author,date,rating,text
Keith Carroll, a day ago, 5,food incredible pork shank risotto
Peter Rabatt, 3 days ago, 5,
Weehawken Seniors, 2 weeks ago, 5,
Bruce Posner, a month ago, 5,great place beer tasty meal
J Han, a month ago, 5,
Christopher Wood, a month ago, 5,
Daniel Howe, 2 months ago, 5,
David Rosensaft, 2 months ago, 5,excellent meal fair price good service portion large enough share take home recommended
Rob LoBue, 2 months ago, 4,great little local place good variety option bar food italian steak seafood excellent outdoor seating area court street hoboken institution
Alejandra Limones, 3 months ago, 5,regular g wing
Luci Swoff, 3 months ago, 4,
Manuel Efrain Farfan Ochoa, 3 months ago, 5,translated google good service friendly cozy quiet recommend original buen servicio muy amables acogedor tranquilo recomiendo
Jade Briggs, 3 months ago, 4,best lamb hoboken wrote great review worst lamb hoboken wrote review coming second best deserves lamb portion twice size others actually know medium rare admit wasn\'t full robust flavor rosemary advertised juicy basic salt pepper meat well cooked properly writing original review place decided order using delivery service asked wanted leave tip driver told would tipping cash driver text said five minute away replied ok apt 1 bell ring twice go door food left door knob entry way door first level building came back managed climb step double check paid picking food
Ann Marie James, 3 months ago, 5,
Katherine Kaplan, 3 months ago, 3,food great deliver outside hoboken otherwise would order week asked say keep one delivery person staff want send outside hoboken
Two Spoons, 3 months ago, 3,overall food good service food ordered entree daily menu appetizer regular menu item fresh good diversity flavor service took time make reservation help arrived wait staff bar staff made eye contact proceeded ignore u finally figured hostess stand waiting get help eventually seated waited waited waited finally bus staff member took initiative take order waitress spent rest time barely checking u taking unnecessarily long time anything bus staff made sure water refilled etc atmosphere sat outside reservation ended section artificial turf canopy bit tricky move chair get situated table overall reasonable covid style setup price food good value service level made thing feel like costly
Dusan Pavlovic, 4 months ago, 5,first time lived neighborhood like 34 year skate made perfection place right
Joe Santiago, 4 months ago, 5,veal great private party buffet lunch traditional restaurant setting
Jeffrey Latko, 4 months ago, 4,
Tiffany K., 4 months ago, 4,partner lamb steak entree amazing cool low key bar stack trivia card table next bar play waiting food staff great nice place date could use classic bar food menu
L T, 4 months ago, 5,delicious egg benedict w smoked salmon
Andy Polack, 4 months ago, 1,food best mediocre worth
Anoosh Zain, 4 months ago, 4,went lobster fest wednesday food good salad soup 1 1 4 pound lobster au gratin potato corn cob beetroot mash 28  lot food lobster really enjoyable definitely would come back food service good though nobody asked u food anything waiter quite cold
Kathleen O'Hara, 4 months ago, 5,classic menu amazing seafood dish awesome daily special
norris warner, 4 months ago, 5,
Andy Napolitano, 4 months ago, 5,absolute best amazing food fantastic bar
Jay Chua, 4 months ago, 2,crowded food mediocre slow arrive arcane reason ask water three time arrive turned evening unpleasant one hour way long wait dinner likely visit
Rachel Verrill, 5 months ago, 5,
Erik Olson, 5 months ago, 5,amazing food amazing service accommodating large party rave review rack lamb pork chop lobster crab ravioli
R G, 5 months ago, 4,nice restaurant look like nice neighborhood establishment decent food menu varied sophisticated expected good thing
Jorge Ojeda, 5 months ago, 5,prime rib top notch highly recommend available monday
Kimberly “ ” Watson, 5 months ago, 5,delicious food wonderful wait staff
Sunil Matta, 5 months ago, 5,
Technog M, 5 months ago, 5,excellent steak side good service
Melissa Lopez, 6 months ago, 5,perfect date night service quick precise able seated two reservation inside cant say enough food delicious return soon
Hugo Long, 7 months ago, 5,spot excellent fair pricing large portion employee always super nice
Geoffrey Gordon, 7 months ago, 5,never bad meal 6 year frequenting establishment olive tapenade outstanding daily salad entree dessert delicious mention monday prime rib night wednesday lobster however night fish porkor chicken special good choice cheesecake awesome
Lucy McGillicuddy, 7 months ago, 2,went boyfriend pay overly expensive mediocre food first last time
C Dub, 7 months ago, 5,food great tasty service unmatched everything amazing 
Matteo De Santis, 7 months ago, 4,
neel thakkar, 7 months ago, 1,food quality horrible bread served cold fry refried 3 time burnt completely almost choked never coming back poor quality food service felt rushed
Karen Wang, 7 months ago, 5,place go want good meal feel relaxed staff always professional friendly always look forward seeing daily menu
Peter Chu, 8 months ago, 4,
Morgan Douglas, 8 months ago, 5,went court street first time last night blown away service efficient server friendly got chorizo mussel appetizer phenomenal entree got halibut risotto lamb shank potato au gratin whipped beet die absolutely going back first time dining inside almost year felt safe entire time staff compliant mask hand sanitizer everywhere table adequately spaced safe dining wait go back
Bhargava V, 8 months ago, 5,food delicious coconut shrimp surf turf entree must try  probably swing get thank
Ivan Trbovic, 8 months ago, 5,
Melissa Roth, 9 months ago, 5,
Buyannemekh Munkhbat, 9 months ago, 5,great atmosphere great people delicious food
Fin Page, 9 months ago, 5,
Crecencio Fuentes, 10 months ago, 5,
Michael thelusma, 10 months ago, 3,food okay noy quite one expecting
Ingrid Olguin, 10 months ago, 1,
Bogdan Morosan, 10 months ago, 5,
Jessica Lorenz, 10 months ago, 5,
walter dirkin, 10 months ago, 5,food still great ca n't wait get back full seating one best restaurant town
Gary Berger, 11 months ago, 4,
Laura Aquino, 11 months ago, 5,first time eating impressed great food service menu nice unique offering went short rib fell right bone highly recommend
Tom Koty, a year ago, 5,incredibly vast menu also incredibly good food service great local place
Marilyn Walton, a year ago, 5,
Robert Schmid, a year ago, 5,court street covid protocol compliant great food wonderfully efficient friendly knowledgeable staff martini perfect steak frites everyone else group equally pleased highly recommended pic steak frites pork chop special
Michael Hofmann, a year ago, 5,
Chris Sheridan, a year ago, 5,
Meital Boyarski Sharon, a year ago, 5,
Linda Ghirardi, a year ago, 5,food excellent wait staff attentive highly recommend eatery
Joelle Eberhart, a year ago, 3,service slow ended two different waitress end night least food good cooked right great taste
John Castellano, a year ago, 5,
Travis W, a year ago, 5,
Joe Castellitto, a year ago, 5,
James Provence, a year ago, 5,
Tod Buchanan, a year ago, 5,think court street one best restaurant hoboken go time pandemic n't gone often would like still order take though monday night prime rib special prime rib large delicious never go away hungry get salad vegetable along bread special spread staff great always accommodating ordered last monday forgotten great enjoy next meal
Tim Preziosi, a year ago, 5,speak comfort food hospitality mind go court street place epitomizes professional level priceless friendliness staff back house culinary expertise amazing highly recommend main stay hoboken hope continue pride take work year come benefit u
Joseph DiMaria, a year ago, 5,time covid refreshing know enjoy wonderful pleasurable dinner food excellent menu cover anything everything could want dinner wait staff pleasant super attentive love place go anytime hoboken ever hoboken definitely need check place
Diego Perez, a year ago, 5,excellent food service
Maureen Ghosh, a year ago, 5,wobderful eat great food service hoboken gem
Rosa Gonzalez, a year ago, 3,
Martina Harris, a year ago, 4,people nice food good nice wine selection
Kevin Burke, a year ago, 5,great food great service go spot
Shoshana Ritter, a year ago, 5,
adam odiorne, a year ago, 5,best food cocktail service hoboken far
Rosemarie cardillo, a year ago, 5,
William Kemp, a year ago, 5,celebrated graduation earlier evening great place well fantastic evening place definitely reason happy event crew cooperated lovely style cuisine great guest overjoyed shall surely return celebration thanks much
Ashley Chillar, a year ago, 5,
Andrew Hymas, a year ago, 5,
Barry Lubin, a year ago, 5,brunch excellent service good
Sadaf Farsinejad, a year ago, 5,good quality food
Kenneth Sauder, a year ago, 5,great squash lamb chop fabulous thanks server thanks free wine ken
Peter Oline, a year ago, 5,
Bianca Sampang, a year ago, 5,
Julian Togelius, a year ago, 5,
Anthony Haddad, a year ago, 5,never review eatery however court street least 20 time last year spot spoil aspect quality service nothing else area really compare  clean  reliable  consistent yet bad experience actually find bringing best friend court street like  sort little secret love hope never change hope forever long live fret special always spot skip desert gold standard classic american restaurant beyond else hoboken
Rich West, a year ago, 5,
Louis Donoso, a year ago, 3,item missing
S Chadwick, a year ago, 5,excellent food service nice wine list great value
Anand Patel, a year ago, 4,
Stephen Cornwell, a year ago, 5,
Ethan Riedel, a year ago, 5,
S Tit, a year ago, 5,
Gregg Saldutti, a year ago, 5,one best hoboken
Dave Curran, a year ago, 5,love place first time went crepe next two time n't turn special occasion dessert new year eve one went dinner made reservation asked dessert goddess could strawberry add dessert posted online followed must go
Kevin Arms, a year ago, 5,great service tasty steak one favorite place visiting hoboken
Gjergj Tr, a year ago, 5,nice quiet catch brunch friend great service
Helen Feinstein, a year ago, 4,nice menu something everyone food well prepared
anthony mauceri, a year ago, 4,
George Lorenz, a year ago, 5,
Evelyn T., a year ago, 5,one favorite restaurant hoboken nice spot w friendly service wine selection dope
Gillibee, a year ago, 5,favorite restaurant hoboken special world affordable great work drink pub grub fancy dinner bunch weekday special including prix fixe menu 22 definitely recommend
Shannen McLoughlin, a year ago, 5,
Jason F, a year ago, 5,great daily special huge variety seafood meat always fresh little pricier side worth
Alison Dembe, a year ago, 5,
Donna Gattuso, a year ago, 5,big portion vegetarian option friendly service
Andrea Leconte, a year ago, 5,
Steve Cotton, a year ago, 5,
Mark Smith, a year ago, 4,
Philo recipe Franzone, a year ago, 5,favorite place
Sam Wasserman, a year ago, 4,
Moran Davison, 2 years ago, 3,nice family homey place food ok nothing exciting great location easy get hoboken
Alex Kushner, 2 years ago, 5,great atmosphere even better chicken parm
Rahim B, 2 years ago, 5,
adam decicco, 2 years ago, 5,coming 20 year never disappointed food always good never salted olive tapenade best anywhere earth offer sale take home ever eat n't take jar home shame
Nikolay Matsenko, 2 years ago, 5,
A Scho, 2 years ago, 3,
Marie Beyer, 2 years ago, 5,unusual fare surprisingly didnt miss meat food excellent service unique cocktail highly recommend
Jiaxian X (Jason), 2 years ago, 5,
David Sevilla, 2 years ago, 5,
Martin Le Voi, 2 years ago, 2,poor food indifferent service
Anton Leskovets, 2 years ago, 5,
Stephen Antisz, 2 years ago, 4,food lacked flavor portion decent try main entree burger steak sandwich location great next time enjoy bar
Zoran Pesic, 2 years ago, 5,
Jack Talbot, 2 years ago, 5,
Patricia M Hugh, 2 years ago, 5,excellent food service wonderful special specialty cocktail
David Jamroz, 2 years ago, 5,
Patrick Nevins, 2 years ago, 5,great service attractive menu reasonably priced well-prepared food
Marsha Guido, 2 years ago, 5,consistently excellent
Eric A, 2 years ago, 1,
Rosemary Foley, 2 years ago, 4,
Paula Salamone, 2 years ago, 5,love place food drink service fantastic
samantha pelc, 2 years ago, 5,awesome food always something new interesting special gf always go monday cocktail prime rib special bartender tom always super attentive great conversationalist
Pam Skalaban, 2 years ago, 5,food amazing always
Mike Mariniello, 2 years ago, 5,awesome food awesome service
Jessie Taylor, 2 years ago, 5,nice spot fancy date night place bring parent friendly service great wine selection
Chuck Corradino, 2 years ago, 5,great staff juan jeff outstanding food exquisite big plus get run cousin bill cathy
Megan Flynn, 2 years ago, 5,
Miriam Cesco, 2 years ago, 5,translated google good dinner nice restaurant center hoboken candlelight dinner varied menu good price nice staff recommended shrimp parmigiana shrimp tomato mozzarella accompanied linguine tomato swordfish sauted vegetable puree original ottima cena ristorante molto carino centro hoboken cena lume di candela men vario prezzi buoni personale gentile consigliati shrimp parmigiana gamberi con pomodoro mozzarella accompagnati da linguine al pomodoro pesce spada saltato con le verdure e il pur
Jo Hayes, 2 years ago, 5,always great food selection everyone
Michael Magalotti, 2 years ago, 5,
Tom Esposito, 2 years ago, 5,
W, 2 years ago, 5,yummy brunch
Tom Hennigan, 2 years ago, 5,
Ashley Fila, 2 years ago, 5,
Dave Schubert, 2 years ago, 5,first class restaurant worthy special occasion celebration
Bobby Richards, 2 years ago, 4,good food great service
Oliver Walsh, 2 years ago, 5,best food hoboken hand go order something special menu let living hoboken 5 year spot ate consistently  let end grow tired old taste also serve hoboken brewing beer bodi blonde ale recommended meal taste good heavy steak light seafood meal
Ant Live06, 2 years ago, 5,awesome food good service
Anthony Foster, 2 years ago, 5,wonderful place great atmosphere better food excellent service
Marlyen HABIB, 2 years ago, 4,
Andrew Price, 2 years ago, 5,
Ray Caron, 2 years ago, 4,
Maria Rivera, 2 years ago, 4,
Matthew Walsh, 2 years ago, 4,party five everyone pleased meal court street menu regular menu well special cover everything pastameats fish three time n't bad meal experience yet
Nick Dougert, 2 years ago, 5,
Aaron Price, 2 years ago, 5,
Erin Hennessy, 2 years ago, 5,
Peter Heidrich, 2 years ago, 5,good mix sport bar nice restaurant atmosphere special great
John Nagle (Blasterman#1362), 2 years ago, 4,good restaurant back
Margarita Alvarado, 2 years ago, 5,
Ryan Lynch, 2 years ago, 4,
Peter Arnone, 2 years ago, 5,
Rucha Bapat, 2 years ago, 4,lovely little place great food nice ambience
Nathan Turoff, 2 years ago, 5,reliable neighborhood place
Lee Quan, 2 years ago, 5,
Scott Lagattuta, 2 years ago, 5,great food great service
Aleksei Smyshliaev, 2 years ago, 5,food amazingly good service nice
Rochelle Flynn, 2 years ago, 5,always great food good service love brunch free fruit soda bread well-priced pitcher mimosa bellini diverse menu option bright sunny room dining
Alexey Lutsenko, 2 years ago, 5,
Jose Prado, 2 years ago, 5,great place great food back part restaurant refine atmosphere elegant quiet
Brian Prins, 2 years ago, 5,good food great price
Gary Engler, 2 years ago, 5,one favorite restaurant hoboken great food friendly service definitely go monday prime rib special
Joe Minuti, 2 years ago, 5,good food good service
Cristian Vasile, 2 years ago, 5,
Scott G, 2 years ago, 5,good food good service go-to place hoboken
jodie ordanza, 2 years ago, 5,
Saeid hosseinipoor, 2 years ago, 5,love beef burgundy
Terron Johnson, 2 years ago, 5,great food atmosphere great variety outing definitely back
Maritza Quinones, 2 years ago, 5,always delicious
Lily G, 2 years ago, 5,food great love place come back often
Mari Rose, 2 years ago, 5,cozy great ambience well-rounded menu highly recommend
Nickitas Georgas, 2 years ago, 5,
Rocco Carlucci, 2 years ago, 5,
Jonathan Agresta, 2 years ago, 5,
Paul Muttillo, 2 years ago, 5,hobokens hidden gem
Sean Glendon, 2 years ago, 5,small little place solid crowd atmosphere food fantastic decent beer choice french onion soup good surf turf great value appears week night special need check
Brian Rathbun, 2 years ago, 5,
Bryan Haas, 2 years ago, 5,always great amazing service point reasonable price hidden gem
Kristine Wolf, 2 years ago, 5,
Robert Lurie, 2 years ago, 5,
T. Pisani, 2 years ago, 5,nice quiet atmosphere front bar area back table area service quick food great menu honestly little big liking though
Adriaan Klaassen, 2 years ago, 5,
Ken Adams, 2 years ago, 5,great food nice cozy environment staff amazing definitely coming back
Theodore Mullally, 2 years ago, 5,always wonderful place ring new year fantastic meal warm friendly atmosphere great service
Jason Stack, 2 years ago, 5,great selection surf turf italian
