author,date,rating,text
Jennifer Spadavecchia, 3 weeks ago, 5,
JoanMarie Scott, 4 weeks ago, 5,bronte never disappoints
Thomas Barker, 2 months ago, 1,woman counter completely dismissive rude update found fly drink
Jason M, 2 months ago, 4,barista seems tired unengaging cappuccino american style cappuccino house coffee actually great cooky like best town
Amanda Shirley, 2 months ago, 1,staff n't friendly
annemariepettinato, 2 months ago, 5,best brioche  nj
Ads H, 3 months ago, 5,never look good
Peter Chu, 3 months ago, 4,
Maria Victoria Ortega Jimenez, 4 months ago, 5,
Mahmoud Darwish, 4 months ago, 5,
Yana S. Moss, 5 months ago, 5,love cute little bakery
Michael M, 5 months ago, 5,translated google thousand grazzi bringing italy home original 
Lavinia Lo, 6 months ago, 5,go want find best authentic italian food hoboken cantucci addictive type focaccia super yummy  best place cappuccino brioche morning quick delicious lunch afternoon staff amazing
Eleonora Magnanelli, 6 months ago, 5, search italy u find prato born raise florence prato go miss home suggestion try potato focaccia rosemary ciccioli  owner sweetest always smile ciao
Aki, 6 months ago, 5,translated google clean friendly friendly staff take raisin bread iced tea delicious 
Aram Dzhamgaryan, 7 months ago, 5,place excellent food great little taste europe
Jonathan Pepe, 7 months ago, 5,n't know tell n't like place maybe sandwich take right back florence n't italian american special like get fiores vito real deal cooky 
Jonathan Petrakakos, 8 months ago, 5,amazing little tuscan bakery friendly service delicious bread sandwich know real deal everyone inside speaking italian
Jahn Andersen, 8 months ago, 5,one favorite place hoboken lunch rustica sandwich really good
Mah Rezaa, 9 months ago, 4,great spot grab tasty coffee sandwich cantucci biscotti sandwich mainly made focaccia taste great many gluten free choice great staff rustic look accessibility plus 
Sophie Weber, 9 months ago, 5,
Constantine Antonakos, 10 months ago, 5,amazing coffee food staff 
Clara Altomare, 11 months ago, 4,
Edward Monero, 11 months ago, 5,
Gynine montalto, a year ago, 5,happy found place stumbled found dream sandwich porchetta excellent
Carlos Vassallo PlanetM NYC, a year ago, 5,great bakery product must visit
Ameet Kamath, a year ago, 5,sabrina make best coffee fast baked good delightful companion
Pete, a year ago, 5,got real italy-italy italian stuff borderline intimidating proud
silvio garola, a year ago, 5,healthy italian food really nice
Justino Santiago, a year ago, 5,
Karen N, a year ago, 5,get belly came clean place ended nutella filled brioche chocolate chip brioche pizza margarita focaccia bread sandwich prosciutto mozzarella great little tuscany bakery
Lantian Zhang, a year ago, 5,great sandwich
Ray Christie, a year ago, 5,food amazing price good woman extremely nice attentive even sweet awesome  much go recommend friend  wait go back thank xoxo
Yiwei Gu, a year ago, 5,
Nico, a year ago, 5,lovely yummy place trying offer variety focaccia kind cantucci biscotti
Dr. Christine Palma, a year ago, 5,excellent authentic food
Ievgenia Zozulynska, a year ago, 5,
Sarah Hong, a year ago, 5,
Elizabeth De Virgilio, a year ago, 5,closest italy get macchiato absolutely perfect every time cantucci phenomenal friendly staff delicious food
Annika Roll, a year ago, 5,
Seraphim, a year ago, 5,best gluten free biscotti
Victor Borba, a year ago, 5,amazing place
Raymond A., a year ago, 5,pork potato homemade focaccia bread enjoy heated unique delicious
Rae Shock, a year ago, 5,great
Jelani Bruce, a year ago, 5,amazing food hot chocolate wow 
Suthida Chuenklin, a year ago, 5,excellent food good price great service never regret randomly walked shop month ago keep coming back little sandwich never bother remember name love ham two cup coffee 
Claudio Javier Cogollo, a year ago, 5,
Orrin Lewis, 2 years ago, 5,great food customer service keep great work always
Mark Smith, 2 years ago, 4,
Allan Lazenby, 2 years ago, 5,walked bakery probably hundred time without stopping finally deeply regretted sooner 
ROBiN UMANA, 2 years ago, 1,
Christian Perez, 2 years ago, 5,
Phil Clarke, 2 years ago, 5,coffee way go spot staff also great
Myles Helfand, 2 years ago, 4,
Adrienne Doyle, 2 years ago, 5,excellent cappuccino wonderful customer service back sure
Roxana Perez Pineiro, 2 years ago, 5,true italian love sandwich 
trisha ghosh, 2 years ago, 5,delightful little place excellent food even better service feeling become regular
Michelle Gesser, 2 years ago, 5,
andrea franco-arvelaez, 2 years ago, 5,best cantucci
Andrew Malaszuk, 2 years ago, 5,
Ashley Bernero, 2 years ago, 5,
Danielle DeZao, 2 years ago, 5,everything simply delicious happy service
Luca Bessi, 2 years ago, 5,
Viñales, 2 years ago, 5,translated google italy hoboken lovely florence waiter great coffee pizza nothing new york seems town full relax quiet people 
John Brosens, 2 years ago, 5,amazing
Nathan Turoff, 2 years ago, 5,best
Jared Johnson (Jared), 2 years ago, 5,service food 
Erica Lee Mitti, 2 years ago, 5,siena sandwich must try
Henry Lo, 2 years ago, 5,
Kalyani Jagannathan, 2 years ago, 5,fabulous sandwich n't miss trying cantucci
Melanie Tam, 2 years ago, 3,torn three four star one hand feel like totally jipped u pizza margherita foccacia hand plain foccacia totally worth really good pizza margherita caught 
Gabriela Biscardi, 2 years ago, 5,great food great customer sevice thank much
Peter Praum, 2 years ago, 5,real coffee excellent bakery snack check excellent coffee espresso food love feel like back home 
Kevin Kansagra, 2 years ago, 5, beat italian espresso favs food siena sandwich pizza slice cantucci place great
Alex Kracht, 2 years ago, 5,great spot sandwich baked good
francesco39, 2 years ago, 5,translated google crush delicious quality product original 
Caroline Schmidt, 2 years ago, 5,
Joey F, 2 years ago, 5,people go place amazing  picky af bakery
Michael Alessandro Contarini Procino, 2 years ago, 5,authentic get without flying firenze amazing sandwich perfectly baked focaccia cantucci leave family fighting crumb delicious porchetta
Frank Barres, 3 years ago, 5,nice
Lee McGrath, 3 years ago, 5,best focaccia since ino nyc closed
Isaias israel Alvarado, 3 years ago, 5,best hoboken
Carla Guastella, 3 years ago, 5,delicious fresh authenic
