author,date,rating,text
Joseph Aubourg, 5 hours ago, 5,great pizza
Chanel “シャネル” Right, 2 weeks ago, 5,good went  brick   penne vodka  delicious brick nice spice penne flavorful enjoyed evening
Mark Hoffarth, 2 weeks ago, 4,
Ultrasound Techniques, 3 weeks ago, 5, ordered blackened salmon wrap time always point tonight 11pm happy know still open needed good meal aside fast food ordered  fire salmon  instead came cauliflower carrot asparagus mashed potato amazing better fine dining place   expect perfect meal time night compliment chef meal well thought salmon cooked perfectly sauce cooked veggie super flavorful delicious veggie still crispy texture would give star would
Nishanth Mudkey, 3 weeks ago, 5,
Stephanie Jones, 3 weeks ago, 5,looking good vegan italian food place ton gluten free option
Brittany A, 3 weeks ago, 5,good pizza great service chicago def better ha
brittany bettiegrue, 3 weeks ago, 5,great pizza great service great price
Morgan Powell, a month ago, 3,best dairy free cheese always get one part order wrong phone call little painful best vegan cheese  ever  stuck
Wilson Veras, a month ago, 5,excellent spaghetti meat ball
Karen Montoya, a month ago, 5,mint lemonade alone sooo bomb rest food
Mihir Joshi, a month ago, 5,
AJ G, a month ago, 5,eaten 3 day row vegan buffalo pizza buffalo cauliflower asparagus fry favorite far great customer service lovely atmosphere 
Darryl Montoute, a month ago, 5,excellent spaghetti meatball good
Edinson Pérez Blanco, a month ago, 5,
JdGreat, a month ago, 4,
Parichit choksi, 2 months ago, 4,good atmosphere live band young energetic atmosphere
robert Van Ryzin, 2 months ago, 1,worst pizza hoboken far
Steven Deollas, 2 months ago, 4,ordered vegan menu good personal vegan pizza make large must request gf wise crust gluten good mozzarella stick non diary gf impressive lot vegan option  enjoy
Uma Moiseenko, 3 months ago, 5, know found magician work chef tried vodka parm sandwich margarita pie absolutely delicious definitely come back
Tim Mazyrko, 3 months ago, 5,one favorite spot pizza absolutely delicious great service boot
Darkest Knight, 3 months ago, 4,family great meal would personally recommend everything bagel pizza comfy environment dog friendly everything order great
Brandon, 3 months ago, 4,food good price recommend place  looking italian quick eats
Justine E, 3 months ago, 4,pleasantly surprised visit restaurant love visiting new vegan spot definitely worth vegan mozzarella stick huge worth garlic knot delicious tomato sauce great flavor vegan greek salad refreshing delicious dressing  wait try salad ended ordering large half vegan buffalo chicken half  believe  vegan pizza honest apps excitement pizza crust flavor could little balanced apps make entire vegan menu ca n't wait come back try entree restaurant located beautiful street great date night free parking sunday variety gluten free option well oh best part dog friendly patio front
Nicole Wenger, 3 months ago, 4,great gluten free pizza option
Marcos de brito, 3 months ago, 5,came back great choice non vegan vegan food open 4 believe friday saturday please call confirm
JORGE MONTERO, 4 months ago, 5,
Dan Hayes-Patterson, 4 months ago, 5,
Danni Dee, 4 months ago, 4,
Dady Yagoubi, 4 months ago, 5,
Thomas Hayes, 5 months ago, 4,large menu dedicated vegan menu lot variety got one vegan burger choice think called brick something burger tasty got salty near last bite girlfriend got chicken wrap noted salty drank plenty water meal
Renee Kornbluth, 5 months ago, 4,food delicious waitress could n't nicer accommodating addition regular menu omnivore full vegan menu enjoyed sausage pepper sandwich something n't eaten 10 year vegan
Tanvi Domadia, 5 months ago, 4,really cute place ordered vegan fry pizza salad great time
Al G, 5 months ago, 5,great fried ravioli pizza sister vegan often find vegan food like place case plenty vegan option liked yet try great atmosphere day
Nick Felker, 5 months ago, 4,
Juan Medina, 5 months ago, 5,terrific food first choice hoboken great deal always happy staff
Dev, 5 months ago, 5,good place visit enjoyed service good dine open 06 02 2021
Veronica Uhlig, 5 months ago, 5,fantastic vegan option vegan stuffed mushroom garlic knot buffalo flower pizza vegan delicious
Sarah D'Annibale, 5 months ago, 5,oh god vegan hard find great option going omnis brick food incredible huge delicious pizza great atmosphere entire vegan menu gf option huge omni menu well new favourite place please support business great many option p whether vegan try garlic knot change life 
Neal “Alexander” Williams, 6 months ago, 5,
Parvathy Ajit, 6 months ago, 4,oven baked margarita 
Eligio A. Rosa Sr., 6 months ago, 3,
David H Bebawy, 6 months ago, 5,excellent food service full vegan non-vegan menu
Rebekah Gray, 7 months ago, 5,
YASMINE HANNA, 7 months ago, 5,awesome food service
Mena Paul, 7 months ago, 5,amazing try chicken parmesan good also took chicken taco classic burger perfect good selection food great service great price good vibe could ask return sure
Mike Maloney, 7 months ago, 5,
Corrine Rybarski, 8 months ago, 5,huge vegan menu delicious food good service
Jinay Shah, 8 months ago, 5,really good vegan food helpful owner staff
Andrea Ravikumar, 8 months ago, 4,lactose intolerant vegan pizza rarity right alley super excited try   vegan  pizza yummy non-vegetarian beyond meat  sausage  flavorful satisfying partner got sweet mango pizza loved ate one sitting unfortunately crust basically pita bread experience  5 star  say pizza 3 star garlic knot 50 star  absolutely amazing get garlic knot
N Shah, 8 months ago, 4,definitely must try especially vegan vegetarian reducing star ambience dine-in capacity
Nancy Guzman, 9 months ago, 4,
Maggie Holsten, 9 months ago, 5,never disappoints go-to option pizza hoboken margarita pizza great pancetta sprout insane ton pasta vegan option
Anielka Ptasinski, 9 months ago, 5,
Hakim Burton, 9 months ago, 5,great late night best thing open late night
Javier Castillo, 9 months ago, 5,best pizza
Veronica B, 9 months ago, 5,brick never disappoints many vegan food option absolutely love ordered 3 x grubhub never disappointed food always hot fresh mention vegan menu
Juan Sanchez, 10 months ago, 1,first time order place pizza thin cooked flavor mozzarella stick well dry taste like take freezer total 50 tasteless burnt poor quality food
Darnell Tucker, 10 months ago, 5,really good pizza hidden gem yummy
Michael Casey, 10 months ago, 5,
Marissa Felicetti, 11 months ago, 5,pizza delicious cheesy definitely hidden gem hoboken little bit everything even full vegan menu great various option
Kristen C, 11 months ago, 5,went vegan menu n't disappointed could n't believe option upon ordering number plus pizza dessert go impressed loved everything plan return told u new creation well n't even listed menu yet gem find everyone worked wonderful super friendly
Diana “Dee” Falvo, a year ago, 5,great gluten free pizza crust right combination crispy doughy tasty
Philip Mierswa, a year ago, 5,
danielle fishman, a year ago, 5,
Jonathan Bolden, a year ago, 5,food delicious staff friendly could definitely see repeated customer
Luis Munguia, a year ago, 5,pizza divine
Syna Kenna, a year ago, 1,put star would never come food cooked unseasoned missing main ingredient told waitress manager took 10 bill dish eat tasted like bowl sugar cost 17 second try establishment last
Graham, a year ago, 1,ordered chicken parm hero w vodka sauce received hero cold grilled chicken kind lemon marinade sauce taste like vodka sauce least lemon flavor chicken overpowered sauce disappointing waste 16
Tracie Gonzalez, a year ago, 5,vegan pizza good
Kaitlynn Rose, a year ago, 2,would loved try food menu guy great review vegan option however customer service skill need work spoke two people seemed nice obvious language barrier issue also fine resolvable telling first person name three time finally spelled giving address asked hold point little skeptical nervous thinking call another pizzeria completely different person came line unable enter visa expiration date correctly word mine normally would think would common sense get third person phone assist card processing also help customer looking order provide business kindly gave said  never mind  order somewhere else   said  ok  trying assist get help another person disappointing support local business poor customer service review simply constructive criticism hope future help better business
Amina Malik, a year ago, 5,
Tina Rodriguez, a year ago, 5,
Paola lucia, a year ago, 5,loving placeamazing food staff
Terence Raines, a year ago, 5,stumbled upon little gem en route another spot glad popped service excellent food even better around hany made feel right home
Yesenia P, a year ago, 5,enjoyed delicious family two special pizza everything absolutely fabulous service ama3 pizza delicious also byob must
Fady Mina, a year ago, 5,
Tony Enrico, a year ago, 5,great price great food
Tiffany Pineda, a year ago, 5,vegan food amazing especially vegan nacho
Animesh, a year ago, 2,horribly burnt chicken wing mediocre pizza ordering
Maria Boca, a year ago, 5,best margarita pizza hoboken great quality nice staff
Erica Barreto, a year ago, 5,bummed  know guy three year lived hoboken amazing vegan gluten free menu best hobo
Pratik Desai, a year ago, 1,worst delivery experience ever got food 2 5 hour late called multiple time told u backed food got u completely cold apparent food made ago sitting around forgotten since got reply figured update waited month post made sure n't angry delivery day sunny storm flooding happened storm day posted 2 n't related
Amanda Mayer, a year ago, 5,food good many menu option meat eater vegan gf restriction also server tabitha attentive kind
JIGAR TALATI, a year ago, 5,
Yaima Sinay, a year ago, 5,food delicious especially pizza selection tom kind definitely go spot
Effieh Denson, a year ago, 5,great place eat great spot  vegan excellent service polite along beautiful view eating outside
Lakshmi Silva, a year ago, 5,love service ambience excellent pizza plethora vegan option
Rodolfo Genao, a year ago, 5,great service cheap price excellent oven pizza
Chris Berkheimer, a year ago, 1,avoid cost sicilian pizza burnt loaf bread cheese sad topping cost significantly extra even basil cost extra none pizza look like advertised photo would wager mcdonalds  picture look closer real thing place  pizza white pizza substance taste like grease pizza  order last thing planet spend money elsewhere literally anywhere else
Dan D, a year ago, 2,vegan nonsense used love place ordered almost every night week make pizza without cheese like nothing animal  know thinking nothing taste got infected vegan virus  go anymore
RK Yoo, a year ago, 5,ordered delivery everything delicious fresh pizza delicious definitely abundant amount fresh mozzarella great sauce sandwich burger ordered big hearty burger plenty sauteed onion vodka sauce grilled chicken extra garlic bread yum would definitely order
Maureen Saleeb, a year ago, 5,amazing food service go pizzaria restaurant hoboken keto friendly
Tomofthespirits, a year ago, 5,hi tom drive bayonne hoboken 25 minute drive get food brick 100 worth vegan gluten allergy brick offer many option full vegan menu includes salad pizza sandwich dinner apps many gluten free option including pizza owner mike make vegan cheese found unique enticing summer took buddy brick time loved meat eater haha buddy loved chicken bacon ranch pizza atmosphere staff welcoming friend always great time
David Rosensaft, a year ago, 5,great vegan anf gluten free option food fresh delicious
smishra7, a year ago, 5,originally order 1 hour late delivery person mix left downstairs appears someone else took food fortunately manager made right personally called delivered order hearing incident excellent customer service thank mike
Sterling Espaillat, a year ago, 1,excited try pizza joint looked looked could n't find vegan pizza anywhere life saw heaven send location said sad ending never soo disapponited life start pizza cold sandwich spicy shared pie three people vegan reaction 22 dollar one tasteless piece thin bread history thin pizza let talk sandwich chef told stuff added honestly little scared spicy going put finger mouth thats spicy also beyond greasy pepper burn n't taste like anything grease sorry say thought decent pizza please close place something worse 40 dollar ever spent
Eder Alvarado, a year ago, 1,20 tip delivery multiple discrepancy misleading information service rendered
Rafaela Borges, a year ago, 5,great place one place whole vegan menu pizza excellent everything look taste amazing  definitely come back thousand time
Osanna Cortes, a year ago, 5,far best vegan pizza  tasted far separate plant based menu many option
AKS World Motivation, a year ago, 5,alex mainevent first time eating herei didnt know expect helped order wanted sceptical dont eat anywhere gave chance surprise food great serving good portion food excellent would come eat reccomend looking great pasta also good customer service
Aggie Personal Trainer & Health Coach, a year ago, 5,thought  stop randomly chicken salad turn place make outstanding salad food highly recommend establishment staff kind attentive
Bishoy Elias, a year ago, 1,
Rachel Cipkins, a year ago, 3,
Show Box, a year ago, 4,nice spot food great server great messed order wait long apology time still enjoyed
Guneeta Singh Bhalla, a year ago, 5,delicious creative vegan menu heart
Randolph Hoppe, a year ago, 5,nice vegan pizzeria meal cauliflower buffalo wing caesar salad margherita pizza specialty pie delicious around nice service
John Spicer, a year ago, 4,
Darren Dean, a year ago, 5,michael shown care customer vegan menu undoubtedly favorite hoboken 6-stars add vegan dessert  sure  amazing thanks guy
Lori Golka, a year ago, 5,amazing vegan pizza caesar salad 
Marina, a year ago, 5,really appreciate large selection clearly labeled vegan gluten free option loved buffalo flower fried cauliflower vegan philly cheesesteak
Joshua T Howard, a year ago, 5,best pizza hoboken hand girlfriend come time wide ranging vegan menu ever seen pizza place ordered vegan philly cheese steak pizza world good even vegan gladly eat vegan pizza brick day week stress good service well mike owner believe always kind courteous ensures everything perfect uptown hoboken really pizza spot wan na go also byob nice well
Michael Vega, a year ago, 5,
Patricia M Hugh, 2 years ago, 5,food service top notch
Sam Mag, 2 years ago, 5,staff friendly large selection vegan vegetarian food busy place
alFredo Romero, 2 years ago, 4,
Michael Gioia, 2 years ago, 4,underrated pizza spot town many option great slice spot open 4am weekend stumble get chicken bacon ranch
Miguel Morales, 2 years ago, 5,vegan menu great
Art Thomas, 2 years ago, 1,pizza pretty bad compared place town gouged people sandy n't set foot 2013 never
Chris Skarantonakis, 2 years ago, 1,deliver pizza someone one block away  hot chewy well
virginia gadala, 2 years ago, 5,wish give place 5 star ingredient amazing make pizza perfect philly steak pizza last night  normally one eat crust dough good ate last piece staff also amazing fast food delivered hot timely manner definitely place go time
Gene Rabinovich, 2 years ago, 5,nice place flat bread pizza especially delicious
Kamel Hanna, 2 years ago, 5,great pizza place hoboken original authentic brick-oven pizza opened till 4 saturday sunday
Brendan Egan, 2 years ago, 5,
Cristina Louise, 2 years ago, 4,
Kira Wildes, 2 years ago, 2,husband waited hour pizza delivery despite many reassurance restaurant  two minute away  avid supporter brick hoboken pizza restaurant past ordering future
Renaud Martini, 2 years ago, 1,awful
johanna wagner, 2 years ago, 1,disgusting worst pizza ever
Michael Abbatiello, 2 years ago, 4,great small pizza place go town consistent reasonably priced pizza great set back selection expected small pizza spot 4 strong star
Parth Malhotra, 2 years ago, 5,ordered brick pasta sicilian pizza siracaha chicken flatbread burrata flatbread everything fantastic tasty presented well
Jemolt Morgan, 2 years ago, 4,
Louis Osorio, 2 years ago, 5,
John Kuczarski, 2 years ago, 1,
Naveed Sarwar, 2 years ago, 5,owner amazing food fantastic
Tanya Johnson, 2 years ago, 5,good
Meet Sheth, 2 years ago, 5,really good food
Nada Abdelmalaak, 2 years ago, 5,shrimp fa diavolo pasta taste delicious food served fast clean restaurant great hangout
kathy oregan, 2 years ago, 3,lovely staff pizza yhe best 2nd time comming dont think ill bsvk worst ive better
Kirilos Abdelmalaak, 2 years ago, 5,
Vatsal Parekh, 2 years ago, 4,
Anthony Rodano, 2 years ago, 5,
Jerry DiMaso, 2 years ago, 4,
Matthew Jansen, 2 years ago, 5,brought friend texas pizzeria first slice jersey pizza loved recommend everyone check place hoboken area
Peter Rabatt, 2 years ago, 5,great food great selection friendly staff fairly priced mike make entree pizza topping want always come perfection best part open till 5am weekend wont charge 4 plain slice
Hana Gerges, 3 years ago, 5,word explain good pizza
QIULONG JIANG, 3 years ago, 5,translated google delicious n't believe original 
Mina Sadek, 3 years ago, 5,
Anthony Rodano, 3 years ago, 5,
Jean-Baptiste Lefevre, 3 years ago, 3,good pizza
Ireland Tawney, 3 years ago, 5,
Chris Henderson, 3 years ago, 4,
F C, 3 years ago, 5,amazing food super fresh even though disappointed switched menu advertised online custimer service great food even better highly recommend margherita pizza brick pasta love
Michael Moussad, 3 years ago, 5,french breast
Gilberto Marrero, 3 years ago, 5,great expirience great service gabriela food great defiantly come
Morris Goldberg, 3 years ago, 5,food amazing service fanatic cannoli shooter summer ypur mouth orgasmic love place
Christian Rivera, 3 years ago, 5,honestly loved experience overall  get started bbq chicken panini come salad straight heaven excited server gabi told new menu coming  wait go back recommend pizza lover top napoli  benny  even basil
Gabi Cerulo, 3 years ago, 5,
Andrew Thompson, 3 years ago, 1,whoever take order phone absolutely terrible rude zero customer appreciation put hold hang charge deliver one street past 14th weehawken hoboken restaurant pizza wood burning oven flavor ever done place
Bryanna Morris, 3 years ago, 5,never physically place always order grub hub uber eats review strictly food place yet fail everything gotten delicious especially fond brick bruschetta truffle fry heartland salad also delicious get little pricey delivery always worth
Myles Helfand, 3 years ago, 2,average pasta dish enhanced stunningly slow service small place
Benjamin Williams, 3 years ago, 4,good
Nate Stumpf, 3 years ago, 4,good standard pie friendly staff
Juniper Sweeney, 3 years ago, 4,
Milad M, 3 years ago, 5,best pizza hoboken friendly people
chandu k, 3 years ago, 4,
Megalla Megalla, 3 years ago, 5,
shawn holmes, 4 years ago, 1,40 10in cold disgusting pizza soggy fry read review  bother going negative review  surprised still business food absolutely disgusting
Darren Dalton, 4 years ago, 1,
rohit kapa, 4 years ago, 3,
Zin Mot, 4 years ago, 5,first time price good min using credit card 10 think reduced price two slice would around 6 50 pizza really tasty well balanced good quality overall would give 4 5 could
Adam Sabree, 4 years ago, 5,
Yalisbel Simeoli, 4 years ago, 1,horrible pizza service waitress attitude definitely recommend
Sonia Deanta, 4 years ago, 5,meet fresh ingredient
Bashir Ahmed, 4 years ago, 5,
mina helmy, 4 years ago, 5,
Dina Umantseva, 4 years ago, 1,food taste good automatic gratuity added every order big small even take make sense put menu
James Sweeney, 4 years ago, 5,
mina abdelmelek, 4 years ago, 5,best puzza ever love place
Gabriella Romano, 4 years ago, 5,totally rated good pizza quick service good group byob go pizza place hoboken
Bichoi Rizk, 4 years ago, 5,
Nishant Shah, 4 years ago, 5,great really great vegetarian pizza option like 5 time love
Guy Tal, 4 years ago, 5,pizza taste service great
Christina Gaied, 5 years ago, 5,
Ruze Richards, 5 years ago, 1,n't good experience staff waiter refused take groupon saying 4 people 3 u could n't eat never happened restaurant go another restaurant refuse ever go least groupon gave money back let everybody know ever meet eat
A G, 5 years ago, 5,great food affordable price amazing chef service well
Panos Nikolarakos, 5 years ago, 3,
Carine Costa, 5 years ago, 1,n't go n't let use coupon properly disrespectful staff
Brian Coleman, 5 years ago, 5,
Aubrey Myers, 5 years ago, 4,good gluten free pizza come 10 inch people sometimes grab wrong pizza try convince larger one made special nope done delivery ca n't speak restaurant clear needing gluten free
Joseph Annoreno, 5 years ago, 5,staff extremely nice great food awesome late night place
Mimi Marcus, 5 years ago, 3,
Belinda N, 5 years ago, 2,took hour deliver literally around corner disappointed made miss entire lunch break
Jose Tavarez, 5 years ago, 5,pizza amazing never bad day everything bought always
Corey Hoey, 5 years ago, 1,price gouging business originally named molfetta hurt community hurricane sandy changed name hope would n't notice people
andy Rodriguez, 6 years ago, 5,love brick oven pizza great service great food recommend check plaze coming back
rushabh doshi, 6 years ago, 4,great pizza seemed understaffed
David Torres, 7 years ago, 5,good pizza tried brick pizza loved combination gorgonzola cheese pear
