author,date,rating,text
Tony Chapman, 21 hours ago, 4,bang bang shrimp appetizer killer absolutely d-lish highy recommend
Ralph Compton, 2 days ago, 3,
Allie Koch, 4 days ago, 4,
Novia Barton, a week ago, 5,
Just Your Average Joe, a week ago, 2,first photo menu brunch old current one reason even went said biscuit gravy got 11:30am sun reservation opted sit inside took 20 min anyone even take drink food order u n't busy overwhelmed finally got server come acknowledge u take order nice date ordered creme brle french toast offput drowned whatever sauce use consistency bread pudding crab cake benedict pretty good cocktail pretty good overall gave place 2 star based lack service start virtually excuse virtually empty sat check took awhile come back table paid end busier washington street alone many option dining brunch dont see u going back especially lackluster service start
Kristen Corbisiero, a week ago, 2,went brunch cocktail menu great brunch option limited overpriced day went took 20 minute drink arrive wait staff  attentive portion skimpy much better brunch option hoboken
Karyn DiSalvo, a week ago, 5,nice lunch today work colleague everyone enjoyed meal particularly great review burger porchetta sandwich truffle fry want return try french onion soup dumpling next time
Ali Ozler, 2 weeks ago, 5,
Steve Capo, 3 weeks ago, 3,ok burger n't get meatball music way way loud
Rudy SIReast, 4 weeks ago, 4,
Julia Morales, 4 weeks ago, 5,
Kevin Stapleton, a month ago, 5,brunch excellent service even better
J. D. Baldwin, a month ago, 2,gave place second chance 2-years-ago disappointing experience thing improved generally slow terrible service asked whether steak bone-in matter doneness request informed ordered medium rare arrived boneless medium best accompanying potato cold creamed spinach heavy cream light spinach actually little bit gross red wine served room temperature 5 deg instead properly slight cellar temperature chill cocktail old fashioned pretty good price thing mid-range manhattan level pretty high standard neighborhood whole wasn\'t awful many great dining experience hoboken really isn\'t much reason go madison within one minute place apulia bin 14 lola far superior overall quality value madison two star feeling bit generous
Eddie Carrasco, a month ago, 5,great experience
Javier Arias, a month ago, 3,
Mary Perryman, a month ago, 5,
Brandie Gutowski, a month ago, 5,
Licia McClary, a month ago, 5,go place late sunday afternoon love hang bar order app short rib pizza usuals lobster cocktail shrimp tuna tar tar short rib pizza delicious also come brunch year well done coming 25 year would say enjoy lot love staff truly main reason coming back attentive friendly knowledgeable menu offering suggestion people adore matt warm welcoming smile equally polite personality literally put smile face walk see working also like mention karem bartender training really busting move back last night polishing glass spot filling ice friendly smiling whole time bottom line great staff nice selection app nice patron round sunday afternoon stop u update october 2021 starting go indoor place feel comfortable bar wonderful spot table top bar feel comfortable service bartender fabulous shout kenny pours great cocktail gave suggestion food option tried sesame chicken salad first time wished tried long ago crowd control indoors bar welcome site try return indoor setting still welcoming warm place enjoyed lot look forward coming back
Humphrey Gardner, a month ago, 5,cosy yet elegant bar great decor friendly service great truffle fry
Dee Uki, a month ago, 3,change hostess girl super unprofessional really inattentive point even saying hi customer put smile welcoming emotion wanted sit outside around 4pm tuesday outside area completely empty except one leaving table ended sitting u dirty table whole restaurant
Michelle Christensen, a month ago, 1,
M Kim, a month ago, 4,
Manuel Solorzano, 2 months ago, 1,translated google type comment say happen others bad attention waited 2 hour table food never arrived appalling original soy de este tipo de comentarios pero tengo que decirlo para que le pase otros muy mala atencin esperamos 2 horas en la mesa la comida nunca llego psimo
Jacklyn Kennedy, 2 months ago, 5,great meal friend town brought nc female server rude however able receive good service server joe loved manager randy nice apologetic rude server food amazing
Justin, 2 months ago, 3,
Josh Dorrance, 2 months ago, 5,
Randy Suarez, 2 months ago, 5,4 frozen non garnished drink 58 thanks going back someone let bartender know one frozen strawberry drink actually sangria mistaken
Samia Shahnawaz, 2 months ago, 3,firstly long wait water service ask someone serve u 20 min got buffalo pizza sriracha mac cheese ball spinach artichoke dip siracha mac cheese ball cold inside tasted like leftover mac cheese fridge buffalo pizza little burnt barely buffalo taste crust seemed undercooked artichoke dip ok could way flavor overall price  worth pretty disappointed paid 100 sort like food
Carla Acosta, 2 months ago, 5,
Jorge Paravisini, 2 months ago, 5,
Christian Sanchez, 2 months ago, 1, much review person one well deserved would recommend place worse enemy went 8 28 celebrate friend treated like garbage ordered 10 shot 2 drink asked tray location friend 20 foot away bar minded done earlier night bar told asked help bring drink ignored asked bartender attitude rude told kind service providing immediately called bouncer grabbed aggressive manor taken outside without proof transaction canceled told  canceled  would provide proof asked cash tip gave bartender ignored manager said  problemlike manager went inside asked bouncer name said  giving you ridiculous treated could give negative start would unprofessional disgusting bar  ever seriously place joke 5 star book
PH ST, 2 months ago, 4,great food atmosphere buy sometimes food slow
Frank Zion, 2 months ago, 5,food amazing  great job chef
Shivam Garg, 2 months ago, 4,
Norberto Melendez, 2 months ago, 5,
David Carney, 2 months ago, 5,owner love place 
Mr. Amazing (Mike), 2 months ago, 2,bartender nice food way overpriced 18 00 burger come yeunngling tasted skunked
Debra Benitez, 2 months ago, 1,best experience went hoboken enjoy cocktail bar bartender inviting never
Sarah Kherief, 3 months ago, 5,love place spacious indoor outdoor dining good drink list nice menu apps entree
Julio Ventura, 3 months ago, 5,great place go food great
S H, 3 months ago, 1,reservation arrived told u  men  need 25  woman  23 10 pm wanted food 23 22 year old asked bouncer said   time older people  stupidest thing ever lol
Steven A., 3 months ago, 4,
dean eggert, 3 months ago, 5,exceptional food rather affordably priced staff friendly enjoyed tavern style vibe definitely stop would recommend checking
David Legendre, 3 months ago, 1,slow server n't pay attention order ask refill food sub par price almost 3 full hour dinner
Jake Callahan, 3 months ago, 3,
William Manzanarez, 3 months ago, 5,
Eric Huot, 3 months ago, 5,fast service great drink chill atmosphere 100 recommend
Kristen Pena, 3 months ago, 1,worst experience waited server come finally got food chicken panini inedible tasted like bread bacon stale server nice took bill  think manager would come apologize nothing many place city save trouble go somewhere else
Sergio Raddavero, 3 months ago, 4,translated google good place good food closing rat terrace caught attention one place surprised give impression rat common original buen lugar buena comida pero al cierre hay ratas en la terraza lo que llamo la atencin e que ninguna persona del local se sorprendi por ello e decir da la impresin que la ratas son habituales
Erica Lee Mitti, 3 months ago, 5,first time nice young man waited u awesome keep good work back
Caprice Clark, 3 months ago, 5,wonderful night dancing music great
Ashley Wohlrab, 3 months ago, 5,good food excellent service
Adam Zak, 4 months ago, 5,randy top notch bartender taking care drink food guest attentive made great suggestion food ipas
Peter Chu, 4 months ago, 4,
Joe, 4 months ago, 1,came gym saturday morning walked hostess taking order worker 4 people standing around took minute acknowledge presence asked see menu scanned sat sat 7 minute 2 server passed tending table behind one greeted offered least water 4 people still standing around left going back unacceptable n't even busy better
Jorge Ojeda, 4 months ago, 3,
Richard Dillon, 4 months ago, 2,
Rubi, 4 months ago, 5,
Mark Heinze, 4 months ago, 4,creative dish cold beer
Beth List, 4 months ago, 4,
Susan Androsky, 4 months ago, 5,nice atmosphere good food got bang bang shrimp without sweet potato fry best sweet potato fry  ever eaten
Demi Davey, 4 months ago, 4,fun friendly staff great drink food awesome service great
Donna Matarese, 4 months ago, 3,
Marco Antonio Avila, 4 months ago, 2,expensive food
Nadiyah Dabney, 4 months ago, 4,
Charles Gover, 4 months ago, 5,
Nisa Cooper (NBC), 4 months ago, 5,waiter santiago amazing thank much appreciate
Ralf274, 4 months ago, 5,love place try eat every chance get try different thing menu outdoor seating perfect good weather
Kovy Kent, 4 months ago, 3,service n't bad food pretty tasteless seasoning anything n't think going back crab cake slider kind dry
Bello Susio, 5 months ago, 5,grate vibe verry chill
Diana Tuaeva, 5 months ago, 5,
Dreams of Audio, 5 months ago, 5,great old fashioned style bar service good vibe great definitely worth stopping area
Ava Newman Sterling, 5 months ago, 3,
Rich Slaby, 5 months ago, 5,
Lindsey Johnson-Daniel, 5 months ago, 1,gabby terrible hostess came twice clearly issue serving time waited manager ethan never came table rectify issue terrible service contacting owner
Jose Ampudia, 5 months ago, 5,translated google food exquisite original la comida estaba exquisita
Taylor Osborne Wolbert, 5 months ago, 2,staff location beer great food low quality taste sadly wish gone somewhere else
Paola Segura, 5 months ago, 5,translated google love original encanta
ulises Lopez, 6 months ago, 5,excellent
Steven Van Blarcom, 6 months ago, 4,
Kruse Ludington, 6 months ago, 4,great food reasonable price
Marcus Conde, 6 months ago, 1,
Maya Padro, 6 months ago, 4,
Nelson Mota (#MrSellyourhouse), 6 months ago, 5,
Piush K, 7 months ago, 5,
Tejaswi N Rao, 7 months ago, 5,
Ellie DeCandia, 7 months ago, 5,
Heléna P., 7 months ago, 5,great service great drink
Carmen E Manzueta, 7 months ago, 1,service bad 20 min waiting drink place  even busy
Yaris T, 7 months ago, 2,impressed food try brunch since area poached egg hard crab cake  flavor slow service
Kyle Englishman, 7 months ago, 4,went brunch saturday sat u quickly service friendly drink well made egg perfectly poached would definitely recommend
pratik kachalia, 7 months ago, 5,
Rodrigo Duarte, 7 months ago, 3,great environment staff food pretty terrible burger fry fried chicken pretty soggy flavourless afraid
Matt Krekel, 7 months ago, 3,came drink small snack sunday afternoon back house rocked food amazing cocktail super tasty rub eat food patron need silverware ask different server utensil napkin unfortunately n't see needed spoon soup meal server finally stopped asked spoon another gentleman delivered them-but clean unable eat soup address server take meal ticket would rather paid gotten eat soup food really good
Xan T, 8 months ago, 4,fun outdoor dining summer good food
Victor Hugo Vargas, 8 months ago, 5,translated google excellent like original excelent place
Gina Rivera, 8 months ago, 5,
TRIOshefboy “Nation” damby, 8 months ago, 3,nice expensive two appetizer 3 drink 75
John Jackson, 8 months ago, 4,didnt like bartender haircut
Betsy Stroup, 8 months ago, 5,
Jermaine Elliott, 8 months ago, 5,beautiful sport friendly atmosphere drink great food indoor outdoor eatery nice area
Allie G, 9 months ago, 5,good bar food drink nice heated patio covid time
carlos Zaldivar, 9 months ago, 5,
Tyler Diminick, 9 months ago, 5,
Jason Aschenbrand, 9 months ago, 5,
shivam modi, 9 months ago, 5,insane sweet onion soup
Thomas Hallén, 9 months ago, 1,allows 1 1 2 hour seating
Bill Polera, 9 months ago, 5,simply put excellent
Danielle Cosentino, 10 months ago, 4,
Cristian Perez, 10 months ago, 4,
Caroline Culp, 10 months ago, 5,
Juan Medina, 10 months ago, 5,terrific food excellent service
Hedley Lagrand, 10 months ago, 4,
William L, 11 months ago, 5,
Jack Zakka, 11 months ago, 5,
Eugene L, 11 months ago, 1,sour beer shrimp old burger awful waiter never around bill ask hostess check u bill ridiculous never
David “deeNice” Vidal, 11 months ago, 4,like
Rick Boss, a year ago, 5,establishment honest people got 160 dollar atm atm 120 next day owner spoke owner atm checked atm 40 buck got stuck owner said never happen 10 year long story short next day went bar owner bar gave 40 buck told happened wing good drink great hang spot
Lisa Dee, a year ago, 5,
nick taylor, a year ago, 1,
Laura Ortiz, a year ago, 1,came place misleading advertising website offer happy hour true friend ordered sangria margarita supposed half-price thursday got check charged u full priced gave u pricier tequila  included  asked waiter immediately called manager aggressive rude explained u website updated  deal recommend asking offer ordering worst experience ever definitely  come
Cristina Bertucci, a year ago, 1,bad experience went thursday friend website advertised half margarita sangria got check realized charged u full price gave u pricier tequila  included  deal asked waiter manager came talk u rudely aggressively explained website updated deal even though clearly update website list new outdoor dining option  shamed  u saying support waiter bartender  think  ever experienced bad customer service shame since used go lot covid see ever going back
Vikrant Vikrant, a year ago, 5,ordered veggie pizza come print old newspaper sauvignon blanc nz quality good outdoor seating feel like hoboken alright
Marisol Manns, a year ago, 5,great food friendly staff
Michael Borelli, a year ago, 5,great food great service
Liam Kelly, a year ago, 1,rude people placed order thru uber eats food never came called twice hang long time sent totally different food called back listened hang phone recommended
Giselle Soriano, a year ago, 5,
Marjorie Solomon, a year ago, 4,
Samuel Parrett, a year ago, 5,outdoor seating comfortable well spaced music pleasant first time dinner dad time food environment made memorable
Ed De, a year ago, 2,ambiance excellent covid outdoor seating beautiful patio  well separated spaced table food average fair chicken panini chicken bit dry burger bad average toddy good cost 30 per head tip service good  place go ambiance much food
Avery Roth, a year ago, 3,took friend town dinner  never sure ordered wrong food pretty tough cocktail  great either beer  gotten skunked said waiter really nice  cool looking spot  buzzy weekend night unlikely  return  suggest others happy hour pre post dinner drink
Sir Claude, a year ago, 1,gave one star give something looking star option day went place obviously empty hostess told fast eating table reserved offered seat corner filthy car passing could share eating diesel fume 2020 people sad america
Fabio Almeida, a year ago, 1,yesterday went madison friend couple time experience good yesterday different food lacked taste saw patron clean table mop cleaned floor friend bbq sauce piece burger inside reused container addition charged higher price burger spoke manager told u eating cleanest restaurant hoboken nothing aware
Tremayne Jackson, a year ago, 5,super friendly bartender staff great time watching game check next time hoboken
Sophia T, a year ago, 3,pricy decent food
David Esteves, a year ago, 4,
Nanette Romano, a year ago, 5,must visit hoboken
Maria Torres, a year ago, 5,
Sasha Steward, a year ago, 5,
Vince Campellone, a year ago, 4,
Tara DeWorsop, a year ago, 4,
Mike Frasco, a year ago, 5,
Cristian Mitra, a year ago, 1,first time got pizza cold burned  customer service worst every time im going
Mike Sancimino, a year ago, 5,
Dino Samayoa, a year ago, 5,
Eric Hammer, a year ago, 3,
La hiervita Gro, a year ago, 5,
Vladimir Nikulichev, a year ago, 5,
Elisabete Boteon Gimenez Soares, a year ago, 4,translated google reasonable time pandemic hot original razovel em poca de pandemia e muito calor
Claudia rubino, a year ago, 1,service  horrible found hair food told still charged meal food great thing okay waiter understanding
Barbara Kivlehan, a year ago, 5,
kmason, a year ago, 5,highly recommended staff management done unbelievable job adjusting limitation outdoor dining created safely distanced shady outdoor seating nice experience staff consistently follows strict safety protocol menu great food fresh beautifully plated top quality flavor thank madison bar grill
Sam 6 string Estrada, a year ago, 5,remember 90 john believe owner always oldie car next door great restaurant
William Meier, a year ago, 5,
Betzabet Barzola, a year ago, 5,translated google loved food attention original encanto la comida la atencin
L S, a year ago, 4,
Maria Vytinidou, a year ago, 4,
Dan Hayes-Patterson, a year ago, 5,
Theresa Aslin, a year ago, 5,gorgeous interior delicious breakfast food easy way stand serve breakfast food place breakfast pizza fantastic came fairly early food ordered took bit longer thought would place empty matter enjoyed experience tremendously would love come back lunch
Samuel Neal, a year ago, 4,visit superb place often love ambiance exist restaurant staff exceptionally friendly skilfull service remarkablywonderfully fast also food cook excellent many time always joyful cost reasobable suggest restaurant friend family
Roseanna Davison, a year ago, 5,great food service
Joe Spina, a year ago, 4,
Berlynn Eustache, a year ago, 4,
Marilyn Alter, a year ago, 2,
StevenLiguori, a year ago, 5,good food good service
Kinga Witkowicz, a year ago, 5,000 wa hug 0dlwasep
Murat Dinc, a year ago, 4,
Jim Briggs, a year ago, 5,
Tony Enrico, a year ago, 5,madison bar grill great go weekend night drink lot young people uptown madison delicious food dessert service excellent ambiance wonderful get whole package dining drink great much history behind outside seating summer give view empire state building 14th street karaoke thursday night
El Toreo, a year ago, 4,
Jared Cape, a year ago, 4,
Noel Aird, a year ago, 1,eating food good delivery unreliable call expect lied 1 hour late 2 hour ordering
Hector Laya, a year ago, 5,nice place great staff price good food really great chicken panini house salad amazing
PK KID, a year ago, 4,
Gilles Troquet, a year ago, 5,
madeleine, a year ago, 5,
Igor Bandura, a year ago, 5,
B Jones, a year ago, 3,
David Neves, a year ago, 5,awesome menu fun vibe friendly staff
Blanca Martinez, a year ago, 5,
Paola Cantos, a year ago, 5,
Kyria Johnson, a year ago, 5,good service reasonably priced drink good food fried calamari point colleague really loved sriracha mac cheese bomb jersey burger fry lunch highly recommended
Matt Hengey, a year ago, 3,
Brian Palumbo, a year ago, 3,
Borris Channiel, a year ago, 5,spot never fails impress serve fantastic food convenient rate waiting time even spot busy
John Spicer, a year ago, 4,
Chris Frie, a year ago, 5,good happy hour 7pm m-f
Nicole Hasenfus, a year ago, 3,
Trevor Pralat, a year ago, 5,
kassie f, a year ago, 5,
Carla Manzuk, a year ago, 5,good food close home
N T, a year ago, 4,always good experience every time go kenny kero matthew faves provided best customer service beverage behind bar definite go go check
Artem Krylysov, a year ago, 4,
Nicholas Saltarelli, a year ago, 1,110 00 new year cover serf raw croissant uncooked waste money poor service unsafe time food
James O'Donnell, a year ago, 5,
Cristina Chasar, a year ago, 5,
Carolina Deleon, a year ago, 5,love place food great environment awesome
Flyan Ryan, a year ago, 5,
Paula Andrea Parra Jaramillo, a year ago, 4,
Matt Meany, a year ago, 4,fun welcoming crowd plenty tv sport atmosphere n't crazy hectic compared downtown hoboken
Shailesh Divey, a year ago, 5,
Alex Cimiluca, a year ago, 4,
Marlene, a year ago, 2,went around 1030 wanted drink dancing music absolute sucked stayed hr hoping music sould get better dont think ever go back two start since drink reasonably priced
Michael Roithmayr, a year ago, 5,really great place wait staff attentive good food good menu
Frank DiCola, a year ago, 5,owner generous
Jennifer Stephan, a year ago, 5,
Michael Terry, a year ago, 5,
Hani Shafik, a year ago, 5,service wonderful good steve take care car give priority saw every one
Andrew Antropow, a year ago, 4,good place grab bite parking bit hassle hoboken
Ro. P., a year ago, 5,
Nilesh Parikh, a year ago, 4,
Kayla Joseph, 2 years ago, 3,food expensive taste alright
Matthew Buckhannon, 2 years ago, 5,go know good house mbg burger amazing mine medium gushed smiled picked half tender attentive lively spirit compliment advice choice tonight good decision excellent spot pick choose wisely neighborhood spot pop quickly loose fl-favor quickly mbg right
Kevin Arms, 2 years ago, 5,great service even better menu must try risotto
Olga Posternak, 2 years ago, 5,
jono mano, 2 years ago, 5,amazing chef anthony siano great venue dining area pleasant eat
Teresa Campos-Orlowski, 2 years ago, 1,place used great today really bad waiter took order never came back waffle need get get maple syrup never came ask u wanted coffee ok time get check ho find recommend madison much new ownets
Rajat S, 2 years ago, 4,
Karen Meyer, 2 years ago, 5,
Antoney Latchman, 2 years ago, 4,
Juan Febres, 2 years ago, 4,cool vibe
Kal Amin, 2 years ago, 3,
jose jimenez, 2 years ago, 5,
Meepstick, 2 years ago, 5,
Bharath Lakshmeesha, 2 years ago, 4,loved service great deal game day bang bang shrimp best
Carol Pilon, 2 years ago, 4,delicious crab appetizer generous tasty new waiter excellent lot specific request accommodated every one
Debbie Winterer, 2 years ago, 5,great food service fabulous
Rafael DeLeon Jr., 2 years ago, 3,
Lainie Speiser, 2 years ago, 5,n't restaurant year looking fun loud place entertain parent friday night madison perfect choice great food great service perfect ambiance relaxing evening front room bar loud festive there dining room back mellow vibe exactly wanted
John Emolo, 2 years ago, 4,
Eric A, 2 years ago, 2,
Joseph Finnern, 2 years ago, 5,
Michael Piluso, 2 years ago, 3,mediocre food great friendly staff
Sherrance Henderson, 2 years ago, 5,
valon ala, 2 years ago, 5,
Miltiadis Tzoumas, 2 years ago, 5,
Agata Podgorska, 2 years ago, 5,
Salvatore Coladonato, 2 years ago, 5,great place period
Cody Wilson, 2 years ago, 4,
Natali Gonzalez, 2 years ago, 4,come couple time say tuesday night bar service good bartender guy girl friendly attentiveand professional drink great froze awesome mexican street corn braised short rib delicious
Chef Elliot Crespo, 2 years ago, 5,
Carlo Ang (CaraB00), 2 years ago, 5,
Matt Meyer, 2 years ago, 5,awesome burger fry nice outdoor seating friendly staff
Elisabeth Lenheim, 2 years ago, 3,
Rosalind Punales, 2 years ago, 5,best bar restaurant hoboken fun friendly staff great drink food awesome service great awesome dj definitely must go bar
Carla Reis, 2 years ago, 5,
Deepak M, 2 years ago, 5,visited almost 8-9 year friend place way left last time good balance ambiance bar service food diversity customer service planted bar abut 2 hour bartender friendly good also appetizer dinner food excellent come palatable price smiling service across board return
nelson capela, 2 years ago, 5,steak pretty great thank nice service
Christian Farrell, 2 years ago, 4,smell like beer
Amit Verma, 2 years ago, 5,
Jean Felix (UncleZazu), 2 years ago, 5,
John Mitchell, 2 years ago, 5,great service
Timothy Dugan, 2 years ago, 5,service great food outstanding
Mike Mariniello, 2 years ago, 5,
AbiChueLaa26, 2 years ago, 3,
Mike Kerslake, 2 years ago, 4,
VR, 2 years ago, 5,great atmosphere chill drink
Katie Usiak, 2 years ago, 1,bouncer inappropriately grabbed multiple woman without discussion said bouncer prior physical contact  disappointed madison   security  team
Darren Di Ubaldi, 2 years ago, 3,
Alexis Ramirez, 2 years ago, 5,great spot
Broad Spectrum Publicity V., 2 years ago, 5,
R C, 2 years ago, 4,
Kali Crandall, 2 years ago, 5,
zane last, 2 years ago, 5,
Melvin Little, 2 years ago, 5,bang bang shrimp
Frances Trompeta, 2 years ago, 4,n't forget taco tuesday
Gina L, 2 years ago, 4,love seafood tower
Uygar Yilmaz, 2 years ago, 4,anice place go dinner pint albeit quite loud noisy night still one best bar hoboken
Bushido Ken, 2 years ago, 5,
Madie Smith, 2 years ago, 5,writing review let know place get bumpin night dj included
Gwyn Kelleher, 2 years ago, 5,bar best music
David Anderson, 2 years ago, 5,
Noemi Rincon, 2 years ago, 5,great time great people food delicious
Mohammad Ilbeigi, 2 years ago, 5,
Bo Bowidowicz, 2 years ago, 5,gem hoboken old style bar new style dining room must stop town
James Foley, 2 years ago, 5,
John Pope, 2 years ago, 4,great lunch
Terra DeGasperis, 2 years ago, 4,
sedat çeçen, 2 years ago, 4,nice delicious
Louise Mcmillian, 2 years ago, 4,delicious service great atmosphere vibrant definitely back 2nd time
Ofir Hillel, 2 years ago, 4,nice place nice atmosphere
Harshal Jagdhane, 2 years ago, 1,
Owen Popovitch, 2 years ago, 5,
Aaron Marsh, 2 years ago, 2,bouncing staff disrespectful enjoying vibe inappropriately touched recommend men color
Luis Mordan, 2 years ago, 3,
Annett Pfähler, 2 years ago, 5,
Doug Ball, 2 years ago, 3,
Michael Desousa, 2 years ago, 2,great service atmosphere crazy food ordered french onion soup dumpling almost cracked tooth disaster dish  even begin eat underneath pile cheese 4 hole filled soup crusty piece pasta also split chicken salad kind joke size cooked boiled chicken maybe  def come back think ordered wrong food
Pawel Polanowski, 2 years ago, 5,place always good time great crowd
Family Fitness Karate & Kickboxing, 2 years ago, 5,
Bernd Pfähler, 2 years ago, 5,
