date,rating,review
2021-10-21,2,coffee good girl work n't pay attention customer order asked decaf sensitive caffeine still enjoy taste coffee morning currently sick stomach girl working morning 100 ignored request gave caffeine even asked handing cup definitely decaf right said yes get sick caffeine point make beyond difficult stay work second time happened location except last time girl nice enough admit messed made new cup get get busy morning flat lying gave decaf wrong especially paying almost 5 coffee obviously never come back ca n't trust staff moral story drink decaf go
2021-08-12,5,cute whole wall cafe actual vault fridge tried three drink far iced dirty chai oat milk okay favorite personally fond spicy chais iced oat milk latte lavender rose time favorite used get somewhere else n't able find flavor anywhere love floral flavor nice dairy free iced drink definitely recommend try also tried iced coffee caramel also amazing espresso amazing flavor iced coffee area definitely give place try wo n't regret also pastry n't try anything
2021-07-03,5,quaint cozy coffee tasty perfect amount sugar added staff really friendly well
2021-05-14,5,bean vault perfect grab-and-go coffee spot around corner hoboken path station coffee order basic plain old drip coffee brew bold strong really like variety milk sweetener flavor option well fancy love artwork sale local artist displayed
2021-01-09,4,tiny coffee spot right hoboken path pier park walked many time recently tried today got cappuccino tasted good definitely one better coffee shop downtown hoboken area
2020-06-06,5,hidden gem hoboken great coffee great service definitely new go-to ton different drink option reasonably priced compared coffee shop neighborhood love
2020-05-20,5,nookiest nook bean vault one favorite place grab cup coffee hopping path since moved hoboken 4 year ago going take step back gasp 4 year ago second andddd back bean vault cute little shop without seating tucked away beaten path since hoboken went lockdown open noon monday friday staff baristas greet friendly face visit delicious coffee lot sweet treat plethora cute gift love remember shop go sit work need cup amazing coffee go make sure try spot
2020-04-03,5,april 2 bean vault open noon monday friday today first visit longest-ever stretch without espresso since 90 thrilled life-sustaining jolt iced americano large really big today depressed time angry others contemplated circumstance well selfishness xenophobia socio-economic conflict enhanced world crisis last three hour n't tired planner glad picked extra ameiricano tomorrow thank great coffee bean vault
2020-03-29,5,past 5 year going bean vault coffee hand best ice coffee hoboken girl work counter always remember order always beat even seems like working really hard
2020-01-09,3,bean vault definitely located main path hard come across unless looking pretty small shop seating generally look coffee shop seating like work decor inside really cute rustic vibe coffee n't great got latte tasted like cheap cup coffee barista really nice u though another note come summer lemonade pretty tasty
2019-10-04,2,coffee quality pretty good however seating store tiny also menu claim nj sale tax included price lie still charged tax come back rectified
2019-08-24,4,tiny spot speck really noticed three day row taking path manhattan hoboken company office building river street enjoyed riverfront walk last morning made detour onto newark street found coffee shop kiosk nice one embedded beautiful brick building got 2 85 drip coffee photo bit ly 2zlucu9 wanted basically anything starbucks indeed surpassed modest threshold coffee 4 star locally roasted bean bring nice richness brewambiance 4 star place sit handsome walk-in closet ideal commutersservice 3 5 star certainly friendly enoughtotal 4 star take hoboken ok really coffee finerelated lost jersey ca n't help ya collection place visited reviewed bit ly 2hnxqqd
2019-08-24,5,one best coffee spot town must try tom geri cooky best cooky town offer gluten free cooky dope merchandise bathroom good music favorite drink cortado fall nice cold brew summer get coffee bean toby estate bathroom seating pier block enjoy new york skyline accept cash credit amazing snack bv merchandise ask tara shanel katelyn manager gwendolyn recommendation love advice hip dopest
2019-08-18,1,worst americano ever went place sunday afternoon get iced americano luck warm enough ice tasted like old brewed coffee paid iced americano asked ice case throw away took ship would never go back coffee drinker love travel find good cafe place disappointing worst coffee place ever
2019-06-17,1,far inconsiderate establishment ever order tea given tea proceeded sugar milk station began pour agave tea guess establishment n't bother squeeze top properly spilled tea causing tea splash burn hand badly stood cry one acknowledged customer ask ok happened last week tuesday u reach store speak owner say cop n't every day literarily ca n't even take proper shower hand burnt badly
2019-02-22,5,staff bean vault friendly lovely perfect place stop morning way path close convenient pretty tiny great place hang around sit seating coffee good baked good delicious
2019-02-22,2,location bizarre walked place small like decent amount dairy free alternative coffee great better ordered latte caramel latte almond milk try 6 mine ridiculous worth actually charge 0 70 almond milk 0 60 flavor flavor return never coffee shop charge flavor n't even cup sleeve label saving money marketing even need charge customer much wish could get money back better coffee elsewhere reason n't recommend place like plain coffee still expensive choc pain much better
2018-11-08,3,gave bean vault three try month location extremely convenient way work however coffee favorite tasted acidic bitter sure coffee supposed taste personal preference
2018-07-25,5,great cold brew espresso drink lady work make place though super friendly sweet always smile kind word hustle really efficient fast service love display sell local artist piece always play dope music
2018-07-05,2,early meet cousin hoboken brunch decided stop coffee bean vault seemed pretty good review yelp thought hey staff friendly pretty quickly price reasonable however cold brew got so-so opinion bitter add agave coffee never never ever put sugar coffee past 5 year sure back next time area
2018-07-03,1,horrifyingly acidic coffee eight u went got latte sort finished rest u threw coffee guess nome u enjoyed acidic medicine-like coffee confused rest good review willing try update review future hopefully chose wrong day
2018-07-02,5,wife love place finally tried way home even though 3 different cup shot coffee quite good really solid cup drip pour coffee single origin bean impressed passed place often never noticed wife pointed daily coffee stop even though make espresso home morning daily commute office hoboken another one place stop try variety see real baristas work craft
2018-06-22,4,small seating good quick grab go got cold brew w shot vanilla cream per request good need return espresso drink since barista seemed experienced
2018-04-24,5,bean vault coffee definitely one best coffee shop around hoboken coffee shop offer variety drink importantly offer pour over ranging single origin bean bean blended together different region coffee lover definitely try pour over baristas take time care insuring best coffee experience also n't forget try cold brew bunch coffee shop around hoboken cold brew definitely strongest consistent taste quality
2018-04-20,4,coffee shop touch compare coffee place new jersey use bean joe coffee nyc already make quite special took one star away place n't wide variety pastry least appetizing far coffee concerned awesome
2018-03-16,4,great coffee high price seating area common day right got hazelnut caramel latte 5 morning pretty good cookie jar n't labeled confused whether self-serve skipped would n't go way come back visit really close
2017-12-10,5,service awesome coffee highly recommend cute cozy coffee shop right near beautiful hudson river
2017-11-05,5,handful time cup coffee love staff friendly never coffee n't love definitely check walk water enjoy head small little place seating somewhere work hang
2017-10-19,4,coffee n't great foamy pastry bought cheese puff chocolate chip cookie amazing shop cute love sell art little thing
2017-10-19,5,cute cozy coffee shop great location right beside hudson river bank nice common area nearby coffee good got jumbo size iced latte tasted good come visit river bank region
2017-09-01,4,always come cafe tea great staff well give 4 star five cause owner justin could learn something staff engaging cousmer shop sitting always tea outside little bit chilly door closed cuz keep heat came kept door open n't realize owner cafe simply say please close door customer reach close door replied leave door open said cold asking close asked ji employe close door replied ca n't owner said excuse try get attention asking push half way looked turn back open door wider said choice take black woman sitting coffee disregard requesting would listened trying say white service continue exist god loyal customer think treated pleasant staff expect treated like piece black unit sad recommend place good coffee good expensive stuff good staff pleasant wo n't recommend place give service money people disregard people color nationality white business organization treat anyone contribute pocket differently matter race know probably look probably looking see black girl sitting part get attention even though try reach try speak maybe apologize coming strong closing door beanvaultcoffe
2017-09-01,5,regular drip coffee great iced hibiscus tea amazing strong flavor watered
2017-08-02,4,wow small place parking iffff win nj lottery actually gind street parking espresso good didnt blow away
2017-07-23,5,coffee always good way better chain love one specific chain staff extremely friendly helpful assortment healthy snack treat impressive love loyalty program music play sidewalk shop small give place chance wo n't regret favorite cold brew om sweet om muffin
2017-06-15,3,n't see hype walked past place yesterday smelled amazing n't time get anything came back today got green tea latte almond milk lady ringing making drink seemed uninterested mostly one making drink n't blame lady ringing annoyed bc customer could figure pay legit paying penny something taking forever even annoying saw lady making green tea latte could see n't enough matcha powder even made comment breath enough n't elsewhere ended giving le scoop matcha powder mixed almond milk basically paid 5 small steamed almond milk hint matcha powder worth
2017-06-11,5,coffee spot go cold brew large coffee actually large staff friendly
2017-05-29,3,first time visiting hoboken wandered place coffee shop quaint warm ordered small ice soy latte 5 got order le 60 second latte cigarette taste 1 shot espresso like drinking soy milk wo n't trying place
2017-04-20,4,staff friendly explained coffee menu unique waffle probably one densest waffle tried super sweetchai latte one favoritesthe iced milo pretty great ice cream hot chocolate con wifi one outlet available think great purse jacket hook table
2017-04-16,4,helpful baristas came coffee left hot sauce like variety item available
2017-04-02,4,place super tiny simple good decent brew snack around fit type allergy diet recently took home bar soap though ca n't routinely buy handmade organically crafted item like to0 time well support small business staff relaxed waiting make decision place upbeat great coffee menu accept card mean world norm 2017 despite charge minimum business owner believe place right station near hoboken little school crazily near starbucks newark ave believe would say great food cup simple coffee okay
2016-12-15,5,place converted decade-long starbucks addiction fed wait time downtown hoboken starbucks stopped bean vault way path one day go every single day coffee fantastic always get latte woman work weekday morning amazing friendly fun somehow every person drink order memorized ready drink two minute even place packed love
2016-11-10,3,four star espresso-based drink friendly service like three star drip coffee lack seating tie-breaker brings three overall espresso-based drink consistently good macchiatos lack milk therefore expose weakness shot-pulling good latte always capped thick layer properly micro-foamed milk regular drip coffee n't quite standard decent prefer french-pressed coffee city saint uptown well dare say starbucks brew tom geri cooky tasty massive 4 guess really want eat one sitting mileage may vary price high side 5 latte place small presumably lower rent overhead cost finally seating fine nice weather day getting go place come linger
2016-09-21,4,best coffee place hoboken quite frankly place come regular basis say everything point drip coffee solid treat super tasty really wanting treat get pour filled amazingness get type day basically therapy cup yesterday green tea latte amazing also love substitute kind milk especially almond milk yummmmm yes get bit pricey new yorker much rather pay extra dollar quality coffee would never settle anything else lucky sometimes give free sample path station looking amazing coffee hoboken look found place
2016-08-26,5,cutest grab go cup joe everyone working sweet coffee amazing
2016-08-14,4,loved walking little place every morning stayed hoboken near water really pleasant walk coffee great baristas pro great menu item well small selection bakery item treat
2016-08-02,5,seriously best coffee shop visited hoboken lacking coffee scene even million coffee shop place would still best staff friendly fast coffee amazing music play ridiculously amazing make morning commute start much better
2016-08-01,5,place awesome placed near waterway front near hoboken child care center really fantastic location go coffee got green tea latte iced husband got iced coffee double espresso shot large came 12 00 reasonable since lasted u whole waterway walk iced green tea latte good good nice matcha flavor creamy overpowering loved iced part since sticky today
2016-07-29,4,great coffee shop right near path waterfront post office nysc etc convenient location time coffee keep coming back also service atmosphere hole wall place matter time day find bean vault coffee playing classic motown hip hop classic rock tune window staff always incredibly friendly regular baristas sure know order soon walk door coffee great believe use toby estate bean price pretty average nyc cup coffee 3 5 depending get great cafe order coffee go next time try specialty drink cold brew always addicting
2016-06-30,4,great cappucino sat waterfront great vibe great service wonderful coffee perfect compliment view go back
2016-06-28,5,cute little coffee shop near path way better starbucks seating downside walk bench water 100 foot away enjoy nyc skyline
2016-06-28,5,n't go enough gotten cold brew regular coffee espresso soy latte twice everything great best thing place people though folk behind bar always super friendly price par coffee shop gon na spend 5 one might well local business right area inside little tight got nice vibe ambiance never felt crowded
2016-06-07,4,n't impressed hot chocolate bit milky liking coffee phenomenal
2016-05-25,4,section hoboken somewhat lacking good coffee quite since chock full nut closed around top head starbucks dunkin hit last resort deli unreliable coffee think finally remedied small place staff cheerful work efficiently make damn fine coffee actually espresso espresso-based drink never let disregard fact one yelp check-in sometimes rush fast forget check baked dessert always look good yet try bean vault new go-to spot need caffeine fix getting path train
2016-05-09,5,love place best soy latte anywhere n't even usually like soy latte nutty flavorful find craving anywhere vicinity think finally felt like new yorker ordering small iced decaf soy latte uhhhh many adjective well usually use yeah sooooo good beautiful spring day decided splurge dessert supposed last day sadly half gone happen got tom geri owner father told make amazing gigantic chocolate chip walnut cooky towering bite cross section layer chocolate chip cookie dough intricate layered like 7layer cake layer cookie dough walnut chocolate chip yumminess bit salt counteracts sweet justine bicotti die tried coconut wow surprised learn filipino seriously mastered baked good discussion earlier filipino friend mad good baker finally everything free muffin gluten free vegan soy free gmo free organic admit skeptical also delicious pumpkin spice flavored satisfying make good need read ingredient next time good know gluten free dessert option tasty satisfying
2016-04-17,5,tried different kind espresso cappuccino latte americano coffee taste great people nice
2016-03-26,4,hand best coffee hoboken tasty strong great music playing walk latte good simple hot cold brew simply awesome
2016-03-13,3,place might hard find n't always blaring music whole block hear place bit closet seating hoboken waterfront close necessary hoboken train station path close great stop coming city basic coffee great mix festive seasonal drink price high hey even closet pay hoboken rent somehow
2016-02-03,5,lovely staff delicious coffee heavenly treat accompanied great tune sometimes linger song finish bean vault hoboken oasis cheer
2016-01-25,4,great spot coffee right near hoboken path station small store lively spot music always going warmer weather music drift open door cheer block-radius staff always friendly cheerful drink always seem prepared care plus n't get assembly line feel like starbucks dd definitely worth visit
2015-12-03,4,nice finally good coffee place hoboken coffee always great people working cool friendly reason giving 5 star feel like might outgrowing location staff size last time store ordered pour-over took 10 minute prepare people trying serve think bigger better location larger staff would really trick place great
2015-11-02,5,tiny place bit tucked away hoboken terminal place worth hunting cold brew point latte delicious wonderful place n't expect set shop zero seating looking caffeine jolt go n't pas place
2015-09-30,5,favorite coffee shop hoboken hand come every morning make day much better besides awesome coffee staff awesome music bring smile face even dragging 7am thank
2015-09-27,4,great spot great coffee locally baked good minor problem nowhere sit shop fortunately sure owner built place mind abundance waterfront bench within yard shop creates desirable place enjoy coffee still nice sit cafe rainy day overall highly recommend coffee shop
2015-09-26,5,happy quality coffee right path new happy place nice local non chain option good vibe highly recommend seating need work space awesome option
2015-09-18,2,capuucinos latte feel burn taste lately may baristas need trained bean supplier could changed maybe know right pay 4 latte cost max 90 cent right ask
2015-09-15,4,one line verdict stick coffee avoid lemonade coffee phenomenal especially love latte always point strong diluted tried lemonade lavender strawberry couple time summer disappointed way sugary syrup-y lady please use real lemon le sugar syrup next summer staff really nice welcoming location great grab coffee hit waterfront perfect
2015-08-12,1,excited try place since area love supporting smaller business big chain unfortunately underwhelmed place really cute small n't bother wanted good cup cold brew would nice greeted tiny smile girl took order looked like hated least fake minute gave change single obviously leave tip going anyway n't even get quiet thank putting bill tip jar loose pocket change took sip thought flavor little acidic thought maybe coffee n't even realize already car couple block away looked bottom cup soy milk spoiled yeah soy might settle bottom curdled ball bottom cup taken picture grossed threw 5 large cold brew fail could forgiven lack friendly service coffee made well correction maybe cold brew really great since milk bad would n't know
2015-08-03,5,best coffee hoboken cold brew must staff friendly vibe perfect also great music chill inviting vibe drip coffee great also trying hot option colder month come stick cold brew almond milk yummm
2015-07-31,5,probably best coffee hoboken fact possibly one best coffee around sure stop get flat white strong latte smaller cup basically no-frills coffee shop good baked treat side including gluten free
2015-07-25,5,life-changing arnold palmer iced tea bean vault signature lavender lime syrup hard time drinking normal iced tea even recipe tea wow
2015-07-13,5,place bright spot work day feature toby estate coffee brooklynmake really good iced latte almond milk 50 extra pour coffee thing people work upbeat nice last time went music blasting stereo tear fear everybody want rule world run-dmc tricky could ask
2015-06-30,4,tiny shop shoehorned onto street corner near water place simple want good coffee want good pastry otherwise n't waste time coffee option vast caffeinated tom geri cooky size head lovely give chocolate macaroon try
2015-06-21,3,nice refreshing iced latte made walk along hudson even relaxing barista fast attentive smaller place one person working behind counter never felt frazzled impatient quality bigger chain recognize try emulate next time hoboken definitely going make stop
2015-06-20,5,little shop delicious coffee toby estate awesome employee memorize order within week great music playing everyday also punch card buy 10 get one free
2015-06-03,4,great selection drink sweet love stumptown coffee customer service always point
2015-06-03,5,great coffee simple pastry baltazar great service unique setting bit hidden worth find
2015-05-20,3,given place chance three time kind gave feeling meh really wanted love place one time wanted plain latte milky taste coffee next time wanted vanilla latte still milky want taste coffee find balance milk coffee realize latte comprises milk coffee n't milky third time wanted coffee plain simple coffee tangy strong know could due bean used day n't good update review give another try
2015-05-12,2,let say coffee great delicious love n't even mind paying 2 35 small however giving place 2 star following reasons:1 cup consistently leak used think crazy looked saw drip coffee hand clothes figured must spilled issue top cup form perfect seal around cup coffee always come top blocked lid drip side cup could caused cup slightly disfigured stretched uneven lid specially made fit cup never ever problem cup starbucks 2 layout store inefficient milk sugar topping crammed window area really one person fit time wait line behind someone order crazy drink wait behind person slowly fix drink window love staff coffee please fix issue
2015-04-26,5,great coffee great service coffee lover nothing else need said lastly place dog friendly
2015-04-24,3,came twice time ordered lavender honey latte first time fairly decent second time disappointing latte art visit
2015-04-13,5,disclaimer love smell coffee hate taste tea drinker place wonderful surprise even coldest day offer two iced tea option lemon black tea excellent mango tropical fav n't watered nice slightly spicy taste steamed chai best hot chocolate good last drop cruddy sludge left behind nice creamy sweet try steer clear pastry weaker day happy indulge apple cinnamon favorite n't think made house teeny spot always fresh staff super friendly always happy answer question become morning stop train station office
2015-03-30,4,stopped saturday late morning hopping path admit usually hit chain walk path mostly due familiarity convenience thought bean vault would nice change coffee menu concise favorite drip latte cappuccino macchiato etc opted drip coffee 2 25 usual table fixing variety milk sweetener well sugar-free option behind counter coffee smooth bold exactly looking space tight place sit savor grab go service friendly quick
2015-03-15,5,bvc got best chai latte coffee town barista make perfect taste cheer bvc
2015-03-02,5,always friendly staff amazing coffee always count going place want something delicious different also enjoy keep expanding offer always yummy desert snack sweet drink n't overloaded sugar either favorite coffee place area sad ca n't hoboken time
2015-02-14,5,great coffee service good place stop getting path lot gift idea hard find person
2015-02-08,5,love place serious coffee drinker setup service humble enough anyone got lost way ucks almost everything bean vault regularly drink plain coffee tried espresso tea drink love also buy bagged coffee bean hooked toby coffee service also amazing employee friendly helpful never single bad experience location small cozy filled great music art baked good great tried chocolate chip-walnut cookie n't really gone back try anything else super pricey absolutely worth closest thing hoboken levain bakery cookie bottom line bean vault best coffee place hoboken complaint far apartment
2015-02-06,4,like place great staff easy fun vibe etc say drip coffee 4 star good great overall place wonderful local cafe n't anything starbucks general chain go local
2015-01-21,2,know coffee snob place really n't went one rainy day couple friend maybe bad weather biased mood anyway ordered cortado could barely taste espresso milky milk hot ca n't remember automatically serve double shot every time like ny single shot hope single shot considering could n't taste place small grab coffee go kind place n't work well u waiting friend get disappointed seeing good review overall recommend place one bit
