date,rating,review
2015-01-19,5,love coffee shop small spot near path train picking to-go coffee also small snack including vegan soy free gluten free treat almond milk soy n't think charge extra milk cappuccino absolutely delicious every time opinion better red lion even bwe perhaps best thing shop excellent staff baby september 2014 going least three day week since easily bring stroller shop two stair leading entrance open door know order girl counter come take money punch card return coffee small gesture much appreciated would able go baby n't course make point go busy n't waste time waiting people waiting line live next red lion uptown continue walk downtown coffee
2015-01-16,4,refreshing see toby estate coffee hoboken love place cute inside seating get coffee way work perfect location
2015-01-15,5,tucked away side street near hoboken path tiny bean vault one favorite coffee spot hoboken enjoy toby estate coffee serve love small selection local snack carry especially nutritreats made right hoboken girl work awesome always friendly give service smile
2015-01-07,5,bean vault easily favorite coffee spot hoboken honestly anywhere ever people friendly vibe great oh yeah coffee ridiculously awesome always great tune playing shop filled local art thing around hoboken mind great show pride shop everyone work beyond friendly always smile face well latte cold brew despite lack sitting space taken everyone know whether date friend family converted bean vault also slightly tucked away newark street good bad wish area people would walk might judging owner employee though doubt would true mentioned everyone really friendly morning quick operation 2 minute matter get long story short check spot thank later
2015-01-05,4,stop latte often coffee prepared well care say enough good thing delicious selection muffin n't cheap line staff friendly always given excellent cup coffee respond comment hi great shop think cappuccino muffin favorite probably one cranberry also quite nice stumbled across lavender latte elsewhere day wonder bean vault might consider addition menu either way course continue stop
2014-12-22,4,great artisan coffee shop downtown charming location right terminal make convenient location barista friendly knowledgable latte bolder used still good seating grab go type gal slightly disappointed n't serve breakfast sandwich
2014-11-27,5,favorite coffee spot town locally owned cared love stopping morning way work quality snack coffee top notch interesting flavor everything authentic even make pumpkin flavored item actual pumpkin puree syrupy crap tip every kind milk could ever need coconut almond soy etc coffee club every 10 cup get free one
2014-11-21,5,great coffee friendly staff support local hoboken business spiced pumpkin latte
2014-11-15,5,let start saying drink lot coffee walked place third cup around 5 pm friend pumpkin spice latte cold brew equally awesome cold brew smooth flavorful without milk sugar strong like regular hot coffee usually iced pumpkin spice latte perfect well sweet syrupy like pumpkin flavored coffee drink n't particularly like pumpkin flavor think one new favorite definitely recommend
2014-10-26,5,bvc serf best tasting coffee hoboken far charming location really feel artisan coffee house stopped morning quick pre-jets-game brew albert crafted americano perfection easily favorite local barista efficient behind bar delightful chat made sure everything needed bean vault coffee go thanks albert bvcedeana brian
2014-10-23,5,place awesome pumpkin spice poison best coffee ever mention fantastic customer service provided albert
2014-10-22,5,nice local coffee shop good coffee friendly staff take credit card via ipad square app offer every variety milk soy almond etc sweetener agave splenda etc sure get stamped reward card
2014-10-14,4,love coffee place tired starbucks stuff started tasting actually taste coffee flavoring latte price slightly higher starbucks really small place alley hoboken caramel latte black white latte white regular chocolate paid 9
2014-09-19,5,best pumpkin spice latte actually make pumpkin spice mix scratch w real pumpkin puree want drink ton artificial chemical go starbucks want delicious healthy version psl go bean vault even pet friendly back soon
2014-09-18,5,favorite coffee hoboken latte almond milk die bit expensive worth splurge every service great always nice speedy
2014-09-16,4,toby estate brewed obviously something right tiny seat cafe one barista surprisingly dish specialty coffee pretty darn quickly except course get pour case got ta wait essential considering location right next path train boyfriend guilty asking barista many question get like sometimes barista answer fairly quickly giving coffee dash sas like like like like prime location grab latte pour taking stroll hoboken like water know
2014-09-13,5,coffee great wide selection milk sugar clearly real coffee drinker impressed service walking dog baby stopped get coffee usually store n't allow dog get secured right outside store stroller took infant daughter immediately said could bring purchase one baristas volunteered watch dog put daughter back stroller put sugar coffee impressed thoughtfulness thank lovely experience
2014-09-04,4,work day start love al wendy crew always service smile shop great vibe coffee dear say best hoboken
2014-08-25,1,came inside hello welcome alright happens n't welcome customer girlfriend went inside place since review said coffee amazing well really girlfriend ordered capuccino ordered like always espresso shot really tell place serf good coffee make great espresso shot bad also store ambience friend club rather coffee place baristas cashier involved conversation wandering customer place need worker good coffee great cup espresso rather sad fwp
2014-08-11,5,best cup coffee ever never new coffee could good drinking watered downburnt stale coffee know better bean freshly ground use freshly roasted bean difference
2014-08-10,5,bean vault coffee among best coffee ever best visited gem twice found service absolutely outstanding occasion actually met proprietor separately referred buddy first visit walked shyly uncertain welcome distaste met boy treat cafe crawling called become new hobby mine drawn capturing perfect shot encapsulate experience wood floor gorgeous two-toned parquet think ceiling twin restoration hardware light fixture ironically seen store marveled wall shelving hold various sundries t-shirt etc course gleaming espresso machine perched behind counter among brewing apparatus quite display encase best accompaniment coffee ever scone cooky like delicious fresh worth dough guy bvc encouraged go behind counter get much-sought-after winning picture taken aback still timid burgeoning giddiness declined said already got gregarious owner gave sticker true genuine hoboken style said sticker stick em place gladly took put use barista kind attentive handsome could want latte ready extremely timely fashion casual small talk made waiting pleasure bvc truly sole place go damn good caffeine fix coffee spectacular atmosphere relaxed pretense punch pulled latte creamy rich ultra-satisfying alluring waltz order another second visit pleasant met proprietor extremely warm patient extensive staging picture seem delighted hear already found social medium platform planned write review urged mom companion trip get hot coffee time nothing beat latte previously ultimately savored could n't resist finishing within minute said goodbye exited little one-room cafe end transaction felt though become happily well-acquainted guy bean vault mentioned traveled hour visit week first visit cause
2014-07-30,4,new favorite coffee shop hoboken coffee great love laid back atmosphere baristas great really know coffee
2014-07-20,5,walking hoboken stopped asked couple folk front shop good place eat also baked good said come really friendly set properly trip back houston pb j bar delicious ever hoboken favor amd stop bean vault coffee baked greatness also great service know
2014-07-13,5,awesome little local coffee shop old bank hoboken even original vault door still within store menu small amazing coffee staff super friendly happy skip chain coffee hoboken give shot
2014-07-12,5,one place groupon work come many time first picking groupon iced coffee term quantity really thirsty avg iced coffee go sbux dd nearby want great tasting iced coffee walking around pier bean vault great option
2014-07-06,4,delicious iced coffee right next path tad pricier end worth since snack drink sooo good
2014-05-28,1,good coffee make stale croissant rude dude working cash register badexperience
2014-05-25,4,offer cold brew rare little pricey usually top quality friendly staff needle say product top notch
2014-05-24,5,great see artisan coffee shop downtown n't blame modcup guy leaving downtown hoboken would n't want stand outside working cart every day either use bean toby estate brooklyn went one bean available brewing pour muungano congo good wish choice n't take effort 2-3 different bean available pour unless n't getting enough turn pour bean justify noticed toby estate bean roast date bag indicates roaster care freshness wife got hot cocoa since n't coffee also pretty good really reason go starbucks bvc covering downtown unless like coffee brewed stale over-roasted bean
2014-05-10,4,omg overdue review jerk ever since modcup abandoned u lowly hobokeners height hating sol fresh coffee sucked back starbucks black hole triple grande 3-pump caramel 3-pump vanilla foam-with whip latte one day walk path work noticed sign knocked battered wind sign pointed direction new local coffee shop felt heaven open heard angel singing fast forward stopping bean vault every weekday last couple month made life coffee espresso variation delicious newest fav cafe au lait cafe con leche coffee w steamed skim much better pocket waistline really care latter lol everyone work nice helpful 3rd day memorized order also loyally card loyal block download app get free drink 10th drink getting next free drink monday go support local business
2014-05-05,5,five star coffee cappuccino tell take pride roasting best coffee price roughly 50-75cent premium starbucks word hope able keep line moving people stop busy time far good something keep mind
2014-05-02,5,keep short simple people work nice serve well-made high-quality coffee reasonable price looking coffee shop also prefer place coffee serve mod cup cart simply light roast taste appreciate good coffee prefer stay away charred mud serve starbucks highly suggest give guy shot keep good work back
2014-05-01,5,went first time impressed quaint one-room no-seating coffee shop really friendly staff pretty good coffee went knowing expect idea wanted asked barista suggestion prompted preference ended giving suggestion wanted aside standard milk half half offer almond milk coconut milk among others escape currently going rather starbucks whenever definitely making regular stop way train station love
2014-05-01,5,stopped bean vault early afternoon first time say impressed latte amazingly delicious barista recommended chocolate chip graham cracker cookie soooo good perfect pair iced mocha latte place seat available fine cozy store little warm think guy barista kinda hot definitely recommend 5 star
2014-04-26,3,cool spot hope well support small local business lot reason swung couple time returning city weekend morning good coffee nice folk add another star soon enough
2014-04-10,5,solid solid solid coffee excellent love dark strong clean crisp cup coffee bvc serf n't like add anything milk 2 75 piping hot cup truly perfect 4 iced brew even sure else say great oh location tiny room hang considering take path everyday week coffee joint moving guard afraid going huge line ppl read review lol also try macaroon gooey center toasty outside
2014-04-04,5,grateful good alternative starbucks dunkin work around corner super convenient coffee temperature regarding review saw americano nice hot definitely stop way train station
2014-03-26,4,coffee great way better starbucks happy small coffee shop opened work latte got delicious weird taste came smiling service would say price bit steep 4 small latte taste well worth definitely coming back
2014-03-23,4,nice small coffee shop ca n't believe never heard coffee shop need get great coffee went two friend u really liked coffee nice style feel shop nice employee would suggests go try
2014-03-20,4,really loving place especially since close terminal employee really nice always happy place tiny clean pick drink go spot stink love sit get work done school latte bold large cup dark roast coffee soy always point one thing noticed twice coffee n't always hot warm really expect order hot drink definitely new go spot coffee latte 3 hour class
2014-03-15,5,place great coffee put starbucks shame highly recommend
2014-03-10,2,seems like decent enough shop small seating fine frill nice looking went friend got drip coffee 12 oz decent strong great 2 25 got mochaccino 3 50 give pricing help fellow yelpers first taken aback receive 8-oz cup could smaller definitely n't larger second best lukewarm wanted hot coffee something n't understand coffee shop especially small one seem fear making something hot guy n't afraid make hot drink hot warm sorta hot hot basic either hot iced tepid coffee good thing
2014-03-09,4,commute city 2 day week look forward getting cup bean vault good coffee stoked n't bunch ridiculous coffee concoction narcissist take hour order everytime people getting coffee getting perfect people want good coffee experience decor cozy place kept clean also dairy carafe never empty really hope local support place
2014-03-02,4,stumbled upon place week ago running errand opened n't cappuccino machine yet coffee excellent also delicious pastry employee think owner friendly definitely back best luck
2014-02-25,4,really like shop small people cant camp laptop hour also loved barista soooo knowledgeable product thats great sign genuinely interested educating product helpful recommendation felt price high large cup coffee forget ordered 16oz 2 75 felt would acceptable 20oz also sell small large returning recommending friend area shop located side street right next terminal make accessible commuter
2014-02-19,5,simple no-nonsense quality bean vault coffee hoboken finally better option crappin donut friendly barristas story tell laugh go live brooklyn n't even kind place hit path hit bean vault glad
2014-02-16,5,hoboken went legitimate coffee shop couple really solid option seems like overnight bean vault coffee taking top spot coffee quality selection amazing friendly helpful service bar stocked delicious pastry right path making perfect morning spot
2014-02-14,5,first bean vault coffee experience morning amazing follow review boyfriend miserable time trekking slush snow way work decided grab coffee cheer barista incredibly nice sympathetic recommended blueberry scone accompany latte wonderful suggestion could n't decide better latte scone left overheard barista asking customer whether liked cappuccino wet dry definitely worth noting staff actually care serving customer coffee taste instead rushing door exaggeration well maybe say coffee deciding factor whether day optimistic bean vault coffee basically guarantee positive mood
