date,rating,review
2021-11-07,5,really enjoyed spot breakfast got avocado toast huge portion lot avo turkey sandwich bag joe jalapeno chip cold brew ube cookie everything great service wonderful really enjoyed vibe inside biggie quaint cozy full hour finished toast
2021-10-30,1,many fee delivery add tip owner need revamp service fee non-sense direction service
2021-10-01,5,black rail coffee hoboken hidden gem breakfast lunch work across street eat black rail 3-4 time week extensive menu food incredible weather looking healthy salad simple snack black rail coffee first time recommendation maui wowi healthiest salad big tuna large chai tea jim staff extremely personable space cute bob
2021-08-16,5,great coffee breakfast sandwich aesthetic inside great feel like place could spend hour staff owner always attentive kind friendly conveniently located next light rail easy stop commute delivery order always come quickly well
2021-07-28,3,fan coffee shop loved food coffee however recently bad experience know ever back went usual get coffee breakfast standing line three month old puppy arm time got person taking order told dog allowed inside place responded keeping order food going take soon ordered little leave alone person taking order would take decent answer told going somewhere else thanked still trying understand closed mentality lack understanding really disappointing
2021-07-12,5,healthier sandwich sooooo delicious really one best sandwich life come popcorners love indoor outlet outdoor seating awning nice staff
2021-07-04,5,hour kill pup area received best service ever pup pretty hyper anxious person working counter went way give pup bacon huge treat know n't one friendly others cafe iced latte avocado toast cut corner great sharing hit spot lot snack sandwich chip option pro tip try eat avocado toast asap site great salsa might bread soggy otherwise
2021-06-25,5,great selection sandwich coffee snack enough fact crew remembered name second visit matter stressed due crowd smile kind word u deserve 5 star price friendly even pandemic hike
2021-06-13,5,outstanding recommend everyone go black rail best place hoboken question asked amazing food best tasting coffee around
2021-05-25,1,hot coffee luke warm waaaay sweet drove buy coffee mcdonald replace awful taste mouth avocado toast burnt drained lemon juice terrible terrible go
2021-05-18,5,everything black rail incredibly good amazing sandwich coffee super friendly owner employee looking bomb sandwich want something different run mill hoboken italian deli look go turkey meet ham focaccia
2021-05-07,5,really great local coffee shop great house coffee drink black latte staff simply best friendly cheerful feel lucky covid casualty real treat u hoboken always look forward daily drop-in
2021-04-21,1,like place served cold lukewarm cappuccino instead flat white ordered make worse took break work walked rain waited relatively longer usual serving time get drink think owe flat white
2021-04-20,5,gem back hoboken almost hidden right next train station funky little place tell right ordered tea food work sandwich month pretty good came grilled ham chicken spinach pickle sort aoili mayo pressed beautifully done little salty 5 star sandwich well done also tried peanut butter bar come packaged counter loved quiet place table come early mark spot food good coffee tea done right could want 5 star place way
2021-03-17,5,love place coffee sandwich delicious friendly staff well wish discovered earlier
2021-03-03,5,loving avo toast lemonade surprise note native language little thing make difference
2021-01-31,5,awesome little local breakfast coffee shop whenever need quick breakfast awesome iced mocha coffee hit spot biggie wrap absolutely amazing reminds crunchwrap supreme taco bell better quality breakfast place must favorite coffee spot area
2021-01-21,5,trying find delicious healthy place came across yelp black rail coffee recommend 100 food super fresh delicious first time frothy almond cappuccino many place right ordered fitness wrap husband ordered turkish homie latter stronger flavor former fresh healthy ingredient super efficient attention cozy place good atmosphere definitely back
2021-01-16,5,impressed coffee food avocado toast amazing coffee really good pictured avo toast mocha coffee clean inside
2021-01-08,5,great spot love ambiance everyone helped super friendly coming back thanks guy
2020-12-12,5,coffee soooo tasty really great source food right baking mama cooky sooooo yummy n't expect nice texture softness stuff taste great super convenient way work ca n't wait check rest offering
2020-12-10,5,came black rail coffee extremely cold day right next 9th st lightrail convenient staff welcoming got inside nice see smiling face work decided get hot chocolate skim milk never tried skim must say delicious hot chocolate bitter strong like one previously one light chocolatey decor fabulous something view every corner draw stay longer cozy cute recommended chai latte sandwich friend definitely returning
2020-11-11,3,crowded even covid high hope sandwich caprese sandwich good bread crispy fresh cheese tomato ok cheese tomato looked enough balsamic sauce inside appropriate disappointing part amount inner ingredient wasa beef filling veggie meat overall bread flavorful spice olive oil
2020-10-29,5,place absolutely fabulous want coffee served wedding absolutely delicious iced coffee great food great place
2020-10-20,5,best sandwich coffee people never fails yum awesome people even better food shop local coffee
2020-09-23,5,ordered food delivered arrived time delicious mostly impressed fresh tasted
2020-08-22,4,impressed black rail family used third wave coffee shop southern california would measure got cold brew french vanilla cream happy ratio great also ordered lavender lemonade son ended tasting impressed fresh food cooking amazing paired great location nestled nicer neighborhood jersey made fantastic experience kiddos place next time jersey visiting
2020-08-09,5,tried black rail first time today cold brew bacon egg cheese sandwich great staff awesome stopping back soon
2020-07-02,5,wonderful staff relaxed vibe reasonable pricing amazing coffee stellar sandwich rosemary focaccia good look covid-friendly outdoor seating 4 5 table cover building roof also ideal shade protection rain definitely coming back
2020-06-19,4,got iced matchas cold brew tasted great also got turkey jam sandwich really liked combo perfect combination sweet savory would definitely order like great selection different sandwich many coffee place looking forward coming back
2020-06-11,5,nice place nice service good coffee intelligentsia coffee used really good kid like pastry especially muffin know coffee shop existed moved area week ago regular
2020-05-23,1,ordered waiting 1 hour bounced restaurant chownow doordash never got order owner restaurant need get process vendor choice figured able actually retain customer terrible experience never going back ordering maybe deserve go business
2020-02-27,4,wife came coffee quick breakfast start saying coffee delicious s'mores latte special time marshmallow bit graham cracker n't huge fan sandwich though ordered pretentious piggy ham sandwich green apple swiss brie honey dijon hardly dijon sandwich think really would rounded flavor far much brie enough swiss wife sandwich turkey meet jam awesome turkey sandwich fig jam pickled onion baguette coming back sandwich sure looking forward trying others
2020-02-22,4,probably one new go-to quick sandwich coffee joint got turkey meet jam damn good fig jam bread made loved everything sandwich however husband got pretentious piggy think name really poorly made barely meat apple slice supposed dijon mustard maybe gone one bite could taste like used energy making sandwich bomb af got said whatever tasted mine though knowing mine point willing try
2020-02-08,3,establishment fault warning n't come want relax read book work know common activity people coffee place recently place packed mean packed little screaming cry kid entitled parent gone mcdonald probably would quiet relaxing
2020-02-01,5,say wow went low expectation definitely impressed best coffee hoboken got iced chai latte iced hazelnut latte highly recommend
2020-01-21,5,really love cafe coffee good love staff nice make small conversation ube cookie amazing every time go make sure get view nice plenty space sit work small section little child sit child book wish hour longer close 5pm tues fri bummer
2019-11-10,5,love love love coffee shop moved side town summer originally bummed way coffee shop loyalist move away favorite spot bummed staff super friendly definitely know greet regular morning even busy nice selection coffee pregnant trying usually get small cold brew pastry sandwich tasty particular shout avocado toast peanut butter banana toast forget name also super family friendly plenty space-read get stroller leave little patio area-and kid reading area also like local happening notice board fun gluten free option well local baked good thing place great give money tell friend
2019-09-28,5,place total delight goto breakfast spot near height since congress station rip closed food always fresh love simple everything english muffin breakfast sammys cute convenient especially arent mood huge bagel sandwich avo toast feta best breakfast lunch item imo coffee drink wonderful personal fav fresh lemonade sometimes pop grab lemonade decent amount seating indoor outdoor set back road dont feel like ur sitting busy sidewalk like many place hoboken service may get little slow busy totally worth wait place popular family young child
2019-08-28,5,little cafe tucked away front lightrail station truly gem baristas knowledgeable craft wonderful beverage guaranteed delicious everytime selection locally produced snack also quite wonderful food also delicious although wish vegan option huge fan tofu want tofu menu haha lovely snack vegan great go interested lowering waste seperate bin plate composted truly love place plan frequent much feasibly possible
2019-08-17,5,love coffee latte especially almond latte regular morning hot coffee refill much better starbucks wish app order advance morning rush pick would certainly switch daily starbucks run option great breakfast option well
2019-07-26,5,nice little spot western part hoboken nestled underneath residential building buy light rail 8th 9th street oddly first time passed back height union city getting elevator surprised expansive menu breakfast lunch snack specials-they n't coffee know also seen special event saw someone playing music instagram day believe geared towards kid used friendly especially hoboken resident swing drink bite time right small local entertainment
2019-07-24,5,finally got chance go lunch today pleased definitely beaten path hoboken local easily accessible use light rail lunch special grilled chicken pressed ciabatta spinach roasted red pep mozz mango yogurt sauce impressed fresh tasty vibe place laid back open cafe town probably one best place bring laptop work hand quiet cozy feel n't get try coffee plan come back nice knowing good west side option n't always go washington st thank great experience
2019-06-28,5,always pleasure visiting black rail excellent customer service delicious coffee favorite almond milk latte triple shot espresso delicious breakfast sandwich make personal favorite mine perfect way start morning simply enjoy leisurely lunch outdoor patio must try hoboken
2019-05-18,5,omg best chocolate almond croissant ever heaven worth every calorie lol also wasa beef cold brew loved way go
2019-04-28,4,stopped neighborhood based high review clean establishment corner street location ordered latte whole milk came great cup standard frill cup flimsy
2019-04-27,5,boyfriend took walk try latte heard good ordered two medium iced latte almond milk really good perfect flavor bean james amazing mocha incredible glad stopped cold brew also good highly recommend black rail inside small cute great view tree rail road baking mama cooky tried also good love lavender use nearby farm honey ny love milk alternative price decent great place back try
2019-03-18,5,wonderful staff excellent food ambiance place perfect reading studying
2019-02-06,4,great little place nice coffee food surprisingly tasty beef stew great
2019-02-05,5,great staff serving really tasty coffee make alot house good selection healthy fare bit dead spot great train station
2018-11-09,5,transit hub cafe work survived prospered west side town become reliable stop commuter using 9th street light rail well resident passing option simple coffee excellent live long prosper black rail
2018-10-07,4,right light rail station serving good coffee various toast sandwich enjoyed avocado toast taste quite good enjoyed reviewer commented pricey despite fact use paper plate thin slice
2018-07-16,5,excellent coffee coffee shop menu go beyond standard pastry avocado toast selection menu offer variety sweet savory sandwich offering like roast beef turkey fig even pulled pork went cold brew toasted peanut butter banana honey sandwich sandwich also supposed bacon rosemary feeling sweet savory left perla n ordered turkey fig sandwich really enjoyed around 8 9 dollar sandwich came two large half outdoor patio decent amount seating find nice day overall solid neighborhood coffee shop cafe similar spot neck wood might go way return found neighborhood would absolutely go back caffeine wifi lunch fix
2018-05-11,5,cute place super nice staff good coffee great price work area place perfect grab quick breakfast got one breakfast sandwich delicious super cheap
2018-05-09,5,went saturday 3pm great place friendly staff delicious food kind accomodate customizations also offered recommendation solid 5-stars
2018-03-28,3,place ok asian lady rude didnt even say welcome thank bit pricey usually n't care money long people work place act professional courteous paying customer n't care someone bad day shitty attitude
2018-03-26,4,excellent place tucked next hoboken light rail stop son remembers tasty croissant good kombucha tried peach first time excellent croissant buttery flaky n't eaten lunch yet look interesting array sandwich option maybe next time
2017-12-28,4,ya know like place quality food decent coffee service good tip first-time customer circumstance look custodian eye may look friendly attack hurt learned hard way bathroom clean though
2017-11-22,5,love guy western part hoboken n't get much love gem right next light rail hard resist tucked residential building coffee place easily accessed northern entrance exit nj light rail coffee always fresh food option pretty great top notch service always friendly great array flavor milk latte connoisseur great spot brunch avocado toast great breakfast sandwich also great place bring laptop get work done meet friend colleague
2017-11-08,5,really love place best avocado toast neighborhood also intelligentsia coffee really great
2017-10-25,5,favorite cafe hoboken good quick grab go breakfast sandwich jumping light rail next shop besides fantastic coffee food menu all-star time never eaten anything delicious fresh ingredient boyfriend favorite spot sit laptop work hour late day bargain pastry baked good favorite wonderful family business happy support
2017-08-26,5,family friendly cafe small place everything want hot summer day came hubby ordered black iced coffee ordered nitro kombucha perfect iced drink tried kombucha first time loved sweet sour sparkling taste perfect balance also like mini ice cube
2017-08-09,5,place awesome erica far favorite person remembers drink always greets smile always location super convenient price reasonable product get complaint n't open sunday amforced look elsewhere suffer definitely check place hopping light rail work saturday grab coffee outside reading paper
2017-08-02,2,staff nice far one week messed two simple order walk around head cloud n't think pay attention customer ask food overpriced getting thing popping grab something take 15 min make smallest turkey sandwich ever tried still nice want quick anything go pretty much anywhere else hoboken spend time talking people making damn sandwich
2017-07-29,5,sandwich month good dream bad part sad go away since change monthly
2017-07-22,3,came wanted get breakfast food coffee heading shoprite try go shopping hungry end buying lot junk food place look like stereotypical indy coffee shop mix matched chair chalkboard menu intelligentsia coffee iced mocha coffee good though small 450 seems pricey large 650 got egg sausage english muffin oddly pre make wrap foil put warming tray like mcdonald gas station even making constantly minute one cool meat make bun soggy avocado toast looked better based food alone get 1 star almost gave place 2 likely back
2017-06-10,5,work around corner place pas every day today decided stop neat little coffee shop cuz hot day right next light rail ordered small cold-brew ice coffee seat pleasantly surprised ice coffee fantastic small fixin bar side add sugar extra milk drink place really hipster nice beat playing speaker ton outlet plug device chill n't tried food decent menu choose definitely come back place eat maybe even bring friend
2017-05-08,4,great coffee friendly staff nice atmosphere serve intelligentsia coffee taste great usually order biggie small sized iced latte 20 oz pastry sandwich wide variety pastry sandwich available breakfast lunch
2017-04-01,5,boyfriend came taco biggie small sized ice latte almond milk sugar best latte ever n't even almond milk drinker also guy super friendly earth
2017-03-18,4,solid neighborhood coffee spot egg sandwich good early like avocado toast smoked salmon lunch
2016-12-10,5,good sandwich made order pastry choc pain fave cold brew coffee biggie sized owner always pleasant love kid-friendly
2016-12-09,5,love warm holiday drink must try gingerbread latte available limited time taste exactly like gingerbread cookie amazed also friendly place child cute kid book high chair child meal owner staff fantastic enjoy
2016-10-30,5,love everything place avacodo toast absolutely delicious bagel amazing excited explore menu coffee option staff always nice owner kind would go everyday could highly recommend
2016-10-27,4,really good coffee helped pinch delivering box joe cooky
2016-10-26,5,awesome people food special always amazing lavender latte hot chocolate addictive
2016-09-08,5,probably favorite place hoboken get coffee sandwich suggest getting healthier sandwich sourdough cold brew bread always fresh cold brew never earthy bitter also conveniently located next 9th street light rail station great trying find parking hoboken never fun
2016-08-13,5,every coffee food item tried hit folk also super friendly
2016-07-27,5,quiet little place probably one best iced coffee hudson county best iced latte w shot caramel also amazing great find definitely back ca n't beat price either
2016-07-19,5,james black rail coffee kind person restores faith humanity fell light rail track today sprained ankle embarrassing two guy got track helped chair black rail walking back starbucks cup hand nothing like drinking competitor coffee sitting establishment chair purchased nothing james came ask could help heard happened immediately offered bag ice ankle big help noticing drinking ice coffee offered cup house amazing cold brew coffee never found special entirely different bitterness daughter stayed good twenty minute bag ice ankle treated nothing kindness even though n't customer certainly future
2016-06-09,4,coffee good best ever definitely good latte also avocado toast incredible 8 50 two piece toast sliced avocado bit steep lot outdoor seating great
2016-06-08,5,went lunch food amazed got sandwich month strawberry almond brie spinach onion honey kindly replaced turkey avocado outstanding also got avocado toast serve breakfast day avocado red pepper flake lemon feta extra 50 cent also delicious ordered two black iced tea really strong tasty free wifi password nice outdoor seating right light rail would definitely recommend
2016-05-07,5,went gym session today like sandwich hard get sandwich big quality quantity got ham turkey panini husband got healthy one delicious quick service clean quiet polite staff fresh ingredient proper portion stuffed processed meat reasonably priced large green tea water two sandwich 18 dollar back
2016-03-29,5,often work coffee shop happy find place great coffee specialty drink selection addition sandwich delish hot panini type sandwich shop ham sandwich turkey sandwich sometimes lunch feeling whole sandwich great half half deal serve half sandwich soup day far cream broccoli soup flavorful pipping hot perfect windy spring cold winter day definitely back time time
2016-02-27,5,regular cafe kick good atmosphere good coffee good people right next light rail recommend people looking quiet family oriented place good food good coffee
2016-01-29,5,love place great family restaurant amazing coffee coming since three year old one grown love establishment kid corner kid choice amazing
2016-01-25,4,pretty great little stop along commute coming pretty regularly since shortly opened happy every time pre-made breakfast sandwich cheap good morning snack seem like n't sit around long getting snatched n't feel gross grabbing one warming tray made order food good well tasty avocado toast peanut butter banana sandwich fun addition menu well coffee solid chai latte favorite mine lately regular coffee wo n't wrong either right 9th street light rail station well great pop grab quick sandwich coffee waiting train
2015-12-28,5,actually 9th jackson took little find place since location misleading native hobokener followed street address turned back monroe center lost put gps man land finally saw sign followed cafe searching finally arrived stated closing early could make food go understandable one cool fellow manning register coffee another making food seriously awesome vibe menu choice photo knew try avocado toast must absolutely loved walking home finally time taste epic treat first bite uhhhhmazing hint lemon spice red pepper really wake 2 slice already completely full next time definitely trying avocado toast feta lavender hot chocolate fun place coffee great
2015-12-14,5,rare find type establishment life upon finding make wonder lived without black rail type shop make located adjacent 9th street hblr stop black rail perfect spot grab coffee breakfast morning commute since began taking train stop black rail regular part routine coffee bitter burnt latte rival town including favorite downtown shop bean vault set cafe apart food breakfast sandwich strike rare combination pre made yet really really good sausage egg cheese croissant make smile turkey egg swiss perfect change pace last week got avocado toast woke early actually got 5 minute prior train word ridiculous multi grain bread toasted perfectly generous amount sliced avocado red pepper flake add kick oh james one co owner awesome human creating welcoming atmosphere great way kick morning
2015-12-10,4,great people coffee tea along pastry think excellent atmosphere perk would find starbucks matter fact pastry drink better starbucks one regret close way early
2015-12-05,5,one best hidden gem hoboken living hoboken west love finally great coffee shop back town black rail chill vibe delicious beverage great spot set shop bang work
2015-11-13,5,place great offer best coffee right next light rail morning commute
2015-11-09,5,heard many great thing coffee place happy life hype confident become one new regular coffee spots:1 conveniently located jackson 9th hoboken right next light rail station easy place run commute via light rail using elevator hoboken jersey city despite proximity major transit stop still found pretty chill quiet corner fair n't morning rush hour lol 2 got americano boyfriend got french vanilla latte mine pretty good boyfriend loved order say lot much particular coffee also got raspberry kouign almond croissant chocopain exciting one favorite bakery also sandwich salad breakfast even kid menu addition pastry 3 also appreciate stock healthier chip option granola etc even bowl sample granola carry mean n't love free sample 4 environment cafe nice like natural lighting amount seating indoors outdoors outlet availability decor wish seat little comfortable n't bad either combo great coffee favorite pastry easy access right alley ca n't wait head back soon
2015-10-02,5,lovely cafe never crowded use intelligentsia coffee espresso drink good sandwich best love healthier sandwich delicious good
2015-08-31,5,drip coffee served seriously smooth delicious walk extra block shop instead laughable competition nearby always quick friendly unlike maroon suck
2015-08-23,5,first time going coffee shopp great staff great sandwich great cold brew coffee cool space n great location
2015-07-18,5,good coffee nice service ready-to-go breakfast sandwich hot tray super tasty convenient definitely go back try stuff
2015-07-14,4,baked good good croissant great coffee always fresh downside little expensive coffee danish staff always nice
2015-06-10,4,space great location kinda weird unless take light rail lot overall really enjoyed coming joint get work everytime ive gone space free wi-fi service solid enjoy cold brew strong good solid flavor would definitely recommend place worth checking wish stayed open little later still great place go
2015-06-03,5,place still rockin great sandwich sweet course coffee comfortable hang friendly owner serve smile
2015-05-26,5,definitely best coffee shop hoboken intelligentsia coffee better anything else served hoboken also great assortment quality pastry well breakfast lunch sandwich try lunch sandwich legit owner really awesome people take time get know customer neighbor put lot love everything done awesome job creating great vibe unique shop
