date,rating,review
2015-05-17,5,husband moved metro stop black rail come every weekend husband grab lunch week working home first came suggested try slow brewed ice coffee took word amazing strong taste almost like tea bagel pretty good coming people grew new york bagel husband raf sandwich 1 year anniversary gave homemade notorious big cooky friendly warm vibe wish continued success
2015-05-13,3,might go back make another assessment good sign serve intelligensia coffee however house blend par blend intelligensia coffee make critique establishment however friend ordered latte milky lot place skimp coffee make much milk like steamer little bit coffee place nice condominium around bend building cute good pastry go back make another assessment
2015-04-13,5,dream cold brew good simple syrup place serve iced coffee n't offer sweetener option never understand owner super friendly service great breakfast sandwich
2015-04-08,5,anyone complaining price clearly n't tasted quality food drink b n't live around hoboken mean seriously town entire ny metro expensive c need go dunkin donut remember people get pay local coffee shop full unique flair special touch discerning eye catch appreciate james one two owner brother sister team love going estate sale finding unique piece including huge mirror lunch menu trust reason place highly rated ignore couple detractor bitter price guarantee nothing bitter coffee great care love go food drink service place everyone really know name go go often support local business one deserves
2015-03-20,3,need lower price got iced coffee cupcake almost 10 price expecting miracle coffee instead ok cupcake good would go back price go
2015-03-08,4,excellent coffee pastry nice place read book sit waiting light rail customize type milk want soy almond etc con little pricey
2015-03-01,5,jcheights resident hoboken resident great place hang sucker good quality coffee even bigger city girl come finding good coffee shop vibe place great cold brew decent cup hot coffee plenty snack treat nosh well sandwich staff truly care customer listen really understand clientele place kid friendly child book welcoming meet friend perfect u want place laptop read good book alone came frequented first opened elevator ride away live jcheights even though ca n't go often daisy james still remember name friendly always accommodating matter busy get make want come back great addition community look forward part continued growth
2015-02-28,5,big fan black rail coffee west side hoboken long needed great coffee place black rail welcome addition staff friendly facility bright wifi strong coffee food snack option delicious thing must try cold brew coffee healthier sandwich outstanding great place get work done week never crowded grab coffee friend
2015-02-28,5,love place great service food decent price coffee great kid love oatmeal comfortable take lunch read kid book watch train go new favorite hoboken
2015-02-28,5,love guy rock best tea hot chocolate town thank-you taking care bos know safe hand zoned work lol
2015-02-27,4,awesome owner atmosphere coffee distinct delicious go cold brew iced coffee taste better without milk sugar food good wifi seems best hoboken coffee shop visited seating area spacious modern comfortable great place get fueled getting thing done
2015-02-27,5,wonderful addition neighborhood cold brew amazing great year long food really good well awesome sit enjoy coffee comfortable setting go time
2015-02-25,5,love place cozy staff friendly iced coffee outstanding warning stuff like rocket fuel
2015-02-20,5,great ambience relaxing great food great coffee
2015-02-18,5,may season cold brew awesome owner james daisy nice caring make visiting black rail really great experience
2015-02-17,5,n't drink coffee often prefer black rail best coffee hoboken
2015-02-09,4,important note 800 jackson st 4th 5th st yelp map indicates actually located right outside 9th st light rail stop hoboken convenient pit stop right light rail big enough size table sit enjoy coffee snack either wait relax riding train stopped get cold brew even though 20 degree outside good worth think fully transitioned iced coffee cold brew breakfast lunch menu well n't anything eat visited also cooky biscotti goody choose looked tasty friendly staff area lot new shop restaurant popping doubt great addition well worth stopping great coffee
2015-01-08,4,top notch coffee love cold brew excellent sandwich soup favorite healthier sandwich glad place convenient light rail highly recommended
2014-11-03,5,forget starbucks dunkin donut try place owner james daisy jung super nice outgoing coffee good try one pumpkin pie latte good even better dunkin donut good muffin never sandwich hope try usually stop way ferry port imperial light rail highly recommended
2014-11-01,5,daily black rail large iced coffee sustained 2 week paternity leave summer latte espresso top knotch friendly welcoming atmosphere indoor seating spacious comfortable large patio area front owner experienced show consistent service drink food awesome desperately needed addition neighborhood highlight best iced coffee hoboken par mod cup jcbreakfast sausage egg cheese sandwichespretentious piggy sandwich ham brie apple dijon spinach grilled sourdough bread
2014-10-21,5,came sorta big order black rail friendly attentive everyone enjoyed coffee sandwich thanks black rail
2014-10-13,5,spot great hidden gem boken try pretentious pig sandwich menu ham brie spinach apple dijon pick lunch
2014-10-02,5,love black rail completely addicted cappuccino iced green tea daisy james fantastic super welcome addition neighborhood
2014-09-30,5,seriously amazing place delicous stop many time work latte organic milk cold brew healthier sandwich tried far amazing place really chill ca n't wait next shift work pas
2014-09-29,4,love place pastry best around always get sandwich caprese always exquisite perfect blend flavor amazing mozzarella real basil delightful balsamic vinegar promotion good change every week staff spectacular friendliest people love daisy james always make time br happy salad would give five star
2014-09-28,5,favorite coffee spot town call oasis staff friendly welcoming coffee delicious serve tasty variety pastry sandwich snack also love ambience whether sitting spacious indoor area taking fresh air one outdoor table recommend place everyone know area
2014-09-13,5,great addition great coffee lovely customer service like coffee shop mixed cheer everyone know name well daisy brother anyway
2014-09-10,5,great family-owned shop daisy james really make feel home coffee wonderful sandwich offering
2014-08-20,5,great little spot right building always friendly give discount building resident make mean cappuccino wish opened earlier real complaint cold brew crack worthy partnered chocopain croissant become go-to breakfast
2014-08-01,5,great coffee cold warm brew delicious sandwich friendly service atmosphere inside make great place catch friend informal business meeting free wifi offered also make joint ideal location get work done highly recommend
2014-07-26,5,great little coffee shop im duncan donut girl time kill stopped grabbed cafe americano reasonable price friendly staff good hot cup coffee nice little sitting area outside back next time area
2014-07-25,4,black rail new unique coffee shop located step away 9th street light rail station fresh quality coffee always welcome neighborhood well comfortable space relax enjoy purchase decor modern 70 kind way furniture spaced well cramped black rail latte many coffee fan demand well modest selection fresh pastry made-to-order healthy sandwich although sandwich tad pricey include chip good thing mention include selection cold drink including ice-brewed coffee outdoor seating shade suggestion box actually plan use helpful important business run really nice people like converse make experience pleasant one check
2014-07-14,4,complaint baristas perfectly pleasant ordered rather large iced coffee affectionately referred size biggie small tasty muffin retreated outdoor table popped laptop proceeded work hour fast wi-fi located step light rail people watching became ancillary perk massive construction project next door much slow bar five star
2014-07-14,5,love vibe place feel like friend house coffee set friendly staff coffee great iced coffee def worth 4 say shocked price first understand staff explained smooth sweeter usually take coffee milk sugar drink black want spend 4 iced coffee seen staff get yelled price quality coffee shop price cold brew iced coffee sandwich amazing favorite either turkey meet ham healthier sandwich cute name take little 4 minute prepare recycle need hand ask recycle whatever n't leave bin concerned people throw trash pro con also suggestion jar show really value customer opinion love glad neighborhood
2014-07-05,4,great addition neighborhood also right next lightrail enjoy cup waiting train take one ride friendly staff good tasty coffee frequenting quite often
2014-07-03,3,usual spot maroon place opened 2 block building thought would nice switch 5 star convenience especially proximity light rail wow coffee taste worth 14 later n't joyed coffee however thought chocolate chip scone great
2014-06-28,5,think found new favorite coffee shop free muffin large latte stuff actually good yes n't wonder cranberry orange muffin fave friendly staff yeay conveniently located right front 9th st congress lightrail hoboken anyone go place also quick prompt
2014-06-26,1,kidding 4 25 iced coffee large medium 16oz anyone standard 20 oz coffee starbucks le rip wont go back
2014-06-09,4,finally longing good coffee near apartment within walking distance live right black rail always either take light rail washington walk 15 minute coffee smooth fragrant delicious food wise see still working menu sandwich test mood speak either way sandwich tasty take time prepare wish breakfast sandwich available readily feeling soon great service almost feel like friend place coffee casual comfortable vibe
2014-06-09,5,seriously loving place think might make default latte spot passed decided try place modern feel open bright spacious plenty seating available see people n't flocking yet hot weather went iced latte vanilla soy milk let tell n't water 5 minute taste delicious one pastry worth cheating diet 3 pm pastry 50 yet try sandwich update also area leave suggestion service coffee neat show value opinion customer
2014-05-10,5,said say welcome addition neighborhood little corner hoboken desperate need quality coffee shop one pretty classic coffee drinker hand cup strong drip coffee happy camper bean black rail using wonderfully flavorful great complexity pastry also incredibly delicious looking forward next time around lunch time give one sandwich try always sound good service friendly think guy great thing going wish lot success
2014-05-09,5,great coffee sandwich pastry friendly staff lovely ambiance
