date,rating,review
2015-03-24,5,phenomenal pizza meaning come since moved hoboken year back somehow made first time past weekend ca n't go wrong pizza menu ordered assortment including la rom pancetta tomato basil hudson remember name pizza one mushroom one honey mascarpone breakfast pizza maple butter bacon egg excellent though n't know order breakfast one love runny egg pizza maple little rich heavy ordered salad literally green plate green like homemade micro green liked waiter seemed new service fine perk byo outdoor courtyard back would great summer also bought dough making pizza home came great love place exists hoboken given general lack good pizza surprisingly dozzinos definitely rival robertas great pizza place city
2015-03-10,4,place truly stand lack good pizza hoboken dozzino traditional italian style pizza came friday night pretty crowded front room back room felt little drafty back room byob allows warm nice glass wine special night rice ball must admit good zero taste presentation nice nice touch lack taste appetizer quickly made pizza came super fresh piping hot flavorful ordered plain pizza boyfriend one egg spinach see menu plenty unique option choose definitely returning future
2015-02-21,3,favorite pizza town favorite pizza restaurant honor go johnny pepperoni dozzino pizza really outstanding high quality ingredient interesting combination perfectly cooked staff bit stand-offish though item get put pizza oven sometimes big
2015-02-02,3,really good pizza great variety chose byob good however order rice ball 12 tiny crusty ball basically rice microscopic meat miniscule cheese sent back kidding also order side sauce dipping come ice cold stove sauce crushed tomato seriously get stove microwave restaurant care hippie wood fired pizza oven go back pizza cold outside sit near big glass door freezing
2015-01-30,3,great pizza unique pizza would give four star margherita favorite however bean salad green salad uneatable bean salad undercooked bean green salad underwhelming washed lettuce green could ok great green great dressing n't like dressing either pizza however great fresh homemade mutz perfect equally fresh homemade tomato sauce love wood oven stove applied thicker deep dish-like crust greasy creating fluffy deep dish pizza make sense
2015-01-24,1,decent pizza wayyyyy overpriced even expensive since came new menu worker eat regular menu double price wanna-be hipster pizzeria brooklyn pizza place hoboken back end town get lost lot customer due serve food normal price get real people
2015-01-23,1,parent beware staff rude 3 time tried go seated due child 5 7 tow n't exactly consider issue food decent overpriced staff unattentive mind went early disturb single food enough ever draw mention leave watch window crank onto sidewalk
2015-01-19,1,live within block place naturally think would tried food however turned away 3 time therefore made mission never step foot place stopped friend friday night 9:30 manager rudely turned u away even though open table excuse policy weekend night hoboken really fact jerk really pissed sunday afternoon church tried stopping bite light music playing door locked owner clearly saw u rudely waved u n't even come door side note walk place everyday basement cellar flooded several foot nasty sewage water icing cake never give dollar money b try spread word yelp friend persuade spend hard earned money establishment actually appreciative dont go
2015-01-17,3,walked order pizza 9:30 gentleman told place close 9 full resturant turned looked corrected said mean kitchen close beware open 11pm
2014-12-26,5,absolutely hand best pizza around although never sit dine say pizza place waldrof astoria sit wine dine food always fresh delicious customer service always fine long day work people want go home relax eat pizza
2014-12-18,1,update n't think ever returning unless someone visiting request go specifically last night worst experience ever food excellent felt like bother staff never case simple evening 4 girl arriving 8:45 quick dinner drink 1 table front room 2 people back large party server still asks friend arrived bit earlier u sit bar wait rest party arrive soul restaurant rushed ordering process 2 crostinis seem get smaller smaller price 4 pizza share eat leisurely sip beer 10:00 dot staff done turned pleasant christmas music started playing youtube video vintage doubt chili pepper blaring light conversation drink light turned clearly last one place simple hey guy closing soon could sufficed instead basically making u feel like unwelcome wasting staff precious closing time get worked want go home still business need maintain easy party 4 deserve top claimed could split bill could use one credit card split bill 2 multiple time friend worked bar year called bullshit quite kindly server got defensive said wan na see system hard friend contested claiming really issue knew could done every staff member fighting friend kept insisting still leaving great tip 90 bill issue null wish could write owner doubt really give shit n't go unless desperate decent pizza n't mind ignored belittled rushed
2014-12-05,4,n't know much pizza let alone artisanal pizza skeptical cautiously optimistic ventured dozzino relaxing massage near-by space relatively small approximately 10 table big small high ceiling modern finishing give artisan feel greeted informally shop owner simply waved general direction would sit cool school apparently chose brushetta tomato basil dino tomato mortadella pizza nutella bread pudding favorite definitely pizza dough thin thick fresh sauce meat could n't beat rhyming completely unintentional make smile brushetta fresh probably would n't get taste almost much like home made one chopped tomato olive oil basil dried bread paying 5 felt excessive bread pudding dessert disappointing taste nutella flavor sat mini cast iron soaked melted butter even 6 month pregnant could n't justify calorie dish worth calorie bottom line come good pizza skip appetizer dessert easy dining without sacrificing quality decor
2014-12-04,5,going go ahead say favorite pizza hoboken n't take-out price feel like n't get whole lot food multiple time always want come back especially good byob aka cheaper ingredient always fresh went late night run bunch pizza never freeze anything n't annoyed fresh ingredient always better love pie pickled red onion favorite among friend ever changing list special never fail delight taste bud esp like white bean crostini
2014-12-01,1,wish could give dozzino zero star boyfriend went sunday thanksgiving quick pizza bragging awesome place thought dozzino get one table leave one else restauant thinking would big deal sit communal table went sit rudely told needed sit two person okay fine ignored someone came plate glass wine key stupid actually thought would open wine wrong asked salad yeah none okay fine sunday thanksgiving give pizza order yelling four men standing around one actually came table kidding pizza come fine one person came see needed anything continued stand around making coffee play cell phone also screaming soccer match uncomfortable rushed meal boxed up-when asked box putting rudest worst experience ever restaurant didnt go johnny pepperoni one place fault never go back believe raving place waste time
2014-11-17,3,favorite pizza town lack topping cheese number one complaint terrible though know people enjoy may worth time give shot
2014-11-17,1,pizza fine owner horrible genuinely rude nasty staff well customer thick skin generally n't bother much however case obnoxious enough write bad review stop going
2014-11-09,1,worst experience hosting party mediocre best pizza place owner marc know run restaurant handle private party completely ordered food party one manage party day fact party arrived knew n't enough food nothing expect demand pay service n't provided even run pizza pizza place clearly could n't handle party party opinion wait staff incompetent complete disaster even worse food little made gross inedible pasta roasted tomato freshly prepared instead tasted like ragu store bought sauce embarrassed dozzino handled party many guest left early food embarrassment living hoboken local many year shocking place still business turn convos many people afterwards dozzino lot problem running food poorly managed party past wish knew made mistake trusting party n't waste time money place
2014-10-29,5,place pretty much nail every time front pizza incredible done service-friendly cool accommodating done family friendly massive chalk board wall minute fun 5 year old take get awesome back yard bocci ball sold love coming parking towards back hoboken n't make want kill open height guy come
2014-10-07,5,amazing food atmosphere right staff friendly perfect friend looking byob hoboken chill atmosphere
2014-09-27,1,food pretty good service terrible server rude inattentive also accept one credit card per table fine advertise commented server told say website helpful happily get take return restaurant
2014-09-24,5,great pizza mascarpone honey pizza one best ever byob awesome great outside seating warm
2014-09-16,4,friend neighborhood wanted pizza came early dinner love natural light coming window simple rustic look restaurant sat outdoor area felt like sitting back yard service actually good day dropped waiter took time go item menu gave u recommendation decided spilt cheech2 diavola pizza spicy kick thought pretty good nice laid back place pizza byob establishment even better
2014-09-14,4,attended engagement party last night probably n't best review typical night whatever staff really nice place reasonably clean food good solid comfort food complaint outdoor seating basic easy going nice space able turn large amount good food quickly party 100 people even keel food hitting table
2014-09-09,5,fan small pizza place really make work best pizza area ingredient fresh place nice date going small group friend staff owner friendly
2014-09-06,1,visiting twice overall decent pizza decided return relative california 9:30 friday night approached waiter behind counter informed u longer seating people kitchen closed explained waiter would order currently sitting guest regular relative excited try pizza continued keep ground denied u service never heard restaurant lively area 1 closing kitchen 9:30pm friday night2 denying type business3 accommodating frequent guest ready order even entering pizzeriayou pizza establishment town filled young professional family n't like cook area restaurant pub dime dozen restaurant business depends local extend hour cater guest get ingredient need satisfy demand polish service attitude one mile across river manhattan pizzeria attitude standard would n't last month pizza best hoboken establishment fun quaint potential unfortunately attitude n't good luck-marco trapoje
2014-08-26,4,changed rating 1 star rant 4 star ca n't stay mad place delicious pizza great place yob place gem u live west hoboken would like make walk washington st gave beer enjoy waited pick order ready however comparable artisanal pizza place dozzino manhattan even gave food dollar pizza weee bit tiny
2014-08-20,2,pizza place amazing take away far food go get much better however service bad get tonight 4 u ate well however finished meal asked dessert waiter tattoo buzzed hair side could rude spent money 4 pizza asked dessert came attitude told u kitchen closed close kitchen even tell current customer worst part said terrible attitude honestly ruined dinner thought great shame arguably best pizza place hoboken service bad
2014-08-19,2,pizza reminds would get pizza hut domino always guess pizza dozzino party event distinct look taste greasy oily ordering order elsewhere huge fan
2014-08-18,3,4 star food 2 star service live street dozzino 4 time tried new pizza every time time enjoyed food crust sauce cheese excellent time food came perfect temperature consistently good quality price pretty fair pizza although last time ordered bowl ice cream dessert seemed bit high 8 service consistently poor inattentive always find someone get check last time put pile plate random number napkin 2 fork 4 people u set table first trip friend one eating 4 5 guy worked loudly swearing behaving like idiot guess also young-ish dude thought cool talk like bunch meatheads locker room eat owner people working would act professional
2014-08-02,3,nice place food great enjoyable eat backyard summer
2014-07-30,5,husband frequent love food rehearsal dinner night wedding entire restaurant amazing guy work super helpful friendly owner easy nice work overall quality food service ambiance perfect everyone talking much fun nice dozzinos pleased
2014-06-25,3,great spot grab pizza friend love outdoor area clearly winning quality would love rave pizza service better tried bianco uberto dino bianco excellent fresh flaky yummy two okay pretty similar many option meat lover n't eat pork byob closed monday
2014-06-15,5,best pizza fresh ingredient make practically anything want ingredient amazing margarita even amazing kale pizza prosciutto fresh local ingredient make difference ordered native strawberry whipped cream dessert one best place hoboken hand best part byob
2014-06-10,1,ordered pizza takeout weekend service quick wait maybe 5 min everything else wait time decor place bad price increased bothered update website pizza burned consistently burned seen review way overpriced portion small limited topping salami tasted weird dough chewy say sure even domino pizza better sure item menu would never go pizza wish better neighborhood pizzeria hoboken
2014-06-01,1,pro con terrible serviceoverpricedburnt pizzasmall portion save time money
2014-06-01,1,small pizza way overpriced size quality number amazing spot priced similarly quality ingredient fancy oven get much money importantly service poor disinterested polite n't get wrong worked restaurant business year know annoying customer suggesting guy roll red carpet come pay attention customer n't need fake smile know n't applebee like privilege u spending 200 meal byob go get 6 pack corner walk back offer u opener ask need glass knife etc come table check see go ask instead watching tv lame wo n't return ever maybe launder money front yeah le customer better
2014-05-21,5,5 star review justified excellent food timely quality ingredient well worth wait wont able get anything close elsewhere
2014-05-19,4,wait terrible kick pizza quickly efficiently try bruschetta fantastic give green plate know aspargus would favorite list ever pizza need topping cheese bianca far sauce lacking la pizza properly topped group ordered 8 almost far much crust crust left 4-5 inch topping space good amount space might make case ordered many rush really matter form pie properly would however five star affair mean byob thats almost 3 star
2014-05-03,2,pro byob cute decor backyard patio avail weather good like pizza toppingscons-pizza slightly burnt called ahead ask tv would willing put net play game night said yes however got refused turn tv even sound woulda gone elsewhere night knew gave u hard time splitting credit card 2 people poor attitude towards customer overall
2014-04-26,5,pizza delivered n't comment service say delivery service quick also nice delivered jch pizza fresh still warm incredibly delicious arrived
2014-04-24,4,girlfriend went last tuesday 4 15 deep dish pie seen via instagram wanted try wait two three week say without doubt worth wait came perfect ca n't wait go back try one pizza even go pig roast look like great place get friend together play bocce ball pizza chill back yard
2014-04-11,5,truly shocked bad review service thing simple byob pizza place set casual atmosphere enough upscale finish make great date night maybe nice atmosphere cause people expect service fine-dining restaurant still pizza place good one worked server many year usually stickler poor service never problem dozzinos love somewhat casual set bottle tap table wine glass water glass serve wine trattorias overseas waiter wear simple tshirt jean usually cozy comfortable atmosphere make feel like right home get busy weekend definitely aim weeknight want seated right away n't fooled one-starrers reviewer seem uptight leaving one star could n't specialize pie way precise way prefer want something specific go home cook come restaurant leaving palette choice chef preparing food would trust guy back dozzinos promise wo n't disappointed seriously go try pizza favorite pizza place ever favorite restaurant hoboken pizza good combo crunchy doughy ingredient bursting flavor source produce locally pesto crostinis always taste fresh always get two order prosciutto fior di latte cheese unique creamy salty little tang way mozzarella favorite pie tomato followed diavola need like spicy one tried specialty menu always return two favorite used live around block frequented dozzinos 1-2 time month dozen time naysayer yes salad always one dessert usually stay week could care le delicious every time think one occasion skimp topping towards end night since know ingredient always super fresh sometimes sacrifice restaurant make order much waste end day overall skip dozzinos poor review go open mind experience
2014-03-29,5,lived hoboken two half year recently moved dream place amazing thin crust pizza ever try everything made fresh bring alcohol best part laid back feel friendly staff
2014-02-11,5,always fresh ingredient place phenomenal best food life best part byob
2014-02-09,2,went night ordered black menu never informed 18 buck black menu pizza n't written anywhere personal size pizza service fine nothing spectacular would say pizza price might right 7 buck 18 buck think mushroom pizza ordered skimpy mushroom get entree amanda amount extra large pizza napoli reminds need write review napoli
2014-02-06,5,several time admit whenever craving pizza dozzino come mind everything deliciously unique dough homemade foir di latte exquisitely fresh ingredient work normal restaurant yea may run topping freezer may even run dough make fresh daily anyone whose ever biz know good thing glutton free diet maybe food allergy n't wan na pay little extra freshness quality maybe however appreciate high end artisanal pizza comfortable cozy casual atmosphere highly recommend dozzino
2014-01-10,1,rundown go kidsdo go unless want dinner 5 minute tell get outdo go n't want good foodworst customer service ever
2014-01-09,4,usually roll eye see insert name new pizza place coming soon empty store front window hoboken dozzino relatively new pizza place stand rest hoboken much needed cool spot town bocce ball court cafe string light back yard solid music hip hop jazz crooner etc young hip staff simple rustic interior includes reclaimed wood table chalkboard menu delicious wood-fired pizza great quality ingredient standard pizza good drunk hoboken ahem 7 star basile bona etc whose mozzarella peperoni come plastic bag dozzino make fior di latte dough charcuterie topping point dough salty pillowy ca n't go wrong diavola la rom style pizza mascarpone nutella crostinisquick seating always get seated 15 minute le probably beaten path lastly addressing complaint service probably 10 time yes sometimes run certain thing could probably work took star away review always ended pizza table food belly show regarding rude service think people little sensitive casual pizza restaurant per se one expect server roll red carpet service usually prompt friendly enough one ever flat rude personally n't like need overly fake smiley server asking everything good every 15 minute everyone need stop complaining thankful least one cool place hoboken
2013-12-09,1,worst customer service experienced life many thing went wrong night highlight were:1 work around people food allergy someone party lactose allergy could n't eat pizza ak cheese unless pizza already said cheese would n't even put extra ingredient dry pizza got even though would pay extra n't part presented menu example since basically getting bread asked could put tomato said waiter said n't allowed 2 several people ordered spinach artichoke pizza two three got artichoke pizza pizza arrive spinach top artichoke called waiter see could put artichoke supposed spinach artichoke pizza said allowed called owner manager said could n't anything lack artichoke make mix morning mix placed atop pizza sometimes get artichoke sometimes n't feel free burst laughing named spinach pizza lucky may experience tiny artichoke bit expressed feeling namely ridiculous proceeded get agitated talking vision n't understand vision yelled u 3 disappointing experience paid bill left tip still end waiter fault left 15 tip owner came back complete exact change leaving granted maybe thought wanted change really felt like slap face n't want anything never visiting place oh top food bland bland make better pizza dough even baked wood fire cheese tasty end
2013-12-08,4,visit pretty clear deserves 4th star n't think ever understand salad always lettuce vinaigrette nothing else two year special crostini always garbanzo beam garlic place make killer pizza recent favorite white pizza brussels sprout red onion crumbled prosciutto always satisfying diavola slightly spicy salami
2013-12-08,4,pretty awesome place love trendy honest feel eating feel like apart something limited freshly made pizza dough variation rotating seasonal topping left impression experiencing someone culinary hobby beginning restauranteur passion look forward getting back eating seeing else guy pull together
2013-12-02,3,gave three star pizza good diavolo pizza great however everything else restaurant ok menu gave u filthy print out piece paper fine leftover crumb pizza oil n't even want touch also n't ice wanted drink know ingredient fresh maybe investing freezer would n't crazy idea since restaurant
2013-11-16,5,say place putting pizza fine anything found garden state rival best ny offer pie definitely pay homage naples clearly adhere vpn dogma using wood burning oven gas assist appear getting slightly longer bake pie prevents abundance moisture pooling center thus pizza eaten hand fork knife affair like vera pizza napoletana cornice pie puffy pliant irregular crumb artisan bread topping super fresh applied deft hand fact remind roberta nyc term understanding ingredient combo defy convention always coalesce nicely finished product also recommend splurging ordering least one pizza riserva menu ali pizza 18 00 use premium ingredient pizza larger pie house menu johnny bismarck fior di latte tomato prosciutto runny egg outstanding salumi sourced salumeria biellese opinion make best charcuterie country general ownership cultivated experience slightly iconoclastic built place reflects solely predilection music played pop ramen dinner bocce ball court back inferiority complex want come hang enjoy good food welcome n't like n't let door hit as way thus service respectful little aloof one kissing as dozzino expect debt appreciation patronage suggest save trouble look danny meyer restaurant nyc skip pizza evening bottom line dozzino pizza joint cool space terrific product touch attitude go get
2013-11-14,5,almost n't want secret get place pizza amazing byob price average atmosphere nice outdoor bocce court seating behind restaurant warmer weather service also good one negative thing get bit loud time especially larger group enjoyed little much byob aspect sometimes bit wait definitely return often restaurant though
2013-11-07,5,opinion best hoboken offer small privately owned business produce great food fantastically laid back atmosphere spinach artichoke pizza diavola pizza amazing bocce area outside nobody turn dozz-nuts thing fantastic time even though change topping every night live hoboken spent time going chain sport bar mediocre mexican sushi greek restaurant need come try genuinely great food
2013-10-23,5,favorite pizza area far nyc hoboken jc concerned n't get better excellent menu incredibly fresh ingredient service always friendly fast price reasonable plus byo keep cost drink reasonable level dessert excellent well get crowded sometimes run pizza really testament incredible food advice go weeknight show early weekend place missed
2013-10-16,3,really like restaurant want like even 1 parking bitch guess ca n't helped 2 weird habit hour went thursday night month ago hub decided go saturday called 1 said private party people invited come 5pm went 5:30pm turned u away may ran dough oh totally normal pizza place run dough husband nearly went crazy 3 bit expensive compared brick oven pizza place hoboken jersey city n't overpriced like franny check review ouch
2013-10-14,1,bad pizza told u big pizza personal pizza wo n't recommend
2013-10-05,1,went dozzino tonight friend lovely evening hoboken food really wonderful server great arrived late lot item sold expected came time dessert another server original white t-shirt tattoo came told u kitchen closed already spent 80 dinner basically kicked husband 20 year restaurant experience u pleasure eating amazing restaurant new york los angeles paris london among others first time ever restaurant basically close alerting u kitchen closing might want order dessert understand server might want finish people tired allow table sit responsibility restaurant honor agreement evening anything le pathetic
2013-09-27,3,eaten dozzino excited return last week diavolo pizza spicy delicious byob got bocce outside like welllll number thing like turn server took least 20 minute take order night busy table came served first also hunt get check end night bocce ball mia pizza delicious always reason still giving restaurant three star mixed green salad though dressed well salad know definition salad includes one ingredient salad lettuce plate 7 hugely disappointing overall
