date,rating,review
2012-09-09,5,"serious food go dozzino food delicious people run place serious food consider foodie food critic etc u dozzino fan favor stay home dozzino restaurant serf simple fresh food salumi plate would get italy salumi bread rubbed garlic cheese drizzle balsamic salumi want thing go tutta pasta place want free food n't think dish ordered thought would exactly described menu maybe applebee kind place crave serious frill absolutely fresh delicious meal prima donna go dozzino 2012-08-30,5 best pizza hobo lot local seasonal ingredient awesome crust great char massive stove patio icing cake around great spot awesome value 2012-08-27,4 dozzino one favorite local meal although n't start way ingredient made daily use local produce specialty import italy freshness show every bite flavorful whether one plain specialty pizza crostinis caprese appetizer meat plate even nutella based dessert done fresh flavorful original mindset involved one caveat freshness well possible run dough tomato grape particularly ingredient frequent customer since opened le 2 year ago told dough two separate occasion least 20 meal first appalled pizza place ran dough n't capitalist society n't want make money somewhere along thought process grew respect dozzinos importantly found craving pizza favorite spot relatively inexpensive meal girlfriend larger group ive part group 4-12 dozzino always hospitable byob sure pick wine beer beforehand recommend going 3-5 good friend eating family style ordering different pie apps dessert sharing personal food recommendation appetizer meat plate brushetta caprese specialspizza spinach diavola la pizza plain dessert nutella pizza gelato nutella marscarpone n't ask ice 2012-08-27,1 one worst dining experience life would never go back place like episode restaurant impossible big group pizza n't topping order told waiter said could n't anything said owner would talk u 20 minute owner n't come inquired owner came n't say sorry try make thing right instead defended food basically said make argued u like think god gift pizza soup nazi something say pizza topping two pizza n't customer complain say sorry let fix instead basically say wrong arguing take pizza bill done first place instead ruining dinner arguing u giving u excuse right wrong 8 people never go yelp review pizza crust decent topping extremely skimpy even neopolitan pizza eat quite often save money evening go elsewhere want excellent neopolitan pizza dozen place manhattan much better food service motorino keste would near top list hope guy change attitude realizes running restaurant temple people come worship creation pretty unlikely 2012-08-17,5 husband love dozzinos often take friend town eat dinner atmosphere laid back patio great nice day pizza really good usually order one per person share love byob save money great place 30 something crowd 2012-08-07,5 finally get update review first time came group told ran pizza time smart enough get dozzino nice early friend birthday celebration tried whole bunch thing menu begin crostinis wonderful starter tomato bruschetta nicely dressed could eaten alone spesto crostini lot great flavor going n't eat pizza meat heard rave review diavola k spicy salami pizza also regular salami n't like spice white pizza favorite salty creamy hint sweetness time spinach artichoke pizza great roasted garlic pizza course regular ol slice comfort italian ca n't live without let forget dessert crostini nutella mascarpone cheese simple effective great food birthday toast made toast toast throw extra cheesy line review roll today also overtired basically boyb great staff bocce ball outdoor seating affordable delicious food 5-star review made 2012-07-29,5 best pizza hoboken fresh ingredient great environment byob service little iffy food outside seating make 2012-07-25,1 walked said 3 min table waited 35 ordered salad crostini pizza finished crostini salad pizza taking ordered another crostini got crostini finished waiter asked u done told ordered pizza checking told u dough look like heading elsewhere two half hour later try find dinner 10:45 come man 2012-07-12,5 excellent find block west washington parking readily available look simple outside nice inside lot light daytime eating huge brick oven smell great front area spacious kitchen seperates front back back long table designed family style gathering buddy birthday back reserved serving bite proscutto cheese tomatoe great came pizza great pizza nothing like fresh oven pizza byob oh yeah bocci ball court back large outdoor eating area lovely place back 2012-06-12,1 begin sat dirty table n't given water 20 minute god forbid ask silverware open wine went pay check literally n't cash change waitstaff rude acted u favor gracing u presence pizza decent nothing earth shattering doubt returning 2012-06-09,2 place open since late 2010 think stuff together nope walking encountered chicken running around head cut stood bar five minute girl behind bar dealt customer asked u anyone helped u yet um n't hostess seated half hour ask order food pretty good one prosciutto crostini one diavola pizza one special pizza two people staff inattentive ask cup plate utensil also fetched napkin stand nearby opened wine bottle waiting bar hostess busy dealing customer seems like staff member simultaneously hosting waiting table busing big place maybe staff seemed flustered constantly apologizing n't care run glass seriously first time happened probably n't buy glass next time improve dish washing process n't offer customer styrofoam cup seems like serious management issue need resolved 2012-06-05,4 love neapolitan style pizza place legit ingredient fresh best quality creative flavor meat cheese far neapolitan characteristic bit lenient please american expectation without jeopardizing neapolitan style center pizza extremely wet definitely pick slice crust flavorful char show benefit wood burning oven one bite bland spicy meant spicy sauce n't color hosted party february marc crew hospitable made sure everyone great time space great ebb flow raw space theme plenty seating great outdoor space bottom line every neapolitan style joint since compared dozzino ca n't wait go back tip check tumblr twitter make sure hosting private event n't hate show food good 2012-06-05,5 love place everything great food good service good delivery good even wait time usually bad even busy night 2012-06-04,4 pizza great ingredient local fresh fresh often run essential homemade dough n't store freezer dough made fresh daily dough light fluffy cheese produce meat top quality one pizza say eat without feeling morbidly obese size personal style european crostini ok atmosphere laid back space nice outdoor seating nice complete bocce ball court one favorite perk byo complaint frequency run key stuff think everytime run something pizza place running dough pretty unacceptable irritating fairly new hopefully make adjustment fix 2012-06-01,4 bocci back say yes true place outdoor bocce court byob found place spoke owner seemed cool enough buddy bday party coming mentioned dozzino room back outdoor space rolled booze food came started different type crustini good usually fan personally ordering n't think come back definitely flavorful good one adorned sweet tomato pesto like sustenance meat plate delicious simple salami prosciutto pizza platter pizza came place n't american style pizza pizza personal size someone nice appetite simple fresh e overloaded cheese sauce good place set stylish open white wall dark wood table floor outdoor space simple patio table chair course bocce pit definitely back night bottle wine pizza bocce one fyi n't ice case case beer white wine go buy bag ice head sure like ice bucket wine either may 2012-05-27,5 yes please hate good food n't like flexibility bringing alcohol want washington hate choice sitting inside hate bocce ball n't come love try different variety pizza hard order umberto every time perhaps order two 2012-05-25,4 place bomb went last night buddy b-day party back room locked crew dozzino byob dopest bocci ball court back yard better good food cheap booze free bocci ball appetizer 2 kind bruschetta 1 kind small tomato slice sort shredded green veggie cheese good also platter prosciutto salami deli meat dinner 4 kind pizza really really great normal margarita style spinach artichoke style white basil style meat style good also nba playoff flat-screen hip-hop speaker dozzino great spot hang place need bocci court 2012-05-24,4 great pizza glad pay extra n't anything dozzino n't liked definitely go special special change daily look board sweet crustinis good worth price pizza however sort garbanzo bean special absolutely amazing dessert must well n't forget byob 2012-05-20,4 dozzino gem hoboken issue thing pizza local ingredient dough best always running dough item menu three time tried pizza oh watch red pepper red pepper flake friend learned hard way nothing better come food fresh local honestly man get togetherotherwise great 2012-05-17,5 great food nice atmosphere grab something drink come back 2012-05-09,5 love neighborhood place beaten path pizza smorgasbord washington street place authentic thin-crust goodness reminds eating pizza italy menu food simple okay quality ingredient n't need dressed taste fantastic three thing pushed place 4-star 5-star book 1 byo 2 outdoor seating secluded quiet backyard patio 3 locally-sourced ingredient looking forward late-night summer dinner come 2012-04-28,5 lovely artisanal pizza shop much offer first foremost pizza delicious perfectly salty charred crust simple topping menu written blackboard large wall main dining area n't many option best part eat whatever new menu n't last time many source produce green meat listed board well love dedication staying local byob waiting table lean large bar front menu wall open bottle wine watch steaming hot plate pizza leaving kitchen window carried hungry customer ambiance simple love pipe table leg get bit loud weekend outside cortyard play bocce ball recommend daily crostinis umberto pizza come topped creamy sweet roasted garlic staff entertaining well 2012-04-19,5 ok little work might good 7 star one day great place take shit though 2012-04-17,4 handful time really hand spending saturday night handful friend spent hour outside playing bocce ball enjoying pizza byob vino beer staff great atmosphere perfect food great love everything place gave 4 star always crave dozzino pizza monday tuesday open 2012-04-07,4 place great pizza amazing one best hoboken saying lot since many pizza place area lovely backyard warmer season small inside get crowded pretty quick weekend get early 2012-03-04,4 like place lot snack phenomenal pizza unique rare fresh topping unique crostini combination well small portion cheap byob chill atmosphere service great recommend place 2012-03-01,4 love pizza price every pizza menu good daily special also always tasty minimal decor make great cozy atmosphere fit family friend couple ingredient always fresh pizza made time order sometimes cause slow service better cold pizza negative everything fresh plus dozzino often run ingredient end evening limiting available menu complaint size crostini dozzino first opened crostini would consider normal size picture 1in thick slice italian bread however since bite sized piece size quarter also would love private party last checked right opened cost rent back space high higher place called hoboken n't include food fee 2012-02-09,3 great atmosphere pizza good fantastic taste fresh crust great could generous topping like variety starter however good salad weak attempt appear advertised e kale appeared kale meat plate pile salami appetizing nutella-based mascarpone crostini delish good pizza byob plus rest great potential"
2012-01-19,5,love everything place byob backyard food absolutely amazing staff super nice love pretty much everything tried menu every time go new special cheech crostini pizza need try problem always crowded weekend hard sit without wait reservation key big party another secret go early side even thursday night
2011-12-31,4,liked byo always appreciated said staff really great vibe cozy cramped food veg got spesto crostini good could eat bowl spinach cheese walnut pesto also enjoyed special garbanzzino tasty rustic hummus seasoned right even asked could serve fresh mozzarella wasnt officially menu wow tasty thanks dozzinos everything fresh market ton option veg next time ill try salad special def enough nice cheap still hip night
2011-12-08,2,walked dozzinos psyched finally try month driving circling parking spot neighborhood immediately noticed beautiful modern interior charmed simple wooden table mason jar glass chalk-scribbled menu hanging bar soon greeted waitress ushered seat hit u christmas music totally miss place like trying modern cool cozy n't even frank sinatra sings christmas third martini like soundtrack original broadway cast recording auntie mame ew ordered spesto crostini baby spinach walnut pecorino small plate 6 guess n't expected much taste refreshing bright texture spinach stringy whole bite little oily shared tomato pizza completely flavorless think bland mozzarella steamed grape tomato salt even hint garlic start meal finish restaurant 20 minute talked ordering food still hungry due obnoxious christmas music general mediocrity fare decided get hell ended grabbing slice sicilian delfino go way home satiate pizza craving brought u dozzinos first place record delfino happens decked festive light ornament tinsel full-on manger scene holiday playing jingle bell rock
2011-11-06,5,wow great artisanal pizza right hoboken went expectation pleasantly surprised good menu somewhat limited seems like change speciality around keep thing interesting agree another reviewer pizza on-par company nyc meat served local butcher real nice touch place least good grimaldi would highly recommend
2011-11-03,4,friend live nearby turned onto wonderful new addition hoboken restaurant scene first byob place always great thing go liquor store next door great selection craft beer old college favorties even lion head one best extremely inexpensive brew hard find around staff friendly make feel welcome walk complaint service bit slow peak hour find waiting 15 min get check considering good food overlook sure get meat plate start group try different pizza usually go total 4 people get 4 pizza fill u white pizza diablo pizza cured meat wonderful save room desert moscapone mixed nutella crustini light great end meal finally weather great go back play bocce ball
2011-10-30,1,obviously dozzino could n't care le customer satisfaction ordering calzone mortadella told mortadella shocker place always something asked waiter replace prosciutto hypothetically super easy swap given prosciutto menu told waiter ask chef owner would probably say sure enough request denied get dozzino ridiculous substitution policy run ingredient expect want rectify situation customer service 101 p get ice machine
2011-09-19,1,service lousy last two time gone dozzinos one time forced wait hour seated find enough pizza dough everyone next time attempted go honor reservation made day advance party late minute due parking issue know pain hoboken anyway table given smaller group first claimed enough space seat u said enough pizza dough absurd especially saturday night town like hoboken never run food turning away good business sad part enjoy going restaurant first opened proper service
2011-09-16,4,redemption came back afternoon first time 9 month get la pizza go delicious issue pizza first time resolved sauce seemed little sweeter cheese fresh basil really tell fresh everything eating n't get better seems like great place bring girlfriend byob yummy pizza definitely coming back glad gave another try
2011-08-23,3,one star byob side note lambrusco perfect pizza wine another star minimal wait party 2 always luck getting table within 5 minute arrival final star crostinis cut eat last spesto think rustic pesto rough chopped spinach walnut parm-reg evoo prosciutto um tasty pork yes peanut butter cup marscapone folded nutella peanut butter topped sprinkle sea-salt pizza however ok fan paying scrilla something could made home pizza stone fresh mutz yes crust chewy thin layer cheese topping meat cheese sauce please
2011-08-15,3,tried place first time last night loved overall european feel place food good fresh thing bothered service walked one greeted u n't really know sit wait seated turned waiter back would nice bartender could helped u go back would liked first time experience go bit better really looking forward trying
2011-07-30,4,slowly eating way hoboken nyc moved adam st washington st week ago walking one night candlelight cozy atmosphere lured picked menu n't last night finally tried place really impressed loved simple menu fresh ingredient really n't understand review italian italy time exactly food made simple fresh whatever season kitchen time food like benny pizza dozzino try like americanized version pizza try authentic succeeds wonderfully ingredient taste picked dough perfect olive oil like heaven want terrible american pie n't come want delicious italian style pizza sure make visit dozzino p byo
2011-07-14,4,italy cena dinner settle bar cafe enjoy bite food drink espresso dozzino brought lifestyle hoboken le brick oven artisan pizza shop menu list 4 simple section crostini salad pizza drink daily special listed blackboard front bar simple ingredient create great tasting pie good thin pie share another person two buddy decided get three piece specialty crostini share perfect amount food mark lauren great server telling u visible wood salvaged original structure bocce ball court outdoor seating area back fun play wait food come pay credit card get receipt texted via credit card scanning ipad pretty bos great spot people want drink socialize bite brick oven goodness true italian fashion place n't really get going till noon start making pie around 1pm espresso ready 9am walk try
2011-06-30,5,seriously great wood-fired pizza even put motorino real ambience lovely server nice
2011-06-13,3,love pie hate never eat would give dozzino better rating n't miffed fact seem closed time private party husband ate dozzino april loved pizza tried order crostini bruschetta daily salad spicy pizza diavola everything good pizza great quality ingredient really shine dough tasty chewy crispy charred enough make want eat another pie lot yelpers complaining fact run dough n't offer choose-your-own topping whatever else expect hoboken pizzeria really leave certain expectation door pizzeria like benny mario restaurant sell artisanal pie earth dozzino n't want money ca n't say know every time family walked past restaurant usually weekend sign door saying closed private party look inside entire front room empty except handful wait staff sitting around hard recommend place anyone seem closed much yes twitter feed husband made good point saying food truck n't check twitter every time want eat
2011-06-10,5,sure people looking come review left disappointingly surprised dozzino spin real pizza like italy looking frozen dough ingredient slapped last minute heated maybe people consider domino instead want authentic pizza character dozzino want menu simple best restaurant keep menu simple menu thirty item guarantee eating wo n't fresh dozzino come learn traditional freezer fridge store inventory get superb taste every bite item n't time sit inventory hour keeping simple dozzino right exactly restaurant world best offer 3 4 dish course provide ingredient peak freshness dozzino feel taste bring customer back definitely new favorite hoboken
2011-06-05,4,something incredibly charming modest pizzeria western hoboken aloof waiter busy hostess many thing place make quaint unique experience possibly fall love detail earthy burnt wood-like table top pipe like metallic foundation honey jar like cup vintage lattice like patternsso byob n't sparkling water lack accommodation make dough suggestion pizza remarkable compare pizzeria like l'azzo run ingredient close thin crust hand tossed pizza simple yet delicious topping try try look past negative review concentrate pizza really love n't order dessert coffee let stress chef bon apeptite
2011-06-02,3,love relaxed outdoor seating area back fact byob spot one weird thing waiter told u enough wine glass gave u one three u made drinking water quickly using glass instead seemed odd esp since place wasnt busy food good menu pretty limited pizza typical large pie hungry ordered 1 salad 3 pizza dessert share back relaxed outdoor seating anything else
2011-05-25,2,made reservation week ahead told n't reservation waited 20 minute table despite entire back room empty food memorable although service quick got seated overall disappointment
2011-04-28,2,love idea natural pizza place local ingredient back room open outdoor patio made decide group event pizza tasty would definitely recommend group event told several time waiving room rental fee group n't know hoboken restaurant charge room rental fee ok thanks pre-ordered salad pizza noon 7pm event based 22 people said might little little le arrived 7 asked ice put beer wine told n't provide would go liquor store next door purchase ok food ready 7:30 point 2 salad came 10 plate 20 people told plate washed ordered 8 salad naturally expected 2 arrive eaten asked would coming informed put 4 salad 2 plate explained nearly enough asked little brought another 28 btw 28 per plate salad consisted mesclun green green grape sliced almond lemon vinaigrette finally around 8 hour event began enough plate fork food everyone say pizza salad good worth hassle event originally owner agreed come back talk group place never happened told total expected cash cover handed credit card later came free dessert overcharged pizza thank business sorry screwed ok thanks dessert tasty receive receipt bill ipad asked one said could email next day agreed email spot acted majorly inconvenienced request receipt 300 dinner anyway look receipt today 8 50 credit card fee omg never restaurant charge fee using credit card let people know going oh forgot mention mandatory 20 tip owner say thank coming thank u business never
2011-04-20,4,place great byob boccii ball court back pizza like typicaly ny style pie like something grandma would make soup also good
2011-04-17,3,eaten several time overall happy restaurant positive beautiful interiorbackyard patio hopefully table summer byobreasonable pricesfriendly serviceroom improvement salad special would better least one ingredient really awesome salad first time subsequent visit selection fallen short pizza dough need salt flavor little bland la pizza please please buy freezer ice bring get using fresh ingredient strange n't ice food come kitchen really fast finish salad
2011-04-11,1,disappointing live block dozzino boyfriend went first opened n't blown away service pizza decided give another shot another couple weekend called early saturday see made reservation problem restaurant went dozzino around 6:45 saturday entered restaurant hostess asked u reservation informed called earlier day person answered phone said n't take reservation replied sometimes n't even know respond told going around 45 minute seat 4 2 available back n't make sense aggrivated left took business someplace else doubt return future dozzino
2011-03-20,3,basically stalked dozzino month opened signed yelp account today express bummed result thus far visited four time one great experience one so-so two terrible good rate return positive place beautiful hoboken need yes ton pizza place none look like atmosphere dozzino positive byo amazing hoboken need byo like like anthony david wo n't mind opening great bottle wine atmosphere young fun want stay drink even positive bocce back outdoor space going incredible weather get nicer place like town so-so owner staff beyond nice seems like always random friend family hanging behind bar like personal playground argue fairly obnoxious eating bar criticism menu limited get fresh ingredient love concept going pizza n't want option one soup salad start crostini main component meal going bread cheese sauce offering bread tomato cheese option appetizer n't really varying menu ton place like dozzino seasonal vegetable menu salad option side meatball etc really incorporate concept take spinach one crostini offer serve side taste fantastic people eat meatball make occasionally feature special pizza awesome make time offer stand alone item suggested expand menu ton option different menu already place would help criticism two bad experience dozzino option n't awesome b pizza totally bland even pepper flake flavor two experience case maybe need work consistency bit one last thing want note sucha b comment chair made laugh loud 100 true like need booster seat feel like adult table hope owner dozzino take review account place potential one popular place town
2011-03-06,4,fan dozzino pizza remind co nyc although quite good use fresh ingredient day run like decor supposedly table made reclaimed wood building renovation family run atmosphere favorite far noni salad special diavola pie sure menu item let know try
2011-03-01,5,still dreaming pizza fiancee live brooklyn came hoboken visit friend took u worth started crostini spesto favorite prosciutto one salad delicious start pizza split bianco diavola special craving white pizza one sooooo good loved spice diavola special kind homemade sausage tasty interior place great love big blackboard ca n't wait sit outside back nice lastly least byob n't love byob definitely make long journey pizza
