date,rating,review
2021-10-23,4,love spot charming vibe cozy comfortable indoor outdoor seating mention food wonderful 5th time coming back pizza come warm pizza dough opinion showstopper crispy outside soft bread inside everything pizza good n't disappointed yet n't think great place also byob
2021-10-14,4,concept cheesesteak absolutely genius fail bread going buy 16 cheesesteak better good hearty crunchy bread ate soon came oven bread basically falling apart juice would gave five star good bread came
2021-10-13,5,private party weekend could better experience johnny josh amazing provided outstanding service fun pleasure work get chef name food great artisanal pizza flavor-packed meatball penne vodka chart thank much marc team sharing incredible venue providing top-notch service creating environment made celebration hit
2021-08-14,4,n't dozzinos age decided pop past friday made reservation resy need dead inside outside friday 7:30 shocking guess summer people may away inside table two long communal table sat 3 menu pretty simple starter mostly pizza also special daily started chicken parm considered starter 3 cutlet pasta tasty split 3 pizza well spicy pepperoni umburto red pie roasted garlic carbonara special pie pizza good carbonara favorite remember pizza smaller good size 6 slice dozzinos byo apparently freezer mean ice drink kinda bummer also keep pretty basic using paper plate eat might want consider ice box drink also crushed red pepper oregano pizza let
2021-08-12,5,great service pizza easily favorite town also byob plus
2021-08-01,1,place awful ran dough thursday night 8pm reservation made trip especially try failed notify u cancelled reservation also pizza delivered delivery took 2 hour pizza cold even deliver box instead piece cardboard inside bag open left floor front front door easily accessible dust bug etc wish option giving place 0 star extremely poorly managed business
2020-11-13,1,yep talk sign meant exclude trump supporter true dozzino admits facebook photo included n't see attached review photo section ordered pizza n't great give another try spend dollar elsewhere
2020-10-14,5,honestly best pizza nyc area hard time understanding 1 star review popular restaurant yes limited dough cheese run reason give 1 star keep dozzino true gem
2020-10-10,1,food great sell remorse able serve customer
2020-08-14,1,read natalie review said dozzino williamsburg crowd end hoboken want pizza something effect completely agree business vibe try give rather food serf food sub par easily bottom half bottom quarter hoboken pizza place additionally service inattentive point almost non existent might well self serve since none staff seems care customer plenty pizza joint much better food far better service
2020-07-09,5,recently came outdoor dining tried pan pie wow wow ca n't wait come back attached picture pre-covid n't care much white pie meatball pie amaze ball
2020-06-28,4,think one best place pizza hoboken exactly neopolitan center pizza soggy charred burnt edge crust definitely give awesome flavor pizza reason n't go often could price maybe 2 dollar cheaper per pizza affordable overall highly recommend
2020-06-19,1,sign held door picture trump supporter enter let show count boycott restaurant rude work food nothing special
2020-06-16,5,place consistently great food owner team easy partner private event thrown shower last 9 year always rave review picky guest strong partner community going remind friend support local gem
2020-06-15,5,5 star really proactive protecting customer covid19 great location cute outdoors
2020-06-15,5,favorite go-to pizza place hoboken pizza best period always nice kind go pick place order highly recommend give guy pizza money bc really best city delish
2020-05-30,4,ordering takeout pie 6 month say fan dozzinos dude favorite pizza jc hoboken area doesnt get top spot top 5 garlic pie umberto absolute favorite pie diavolo guy favorite la pizza really good basic pizza ordered white pie really didnt like stick red good 10 quarintine special awesome staff always friendly nice ordering picking two peculiar aspect takeout 1 dont use pizza box get pizza bag cardboard cutout pie 2 dont cut pizza slice two thing guess always taken granted ordering pizza
2020-04-06,5,fiance came first date four year later engaged come least week hand favorite pizza spot hoboken jc brought numerous friend safe say favorite place pizza apps always fresh made high quality ingredient highly recommend dozzino anyone looking chill dinner night
2020-03-06,2,boyfriend decided check new pizza joint craving pizza got 7:00ish wednesday night customer site appeared staff meeting happening decided risk hungry decor restaurant clean simple modern lot barn wood used create bar bar stool waiter let u sit bar gave u bottled water ask u wanted water flat bubbly type beverage let u know choice water gave u flat fine let u know special one kale salad eventually ordered although thought want clarify indeed want kale salad boyfriend inquired pizza filling hungry waiter responded honestly n't think one filling another eaten pizza went spinach artichoke pizza kale salad shared kale salad edible amazing texture bit hard included dried fennel v fresh fennel lot chopped fresh red onion enough kale balance portion ingredient eat ok pizza included fresh spinach good cheese ratio found bit salty large enough one person would leftover n't amazing pizza experience take leftover home biggest issue joint waiter lack service seemed high present detail server example brought salad gave u small plate fork serving spoon serve salad ask pizza came refresh plate small salad plate enough space eat pizza better suited appetizer plate used coffee cup saucer asked waiter could get larger plate new plate leftover salad mine said allowed use large plate think silent dismay cued get u larger new plate luckily seat bar provided u direct frequent contact versus patron table wait make round get silverware n't think back due experience service n't able sell u food term insight best filling n't provide proper utensil u uninterrupted meal lastly never given condiment hot pepper salt pepper overall food ok area hoboken find phenomenal pizza attentive detailed service fair new restaurant sure working kink waiter could night also wonder proper tool training successful job hopefully constructive criticism serve opportunity improve
2020-02-22,1,made account review first order tell 15 minute wait 20 minute go pick get say wont ready 15 minute wait finally get pizza get home damn pizza even cut full pizza uncut finally able get mediocre way much cheese grease place joke stay away
2020-02-16,1,pizza trash picked two pie raw would never going back
2020-02-04,2,came girl night two friend originally requested outdoor table told sit way back right next shed firewood crawling bug note place virtually empty plenty seating elsewhere given menu half thing crossed n't hot outside requested ice n't ice asked could chill wine request initially ignored heat bug eating ankle requested sit inside waiter accommodated also openly made fun u colleague rude n't think meant u hear got order waiter n't check u time serve get plate shared meal noticed plate scolded u saying n't provide large plate order lay hammer make sure n't happen strange never checked u long time flagged check left u ipad pay went outside smoke got left soon confirmed payment expected way better place food pretty good redeeming factor service horrible ruined
2020-01-31,5,engagement party dozzino 70 people december amazing time johnny staff helpful planning setting hosting food incredible everyone raving highly recommend
2019-12-29,2,maturity staff zero food amazing best pizza outside manhattan downside major downside 2 guy behind counter joking around loudly giggling shouting playing around whole time eating distracting annoying unfortunately took away enjoyed meal
2019-12-07,5,great pizza supper attentive staff went daughter long day treated u rice ball house super yummy highly recommend trying side
2019-12-03,2,place ball send uncut pizza paper plate paper bag never 36 year life seen also n't bother salt property snow 2 star opposed 1 pizza actually good service person via delivery horrendous pretentious bunch n't bother
2019-12-02,5,visited dozzino month back still dreaming food shared two pizza meatball friend exceptional tomato sauce pizza meatball amazing place also byob feel free bring bottle honestly liked pizza better juliana dumbo believe dozzino 3 5 star rating definitely give neighborhood pizza place try
2019-11-26,1,tuesday 8pm walked bottle wine ready eat dinner host let girlfriend know run dough cheese 8pm pizza restaurant every time come instrumental ingredient time meatball actually made joke walk wondering would safe assume always something dough ingredient flour water salt yeast
2019-11-24,2,happy others good experience unfortunately service great guy nice helpful honest ordered meatball johnny bismark pizza start pro service great appreciate n't freezer everything fresh food came timely manner water cold food came warm meatball bite size tomato sauce homemade parm top nice touch con meatball strange taste dry hard maybe much breadcrumb tomato sauce n't much flavor add garlic herb make robust small 14 overpriced asked could get extra sauce meatball told since make enough serving meatball also disappointing johnny bismark pizza fresh made mutz prosciutto one tiny egg prosciutto cooked horrible wish would cook pizza add prosciutto better way disappointed think may quail egg super small chicken egg boyfriend afraid eat since egg white n't fully cooked yolk okay wish one tiny egg paying 19 pie n't make sense pizza minimal prosciutto pizza worth crust soft chewy would better cooked little longer also make cut pizza worse yet boyfriend got sick later vomited meatball needle say returning
2019-10-18,5,honestly food top-notch laroma pizza meat plate appetizer solo dinner requested crest little bit crispier definitely honor came reservation two husband could make n't problem asked lot question patient ca n't speak issue others might experienced enjoyed return
2019-09-23,5,amazing pizza amazing vibe definitely best pizza spot hoboken recently came back italy coming whenever missing
2019-09-20,3,husband called ahead time made reservation 745 arrived told reservation little weird okay sat bit buzz air excited ordered bruschetta meatball pizza asked everything come together bruschetta meatball came first okay issue really good like really good unfortunately husband pizza n't arrive another 10-15 minute later pizza actually arrived really good well would given hidden gem 4 5 star n't lapse operation think spot great potential team need button operation pay attention table definitely back p byob huge plus
2019-07-30,4,dozzino perfect place eat mood brick oven style pizza want sit pretty courtyard whole place cool laid back vibe byob menu relatively tiny pizza selection decent combo put together super tasty service good may little slow busy night pizza dough fluffy chewy big air bubble yaaas wouldnt call best za hoboken dozzino disappoint
2019-07-25,5,sure people could rate place anything 5 star think one best spot hoboken firstly pizza amazing place byob unique pizza special like personal sized everyone get want try bunch secondly ambience amazing inside even better best outside patio sure picture yet going add one beautiful tree light great date spot place hang friend byob make easy wallet one thing would like see much better appetizer menu barely anything friend love order starter usually n't lack choice amazing place overall
2019-07-14,4,definitely solid pizza hoboken area like beaten path aka washington street indoor outdoor seating area cute quaint outdoor area beautiful spring summer evening warned usually wait byob major plus well offer variety salad small apps sharing several different type pizza friend started order zucchini flower special evening visited wow delicious fresh served piping hot ordered two pizza share well think difficult thing restaurant fact give pizza cutter slice pizza lolol pizza flavorful dough light airy dense favorite pizza anything come egg top love runny yolk service little slow appreciate n't trying rush door surely back dozzino
2019-07-08,5,nice pizza beautiful presentation style donzzino complimentary threashold patio w half-century-old vespa nice oven-baked personal pizza served cutting board american-style rolling pizza cutter donzzino reminds nice pizza look b4it cut decade ago american attitude changed late anthony bourdain described way american turned away italian-american food like cousin embarassed u childhood italian-american life hoboken frank wud b proud
2019-07-03,5,huge fan diavola find craving pizza time pizza definitely either picked person eaten restaurant package pizza like paper envelope thing idea describe better without box delivery people really mess pizza love place pizza
2019-05-22,5,great authentic food byob definitely plus would come back quality freshness food
2019-05-10,4,twice place really awesome pizza whatever use make dough amazing love slightly burnt crust definitely tell fresh high-quality ingredient used good service friendly staff well
2019-04-15,3,came group 6 friday night w reservation overall food good everyone group walked 25 yay byob ordered meatball yum two salad 3 pizza one special cacio e pepe delicious pizza come uncut give pizza cutter perfect group make sure everyone got piece con loud dinnertime practically shouting across table impossible hear waiter read special asked waiter big salad held hand foot apart indicate size said could share well came size house salad order another also asked bigger plate one provided big palm hand said could n't give u bigger one massive stack sitting shelf across room given guest ordered side bread never brought bill end dinner took charge asked also get go bar remind espresso ordered end meal served tell u milk
2019-04-09,1,one rude restaurant owner ever encountered girlfriend dozzino time enjoyed food last time went discovered owner simply nice person first nice weekend spring requested sit outside couple friend seemed like reasonable request given lea 4 table open outside owner said would absolutely push two table together provided rationale two would impossible asked soon could seat 2 said immediately asked could seat u two next point snapped told u could go different restaurant n't like way thing run looking byob pizza place outdoor seating hoboken would strongly recommend johnny pepperoni pizza simply better thought jp pizza better encounter seating far tell owner n't rude former customer suppose everyone entitled bad day lot pizza place hoboken n't need worry harassment going patronize place also nothing outdoor seating dozzino actually pretty bad adjacent dumpster usually swarming mosquito
2019-03-15,3,good pizza le option later day food ordered regular pie dozzino exactly expected nothing nothing le sauce cheese pie alright wow factor pizza crust really great flavor whatever oven use amazing main highlight pizza pizza personal pie good one person hungry definitely split one satisfied certain time majority pizza n't available basic la pizza definitely disappointed pizza menu sounded good price la pizza 12 00vibe worker friendly space welcoming one group atmosphere chill great place looking toned lunch looking quiet spot catch friend
2019-01-05,4,great spot authentic pizza good atmosphere kitchen make accommodation okay sort thing
2019-01-03,4,awesome pizza w egg run stuff quick like could n't get nutella mascarpone desert love cannolis soft
2019-01-02,5,place become local go-to consistently serve best pizza eaten anywhere travel around world cool low-key ambiance plus lovely back patio
2018-11-12,5,favorite pizza place hoboken best pizza apps town pizza great personal pie splitting cheese fresh
2018-09-15,5,dozzino multiple time always great experience also one favorite pizza spot order delivery hoboken honey unlike pizza ever incredible something sweetness honey mascarpone paired salty prosciutto n't tried must also love diavola little kick red pepper another plus byob always plus want great dinner trying drop 15 drink 40 bottle wine
2018-08-13,5,dozzino six time since moving hoboken location awesome food atmosphere extremely laid back quaint dont expect 5 star service super casual place food find food delicious every time dined gotten different appetizer really appreciate freshness menu sometimes sit find thing menu n't bother may annoy others best apps meatball rice ball bruschetta super fresh pizza come personal size disappoint best part place byob conveniently located next liquor store always one top spot hoboken
2018-08-04,4,find dozzinos least month friend boyfriend tow sometimes question paying much singular bowl olive ca n't help constantly craving bianco say dozzinos perfectly hipster vibe bar side dining room outdoor seating adorable hanging light n't forget place byob experience yet get ice bucket either bring nice red ask bottle kept fridge come early n't sell wo n't disappointed see
2018-07-26,1,first never experienced poor service establishment life upon entering restaurant asking seated outside told party hold prepared outside table host taking u table seated u inside anyway waited outdoor seating fortunately move u outside table became available upon seated provided 6 u 3 menu one menu accurate listing available option food okay service terrible ordering receiving food party left outside waiting water 15 minute one u went inside ask unsuccessful none restaurant staff around eventually someone able help u unfortunately provided u enough water fill 4 glass stuck waiting refill still nobody around willing help u another member party go inside ask leading repeat previous attempt server willing bring bill others dining restaurant long able flirt female party walked past u repeatedly ignoring attempt receive service completing meal sat waited server bring u bill never brought go inside ask billed pay awful experience never return establishment urge anyone else avoid cost worst dining experience life ashamed able rate lower 1 star would hesitate disgusted
2018-07-14,5,awesome food super earth accommodating staff amazing pretty much everything weekday bite cup italian espresso renting daytime party done multi time always spot
2018-07-07,2,pizza place much potential dough great brick oven taste amazing however sauce ok menu soooo limited hard go local spot would love support service management terrible helpful
2018-06-27,4,great backyard sit byob spot several occasion always order special pizza calzone loved everything believe make mozzarella service efficient food come quick
2018-06-15,1,worst service imaginable take money n't deliver order happened ordered pie 7:15pm supposed delivered 8:15pm called 8:45 n't receive order restaurant said checking put hold 15 minute hung called back restaurant closed pizza delivered
2018-06-10,1,pizza restaurant run pizza friday night yes read right came group friday around 7pm waited hour seated seated told 4 personal mind pizza left whole place would able 2 since another table also n't ordered yet literally let u sit hour waiting seated telling u also know n't ice want enjoy ice water ice wine n't go n't freezer also want grated cheese sprinkle pizza dollar extra joke seriously charge dollar extra parm cheese wildly overpriced n't know run business n't waste time go somewhere worth time grimaldi napoli zero otto uno name n't know survive running business way
2018-06-02,3,dozzino decent spot want chill friend fam chalkboard wall long wooden table patio area create nice ambience pizza would say okay place source locally fresh ingredient learned n't much fridge space upon arrival prime dinner time notified several dish including meatball appetizer pizza pizza smaller pricier typically find hoboken ordered hudson 19 come spinach artichoke prosciutto egg rom 14 tomato salami personal preference prefer crispier crust hudson pizza sounded interesting menu found pizza crust bit doughy veggie burnt also sauceless pizza flavor hudson okay much preferred rom traditional tomato base tip byob n't ice guess case byoi bring ice
2018-05-22,3,pizza decent thing really bother place n't ice everything served warm unless go early sell menu option leaf menu slim picking night actually sold pizza wait pizza restaurant right hard make plan go restaurant n't know going left menu get
2018-04-30,5,went first time weekend right opened 1:00 pm byob door liquor store definite plus girlfriend split two pie ordered la pizza 1 special pie forgot name fontina cheese caramelized onion soppressata arguably best pizza girlfriend ever environment chill server super nice definitely coming back
2018-04-18,5,order takeout regular basis-never disappoints usually ready long estimated time-which huge plus starving way home work ingredient always fresh
2018-04-14,3,pizza good great like brick oven taste crust bit doughy chewy liking personal preference others may like tomato sauce bit strong relative rest flavor also note substitution regarding topping real issue service took 40 minute ordered get pizza finding waiter question bill difficult price fine return try delivery also
2018-03-25,1,disorganized haphazard establishment ever encountered someone need remind extremely rude arrogant owner hospitality business look definition dictionary food good hoboken standard worth enduring horrendous service menu virtually unreadable printed tiny faint print copier ran toner waiter suggested going online read incredibly highest level service received list grievance get worse definitely wo n't going back recommend looking elsewhere planning large party special occasion people care patronage valued
2018-03-21,5,pizza amazing taste exactly like pizza would napoli rome n't get better must try service awesome byob
2018-03-04,1,terrible ran menu item never place n't ice staff nice little work paper cup napkin find public restroom probably empty owner think pleasing customer instead repeat
2018-02-21,4,went dinner last friday night great experience wait almost hour long able sit bar drink byob wine waited appreciated host honest wait time expectation managed split bruschetta app eh fine plain pizza white pizza soppressata loved negative server attentive asked olive oil bread said would extra charge
2018-02-02,1,overpriced get waiter rude like could care le actually want go need hope n't baby shower going assume cash cow pizza bleh two thing going place outdoor seating byob
2018-01-15,5,went dinnerfood 5 5 spicy meatball super tender really nice sauce hint spice mostly deep smoky flavor keep fresh every bite pizza absolutely phenomenal dough beautiful perfect amount elasticity give great bite keep soft cured meat pair perfectly awesome dough cheese sauce delicious surprisingly australia united state respectively proving anyone produce amazing ingredient regardless location cultural background service 4 5 quick friendly restaurant casual service reflects give pizza cutter pizza cutter lift pizza value 5 5 pizza go 14 personal pie little average pizza good dough really make happy dined making worth every dollar awesome value parking street free
2017-12-29,2,terrible delivery n't waste money cold expensive tiny dining better experience
2017-11-26,2,ordered two 10-12 inc pizza staff 1 pepperoni margarita could n't add topping alter arrive came two soggy paper bag box pizza small salty sliced surprising could least sliced throw garlic knot price payed
2017-11-18,2,went last night first time n't reallyimpressed dry sausage pizza could n't even add topping pizza place n't let customize pie 18 small thin pie n't great server nice byob nice addition worth money also byob would n't least glass pour wine beer paper cup given flying
2017-11-02,5,incredible everything place one ca n't explain one bite make man happy ima let boy continue yo joeys boy wassupppppppdozzino reason wake morning time ever seen joey happy found pornhub free anyways n't like place probably loser anti christ
2017-10-14,5,feel place deserves 5 star would recommend service awful n't try make adjustment order philosophy heat extra marinara sauce still sure fault restaurant problem fact server bad job otherwise pizza fantastic sauce really great backyard adorable peaceful appetizer could use work still tasty
2017-09-26,2,hard judge completely another event day officially closed provided pizza guest time shine kinda n't great environment backyard pleasant interior comfie great welcoming staff cool location stickler great pizza great sauce topping crust well done loved dozzino crust nice crunch right place thick enough hold hearty sauce topping buttery greasy yet charred oven good foldability also good hold in-hand napkin plate arrive time crust n't hearty tasty sauce n't decent amount cheese pepperoni salami topping pie scarce smelled great came nice hot cut crunch sauce tasteless made upset wan na someday prove nj great pizza brooklyn-raised friend know great pizza dozzino 1 extra star crust tho
2017-09-11,2,dough saltier side chewy strange wood fired pizza cut pie smaller slice stranger go back cut think right idea need fine tune till rather avoid
2017-09-10,5,favorite pizza place hoboken whole pie many time time pizza great byob well great change high alcohol price restaurant back yard space nice definitely back soon
