date,rating,review
2017-08-27,5,checking number place hoboken decided engagement party dozzino space perfect rented three room party people could walk around mingle different setting outdoor space amazing people wanted get sun fresh air marc staff keep place spotless fresh setting party arrived 3 hour started get thing organized marc arranged two staff help u anything wanted including setting table flower bar etc even ran store u get ice last minute item everyone friendly extremely helpful finally food nailed opted pizza pig roast party marc started roasting pig hour party time people arrived place smelled amazing coupled pig roast pizza salad crustinis everything came great could happier result thanks marc crew memorable fun day
2017-07-26,2,food average small menu menu piece paper choice crossed pen service extremely poor lastly sat outside tree scratching left right covered ant n't recommend
2017-07-26,5,pizza best town la pizza might seem like traditional style flavor sauce crust arent like anything ever
2017-07-25,5,n't 5 star place n't know anything especially come pizza every pizza spot hoboken easily take pie love fresh ingredient custom pizza n't n't matter p byob bocce court
2017-07-06,2,came lunch boyfriend impressed rarely write review case feel need pizza ok ordered rice ball good pizza nothing special another thing every time asked something would n't tell u actually getting came table example ordered cup sauce came table cold n't told front u sauce served room temperature n't think cold sauce way go ok overlooked ordered cooked prosciutto pizza came cold asked cooked said yes prior pizza second strike 3rd final strike walked told seat one table inside occupied 2 6 outside nice day decided outside 4 6 table small could barely fit pizza took one bigger table waiter came bring u food said guy literally sat wherever wanted would known going take big table would sat rude done place point place empty hell matter 1 couple came time needle say n't waste time
2017-07-03,1,big fan place regular weekly customer ended week ago order uber eats ordered three pizza chicken parm sandwich pizza salty two pizza came ordered loaded salt third pizza crust spinach parm cheese nothing else sauce super salty chicken parm sand came two slice white bread top chicken breast cheese sauce bread toasted looked like given leftover someone plate take called restaurant let know disappointed order kept getting passed different guy none interested helping finally kitchen manager got explained made mistake food best also told salt crust put high amount salt keep apologized sand also wrong pizza asked food replaced told thing could get refund uber eats deliver area ca n't make fresh food asked manager told one around left name number owner call back paid disgusting food dinner family night unhelpful overall lost customer
2017-06-16,1,visited dozzino another couple completely unimpressed wait staff aloof attention table pizza average best limited selection manager seemed interested running door worrying satisfied never return
2017-06-16,1,terrible restaurant kind pizza joint n't allow add topping arrogant management likely go business near future
2017-05-30,3,review take-out never eaten restaurant said probably should't offer take pizza bag yes bag meatball cup kind use fountain soda tin foil top god bless delivery man making mess red sauce car taste good decent price way showed
2017-05-22,2,overpriced hipster pizza oh ingredient fresh pas best way describe artisanal garbage thick baked dough minimal topping cheese honestly n't even taste good properly prepared di'giornos ask sauce side tomato pancetta hudson prosciutto mushroom pizza pretty bland individual 14-20 pie small girl could eat one guy probably closer two service poor plate napkin asked n't even bother cutting pizza find somewhat annoying byob hoboken n't ricotta honey fried rice ball overrated meatball appetizer grimaldi much better fancy pizza reasonable price point place begrudgingly get 2 star food n't completely inedible doubt coming
2017-05-04,4,service great pizza good cheese little salty got ricotta honey appetizer delicious like artisan pizza definitely try place looking traditional pizza place crust naan texture also byob always good girl night
2017-04-15,5,best pizza hoboken tried also got ricotta honey chicken parm special also great byob
2017-04-02,3,potential great pizza three last five time topping full sand spinach-this happened two separate occasion b invisible pay much c looked like thrown pizza across room also n't like hipster attitude boring sorry sorry
2017-03-27,4,wow seriously tasty za came large group birthday dinner perfect pick call ahead reservation plenty large table byob menu easy please definitely could n't ask well guess would nice enjoy bocci court backyard come back summer menu variety small plate salad crostini veggie meatball etc lot lot pizza option decent amount small plate luckily ton mouthwatering special make started bruschetta ricotta crostini table n't huge fan ricotta weird texture sort looked tasted like greek yogurt bruschetta excellent tomato fresh main ordered special menu brussels sprout pizza ricotta pepperoni caramelized onion sprout incredible perfectly crunchy topped parm cheese two order came large tray could easily fed party 10 coal fired pizza bomb thin crispy cheesy generous amount topping complaint much crust pizza n't big begin n't left whole lot pizza suggest ordering solo pizza getting least one thing going share great first trip hopefully last time dozzino
2017-03-06,5,absolutely amazing date night family get together friend night restaurant vibe amazing great place bring extra large maybe 2-3 bottle wine relax laid back environment pizza brick oven fresh delicious far away chaos washington street definitely little hidden gem want amazing pizza best part outdoor seating light bocci ball court summer recommend anyone looking new restaurant hoboken beaten path
2017-03-04,1,great food horrible service company respect customer employee high serve owner care guest
2017-02-10,1,chef literally took poop customer bathroom announced still glove disgusting also chef drinking 730 pm view customer literally chugging beer top waitress horrendous could n't even walk around large group table take order instead made u yell across order shrugged could n't hear pizza burnt good naples way literally burnt crisp also wait 45 minute table reservation laughed said bad regular end asked pizza go would n't even give u box use delivery put food wax paper bag place like get away kind customer service please favor stay clear
2017-01-25,4,byob many place nowadays byob drink away came old college friend winter month ordered two pizza share two u took u awhile choose even longer server come around take order since backroom remember getting basil sicilian friend ordered another one also good pizza arrived 10-15 minute chowed chattered away pizza good italian pizza expert say n't many better n't notice one left restaurant paid staff never ever pushed u door sometimes unheard know working personally would want get customer could go home two thumb come back weather nice booze patio area
2017-01-18,5,simple authentic delicious topping amazing best pizza around byob nutella mascarpone desert world
2017-01-16,5,best pizza hoboken great byo place n't miss brussel sprout meatball
2017-01-02,5,best pizza hoboken albeit expensive best eat delivery nearly good
2016-12-07,5,ordered seamless diavola pizza sopresata hot pepper delivered round cardboard sealed paper bag pizza uncut good fantastic char chewy crisp crust flavorful reminded pizza rome really great stuff ordering going point absolutely impressed
2016-11-07,4,came saturday afternoon around 3pm spring easily able sit outside service kind slow likely right lunch dinner shift n't know byob disappointing still ordered 3 pizza enjoyed spring air pizza great crispy full flavor
2016-11-04,5,pizza really good ordered bianca special day caramelized onion pancetta yummy come back
2016-10-07,5,great pizza perhaps bit expensive flour water cheese tomato sauce great job rather pay good pizza pay bad pizza
2016-10-05,5,love place service sometimes leaf bit desired pizza good get byob never wait drink think wash also ambiance inside great inside table sort casual family style outside awesome little brooklyn-esque garden dozzino find personal-sized gourmet artisan pie delicious fresh albeit minimalist ingredient red sauce fresh crushed tomato basil healthy glaze olive oil crust pie n't like also calzone special time time get absolutely delicious way dough cook around calzone like nothing ever crispy outside soft inside tbh could probably meal cooked dough olive oil
2016-10-02,4,great wood-fire pizza umberto fresh garlic top delicious place byob prefer sure pick wine lunch dinner also real cute outdoor patio light back handful table one bocce court went overcast brisk evening n't trouble securing bocce court couple hour without anyone waiting line u also able split bill five way credit card hugely appreciated hope come back
2016-10-01,2,really looking forward early dinner cute place known great food arrived handed one menu could n't actually read told special written huge chalk board n't actually real n't serve ok fine order green salad rice ball rice ball ok fried anything taste great salad legitimately lettuce plate dressing nothing else place make mozzarella think would least mozz salad nope mushroom pizza ordered n't look taste like mushroom added nothing pizza honestly made hard eat ordered another pizza margarita good eh food ready leave asked bring pizza home put paper bag bag n't know stunt seem cool different pizza stuck top bag incredibly hard carry weird want place great maybe try one day
2016-08-24,1,pro nice looking restaurant solid corner location outdoor seatingcons service suck wait staff rude hell lazy slow uninterested guy behind counter always snickering like little school girl pizza slightly average always run ingredient special salad always bag lettuce lemon juice bread sit awful acoustic loud hellin closing walk three block panellos 7th get much better meal experience
2016-08-07,5,fiance several time love food atmosphere decided hold engagement party dozzino whole crew helpful planning process available hour event help set-up manager staff checked u throughout event make sure everyone needed even made special menu friend allergy guest loved pizza ambiance definitely spot come back year come
2016-08-05,1,went second time giving place another shot first bad experience never wasted time never place waited menu water 30 minute second time thing cold waited 45 minute realized still n't bring pizza much pizza hoboken wait
2016-08-05,1,traveled back home nj excited try place never return suggest waste time money took hour get food pizza long take top management incredibly rude absolutely help go street literally anywhere else
2016-08-03,4,come time usually take pick often eating part happy turnaround time quality got first opened ate busy-it get way depending day time really downside besides fact close relatively early 930 10 n't late night pizza joint-if want especially later make sure order go close keep hour mind n't broad selection really go pizza bruschetta first visit ok pizza convinced u come back use different type grain mistaken crust know eat n't feel disgusting bloated sick like might place light flavorful come variety special usually customize something within reason ask diavolo one favorite drawback price tad bit high assortment love order mainstay pizza lookout
2016-07-18,3,came dinner large group sunday night able accommodate large group said told vegetable salad diet coke regular egg pizza limited selection eliminated many ordered multiple order bruschetta crostinis portion small good pizza probably would n't bring another large group
2016-07-17,5,great pizza joint like typically pizzeria lot great option unfortunately lot choice let u know beginning still plenty choice pizza delicious cooked perfectly ate played bocce outside back cute atmosphere definitely back
2016-07-16,3,locally-sourced ingredient over-priced faire try dozzinos whatever meh dough tomato sauce 12 hardly mozzarella tiny pizza wut place exclusively williamsburg hipster visiting hoboken
2016-06-09,4,went christening party familiar hoboken place seemed like hot spot good pizza variety good wing incredible sure type seasoning nice bite nothing hot right area come back
2016-05-19,3,come artisan pizza picky zonnis red bank nj domenicas nola compare best pizza friend went saturday night ordered bruschetta bland fuzzy grainy cherry tomato doused olive oil stand basil served 6 piece bite size bread could mistook crouton also ordered umberto pizza spinach pizza 2 pizza enough 3 people salty mean exceptional mediocre coal oven fired pie would n't particularly go back eat overall service fine food fine
2016-05-17,4,almost n't want post another review place n't want get crowded outside seating open guess share pizza amazing get prosciutto honey special board bring wine lot wine quarrel place charming artisanal table built bit high charming mismatched chair short bit awkward
2016-05-07,1,usually n't right bad review later tonight food thought deserved one n't first time eating definitely last went pick around 730 restaurant empty used crowded sign picked two pie take home maybe tried pull fast one u since takeout got diavlo eh dough burnt pretty chewy hardly cheese bianco even worse basically charged u 14 crispy dough basil leaf three cheese supposed highly recommend pick one better pizza place hoboken many
2016-04-27,5,wife starving running tight time needed road early next morning make sure hair cut 1st luckly conveniently across street get haircut gem pizza ever wanted tell made love fresh ingredient kicker byob back
2016-04-26,4,heard many great thing dozzino since moved hoboken finally decided give try fyi huge lover pizza fiance went thursday seated immediately anyways ordered mixed green salad apple cider vinaigrette honest think green little rancid also ordered bruschetta n't much flavor thing could taste salt lot salt ordered two pie diavola pretty good bianco tasted like nothing salt overall impressed heard many people talk great pizza maybe night like give place another shot maybe summer group backyard open play bocci ball one thing like fact byob updated review 8 3 16 like said planned giving dozzino another shot went group friend ordered pie delicious marscarpone honey pizza ridiculously good plan going back updated two star four
2016-04-25,2,really n't understand hype neither atmosphere food rave-worthy last friday large group inside let six little kid run around screaming outside supervision elderly inebriated relative communicated screaming well loud unpleasant sit outdoor table still expecting great artisanal pizza based rave review boy disappointed artisanal as sauce tasted like came nothing added crust n't great either probably one pre-made frozen jobbies place good family screaming kid everyone else avoid pizza expensive yet cheaply made bland ambience non-existent waiter nice though
2016-04-01,4,took long get glad finally tasted slice heaven aaahh crack anyway came friend play catch happens know owner soon sit inside unfortunately table outside tell u working wing recipe give u plate try delish little perk knowing right people ordered la rom margarita topped sopressata friend hot onion special menu little odd special menu extensive regular menu buuuut understand special n't change often like part 2 situation wanted try couple special partial red pie majority one sounded good white pie eat slice white pie entire one bit bummer pizza came 10-15 minute later surprised amount fluff dough light airy risen much much enjoyed every bite pie still could used little sauce taste flavor point great hang date night spot byo gentle bank account ca n't wait come back try pie crostini
2016-03-13,3,pizza pretty good vibe nice cool outdoor area bocce ball green got basically pepperoni pizza small cost 18 seemed pricey byob cut cost dough pizza good overall pizza ok place actually pretty crowded waited 10-15 minute 2 little noisy music choice place n't mind
2016-03-05,5,got married last week w hoboken super awesome also fancy rehearsal dinner wanted something casual warm friendly delicious could better pizza party looked ton place nj originally n't live anymore landed dozzino talked marc clear choice pulled party without hitch pizza fast delicious fit 75 people food speech exactly wanted n't hurt thought marc staff real cool guy thank much awesome private party best
2016-03-02,1,burnt pizza main issue place would order week would burn pizza dough regular basis considering coal considered carcinogenic group 1 category fan wonder manage burn bad time bad like ingredient use hoped would fix oven technique time would clean oven often nothing changed place named burnt pizza place please n't review business received freebie writing review connected way owner employee
2016-02-27,3,felt rushed order chance look menu hard see special chalk board food good next time deff make point take time ordering
2016-02-18,5,congrats dozzino high ranking best pizza nj nj com absolutely deserved pizza far best town freshly made dough crisped brick oven little doughiness crust favorite diavolo owner excellent job sourcing local fresh ingredient something stock good reason
2016-01-10,5,hand favorite pizza hoboken hoping gigantic slice usual format disappointed want really excellent crust aged meat fabulous cheese personal size pizzas-this place highly recommend trying hudson hot onion pie bonus byob
2016-01-09,5,excellent byob pizza shop good special well atmosphere excellent outdoor space cozy management extremely friendly service solid
2015-12-30,3,pizzeria fresh flavor inventive pizza fan attitude staff liked assortment pizza available regular menu invented pizza special shared friend special pizza brussel sprout caramelized onion prosciutto end say ingredient worked well thought pizza little dry could used cheese also tried special pepperoni roll tasted good one thin slice pepperoni huge roll pizza dough let cheap meat lastly got salad mix green apple vinaigrette nice green choice one salad topping thing thought ruined would 4 star rating wait staff absentminded slow also thought waiter snippy friendly know everyone day avg rating would inclined try
2015-11-21,3,local pizza place try cool new dinner spot fall short dozzino fine nice place go friday night friend bring bottle wine share pie actually problem pizza mediocre filling pie personal sized leaf hungry really much dough sparse filling sauce cheese topping n't make much pizza leaf eating really good dough much else diavola umberto spinach fall category plenty good pizza hoboken looking pizza go looking spot hang go dozzino
2015-11-20,3,byob nice little pizzeria hoboken seating front back outside outside would definitely nice summer time thursday night closed back dining area seating front still somewhat busy thursday late evening service good rushed n't care diner stayed bit longer finish byo wine pizza 14 spinach artichoke thought bit bland okdiavolo definitely favorite bit spicy calabrese salami top overall ok pizza place
2015-10-18,1,service abrupt rude trashed canvas wine tote literally threw trash byob n't worth restaurant take pound flesh belonging place person pizza mediocre uninteresting could make thing home pizza stone minimal effort trolling seriouseats com ditto crostini plus n't worry demented server stealing anything nailed home find restaurant blight neighborhood nuisance
2015-10-10,5,best pizza ever life fresh ingredient great vibe must visit hoboken
2015-10-01,5,great rustic pizza nice modern environment relaxed outdoor seating serve good espresso
2015-09-21,1,let start saying family private party dozzino yesterday afternoon start 2pm rented back room along patio several group arrived approximately 2:15pm motioned make way back area found long table chair open door patio rest party approx 25 people came 2:30pm everyone arrived began mingle server made appearance began slam large bag ice onto pavement several slam proceeded pour ice chip bucket containing glass soda bottle sitting sun chilled prior arrival never mind fact witness ice smashing spectacle let add soda bucket left patio next large collection scrap iron recyclables suppose thankful bottle opener provided u upon seat rusted vespa another member party politely asked glass ice cube told ice accommodation made could attempt throw tray freezer n't restaurant food several plate appetizer served buffet style along main entree assortment different pizza say fresh rather tasty however small ration bite make sure everyone enough said small plate contained two pound macaroni wondered wind blew would pasta blow never saw large amount piled onto plate dishwasher broke large bowel never arrived amazon mention pasta tasted like left over would receive pizza hut buffet vega could n't tell tomato sauce tasted like rather dressing hint tomato since napkin sight contemplated going wipe tomato dressing finger event dripped happy say server made second appearance day brought u paper towel bathroom came time cake fortunately relative ordered cake plate knife slapped onto table served piece made nice cake-cutting ceremony let add consumed cake continued drink last warm water soft drink wine another server came along announced taking coffee order aunt asked could please regular coffee milk stared asked go tubing hudson trash reply restaurant regular decaf coffee could make espresso latte americano etc ordered came table like slop cup latte watered cold stale would n't ladle crap throat diabetic horrible continued clear plate silver wear end extravaganza please beware planning using men restroom light work keep hand front like good old fashioned game hide seek let hope n't find anyone travel sink n't expect soap paper towel dry hand concerned flickering christmas light around mirror fumbled find handle door hoping n't going seizure let short time later proceeded leave normally would thank wait staff crew five busy texting sitting counter feeling one must get try sneak someone 3rd rate bbq crashed rude left feeling hungry thirsty vulnerable place byob suggest bring following:1 ice cubes2 napkins3 antibacterial wipedo n't forget stop starbucks way home
2015-08-29,2,pizza hoboken 2 thing fit together seamlessly unfortunately say dozzinos atmosphere welcoming rustic authentic however good thing end run garlic mozzarella pizza dry bland could argued n't much pizza best group girl smaller appetite looking neighborhood byob
2015-08-02,4,pizza really great want best bet eat delivery roll dice time wo n't deliver 5 time tried get pizza delivered delivered twice neglect part overloaded ca n't sustain level order impression get worth trip though shame delivery inconsistent
2015-08-02,1,n't walk friday night 9:30 happen first tell n't table 6 outside say ok change reason ca n't seat u dough crazy huh whether food good lot learn customer service important menu
2015-06-29,5,secret dozzino best byob joint hoboken bad experience 20 time eaten normally stick pizza rather fill appetizer special offer top 5 pizza order:1 honey perfect combination salty sweet2 johnny bismark nothing bad egg prosciutto pizza3 breakfast club although usually one 4 actual mushroom yum5 cipolla carmalized onion win
2015-06-11,4,great food cool vibe byob hoboken hidden gem awesome outdoor patio bocce
2015-06-02,3,wife go back probably 4-5 time year since opened year ago service staff gotten much better pizza gone downhill used unique delicious turned skimpy topping little cheese dough shame space byob make one best atmosphere town
2015-05-26,2,read dozzino nj com list best pizzeria state got honorable mention believe great pizzeria hoboken never heard try checked website wed evening said open tip 11 walked arrived 9:10 quickly told stopped seating 9 waiter little attitude told well single diner plenty seat available still turned away well good first impression returned two day later friend anxiously wanting try dozzino ordered three pie ordered spinach pie friend ordered special pie prosciutto ca n't remember third pie well quickly underwhelmed crust fantastic felt topping skimpy short pizza kind bland one point asked cup sauce add little flavor waiter came back 5 minute later cup sauce stone cold bill arrived realized special posciutto pizza 19 hmm 19 buck small sized pizza skimpy topping really hoped place going great sadly disappointed would go back
2015-05-18,2,great pizza staff snobby slow walk act like grateful let also ordered salad literally weed could pick sidewalk price absolutely worth
2015-05-09,5,let say love place feel like relaxing cafe italy used live hoboken far miss much visit friend hoboken always suggest place bring bottle wine byob casually order pizza salad relax catch pizza always good vibe great fun sit communal table back make new friend see order time fave diablo menu order uncle leo whenever brussel sprout pizza list salad also always fresh delicious well go early ensure get table warmer month outside also great
2015-04-30,5,tried breakfast pizza pizza egg maple syrup also extreme cheese pizza food fantastic byob real good well would love visit cheer
2015-04-12,5,amazing pizza love place byob great thin crust always special lot ingredient sourced local farm everything really fresh hudson one favorite put egg right top insane mushroom also amazing white pizza option one favorite spot hoboken get superrrr loud crowded complaint
