date,rating,review
2018-03-14,4,ordered delivery impressed ordered 3 gyro sandwich delicious even husband liked hard please come greek food spinach pie still warm crispy soggy mother thought fantastic mom got lemmon soup said delicious ff really good also would like mention delivery sent reasonable time hour sunday night hoboken bad impressive part everything still hot soggy well ff soggy almost impossible keep crunchy getting delivery expected totally fine first time ordering gave 4 start keep getting service like def increase 5 star
2018-03-12,5,love place order regularly couple time month since opened food consistently fresh prepared well delivered promptly best greek salad hoboken opinion messed order one time upon calling inform mistake quickly delivered replacement salad free dessert hand written apology note customer service excellent highly recommend greektown
2018-03-11,5,finally good greek restaurant hoboken food fantastic service great ton time never disappointment highly recommend
2018-03-01,5,much healthier option restaurant hoboken plus food mostly pretty good entree dish good
2018-02-25,2,go-to greek hoboken place get better review decided give go ordered gyro sandwich sauteed broccoli side wife ordered greek salad sandwich blah broccoli cooked could n't eat also n't provide tzatziki sauce side giving 2 star wife said salad decent greek def better give extra tzatziki sauce free sauce meat taste way better ordering
2018-02-09,5,crispy crispy crispy crispy zucchini eggplant chip heaven earth deep fryer black magic always get yeero never disappointed food consistently good fast chip honestly may still extoll virtue deathbed
2018-01-04,1,place joke placed order seamless waited 1 5 hr called told delivering area get sh together
2017-12-28,5,finally got glad place cozy people welcoming service stellar food delicious chicken avgolemono soup far best ever always order soup staple judge greek place serious really best tried greek chip fried zucchini eggplant chip grated cheese tzatziki wow two cheese meld gorgeously together flavor bomb loved tried yeero twist name delicious plan try platter next time trip salad ordered seared pork chop grilled veges greek fry waitress hamida recommended dish served fresh lemon wedge thing would say give lemon know would absolutely accommodate said start stellar service hamida attentive took great care u pork hard sear personally would liked slightly le cooked lemon made dish grilled veges quite good liked lemon zucchini eggplant red pepper tomato never made dessert trip full plan come back soon dreaming chicken soup glad finally decent greek place hoboken live weehawken yes said would deliver u yay great place make sure stop
2017-12-03,4,got lamb pita platter grilled octopus appetizer reading menu like platter close double price portion huge two u full 1 main 1 app lamb pita platter came salad rice fry lamb come skewer pretty good grilled octopus made meal delicious tender juicy smoky loved fresh tomato mix came really completed dish
2017-11-12,2,let say would easily 4 5 star review except 2 thing first believe lot menu priced got yeero pita fry nearly 10 tax opinion based amount food closer 7 also ordered online confusion forgot fry got yeero delicious plenty meat plus yeero fry n't worth 10 mention forgot fry
2017-10-29,2,one greek another average greek place gyro meat dry bland look like cut circular mound meat let sit tzatziki ok nothing special lot garlic chicken gyro better still par better greek food also ordered greek salad bad tried place 2 occasion par best bet go astoria manhattan get greek fix
2017-10-19,5,living city chance lot greek food greektown par ahead curve got grilled chicken platter shocked much food given could easily split two meal tel food good quality space clean attentive service easily regular whenever hoboken
2017-10-17,2,tuesday 5:30pm 10 17 2017i ordered gyro platter always delicious time ordered one half decided try something new ordered stuffed crispy chicken 18 00 appetizer share spinach pie 7 00since sticking cheese spinach two fried flat piece chicken called stuffed chicken spinach pie came completely burnt inedible really disappointed
2017-10-08,1,food delicious waitress letting people smoke outdoor seating area brought attention like oh well outside probably ok shame wanted enjoy food weather outdoors patio something like ruined whole experience food good could n't get probably wo n't return
2017-09-29,5,great placed last minute take order large order 15 expectation met every level great food thank
2017-09-12,5,place started average really seems stepped past month chicken dish huge tender ample rice veggie pita always amazing well went going occasionally least week often order lunch menu also great deal
2017-08-28,5,delicious first time ordered place delivery guy time friendly got chicken pita platter fry greek side salad chicken kebob perfectly seasoned fry amazing full eat salad bite good nothing bad say food service would definitely order
2017-08-26,4,liked ordered yuerbo greek salad chicken yuerbo pita rice salad meat wee tender flavorful rice also excellent definitely ordering
2017-08-24,5,coworkers raving place decided give try got yeero lunch special expected came side order fry also ordered tzatziki pita appetizer expecting fry event everything phenomenal fresh tzatziki best long time young lady working register friendly definitely visit
2017-08-17,5,place underrated best best greek food hoboken honesty probably best greek food ever service warm welcoming really get bang buck quality food price outrageous got ta check place
2017-08-16,5,recommend place highly staff great chicken avgolemono soup outstanding
2017-08-06,4,greek town greek spot hoboken friend stopped quick bite unfortunately gyro meat 86ed karina host accommodating giving indecisive pal solid recommendation grape leaf grilled lamb plate delish definitely returning live hobo ordering delivery
2017-08-06,2,passing restaurant quite time always wanted try today finally stoped ordered item menu two star really food actually really good server amazing welcoming however n't rating would zero manager present horrible attitude simply disgusting unwelcoming condescending snobby rude wish knew name put could n't even approach busy outside speaking friend instead assisting staff sad see someone like running restaurant leading employee clearly care client
2017-08-01,3,meaning go restaurant awhile finally craving greek tonight boyfriend went around 8 p offered outdoor indoor seating food overall average greek place ordered shrimp pita boyfriend got yeero platter side french fry platter also come greek side salad meat pretty juicy right amount greasy shrimp pita delicious n't skimp shrimp place byob pretty nice wine liquor store right across street service great n't many customer empty table still dirty previous customer wait given menu water silverware even gotten meal ask twice wine glass server seemed bit frantic think going order pick-up next time tbh
2017-07-16,1,ordered food 1 hour 35 minute ago first time called find food told driver made deliver way 15 minute later called told cashier left order think mine 10 minute later called said food restaurant told keep enjoy eating
2017-07-09,3,chicken gyro couple appetizer food n't bad nothing memorable one plus outdoor seating nice day may may return place craving great gyro better option
2017-06-24,4,hand best humus great first time hoboken able get reservation day four outdoor seating ordered tapa sampler octopus delicious generous highly recommend service terrific byob brought 3 bottle wine stayed couple hour actually last table leave staff never rushed u friendly would come time lived closer top bill 88 4 people
2017-06-14,3,craving greek food n't quite get sought nice simple place indoor outdoor seating stay busy takeout delivery business hummus pita excellent liked greektown salad grilled octopus underwhelmed shrimp entree entree big loaded orzo shrimp lacked color flavor wine shop across street want bring wine server good one man band work phone table
2017-06-12,1,well usual go place greek wife decided try something new thus began finest hour yikeswe ordered lamb chicken yeerothe food cold tzatziki sauce non existent watery whatever therei hungry ate wife n't bother since really blandthe vegetable cut haste pathetic say least oh yeah also 3 delivery feeavoid cost
2017-06-03,3,best hummus think ever flavor amazing wish little chunkier texture preference chicken yeero also great flavor section outside sitting n't get take advantage definitely back soon also think byob perfect looking forward going back healthy option lunch taking star service first time forgot french fry 2nd time forgot hummus empty time ca n't say busy short handed listening
2017-05-07,3,kudos restaurant showed late near closing time sat u ordered overall food good service decent price expected affordable ordered baklava biggest piece ever seen restaurant good flavor
2017-05-04,3,went place couple week ago horrible greatest greek ever think staff friendly helpful expecting menu food spicy feta dip tasted like put canned chili warmed feta main dish n't bad typical greek fast food go would n't ritual
2017-04-30,5,absolutely amazing first communion confirmation brunch greektown best decision ever boyfriend coming greektown since opened first worried might fit party 17 people really love food went michael owner extremely helpful accommodating helped put together menu family style appetizer side gave guest option choosing entree small selection apps prepared variety dip u well haloumi greek salad one reason boyfriend regular entree guest chose either yeero greek burger grilled chicken pita almost everyone went yeero side fry rice good vegetable guest loved food could n't stop raving delicious server aveda hopefully spelling correctly super attentive always made sure everything going great whole time brought wine dessert helped coordinate everything food delicious staff michael great thank greektown
2017-04-05,5,rarely write review place merit one seeing many business location greektown finally arrives clear stay every dish menu satisfying tend pretty healthy well husband mediterranean refuse eat regional cuisine unless crispy stuffed chicken must mention byo across street liquor store
2017-03-24,3,sum bad spot several time given convenience close proximity path however time pas place friend simply elect go elsewhere 9 time 10 said bad option absolutely worth trying never keep thing mind food wow presentation nice n't let fool quality leaf something desired suppose cool menu translated english example spanakopita simply called spinach pie menu guaranteed reduce confusion give extra star would otherwise byob liquor store across street
2017-03-11,4,great food spicy feta dip chicken gyro platter lot food good definitely recommend coming mood good greek food also staff friendly helpful loved
2017-03-08,5,place amazing totally recommend going lunch plenty food option choose love atmosphere clean love different greek product purchase
2017-03-04,4,first time trying place good stuff salad fresh plentiful gyro meat cooked nicely dry definitely going back new greek spot hoboken
2017-02-26,5,glad stumbled upon place sunday night walked restaurant totally empty seemed ton delivery order going decided give shot staff immediately welcoming waitress wish could remember name gave u recommendation answered detail question menu even sweet enough bring u house dessert end meal rice pudding delicious perfect end dinner consistency creamy n't sweet dinner started grilled octopus order dish large portion perfectly grilled octopus bed roasted red pepper caper onion chickpea n't much say appetizer amazing char octopus blended well saltiness caper octopus also fresh perfectly cooked tender chewy followed octopus grilled chicken spinach rice entree grilled chicken kebab platter delicious huge portion took food home enough second meal chicken dish well seasoned dry needle say back would definitely recommend place anyone looking simple yet delicious casual byob restaurant
2017-02-19,5,super fresh food awesome service love outdoor seating delicious local place usually get soup platter two people share portion great size food delicious
2017-01-30,2,thought try place lunch given decent review ordered greek burger medium-rare came much rare side thing eggplant also grilled enough looking melt mouth eggplant consistency
2017-01-26,5,love greek salad grilled chicken dressing perfect wish gave 2 grape leaf v 1 yeeros good food always fresh order yeero fry separate le expensive platter
2017-01-15,2,terrible flaw service cool food came timely downside greek salad lettuce little brown seemed old also found hair inside chicken kebab also didnt taste totally freshmore like cooked hr warmed little dry tzatziki sauce weird watery full much flavor better fry pita fresh gyro okay told filling however little misleading offered fry fry dont come side stuffed inside gyro probably try sometime line good greek food wouldnt first choice area sure
2017-01-11,1,take something really serious give 1-star rating especially local small business pretty much everything experience couple month ago terrible n't want others waste money tried place overwhelmingly positive yelp review 3 thing ordered one octopus app could even called mediocre would generous got shrimp santorini awful especially instead shrimp gave chicken note version dish chicken menu accompanying orzo super mushy whole dish totally bland worse cafeteria food n't think ever sent food back chicken error egregious enough time waiter eventually came back plate shrimp also still quite piece chicken finally came back near end meal complained dish noting chicken left behind offer take 21 item bill n't want jerk n't demand certainly put notice happy customer overall bad food bad service n't bother sure others raving
2017-01-06,5,great addition neighborhood meaning try restaurant awhile mad getting sooner everything excellent price size meal great definitely back app spicy feta dip meal greek salad gyro platter spicy feta served cold warm fresh pita great starter gyro platter flavorful enough rice pita greek salad side still full dinner take home salad fresh flavorful 35
2016-12-20,5,never even heard place looking something close apartment cold weather found place yelp two block apartment never seemed walk direction service excellent n't busy friday night sure location cold weather ordered appetizer sampler absolutely delicious good size 2 people ordered platter one veggie one chicken enough food took home could n't finish restaurant byob waiter attentive pouring u water making sure everything needed answering question definitely back love found new place close apartment
2016-12-17,5,great greek place good range option grab cheap gyro yeero call 8-10 get fancier greek meal entree 20-30 price range everything fantastic definitely back
2016-12-16,5,ordered delivery greektown everything arrived warm quinoa salad yeero meat huge really happy another greek restaurant hoboken
2016-12-13,4,really good got greektown yeero lamb beef also french fry fat sandwich style delicious absolute perfect mixture vinegar flavor really complimented food reasonably priced take well
2016-12-08,3,found place yelp called pick order got chicken yeeros pretty good nothing crazy like review mention good probably order quick food post bar food total 9 95 think bit high quality food get rafiqi food truck platter 5 75 food taste better
2016-12-03,5,wow much better greek place town delicious hummus pita got chicken kebab platter point rice moist chicken tatziki greek salad come stole show yummy moved downtown midtown definitely found new spot
2016-11-24,5,girlfriend waiting try place awhile glad got 7 wed night place pretty much full got quickly attended waiter calamari settled start texture perfect taste fresh entree went chicken yeero platter since quite hungry order came nice timing wow hunger match big plate half chicken extra underneath french friend addition also given greek salad side also fresh tasty tzatziki sauce also amazing overall atmosphere nice food amazing staff also helpful attentive spoke owner minute also nice definitely going back
2016-11-21,3,simple restaurant well known basic dish generous portioned plate liked avgolemono lemon egg soup filling anticipated good place lunch
2016-11-12,4,byob greek hoboken intimate dining spot family town loved food portion huge would return also moderately priced
2016-11-06,2,giving review two star instead one waitress kind called attention fact chicken gyro raw undercooked apologetically explained never happened offered anything else free charge however partially eaten chicken n't cooked properly could n't think eating chicken unlike meat fish never served undercooked customer came excited try something different downtown hoboken left wondering whether get sick eat check food carefully
2016-10-22,4,place great came friend day ordered bunch appetizer dinner everything amazing got cold appetizer sampler spinach dip grilled octopus fried eggplant zucchini chip portion huge way much food two u loved everything zucchini eggplant chip little breaded would definitely recommend 3 thing favorite cold sampler came hummus spicy feta dip tzatziki sauce eggplant dip grape leaf beet served much warm pita loved waiter attentive sweet byob price fair definitely back
2016-10-19,3,excited try newish greek restaurant hoboken n't enjoy entree definitely give another shot dip sampler spinach pie looked pretty good dying try artichoke salad visited ordered tzatziki good shrimp santorini 21 shrimp fresh tomato spinach feta cheese orzo care think supporting ingredient probably fine shrimp n't taste fresh flavorful fella chicken orzo entree found chicken completely unseasoned term one experience would rate two star dish want try new byob rounding 3 star
2016-10-12,4,say hard time eating chicken lately place food fresh cooked perfection really enjoyed experience place clean food taste awesome staff nice everything came promptly back
2016-10-08,4,ok want go place better greek hoboken dying another greek spot town got spinach pie far superior greek insanely freshi chicken rice dish tomato feta basically licked clean lolmy husband got gyro loved said better greek meplus byob restaurant mean come people cant get better great service top
2016-10-07,5,ordered seamless pickup definitely order stuffed chicken salmon entree gyro everything delicious especially impressed little detail like cloth net halved lemon seed would n't get food fact side broccoli actually green good texture taste food general well presented even pick container portion also fair price highly recommend
2016-10-07,4,always enjoyed hoboken outpost local greek chain thrilled see competition quaint greektown similarly casual byob spot greektown also offered comparable level satisfaction service fantastic food enjoyable positive seasonal weather enabled u grab comfortable cushioned seat one outdoor table regaled basketful warm flavorful pita enjoy waited meal started meatball appetizer sadly found dry tasteless fact appear fresh dish literally put bad taste mouth greektown salad blew u away contain lettuce included large chunk tomato cucumber soft feta bold fresh simply delicious could get enough even thought one best ever chicken kebab entree included 2 skewer 8 chunk meat chicken tender well-marinated served another salad even fluffy pita buttery rice overall average experience worthy 3 5 star exceptional service led round 4 star
2016-10-02,3,nice place really liked atmosphere stuff nice everything cooked well greek salad pork mixed pita platter unfortunately n't like quality rice pork meat wish place well hoboken people probably prefer better quality food better use better product
2016-09-25,4,happy found place delicious great healthy greek food authentic delicious
2016-09-22,1,food trashy cheap quality cheap side service professionalism efficiency last saturday waitress offer u drink anything besides tap water offer coffee dessert barely spoke english wander owner find staff work wo n't come back
2016-09-20,4,place nice cute appetizer salad amazing gyro n't great tho would def go back greek salad w chicken apps
2016-09-12,4,good food quick service lunch special great price group 6 lunch served promptly u enjoyed meal gyro fry lunch special ordered extra side tzatziki wife enjoyed greek quinoa salad attest awesome couple bite gripe got bill never returned offer water refill presented otherwise nice addition hoboken culinary scene
2016-08-27,5,loved appetizer sampler lentil soup generous portion everything barely room entree always plus byob liquor store across street
2016-08-21,4,new go greek spot town husband always get gyro platter even come huge side salad typically get greek salad grilled chicken salmon delicious shrimp would n't recommend shrimp tasted bit rubbery greek fry fantastic hummus appetizer
2016-08-15,1,friday night three u decided try place ina mood greek food boiling hot inside open kitchen restaurant concept made place look really tacky cheap seemed ac working felt might well outside nonetheless still decided stay try food price affordable cheap side make alway doubt quality owner buy good quality food sell low price unless frozen junk add msg enhance flavor decided try shrimp santorini fake version real shrimp santorini original dish baked oven feta without spinach yeero platter awful taste n't resemble meat maybe meat left year year freezer bought cooked top brought u cold called greek fry tasted worse mac donald none server pleasant smiling greeting table apology keeping u wait drink food paying check unable answer question even though restaurant busy none server offer u anything drink besides asking u want tap water ask soft drink juice byo waitress holding glass rim dirty fingertip made u feel disgusted drink anything one others exactly obvious u none girl ever worked restaurant industry getting job many great choice greek food area definitely coming back reply owner wanted make restaurant concept greece great tale someone never greece however none resembles greece open kitchen restaurant concept food yeero nothing taste yeero greece taste like frozen many year ready made cone meat n't know using msg say one waiter said use everything taste better interested look cleanliness kitchen staff walking around dirty shirt apron sweaty bad odor please n't tell waiter also work greece n't attack customer rather work issue brought attention find way improve restaurant food staff quality
2016-08-14,2,buddy said dinner feeling greek seeing place listed hot new business yelp open three month solidified plan join first impression place casual affordable expensive thing menu 24 lamb chop byob also plus speak lamb pita platter quite filling 17 give choice gyro kebab opted gyro pretty disappointed meat served chopped rather shaved never gyro thick chunk meat wanted thick chunk meat would ordered kebab add insult injury meat cold side option fry rice saw fry likelihood frozen opted rice turned perfectly cooked delicious tzatziki sauce also ca n't speak probably bit garlicky buddy kept popping gum night night went 100 degree outside inside restaurant might 99 evident fact ice bucket wine caused flooding reminiscent hurricane sandy brings service either waitress really bad day else need new profession never encountered unenthusiastic person whose income dependent tip still scratching head took long table 3 people get served handful people restaurant besides u must waited 30 minute food guessing either forgot place order else kitchen equally bad day server cold lamb finally ready absolutely sense urgency delivering table least bit apologetic amount greek option area ca n't imagine greek town town long n't get together
2016-08-12,3,3 star potential love greek food greek town opened one greek restaurant town give try greek town sits corner block away path byob liquor store conveniently located across street sat outside summer night chair cute blue white striped pillow played nicely greek theme really get bang buck portion huge food pretty good got grilled octopus much bigger portion restaurant shrimp orzo crusted chicken potato baklava n't remember specific dish name would definitely return try dish menu however like review mention service slow
2016-08-06,3,really excited walked always good gyro especially close got shrimp gyro fiance got chicken gyro sauce tasty vegetable crisp fresh protein cooked well however 8-9 gyro fry rice etc expensive side fast casual would totally pay price fry rice small salad side combination make filling meal starter dessert also expensive side conflicted expensive casual take place probably continue getting gyro elsewhere
2016-07-31,5,delicious assorted cold apps incredibly tasty also chicken pita greek chicken salad outstanding price reasonable definitely back
2016-07-29,5,really delish casual dining first big date spot food good time quality great time like dip pita get assortment platter little pricier get good amount everything sit outside byo always plus liquor store right across street happy addition hoboken happy every time walk see table filled
