date,rating,review
2016-07-27,4,coworker recommended place really happy see good review yelp bad yelp community review trump coworkers opinion usually takeout decided sit get office bit space really open bright clean huge window outdoor seating took advantage c lunch special awesome got greek salad grilled chicken 8 95 friend ordered salmon absolutely loved friend ordered chicken pita salad really good size lunch portion n't olive limited chicken feta really liked dressing light greek dressing salad also came side pita asked small side tzaziki waitress gladly brought would definitely come back lunch would probably order something else next time unless trying healthy like today service pretty slow like hour probably try takeout next time really really glad place opened good greek food option neighborhood
2016-07-22,5,greek town fabulous service top notch well food dipping appetizer great shrimp orzo delicious dessert incredible apple cake yummy great spot
2016-07-18,4,delicious affordable greek food tzatziki octopus greek salad w gyro meat everything really tasty portion generous definitely going back soon
2016-07-16,4,greek town hot new restaurant hoboken boy glad greek food neighborhood though authentic food delicious chicken gyro brother beef lamb gyro nostimo mean delicious greek stamp approval frappe amazing
2016-07-12,5,absolutely terrific greek food thank arriving finally figured cater greek food lover town everything figured work perfectly hoboken including liquor store across street byob experience mediterranean food second none
2016-07-08,5,good new place byob wonderful people picky drink food service good crispy stuffed chicken especially good dill love outdoor seating nice weather day bonus play good greek music inside please never change n't greek coffee moment told future ca n't wait definitely back happy restaurant option
2016-07-03,5,first time n't think ever left yelp review place deserves one staff extremely friendly attentive food delicious portion especially generous pricing reasonable definitely back casual atmosphere great easy lunch dinner friend alone octopus appetizer amazing greektown salad tradition horiatiki salad also fantastic highly recommend trying place update even though n't appear menu several traditional greek dessert owner graciously treated rice pudding wow definitely homemade delish leave room something sweet
2016-06-29,3,service ok chicken pita delicious really need structure baklava good give another chance
2016-06-22,4,kid lunch special chicken sandwhich greek fry little picky eater ate would preferred smaller chicken piece picky meat ordered baklava 6 00 thought little pricy lot nut delish
2016-06-20,4,spicy feta dip good would probably order alone dinner byo causal good girl night dinner didnt feel like date spot also tuesday night
2016-06-19,4,happy nice greek spot neighborhood sat outside sunday night serve mike attentive friendly cold appetizer platter seen photo split seafood platter yeero platter food came really fast still nice presentation standouts appetizer platter spicy feta really great stuffed leaf dense tzatziki octopus tender juicy wonderful smokiness mike pointed lamb fresh frozen definitely delicious portion ample feel free share bill came 55 cold appetizer combo seafood platter gyro platter cheese appetizer wanted well lamb skewer bit disappointment said sunday evening father day pretty well back stuff missed try delivery available week review delicious friendly welcome addition neighborhood
2016-06-14,4,new restaurant open walk work try waitstaff attentive almost point impatience accommodated group putting together table outdoor patio appreciative price standard good greek restaurant portion size large actually grilled octopus appetizer main course enough dinner food came reasonable quickly gyro yeeros greek salmon entree also large told quite tasty top byob overall ambiance lacking anything except dinner friend family still come back mood greek
2016-06-12,5,amazing happy see authentic greek restaurant open hoboken place byob great small plate regular entree boyfriend sampled cold apps calamari octopus could n't get enough
2016-06-12,5,girlfriend went dinner last night great time staff attentive food delicious greektown authentic greek restaurant worth visiting casual dinner
2016-06-11,4,waiting new place open looking forward trying greek town finally got try last week disappointed super fancy decent tasty option think location need loved appetizer sampler salad really fresh low key byob 2 thing love understand serving breakfast soon well nice option overall think great potential solid local option
2016-06-10,5,always exciting new restaurant open area tried place first time definitely going back calamari appetizer delicious fresh entree chicken kebab platter fry great portion size everything served hot also byob plus
2016-06-08,3,hate give first 3 star review let first say really think place 4 5 star also let preface would return eat sat outside immediately greeted waiter quickly asked wanted anything drink ready order literally sat maybe 45 second came back minute later exaggerating minute later still n't ready order took 10 min come back food took 40 min come waiter apologetic think great takeout place date spot best greek food hoboken definitely potential
2016-06-05,5,tried first time loved casual byob outdoor seating friendly staff appetizer assortment delicious fresh-6 small portion cold apps-tzatziki spicy feta dip hummus beet eggplant dip stuffed grape leaf also tried yeero chicken pita-very good definitely back soon
2016-06-04,5,fantastic stopped fiance dinner delicious started cold sampler highly recommend tzatiki hummus eggplant particular stood seemed small end nearly stuffed could comfortably appetizer four entree yeero patter chicken platter yeero perfectly seasoned accompanying rice perfect chicken perfectly cooked juicy tender nice touch lemon definitely regular
2016-05-31,3,went lunch wife got order wrong food decent small portion price sticking greek place hoboken
2016-05-21,4,solid greek spot came lunch weekend wanted seeing new place good byo huge plus hummus good could used spice top meat good pita yummy waitstaff friendly maybe little slow price good back sure
2016-05-19,5,waiting long nice restaurant open location prayed would delicious one well someone heard u restaurant opened food delicious ordered yeeros extra side sauce expected byob right front best liquor store mendoza family run across get wine relax service wonderful fast kind 100 recommended good addition hoboken foodie like u
2016-05-19,4,really promising new spot pita boyfriend yeero enormous fresh delicious split best baklava ever also byob weather nice great sit outside good service
2016-05-15,4,tried new place last night surely back great service good food reasonable price tzatziki great gyro meat well-seasoned platter worth extra buck byob put wine bottle ice keep beer fridge bring chilled glass waiter said getting outdoor seating next week memorial day planning offering brunch greek brunch whatever regular brunch byob outdoor brunch sold
2016-05-14,4,solid greek food salad amazing pork chop huge delicious baklava die french fry perfectly seasoned service attentive friendly place new would expect ramp soon table opening outside day told byob liquor store across street nice
2016-05-13,4,love greek food really one cuisine hoboken struggle restaurant still work attribute hiccup week old takeout ordered lentil soup excellent greek salad shrimp grilled chicken platter grilled chicken platter came decent sized greek salad tzatziki fry although ordered rice grilled chicken flavorful juicy greek salad balanced tasty compared similar greek restaurant price bit steep also surprised n't offer dessert n't love baklava meal give restaurant 4 star ca n't argue good food think price adjustment greek town potential really well least hopeful
2016-05-13,4,wife ordered chicken gyro 8 got pork chop 18 take chicken gyro pretty good chicken chunk large juicy vegetable top fresh appetizing good price gyro unsure platter though add 7 fry salad maybe deluxe salad wack iceberg lettuce tomato salad pork chop dinner great 2 large thicker cut pork chop juicy perfectly cooked could used bit flavor willing give thumb came french fry grilled vegetable really good good assortment asparagus pepper onion perfect definitely willing go back thought worthwhile try considering opened definitely return
2016-05-07,1,wife disappointed meal gyro meat tough fatty price high quality low ate half portion threw rest away went slice street
