date,rating,review
2020-11-24,5,visited cafe work decided get hot chocolate got small small large option staff welcoming nice smiling whole time great see early morning hot chocolate tasted fresh chocolatey course hot perfect cold weather love place small seems homey christmas decor festive nice try something else next time
2020-10-25,5,sure others really enjoy place either simple cute chic decor tried special drink solid service good friendly staff great experience joboken cafe
2020-10-20,5,excellent coffee b great food option music great make feel like palace video get banana bread delicious
2020-06-29,1,prime location try n't think try ever cappuccino unbelievably tasty maybe milk overall cappuccino making skill literally form tasted like watered coffee milk
2020-02-19,4,regular work manhattan stop nearly every morning way location make seamless stop way city usual order hot coffee bit almond milk sometimes gf v banana bread pastry tasty staff friendly get order fast coffee opinion delicious best option area reason gave four five star to-go cup without fail coffee leak somehow lid deposit coffee hand jacket never problem bad enough sometimes deters stopping even though love coffee
2019-10-12,5,banana bread night oat joboken cafe go breakfast day big fan coffee creative sign black board outside
2019-10-07,5,amazing iced coffee cold brew refreshing slightest bit acidic staff friendly price low would come daily lived closer
2019-07-10,5,one best cold brew banana bread die nice quick service needed place near train station
2019-05-18,5,requirement good coffee place joboken hit great brew fast service friendly staff im sure get crazy packed weekday fought 0 line saturday enjoying heck cold brew price also par coffee place nyc sure sure come back insider tip rent car hoboken need caffeine fix accompany drive
2019-04-29,5,joboken cutest lil coffee shop cutest darn name perfect place stop right hop path head work shop small never experienced bad line baristas good getting coffee asap skip starbucks head joboken
2019-03-20,5,look forward seeing andrea rest sweet friendly staff every morning always two minute like homemade breakfast offer specifically homemade seed granola bar sometimes go way come weekend even though n't need go toward path iced oat milk latte good always welcome pup
2019-02-14,5,andrea barista simply amazing actually whole staff super friendly every morning look forward grab joboken coffee get day spot convenient pastry fresh well feel like grabbing coffee joboken routine talk andrea always great mood make customer feel like friend love love
2019-01-04,5,every morning start day banana flax seed bread today far best yet perfect texture moist although always tasty sometimes dry keep making like today batch 01 04 2019 thank happy new year
2018-12-27,5,convenience big thing come cafe there indoor seating think thats intentional u busy commuter need cup way path perfect staff also super super sweet intimate setting go enough staff really get know take coffee coffee n't absolute best everything else perfect
2018-12-05,5,love everything coffee shop staff super friendly coffee shop clean great location love hazelnut latte skim milk thing wish opened 5am take 538am train nonetheless always happy coffee service
2018-10-30,4,location really convenient perfect place pick coffee morning going work small really cute outdoor seating ordered small ginger-lemon tea chocolate croissant totaling 7 fair originally wanted tea hot unfortunately ginger lemon come cold chocolate croissant toasted honestly tasted average wish food option small space ca n't helped guess adding something warm menu would appreciated especially cold weather coming place amazing cute convenient cafe grab quick bite drink commute
2018-10-13,5,great spot next path coffee hand one best hoboken rather surprising considering location line reasonable highly recommend
2018-08-17,5,best coffee town try cold brew place authentic convenient get
2018-06-29,4,start location prime u commuter place opened option coffee right next path dunkin need say coffee quality price definitely reflect whole milk super creamy delicious also love small large sized tea priced equally appreciate honesty water free would give 5 star except coffee never actually reasonably filled brim pet peeve mine ex-barista espresso shot burnt couple time great addition town
2018-05-24,2,owner rude coffee n't great wont going back unless desperate coffee commute
2018-04-30,5,cute grab go spot getting hot matcha hoping warms soon try iced version taste great service super friendly
2018-04-25,2,wish could give place better rating cafe cute staff friendly location convenient well right next path station room seating unfortunately coffee average pastry decent felt like price high serving compared similar cafe manhattan couple better option within 2 block cafe recommend
2018-04-21,4,cute little place right front path entrance hoboken opinion coffee really good size small
2018-04-17,4,n't buy coffee every morning every like order cappuccino prefer support local instead going starbucks possible morning tried joboken worker super friendly pleasant cappuccino 3 75 cup 30 smaller cup get starbucks like espresso cup immediate reaction disappointment discussing coffee aficionado friend definitely suggested probably coffee milk better quality correct ratio coffee milk though someone n't really know difference bummed small size super coffee refined palate barista good probably love coffee tasty sure balthazar pastry excellent coffee cup size normal sized want luck specialty coffee drink coffee aficionado prefer cup size quality lol told may get bang buck elsewhere
2018-04-09,5,teeny tiny place super cute great espresso outdoor seating look like still working lot kink detail n't hold great addition morning commute
