date,rating,review
2016-07-21,5,live block p quite treasure close older friendly italian couple run 0 50 short first time bring next time sandwich bought always absolutely murdered homemade mozzarella brought parent wo n't stop talking go back italian deli hoboken guy top 2 best wish better hour open weekend good living la dolce vita
2016-07-11,5,omg best italian sub ever ate whole entire life nothing compared roast beef salami ham mutz well worth 10 n't close early eating alot sadly 9-5 ruin
2016-06-23,5,hype real hype real let talk 2 27lb sandwich fresh mutz look new yorker grew eating lot ltalian hero arthur ave bronx sandwich p topped every hero ever feel like disgracing neighborhood italian grandma something saying good got similar sandwich vito p way better stop bring cash n't take credit card worth promise
2016-06-03,5,sandwich giantic certainly best mutz hoboken meatsbare delicious
2016-05-02,5,wow place amazing walked first time reading great review yelp right small amazing italian deli got roast beef ham mozz sub lettuce tomato onion roasted red pepper mozz amazing like review say sandwich bottle water around 12 sandwich could last 3 different meal food underpriced recieving people working nice seemed really enjoy work believe owner saw someone else yelp review picture definitely recommend place definitely going back side note cash atm pizza shop next door
2016-04-14,4,biancamano opinion 2nd italian deli hoboken slight best quite others acquire distinction fran rank offer similar sandwich deli biancamano definitely delicious mutz put elite level mutz prosciutto hero definitely left smile ca n't go wrong sandwich
2016-03-23,5,quick trip hoboken meeting started lunch officially best mozzarella hoboken according people choice award concur creamy fresh full flavor south jersey guy hoagie hero sub whatever known hoboken definitely best ever greeted promptly treated like old friend staff back town definitely start
2016-02-20,5,everyone tell vito deli best hoboken absolutely nothing p sandwich die tried quite sub life first one roast beef fresh mutz best sandwich ever life roast beef juicy flavorful need condiment mutz wow best mozzarella ever also load bread high choice meat cheese damn thing ca n't even close typical sandwich like got today roast beef turkey mutz l ran 10 far one meal got almost half stop get rest wrapped haha also family run kind sweet helpful people definitely good people kind feel great supporting ca n't praise deli new obsession hoboken
2016-02-11,5,best mozz ever love mozzarella try almost every deli go sandwich huge definitely get money worth pasta hot sandwich also good want one right thanks guy
2016-01-04,5,one complaint heard others place sandwich big awesome complaint could hope food business anyway place block mutz award winning good reason sandwich high-quality tend go tradition italian specialty like mortadella compliment mutz n't know mortadella maybe re-examine life priority
2015-12-16,5,rarely leave review place far best deli ever gone worker straight italy amazing genuine people run shop like actual deli italy sandwich affordable tonnnn cheese meat loaded mozz literally award winning world prosciutto fresh ever friend visit hoboken solely deli
2015-12-12,5,totally rediculous sandwich joint eating sandwich year typical deli sandwich call lip splitter good reason stuffed best meat cheese incredible italian bread speak sandwich sure deli item point well tip street parking hard findtip cook roast beef usually ready around 1100 go fast get early tip hard italian roll left take sandwich next level tip order half gynormous whole could feed family
2015-12-11,5,meat meat meat meat meat meat sincere apology bova bakery boston reign best italian sub ended moment took first bite good measure deli like strong italian believe amazing 9 got fully loaded italian piled high tastiest italian meat ever bread would n't even close lasted two lunch though good surprised n't kill whole thing one sitting one sandwich still need try roast beef mutz various parms know amazing one sandwich hard find right word accurately describe greatness italian guy could come every single day even n't market sandwich italian food italian side lot italian grocery buy one late lunch time stare every single thing sold chat awesome owner spoke course italian ate food lot place go hoboken food like many fantastic p moment top list go eat sandwich italian
2015-12-05,5,friend working hoboken asked meet lunch wanted go p biancamano hoboken institution 30 year ago lived directly across street although moved 96 still considers place like home really old school every year win best mutz contest food great sandwich pricey worth sandwich around 10 feed family 4 buddy sandwich sopressata mozzarella pepper inhaled half ate 1 4 roast beef ham mozz wrapped rest ate another 1 4 home shared husband evil dog made last delicious n't sold boar head mafia
2015-11-29,5,could best sandwich town wait city hoboken could go far say might best sandwich world abso-mutz-ely really put time love making sandwich watch see
2015-11-05,5,best sandwich nominated best mutz 3 straight year ca n't ever go wrong give good sandwich must go spot
2015-10-29,5,true story carried meatball plane way back los angeles still amazing
2015-10-25,5,best mozzarella ever would like call mutz staff helpful friendly sandwich good also nice piece history
2015-08-29,5,oh goodness fantastic deli living 3 year always wanted try traditional italian sandwich service perfect meat mozzarella fresher deli ever n't get started bread could eat ten loaf got c
2015-08-26,5,busy rush hour well worth wait cash good luck parking dont double park lose spot line
2015-08-10,5,stopped lunch try place glad sandwich made delicious mutz die sandwich huge wide made perfection highly recommended lunch dinner hot food also available
2015-07-30,5,mom pop shop core worth every dollar half sandwich easily split another person remember bring cash
2015-07-28,5,errand wanted try something different lunch decided get sandwich got chicken mozzarella technically n't menu guy helping assume owner problem friendly portion generous mutz cut thick amazing could eat half sandwich big ca n't wait eat half definitely back
2015-07-20,5,probably one best sandwich ever eaten mutz oh em gee literally thee best got roast beef turkey mutz roasted pepper onion sooooo filling got half literally split someone still full stuffed b c soo good couple working guessing owner super friendly bit pricey worth every penny paid 13 sandwich water seating outside inside must mutz cash
2015-07-11,5,absolute favorite place hand father grandfather went lunch dad brought home 1 4 lunch sandwich left n brother would literally fight it-it serious pete theresa amazing people hope n wish stay forever beautiful family walk like walking kitchen home best italian deli u whether order hot cold hard soft huge portion best hand made mozzarella never leave hungry thank p xoxo
2015-07-08,5,favorite italian deli hoboken good drop sandwich mozzarella take hostess gift n't get eaten u humongous sandwich great take home sit inside outside
2015-06-23,5,want real italian sub real deli meat come p biancamano come couple time time little different wife went store ordered prosciutto mozzarella sub originally planned guess run bread mozzarella problem though prosciutto swiss cheese vast array cured meat make inconvenience went bakery bread problem solved prosciutto heaven earth place quality excellent come back great customer service well even mozzarella gone happens best hoboken
2015-06-16,5,know sandwich great random stranger street walk ask got prosciutto soft take-apart mozzarella hot pepper sweet pepper mustard 10 75
2015-06-03,5,excellent friendly folk food awesome fresh mozzarella known everything good sandwich huge definitely big bite prepared
2015-05-27,5,saw write-up yelp local italian delicatessen guess favorite listed first husband n't lived hoboken many year however know best italian deli going biancamano many year even back peter parent owned ran business best italian deli hand lot italian deli hoboken teresa peter hard working cook best authentic italian food
2015-04-23,5,place everthing would expect italian deli ordered sandwich must half pound assorted cold cut bread fresh tasty best part fresh muttzarella huge tasty sandwich reasonable price hiny probably share sandwich someone really lot one person
2015-04-03,5,new favorite lunch spot since moving uptown took job working home day old school place simple deceptively spacious inside seating inside teetered 4 star n't take credit card could n't bring love much n't billion option outstanding mutz divine probably one place town rival fiore mutz quite literally mom pop couple run nicest people always smile say hi love sandwich ginormous saw review thought pfft eat whole one happening one half enough meal sandwich run 8-10 one best value town cash hand choice lunch absolutely disappointed grabbing hoagie
2015-03-20,5,best value town portion insane take look pic get sense personal favorite chicken parm hamcappicolaprosciuttopepperoni mozzarella also turkey mozz roasted peppersmr mr b nice well always shocked hoboken people tried place highly recommend visit
2015-03-19,4,review pertains hoboken mozzarella tour took last week official tour something decided embark upon visit north comparison 5 different hoboken deli make fresh mozzarella cheese growing hoboken feel like know thing good pizza good bagel best mozzarella cheese planet earth admit biased last 28 year gone primarily vito deli always mother favorite time around boyfriend never hoboken mozzarella cheese decided time put cheese test sure missed place limited time decided try 5 highest rated longest standing renowned town boyfriend never fresh mozzarella n't even recognize mozzarella cheese course told mozzarella cheese everything else packaged date imposter think important know exactly tasting recommend taste mozzarella location prior instead ordering sandwich taste really show mozz made tour went brief feedback location mozzarella feedback rating solely based caliber taste mozzarella cheese quality everything else sell service provide comparison vito since baseline vito made fresh 4 time daily tasting best choice hoboken come conclusion simply better fresh mozzarella cheese town vito anywhere world far concerned still favorite stop 1 vito buttery soft warm wet salty literally melt mouth stop 2 biancamano great mozzarella taste overall little chewier vito nice amount salt little wet brinestop 3 lisa great taste inside salty bite outside also bit chewier vito stop 4 fiore saltiest 5 mozzarella also coolest temperature-wise slightly chewier lisa biancamano 5 luca brasi coldest temperature-wise nice amount salt buttery however unfortunately found texture like cottage cheese start chewing exact review posted across 4 different location hoboken mozzarella tour
2015-02-17,5,sandwich best large portion cold cut choice bread soft hard mutz fresh soft hot food freshing made every day price fantastic
2015-02-07,2,first experience bad go back maybe day never know ordered chicken parm sandwich unlike sauce seemed dull color taste cutlet breaded like floury francaise parm also tried capicola prosciutto mozzarella hero pepper item nice drowned salt could see sandwich interior item inherently salty maybe add pinch cheese way much
2015-01-29,2,sandwich amazing happy find place butthen went today n saw owner making sandwich w bare hand glove handled cash n scratch back n touched salami n lettuce w bare hand yuk lost appetite sad place sooo good really wish lucky old couple awakening hygiene customer
2015-01-24,5,best sandwich meal around nicest family owns place serf great food never bad experience people go
2015-01-24,5,outrageous sandwich generous portion delicious high quality meat cheese fresh mozzarella cut right front generous portion delicious high quality meat fresh mozzarella true mom pop shop
2014-12-23,5,love italian deli large portion pay delicious best muttz hoboken
2014-11-07,5,sandwich massive cheap high quality mutz homemade saltier heavier side delicious satisfying ca n't wait go back tomorrow
2014-10-11,5,really n't get better biancamano coming since little girl dad favorite place since 80 mozzarella world sandwich always overflowing always order turkey mozz tomato mario teresa sweetest
2014-09-27,5,fantastic little deli washington highly recommend definitely coming back food amazing owner nice come wo n't disappointed
2014-09-16,4,huge sandwich great cold cut excellent mozz
2014-09-01,4,portion ridiculously huge ordered half sandwich barely finished half got ham cappicola fresh mozzarella lettuce tomato onion hot cherry pepper extra oil vinegar charge 25 cent topping condiment queen added pretty fast friendly service loved could actually sit inside outside unlike deli hoboken
2014-08-25,5,best sandwich hoboken saying ton love sandwich c best ever comment others though sure awesome n't power even try sandwich true love frankly one giving le 5 star clueless sober italian couple operate gem great people wish nothing continued success deserve well check guarantee disappointed
2014-08-22,5,stopped sandwich upon recommendation friend wow wow place amazing wish could give 6 star decor legit italian deli n't much room anything ordering waiting table inside outside however nice everything clean inviting smell freshness ingredient bathroom going guess one customer use staff man woman working counter assuming owner awesome friendly eager take order make food least seemed read mind exactly wanted tell care customer show everything food drink classic italian sub w two bag chip sub incredible never anything like meat fresh mustard vinegar really popped mutz god mutz definitely reason best hoboken honestly exaggerating place changed sandwich life value get sandwich ridiculously delicious huge couple buck think whole lunch 10 fantastic enough food two meal joke get money worth place hand best sandwich shop hoboken without doubt best sandwich shop every tried always order place opinion
2014-08-19,4,cheap massive sandwich saw one guy leaving pretty large sandwich ordered large thinking get little know twice size owner nice sandwich completely overstuffed people complaining happy problem mozzarella fresh pretty much get brick stuff left full love
2014-08-17,5,hoboken hidden gem best sandwich hoboken say confidence hubgry sandwich huge inexpensive could charge double sandwich still worth n't made yet missing
2014-08-13,5,grown going family owned run deli honestly say best deli area like everyone said mozzarella amazing sandwich big one could feed whole day finally husband wife team work behind counter could n't nicer
2014-08-13,5,best cheese cheese competition got mozzarella fiores vitamia p cheese favorite far texture taste owner friendly well recommendation go p cheese fiores garlic red pepper bread wo n't regret
2014-08-11,4,love sandwich one best place hoboken ever sandwich actually fill course eat another
2014-06-24,5,place good joke started salivating soon even decided write yelp review love sandwich truly could eat every day 3x day think turkey pepper mozzarella sandwich delicious sandwich pas lip condiment zero fresh baked bread flavorful marinated pepper delicious melt-in-your-mouth mozzarella turkey win prize seriously live brooklyn cross two river get sandwich good also one place everyone seems little skeptical walk set eye sandwich fall food love one bite boom turn true love
2014-04-22,5,know p biancamano hoboken mutzfest last year find much easier come italian deli hoboken week work parking seems better got one right front today strictly take-out place though couple table front sandwich wow big ordered 1 2 got home rest dinner wife sandwich super c special recommendation woman behind counter great call enjoyed immensely trust need 1 2 packed ham cappicola prosciutto pepperoni ca n't forget award winning fresh mutz topped lettuce tomato spicy mustard oil vinegar total price sandwich 8 75 deal also small selection salad hot daily special definitely worth look area mangia bene
2014-04-17,5,delicious italian sub never fan sandwich got addicted
2014-04-07,4,preface saying grown deli everywhere around consider deli connoisseur said moved hoboken ny n't know expect deli far good place great owner friendly gave sample muttz attentive accommodating huge mozzarella guy certainly distinguish good muttz meat galore everything galore term overstuffed understatement place eat could n't finish half meat sandwich normal ppl split half sandwich get two soda around 10 deal next time go next time get something even vegetable meat ratio lol
2014-04-01,5,best mutz state food people excellent clean professional mom pop place worth every penny whole sandwich whole loaf bread highly recommend try know back
2014-03-31,4,mozzarella best ever love fresh mutz often find little bland side perfect far sandwich mountain meat definitely delicious woah put much meat impossible actually close eat like sandwich normally totally fine lot mean think going use much really need bigger bread perhaps cut bread way top bottom actually taste ingredient together like supposed like open face sandwich fork knife maybe would ok really open face sandwich type guy definitely go back though still recommend anyone worth visit even cheese
2014-03-22,4,place disappoint mutz really great lunchmeat tasty shared seriously trying finish one seems close impossible mutz ham pepperoni prosciutto roasted red pepper lettuce honestly could left lettuce pepper sandwich stuffed impossible taste time cheese meat speaking stuffed actually n't like stuffed sandwich almost impossible eat seemed little excessive would fine half meat delicious owner friendly definitely back
2014-03-21,3,sandwich good huge mozzarella great stop latest trip really turned husband wife run place nice think need updating health code usually one care stuff eat anything anywhere eat truck greasy spoon place street cart dirty water hot dog nothing really phase last time went vegatables sandwich sitting open pepper onion tomato lettuce use one cutting board everything handle money food time n't care n't use glove make sandwich big deal turning around handling cash making change going back making sandwich no-no money one dirtiest thing hire someone work register wash hand complaining well last time ate everyone house got sick
2014-03-15,5,best sub hoboken four year lived got turkey mozzarella jam packed 6 50 could eat half due much turkey mozzarella put looking forward eating half another meal customer service really nice beware cash
2014-02-05,5,great sandwich best mozzarella hoboken sandwich huge defintely share another person
2014-02-05,5,exceptional sandwich stuffed mozzarella best jersey price right 5 star
2014-01-31,5,washington street n't many gem come sub place like gusting tummy luving taste bud huggin sub take bite bite bite never wanting end place get sub mutz must
2014-01-21,5,even wanted would n't able give place le 5 star quality amount food get price ridiculous massive sandwich 8 satisfy least 2 meal probably best mozz ever great kind friendly owner easily 5 star
2014-01-12,3,owner friendly made feel home went lunch 1 italian sub came fresh delicious cold cut issue sandwich loaded could n't enjoy sandwich eat cold cut separately bread went sandwich meal cold cut side bread people might ok n't tackling behemoth sandwich two different party came left least 2 lb mozz judging previous review mozz may main reason come making conclusion based two customer fact asked half monster wrapped could take go owner told next time-ah come fo da mozzarehhllaa sure legit sure returning mozz 3 star likely jump 5 pic sandwich could fed african village n't mean insensitive huge
2013-12-30,4,visited place saw review extremely good n't lying sandwich great would know big would got one split wife instead got one u wow lot food good leftover owner extremely nice made feel welcome definitely coming back
2013-11-18,5,always tell italian deli good despite full ca n't resist finishing second half p one place one best italian sub ever generous portion incredible mutz owner earth put amazing product
2013-10-30,5,five star rated yelp place eat hoboken believe deli place disappoint great italian sandwich cold-cuts pasta delicacy sandwich cheap even half sandwich fill two people possibly best fresh mozz ever reason place highest rating hoboken isnt hype fact probably untold secret land trendy hipster thrive superflous narcissistic notion blatant materialism
2013-10-03,5,nobody make italian sub like east coast least come find visiting nyc west coast friend introduce u fine establishment way airport ordered combo share boyfriend let tell boyfriend eat like one business ordered whole sandwich thinking would sweat polish flight thing stuffed capacity sopressata salami mortadella capicola mozzarella cheese lettuce tomato hot pepper oil vinegar owner sliced sub quarter rolled wrapper bagged u carrying bag around like carrying brick dense heavy upon first bite realized wayyyy head could n't even take bite everything take bite bread bite meat cheese bite side bread way smash thing good biteable size swear albeit able finish quarter save rest flight delicious well priced
2013-09-27,5,little biased know biancamano family fairly well living across street first 7 year lived town 1999-2006 10 block away always make trip going deli pas lisa way perfectly fine deli biancamano tend creature habit exception always get turkey provolone roasted red pepper crispy turkey provolone high-quality everything bianco roasted red pepper make sandwich awesome also gotten hot food year good also course waiting wo n't long grab italian candy sandwich huge incredible heck might head today biancamanos great people care customer always friendly great part community know deli town super good also biancamano deserves local fame
2013-09-16,5,p biancamano simply world class went buy sub tailgate metlife stadium sub beautiful promptly took picture sent friend seattle blown away n't type place west coast
2013-08-26,4,one word meeeenk little old deli run seems husband wife team move quick sandwich point sandwich prosciutto soppressata fresh mozzarella lettuce tomato fresh mozz delicious n't skimp amount give fullness sandwich might new favorite deli hoboken home run
2013-08-24,5,damn fine sandwich huge perfect get half half half half later need eat day got ham salami mutz ltm bf got b roast beef made house nice rare wish could go would obese
2013-08-22,5,5 star place little gem mozzarella amazing definitely worth trip went special c
2013-08-19,5,came friday afternoon lunch since work really close hoboken got c since seemed sandwich get establishment waited line noticed sign read cash thought enough cash without checking turned dollar short scramble back car dig coin cup holder got back store finally turn order lady asked wanted walked away left confused look face husband joked reassured n't ignoring waiting new shipment fresh bread got good laugh finally started making sandwich saw load fresh cut meat right bread overloaded idea getting half sub enough ate half half rest hour later place delicious get lot money top old couple extremely friendly another small note little old grandma barely walk making hot food back kitchen know place real italian
2013-08-07,4,see mutz fest hoboken tasty mozzarella add great flavor texture sub ca n't wait come back
2013-07-26,5,mutz best hoboken people choice award winner hoboken mutzfest good french baguette style bread load deli meat mean load owner italian couple always really nice people mutz mutz mutz
2013-07-14,5,hand best mozzarella ever fresh perfect blend salt slip bad boy fresh loaf italian bread along basil leaf olive oil get ready transported paradise instantly
2013-06-17,5,found place 1996 looking nj monthly 1996 10 best place eat read place 1 2 block friend place hair cult tried god huge 4 tall 20 long weight 4 lb mozzalella cheese make fresh everyday prosciutto make monster sandwich cost today 16 50 p biancamano 1116 washington ave hoboken nj 11th 12th p buy 1 2 sandwich 8 50
2013-06-16,5,kind obsessed upon hearing first visit owner immediately handed giant complimentary piece fresh mozzarella seriously best town ordered sandwich literally stuffed gill ingredient got half sub half enough handle whole visit pleasant delicious absolutely wait return
2013-06-11,5,always fan vito fiore never say wow amazing mutz sure n't stingy sandwich
2013-04-02,5,far best italian deli hoboken sure people jump say fiore vito lisa lucas popular likely n't live hoboken n't tasted p going since moved 12th street hoboken 2008 right around corner moved 3 time since always make priority get least month anytime friend come hang help move spend day going want grab sub always make point bring lived throughout hoboken near place tried multiple time rush walking home work yet always feel subpar p always get c balsamic oil without lettuce tomato b c sandwich packed typically get 2 whole sub 8 bring one work n't forewarned sandwich huge barely eat half one sitting thrilled pete owner told open sunday past football season going would get closed 1 really enjoy italian sub real italian deli try find better place money friendliness owner
2013-03-28,5,place make ridiculously sized sandwich ever seen load much meet need different eating strategy sandwich since literally ca n't even close sandwich fit food hole also place ca n't finish entire sandwich one sitting always split two meal definitely top deli choice cold sandwich n't tried hot sandwich yet comment wish closer apartment go often
2013-03-13,4,italian deli hoboken one always favorite best sandwich best mozz best around think better vito fiore lisa fran others plus owner nice helpful n't ask wife cut sandwich half otherwise piss bad mouthing deli 100x better almost anywhere else
