date,rating,review
2013-02-15,4,oh man great huge sandwich could finish half saying lot considering appetite p one hole-in-the-wall place love interior old-school italian deli chair table dining people behind counter seemed really nice great rapport patron loved vibe sandwich definitely lived expectation try c yes listed letter tremendous picture yelp accurately depict massive hero sandwich delicious almost good good favorite hoboken deli luca brasi favorite uptown deli back often possible
2013-02-13,5,best sandwich best mutz hoboken slice meat fresh sandwich half last least 2 meal owner also nice personable hard working italianos magnifico
2012-09-26,4,place one time thought great mozzarella prosciutto sub plenty meat mutz mutz opinion rival fiores term hoboken deli want ton meat cheese sandwich place would definitely highly recommend least trying mutz great
2012-09-10,5,possibly best eggplant parm ever love place get sandwich eat day
2012-08-08,5,place brings real italian flavor hoboken family known terry pete owner year even traveled hometown italy chance hard working pleasant people simply want serve amazing italian food always get sausage sandwich sans pepper gigantic hit spot well know mean outdoor seating enjoy people watching best reasonably priced even sell real italian food staple definitely cater event two year ago mom retirement party used service needle say tray empty party ended ca n't recommend enough
2012-07-25,5,sandwich amazing price give steal awesome service without doubt good variety sandwich
2012-07-12,5,make account review deli first guy work extremely friendlyi ordered ham fresh mootz extra mootz 8 buck half man let tell sub filled equal amount ham juicy cheese still bit shock delicious plus quantity received mind blowing never eaten better sub price entire life
2012-07-02,5,deli best fresh mozzarella around owner time really nice people sandwich piled high meat cheese roasted pepper great
2012-06-09,3,place good town crowded italian deli rank behind fiores vitos luca brasis
2012-06-04,5,load meat mutz like order ham salami mutz roasted red pepper might able find bun underneath go turkey mutz roasted red pepper lettuce little oil vinegar unreal small old school italian family owned deli n't try fancy n't look like much outside inside matter wo n't find ton gourmet side spread necessity making best sandwich town sandwich n't come standard lettuce tomato sure ask want basically tell everything want sandwich also like choose hard soft roll bring friend probably wo n't able eat one sandwich also offer incredibly affordable catering menu tried yet plan try soon
2012-05-30,5,moved area year ago till day make trip deli best fresh mutz ever combined fresh roast beef hot pepper sandwich worth stay longer gym
2012-05-19,5,family coming year food mediocre deli amazing place try replicate opinion p surpasses hoboken hungry must try place 5 star
2012-05-11,5,best sandwich hoboken anywhere matter freshest mozzerella planet great bread absolute perfection huge sandwich cost around 7 easily feed two people make place got try
2012-04-28,5,love place huge sandwich great hot plate never order thing like many people order together work
2012-04-27,5,far best homemade mozzarella hoboken sandwich huge impossible finish quality phenomenal
2012-04-23,5,may bowing peer pressure whatever think p biancamano part reason brother great time visiting week ago deli like denver couple run place freaking sweet really beat price stick let baby brother order n't remember called split half sandwich around 8 could eat half half pretty much every italian meat possible well pound provolone everything really delicious crazy amount funny watch put together equally funny watching brother trying finish half half-sandwich good effort cash
2012-04-09,4,wanting try place continuing journey trying find best sandwich hoboken pushed edge past weekend finally make walk hearing artie lange talk radio show awesome sandwich friday took walk check lunch deli cool little place wall italian dry good left hand side deli counter left walk think p stand mom pop old italian couple service daily hot special friday shrimp parm eggplant parm believe special seemed selling quickly sandwich though stayed course ordered two half sandwich ended way much food 2 people 2 people easily split single half totally satisfied sandwich stuffed meat fresh mozzarella well worth price take note want topping tomato lettuce pepper etc make sure ask otherwise sandwich come nothing meat cheese also cost bit extra price sandwich still reasonable big sandwich get bit sloppy big roll hold well punishment meat trying eat meat sliced fresh assembling sandwich fresh muzz cut huge chunk tossed generously bottom line sandwich good filling far favorite sandwich still coming vito hoboken block
2012-04-03,5,found place washington noticed fireman police like eat lunch old school italian fresh mozzarella sausage pepper meatball gravy place forever sandwich die husband wife team behind counter always make feel welcome shortage sandwich choice mortadella salami prosciutto usual suspect personal favorite turkey mozzarella soft roll lettuce tomato mayo warning small portion
2012-03-09,4,told friend try mozz absolutely amazing fiores overrated overpriced
2012-02-09,5,top notch sub shop usually go prosciutto de parma fresh mozzarella simply amazing geat price
2012-01-18,5,place solid 4 5 star sandwich ala half star yelp bump bad boy five star since guy behind counter amazing mutz mutz could solve war middle east well may exaggeration super duper good ordered chicken cutlet fresh mutz roasted hot pepper half sandwich might add huge delicious n't know n't come lettuce tomato sauce e mustard mayo oil vinegar must ask item little sad however still amazing think came 7 could eat half main squeeze ordered heart attack roll n't called really seriously like 4 lb various deli meat roast beef prosciutto salami pepperoni list go topped fresh mutz fact unaware order lettuce tomato sort condiment sammy big ole red block meat block fresh mutz extremely overwhelming intimidating overwhelming sandwich bf completely turned almost life sized submarine back p armed knowledge order work bad boy
2012-01-17,5,italian deli like reason love hoboken sandwich copious amount high-quality deli meat fresh mozz old world italian bread pretty sure ca n't go wrong anything c standout sure add hot sweet roasted pepper top owner could nicer special request note close 6 pm week plan accordingly even requires sneaking office early
2012-01-12,5,sandwich absolutely stacked one whole good three meal even large appetite husband wife team behind counter friendly well
2011-10-07,5,omg finally got chance come today hearing nothing rave review ca n't missing could n't nicer sandwich huge ended getting second half wrapped thick slice fresh mozz sandwich delish bargain huge sandwich place like make happy live town quality italian deli although one visit place already sitting top list ca n't wait go back
2011-07-18,5,coming p 20 year probably stop time year hit place regular basis think button would start popping shirt sandwich handful stuffed eating one offer soft crispy bread typical italian deli sandwich big fan muzz tasty usually get prosciutto salami muzz crispy bread soo good soo filling also hot food special every day outdoor seat summer table inside one great deli make hoboken p fiore vito ca n't go wrong place
2011-04-29,5,eating like thanksgiving better come least week best fast meal least 2 day serve one size hero ginormous kinda person like subway shekel slice cheese place mozz n't come slice come slab added top tower meat serve n't driving either vision start getting real foggy around bite number 7-8 already tried trading girlfriend mr behind counter mr biancamano smart rookie tactic
2011-04-18,5,home made mutz best sandwich town besides maybe fiore close far away take cash prepared
2011-03-12,5,spot brought yelp hiatus see nobody give place poor rating may get 4 star worst ca n't even understand maybe yelp suspend individual account hoboken kumate tournament every single deli hoboken invited participate fight death biancamano would play role van damme already decided 2012 apocalypse biancamano way parent going make sure save owner store en-route fam almost every italian deli hoboken n't make sense say deli better assume poster claim deli x best n't yet good almost n't want post anything keep low line n't bad right noteworthy incredibly fresh everything huge portion walking dead status consuming cheap open 6 personal favorite include italian meatball mozz sandwich
2010-08-15,5,fresh moz roasted red pepper m+p biancamano perfect sandwich
2010-07-08,5,best sandwich ever substantial sensational without draining wallet perfect transporting block two riverside park ready made picnic
2010-02-19,5,love healthy generous sandwich order go well orangina drink huge pricey must try place
2009-06-15,4,9 year since last biancamano sandwich seem even better faded memory space definitely spruced got sopressata fresh mozzarella hot chilli superb mozzarella nearly par famed fiore bread better make favourite sandwich place town must stop although say hesitation worried spoiling relaxed atmosphere one last bonus husband wife proprietor make feel home
2009-06-08,5,going 30 year food n't changed best really ca n't understand n't food tv traveling plane specially wrap well open flight passenger stare nice see husband wife working together kid grow best mozz u
2009-04-03,5,omg omg place amazing visiting hoboken week february told many many people get sandwich boy oh boy dissapointed sandwich huge moz best ever life bread soft chewy crusty one honestly ca n't even imagine better sandwich craving right write getting depressed san francisco doesnt place even begin compare place must
2008-06-30,4,biancamano make delicious huge sandwich deli fresh mozzarella make fantastic creamy smooth especially paired salty slice prosciutto roasted red pepper meaning stock dry pasta sell keep forgetting decent small selection italian imported food addition deli selection eggplant parm also really good
