date,rating,review
2021-09-26,5,best sandwich jersey started going 20 year ago hudson tea building opened one first tenant n't anything close quality value
2021-09-18,5,world italian sandwich nicest people usually go something wit prosciutto mutz pepper god great selection old school italian cooky
2021-09-13,5,best fresh mozzarella north jersey maybe entire state
2021-09-06,5,literally best sandwich big good enough share well even vegetarian love veggie sandwich offer husband raf turkey sandwich regular veggie sandwich try eggplant parm either hero pasta die couple run p also delight
2021-08-21,5,stopped yesterday get lunch got c roast beef fresh mozzarella grilled red pepper sandwich sooo crazy good mozzarella killer one fave mozzarella thus far good texture good taste put generous amount mozzarella sandwich well bread also good par italian deli shop area quite chewy tough chewy even cold wish bread warm resist fresh bread right oven rather typical among italian deli shop size oh even 12 amount meat cheese put worth every penny shop thus far favorite italian deli shop nyc hoboken jersey city area would definitely come back without doubt several excellent italian deli shop area personally tried one definitely special win heart somewhat smaller shop honest old school frill shop sure covid-19 era thing running minimal staff shop counter run 2 people possibly husband wife felt getting sandwich old country felt like legit thing way first timer like ordering food could quite challenging intimidating especially add-on like roasted pepper basil etc ca n't also spend 15 min wondering order got ta order sandwich pretty chop-chop appreciate fact 2 people working shop might customer waiting behind enjoy order outside limited 3-5 outdoor table right entrance door service though indoor dining area appears closed
2021-06-25,5,would give left kidney one sandwich best mozzarella town make sure grab lunch sandwich big enough split probably wo n't happen bring cash get ready use atm
2021-06-01,5,best best sandwich amazing like literally best sandwich ever sandwich enormous way ca n't even fit mouth eat half big also definitely get sundries tomato world place small mom pop place close believe 2 3pm also street parking located twelfth washington
2021-04-18,5,old school deli run husband wife right straightforward spot bell whistle typical deli huge sandwich insanely reasonable price covered say sometimes sandwich packed meat cheese hard eat better skimping ingredient went chicken cutlet american cheese mayo lettuce banana pepper good could eat mozzarella also order make fresh daily order sandwich come packed perfectly silky milky done right also hot food sell quick n't come early chicken parm beautiful also eggplant parm chicken cutlet also solid get sandwich love mom pop shop right hope stay many year highly recommend hoboken
2021-02-24,5,hand best mozzarella ever came high expectation delivered usually deli rush n't much time small talk providing top tier customer service especially really good know person behind counter entertaining friendly gotten italian sandwich breaded chicken mozzarella sandwich italian sandwich delicious meat fantastic however would highly recommend chicken mozzarella sandwich simply based fact really taste cheese shy definitely point favorite deli hoboken one best quality sandwich
2021-01-19,5,food fresh portion huge recommend trying mozzarella roasted red pepper good meat
2021-01-15,5,great mom pop sandwich shop heap meat fresh mutz next time ask add sweet pepper olive oil vinegar c large fault newbie customer
2021-01-13,5,love sandwich massive healthy portion whatever request made mine prosciutto hot capicola mortadella hot pepper fresh mozzarella took 3 sitting finish handling covid well also 3 people allowed deli time favorite mozzarella town hand
2020-12-19,5,omg muz moz mozzarella world overdid first time ordered way much take home n't worry none wasted looking fresh mozzarella holiday platter sandwich love mozz want eat place go chicken cutlet sandwich solid well looking mozzarella back second time stocking holiday aka needed excuse make acceptable eat another lb mozz def give place try support small business shoplocal
2020-11-24,5,hand best italian deli hoboken new favorite go place service husband wife duo provide par
2020-09-30,3,downtown hoboken 25 year love fiore vito hero eat weekly often would hear people singing praise p decided order italian hero n't spell figured must standard italian hero menu asked sweet pepper ready pickup 20 minute basically boiled ham salami mutz lettuce tomato roasted red pepper oil vinegar offense kinda expecting bit read review sandwich loaded would agree big slab ham salami two teeny-tiny slice mutz mutz delicious doubt really cheap amount mutz sandwich meat standard cold cut guess thumanns thinking maybe would capicola mortadella sandwich versus ham salami sandwich also bit soggy drenched oil vinegar sitting bit mess eat good sure would rate like 7 10 time money pick vito p craft nicer sandwich vito hero probably wo n't come back n't get wow factor everyone give place okay
2020-08-07,5,mutz melt mouth owner pleasant deli gem cash
2020-07-29,5,absolute best mozzarella hoboken sub huge delicious super fresh owner friendly attentive highly recommend definitely coming back fyi cash
2020-06-27,5,awesome amazing perfect place crave italian sandwich best italian deli place love mozzarella recommend everyone like italian deli meat mozz anything
2020-06-10,5,ummm want know keeping deli secret whole time seriously incredible easily one best sub ever life ham cappicola prosciutto pepperoni fresh mozz addsundried tomato loved loved loved every bite smashed face amazing sub lovely staff cute dog need anything else nope got
2020-06-05,4,advertised really best mutz feel 1975 everything fresh fresh fresh good quality salami prosciutto along red sauce sandwich
2020-05-23,5,amazing enough said best fresh mutz hobokenjust remember cash
2020-05-21,5,hoboken little secret biggest delicious sandwich nj place like katz harolds deli fresh mutz made daily l e sandwich joke average human eat 1 4 sandwich sittingthey n't deliver call ahead pick cash atm inside seriously one day hoboken make lunch stop
2020-04-18,5,best mozzarella hoboken best mozzarella ever meatball mozzarella sub thing wonder enough feed small family 10 amazing n't know place changed much year hope change future sure anywhere would rather get lunch
2020-03-07,5,guy best best mozzarella hoboken possibly even ny sandwich huge fantastic italian gourmet product awesome eggplant parmigiano anywhere hand best italian deli nj pete theresa best well
2020-02-18,5,place best mozzarella hudson county family come nyc upper west side get mozz sandwich also great fancy add one like avocado classic old school italian establishment believe say want
2020-02-11,5,best deli hoboken sure huge super stacked sub around eight buck difficult beat town make sure get award winning mozzarella always fresh delicious
2020-01-13,5,delicious fresh italian food could ever ask delightful warm friendly people regular
2020-01-08,5,italian relative come way north carolina sandwich ginormous delicious diet definitely n't go old school nj deli vibe like right soprano great people work endless combination italian meat course fresh mutz definitely get roasted red pepper sun dried tomato top sandwich game changer
2019-11-18,5,unexpected closure fran deli tried several italian deli town p go cholesterol level damned
2019-10-25,2,wanted much like place went around 1pm friday ordered 1 2 meatball mozz sandwich go meatball guy behind counter friendly authentic 30 year offered chick parm option thought ohhh chicken parm one favorite yes chick parm hot sandwich cold chick parm soggy bland crispy bread hoped either hoping come back update review better news future maybe 1pm steam table cleaned lunch rush unfortunately inclined go back
2019-10-21,5,favorite sandwich hoboken great italian deli serving huge sandwich great ingredient fresh mozz worth getting every time
2019-08-02,4,see best muzz hoboken sandwich great two thumb returning bigger pant
2019-07-13,5,hoboken full great sandwich option vito lucas top two place win hand cold cut sandwich unbelievable bang buck le price anywhere else probably 50-100 sandwich
2019-06-24,5,best mutz planet sandwich delicious dreaming since last time year ago
2019-06-15,5,lot really good italian deli hoboken worthy trip could best best went couple time recently blown away every time mozzarella epic ingredient great owner welcoming place bring friend city italy know love
2019-06-06,5,wonderful deli visited morning daughter flying home houston owner took special care double wrap sandwich could take home son delicious fresh mozzarella meat amazing favor eat
2019-06-04,5,amazing sandwich two people could easily share half size ate mine open-faced since filled brim meat cheese mozzarella incredible
2019-05-09,5,looooove deli going since kid entire family love favorite italian deli hoboken freshest mozzarella made hand family daily family owns deli amazing dedicated making quality fresh mozzarella delicious italian dish
2019-05-07,5,absolute favorite growing still best salami mozzarella family oriented great bread also love ziti go place visiting nj
2019-03-21,5,old-school amazing giant overstuffed sandwich super-fresh ingredient run nicest mom pop team meet generous portion everything delicious
2019-03-20,5,absolutely love place used live block away back early 90 went time went lunch today friend visiting salt lake city said hungry said need go loved chicken parm fresh mutz got prosciutto roasted pepper fresh mutz delicious even better couple still running place serving delicious sandwich 20 year later truly mom pop shop take great pride business
2019-02-22,5,town alabama wedding bride place tip tongue place try oh goodness arrived 3:30 saturday find short line turn came presented bread 20 minute bakery delivers eating local travel place clearly local wife decided wait short time started stacking chair explained n't close 4:00 folk would come hang midnight last customer day bread arrived time wife ordered half sandwich shared one half u barely finished half half wife 3 4 half left cried uncle never life sandwich much meat enormous portion fresh bread delicious meat could want buildup mutz-yes learned new word today mutz noun short mozzarella love cheese folk make fresh mutz everyday wait treated large slice one one best fresh cheese ever eaten got order american often describe travel term food eat find hoboken great place make food memory
2019-02-22,5,n't get much better p biancomano sandwich walk find shop n't changed much year expect wait worth fiance heard sandwich big ordered half told whole sandwich would believed though way load sandwich even half massive hard choose order sound good good whatever make sure mozzarella amongst best ever soft fresh regardless get love full
2019-02-13,5,life changing softest creamiest perfectly salted pillow mozz ever light year beyond fresh mozz tasted got whole sandwich meaning whole baguette make worth got early side hear typically run ingredient 3pm earlier tried prosciutto mozz roasted red pepper mozz tomato basil balsamic fresh basil used pesto instead serve open faced thick slice mozz get pretty unwieldy bad thing sandwich great real star mozz could eat plain caprese salad day mozz still warm take leftover home harden little fridge wo n't eating right also imported italian grocery snack drink san benedetto tea hot food small place seating limited way home slipped cheese coma like never sleepy calm content care world
2019-02-10,5,freaking sandwich heard lot p surely lived reputation walked around 1pm saturday lunch saw enormous sandwich yelp decided split one half absolutely right call one person front u came ordered quickly went sandwich c ham salami prosciutto capicola mozz added roasted red pepper oil balsamic literally never seen much meat mozz stuffed sandwich impossible get one bite everything sandwich wide definitely messy eat mozz best part sandwich meat great damn mozz another level soft bread good nothing write home sandwich 10 50 perfect size two would definitely love come back try sandwich bring home mozz get hot food
2018-08-16,5,sandwich last week living block year quite amazing satisfying sandwich great price however bit pissed ate pissed ever stepped foot vitos wasted 4 sandwich experience life place italian cuban pffff ca n't wait go back p
2018-06-22,5,ordered 8 roasted red pepper sandwich heaven word describe level deliciousness close feeling level happiness like winning lotto finding treasure good
2018-06-08,5,deli real deal serving sang-wiches huge uuuge buy extra roll slap slab homemade mutz hoboken stick make two sang-wiches one peter owner provide extra local flavor true hoboken institution
2018-05-31,5,eating since late 80 truly best fresh mozzarella ever eaten time order sandwich fresh mozzarella think put enough excuse go back get still warm made fresh premise everything fresh authentic owner staff friendly accommodating
2018-05-12,1,ordered chicken parm sandwich ordered noticed got 4 piece already made chicken put sandwich without heating threw since n't expect cold got huge sandwich give opened packaging noticed entire sandwich messy normally bad thing ridiculous sandwich started good 15 minute cheese sauce become cold soaked bread sandwich point everything becoming messy nasty worth finish sandwich going
2018-05-05,5,best sandwich hoboken love lady counter must go hot pepper superb motz ca n't beat pic motz posuto sandwich ca n't beat
2018-03-29,5,hand best italian deli hoboken delish mozzarella drive 30 minute get mozzarella p would n't way deli meat fresh chicken cutlet perfect amount breading sandwich decadent easily get two meal half sandwich plus always nice experience
2018-03-20,5,true customer throughout year sandwich always double size competition hoboken buy sandwich make 2 1 quality price best cold cut bread awesome
2018-02-26,5,town best deli p hold sub massive think best italian style hoboken also nice staff
2018-02-11,5,uhhhhh die level sandwich unreal ca n't beat husband wife team serving hot sub cold equally amazing home made daily mozz something seen look pic get half sandwich enough also great italian grocery option load pasta local place ca n't say enough wonderful owner u texan
2018-02-05,3,grateful willing take order super bowl sunday last minute always great sandwich huge portion
2018-01-16,5,love place staple uptown hoboken mutz top notch one always receives humongous helping cold cut high quality especially roast beef cooked fresh every day chicken cutlet sandwich die put 9 cutlet half sandwich half sandwich need large lunch favor split half sandwich friend full satisfied husband-wife team behind counter friendly roll sandwich quickly sure give p try
2017-12-26,5,review long overdue visiting nyc december 2016 local know took u flight back seattle owner nice food delicious even made u special sandwich packed various meat cheese flight home sure everyone flight within smelling distance jealous u point anyway highly recommend place
2017-12-21,4,place great food top quality reason ca n't give 5 star pretty much ca n't eat sandwich way made topping fall soon try bite cold cut slide bread ca n't complain awesome amount food pour sandwich dead serious impossible eat like regular sandwich got ta move stuff around take stuff break bread place finally squeeze deliciousness mouth
2017-12-08,5,best deli new jersey mutz get fresh mozzarella every christmas melt mouth n't last around family sandwich made order generous portion meat make place exceptionally special family make feel like family used catering party well hot food great sandwich good pricing especially quality
2017-11-13,5,went college hoboken would come time seasoned adult brooklyn still make trip least every month king sized sandwich accompanied best mozz ever tasted love owner love everything place perfecto
2017-11-08,5,freshest cold cut thickest slab fresh mozz imagine sweet face serve place absolutely beat regret trying sooner doubt top go list hoboken mean n't love good italian hero walk get incredible aroma tell made overwhelming mix cheese meat ready put 5 sens overload
2017-11-04,5,co-worker stopped lunch since area happened walking quickly got u mood italian sub located washington street near quieter side main drag first time wo n't last wow great local mom pop deli grocery place appears decade surprise look board counter great variety sub offer ordered e half either half whole whole basically whole loaf italian bread eat best half perfect e consisted salami prosciutto ham provolone possibly something else incredible n't skimp meat impressive bread held perfectly entire time two nice older people behind counter nicest people welcoming polite also nice little italian market different variety pasta cheese etc several table inside deli several table outside well price bit higher spot well worth go way come one best sub ever cash
2017-10-05,5,italian feel another life freaking love italian food place seemed authentic exactly looking someone moved south virtually impossible find tasty italian food little daunting walking shop seemed like everyone regular sort stood doe eyed staring menu overwhelmed came something get lot option seems like basically order whatever want meat topping available got ham prosciutto mozzarella red pepper crispy bread probably plan sandwich little next time delicious husband shared trust unless extremely voracious eater would share someone ate like 1 4 tapped definitely kind sandwich keep going day price 15 ca n't beat plan come regularly
2017-09-16,5,small italian deli grocer without question favorite spot hoboken located washington street easy walk would mistake homemade mozzarella mutz world clearly others fan hoboken mutz fest multiple year go-to meatball sub homemade meatball enormous moist full flavor bread come buttery soft ciabatta sub roll perfect sop extra sauce also request crispy bread recommend taking sub go top homemade mutz perfection unless incredibly hungry sharing friend half sandwich plenty sub delicious using beautiful meat fresh ingredient staff super friendly old school adorably speaking italian one another behind counter one note cash-only establishment
2017-09-09,5,ca n't say enough great thing p biancamano hidden gem hoboken sub amazing couple owns store nicest people ever walk shop transported hoboken used family owned mom pop shop tell put love everything love customer owner polite friendly customer great people everything fresh must get homemade fresh mozzarella whatever sandwich get sub huge well favorite c ham capicola prosciutto pepperoni fresh mozzarella throw oil vinegar lettuce tomato dream love big portion sub honestly enormous either splitting putting half fridge tomorrow big taste great though coming fridge love supporting place recommend anyone looking great bite eat hoboken
2017-07-28,5,biancamano always go great sandwich yummy mozzarella everyone know sandwich huge literally make 2 1 wish delivered sometimes get busy family always really nice friendly every time go
2017-06-08,5,everything italian deli perfection ambiance authenticity first bite homemade mozzarella delicious imported prosciutto crispy roll balsamic glaze everything pure perfection mention value ten dollar sandwich last entire day seriously ca n't eat sandwich anywhere else without comparing p easy 5 star
2017-06-06,5,great family run joint friendly owner looking take order sandwich great huge make challenging stuff mouth case great local spot get really busy certain hour
2017-05-29,5,year ago heard nfl broadcaster say giant jet game always get something eat saturday understand sandwich made think white house atlantic city back
2017-05-23,5,best lunch hero ever highly suggest chicken cutlet roasted pepper fresh mozzarella option picking crispy soft piece bread great friendly atmosphere really ca n't go wrong type sandwich go spot hoboken remember bring cash
2017-05-13,5,hoboken nj known history waterfront view bar course mutz p mine entire family go spot italian style sandwich mozzarella yes many place town others loyal trust say one serf like pete teresa owner decide get sandwich anytime 2:00pm might pushing luck get sad news bread people line early get hand one signature sandwich mutz keep simple always order ham salami mutz sandwich feeling daring add roasted red pepper get sandwich roll half italian bread whole italian bread offering hard soft sandwich huge known load cold cut mutz always get roll sandwich time gotten half split someone p around since old hoboken true italian family place filled much culture truly appreciate customer make want come back always p girl would n't trade loyalty italian spot
2017-02-24,4,hearing sammies bomb one monday afternoon finally got try ordered prosciutto mozzarella sammie 11 50 sound pricey sandwich trust amount meat cheese stuff completely worth boyfriend shared stuffed gripe bread super chewy sure went midday got second last piece bread willing go earlier next time give another try mozzarella good pas
2017-02-22,5,zomg sandwich amazing n't normally get super excited italian deli place beyond fiore loyalist year still think roast beef special fantastic tried p first time recently like every day thereafter love first sandwich ginormous read review going said full sandwich easily two meal husband n't believe insisted get whole boy wrong half enough big eater half size large sandwich elsewhere even quarter alone enough lunch already hub super happy place make sandwich filling though n't bread ridiculously generous filling always get sandwich fresh mozz either ham roast beef personal favorite prosciutto mozz delicious fresh creamy give giant slice really taste appreciate cheese never know tackle sandwich large like big make lack quality ingredient phenomenal favorite part bread two type soft hard n't bothered try soft hard bread literally perfect crunchy outside soft pillowy inside truly make sandwich sure fiore n't use bread top goodness love p people friendliest come across hoboken clearly care customer product love preserved mom pop shop vibe old school italian best way possible always speaking italian ca n't believe n't heard p year sadly discovered moving hoboken might back frequently sandwich good
2017-01-28,5,real italian product mozz awesome come fresh roast beef mozz gravy hero always make mess taken tie source lol almost always huge line call order advance significant wait food highly recommend
2017-01-24,4,n't know hell tell best damn saingwich place town yes better fiore even though love sandwich size head got head big world globe halloween amazing place n't think really need go much detail awesome italian deli place like place better place
2017-01-16,5,love great sub sandwich place chicken parm sandwich nothing le amazing couple behind counter sweetest found little inconvenient take cash remember cash great place
2017-01-08,5,review right best mozzarella huge sandwich great people ate last meal heading airport go home seattle never friend read great review truly right homemade mozz amazing say mindblowing fresh burrata mozz southern italy beautiful balance moist soft right touch salt pop flavor half sandwich truly like whole sandwich world think 1 2 inch meat thing loved see local people clearly regular neighbor come tell part community writing review month ate still wishing could go back n't remember name owner remember nice friendly kind place make community neighborhood give warm fuzzy feeling wish best
2016-12-04,4,first foremost place cash deli close atm easily found bring cash line relatively long good reason sandwich amazing 12 get ginormous sandwich amazing cut meat course mutz excited return try thing
2016-11-08,5,say n't said simply best cold hero shop hoboken run best owner town never come seen two owner slicing every sandwich perfectly order fresh delicious positively enormous great salad italian specialty take home ca n't better anywhere try catering
2016-10-18,2,hugh sandwich fresh delicious ingredient downside place one wearing glove boyfriend become little sick eating turkey sandwich really wanted love place return
2016-10-03,3,seemed closing 5:15 friday quite annoyed take small order 1 4lb mozz solid
2016-09-29,5,best hoboken know italian food right p absolute best italian sandwich outside awning say best mozzarella true food fresh sandwich fully loaded generous pile meat fiance always split sandwich completely stuffed mix italian balsamic dressing go wo n't regret
2016-09-22,5,stopped bakery street referred local joint mutz idea found sandwich also homemade pasta alfredo chicken parm traveling day pasta chicken parm lunch ordered mutzs go everything fantastic mutz sandwich load meat fresh mozzarella make mozz site best mozzarella ever sandwich huge one enough three u ordered two knew lunch next day kept remarkably well many place choose dining hoboken glad ended
2016-09-16,5,best place get sub mozzarella die friendly service franchise place need take lesson true sandwich test like
2016-09-15,5,simple review amazing turkey sandwich huge open night place awesome cash see open want deli sub go
2016-09-14,5,probably best deli sub town half sub good lunch dinner little pricey standard sub spot n't go short ingredient quality classic italian join ran elderly couple self seating dining area cash atm next door must try fresh mutz variety antipasta
2016-07-26,4,congratulation purchase sandwich actually enough food two meal maybe three sandwich run 10 11 piece loaded like seriously loaded point ridiculousness mozzarella another level sliced order sandwich moist sandwich sliced see milky juice oozing side n't get fresher huge portion fair price excellent ingredient come hungry prepare leftover
