date,rating,review
2019-08-22,4,thrilled mamoun falafel opened hoboken since offered leaner solution late-night dining comment mean overshadow benefit able enjoy authentic middle eastern food quick lunch dinner well first visit location started going regular basis dining room rather spacious several table lengthy counter stool available addition outdoor spot offered warmer month term order tend alternate vegetarian combo plate chicken kebob platter depending mood many meat meal eaten remainder week combo plate includes base salad rice get salad topped falafel hummus baba ganouj favorite component pickle olive thrown well pita come side much texture dish also allows walk away feeling le full marinated chicken breast platter includes chunk poultry removed grilling skewer placed salad tahini sauce pickled vegetable hearty dish includes well-seasoned chicken substantial vegetarian counterpart delicious mamoun great place quick-serve dining customize liking term portion-size healthiness offer quality sustenance throughout day wee hour morning
2019-08-21,4,weeknight quick dinner spot pretty tasty falafel baklava world overall food tastynice seating area good service price reasonable
2019-08-17,2,really love lentil soup always good hummus make stomach hurt guess oil put eat hummus anywhere else fine either 100 olive tahini oil using may using large amount oil recipe sure
2019-08-16,5,place best food love falafel sandwich minty lemonade price great everything delicious great place eat good food hang friend
2019-08-12,5,loyal customer mamoun 20 year west village location original location 100 square foot inside basically 5 people stand west village location mamoun spot back day going limelight avalon day rely mamoun always deliver consistency hoboken location even better west village opinion love hoboken location spacious cute decor lively interior location 15 table 10 bar seat pretty comfortable order mango juice like mango order tamarind juice fancy tamarind mamoun bakes pita chip house always pick bag 2 snack next day work small hummus side run 3 perfect compliment crunchy pita chip ordered chicken kabob sandwich devoured pita bread mamoun best thank mamoun
2019-08-08,1,music way loud chair stool moved around insanely loud put rubber bottom dam chair please horrific eat
2019-08-07,4,always good stealth bag charge 10 whole centsi know n't given option using bag
2019-08-05,2,staff nice place nothing like original village worst lamb ever tasted like steakum full grease
2019-08-02,4,great place falafel shawarma sandwich lamb delivery came quickly well always wanted try shawarma meat since saw avenger know also enjoyed falafel delicious definitely order shawarma sandwich filled good amount meat vegetable pita bread falafel side perfect companion sandwich hot sauce also nice recommend place looking something different try
2019-07-25,5,6 falafel pita sandwich amazing deal great meal hoboken anytime day finding something price hoboken dinner almost impossible fact good make much better sandwich meat little 6 definitely worth extra change food great service always lovely also really love baklava display really delicious
2019-07-14,4,great food pleasant service fresh consistent reasonably priced fare please mamoun management invest adhesive felt strip place foot chair screeching sound heavy metal chair dragging across stone floor blood curdling easy fix
2019-06-29,5,ca n't get enough mamouns quick affordable 100 tasty every time begun order combo plate chicken every bit food delicious rice pickled topping meat baba ganoush etc dessert yup delicious well n't get probably find week go
2019-06-29,5,hoboken location carry tradition west village serving damn-tasty falafel machoistically hot sauce hard-pressed find fresher falafel spicier sauce side atlantic thing place need fountain dispenser milk quell pepper sauce instead get side creamy hummus
2019-06-28,1,order plate go force salad meat one plate willing put separate container whole meal full liquid n't get take cold wet
2019-06-20,2,disappointed mamoun ordered medium hummus got home notice gave small order hummus pretty regularly really like terrible sorry downgraded two star
2019-06-17,5,holiday visited place 3-4 time food delicious hummus pita amazing best hummus tasted bleeker sandwich sullivan sandwich favorite house fry also refreshing drink mango mint lemonade enjoyed n't miss dessert tried could decide best definitely stop visit next
2019-06-16,5,like guy ordered classic falafel sandwich fry garlic sauce seamless price fair order delivered le time estimated food hot fresh somehow still crispy soggy 5-star experience reorder
2019-06-15,3,price le 9 falafel plate ca n't beat got falafel plate n't life-changing tasty made want try falafel mediterranean food future falafel somewhat dry still really flavorful liked sauce came salad standard iceberg lettuce tomato tasted good sauce pita bread much seating shop go nearby washington square park atm next door helpful bc mamoun cash
2019-06-14,5,great place quick bite food lot flavor tasted fresh thought service really nice baklava delicious
2019-06-12,5,delicious good price good crowd wait n't bad crowded place lunch employee nice got schwarma added spicy sauce extra punch mango drink ktaif loved everything
2019-06-07,5,soo good fast delicious authentic vegetarian delight loved would recommend anyone like mediterranean
2019-06-04,4,must say establishment always foundation growing area always somewhere would n't go way indulge old country cuisine however must say establishment converted franchise taking account much larger restaurant rising cost one could understand certain aspect experience may changed said gyro went 100 accurate rendition gyro would get street egypt version chopped corned beef spice similar could almost authentic must say came dinner substantially disappointed food still good quality great average person probably would notice still intend coming however idea best shawarma sandwich earth longer resides establishment lastly lack communication cashier kitchen adamant could tomato sandwich onion lo behold got home sandwich literally extra tomato extra onion nominal may sound certain thing like onion destroy someone meal accustomed specific ingredient onion tomato really put damper mamoun tradition buying holiday remind u old country retrospect despite change perceive worst still write restaurant four five star overall value speed service quality food still superb long comparing 100 authentici guess reminisce perfect shawarma sandwich used back day
2019-05-26,5,go place lunch dinner whenever absolutely love baba ganoush classic falafel sandwich kunafa pro appropriate portion even famished full long time reasonable imagine satisfying 6 lunch anywhere else washington street truly delicious pita bread tonne mediterranean restaurant also lived country say pita actually nice friendly staff con none
2019-05-18,1,wow place really gone hill renovation new ownership n't enough hot sauce bottle ask refuse give one seating terrible traffic pick place basically fast food restaurant n't even napkin traverse everlasting line front counter wait worker notice called 15 time rudely hand 5 small napkin disappointed
2019-05-12,5,one best falafel shawarma sandwich since left affrica hand
2019-05-10,3,first time coming restaurant excited order vegeterian plate however realize salty food would falafel rice delicious hummus sauce add top rice made salty sure ask go easy sauce next time enjoy food
2019-05-09,5,new location always clean biggest complaint hard time staying away food plus open late
2019-05-06,4,love mediterranean food really good food bowl filling yummy ordered plate chicken kabab got rice along side hummus falafel add-on give nice soft pita bread along rice flavored beautifully go well chicken kebab service super quick falafel amazing chunk chicken found 2 undercooked hence 4 star ordered mango drink really refreshing nice also n't like baklava toooooo sweet much cinnamon overall would rate 4 5 value money plate good enough two people come back sure
2019-05-03,5,thought liked falafel tried mamoun completely obsessed several time lunch since near office every time amazed incredible falafel new go-to lunch spot although definitely come hungry usually crowded around lunch time line move quickly menu many option including vegetarian non-vegetarian sandwich platter always get kind pita sandwich packed full delicious falafel veggie hummus sauce overall perfect spot grab lunch want something affordable filling delicious definitely worth hype
2019-05-01,5,quick fat service nice employee clean place chicken kabob plater go always full flavor
2019-04-21,3,ordered chicken kebab plate food came within 5 min okay price chicken breast dry overcooked
2019-04-20,4,great chicken kebab sandwich well seasoned great portion size deducting star pita bread never hold sandwich always fall apart hummus really delicious
2019-03-27,2,n't know management changed location changed place far cry used old team previously arabic menu employee year new place much akin american fast food point n't see packed given time night anymore
2019-03-26,1,service level place need new employee new management wow ca n't deliver food n't get place ever never food average type bad service occurs n't really care
2019-03-17,3,great value money spot middle eastern food hoboken moved corner spot decor gotten upscale food still good coupled quick service pita sandwich plenty meat bread fresh skip hummus middle road instead go extra meat baklava plenty sweet cure sweet tooth craving
2019-03-04,3,place great started great servicefriendly staff great environment lately cooking quality start go third visit row reheat chicken dry
2019-03-04,5,amazing service quick delivery make lunch office great one every time
2019-02-22,4,love location mamoun n't get super crowded food great super filling fresh ingredient hummus delicious
2019-02-22,2,nice location outside city offshoot original store manhattan surprised shwarma request veggie white sauce gave quantity lamb lot compared give city much smaller size spice right kind flavor n't city version price perhaps little cheaper according staffer go back see pricing city hummus spicy red sauce though use lot latter might notice
2019-02-20,5,excellent appreciative dining space long time n't enough seat sit customer course go shawerma absolutely deliciousoverstuffed pickle request baklava-delicious perfect balance sweet crunchy must try
2019-02-17,5,went original mamoun macdougal first time 2001 went friend sister mom saw conan late night show great night started going hoboken prior living psyched find mamoun falafel great choice quick lite eat going meal like getting falafel shawarma mango juice used spinach pie bomb stopped making good boy treat baklava
2019-02-17,5,simply put best falafel hudson county babaganoush also amazing well menu item place great cant miss hoboken everything always fresh
2019-02-13,4,great see mamoun falafel macdougal street new york open location hoboken new jersey mamoun falafel really best pita sandwich would 100 recommend getting pita sandwich go great option workday lunch whether picking food eating picking dinner work unfortunately mamoun option outside pita sandwich little expensive would expect feel like mamoun would popular made price menu item outside pita sandwich reasonable hope stick around hoboken new york mamoun known delicious hole wall late night cheap food spot hoboken really different macdougal street manhattan think adapt thrive better cheaper lunch option would great
2019-02-12,4,friday evening husband fond place used eat lunch working near car parked little far walked restaurant crowded stood line order ordered one chicken kabab platter one shawarma platter came pita bread asked get whole wheat pita bread told pita bread grain one house baked also ordered one mabrumeh dessert looked amazing could go without order to-go wa sready 5-10 min chicken kebab 4 5it delicious came 3 side choice pickled onion salad pita got 2 hummus baba ganoush side perfect platter shawarma 3 5it lamb shawarma came rice salad extra pickled onion salad pita husband liked flavor better mabrumeh delicios pastry dipped honey syrup many nut top service quick everyone staff friendly
2019-02-12,4,falafel good tender flavorful fried perfection piping hot must speedy system place took three minute receive order perfect hangover post drinking dying starvation snack price right
2019-02-07,5,kind personable came night friend birthday sang even gave friend dessert love place would definitely come
2019-01-30,5,best place hoboken get middle eastern food great quality great price always fresh ingredient ton flavor ca n't go wrong anything menu restaurant great ambiance great casual first date get little crowded peak time great place sit enjoy meal get work done
2019-01-28,5,consistently fresh delicious mamoun perhaps best place eat hoboken yes mamoun great yes also option hoboken depressing wrap incredible get classic sullivan favorite
2019-01-26,1,argh disappointed ordered falafel combo hummus baba ghanoush salad terrible baba ghanoush tasted like bitter version hummus barely taste eggplant thick bitter hummus hummus good either hungry could n't even bear finish falafel average maybe used delicious falafel place good 10 platter like higher expectation way worse 6 street food truck one
2019-01-24,5,mamoun favourite spot falafel hummus falafel green inside delicious spicy red sauce epic like spicy sauce shawarma plate rice enough food go every couple week kid cause live 20 minute away always great job thanks team
2019-01-20,1,order delivery mamours every week called tonight incredibly rude woman told wo n't deliver address anymore 2 0 mile away unbelievably stupid shortsighted
2019-01-05,5,mamoun new brunswick super sized location hoboken plenty friendly staff onboard food come pretty quick place super clean ordered shawarma platter normally get sandwich extra sauce extra shawarma since keto decided stick platter give decent amount food wish got shawarma also mint lemon-aide one favorite dessert tray baklava staring right face course cheated diet tried delicious recommend place everyone review strictly opinion based experience interaction business person provided service food merchandise review translated fact review truthful best ability intended present harm business encourage perform better allow continue awesome received monetary gain writing review bruno f
2018-12-30,5,awesome place everything great complaint ultimate sign restaurant good people mamouns always jammin lotta place hoboken dead inside never last long mamouns king fast-casual food town mention baklava really fantastic whenever come hoboken even n't get entree stop baklava go easy hot sauce though grab booboo quote cheech n chong
2018-12-11,3,spoilt taste n't mamoun didnt go change taste authentic pita bread delish disappointed recent change
2018-11-25,4,needed falafel place delivered price nice recommend manhattan pita falafel
2018-11-18,5,woah place yummy craving light lunch meant bigger sandwich smaller chipotle bowl came ordered mcdougal meat sandwich shawarma falafel pita bread bag delightful heavy everything sandwich tasted delicious together hot dang hot sauce real kick seriously left tear warned price got 2 meal super sold place
2018-11-14,5,live hoboken place always u friend love stop night open later place food good time great hummus pita vegetarian option really cheap price jump anything containing meat still good deal usually get shawarma baba ganouj pita pocket guy friend always get plate nice large portion size whatever get highly recommend beware hot sauce table spicy n't want use much
2018-11-05,4,go spot looking something cheap good filling falafel platter run 9 come ton food perhaps maybe enough share two people neither one end food-coma always ask extra pickle happily oblige every time mangolassi drink really delicious ask sample never becareful hot sauce ask side quite spicy ca n't handle spice probably best stay away
2018-10-22,5,place kept sustained entire pregnancy clean fresh food amazing flavor
2018-10-09,5,hand go spot n't visited bad location yet great always know going get like order veggie option time time
2018-10-06,3,found place searching halal food yelp unfortunately carrying halal food took veggie plate
2018-09-23,5,best falafal nyc excellent fresh ingredient vegetarian food fritter tasty sauce excellent
2018-09-14,2,others said big disappointment since move prior could order everyday shwarma falafel hummus always great hummus different shwarma greasy dry n't flavor falafel nowhere near good believe house made pita good remember falafel original location nyc felt like found would request last meal original hoboken identical much original deserves place 1000 thing see die book much please go back root
2018-09-09,4,super busy place loved old location better still favorite place cheap eats high satisfaction tasty food good vegetarian selection need mention old location better food better price better customer service cute cozy new location bigger brighter cleaner longer line
2018-09-08,4,great service fresh ingredient short line dissatisfaction dessert tasted bit stale overly sweet pretty great customer service especially considering time clean especially good whole food would totally recommend late night meal
2018-09-04,4,working around area almost year finally come around try place advised coworker try get lunch rush around 12pm came 11:30am line pretty empty nice clean dining area bathroom also clean opinion great thing since believe reflect restaurant operates cleanliness ordered bleeker sandwich came pita bread disappointing size medium hand price expected something bigger delicious ordered side falafel delicious well made
2018-09-01,4,honestly really enjoyed chicken kebab sandwich portion pretty good price chicken good flavor moist grilled flavor also whole bunch seasoning arent skimpy sandwich would definitely come back looking quick bite lunch
2018-08-16,2,ca n't believe writing review moved old location 5 star every day week went last night ordered chicken kabob salad plate large hummus register unenthusiastic sour faced person took order proceeded wait 15 minute order made got home order could n't believe much reduced size 8 large hummus container old around half full totally unacceptable amount price used lot larger get 4 pita bread least something chicken kabob salad generous chicken pretty much inedible hard dry eating golf ball even beer feeling really hungry plate n't satisfy late night munchies 20 wasted go back one time hope one used one time favorite spot hoboken last night experience think gotten lot tastier cheaper meal mcdonalds across street
2018-08-15,4,pretty decent franchise rather concept original multilocation eatery pleasantly surprised clean fast service yet still sad ethnic eatery water certain group people make palatible good way buying authentic taco group blonde surfer named bret fiona awesome business partner brad ethic chipotle olive garden listen late night run perfect right delicious clean mcdonalds burger king interior feel definitely make bret fiona feel home right food good price admit earlier would found family owned joint jersey largest middle eastern population u easy find overall give place 2 thumb geest place regardless short comingsthe food good issue society problem expanding wanting diverse crowd feel welcomed required mcdonalds meet lebanon meet starbucks meet chipotle neccesity get ill definitely back late nite falafel
2018-08-05,3,tried shawarma falafel surprised size admit flavor lacking expecting put hot sauce helped little bit try baklava also ok lastly service fast friendly give try judge
2018-07-28,4,great delivery food experience fresh lamb tasty fatty dry pita hot really delicious paid attention special request note appreciated definitely would order
2018-07-21,3,ordered lamb shawarma sandwich delicious contained lettuce lamb smh
2018-07-21,3,place halal food past people working told u vegetarian option still good reason visit place
2018-07-20,2,coming lately gone hill fast price gone considerably soon try order problem start 8 people working fine old time however one taking order order sat someone asked found everything looking today ffs macy made laugh food still good price n't think justifies price quality portion
2018-07-20,5,love food well priced highly recommend sandwich adding grape leaf yum
2018-07-09,4,best grilled chicken area steinway better much fuss good price
2018-07-08,5,best place go night hitting bar hoboken great courteous staff food hit spot love late hour staff always ensures well taken care even drunk lol
2018-07-07,5,place year well known fresh ingredient falafel came day lunch ordered shawarma platter food came rather quickly meat well seasoned fresh vegetable delicious plenty food paid hummus delicious felt bad much food left great dining spot love falafel vegetarian option well
2018-07-04,1,place used really good since moved new place almost doubled price everytime wait least 30 minute get food 3 time far definitely going back ever last time took u 1 hour get food
2018-07-04,5,one go spot lived hoboken simple yet good shawarma plate way go hummus babba ganoush great addition well also hand best late night food option town hoping open one morristown soon hint
2018-06-27,5,restaurant busy expected popular place area weekend order counter pay call number food ready busy place feel rushed cashier answered question great attitude tried chicken kabob plate rice salad chicken piece grilled perfectly dry undercooked either also give good amount piece salad olive onion tomato etc put white sauce rice rice white sauce allright taste remember quality taste chicken piece along fresh salad amazing bread give best soft hot fresh pita bread packaged one sure hot red sauce veryyy veryyyy spicy careful like spicy want add
2018-06-25,1,weekday lunch counter guy useless liar delayed order unnecessarily omitted condiment even reminded
2018-06-12,3,seems every time visit daughter hoboken order delivery mamoun order always well prepared delivered timely manner one time goofed forgot item paid delivery guy went back restaurant short order door forgotten item even though midnight typical order includes falafel hummus baba ganouj tabbouleh pita prepared traditional manner flavor texture spot particularly fond harissa sauce n't tried approach caution fiery hot know much palate tolerate like harissa like adding every bite honest better middle eastern food elsewhere even cooked better middle eastern food home even though ancestor northern european get town long plane ride drive nothing better kick back enjoy couple cold beer tasty supper delivered door back hoboken month sure order mamoun
2018-06-02,4,good food remember original mamoun million year ago price cheaper food quality better still ca n't hate place got popular keep hoboken price expensive still good food came around 8:10pm friday came iftar line n't bad soon eating leaving around 8:30-9pm packed like crazy crazy packed hoboken decided come time n't even one big group either legit hoard different group people line waiting food anyway gotten everything menu mamoun nyc new brunswick hoboken moved location everything always good
2018-05-31,4,got lamb gyro sandwhich one best ive really taste lamby gamey taste pita bread soo yummy also tried friend combo platter hummus babaganouche babaganouche bomb dessert looked pretty good got one ciruclar nut top decent ive better personally wouldnt recomend one would give one shot
2018-05-26,5,hummus amazing tried shawarma combo chicken kebob mint lemonade lemonade refreshing loved recommend
2018-05-09,1,place nothing like original manhattan warned ordered lamb schwarma platter lamb taste grilled tasted like boiled baked flavorless colorless light gray color chicken tasted grilled flavorless consistency cardboard pita worst part bland definitely taste like cardboard rice flavorless recommend place imagine wasting another dollar place
2018-05-06,4,love baklava might seem bit expensive totally worth falafel sandwich mixed shawarma delicious well many pickle falafel sandwich though
2018-05-06,3,real authentic halal food different tasting food cart seasoning rich herbaceous left little hungry ordering chicken rice platter ordered past moved portion used bigger thought regardless great cultural spot great food match
2018-05-03,3,solid late night actually probably choice 10:30 weekday service good
2018-05-03,2,ordered falafel plate salad rice good thing plate falafel pita came sauce salad flavor rice cinnamon needle say n't good kind pricey would minded paying 10 plate food delicious far far good
2018-04-25,4,good clean environment upscale felafel shop like shawarma sandwich lamb hot sauce spicy would recommend using sparingly lamb tender juicy unlike gyro place location hoboken definitely cleaner manhattan location
2018-04-24,2,review must never really good falafel falafel sandwich pita sad might well used flour tortilla probably would better pita chewy thin weak could n't hold sandwich collapsed one bite much juice thing use napkin falafel bit adverage place street better close review find another spot
2018-04-20,5,order shawarma platter rice side baba ganoush put together add hot sauce thank later
2018-04-20,4,good food cheap fast service sitting always take-out ca n't go wrong food one favorite place take tried sweet yet look good though
2018-04-15,4,delivery quick 3 delivery fee lot sandwich little soggy maybe use le sauce delivery order also wish gave 1 pita order hummus
2018-04-08,1,location staff service place food n't taste anymore used come mamoun every wednesday religiously settled coming original establishment macdougal
