date,rating,review
2017-02-03,4,good cheap falafel sandwich plate also eaten rice friend plate ok really flavorful falafel depending time go obviously lot packed evening point might get table oh also knafe baklava hopefully speeding correctly good
2017-02-02,1,wow living hoboken 4 year used love mamouns last time went horrible walked order takeout two friend everyone else got asked order unfortunately get baklava ordered paid noticed got home n't receipt place usually reliable called give feedback person phone said saw colleague add item bag nothing could basically dismissed claim rudely miss old management place also skimped pita bread give platter ew
2017-01-31,5,always consistent delicious favorite falafel kafta kebob mango juice also delicious
2017-01-24,5,go restaurant every time miss home still nothing compared authentic middle eastern shawarma come quick bite pick falafel go oily big plus
2017-01-19,4,food absolutely delicious love decent eat-in place popular spot tend consistently busy never issue finding table friendly staff downside n't deliver 2 mile jersey city
2017-01-18,5,best consistent delivery hoboken run good guy best get everything right many chicken kebob platter never enough get rice pickled veg side falafel best deal town
2017-01-17,5,food great thanks letting friend play dungeon dragon corner table
2017-01-12,4,got basic falafel hummus ginger ale wrapping little leaky food tasted great
2017-01-09,4,friend super excited place opened senior year college small fast food type place take order pick go eat small dining area menu relatively small pretty cheap price gone bit since first opened course get much better value elsewhere paterson favorite lamb shawarma sandwich ever along spiciest hot sauce decent flavor falafel pretty good overpriced specialty drink also good great open til 2am later case want drunk food pizza
2017-01-01,2,scream yuppieeats way unfortunately form authenticity place begin cook asian hispanic middle eastern food basic nothing compared place price fair plenty table inside outdoor seating ordered meat plate n't impressed n't enjoy rice tasted old microwaved kafta kebob bit salty hummus served small container barely enough one person nice staff behind counter would n't come back ali baba block much authentic really wished better experience price fair picking sandwich every would n't bad idea
2017-01-01,5,place hidden gem shawarma falafel much better famous tasteless food truck falafel meat seasoned perfectly eaten allot shawarma world one one best far hesitate try
2016-12-28,4,reliable falafel quite fan lamb price cleanliness quick service make great lunch spot
2016-12-25,5,love food specially vegetarian everything fresh tasty offer fast service open late let forget great price best hot sauce make cry every time never fails
2016-12-21,3,okay place obviously overrated located hippy area like hoboken cheaper compared restuarants tried lamb platter baklava pastry bread dry hard tear apart hand lamb meat dry rubbery veg side much salt mint lemonade pastry good left unsatisfied overall going back
2016-12-19,5,delicious falafel sure wish mammouns closer think eat week come open one bergen county
2016-12-08,5,love place open late serf great food frill shish kebob plate tebboulah awesome
2016-12-05,4,great late night spot open 5 much cleaner food anything else open late night delicious falafel hummus inexpensive vegetarian option ca n't wait go back try another dish
2016-12-04,3,food pretty good chicken combo platter 12 six piece chicken bit rip need portion little bit mango smoothie rad
2016-11-28,5,mamoun love place sister restaurant new brunswick food 5 5 authentic delicious big portion ca n't go wrong ordering anything menu service 4 5 never issue order food come decently fast busy night sometimes wait 40 minute atmosphere 4 5 huge restaurant seating limited wait food sometimes wait outside
2016-11-20,4,highly recommend falafel sandwich delicious healthy cheap filling complaint lentil soup n't great pita served tasted store bought
2016-11-15,4,great place never fails fill leave smile face pretty good price well usually get shawarma sandwhich falafel
2016-10-29,4,never eaten restaurant order go food always good great price never wait long food staff nice
2016-10-24,4,mamouns new york city classic picture greenwich village 1996many hungry night find macdougal village super hungry five dollar maybe get something eat easier find food 5 90 nyc n't want gray papaya pizza always open always line always delicious falafel sandwich near perfect pita mind blowing falafel perfect balance creamy tehina crunchy salad experience hoboken n't much different though 5 ordered food go everything expect hot flavorful much made love intention little disappointed baklava really came falafel perfect shawarma excellent salad rice made whole meal feel complete always back mamouns meal n't disappoint
2016-10-23,2,washington street around parking found day specially week end ordered around 10 reached 10 44 double parked first wait line pay told minute waiting order decided peak outside saw cop standing behind car run take spin around couple block come double park time ran inside order bag ready went home noticed forgot give extra tahini sauce hot sauce requested paying food ok worth wait risk getting ticket better shawarma street ny whole idea ordering 45 minute early wait
2016-10-21,3,food great price lamb kebab good friend lamb gyro wrap liked much problem charged u full salad even though ordered got small one n't give lot white sauce venue could nicer
2016-10-18,5,love eat drunk preparing get drunk nursing body back elite shape drunk hoboken better place offering
2016-10-05,4,mean place go falafel shwarma kebab like falafel n't really cup tea gotten kebab shwarma time price reasonable really fill pita one gripe last time got olive pita pit ended biting olive pit ouch usually get delivery quick friendly cozy shop fine quick meal
2016-09-29,5,every get mamoun craving finally get end craving week following seriously feel like stay away least 2 month else thinking getting shawarma lease twice week good cheap hot sauce
2016-09-28,4,everything menu absolutely delicious little bit pricey like worth every penny perfect night hoboken fast service
2016-09-25,3,food ok portion small price yardstick halal guy par taste ok great fall short portion price cost get pita sandwich get whole plate
2016-09-18,5,come arabic style gyro falafel sandwich mamoun one best around love location right heart hoboken take nice walk afterwards washington st enjoy hoboken amazing vibe highly recommend mamoun looking good middle eastern arabian fast food two thumb guy rock keep good work
2016-09-17,5,never big falafel fan mamoun herby light mamoun make best falafel ever tasted day walking city getting small bite eat came back hoboken car parked decided get mamoun got one platter meant one person shared shwarma baba ganoush hummus falafel along salad pita another side order grape leaf shwarma falafel perfect great seasoning came heaping pile shwarma like falafel considering getting option sample popular choice suggest getting another side order falafel like came three would ordered little hungrier better baba ganoush good enough hummus incredibly creamy delicious paltry salad really ca n't even complain since rest good grape leaf cheapest seen great little appetizer
2016-09-13,4,excellent consistent food falafel babaganoush delicious delivery always time food hot family go take
2016-09-12,3,reliable option late night eats probably largest location around area believe another site princeton n't got chance check yet got combo plate extra portion meat know priced pretty decent meat portion bit skimpy side went chicken lamb pretty quickly piece le bite sized chicken lamb also pretty salty well veggie option actually far tasty satisfying comparison hummus baba ganoush tabbouleh pretty good may get veggie platter next time
2016-09-10,3,mamoun reading review excited give try huge fan turkish overall middle-eastern cooking kinda disappointed place look like cantine lack better word hummus good lacked acidity balance flavor falafel good lentil soup also little bland tea point however nice overall found place little underwhelming probably wo n't going back
2016-09-09,5,lived hoboken 6 year heard great thing place never made finally wanted something different ordered delivery wow know place get prop fast service food exceptional spent much time middle east place get right ordered lamb kabob hummus dish chicken ton side hot fresh tasty
2016-09-03,5,omg hot sauce pretty deadly holy crap bottle tip cut pretty big got tbsp plate thought gon na pas eye watered nose ran eye lid sweating sure sauce hotter halal guy nyc one either way blow brain good luck got chicken kebob plate 12 salad rice extra 1 1 side chose hummus good lord huge chunk chicken moist god give anything moist chicken hummus smooth flavor well balanced cold hummus warm pita oh heaven rice awesome middle eastern seasoning packed much flavor amazing mint lemonade 1 85 n't sweet thank god hate sweet drink nice cost u 35 two people getting plate drink 1 dessert cheap well worth satisfaction coming back
2016-09-01,5,hand one best eatery hoboken arab israel place best falafel sandwich around next beyond pita montclair nj n't bad experience mamouns guy behind counter amazing helpful especially people n't understand middle eastern food sandwich filling pricey also recommend getting plate cheap filling full flavor place always packed looking sit may get seat okay thats make place great take walk sit someone stoop enjoy best food hoboken people watching
2016-08-30,4,hoboken location mamoun much nicer nyc counterpart near nyu actual space dine takeout super quick within 5 minute tuesday around 11:45am beat lunch crowd got chicken kebab sandwich great 7 pretty good deal felt like enough food n't opt platter 12 definitely try next time solid consistent lunch spot hard come hoboken really hoping mamoun one today quick lunch run spinach pie baklava looked fresh yummy ca n't wait try tldr clean affordable quick lunch spot mediterranean sandwich platter highly recommended
2016-08-25,3,well food excellent lately apparently become normal deliver cold food n't get hope 3pieces pita bread mentioned delivery page get one 5th time pretty confident seems long term habit shame couple month ago food impeccable delivered hot promised amount bread like could n't live without bread usually paying customer get promise conclusion got choice plate sandwich get sandwich get expect way cheaper though n't care need food lunch next day plate good option size
2016-08-17,4,great food friendly worker food never disappoints long wait popularity
2016-08-14,4,got shawarma plate rice salad know lamb tender yet juicy rice cooked seasoned really well got sauce side forewarning hot sauce ear-numbing spicy also prepared wait really popular worth
2016-08-14,5,amazing food chicken flavorful shawarma sandwich amazing hummus best ever creamy delicious
2016-08-09,4,amazing food great service recommend getting meat platter get veggie awesome meat option warm friendly staff efficient
2016-08-07,1,mamouns like girlfriend keep cheating stay know n't willing say food delicious customer service atrocious probably worst ever experienced multiple time order online phone paid instantaneously walked like 15-20 minute later pick start making order come claim hell damn point letting people order way lying customer saying ready certain time started moment point get tired con know people waited hour delivery block away go way avoid place point time break
2016-08-07,5,great place affordable price always go son friend fast good service vest falafel ever
2016-08-04,2,average food fresh ingredient better place area get falafel crisp newport mall best fresh falafel whole wheat pita bread
2016-07-27,4,stumbled upon place get rain ordered falafel sandwich one bite taken back lean day living west village could buy falafel 1 50 turn falafel back macdougal street 80 whether nostalgia reality best falafel sandwich even price tripled
2016-07-26,4,awesome falafel sandwich shwarma hummus tabbouleh salad also fantastic one go quick filling dinner also love open late late night fix well never disappointed food always consistently delicious give 5 star could get delivery hour every time ordered wait least 65 75 minute peak peak dining time noticed hoboken issue mamoun issue though
2016-07-24,5,first order delivery ordred shawarma sandwich also baba-ghanouj amazing delivery fast thank
2016-07-19,4,always tasty fresh thing annoys whenever place pick order prepare get take long especially busy dinner time
2016-07-17,1,great food terrible service mo cashier manner
2016-07-15,5,best hummus outside greece order ca n't go wrong anything
2016-07-04,5,go-to takeout option husband hoboken always order swarma chicken kebab plate sandwich considering order couple time month food always consistently good also tend customize lot ex veggie extra xx etc always get substitution right ca n't say many place hoboken consistent basis least
2016-06-26,4,many falafel place around mamoun offer good falafel reasonable price family love come place open late however find food little salty time
2016-06-26,4,late night speedy delivery falafel great kebobs beware hot sauce big spicy food
2016-06-23,5,night go hoboken think biggest motivation knowing get amazing falafel 2am tried numerous thing including falafel hummus baba ghanouj grape leaf baklava mint lemonade everything delicious everything place great clean open late server friendly competent food amazing cheap could ask
2016-06-11,5,first visit momoun amazing food authentic affordable falafel really good though iced tea could lot better outside seating add fifth star place definitely visiting
2016-06-08,5,loved place perfect weekend afternoon lunch late night favorite dish far hummus falafel tabouli salad also good great location however get bit crowded may feel little tight meal
2016-06-02,4,best cheap eat area always get falafel mint lemonade service good plenty seating
2016-05-29,3,pita bread dry chicken piece cooked order totally messed order good food late night club go family dinner
2016-05-29,4,definitely go spot falafelgreat flavorreasonable price mango drink seemed watered 2 00 cup tehini poured falafel even dont request advice tell put sidei personally like tizaki better n't offer yet next time try shaworma great place come eat hoboken
2016-05-26,4,first meal back tonsil removed regretting either got chicken sandwich quite delicious felt little dry dap hummus cured rice option lot going many different spice flavor wasnt huge fan hummus delicious favorite thing honestly buy bigger portion take home later
2016-05-26,4,feel like place always raising price perfect spot eat late night believe open 3am got chicken kebab plate served salad mabrumeh dessert beyond favorite mango juice refreshing baba ganouj n't expectation n't taste refreshing last night chicken salty overall stuff pretty good worker cool personality
2016-05-22,5,first time trying mamoun yelp review accurate flatbread grill good mamoun seems authentic got meat combo platter chicken hummus falafel salad enough food two meal price also really good went pick order restaurant pretty busy lot people waiting to-go order definitely return customer
2016-05-21,4,one favorite falafel place baklava one best huge fan side hummus grape leaf oh mango juice really good great weeknight cheap date spot
2016-05-17,5,amazing food really cheap falafel made happy hummus decent solid though amazing grape leaf cool specialty drink overall solid 4 food price 3 50 falafel sandwich omg outside seating make 5th star
2016-05-14,5,always order deliverythey inform always wait time 45mins etc consistentabundant flavorful good job
2016-05-13,4,looooove chicken sandwich indian enjoy chicken spiced juicy place successfully satisfied craving chicken well roasted loaded spice near perfect problem falafel platter husband ordered served horrible bread dry inedible also rice flavorful filed garam masala healthy thing yes platter saved crispy falafel serve would never falafel platter chicken p hot sauce hotter halal guy believe
2016-05-13,5,love place platter filling delicious lemonade also good never liked falafel came im sure anyone may like suggest try one time
2016-05-11,5,mamoun become staple u fiance eat least one two time week food super cheap super delicious favorite combination far best falafel around everything really amazing looking something order always get chicken combo platter 2 side falafel either babaganoush hummas
2016-05-10,5,big fan mint lemonade feel like mint n't fresh would make huge difference falafel point absolutely addicted crave time friend cali came jersey ate falafel perhaps would pick nj ny pizza little stingy white sauce probably know name
2016-05-05,4,food great guy working act like douchebags sometimes need learn professional courteous
2016-05-03,1,worst customer service friend ordered lamb sandwich get chicken sandwich instead ca n't eat chicken call tell hang u apology nothing asked could deliver block away since messed order answer seriously pathetic service also tell u return chicken sandwich audacity
2016-04-25,3,chicken kebob sandwich good add hummus 50 cent nothing world decent
2016-04-25,5,pro outwit con reason get 5 star open really late food amazing definitely hit spot worker nice occasionally get one guy seems care always get veggie plate baba ganoush hummus falafel rice sometimes get kofta sandwich awesome lamb rice also really good tell meat top quality however wish would n't cut yelpers complaining food salty n't agree believe spice see nevertheless thirsty mofo next day speaking thirsty always get blackberry juice always watery one time lady sitting front returned lemonade cause tasted like water another time saw worker drinking cup pouring remaining content back juicer yuck recommend coming night sometime 11 weekday place empty street parking empty please love god go carlos shitty bakery eating instead try dessert dessert
2016-04-21,1,ordered last week nothing made well falafel prob best thing saying much actually got sick eating well bad experience hopefully one
2016-03-26,5,good amazing best falafel joint town great service tasty food amazing service come back sure
2016-03-24,4,3 word dee lish u yelp post longer review hell number letter type opinion asked opinion gave
2016-03-20,5,great food love falafel lemonade
2016-03-15,1,got food poisoning eating never unfortunate bc used love place
2016-03-13,4,mamoun great delivery late night option multiple time never disappointed food always hot fresh portion generous considering low price
2016-03-12,5,maybe 4 jesus christ iv long time running 3 hour sleep since thursday veered 495 way back city get thing open crazy hour mamouns well fuck maybe diner open jersey point hour craving say name pop google map obvious beeline know late parking right front spot nobody goddamn ordering chicken kebob shwarma falafel sandwich regard im going eat knowing want dont want compromise jump back car fly back city flash forward even 10 minute later laying bed making love sandwich standing devoured falafel started chicken tossed fridge mamouns next morning im writing absorbs last night sin effectively practically hamburger term nutritional value except would argue taste way better realize like 3rd mamouns iv reviewed yelp guess could say favorite place eat period crazy think totally justifiable open around clock oddly wherever fuck mouthwateringly delicious every single time
2016-03-11,1,used love place many service issue last several delivery able recommend recent situation took 90 min deliver order discover swapped ordered whole wheat pita care give white pita also chintzy side pita also white giving le gotten past broke camel back called complain order asked told u always run whole wheat hour seems always run plan available serve customer actually ordered guy answered phone basically told u piss hung without apology wo n't giving business anymore
2016-03-11,5,good cheap fast open super late delivery quick love babaganoush hummus order often
2016-03-10,2,price really good food great little greasy taste greatest meat
2016-03-08,5,without doubt one best place eat hoboken come time week chicken kabob falafel leave spending 8 dollar everything menu fantastic highly recommend side mango juice owner absolute stand guy stopped run one day one credit card one declined due fraud account owner gave sandwich anyway told pay next time outstanding customer service
2016-03-08,3,mamoun always go place u drink late night snack falafel sandwich good decently priced
2016-03-06,5,love shwarma sandwich pita bakala pastry bunch thing n't tried good diffenitly cant wait
2016-03-02,5,place delicious service little slow although food fresh hot delicious worth little wait small relaxed casual restaurant great spot cheap filling delicious meal ca n't wait go back yum
2016-02-16,3,price food perfect college atmosphere like place area welcoming everyone food meh falafel plenty restaurant make cut place temporarily cure craving falafel guarantee wo n't satisfied long
2016-02-13,4,went dinner mixed meat interestingly enough come one meat choice beside minor confusion placing order food awesome really enjoyed quality taste food
2016-02-13,1,way much salt mean way much ruin yummy delicious food much salt falafel gluten free many vegan option wanted try pretty much everything menu ordered 40 worth food chicken hummus baba ganouj inedible salty falafel lamb heavily salted well point inedible sad falafel perfectly super moist inside crispy outside still salty eating bite food left place hungry saltiness disgusted appetite entire day wanted eat food salt next day would love eat falafel cut back salt please cut back salt please
2016-02-11,5,probably one time favorite spot eat drive distance get damn falafel sandwich place great friend life four hour away begging bring food bundle listen try restaurant whenever whether 3am leaving tally ho drunk five dollar name place keep satisfied item amazingly priced staff always friendly make sure leave tip place sometimes messy honestly rush get insane n't care cleaning another person mess sometimes oh hot sauce tearing bit craving five star forever ever 1:35am two second away driving right oh another perk open till late
2016-02-08,4,good food price right huge fan grilled chicken sandwich side humus everything fresh never bad experience little slow ordering take delivery
2016-02-06,4,back four star five mamoun still good price increase inconsistency several recent purchase think four right number falafel pita 3 50 still quite bargain hoboken
2016-02-03,5,love place straightforward always good staff looking little like male stripper good efficient pleasant job really well speak fluent bro always order grilled chicken sandwich delicious basically grilled grilled chicken salad pita guilt love spicy stuff like one hot sauce control spicy mix tahini wow perfect hummus honesty could updated little along baba still solid old school good dessert great lemonade great casual place
2016-02-03,5,ordered take dad since mom currently country ran food p eaten many time loved contrast intense rich flavor shwarmas falafel also refreshing tart crunch pickle better yet customer service always point serving smile dad took one bite shwarma plate fell love mom come home ordering
2016-01-28,3,solid joint like schawrma pickle side mind blowing quite good
2016-01-24,1,wtf called inquire whether kosher received abrupt hung mid sentence something said
2016-01-19,1,food usually good offered delivery 90 minute go call find going excuse get traffic traffic hoboken 2 pm tuesday joke extremely laughableyou guy lost loyal customer im gon na fun telling people story
2016-01-06,5,place phenomenal definitely one best late night delivery spot hoboken efficient order system getting food price great amount food get place always bustling around dinner time bar crowd start get peckish always seems plenty seating though recommend gyro side falafel solid meal soak good night send bed full stomach
2015-12-29,5,great late night food night bar falafel crunchy tasty shawarma perfect price reasonable great place
2015-12-29,4,nothing better shawrma 4am besides amazing drunk food everything fresh delicious hummus super good
2015-12-26,4,day traveling holiday came back hoboken starving luckily mamouns opened could stuff face one plate menu extensive well option sandwich plate plate easily split two people looking skip pita bread love shawrma chicken additionally honorable mention dessert literally every single dessert worth try super flaky plain delicious also juice mint lemonade tamarind great quality consistent food chain get packed great late night spot also deliver sometimes take well worth
2015-12-26,2,went shawarma day xmas u pretty hungry meat pita chewy challenge instead expected succulent mouthful one point companion thought bit bone shred ossified jerky long time customer mamouns macdougal st mark nj experience surprise save shekel pas mamouns holiday weekend
2015-12-21,5,begin first tried mamouns greenwich village manhattan loved living jersey n't want go far thrilled find hoboken still far much better going lincoln hummus best e arab pretty much hot sauce amazing super spicy chicken extremely good picky chicken eater falafel also great best go paterson egypt also gaza palestine price okay little like spend food crazy mean tabuli pretty good well try baba ganush amazing overall place great wish bigger dinning room like place hoboken room expand beef lamb family friend say lamb die also n't forget mint lemonade absolutely perfect overall go whether new arab cuisine arab looking good authentic grub please appetite
2015-12-21,4,goto place hoboken fun
