date,rating,review
2021-10-25,5,long overdue review mamouns city year year ago hoboken location awesome consistently delicious little pricey outrageous hoboken plate keep full day must updated online order system response review saying n't know order ready placed order online got text ready
2021-09-28,4,always forget take pic since always devouring soon get haha kind get pita sandwich sadly falling apart getting soggy cold time get west 4th sandwich yesterday shawarma hummus really disintegrating arrived still tasty also got combo plate falafel babaganoush stuffed grape leaf rice really liked except rice ok lot would rather 3 chosen item much filler drink mint lemonade pretty good past location shawarma pita well tamarind mango drink really good course also made visit mamouns nyc n't staple
2021-09-23,5,yesterday lunch mamoun falafel hoboken location falafel sandwich season fry overall food really good
2021-08-31,5,food fresh delicious people kind willing help anytime place clean like using le plastic excellent service
2021-08-23,5,born new york city mamoun falafel blossomed chain restaurant bringing middle eastern cuisine location east coast menu simple compact pick falafel plate came seven herbaceous falafel ball served simple salad lettuce tomato onion herb olive pickled radish black pepper plate came tahini sauce side acted perfect dressing salad dip falafel also got side tabbouleh chewy nutty mixture bulgur parsley thick creamy hummus perfect dipping falafel thin chewy pita bread came side one last item worth mentioning mamoun hot sauce particularly peppery spicy flavor added quite lot heat every bite
2021-08-20,5,ordered shawarma sandwich side rice side falafel baklava incredible travel well
2021-08-20,5,one best turkey kababs u probably closest one real deal ordered sullivan chicken kabab hummus mcdougal lamb falafel yummmmm
2021-08-19,5,regular reliably delicious always taste fresh usually get classic falafel sandwich great veggie option never problem service dessert amazing
2021-08-14,3,overhyped falafel place price good quality falafel mediocre sure hype really
2021-08-10,2,nothing like mamoun east village bland bland bland ordered shawarma falafel sandwich could n't even eat meat dry flavorless sad disappointed topping n't taste like anything time bit sandwich everything soggy coming back
2021-08-09,4,food greatstaff attentivei placed online order went pick pick place never keep order would know food ready read name bag prepared order kept behind pick point even though waiting order good 10 min went staff check food gave food update status online order food ready pick even though mention track status using delivery comi order chicken falafel sandwich awesome complaint quantity quality food red sauce hott
2021-07-31,4,nice dining place simple interior excellent food quality fast service desert ok
2021-07-14,5,love place sandwich delicious filled perfectly little expensive quantity quality great taste awesome
2021-06-29,4,one best place around nj ny falafel stand name opinion falafel star dish along baba ghanouj hummus wide variety option till date none disappointed u including dessert shawarma beautifully seasoned cooked perfection great fan meat combo plate go would n't disappointed
2021-06-28,5,go quick bite love classic vegetarian pita hummus falafel quite full meal would recommend adding fry delicious garlic dip
2021-06-24,4,took food mamoun movie night park service quick people nice shawarma plate awesome amount food price also got stuffed grape leaf baba ganoush fresh pita bread perfect meal also n't miss baklava piece huge delicious next time ask extra sauce plate go easy adding hot sauce spicy definitely going back
2021-06-22,5,friend told mamoun literally fallen love everything flavorful reasonably priced make soul warm one favorite hummus feel like could eat like rest life never get tired always addition orderi even vegetarian love west village falafel sandwich literally go every time even though keep telling going try stuff amazing menu go check location stomach love sure gon na fall love
2021-06-08,1,food horrible expensive sandwich cheap lettuce meat three piece lamb three piece chicken falafel horrible black smelly oily
2021-06-07,5,nice restaurant great location good food fact like one new york st mark street
2021-05-16,5,all-time hoboken favorite amazing set sandwich best falafel classic sandwich pita loved kanafeh
2021-05-09,3,ordered west 4th sandwich tasted okay bread almost freezing cold soggy bottom falafel good
2021-03-25,1,feel like every-time order place screw order explicitly ordered side pickle sauce missing even portion diminishing prepared bland sandwich order side
2021-03-17,5,consistently delicious lunchtime stalwart going hoboken spot year used 5th street 3rd nice menu wide ranging choice back great friendly service ordered online easy order quick delivery excellent food one best falafel ever top choice
2021-02-27,5,delicious every single time love west 4th sandwich like lamb try west 4th falafel good well skip chicken flavorful
2021-02-13,1,ordered vegetarian falafel platter rice falafel sandwich feb 21 2 bite falafel platter found piece meat supposedly vegetarian falafel platter immediately stop eating food since dietary restriction waste money time driving jersey city
2021-01-28,5,awesome experience went pick seemed safe concern covid food prepared quickly food delicious shawarma mcdouglas pita bread fresh soft lamb seasoned perfection perfectly combined rest ingredient highly recommend
2021-01-26,5,might order often honestly consistently fantastic whenever get delivery fast service food always still hot usually get shawarma wrap tried platter platter bang buck fiance lebanese falafel always make happy one favorite restaurant take-out hoboken
2021-01-20,5,dubai give place 5 star big deal soon moved jersey city many friend telling u check place also recommended random uber driver check tip difficulty using 3rd party service order online directly called hoboken location free delivery radius awesome recommend ordering classic falafel hummus sandwich west 4th hot sauce real hot good ordered side hummus really reminded home
2021-01-11,3,mamoun long time comfort take option worth buck filling sandwich decent vegetarian option falafel flavorful best suggestion try baklava often fresh
2021-01-11,1,jan 11 2020 boyfriend friend went get food location boyfriend wanted cookie case pointed cookie touching glass case cashier anne said bruh stop touching case second time touched every time touch clean finishing food asked cashier issue rude replied dumbass nigga even customer friend paid food called morning speak management reference experience got someone named marie explained situation response saw video ann n't say er instead nigga made racist educating marie defending coworker inappropriate call black man nigga derogatory name regardless touched case unacceptable ann attitude unwarranted unprovoked marie excuse behavior speaks management educated marie ignorance got pissed said n't going disrespected replied n't disrespecting simply educating ignorance response come store check invited come store challenge hoboken police contact boyfriend say harassing could imagine day time behavior staff franchised establishment insult black man touching glass call police say come store sad say surprised
2020-12-28,5,hand best falafel ever tasted coming west coast n't know term falafel game east coast know always compare every falafel mamouns taste texture perfect way come together wrap absolutely delicious also great tasting dolmas fry
2020-12-27,2,ordered falafel sandwich came thin squished falafel whole lot lettuce soup good remember got pita bread w soup anymore also tried order bunch side like baba ghanoush hummus available overall disappointed go year gotten stingy price went
2020-12-11,4,always immensely incredible dining experience overall mamoun go wrong mamoun chain matter go ingredient freshly prepared cooked plenty lettuce onion tomato tahini white sauce dreaded super spicy red chilli sauce go around falafel super crispy outside soft inside shwarma lamb beef chicken gyro platter excellent plenty meat piece rice affordable price relatively decent portion size money parking-wise downtown hoboken parking bit tough find may lucky timing right someone back parking space grab otherwise street parking meter nonetheless overall food quality taste excellent
2020-11-25,5,love swarm end crispy rice seasoned perfectly mother god garlic sauce order 6 ounce cup set aside two ounce put shot glass take back
2020-11-21,5,went wanted add amazing yhe cashier girl could n't decide gave u much advice told u favourite waited patiently sweetheart everything recommended tasted amazing good food good service
2020-10-16,1,get food delivered arrive cold missing item 8 10 time good luck
2020-09-25,5,boy mamoun still spittin fire like 96 w4th street real good city hot sauce potent white sauce healthy tahini kick keep local know happy thing need 2 pocket fill falafel shawarma homo hummus either way fire habibi
2020-09-24,5,know hated last review falafel one better hummus believe n't rock world blow away keep running across river way one point still best middle eastern food ever eat life amazing heavenly well made price still incredible way long long time ago get pita combo falafel shawarmawhy mamoun best service best food locationwhenever jersey waythere one thing sayto b tch named karma let go get shawarmaand eat mamoun every day think best thing moon mean mamouns combination different stuff put pita talking best topping imaginable beautiful fluffy open pita bread kind worth stuffing anything really kind food really blow away leadership system brokenand deepest fear unspokenbut come foodit would f cking rudeto come mamoun hoboken also excellent selection lemonade exotic drink mint lemonade second none massive fan probably come try employee thought mother cow may ma-moos best experience mamoun hoboken leave buffalo shortly midnight still manage miraculously make location close 5am fri sat lot people drive time without even getting ticket route yet especially bad weather bart simpson eric cartman regular eric regular everywhere ma-toons actually managed roll 4 47am 5am close 5-hour-high-speed drive buffalo serve gave bunch free stuff customer service absolutely exemplary quite opposite waitress syracuse mamoun best customer service anywhere lovely guy rocked world time road n't want get find closed 15 minute early like many place would sold digital song whereby artist got almost profit ma-itunes hummus world long island best closed mamoun best still alive exemplary incomparably delicious pita fool disagrees get shawarma falafel combo pita 6 50 stuff everything say everything mean pickle hummus crazy flavourful bit n piece spiced veggie drizzled tahini come together absolute miracle guy crush mum ma-swoons stuff like kofte chicken never able stray tried trusted shawarma falafel combo pita good saw tom green fave bird ma-loon fun always expose bum rather mum rather expose bum maybe get case like put bum thing fun everyone well ridiculously low price nyc area yet 6 50 stuffed pita full heaven added bonus hour 5am fri sat 1 2 3 night come breakfast insane early macdougal manhattan location open til 5am every night closed 12pm instead 5am ma-noon mamoun favourite pita kebab ny-nj possibly usa ca n't take mother anywhere driven jersey least 666 occasion every time expose bottom staff think gross think funny one creepy hairy guy back seems actually enjoy little bit much burly grunt anything go n't know moon know become famous ho-boken renamed restaurant predictable moonings accordingly bring barbie swoonsimagining desert golden dunesand always dress like world finest poonswhenever bring barbie mamoun
2020-09-04,4,amazing place fresh mediterranean food lot option vegetarian think great mamoun quality food reasonable price falafel name restaurant course got side falafel shawarma sandwich friend got chicken rice dish got stated overall dish delightful light though place full want balanced healthy meal great place get one
2020-08-31,5,ca n't believe n't review mamoun boyfriend stop quite often shawarma favorite delicious juicy hot lamb meat good get side lot salad delicious n't prefer iceberg olive feta dressing grape leaf pickled veggie great fresh pita bread baked daily good boyfriend love bleeker sandwich chicken kebab felafel served pita lettuce tomato onion tahini sauce also love lentil soup think ok like mine better lol like macdougal sandwich shawarma felafel tomato onion lettuce tahini sauce yummy also pita pocket love pita chip bad good hot sauce make excellent spicy baba ganouj delicious like eggplant side chicken kebab good though sometimes little dry three dessert good baklava course knafe shredded fillo dough pistachio layer honey mabrumeh fillo dough topped mixed nut coconut honey definitely recommend mamoun great service every time gone always consistent price n't bad worth
2020-07-22,1,worst service ever received apparently could n't deliver building forgot let u know call multiple time never go food n't even worth
2020-07-22,5,schwarma plate go portion look small filling usually ask sauce side otherwise rice drenched white sauce crack hot sauce absolutely get enough must try
2020-07-14,2,since mamoun thought would give shot phoned advance seemed gotten wrong line pick order though line paid food ask cashier food seemed remember give got food brought home pita dry falling apart lamb bit crusty doused tahini sauce n't bad late competitor garlic tahini good enough return visit anytime soon mediocre best staff seemed like wanted elsewhere
2020-07-14,5,go-to whenever craving cheap middle eastern food particular spicy juicy pita consider mamoun nyc staple love eggplant pita mango lemonade juice ordered twice grubhub hoboken location enjoy going east village location person hope able get thru pandemic
2020-07-11,4,great quick bite highly recommend bleaker like hot sauce sauce amazing recommended putting side heat
2020-07-05,5,came lunch one week day delicious got combo platter much food
2020-06-29,1,found two long hair bleeker pita rice tasted like big red chewing gum pretty disgusting would n't recommend
2020-06-29,4,love falafel sandwich must try believe costed little 4 dollar year ago seems like little 6 dollar falafel always freshly fried crispy go amazing pita pocket veggie love put good amount tomato inside hot sauce addictive would careful though get spicy put much
2020-06-07,4,huge falafel lover stopped mamoun awhile back could n't remember decided stop classic falafel overall bad nothing special falafel ball tasty huge fan pita thin tasteless rather one halal cart honest opinion though added 1 extra star solely service girl register friendly really went beyond chatting every customer cleaning bathroom noticed dirty great worker also really grateful happy open pandemic stomach thanks
2020-05-28,5,ordered sullivan lunch today delicious portion generous definitely n't skimp meat protein side fry also perfect definitely come back future
2020-05-26,1,supporting local business difficult time mamoun n't know treat customer mess order given dry cold food wrong salad called let know wanted drive way back hoboken jc return sandwich salad spending 45 btw manager phone wow take 15 loss seeing unacceptable business awful attitude hope people stand
2020-05-24,4,ordered mamoums falafel pick ready right away ordered classic falafel pita macdougal pita side hummus item good fairly priced make place goldmine hoboken previously gone st mark location hoboken restaurant good price ca n't beat place recommend mamoun falafel lunch ate mine park n't feel mid-day slump afterwards bring extra napkin since bit messy process ca n't wait try item
2020-04-13,4,mamoun new brunswick basically staple diet senior year lived right next door stopped 4 falafel sandwich least week whopping 6 hoboken location different great food insane price went bit crazy night dinner ordered whole spread dip sandwich dessert work nothing disappointed full order small hummus baba ganoush extra pita falafel sandwich shawarma sandwich extra tahini mabrumeh knafe dessert dip probably best part meal hummus fantastic creamy flavorful put small amount oil paprika wish got larger side baba ganoush fantastic well smokey flavor eggplant dip really like dip come large pita bread falafel sandwich good always love mine ton tahini give one side per sandwich plenty boyfriend got shawarma sandwich n't really like thought pretty dry n't much flavor even though eat meat always loyal falafel sandwich ca n't personally speak shawarma onto dessert mabrumeh amazing filling tasty think combo 3 nut soft loved sweet knafe great n't sweet tasted little grassy deciding dessert go mabrumeh especially sweet tooth got delivered showed maybe 20 minute tax tip delivery around 30 definitely one favorite spot really affordable great food forever keep coming back falafel sandwich
2020-03-22,5,delicious falafel great sitting space almost good mcdouglas st store
2020-03-13,3,3 5 star seem skimp protein platter sandwich jam packed lamb shawarma pita sandwich almost little much shawarma enough ingredient could taste meat every bite bet lot people would enjoy also tried combo plate falafel hummus baba ganouj loved flavor dip hummus creamy strong tahini flavor baba ganouj smooth smoky opted get rice salad platter 1 extra n't think 1 necessary dish come amount food normally get plate pay 1 get half rice half salad standard
2020-03-04,2,loved place ordered frequently long day work never inside gotten delivery via seamless go without say surprise object found salad tonight enough keep away place good absolutely disgusting day age health risk like n't taken lightly screened much better
2020-02-22,3,food great usual meat portion combo really disappointing combo chicken kebab 5 small chunk chicken cost 6 00 add
2020-02-13,4,mamouns one favorite place hoboken never disappoints best falafel around hot crisp greasy key hummus creamy flavorful always go like get chicken combo plate salad since get try little bit everything way think could little generous chicken still abundance food caution careful hot sauce tiny drop go long way n't make mistake drown food n't believe give try
2020-02-03,1,gave wrong order denied gave wrong order n't responded yelp message either horrible customer service ordered timei used uber eats food wasprepared restaurant maumounin hoboken order 1 28 20207:27pm order number traditional falafel sandwichwith two unidentifiable soup thatfrom uber eats 6ed3f order code second negative experience restaurant two lentilsoups identifiable lentilsoups mind lentilsoup hoboken restaurant occasion fineand way thesetwo soup one tookone lentil soup diluted intoten soup eatable still refrigerator youwould like eat feed yourfamily complained nightto uber eats basically saidthey sorry bad experience unable doanything point theyanswer back someone namedmae restaurant going tomake thing right use themfor business half order isgood half possibly health deptissue adulterated food apology people uber eatesjust n't cut especially wheni paying good money uneatablefoods one place nothaving eye ball
2020-01-23,1,thought going good spot meal took turn worst eating chicken plate hummus mint lemonade woke middle last night worst case food poisoning still lasted please clean careful serve people unfortunately scarred go back hope others n't experience
2020-01-20,5,used always go place west village location must say service food hoboken good thank coming hudson giving u little piece heaven falafel amazing chicken kebab killer thanks also smile nice service
2020-01-12,4,came late night bite husband idea mamoun even hoboken saw knew would want go order anything ordered shawarma platter forgot snap picture delicious came shawarma one pita rice veggie service quicker expected price bit steep
2020-01-01,1,piece shit restaurant ordered 2 entree receive soggy piece chicken barely 2oz soggy salad paid 20 unreal avoid cost
2019-12-06,2,recently food n't good use got chicken falafel bowl really hard could n't even eat driving get took u 25-30 min
2019-12-05,4,known falafel know west village falafel sandwich sooo flavorful lot falafel topping lemon soup kind bland flavor added spicy sauce table gave kick looking pita chip topping service quick order ready still paying ghos since lunch hour cold day hoboken
2019-12-02,5,ordered mamoun late night long day food delicious got east village macdougall sandwich hit spot delivery service great recommend asking hot sauce like spicy food caution veryyy spicy warned
2019-11-27,4,good cheap fresh yummy mentioned cheap went twice 5 day visit nyc falafel sandwich baba ganoush midday snack great time complaint hot sauce n't favorite taste like bunch spice much else good way go wrong menu option tho
2019-11-16,4,heard lot place fellow middle eastern fair share falafel say falafel good loved soft fluffy pita bread well got lamb plate good nothing extraordinary
2019-11-14,4,good middle eastern food chain enjoyed falafel combo portion size really big decent price food get
2019-11-13,4,huge advocate mamouns absolutely love food going new brunswick location long remember opened location back ago recently visited place blown water location actually pretty big service great people working behind register could little suggestive seem somewhat friendlier price location food fresh well dining atmosphere seems pretty welcoming clean table bright light age group come location vary teenager younger adult family wanting enjoy one falafel said last location say location area grab falafel mamoun
2019-11-04,1,use delicious worth money like 6 chicken rice cart packaging shitty food quantity le freaking 14 use regular customer would rather go 6 cart mamouns
2019-10-31,5,mamoun shizzz afraid try n't everything yummy warm fresh always go chicken kebob plate rice rice crack soooo good could eat love hot sauce well add amazing flavor level already aromatic food pickled vegetable nice tang bite along pepper mango juice go drink n't taste watered nectar like always tried hummus falafel neither fan general however say mamoun hummus smooth creamy falafel nice bite great flavor baklava perfect ending fulfilling meal sweet nutty flakey sticky love portion size big end eat half next day price extremely fair ever since moved restaurant become spacious inviting definitely great place try late night craving
2019-10-15,4,place solid spot fast food better quality fast food usually get lamb pita really good drink option pretty good know others gotten falafel hummus said good make sure get sauce n't feel dry
2019-10-10,4,love mamoun going one ny mcdouggal year one hoboken great well however give 4 5 star never give enough napkin bought shwarma 2 falafel sandwich fry received 3 napkin food get messy use sauce food great always intend coming back wish hand napkin also request tahini white sauce falafel sandwich n't give side without asking one ny always gave side little thing take away good food taste
2019-09-28,4,falafel chicken shawarma place amazing pita warm fresh service quick
2019-09-26,5,absolutely nothing negative say place food beyond amazing recommended shawarma classic definitely go-to pair mint lemonade perfect feast always leave satisfied full wanting
2019-09-21,1,aside much food way way salty mamoun place really stink business could care le accuracy order timely delivery general satisfaction customer today yet another horrible experience placing order getting everything ordered uncaring frustrating interaction person could cared le done business guy many place actually care customer deal folk like mamoun
2019-09-18,4,great fresh mediterranean falafel spot open late hoboken hankering great food late enjoy sharing platter suggest trying unsweetened mamoun iced tea splash mint lemonade trust need use mamoun hot sauce shoutout vianna saving u 3 recommending combo platter instead chicken kebob plate adding extra sharma side yummmmm
2019-09-06,5,time wait time order go 5 min max quality quality food definitely medium high quantity definitely make full first date definitely casual type place want date experience first impression overall good place hang friend good place order go special note would definitely try shawarma chicken kebab would recommend yes
2019-09-05,5,visited several time ny never got chance try throne hoboken people told great one mcdougal turned great classic sandwich sandwich contains fresh green lovely crisp falafel tomato onion delight extra herb extra veggie classic hummus pita falafel must try sure eat big sandwich real fast get soggy pretty soon west side sandwich one contains ton pepper spicy sour tabouleh green falafel hummus tahini short little bit everything like sour pepper pita bread probably would give miss compared classic p love spicy food hot sauce available pretty hot
2019-09-04,5,go place shawarma eating family run business since little girl know getting fresh flavorful food clean environment hot sauce nothing play warned tamarind juice lemonade always super refreshing
2019-08-25,5,mamoun become new go-to takeout ever ordered chicken kabob plate salad rice consistently delicious love garlic sauce thing say seasoning rice overpowering must get baklava
2019-08-24,3,place used great since new management meat halal confirmed atleast 3 time different day staff manager thatshow much long chicken shwarma still vegetarian platter good owner reading please make place halal
