date,rating,review
2018-04-06,1,regular location usually service amazing except last night manager extremely rude asked shawarma sandwich made tahini would get soggy took order ready asked extra tahini side guy behind counter said already tahini sandwich specifically asked manager took order started arguing n't ask would also give extra tahini completely different experience day prior male manager nice helpful even brought u food plenty extra tahini smile yes sandwich soggy time got home
2018-03-22,5,go hoboken always hit spot never disappointed seasoned rice mint lemonade great add ons
2018-03-19,1,moved new location price increased pita became modest never good save client many mistake order attitude b important n't answer phone two day row better handle issue quickly
2018-03-05,2,experienced much better place one favorite something quite order feeling sick since food sure eat rest bummer
2018-03-04,4,love food reason took one star ordered chicken kebab plate little piece plastic pickle sure would bad kid ate took everything yummy
2018-02-28,2,used late night go sure happened moved couple block new location soggy soggy soggy pita sandwich could n't even hold hand broke apart seems like bunch owner family member running show find new falafel spot bad
2018-02-26,4,open late reasonably priced menu incredible hot sauce bottle spice hotter good ok experience never disappointed
2018-02-16,5,new spot good old best place town falafel super delicious sandwich well friendly fast service high quality eats highly recommend try pita chip toofor dollar well worth
2018-02-11,5,would eat everyday lived closer falafel dry city random place moist fresh flavorful loveeeeeeee
2018-02-08,5,love falafel sandwich may 100 time still good however feel smaller since moved new location pricey n't mind paying price least n't make sandwich smaller please n't fill lettuce travelled numerous time hoboken falafel sandwich place heart break see sandwich smaller overfilled lettuce always order falafel sandwich baba ghanoush keep visiting place since much better competitor would appreciate n't overfill sandwich lettuce make smaller used
2018-02-01,3,best food great deal vegetarian lot option mix match everything every meal come good amount vegetable grab tasty falafel sandwich le 4 love place always clean moreover friendly staff remodeled really expensive
2018-02-01,1,place absolutely terrible slow rude staff listen order 1st experience ordered chicken bowl rice waited 20 minute find rice offered salad listen salad healthier choice craving chicken rice told would another 20 minute rice asked refund swore would come back seriously run rice place center around rice dish 2nd experience 6 month later craving chicken rice long workout ordered two bowl one half salad half rice gf rice phone gf ordering evidence paying attention receipt got home put eating pant dive guess put salad called complain strike 2 2 manager spoke told ordered salad b n't going fight since receipt avoid place like plague also shawarma suck
2018-01-29,4,mamoun open super late unlike competitor great drunk ashleigh decides want falafel food tasty sober hummus delicious used also really like baba ghanoush something must changed burnt aftertaste thought could bad batch happened month later made decision opt fry also perfect feelin wild suggest dipping hummus still n't better grape leaf mamoun offer wo n't either flagship manhattan also great closer hoboken vouch location absolute consistency still doubt could go wrong regardless location
2018-01-28,5,family visit new york stopped mamoun falafel perfect decision restaurant service perfect delicious highly recommended anyone planing visit new york
2018-01-25,5,place good whoever give bad rating clearly butthurt something petty food great quality great taste justifies price price actually low love place
2018-01-23,5,take picture ordered amazing ordering hot sauce completely erupts flavor mouth fantastic back
2018-01-23,5,take extreme caution hot sauce regardless great think tolerance hot dressing would recommend taste first generously soaking whatever ordered shwarma platter way go come tasty shaving seasoned meat rice salad includes pickle olive one plate everything else come secondary offer sandwich meat stuffed half pita platter protein option vegetarian option available well beyond falafel grape leaf really sure else also section middle eastern dessert diabetes inducing soaked honey almond pistachio related goodness drink juice available flavor mango tamarind well ice tea option
2018-01-20,1,decided try place since moved new location definitely much cleaner old dig food bleh probably thrown bread supermarket package chicken rice greasy flavor recommend
2018-01-12,5,hummus falafel sandwich delicious mention super cheap also hot die
2018-01-12,2,decent chicken kebab careful hot sauce basically ruined meal unbearably hot typically love spicy food use hot sauce use little
2018-01-12,5,place great great taste great experience great value go try dessert diet permit
2018-01-11,5,better mamoun location tried tried new brunswick new york location one much better two love hummus olive vegetable falafel contemplating ordering another one take
2018-01-04,1,mamoun happened loyal mamoun patron 17 year since day skipping high school class visit one middletown ct n't even open anymore one new nyc village hoboken always praised quality price menu recently hoboken location moved washington 5th washington 3rd sure happened move price went quality plummeted tonight ordered mamoun salad side falafel side pickled veggie olive price cost least 5 total usually would salad half size upset see 8 salad appetizer rather entree additionally size falafel per menu 4 piece came 3 paying getting le although falafel tasty sad salad lacked came soggy olive pickled vegetable tasted used favorite part pickled turnip flappy looked though sitting around bit long olive tasted sour spoiled heart break write eating mamoun life ordering product new source franchise properly maintaining quality please help understand terrible experience
2017-12-29,5,best mediterranean food ever eaten although little spicy taste good spice feel good facility clean service awesome
2017-12-27,3,place open christmas eve one like whole street came getting locked apt got bleecker sandwich kebab falafel tomato onion tasted great buuut problem stomach started hurting right eating stomach issue last week probably happened stomach still sensitive still unfortunate n't get finish apparently another mamoun east village good going
2017-12-15,5,going mamoun many year absolutely love place pretty much everything menu delicious said kafta kebob platter salad rice go-to dish get hot sauce side pop open bottle syrah golden enjoy
2017-12-09,5,soon walk mamoun feel like home music along employee give restaurant warm familial vibe live hoboken better come mamoun authentic middle eastern food ever amazing shawarma amazing falafel amazing service amazing atmosphere
2017-12-08,5,first walked restaurant overwhelmed warm environment aroma falafel struck face like strong left hook mike tyson food bomb com service spot highly recommend place anyone hoboken area wo n't disappointed
2017-12-07,3,customer mamouns year today first time new location inside spectacular service amazing said sandwich getting since going taste much different new hipper location sure old recipe got lost old location kindve upset new location sandwich wet hell needed like 12 napkin bite looked like fat kid matilda eating chocolate cake desk work lunch gunna keep coming please go back used prepare sandwich
2017-12-01,1,seamless quoted 55-65 minute delivery waiting 2 hour canceled order falafel never worth 2 hour
2017-11-28,5,look like gave interior make cover look modern fast casual food still good first time ate freshest shawarma grey meat give lot falafel amazing well baba ghanouj yummmy
2017-11-28,4,great food evening late night falafel juicy good amount veggie sauce big fan chicken kabob sandwich chicken kabob flavorful various spice try tamarind drink refreshing sandwich
2017-11-22,5,checked new location gorgeous inside great service usual new menu option also sandwich plate combination manhattan sandwich probably best tasting satisfying vegetarian meal ever going regularly
2017-11-20,4,goto late night meal portion quite large money open super late occasionally forget bit order refuse walk apartment deliver otherwise spot ton vegetarian option like pickled veggie come platter aware hot sauce seriously spicy
2017-11-18,4,good shawarma pita side falafel go mint lemonade fantastic well hummus fresh flavorful hot sauce super hot staff super friendly little unorganized account 4 star rating aside menu great always come back quick lunch town
2017-11-16,2,barely give meat underwhelming recommend halal cart nyc 10x better
2017-11-10,2,weird baba ganoush good way ordered takeout falafel burnt tasted okay baba ganoush weird bread generic store bought pita bread everything went garbage bite doubtful would return
2017-11-10,4,mamoun nyc institution oldest falafel restaurant city say website ecstatic finally try ironically enough hoboken ordered grubhub walked restaurant order prepared picking guy working kindly offered convert dining sat outside listened dulcet tone homeless man loudly conversing himselfbeing starved mamoun newbie settled meat plate 12 get select choice meat three veggie side along either rice salad plus pita rename newbie combo yeah right anyway picked shawarma fool mudammas fava bean salad tabbouleh baba ganouj salad whole wheat pita stomach tastebud quite satisfied baba ganouj especially stood well-defined smoky flavor sipping ordered house spiced black iced tea 2 made cardamom reviving long day mint lemonade also earned praise companion mamoun actually moving two block south still washington also open past midnight every night week later weekend glad finally tried mamoun
2017-11-07,5,basically simple mediterranean food reasonable price falafel sandwich 3 50 get plently price falafel green great flavor come tahini side try hot sauce use little service good food come quick always seems busy seating outside nicer day
2017-10-18,5,best falafel ever place listed book called 1000 place visit die staff cool place clean blackberry juice bomb
2017-10-14,1,n't think possible place get worse somehow managed addition poor quality food added feature getting order wrong often given place many chance done
2017-10-09,5,nice spot really enjoyed chicken kebab platter chicken soft juicy falafel ball amazing well could tell authentically made back try item menu
2017-09-29,2,place used great far cry city version first open hoboken original crew great service quality slipped new staff brought eaten location probably 40 time writing painful
2017-09-21,4,five star place since came area exact replication least term food flagship nyc hummus baba falafel protein always great recommend shawarma far away chicken considerable second kafta passable usually little tough best part open well past closing bar weekend great ethnic option besides spa diner meh pizza late night docked star seem changed management everything seems little exact streamlined corporate way portion bit smaller every employee used know knew name vanished food still good seems slightly take grain salt likely wo n't intimate local connection place
2017-09-20,4,get shawarma babaganoush hummus salad knafe girl counter told chicken fave think lamb choice way go hairy little dessert knafe kuh-naf-ee voted unanimously baklava
2017-09-17,1,lost customer changing place deliver n't understand 3 year delivering zephyr loft observer choose continue oh well lebanese mediterranean food order loss
2017-09-15,4,tried falafel sandwich chicken kebab sandwich sandwich reasonably priced 3 50 falafel 6 50 chicken kebab note sandwich small sandwich came lettuce onion tomato tahini sauce pita pocket ask hot sauce add kick sandwich falafel chicken kebab tasty good flavor wish meat falafel sandwich back try plate week day night still decent amount people eating lot people waiting take outdoor seating make great option cheap casual dinner summer
2017-09-08,5,fala-fill belly goodness well got shawarma n't many good joke went shawarma sandwich opposed plate mostly sandwich 6 75 plate 12 sure plate could n't justify price shawarma come lettuce onion tomato sauce meat added feta life present option add feta add feta super tasty deceptively filling sandwich highly recommend p longer spinach pie care menu pps think open late night lived hoboken somewhere casual drink take clothes soil carpet drunk would come pop falafel ball mouth like kid bozo show throwing ball bucket
2017-09-07,5,shawarma sandwich amazing thing tried good ordered another one lmao also tried specialty blackberry juice good
2017-08-30,5,best falafel place love falafel babaganoush also must try knafe bacalava delicious n't forget order lemonade along food
2017-08-20,5,regular love every single item menu favorite platter lamb hummus babaganoush rice pickle place open late awesome healthier option eating late love place
2017-08-20,1,saw rat worker n't care address fact saw rat saw one rat second rat told worker worker told mistaken saw two rat love food fact rat exist restaurant make think twice eating
2017-08-19,2,well going place since opened hoboken went evening n't busy 1130pm food however n't great lot time n't location 3yrs firstly lady register n't seem happy working evening reana ordered veggie combo falafel baba hummus go got home n't far restaurant n't see notice baba believe falafel inside told past expect 4 50 sandwich 11pm restaurant catering drinking drunk crowd n't care quality food looking food soak alcohol certainly understand statement falafel sandwich basic street food middle east served perfection time day nite certainly miss experience broccoli falafel part sandwich never 30+yrs eating sandwich overall sandwich basic falafel sandwich make home salad far superior next time get late nite craving falafel sandwich take path taim west village israeli place always consisted day nite
2017-08-17,5,mamoun never fails service good every time come taste better recommend place everyone enjoys good bite
2017-08-12,5,nice small place affordable fast service good seating outside love place specially try desert 2 n't anything breakfast rather good verity lunch dinner love
2017-08-09,5,best shawarma falafel parking issue well worth hassle
2017-08-07,4,parent love place every time go hoboken eat every time go ask bring back falafel ball nice crispy outside even love hot sauce super tangy strong need couple drop would n't eat food sometimes get baklava also bomb
2017-08-02,5,best hummus easily greatest stop hoboken fast delicious food mango juice falafel sandwich make heart sing baklava mana heaven late night town forget greasy slice head 5th washington
2017-07-26,4,need quick meal go takeout eat restaurant gotten delivery time food n't warm time get year tried classic falafel sandwich last year tried lamb shwarma fell love big spicy filling tasty also get side grape leaf baba ganoush hoboken location lot bigger location city ample seating pretty crowded even late night price good taste delicious definitely fan
2017-07-20,4,many time kebab falalfal baklava great enough seating compared manhatten one serveice quite good location perfect hoboken
2017-07-18,4,like falafel sandwich decent enough satisfy craving hunger think place falafel sandwich stand way taste 3 50 good deal n't tried item overall inside restaurant clean look nice
2017-07-17,5,visiting town really wanted mediterranean food came recommendation within walking distance n't disappointed got sharwarma plate three side recommend getting sandwich asking side put individual container possible say time walked back hotel side mixed together bit messy n't realize n't separate container ate falafel tabbouleh hummus portion really generous blackberry juice delicious wish would ordered larger size spicy sauce great offered kick like n't heavy handed definitely give try
2017-07-14,1,disappointed visit today got baklava go par tasted oil messed distinct smell oil reused messed throat mamoun go place falafeland baklava wud occasionally drive hoboken eat staying away
2017-07-14,1,give zero star disgusting baklava use like mamouns food quality haa gone really bad picked baklsva location smelled old oil loaded syrup irritated throat real bad caused major irritation oil used old totally disgustung taste god know use mamouns please avoid health reason
2017-07-09,5,stopped lunch kid 6 year old could n't get enough chicken kebob schawarma die would time lived closer
2017-07-09,4,love falafel sandwich get tabouleh would say meat kebab average bad get tamarind juice delicious overall reasonably priced perfect spot late-night food
2017-06-19,1,went yesterday afternoon cashier glass really unfriendly cold attitude towards u know wrong looked like want help u order food food place salty healthy option
2017-06-15,2,n't bother placing order online wo n't make get friendly girl counter least
2017-06-10,5,excited moving back nyc area discover mamoun hoboken go spot ordering take always stock hummus hot sauce amazing watch sneak
2017-06-04,5,grew eating mamouns macdougle street excited see second location open hoboken think falafel joint hoboken jersey city mamouns tastiest moist falafel hand price also better competition menu meat kebob sandwich platter option different side chose hot sauce best
2017-06-03,5,hello known fact mamoun absolute best falafel mediterranean style platter everything sooo good fresh price great service quick place open really late whatever time munchies invade trip mamouns always smart option please try mint lemonade falafel pita lamb shawarma veggie meat platter pastry also delicious
2017-06-01,5,honestly hardest part moving hoboken able weekly mamouns falafel actually perfect ever done delivery fact could withstand decent car ride impressive amazing hangover meal still good hour day live hoboken n't eat mamouns reconsider life approach clearly wrong
2017-05-28,3,goto place nighters nyu library certainly n't serve best falafel town good enough price cheaper side
2017-05-26,3,excited try place due great review n't blown away though service quick despite fact backed got meat plate chicken 15 dollar joke 4 cube chicken ton rice salad disappointed amount meat plate especially price piece chicken tasted must say well seasoned tender mint lemonade really good though
2017-05-19,4,great value quick bite quick always consistent service outdoor seating come handy
2017-05-18,5,always wanted try finally delish cashier server nice accomodate new face gave time answer lot question food
2017-05-17,3,food good used service counter nothing buff show kinda guy ordered pick arrived 10 minute wait another 15 min chix plate sandwich hubby like hot sauce overly dry meat otherwise would def back
2017-05-15,2,beware mamoun conducted nearly fraudulent charge credit card snuck new delivery fee without telling also put tip card without knowledge always tip delivery person 3 5 surprised would stoop deceptive tactic extract money combine food poisoning heard recently likely handing crook money longer food great time even though portion tiny worth enabling sort mistake
2017-05-12,4,place n't disappoint original location manhattan touch doubt proven completely wrong good one village delicious falafel shawarma seasoned right craving middle eastern food place never fails please keep great work
2017-04-20,5,hot sauce insanely hot warnedfood awesome service good definitely love place
2017-04-17,5,veggie wrap 3 50 meat wrap 6 meat wrap small worth buck go veggie wrap make sure ask hot sauce reasonably priced baklava
2017-04-16,4,come twice falafel sandwich mint lemonade veggie combo baba ganoush falafel hummus salad pita bread reasonably priced tasty would love visit
2017-04-15,4,good falafel store good amount seating located middle town washington st bit walk hoboken terminal well worth time falafel sandwich pretty reasonably priced 3 50 falafel sandwich pretty good size filled veggie falafel pita packed also tried seasoned rice mint lemonade go well falafel sandwich place relatively clean spacious usually seating available n't enough turnover place 5 minute seat open wait order come pretty quick takeout breeze get pretty packed sometimes line move pretty quickly
2017-04-14,3,one perfect place eat college student like late hour expensive good range option combination really enjoy food even know n't taste authentic perfect someone whose taste bud unfortunately americanized guess one main con would portion order extra whatever getting never fill e extra falafel veggie platter three little ball falafel going fill big girl like baklava satisfactory would recommend unless know bakery specializes
2017-04-08,1,awful way overpriced salty tasteless food food flavor falafel hard inside price three time higher skip
2017-03-29,4,food definitely one top mediterranean area ambience need improvement gone cold night heater work happened multiple time need able provide basic temperature control
2017-03-28,5,mammoun making falafel great shawarma also hot sauce hell
2017-03-27,3,food good complain anything eaten however whenever walk place smell overbearing awful ca n't seem get eat
2017-03-22,1,used mamouns fan ordering twice almost every week past month something 100 changed quality chicken terrible barely seasoned additionally become extremely cheap giving 2 piece pita 45 00 order includes large order hummus 2 platter disappointed place going hill eventually rest hoboken catch go somewhere else rip mamouns hoboken good lasted
2017-03-21,4,love place frat falafel shawarma eating downtown location since 93 still good food
2017-03-21,4,probably one better shawarma place around nice staff awesome hot sauce parking bitch overall great place tasty food n't tried hoboken go especially fun night
2017-03-21,5,waiting 30 minute one falafel sandwich preparing delivery horrible service edited review manager contacted made sure try fix issue really appreciate feedback food great
2017-03-18,5,love place came 3am long line food worth wait excellent falafel also shawerma tasty hot sauce fire use little bit cheap convenient delicious got ta try r area open real late reason try infamous food joint
2017-03-15,4,mamoun go spot hungry n't know eat late never go wrong shawarma sandwich mango juice make sure get extra meat going left bottom sandwich salad said person enjoys shawarma sandwich side salad basically best worldsalso one reason love coming old school arabic music play
2017-03-11,2,sure happened place everything gone downhill drove way belleville get fix boy disaster ordered lamb shawarma chicken kebob combo plate rice salad asked salad could put side sometimes lettuce get soggy ride home cashier quickly shut told could n't done get home begin eat everything tasted like rewarmed night chicken dry hell rice mushy lamb heavily salted pickle odd taste thing saved day mint lemonade gone day got whole bag pita surplus food sure happening need fix issue quickly may give another try couple month definitely going search alternative
2017-03-06,5,good food price place falafel okay stuff pretty delicious big portion order plate
2017-02-28,5,lamb perfect cash though loved smell second went inside smell like true middle eastern restaurant
2017-02-28,5,holy cow definition fast casual eating place immaculate always clean every time time food cooked order faster fast food chain plus hot sauce die intensity definitely accompanied great flavor spicy
2017-02-26,4,delicious food new go hoboken free delivery kind slow service worth wait reason taking away star salty everything make sure hydrate well
2017-02-23,3,love food customer today ordered falafel sandwhich chicken skewer amazement chicken look like took 2 cube chicken cut 3 shocked say something thought mistake like 5 buck guy counter like yes said impossible wasnt enuff 2 year old manager came told made mistake preparing chicken night guy register clearly moron didnt care help cause clearly mistake gave another order
2017-02-22,5,came maamouns good friend ramsey love maamouns dont really enjoy hoboken crowd lack parking area however friend n't seem open eating anywhere else lucky found parking right front otherwise would left went home joke aside love maamouns visit frequently chicken kebob sandwhich normally get would recommend appetite one sandwhich might enough suggest two platter another must blackberry juice use wash distaste hoboken go service fast without impact quality worker always quite pleasant seating tough busy time outdoor seating accommodate mood good arabic food endure pretentious hoboken atmosphere short make way maamouns
2017-02-16,5,go mamoun often cheap falafel sandwich recent experience ordering delivery food came fresh delicious delivery quick overall great experience every time reasonably priced
2017-02-14,1,lamb patty really dry disgusting food cold delivery took forever maybe place better person least food would warm really disappointed waited well 1 5 hour something n't even taste good food wrapped foil could n't microwave work cafeteria already closed complete failure
2017-02-12,5,delicious good quality fast delivery ordered mamouns four time flavor quality consistently great love veggie option
2017-02-09,5,received delivery time weather got lucky within delivery zone barely made hummus die almost ate tupperware blend olive oil right amount paprika amazing lamb shawarma chicken kebab sandwich right portion superb flavor specially chicken baklava super delicious thanks guy highly recommended
2017-02-08,2,n't impressed big fan mediterranean food really n't like place one favorite side baba ghanouj eggplant dip tasted mixed w mayonnaise completely n't taste shawarma tabouli ok greatest falafel n't like
