date,rating,review
2020-08-01,1,getting really annoyed irresponsible business pandemic place one none employee wearing mask properly wearing done customer business like
2020-07-31,1,waited 90 minute delivery course order came incorrect tried call 15 time phone busy never ordering especially time like ordering takeout luxury
2020-07-30,1,3 strike decent bagel done w place1 skimp egg breakfast sandwich pay extra get 2 eggs2 wo n't take phone order online ordering super glitchy c'mon phone order point covid 3 gave another shot today forgot bacon bacon egg cheese super bummer
2020-07-28,3,friend visiting town really wanted get sandwich o'bagel seeing photo instagram covid way order online via chownow unfortunately page n't flexible site advises anything put special instruction field ignored wanted add avocado one sandwich however n't listed substitution addition check way request ask bagel toasted also way request gluten free ordered ridge diablo jalapeno popper whole wheat bagel pick-up placed order 90 minute advance pick-up time food ready arrived wait based several yelp review expecting order may wrong everything right tasty liked ridge diablo pickled jalapeno nice kick wish toasted wrapped tin foil stay warm probably place going order often 8 breakfast bagel sandwich pricey however could nice treat night
2020-07-25,2,experience o'bagel recent month completely put involving online ordering healthcare worker work rotating weekend attempt treat saturday shift come around o'bagel hour listed open 6 tried several time call place pickup order saturday morning told employee answer would need place order online unable take phone order due schedule car way 7 unfortunately despite open 6am unable place online order would ready prior 7:30 one thing open getting ready day find incredibly misleading hour posted opening 6 employee answer phone tell 6:45 order need online n't begin 7:30 unfortunately rating based solely customer service still n't able try breakfast sandwich heard many great thing due restriction surrounding ordering
2020-07-24,3,food good say 7 10 time delivery order incorrect always willing refund fix waiting two hour eat bagel sandwich
2020-07-21,5,hoboken best bagel n't say lightly breakfast sandwich great time
2020-07-15,2,hearing o'bagel decided give try busy saturday afternoon due pandemic must place order online talking walk order ordering estimated pickup time 25 minute long bagel regardless busy approached employee front let know wanted bagel toasted denies tell toaster currently working bagel warm bagel shop toasted bagel common request corrected bagel ordered everything bagel cream cheese egg everything bagel extremely salty sure extra salt thrown top normal returning spot hype
2020-06-29,4,know exactly want bagel little crack outside fluffiness glutton inside think lot bad bagel exactly like bagel hoboken legit n't like getting sandwich much tend overpriced good wish taylor ham egg cheese bagel sandwich egg personal preference pet peeve cheese melted inside overall good bagel
2020-06-20,5,plain bagel everything bagel go good also bought scallion cream cheese go amazing good service
2020-06-20,2,pre-covid girlfriend would order every two week went online stopped taking order phone o'bagel customer service plummeted gotten order wrong past double charged two bagel asked n't get 4 bagel last straw showed manager bag 2 bagel whole ordeal took 20 minute obtain refund done place longer return establishment bagel buyer beware
2020-06-08,4,amazing spot bagel breakfast sandwich definitely one top spot hoboken whether looking plain bagel breakfast sandwich tried ridge diablo sinatra breakfast sandwich really good ridge diablo meaty sandwich good like breakfast meat put lot pickled jalapenos may need take couple sinatra got whole bunch flavor tuscan spread add really good
2020-06-02,4,simple effective egg cheese everything bagel proper amount egg cheese bagel above-average wished plump-er almost done started staff helpful pleasant social distance pickup process leaf something desired might still working thing almost like grab-bag table near window ordering process smooth ready prior estimated time solid choice looking bagel spot hoboken
2020-05-03,5,o'bagel one best home quarantine kit boyfriend wonderful time making bagel home step easy follow family loved mom requested became bagel making pro thanks o'bagel highly recommend snagging kit safe pick delicious
2020-04-24,2,bagel good n't even going post heard guy brag bagel better bagel shop manhattan hoboken girl podcast could n't handle point creative sandwich suppose good bagel
2020-03-29,4,decided try place finding owned owner loquito heard specialty bagel really good tried sinatra bagel breakfast sausage medium egg arugula red onion tuscan cream cheese bagel massive n't expect stay inside flavor really good though especially cream cheese however got order wrong reading thing review well overall still happy first experience o'bagel
2020-03-28,5,tried o'bagel first time today truly floored egg ceptional menu one history book intrinsically creative thoughtfully curated plan visit location much schedule shall permit ordered two gringo burrito one friend earnestly wanted head back another shortly consuming lol staff amazing initial phone order person hand-off since to-go order hand best bagel shop hudson county quite possibly every county
2020-03-28,1,messed delivery order phone hook ca n't even call ask correction refund
2020-03-14,5,best bagel store hoboken hand fast service incredible specialty sandwich world customer service line move quick sandwich come flash
2020-03-09,5,line long quick coffee n't worth joe peach tea good sinatra bagel delicious friend burrito brisket super tender hmm handful seat near window aspect get bumped line order line pick tight fit
2020-03-01,5,best bagel hoboken best bagel ever ridge diablo fire
2020-02-27,5,egg-ceptional menu heart n't gift pun actually called o'bagel usually packed great indicator good bagel actually next morning night hoboken group craving messy breakfast sandwich wanted delivered close couch sharing possible ordered website time chowing usually want bacon egg cheese bec sudden always called checking egg-ceptional menu found sinatra good pas straight menu description guy breakfast sausage medium egg topped dressed arugula wilted red onion smear homemade tuscan spread 8 25 got mine everything bagel loved bite tuscan spread like cream cheese came pretty heavy dose loved n't want ton shmeer ask lite take favorite spot town want good ol bec make place sandwich little frill looking new bagel spot hoboken o'bagel wo n't disappoint
2020-02-23,1,ordered bacon egg white cheese legit got cheese barely egg load bacon bagel good unfortunately always get order wrong n't first time happened ever get something get bagel butter cream cheese ca n't fu k right mean wth going pay 10 bread sprinkle egg white go somewhere else
2020-02-22,2,place could ever get order right could confidently proclaim best bagel shop hoboken literally 50 50 chance folk screwing order family visiting put order 6 different bagel sandwich forgot put 2 sandwich bag straight forgot four two wrong norm whenever go open everything leave really really poor service
2020-02-02,1,average bagel poor service conveniently located keep coming back due location count order wrong 40 time cream cheese fantastic ca n't go wrong bagel cream cheese anything grill shot dark consistency update gotten worse time need pay attention line order
2020-01-27,4,kind pricey bad place pick breakfast usually order bacon egg cheese whole wheat bagel usually cost 5-6 really n't much different going standard deli maybe tr thing next time
2020-01-27,5,o'bagelo g dwhat underrated spot shocked see average star rating yelp little hidden gem shocked even amount time went checked single time show excited presence magical bagel expert every time gone always buffalo chicken bagel spectacular picky come texture flavor sandwich seems mastered task im fan spice masochism side come every kick buffalo cooling cole slaw created perfect balance cause gastric content slowly creep esophagus far bagel always got everything bagel taste fresh fluffy usually bagel lightly toasted put together ever sandwich ordered recommend ordering online maybe going rush due high volume customer line sometimes go door
2020-01-23,4,potential 5 star need sort kink typically large wait time delivery sometimes get order wrong otherwise favorite bagel place hoboken bagel egg cheese whole wheat everything yes please
2020-01-21,3,gooood better bagel hoboken definitely overrated dont order seamless pretty much run everything weekend youll wind getting random bagel didnt order
2020-01-16,3,hoboken classic unfortunately get order wrong lot understand always morning rush especially weekend need hangover bagel sooo annoying wait open bagel get home see wrong happened
2020-01-12,5,one place outside hometown bagel shop would endorse bagel legit chewy inside crunchy perfect bagel texture taste good coffee place always packed come prepared mindset line
2020-01-04,4,frequent customer o'bagel 2 year one favorite breakfast spot town term actual bagel 1 2 hoboken staff awesome store always buzzing weekend got system pat balance busy service admittedly silly criticism always notice always bother get lunch sandwich lettuce dark romaine lettuce opposed iceberg lettuce example cant explain drive crazy anyway bunch beautifully aesthetic pic many visit obagel
2019-12-30,3,got watchung warrior onion bagel overall bagel tasted yummy portion little skimpy price also yelp free small coffee deal accepted bummer
2019-12-16,4,favorite bagel spot hoboken bagel always fluffy huge never go wrong breakfast
2019-12-16,5,boy o'bagel pennsylvania native sucker quality new jersey bagel chose o'bagel disappoint tried ridge diablo onion hit every spot spicy fresh seasoned meaty love place everyone find something suit walk away happy place sandwich big unique delicious complaint might fault ordering via grub hub could choose specialty bagel offering side
2019-12-15,5,found bagel place right corner air bnb decided stop quick breakfast glad many delicious option hard pick decided go skinny girl bagel egg white spinach avocado turkey delicious got wheat everything bagel great combination friend got lox bagel buffalo chicken delicious looking yummy quick breakfast hoboken place go
2019-12-13,5,o'bagel know make great new jersey bagel got classic plain bagel run 1 fresh got lightly crispy thin crust fluffy soft interior great color shine experiment firehog cream cheese cheddar cheese jalapeno mixed beet cured hummus granny smith fennel red cabbage slaw know creative eye behind menu n't breakfast try lunch grub o'bagel open till 3pm pop one delicious lunch bagel combo personal favorite jim halpert homemade tuna salad swiss cheese balsamic dressed arugula red onion n't meat eater pescatarian try aforementioned jim halpert promise run mill tuna fish vegetarian gt creative breakfast bagel consider adding crispy hashbrowns avocado veggie spinach arugula topping like red onion jalapeno vegan yet add tofu cream cheese menu surprising since half block hoboken hot bagel order delicious beirut sandwich composed homemade beet cured humus topped oven roasted vegetable charred carrot fresh parsley beware popularity come early sell item quickly n't always avocado though keep heap storage n't serve unless ripe line run door weekend request love see meat substitute menu talking seitan tempeh impossible meat morning star sausage patty bring non-processed option consider slab cauliflower steak coconut bacon tofu make inclusive menu expand customer base
2019-12-08,4,delicious bagel quick line n't huge fan coffee lid kept coming cup
2019-12-02,1,place worst people n't take accurate order make accurate order care bit pointed gone 4 time give try sucked similar way time
2019-12-01,3,bagel good ordered lox spread w caper onion lox cream cheese one tiny piece lox love put suck grew going bagel hometown never disappoint give love bagel price dam thing know expect
2019-11-18,5,n't buy negative review place amazing think honestly negative review people looking something negative say place delicious friendly staff every time visited great experience
2019-10-26,1,cmon o'bagel expecting way nj bagel place barely one slice ham cheese sandwich cost 8 38 disappointed
2019-10-25,5,wowowow love place also want preface west-coaster first bagel place tried area walked night went closed looked like quaint little bagel shop went morning found fully packed line way door n't realize popular place must sign pretty good line long move pretty quickly ordered lox loaded go big go home amirite got everything bagel wow loved bagel could n't eaten plain still enjoyed everything bagel added delicious bonus absolutely full eating highly recommend
2019-10-14,5,ordered delivery today delivery arrived quicker expected everything packed neatly arrived hot ordered gringo burrito watchung warrior pastrami melted swiss scrambled egg honey dijon asked note could please get white wrap also like gringo delivered wrap awesome burrito delicious love crunch hash brown gringo flavor watchung recommend flavorful
2019-10-13,4,best bagel place fresh soft chewy favorite open early people like ca n't sleep staff friendly happy help
2019-10-06,5,bagel best hoboken hand ridge diablo amazing enough spice also pork roll egg cheese another great simple sandwich jersey classic course
2019-10-03,4,one best part visiting nyc bagel pizza let focus bagel friend placed order online delivery took hour well worth wait o'bagel menu creative twist consists ton specialty sandwich multiple flavor cream cheese bagel inferior ordinary plain bagel fresh thick still fluffy consistency super generous spread ingredient result huge sandwich highly recommend staying hoboken need filling hangover cure
2019-09-25,3,ordered breakfast pick-up since place seemed best review bagel spot hoboken jalapeno popper crispy bacon egg melted cheddar cheese topped smear firehog cream cheese bagel bread choice asked scoop bagel even could finish half pretty heavy oily probably would n't order one bagel alright nothing amazing nothing could ever beat ny bagel bf gringo burrito sofritto braised short rib fire roasted ranchero pepper homemade salsa medium egg crispy hashbrowns topped tequila pickled onion jalapenos wrapped warm tortilla also oily expected pretty good overall n't even normally liked braised short rib maybe hash brown made next time want try chicken salad sammie breaded chicken ricotta
2019-09-19,3,food great pretty angry put order almost 30 minute pickup arrived started working nice shiny parking ticket go breakfast two second turned 10 minute
2019-09-12,4,love carbs motto o'bagel would n't say love carbs love good bagel o'bagel happens good enough argue best hoboken others either charge much simpleton food flat fail making said o'bagel best ever close lot appreciated earth experience ordering competently done bagel service always fair efficient never rude feigning sweetness decor quite accurately sum service spartan utilitarian poor ventilation boot signal draw pretense instead simple namesake frill atmosphere eventually amount bagel delivered mouth arrives expect regional basic plain everything salt poppy garlic whole wheat paired cream cheese taylor ham egg lox expect light cream cheese tofu spread modern foo foo may call basic call o'bagel basic call bagel basic enjoy way
2019-08-25,1,underserved every order rude ask basic question bagel highly recommend investing business store option would n't give absolute disgrace
2019-08-19,4,cheap done well issue place tiny long line hey hoboken
2019-08-19,4,came small bagel joint visiting hoboken disappoint super tight would n't suggest eating
2019-08-17,2,wow ripoff pretty hyped waiting line saturday morning found sorely disappointed lox bagel 5 chicken salad bagel 7 found fact since menu price listed guess place charge whatever want cashier rushed u order could choose something else bagel okay great compared bagel shop area
2019-08-14,4,okay updating review made change menu remodeled stopped wednesday morning break grad school selection n't bad variety bagel different flavor cream cheese choose ordered whole wheat bagel fire hog cream cheese fire hog mix jalapeno cheddar cheese n't worry sound weird actually really good super spicy bagel good found sometimes service rushed find sometimes bagel n't toasted way ask toasted however place usually busy extremely packed weekend understand might rush busy space tiny line usually door weekend place sit since recently remodeled counter seating allows indoor seating still pretty crowded outdoor seating nice summer personally fan egg sandwich rather eat mine bread rather bagel find flavorful personal preference coffee pretty good sometimes fill much little room milk service friendly fast overall good place quick bagel best ever
2019-08-11,5,best bagel hoboken far long line weekend worth wait thing n't like jalapeno cheddar cream cheese bland would n't recommend trying flavor otherwise amazing
2019-08-04,4,place one best bagel shop hoboken food delicious would highly recommend issue coffee got iced coffee tasted like tequila hey usually pay extra amiright people snare drum crash n't gut get coffee experience aside food make one bad encounter
2019-07-28,5,awesome bagel sandwich would definitely come back long line great service keep line moving
2019-07-18,1,liked place first opened however gone downhill ever since decided give one last chance today wish n't got home find bacon bacon egg cheese forget put bacon bec bacon name sandwich n't first time something like happened either n't annoyed laughing level incompetence also one egg one piece cheese put basically like eating bread sandwich complete waste eating bagel mention staff give idgaf vibe represented sandwich making thanks jps going forward
2019-07-18,2,10 time bagel great however get egg sandwich 75 chance get order wrong bacon egg cheese bacon try asking ham egg cheese bagel one work heard regular deli ham taylor ham sandwich one slice meat jp bagel hudson street pile meat high often skimp cream cheese filling bagel french toast bagel amazing however seen available twice since first bagel run keep giving place try bagel great one want come home see one egg one slice cheese c bagel
2019-07-14,4,bagel fantastic tell many time get home wrong order seems like get little careless sat sunday rush wo n't stop going definitely check bag leave
2019-07-11,4,much competition bagel know chime nj bagel war pizza war think pizza popular bagel n't far behind o'bagel newer place town located block hoboken hot bagel bagel hudson forever here went o'bagel first come hot open kitchen order near back sit heat summer definitely break sweat ordering usual suspect either didnt roast beef swear sandwich menu guess came primetime hour saturday bueno ordered couple egg sandwich good bagel n't pop n't star sandwich like place n't bad great prefer bagel chewier side rather crunchy idk either good spot area come check definitely prefer bagel hudson ordering bagel would come hoboken hot bagel though
2019-07-08,3,bagel really good upwards 9 think 2 slice meat sandwich disappointing food nice atmosphere though
2019-07-01,1,used regularly visit stopped bad experience last year seems n't learn lesson stood counter least 5 minute ask served ordered thec watchung warrior sandwich missing egg complicated make bagel sandwich never go clearly n't care business operates looking exploit local foot traffic crap service
2019-06-29,4,gon na get crazy say favorite bagel hoboken ton speciality bagel sandwich awesome bagel crispy outside warm doughy outside forget everything exactly way everything bagel favorite riverwalk scaly really great sandwich combo thing never think put together trust know usually pretty long line door typically go fairly quick definitely worth wait seen people walk away line fact there much room sit wait inside n't let deter worth bagel sandwich little pricey n't also get classic butter cream cheesed bagel sure wo n't disappointed
2019-06-24,5,best bagel entire world biased bc grew bagel basking ridge honestly friend totally agree ca n't get better 100 recommend whole wheat everythings french toast bagel ridge diablo creation miracle bagel coffee good excited owner new taco store open best cook
2019-06-08,4,o'bagel known best bagel spot hoboken would totally agree bagel always good size average circumference big small really like bagel much rise give bagel fluffy texture absolutely love opinion bagel great best bagel ever reason 4 star rating today boyfriend got ricotta sandwich lunch saw day ago instagram said delicious look criticism would bit messy hard eat overall o'bagel consistent always go mood hungover breakfast sandwhich
2019-06-08,4,came friend live around corner come often saturday morning line actually n't bad definitely hot shop order wait outside call name got cinnamon raisin bagel plain cream cheese perfect amount cream cheese bagel check also took advantage yelp deal get free small hot coffee friend ordered breakfast sandwich avocado loved mix one friend bagel instead whole wheat everything bagel regular everything bagel overall huge deal next time area definitely would come back maybe try one speciality bagel sandwich
2019-06-04,5,beyond hot inside shop o'bagel best bagel shop hoboken hash brown bagel sandwich wonderful line long order order come quickly
2019-06-03,5,fantastic filling delicious friendly place visiting son hoboken recommended place
2019-06-01,2,iced coffee nice earned two star let talk bagel ordered egg cheese avocado tomato everything bagel hard forgot avocado remembered charge bagel black russian lox spread lox spread really good need see doctor check jaw trying break bagel total price 19
2019-05-31,3,bacon egg cheese came barely egg staff slow lazy also menu store online lower price charge register need remember stop coming second time disappointed
2019-05-22,4,really busy place order ahead pick highly recommend ridge diablo bagel sandwich delicious spicy add hash brown make even delicious
2019-05-12,1,ordered ricotta love bagel sandwich looking forward waited long line came home noticed forgot put vodka sauce n't want go way back rain tell forgot sauce disappointed 9 50 least get right
2019-04-27,2,regular warren long hill location excited try hoboken one recently moving sadly disappointed bagel served without hash brown paid without salt pepper ketchup requested service relatively quick cordial need better crowd control let jamoke stand walking lane thumb butt overall good bagel make sure correct bagel bag rub patron way
2019-04-26,1,ughhh sad writing review o'bagel go-to bagel spot long time despite issue 2 year ago resolved remained customer issue person took order rang transaction handled cash n't change glove touching money proceeded make bagel glove posted negative review owner reached via yelp apologized rookie mistake assured held meeting staff issue also offered free breakfast sandwich eye issue resolved happy remain customer bagel awesome however 2 year later exact issue today tall younger guy took order today rang register glove left hand proceeded dig quarter hand change using glove watched went straight bagel dug find good one using left gloved hand guess said something place packed honestly n't act quick enough completely grossed took bagel left course n't eat wo n't go back even mistake one person head n't watch every single time someone make food n't get wear glove going touch money touch food frustrating find new bagel place point
2019-04-21,1,visited o'bagel today get bagel coffee yelp app free small coffee purchase offer posted o'bagel however asked cashier hesitant honor offer informed check someone back store speaking person came back told gave random bullshit excuse offer online order yelp order showed yelp app offer detail clearly stated get free coffee purchase however acted like n't know going n't want make big deal took everything bagel walked away bagel felt little bit salty side sure bagel tuscan mediterranean spread shame business advertises offer yelp employee clueless willing honor
2019-04-16,1,ordered grubhub excited try first time 26 minute late missing hash brown side old cold baconegg cheese greatttttt
2019-04-14,5,steve sister amazing job obagel amazing tasty bagel bagel bagle go obagle promice return
2019-04-06,5,solid bagel fresh crispy doughy lox good also outdoor seating eat
2019-03-29,2,went first time today ordered onion bagel beet hummus topping u customer waiting bagel freaked large mouse walked across wooden food prep table like owned place despite super crowded loud 9am told cashier n't seem super concerned perhaps n't want bother 5 employee try figure mouse came prob 5 minute wait bagel 1 minute line crust excellent spread 1 2 cm thick far cry fat-stacked bagel picture like beet-flavored bagel 5 sandwich thought get think could use lemon vinegar something hummus robs beet flavor afraid wo n't back n't get premium experience food hoping
2019-03-26,5,definitely one best place get bagel hoboken area bagel soft fresh highlight o'bagel creative bagel choice favorite includes ridge diablo jalapeno popper seriously addicting danger diet worth extra calorie
2019-03-24,5,stop breakfast disappointed ordered jalapeno popper everything bagel every bite tasteful definitely coming back
2019-03-18,1,quality food customer service joke picture speaks ordered bagel cream cheese recent review show alone jp gained lifetime loyal customer never issue except wait worth
2019-03-17,1,place keep getting worse horrible customer service continuously lowering quality food ordered taylor ham egg cheese realized got home taylor ham also check skimpy 6 bagel
2019-03-08,3,crime make lox sandwich one thinly slice lox customer pay 11 25 sandwich
