date,rating,review
2019-02-26,4,quest find best potato egg cheese new jersey stopping o'bagel brainer famous giant bagel sandwich serf whole party little disappointed content sandwich ratio bagel cheese-potato-egg bit bagel make though bagel bomb perfect bready crispy bagelly combo also hash brown potato option added nice crunch sandwich sucker seasoned tater overall pretty good sandwich wish bit bagel
2019-02-25,5,bagel always fresh service friendly quick best bagel hoboken far
2019-02-19,5,opinion o'bagel best bagel hoboken bagel shop eat bagel fresh fluffy toasted well bec avo personal fave location small super cute
2019-02-18,4,great customer service delicious specialty bagel get crowded lunchtime rush got daily o'special castro ham melted swiss braised pork shoulder jalapeno pickled onion mojito salsa super tasty bagel sandwich unfortunately order got lost mix wait pretty long also gave wrong bagel type n't toast requested initially n't impressed service nice apologized wait let grab free drink way long time since experienced customer service good great place great food nice people back real soon also get 10 first order check yelp
2019-02-09,5,hard find good bagel jersey city hoboken place best one bagel nice crispy outside soft inside highly recommend cold brew one special sandwich staff super friendly available seamless consistently satisfied
2019-02-07,5,ridge diablo could considered new jersey go-to bagel sandwich ham bacon cheese egg choice bagel simply delicious make sure add hash brown thought also pro tip ordering online typically say 1 hour go minute otherwise run risk bagel sitting around
2019-01-30,4,go-to bagel shop mainly living around corner also thoroughly enjoy bagel fiend numerous different bagel sandwich worth trying bagel ridge diablo probably favorite hash brown think something aioli jalapenos another favorite watchung warrior would never think put honey dijon dressing egg sandwich also told lox fresh great lox n loaded bagel always fresh decent amount spread option early enough smell bagel baked walk hot cold brew coffee tasty nice pairing breakfast downside breakfast sandwich little pricier line usually door order left line go hoboken hot bagel street n't worth wait
2019-01-25,2,third time asked bagel 2 fried egg every time egg super runny practically raw would want eat see pic sandwich total mess barely edible n't understand difficult make fried egg bagel breakfast shop also someone wrap breakfast sandwich like think ok bagel completely drenched soaking super runny practically raw egg understand thing happen consistent trend bagel third time aware presentation ensuring people n't going get salmonella eating food also time ordered sandwich shop also empty another reason confused presentation quality bagel bagel n't bad sandwich hot mess apparently asking something simple fried egg instead usual egg beater asking much
2019-01-20,2,ordered lox loaded cream cheese one piece salmon whole sandwich constructed like complete mess worth close 11 dollar charging
2019-01-06,3,delicious bagel although end running popular one noonish weekend bit overpriced nearly impossible find parking nearby
2018-12-30,4,expensive food really good customer service amazing even busiest time stay calm organized
2018-12-29,3,ok pretty cheap beetroot hummus beirut would still come back try stuff fresh bagel shelf look really good otherwise underwhelmed beirut supposed zaatar spice grilled zucchini e thyme sesame n't taste anything
2018-12-28,2,good bagel ordered dozen bagel weekend trip gave 9 bagel disappointed
2018-12-27,5,ca n't imagine better bagel anywhere best ever get early cinnamon raisin sold noon
2018-12-27,4,growing jersey inherently make bagel snob want good bagel come warm rip apart ease hard thing find o'bagel closest thin get bagel glory hoboken jc love specialty sandwich early bird go cold brew tap nice touch qualm layout n't exactly best waiting line waiting order much knock place packed business good reason
2018-12-22,5,reading 1-2 star review running bagel delivery time taking long put shoe walked 5 block try disappointed everything bagel crispy outside chewy inside counter worker polite despite long line found new bagel shop
2018-12-20,5,love best bagel hoboken line usually long worth wait recently cash girl counter allowed use credit card even though n't reach card limit kind considerate experience better coffee also good
2018-12-16,1,husband went pick bagel u order beirut vegan advertised bagel roasted vegetable attached photo photo website photo received bagel strip bland zucchini thin spread beet hummus top piece bacon supposed vegan bagel paid 9 bagel needle say beyond disappointed returning
2018-12-07,4,love o'bagel favorite specialty tried far scaly also enjoyed jim halpert also ordering jim halpert favorite bagel cinnamon raisin classic go-to recommend getting bagel toasted make sure n't forget ask wish little seating especially winter month outdoor seating n't option hoboken space limited
2018-12-03,4,best bagel ever living jersey place small get crowded quickly definitely worth wait favorite everything bagel egg cheese avocado absolutely amazing super filling ridge diablo another go would definitely go back try combination
2018-11-20,1,review two customer left hungry outside shop thanks lack knowledge food menu possibly great option vegetarian healthy crowd order taking personal n't know take whole wheat bagel available guess extra stock healthier option order talking person could find cheese ended bagel without cheese looking pastureized cheese worst joke vegan spread sandwich menu said ginna use twi bread move may may wrong asked clarification n't get meaningful answer ask order taking personal could n't explain result ended bread touch hummus promised chickpea grilled beet none sure miscommunication asked rep care vegetarian anyways cook meat veggie grill matter ended wasting 9 importantly missed chance something eat breakfast
2018-11-04,3,bagel toasted fantastic rest sadly great ordered poppy seed bagel toasted w butter cream cheese tomato cream cheese 0 flavor slightly filmy least cup tomato light pale pink also flavor butter maybe good thing like go back place always smell like burnt stuff though could cleaner many dude standing around behind counter ever helped friendly though guess step guy better quality product
2018-10-30,4,came back place gave second chance first experience really pleasant decided come back wooahhhh craving delicious fulfilling bagel exactly place delivered got ridge diablo omgsh filled sort flavor exploration love jalapenos bagel always remove jalepenos chipotle sauce delicious want something quick flavorful fulfilling bagel get also one popular one recommended really nice man taking order believe name johnny totally made morning bagel redeemed ourself johnny suggestion please please turn taco place night come back
2018-10-28,5,ate bagel morning one best bagel ever bagel sandwich called scaly 10 10 would recommend jammy egg super friendly staff eat want feel happiness form bagel
2018-10-27,1,ordered three bagel toasted everything butter toasted everything cream cheese whole wheat bagel egg bacon absolutely everything came wrong everything even called told look order come wrong every time past three weekend refused replace anything said busy toast bagel place awful bagel amazing staff accommodation far anything ever experience town town 30 plus year awful awful awful
2018-10-20,5,place serf best bagel hoboken baked premise served friendly staff specialty toasted sesame cream cheese caper remember every time walk door often order elaborate bagel special menu kombacha tap
2018-10-13,2,2 star bagel pretty good overall experience n't long slow-moving line order 10am somehow everything bagel iced coffee leaving saw bagel order incorrect missing item overall disappointing
2018-10-12,5,pop heard bagel know diablo legit know late night pop loquito taqueria genius every bagel spot need late night pop-up waste good real estate loquito feature simple concept taste menu taco pork chicken short rib veggie side like street corn waffle fry seasoned perfection churros sweet tooth oh left something cheeziedilla best menu item hard guess quesadilla taco n't assume taco bell knockoff dilla life topped charred corn elotes fressssshhh queso everything never knew wanted come chicken switch different protein personally love short rib would highly recommend taco dilla form waiting run n't walk really joking run something sol currently open 5pm think moving 9pm opening soon pajama 8 like probably get butt get taco order seamless either way eat taco
2018-10-08,3,gotten bagel never problem past ordered two bagel week ago gave plain bagel asked everything receipt reflected correct order cook screwed boyfriend order fine really big deal happens ordered two bagel specifically checked bagel still o'bagel saw poppy seed foil figured n't need inspect got home opened another plain bagel boyfriend bagel also stale hard rock almost inedible unfortunately torn since good experience o'bagel past would definitely recommend opening bagel leaving checking order correct definitely come back
2018-09-30,4,o'bagel hoboken carboholics come unite came around 11am saturday line door n't intimidated line actually move pretty quickly store le 10 minute storefront quite small limited seating indoors table outside enjoy coffee bagel bagel soft chewy fresh also appreciate wide variety bagel spread pricier bagel shop area personally find quality much better competition time taco pop shop share space o'bagel
2018-09-30,2,disappointing ordered egg bagel tuna charged 6 dollar crap tuna dry cheap hardly put anything
2018-09-29,2,disappointed bacon egg cheese sandwich barely egg bagel good really need improve portion considering high price
2018-09-28,3,taco night good tasting taco n't sour cream told authentic mexican n't sour cream mexico given sour cream
2018-09-28,2,n't close grill hour close ridiculous take 15 min clean cook rushed distracted counter gal correct twice ordered toasted bagel even warmed cook n't rush late ordersit cost customer quality suffers food n't prepared correctly young lady behind counter excellent offered fix food disappointed
2018-09-25,5,tried place wednesday morning got watchung warrior delicious regret n't add hash brown husband built sandwich consisted pretty much every meat offered except sausage egg pepper jack cheese chipotle aoli absolutely amazing aoli good definitely come back
2018-09-21,1,today 1 star review left wait salesperson discussed tattoo customer line please see line would act accordingly unusual hurry generally give place 5 star
2018-09-15,5,great food great service amazing staff pas least 5 time week amazing watchung warrior early bird taco night die new late night spot delivered front door step 30 minute keep
2018-09-12,5,o'bagel simply best stephen creative bagel perfection every time lox loaded old reliable go-to every time try something new super delish get packed weekend sure get early
2018-09-11,5,bagel best whenever go store everyone always super friendly helpful also joke chicken salad best ever tasted life favor order scooped everything bagel chicken salad lunch change life
2018-09-11,5,always looking solid breakfast sandwich shop wherever go o'bagel easily best north jersey offer crazy sandwich concoction really well anything pork product win solid pec even though call taylor ham forgive busy spot normal breakfast hour always go little past rush normally little line wait overall definitely great breakfast experience
2018-09-11,4,o'bagel one top place hoboken seriously delicious jersey bagel really nothing else like um huge fluffy solid crunch toasted love offer fun assorted sandwich choose addition standard breakfast sandwich cream cheese one favorite sandwich ridge diablo add hashbrown trust spicy meaty mess really perfect hangover cure also filling wo n't need eat long time
2018-09-10,4,many bagel store downtown hoboken one might think plethora choice really choice o'bagel midtown hoboken bagel always fresh popular run fast go nj classic taylor ham pork roll south jersey country folk egg cheese whole wheat everything special breakfast sandwich look die well think hashbrowns pastrami sort good stuff since live north west hoboken hope wish pray o'bagel continue great success open second hoboken location close trader joe although probably n't hurt walk 6 block street washington since original review coffee milk fridge self serve love addition someone heavy hand usually ended milk splash coffee regardless thinking next excuse get o'bagel
2018-09-09,1,ok bagel amazing add ons would even better actually ever got order right keep trying becasue friend swear place left walked home 8 block rain opened taylor ham egg cheese find hashbrown taylor ham bagel egg cheese ismt 1st time last time different order tomato onion missing also cooked egg sandwich would rather wait extra 5 minute get order right staff rushing everything getting home eat something n't want
2018-09-08,5,gringo burrito disappoint first time going staff friendly bit hurry food got quick gringo burrito truly amazing ca n't wait try stuff menu
2018-09-04,4,want something little different traditional east coast bagel smear suggest o'bagel bagel super fresh sandwich option topping seems endless jalapeno popper sandwich whilemy girlfriend jim halpert finished every last bite sandwich walked big smile across face
2018-08-31,1,honestly place good bagel issue coming every week quite time give right order le 50 time unfortunately essentially forced go due fact hoboken literally one else make half decent bagel
2018-08-27,5,favorite bagel hoboken made fresh never disappoint go bagel bring along visiting people state want nj bagel breakfast brunch spot o'bagels covered
2018-08-20,5,place wow probably best bagel place everything bagel taylor ham egg cheese soooo good line long go really fast
2018-08-18,4,finally made rainy saturday morning pretty busy around 11:30-12pm overwhelmed bit menu also get menu looking large chalk board something ordered breakfast sandwich mine egg cheese speciality sandwich ridge diablo spicy kick really good n't eat much rest day liked egg felt could bit cheesier also wanted bagel cinnamon raisin packed kinda basic may fault would return service good happy support local business
2018-08-13,5,o'bagel one favorite bagel spot area excellent representation jersey bagel offer wide variety bagel sandwich created flavor bagel sandwich loaded satisfying meal added hashbrowns bagel topping along meat egg cheese photo attached ton option try including variety cream cheese lox classic o'bagel open late outdoor seating available customer weather allows outdoor nice outdoor seating washington street view addition indoor table done collaboration create large pizza bagel seen instagram definitely want try soon look perfect party
2018-08-13,5,great bagel spot hoboken nj extremely impressed fresh ingredient perfect hand rolled bagel soft inside crunchy outside staff friendly extremely accommodating need customer perfect hangover cure sunday morning must try
2018-08-13,5,place staff courteous personable especially stephen patient friend new hoboken explained favorite went french toast bagel sweet nut spread friend got ridge diablo per stephen suggestion wow good best bagel ever
2018-08-12,5,another awesome bagel experience firehog cream cheese cheddar jalapeno delicious cheddar went well jalapenos big fan place
2018-08-11,1,dont order delivery obagel waited hour food tried calling 5 time kept ringing answer spoke seamless could n't reach well helped cancel order sure food delicious never know never ordering
2018-08-09,4,bacon egg cheese sandwich really solid bagel quality crunchy outside soft chewy inside worker pleasant good customer service price reasonable well run restaurant line get little crazy saturday sunday morning young people stevens student want breakfast sandwich night partying may waiting 10-15 minute line crazy 10am-12pm weekend line normal like think o'bagel best bagel hoboken
2018-08-09,5,love o'bagel breakfast sandwich something bagel push another level point find craving least week also occasion pop shop taco best flavor combination ever
2018-08-07,5,greatest bagel shop east mississippi looking authentic ny nj bagel place need check craziest item tastiest food hand dopest spot hoboken perfect saturday morning hangover cure hump day lunch nothing beat ridge diablo add hash brown hold jalapenos make extra saucy check asap wo n't disappointed bobs_eats
2018-08-07,5,fast service great bagel love place always visitor try great new jersey bagel bring friend
2018-07-26,5,place really best bagel nj lox n loaded bagel instantly addicted definitely stop back town come nj bagel
2018-07-17,5,o'bagel oh yes place hoboken get crack dawn go saturday freshest bagel ever every order made love wonderful staff make overall experience much better
2018-07-17,5,great food great service great location someone ask o'bagel take breakfast lunch bagel another level classic breakfast sandwich famous jumbobagel need get asap burrito twice impressed everytime always classic bec hashbrown sec hashbrown type girl obagel option make change style check instagram drooling food inspiration make sure get asap
2018-07-17,5,o'bagel best bagel find hoboken get breakfast place practically every weekend make sure try sinatra ridge diablo visit great food excellent customer service
2018-07-16,5,bagel good service bagel sandwich one bbq really liked variety cream cheese bagel got cinnamon raisin bagel honey walnut cream cheese delicious definitely love come back
2018-07-03,2,bagel generally good decide get order right usually staff busy preparing takeout order completely ignoring store customer could bagel cream cheese take 15 minute store customer ahead literally impossible happens o'bagel
2018-06-29,4,favorite bagel delicious reasonable price come back highly recommend yum
2018-06-24,2,place suck waited 20 minute two god forsaken sandwich one wrong cold wtf least rest easy knowing every bagel place hoboken also suck
2018-06-24,4,o'bagel notably solid experience day came store grueling spin class find line noticeably shorter normal e door maybe due seasonality maybe time day either way excited get bagel place small storefront visible kitchen table expect grab go decent variety bagel flavor spread topping specialty sandwich without overwhelming customer went lox loaded caper tomato whole wheat everything gave regular everything instead n't going complain honest mistake happen bagel exactly want taste think bagel crispy flavorful outside soft chewy inside scallion cream cheese n't overpowering overly rich complimented lox well lox thick salty crisp fresh onion cucumber round thing easily one best bagel place best hoboken definitely worth try
2018-06-20,1,sanitation practice unacceptable person worked cash register made bagel wearing glove one one hand activity
2018-06-14,5,bagel place compare obagel moved san diego two year ago one thing miss good bagel every time visit east coast make sure get breakfast sandwich everyday highly recommend everyone go everyday forever please open west coast
2018-06-03,5,easily best bagel around blessed live across street o'bagel get go time cook sandwich order bagel made perfectly recommend everything regular bagel butter sausage egg cheese bagel sandwich turkey chipotle cream cheese cucumber get little busy weekend morning wait worth small critique would love started making cheese bagel
2018-06-02,3,best bagel shop hoboken yet may want try place actually get 2 bagel order correct also expensive would give 4 get order right
2018-05-15,5,o'bagel favorite bagel spot hoboken tried breakfast sandwich plain bagel go wrong either seen lot review complaining wait sure annoying case o'bagel wait long offer good product poor organization
2018-05-06,2,disappointing highly recommend ordering delivery especially weekend expected delivery 30-45mins took 2 5 hour
2018-04-29,2,food great complaint price astronomical wanted becky sandwich toast instead bagel seems like downgrade le price also wanted egg white understand upcharge cool problem instead 5 75 10 00 thanks went straight hoboken bagel block got sandwich identical iced coffee 6 50 go instead save soul wallet
2018-04-15,2,resident hoboken four year frequent bagel shop sunday o'bagel always crowded good bagel far go every time either incorrectly given something order messed order completely waited 25 minute egg sandwich bagel still wrong salt pepper ketchup given place numerous second chance today last straw fiance ordered 11 bagel lox got home 10 minute walk home saw gave one thin slice lox see picture kindly threw one tomato slice piece onion past messed order lost ticket entire order would apologize gave free crumb cake old tossed called number 5 time let know lox order pick want bagel cream cheese enjoy long get order right anything else visit one many bagel shop hoboken
2018-04-13,4,let start positive note bagel sandwich combination delicious tried many favorite watchung warrior onion egg bagel hash brown bagel selection good make sure get earlier busy day bagel run quickly n't tried cream cheese yet ca n't really review quality taste n't give five star people say often long line long wait time worker work pretty fast efficiently n't waiting long however main gripe often forget add hash brown onto sandwich past 4-5 time visited usually go week forgotten add hash brown onto sandwich clearly told cashier add hash brown 1 extra certain sandwich either watch make sandwich remind add hash brown package sandwich open sandwich get ask add forgetting twice fine consistently forgetting n't right good thing always apologize tell always added hash brown afterwards overall pretty efficient service amount people come bagel sandwich always taste delicious make sure paying hash brown added sandwich check see added leave place
2018-03-31,4,best bagel spot hoboken hand tried every bagel shop area consistently disappointed got sick place bad butter bagel hard rock losing hope hoboken bagel roommate found o'bagel go spot plain bagel breakfast sandwich everything fresh absolutely delicious interior also nice bagel shop downside wait time huge line form weekend inside get hot however say bagel absolutely worth go enjoy
2018-03-29,4,bring deliciousness love carbs t-shirt proudly proclaim treat come bagel bagel sandwich upon moving nj nyc area spent week searching high low well knowns dive find signature staple great place bagel finally made o'bagel bringing exhaustive search finale finale offer wonderful selection hand rolled fresh doughy flavor packed bagel huge creative delicious selection breakfast lunch sandwich highly recommend ridge diablo fully loaded hash brown put right sandwich classic little aisle deli style cafe high table left n't surprised line form right worth wait hustle even observe boiling bagel back enjoy bagel umbrella sidewalk terrace summer month oh facebook com thrillist v
2018-03-27,4,incredible bagel sandwich came sunday morning although little bit line 10am n't bad moved quickly taking order got food within 5 minute impressive timing got diablo hash brown add egg bacon hash brown delightfully fresh made everything bagel made everything right world jalapeno nice touch loved spicy breakfast sammy lox fanatic splurged lox loaded bagel 11 expensive sandwich definitely skimp lox go well cream cheese caper definitely delightful would n't spending kind dough every day visit nj delightful
2018-03-25,4,awesome bagel favorite ridge diablo recommended hash brown weekend line pretty long go pretty quick
2018-03-19,1,disappointing checked menu online walked across town apartment sandwich looked amazing find changing menu next week n't ingredient better judgment substituted good skimpy ingredient last time got home find screwed order let go done place overpriced underwhelming always wait
2018-03-18,5,really great bagel amazing sandwich fantastic service line always insanely long move super quick go bagel spot try ridge diablo
2018-03-11,1,got sick eating friend also price 20 two bagel sandwich pretty ridiculous get
2018-03-10,2,start amazing food awesome marketing great menu choice eat meat con custom sandwich side lot vegetarian option would love see option without meat still egg cheese order ordered 2 sandwich paid extra hashbrown came without hashbrown tried calling back nobody answered also tried writing review grubhub well using contact u feature o'bagels website heard nothing back spending 16 two sandwich would expected better customer service return however careful check sandwich get busy sunday quality slip
2018-03-05,5,extra point favorite whole wheat everything bagel extra extra point awesome shirt said heart carbs back cute tiny bagel shop washington street hoboken walking around staying friend place right meanderings walk past blacked-out bagel spot faintly hit delicious smell bagel mixed breakfast meat open door whole different ball game smell waft transported bagel oasis yum place tiny tiny make way towards line back swimming upstream line patron waiting towards front order bagel displayed behind clear plexiglas see actual decision though whole wheat everything order whole wheat everything 4 u ordered different sandwich paid ton different breakfast special advertised menu digital screen cashier wait probably 10 minute seemed like long time place bumpin could tell staff working really hard bagel fluffy chewy perfect balance yummy whole wheat everything great slight subtle sweet hint whole wheat salty garlicky deliciousness everything seed
