date,rating,review
2018-03-02,4,new yorker place n't best bagel ever tasted prob best hoboken however always satisfying really interesting option guy creative always trying something new taco friday summer give credit get crowded weekend day line move relatively quickly worth downside every single time gone cold brew make plz staff always energetic impressive considering working weekend morning shift keep
2018-02-26,4,go o'bagel week since saturday sunday line door yuppie little priced food great tastey however new chef keep getting refuse make bagel correctly put egg egg almost paper thin
2018-02-22,5,boyfriend go weekend usually little wait weekend morning line move fast bagel good staff friendly highly recommend
2018-02-04,4,bagel never expected bagel made like big meal kitchen right behind counter ordered lox n loaded oh man fresh filling always long line definitely go back
2018-02-03,4,time good every visit meet bagel shop standard n't screw order usually salt bagel left time arrive saturday remember pepper ketchup also different sandwich option wo n't find anywhere else hoboken
2018-02-02,5,great food great service definitely return next time town got stevens duck believe delicious wonderful recommendation
2018-01-29,5,finally found decent regular bagel place black russian aka pumpernickel cinnamon raisin bagel best n't even like cinnamon raisin breakfast sandwich generally pretty good hit miss kind pricey 8 cream cheese probably weak link bagel perfect texture soft inside almost crispy outside good bagel n't actually need toasted good bagel think overall rating place 3 5 star service ca n't say service issue others described generally go middle day weekday though anyway food 5 5 star long stick good bagel
2018-01-23,4,really great bagel never dry lot option
2018-01-22,1,watched guy tattoo forearm sweep entire store definitely wash hand scratched crotch approached take order placed order anyway assuming would put glove weirdly gloved left hand right hand one scratched crotch work putting sandwich together n't want make scene took anyway tried eat part n't touch crotch-hand sandwich bagel good anyway wo n't back
2017-12-18,4,great bagel ny style fresh flavorful would revisit area
2017-12-17,3,like different combination bagel sandwich ordered sinatra sausage egg arugula tuscan cream cheese tasty well cooked cut bagel poorly half made difficult eat also felt pricey size comparison jersey bagel spot bagel smaller usual
2017-12-17,5,wish discovered place sooner five year living hoboken eating lox loaded divine bagel delicious ingredient fresh generous helping salmon service great hope place continues thrive
2017-12-15,1,bought bagel charged 1 85 found obagel charge 1 00 bagel kind scam bagel ok best worth double price nearly aware scam
2017-11-23,3,3 star would ignorant jerk register arguing bagel included takeout order sandwich spite receipt showing accused u lying attendant held bag bagel name apology must know read care removed boil water
2017-11-10,5,best bacon egg n cheese town little pricier place totally worth
2017-11-06,4,hoboken friend tell one better bagel get area thought pretty simple everything bagel cream cheese get job done bit steep 2 50 hip city pricing first time went apparently cut entire walked straight register ordered ahead guy looking funny figured everyone waiting coffee bagel nope line really long friend spent 17 breakfast sandwich bagel cream cheese 2 iced coffee seems crazy conclusion stop grab bagel unless hurry weekend morning
2017-10-22,1,0 star possible made order line 2 hour closing got 2 call bc everything ordered understand end day fine changed order took 4 time fr person talking understand get correct hour call say process order bc closing terrible communication customer service stick wonder bagel central congress station palisade
2017-10-20,5,decided try place way train morning bagel cream cheese good definitely return try egg sandwich
2017-10-07,4,great little bagel shop get morning going busy joint morning even though seating inside outside taking order go best option crowded think help sell place even ton bagel cream cheese option along beverage great cold brew coffee able call crowd bagel finicky bagel population hoboken new yorkers take bagel seriously testament well product made bagel doughy freshly baked toasted perfectly added healthy smear cream cheese overall good experience solid bagel coffee get morning right foot enjoy
2017-10-02,5,o'bagel necessity sure weekend packed get line totally worth signature combination fresh bagel gam changer reason 1 hoboken run great family stephen sister able change food scene 201 wait see else come
2017-09-30,5,usually long wait saturday morning go worth wait really good bagel bagel sandwich like pick friend always crowd pleaser
2017-09-24,4,going year say make best bagel one buy money 5 5 food problem became deciding factor go bagel shop time line wait time weekend come 7 8 prepare spend hour line food sad especially since n't take pre-orders could come pick food
2017-09-11,5,best breakfast sandwich hoboken creative unique twist basic breakfast sandwich good highly recommend ridge diablo lox n loaded one favorite besides getting basic bagel cream cheese line might doorbut wait bad
2017-09-11,3,used love o'bagel last time disappointing week ago ordered two bagel sandwich waited outside almost 20 minute get food find onion onion bagel completely burnt last time went sunday morning ordered bagel cream cheese toaster n't working could n't toast bagel opted go elsewhere
2017-09-10,4,think people complaining lack seed bagel come back 7am bagel hot fresh outta oven plenty seed evidenced pic black russian cream cheese bacon delish hub loved jalapeno popper
2017-09-09,4,issue week ago trying bagel pick everything bagel blueberry cream cheese order complete fast list blueberry cream cheese super yum back try sandwich
2017-08-13,5,ok lived hoboken three year every single time try get bagel bagel shop long line n't understand people complaining long line weekend confused wha yes line get long 1 good 2 bagel shop located town everyone try get bagel weekend bagel good like lox n loaded think dozen time stale bagel monday n't hold service slow yes messed order couple time 1 10 ai n't bad definitely frequent often go early line form time wait said line
2017-08-11,5,contacted said going work sorry hear consider great lower review think hired different people pretty rude customer pointed tv screen description boken prosciutto didnt add prosciutto onto sandwich menu apparently say something different consistent needle say uncomfortable see rude customer technically wrong still friendly people work definitely good customer service today
2017-08-11,2,bagel good staff incompetent understand wait order grilled 10 minute pull 2 dozen bagel insane register person could done quickly way instead waited 5 minute watched girl struggle counting bagel another good 5 minute thought would figure work flow still havent
2017-08-06,5,passing hoboken noticed cool looking spot decided stop really enjoyed decor ambiance nice vibe store going ordered breakfast sandwich coffee thing order every day heading work local bagel shop say bagel away best ever perfect combination chewy soft great crust service coffee solid also busy store really impressed employee managed customer overall must visit definitely back next time town
2017-08-06,5,real bagel good coffee awesome signature sandwich place really cool vibe staff super nice highly recommend
2017-08-06,5,great bagel great service made trip way queen get breakfast sandwich o'bagel every time come try something new disappointed yet highly recommend o'bagel
2017-08-06,5,o'bagel become institution hoboken community one place know hand rolled bagel really sense difference menu lot cool varities ca n't wait try worker super helpful owner steve made feel home everytime keep good work o'bagel
2017-07-30,4,best bacon egg cheese bagel hoboken said expensive 10 buck breakfast sandwich iced coffee place packed line long stay away weekend treat every mid week outstanding breakfast sandwich
2017-07-30,1,suck give place 1 star bagel pretty good especially sandwich selection could give 0 star would service one worst experienced three time gone walk work grab dozen bagel sandwich bag bagel wait 30 minute time ask worker get bagel would late work owner need figure hire someone else service garbage also went friday morning 730 someone ordered 10 bag bagel flavor left customer plain egg ready order people n't left selection many good bagel shop around wo n't going back
2017-07-14,5,best bagel florida girl ever sesame seed bagel shocked see seed top bottom never see fla fresh crispy plain cream cheese actually salivating guess travel 2500 mile forgood pizza bagel spoiled
2017-07-13,5,reason place blowing awesome food even better vibe everyone friendly always adding awesome specialty item menu cold brew coffee home run stop n't already got referred friend disappoint
2017-07-03,1,ordered simple egg cheese bagel morning maybe two people waiting order somehow got egg cheese look like ketchup mayo obviously n't notice got home n't marching back 3 bagel disgusting inedible
2017-06-29,5,pretty darn solid time guy good spot take good care across board
2017-06-28,5,like bagel look best bagel breakfast sandwich hoboken variety cream cheese available
2017-06-25,5,n't usually leave review far best bagel place hoboken jersey city area taylor ham pork roll egg cheese spot generous portion taylor ham
2017-06-19,2,"given place three try going something simple e bagel butter probably fine otherwise steer clear bottom line staff incompetent know know bagel shop young etc etc cashier clarify sandwich order six time seemed hungover complicated sandwich still made wrong another time given two sandwich rotten avocado brown oxidation literally black mush stale roll missing ingredient use common sense baffle mind close nyc one decent bagel shop sigh 2017-06-14,4 best bagel area always fresh get love soft full crisp outside real nj bagel 2017-06-08,3 biggest fan ridge diablo sometimes get second one cuz good even full suggestion offer fresh jalapenos pickled tried sinatra let n't like sauce made sandwich dry stick ridge diablo must try black russian bagel 2017-06-07,4 great bagel however giving place 4 5 star much salt everything bagel would liked could n't taste topping salt made hard finish bagel overall great bagel place really good hazelnut coffee 2017-06-07,3 bagel alone n't great definitely better quality bagel around however put bagel delicious lox good quality slightly salty used still enjoyable taylor ham egg cheese hash brown perfect remedy rough morning 2017-06-03,5 n't know put iced coffee swear best ever know thats strange bagel place really greatest iced coffee ever found place yelp year ago back almost every saturday sunday since breakfast sandwich really creative many option also great making perfect plain bagel cream cheese 2017-05-28,5 poppin bagel hook love option customer service worth trek downtown 2017-05-14,4 bagel amazing baked fresh great selection peak time service great super friendly quick morning rush prepared wait however know want order yelp via pickup save lot time thing n't necessarily like pickup process since line usually long register people ordering left right confused bit could ask pickup order actually got store got ahold one staff waving asking help thing seemed go quite smoothly 2017-05-07,5 place real deal old school puffy ny bagel spread staff atmosphere really chill spot coming hoboken 2017-04-30,1 good hoboken bagel line moved slow priced walk 300 foot towards 7th street better 2017-04-24,2 loved o'bagel first opened last month quality gone hill n't expect order anything custom come like wanted gone 7 time last 3 month every time asked bacon well done bagel toasted bagel toasted bacon even close cooked luke warm like package sat sun better description temperature bacon get busy going wait 15 min bacon egg cheese cook would rather wait another 5 actually bacon cooked 2017-04-22,4 price high service grill item e bacon egg cheese slow best bagel far hoboken 2017-04-22,3 food pretty solid least half time make wrong getting ingredient paid extra like hash brown hard see would keep coming somewhere else go weekday busy otherwise n't bother 2017-04-07,5 best bagel service around every time back town make pilgrimage quality flavor unrivaled go taylor ham double egg cheese spk everything bagel love place 2017-04-07,5 best bagel ever reason got voted best bagel nj nj com family ran business hand rolled new york style bagel worth carbs would highly recommend place creation sandwich bagel unless o'bagel 2017-04-05,2 short overrated overpriced even hoboken simple taylor ham egg cheese bagel 7 7 great enough warrant crazy price also horrible layout since used bar bagel pretty good get crowded weekend room wait food basically one aisle expect people stand line order wait food sit eat bar stool opinion jp bagel near path good better reasonably priced comparison hell lot le pretentious 2017-03-14,5 fresh ny style bagel small space seating limited bagel awesome usual whole wheat bagel turkey bacon egg hash brown sandwich variety bagel love name bagel sandwich continue visit eat delicious bagel 2017-03-09,1 review would 0 could placed order charged almost 2 week advance party called week party confirm read order food never delivered ever phone line busy 4 hour finally got apology delivering order questioned business could run n't even decency call let know would n't receive food told insulting make matter worse 5 day later still n't received refund speak someone daily 2017-02-26,5 honestly shocked see negative review seems like someone one slightly unpleasant time come make look like overall business bad bagel shop probably best place every time walk employee happy friendly enthusiastic work going lie weekend get busy n't stop worker busting order timely manner high quality bagel fresh listen alter order liking needle say food delicious defiantly favorite bagel store hesitation hope people give review deserves amazing 2017-02-25,5 staff super friendly love energy also gluten free bread ca n't go wrong tad expensive hot bagel 1 2 block 1 3 price think o'bagel could put meat sandwich money 2017-02-19,5 yes get place craving good breakfast sandwich hit spot sunday morning line long worth wait 2017-02-05,3 best bagel hoboken service always super nice incredibly slow got 1 bagel cream cheese morning forgot remind gave wrong thing super frustrating 2017-01-17,2 used go seeing live door away became pretty convenient opened last year n't 12 bagel smoked salmon understand manhattan within view ca n't charge price hoboken address sorry perfectly done whole wheat bagel unfortunately sandwich wrong almost every single time went also literally use one egg per sandwich laughable option b walk block way bagel hudson trust n't wan na either basically stopped eating bagel point thanx hoboken 2016-12-30,5 best bagel hoboken service always friendly tight amount space bagel shop would expect get everything w meat cheese hashbrown good highly recommend bagel lover short wait worth 2016-12-28,3 bagel probably best hoboken however get really busy peak time weekend cause issue ordering time ridge diablo must 2016-12-27,2 bagel place sandwich amazing 2 star come staff beyond incompetent owner show control employee control would better run establishment pleasure standing register 10 minute watching employee goof around chat wanted place order surprising order wrong expected place quality people n't know owner ca n't get staff together discussing people town consensus place go get order correct 2016-12-14,4 like review said bagel decent service ordered lox n loaded black russian bagel taste fresh bagel great chewing texture 2016-12-09,4 ordering phone little difficult however bagel food top notch sunday packed try order food quickly love egg cheese bagel cook perfection great mean hang 2016-12-09,4 place best coffee washington staff delight full sure want ask recommend n't failed yet favorite employee one white hair glass sorry im bad name hahaha walk already know like coffee also great cheerful personality n't function right morning without coffee thank bagel helping get day 2016-11-26,3 first time everything bagel great went way nutley nj get zero seasoning everything bagel disappointed 2016-11-11,1 second order messed ordered seamless still managed order incorrect first time gave tuna salad bagel asked salad completely left bagel cream cheese placed order got call saying three kind bagel left order came snapple warm put dressing salad said side forgot ketchup packet requested side ever order suggest calling say order back 2016-11-06,1 place awful tried calling 15 time place order pickup finally received food fingernail river walk sandwich highly advise taking half morning eat fingernail welcome 2016-11-06,4 know place opened definitely kink work new excuse layout one good cause large crowd build waiting area seating area flow used space server area none patron half item menu sold bagel prepared sell bagel also display hard even find menu lox sandwich black russian bagel say actually good quality food good place would 1 star figure kink next month return otherwise n't see lasting due poor layout time update best bagel place hoboken freshest bagel ca n't comment delivery still hectic layout place get packed stevens student 100 worth craziness bagel compare place 2016-10-31,5 staff friendly answered question bagel huge stuffed max tasted great 2016-10-30,1 option star would choose made order company took 2 1 2 hour get food lost customer n't care bagel decent experience sucked kid work n't care customer 2016-10-28,2 meh decent bagel nothing write home super expensive excited see kombucha tap n't expecting served ice definitely n't feel like got 4 75 worth kombucha considering volume ice 10 total bacon egg cheese plus iced kombucha plus lengthy wait crowded space full hipster finally get sandwich practically thrown wo n't back unless place closed 2016-10-27,1 busy bagel fluffy taste worth long waiting would like go hot bagel 2016-10-23,5 best bagel area definitely worth wait got chicken salad last time thoroughly enjoyed well new go spot 2016-10-16,2,40 minute wait subpar bacon egg cheese hash forgot hash there probably 10 everything bagel huge disappointment o'bagel like bagel 2016-10-07,4 yum yum yum boston never salt bagel grab many whenever visiting sister law hoboken manhattan delicious satisfying always hubby egg cheese onion bagel really good coffee caramel flavored n't love hence docked point otherwise amazing little shop definitely recommend 2016-09-30,4 excellent soft hand rolled bagel thought initially saw place going hoboken really need another bagel place turn one pretty good really interesting cream cheese tuscany quite good amazing sandwich sweet tooth almond butter pomegranate jam french toast bagel really good coffee kombucha tap thing keeping 5 star service always strongest arrived employee phone screwed order bit deal breaker could easily best bagel joint hoboken took bit care"
2016-09-28,4,like many take 1 star away overall wait time place get extremely busy weekend walked right past due line door said bagel good line go door hot sandwich specialty cream cheese fresh bagel coming back seems like every 10 minute rotation place absolute favorite bagel spot
2016-09-27,1,unfortunate terrible customer service bagel decent recently delivery order half dozen bagel showed completely wrong called restaurant could barely hear person phone due background noise could n't hear either person n't know issue gave manager manager reviewed order told reason n't get bagel flavor wanted subbed one without calling first told unfortunate problem bunch bagel wo n't eaten family n't bagel like eat say nothing silence let recap order product product want give something different without consulting assuming want tell wanted n't offer sort consolation business offered ability change cancel order delivered oh gripe place charge 3 75 tiny container scallion cream cheese look picture metro card scale size one little cup supposed put ketchup fast food place barely enough cream cheese 2 bagel thank god seamless called got refund
2016-09-27,4,let get something straight seeking review bagel shop thing really matter quality bagel rightfully said 5 different bagel shop tiny square mile call hoboken o'bagel definitely take cake people call hoboken hometown majority u say hometown bagel shop reign supreme may well o'bagel honestly say place quality bagel give hometown bagel shop run money minus one star long wait spent close 45 minute waiting bagel busy weekend morning suppose paying price quality least room improvement
2016-09-12,1,hoboken to-go breakfast sandwich spot washington st slim really excited guy however gone dozen time every time messed order top terrible service bagel hard rock even lunch time one manage mess order never going back
2016-09-07,4,grown o'bagel bagel ecstatic heard opening hoboken bagel consistently delicious would go far say best bagel ever large always fresh important note large bagel going get breadiness kind work fan bready bagel probably would prefer another place honestly like fresh bagel variety option standard bagel cream cheese choice bagel sandwich spot reason dropping 4 star instead 5 unfortunately service owner slow leaf lot desired trust n't mind wait much love bagel little excessive waited 20 min person ordered 2 bagel cream cheese n't norm gone 5 min n't think ignored end positive note bagel awesome cold brew die tap definitely disappointed hungry eating o'bagel bagel
2016-09-04,4,always gone hoboken bagel since favorite spot mood bagel option come must say bagel bit bready side good hoboken hot bagel chewy jp bagel dense lot option making creating trying speciality sandwich would avoid morning rush wait quite long go hour must easier get drink speciality bagel run around 12 give take offer gluten free great oh offer kumbucha tea one drink hard find fast food joint
2016-08-31,3,gosh o'bagel leave gal conflicted rate stuck 3 4 star inevitable flaw yelp lack 0 5 option guess good make u decide though provide delicious jersey bagel pricing service store set result loss 2 star taste let start best part yes best bagel town state perhaps universe said know bold statement perfect combination crispy outside soft weight inside great variation flavor bagel cream cheese sandwich option fresh service life take nose dive slow prepare spend 30 min get bagel else mean wait also rough time taking order time repeat cashier even ordering one person want order people wish luck inevitable forgot give something order situation last time one 3 customer ordered bagel coffee forgot coffee 5 people working behind counter still scratching head one several employee look like last place want happy give bagel wish page happiness waiting bagel store set really need something traffic flow wait bagel done end line mashed together one know whats going tough see menu kind bagel top register prep time make decision coffee hidden know know order get register understand work existing structure went believe better way oh want larger take home side cream cheese yes way beyond line stocked really know shop price bagel sandwich coffee cost almost 12 yeah kidding priciest bagel place town even city price basically place get great bagel experience long wait long line empty pocket regular want successful still keep coming back wow bagel awesome
2016-08-31,5,5 star amazing establishment best bagel sandwich around coffee really good staff friendly place clean good amount outdoor seating highly recommend also added gluten free option menu
2016-08-23,4,nice place go u want bagel sandwich got stevens duck bagel really enjoyed would go back seems get crowded quickly line move pretty fast
2016-08-21,5,best breakfast bagel sandwich ever hand got whole wheat everything egg cheese delicious bit skeptical bc previous review feeling newly opened business kink needed sort ca n't wait try lunch sandwich highly recommend o'bagel
2016-08-19,2,attempted 5 time order french canadian bagel sandwich since first time friend got amazing every single time ordered never gotten sandwich described menu french toast bagel maple cream cheese bacon one time n't get bacon one time n't get french toast bagel one time n't get maple cream cheese last two time got egg regular cream cheese even close stop trying place could great employee really need work attention detail o'bagel going lose would loyal customer
2016-08-18,2,although bagel egg sandwich taste good look fact skimpy forgetful staff ordering 5 bacon egg cheese salt pepper ketchup got back desk sure enough salt pepper ketchup biggest deal world 5 expected sandwich seemed half egg would like say would give place another shot expect said last 2 time ordering always seems something forgetting side lunch order overcooking chicken cutlet etc aside bagel hoboken much better option across board
2016-08-07,5,mixed review came sunday morning around 10am knowing expect saw long line table full always good sign restaurant surprise line moving along fast ordered loaded lox black russian bagel sure people complaining price seems line every bagel sandwich shop took bagel oj block waterfront took bite omg good tried lox bagel nyc nj spot best salmon fresh bagel fresh soft staff friendly also asked girl register loaded lox took time explain showed menu lcd register definitely new bagel spot regret taking picture bagel eating post excuse go back next sunday
2016-08-06,1,took hour half delivery finally came order incomplete bagel n't even fresh never
2016-07-29,2,whatever dont order french canadian reason made wrong 4 5 time gfs ordered menu hard make another thing run lox spread 930am make
