date,rating,review
2021-10-25,5,hit favorite bagel spot hoboken brand new hayride bagel fall finally know disappoint know wondering french toast bagel caramelized onion sausage egg apple butter cheese whaaat yup felt way however guy know blend flavor y'all another example fall savory bagel right hit every flavor note besides spice good work perfectly nice coffee tea fall morning give try tell wrong
2021-10-24,3,bagel ok got beesting dynamic right actual bagel alright bagel lack flavor portion size sandwich really pricing could bit better provides 5 bagel cream cheese 8-12 sandwich money could spent better otherwise prosportion sizeefficiency service really quick wait around 10 minute sunday morning order kind staffmultiple location conslacks variability bagel cream cheese option limited
2021-10-14,5,bagel delicious different every month come new bagel sandwich disappoint place 4 shop open first one opening small town centralish north jersey clearly well expand much bee sting breakfast sandwich one favorite bagel crispy bacon scrambled egg cheddar cheese scallion cream cheese honey different ingredient mix together create exhilarating flavor classic usually tend go jersey debate bagel choice taylor ham egg cheese although sold every bagel place nj o'bagel top bagel crispy outside yet warm doughy inside tend like bagel toasted go make toast already nice crispy check instagram see new sandwich come definitely best bagel place hoboken
2021-10-12,4,let start saying reason gave 4 ordered gluten free bagel let say chewy never good gluten free bagel breakfast sandwich good sans bagel order ready minute staff friendly hope perfect gluten free bagel hurry back
2021-10-05,1,ordered 3 time 1st time order came room temp chalked delivery heated promising decided give another chance 2nd time lukewarm bagel sandwich put together well order correct tasty decided order third time ice cold mean like cooled delivery never heated chaotically put together egg n't even bagel tossed side hashbrown liked paid receipt asked toasted bagel n't indication bagel egg bacon cheese ever heated thrown bagel even made door order came 20 minute early n't understand rush much rather come time even 20 minute late correct warm egg bagel time price food pricey get delivery fee top really disappointing absolute lack care quality control n't feel like wasting money hope order come correct touch warmer room temp feel dumb even giving third chance hard clearly photo 5 star review people getting good quality wish tell secret
2021-09-15,5,recommended prime spot someone life nearby ambiance ordered 3 sandwich online sunday got notified order status helpful considering one busiest day 45 minute wait able time walk location walk area also order window pick order ready price pricing great considering location quality quantity food pro breakfast sandwich awesome kept plain taylor ham sandwich cinnamon raisin bagel others group got sandwich look forward trying specialty breakfast sandwich future con wait time 45 minute little longer got sunday morning notification got allowed u time walk apartment overall definitely great recommendation glad tried make easy order pick food great way stand hoboken many delicious option
2021-09-01,4,slowly making way menu first restaurant hoboken twice would say really good bagel general amazing texture spot issue n't sell garlic bagel every gotten plainlox n loaded amazing flavor combination amount salmon get great bee sting far favorite bagel flavor combination great ate fast immediately wanted another watchung warrior got bagel breakfast breakfast bagel bagel would better lunch probably would order biggest fan pastrami ingredient n't anything enhance itthis place get really busy prepared wait 5-20 minute bagel order online hand le wait
2021-08-28,5,omg best bagelssoft inside crisp outsideplease bring store hb caonly sad part low nonfat cream cheese peanut butter
2021-08-18,5,walked like 20 min ago town day walked extremely welcomed gentleman front recommended bee sting huge fan onion flavor spice jaw dropped flavorful great experience come every time town morning 5 star joe
2021-08-13,5,okay obagel redeemed pickup ready time sesame bagel good
2021-07-28,5,bee sting lox loaded amazing service great fast definitely back
2021-07-26,2,bagel sandwich undeniably good however well 5 plain bagel cream cheese bagel sandwich generally range 10 13 offensive lived hoboken jc area entire time store open washington street purchased many bagel sandwich count however done raising price stratosphere obscene detached rationality one thing raise price attempt claw-back lost income covid altogether different story offensively abuse pursestrings loyal customer back
2021-07-24,3,place used really good come lot always mess something sometimes cheese ketchup bagel n't toasted overall kind fed switched bagel shop sad bagel great need get together kitchen
2021-07-19,4,friend visiting hoboken decided check o'bagel tiktoks kept seeing ordered online got call bagel type got jalapeno popper sandwich salt pepper ketchup friend got classic bec plain cream cheese good except wish bagel toasted definitely best quality bagel hoboken prefer hoboken hot bagel hudson however definitely revisiting bagel sandwich
2021-07-12,2,best bagel hoboken last week mouse came running corner kitchen past foot told cashier checking time response oh shit really proceeded absolutely nothing really recommend guy clean place get rid rodent n't feel comfortable eating taken care
2021-07-10,2,place always good heck 7 dollar barely put lox spread bagel disappointing
2021-06-27,1,review break heart reviewing location specifically good experience o'bagel location stirling gave raving review unfortunately location hoboken extremely busy walked saw people waiting noticed relatively short line ordering thought would give try 40 minute meet little bit road assumed 40 minute would enough two bagel ordered standard sausage egg cheese plain well plain butter waited 20 minute nothing came also note still bathroom closed could even use bathroom paying customer waited approached woman handling order twice first time check order 15 minute typically bagel shop crank order 10-15 minute super weird hope second time asked noticed others ordered gotten order left maybe 20-25 minute wait time said coming right though n't believe saw actually checked another 10 minute went cashier assistance late meeting street almost 35 minute two bagel cashier able check actual prep line got sandwich another 5 minute definitely think mix wish woman window took concern bit seriously 40 minute plain bagel bagel sandwich okay n't good experience one seemed care take concern seriously late meeting could eat hour half later meant sandwich cold stale back location continue visit o'bagel stirling really enjoy good service fresh bagel
2021-06-25,5,ordered bee sting today flavorful 8 80 incl tax expensive usually paid bagel worth come back try
2021-06-12,5,quality bagel always busy weekend typically call place order pick go bagel place hoboken every breakfast lunch bagel incredible definitely recommend
2021-05-28,5,fiance went based local recommendation wowwww glad tried o'bagel first people friendly kind courteous helpful made conversation gave great bagel sandwich recommendation obviously review bagel bacon egg cheese ridge diablo bagel fresh ingredient quality big soft inside firm outside perfect bagel bacon egg cheese classic ca n't go wrong one ridge diablo also amazing little adventurous chipotle flavored sauce delicious die ca n't wait come back try
2021-05-08,5,greatest sandwich bagel ever completely sure name sandwich diablo cheddar jalapeno bagel must
2021-05-04,2,kinda wish able step experience indoor dinning like straight forward point bagel nothing fantastic bec highlight b bacon bagel nice staff though
2021-05-01,2,good bagel veggie cream cheese awful terribly sour tasty huge disappointment bought half dozen bagel container stuff
2021-04-30,1,poor customer service ordered egg white bagel simply asked could make omelet style rather egg broken clerk said sorry n't clear something easy bad enough paid 8 something literally cost 0 50 make please get basic right never come back
2021-03-30,5,love fantastic nice crusty outside bagel nice chewy interior sandwich combination also amazing highly recommend
2021-03-28,5,love breakfast sandwich best hoboken recently tried new one bee sting loved light covid ordering ahead great used really long wait weekend
2021-03-14,1,absolutely worst customer service place entire life even sure business like stay open first online order pickup time generally hour half order went 50 minute pickup time told guy listen understand wont ready pickup time cant expedite strict time schedule cancel basically told would expedite problem go 20 minute later say oh yes sorry ready 5 minute another 5 minute go guy say hey man sorry still n't hit pickup time listed made order ultimately cancelled order would bring mentioned strict time schedule way annoyed order system get however way handled request expedite ended telling wait pickup time absolutely absurd cancel like asked instead wait 40 minute absolutely awful make sure receive business friend moving forward
2021-03-11,5,absolute favorite bagel spot east coast staff always friendly courteous bagel freshly baked lightly crispy outside tender inside nothing like grocery store bagel always stop place whenever hoboken recommendation ridge diablo bee sting opt hash brown inside wo n't disappointed
2021-03-08,5,tell bagel wanted scream delicious flavorful literally love every bite cross place bucket list family owned bagel made fresh house even jumbo bagel want completely devour enjoy friend family wish lived closer would everyday ordered bee stingthe southern classic becky jersey debate amazing filling topped everyone favs personally loved bee sting add mike hot honey gave everything unique taste bang wish able dine freezing sure dine moment see chair outside freezing make sure check place staff friendly well organized loved also get free hot coffee yelp check
2021-03-08,5,wow stopped eating bagel bc n't seem worth carbs bagel absolutely worth honestly best bagel long long time toasted bagel scallion cream cheese perfect light airy crunchy skimp cc pastrami egg also delicious back sure
2021-03-06,5,think best bagel hoboken complaint always long line great bagel sandwich
2021-03-02,5,obagel know absolutely love french toast bagel always get toasted peanut butter super friendly staff always serving best bagel vibe
2021-03-02,5,best fluffiest bagel around breakfast sandwich unique flavorful always greet smile warm greeting
2021-02-17,5,behold bee sting breakfast sandwich o'bagel hoboken tbh passed place hoboken sooo many time past never stopped n't cousin sent tik tok account absolutely intrigued ohhhhh boyyyy soo happy finally stopped got bee sting contains stacked crispy bacon scrambled egg melted vermont cheddar cheese smear scallion cream cheese topped mike hot honey also got toasted french toast pumpkin spice bagel guy never fantastic breakfast sandwhich life new jersey say lot bagel perfectly fluffy heavy like bagel flavor absolutely immaculate ingredient inside bagel go together well like clue scallion cream cheese bacon honey go soo well together ever hoboken hour 7am 3pm would highly suggest checking place
2021-02-17,4,first review post owner promptly reached wanted make thing right finally went back gave bee sting bacon another try charge compliment owner much better time bacon site definitely could taste hot honey
2021-02-16,1,decent bagel spread today ordered gluten free bagel tuscany spread 6+tax pickup still charge offered something else place without gluten free option forced take cold brew coffee instead way 6 n't offer refund order whack sauce stick wonder bagel best bagel county
2021-02-13,1,nothing toasted thing ordered extra barely singe portion hoped first occurrence bad luck second time row definitely wo n't coming back
2021-02-11,5,favorite hoboken bagel interesting sandwich order online pickup way easier waiting line
2021-02-04,4,first time place new bee sting bagel sandwich delicious complaint would bit pricey bagel joint food good
2021-01-31,3,got ta honest drawn tiktok bagel tiktok looked phenomenal moved jersey city top must-try spot hyped expected much menu definitely great love pun seems like ordered something missing partner ordered ridge diablo jalapeno popper everything bagel sounded absolutely delicious paper ridge diablo taylor ham bacon egg pepper jack topped pickled jalapeno chipotle aioli jalapeno popper bacon egg cheddar firehog cream cheese jalapeno cheddar chive get hungry reading right thought amazing got order received ridiculously fast pretty disappointed bagel bit smaller used nyc tompkin square bagel gramercy bagel bagel schmear despite ordering 10 somehow seemed like day-old bagel tough hard chew biting ridge diablo somehow tasted individual ingredient melding flavor n't understand happened since paper seems like blend well together yet somehow ingredient individual cohesion taste another reason 3-stars sandwich seemingly one egg kind made wimpy breakfast sandwich comparison others individually ingredient ridge diablo actually taste good together seemed like fighting dominance rather working together form beautiful breakfast sandwich hoped next jalapeno popper lot issue ridge diablo ingredient somehow n't work blend help flavor felt something missing maybe salt would helped also ingredient great one lackluster firehog cream cheese seemed like batch n't blended well often found plain cream cheese versus deliciously decadent description would imply otherwise service good price fair though 4 delivery seems criminal mentioned earlier delivery insanely quick le 25-30 minute however n't order food price convenience order taste somehow n't work try bagel cream cheese going skip getting breakfast bagel sandwich future continue search area better spot overall say try experience might vary bar n't set high might love far concerned okay
2021-01-24,5,amazing staff great effort making experience best even busy enjoyed ridge diablo bee sting deff worth shot area would like diff bagel enjoy get busy try make every customer feel special highly appreciated great bagel made fresh everyday try french toast chance
2021-01-24,2,tried tried love o'bagel breakfast sandwich never seem live hype hoboken food instagrams picture always look delicious every time let receive understand morning rush place see bacon aside scarcity sandwich seems metallic taste due sitting corner grill top hour yesterday tried new bee sting sandwich hot honey found entire sandwich sandwich cold shredded cheese even melted clearly assembled cold premade ingredient willing pay great breakfast sandwich 9 bacon egg unmelted cheese bagel cream cheese place much potential wish would take care every customer well instagrammers
2021-01-17,1,hour get small overpriced bagel 20+customers standing around waiting name called go jp bagel express
2021-01-09,3,average bagel shop food good overly unique taylor ham cheese egg everything bagel
2021-01-06,3,n't quite live instagram hype price going shell 10 bagel better step 4 deli go-to case sauce jalapeno diablo missing much bagel egg meat online ordering pick easy enough 45 min sandwich ready arrived 15 min early likely sitting 30 minute getting cold excited grab jumbo bagel point share friend likely go way come back
2021-01-05,4,ordered jersey bagel everything typical taylor ham egg cheese nothing spectacular may ordered correct menu item good choice bagel live area would n't go way get
2021-01-05,3,n't understand hype o'bagel bagel super doughy hard many great breakfast option hoboken jc usually last resort
2021-01-02,4,o'bagel fluffy fresh bagel tried home bagel kit twice quarantine loved must check try bagel shop nj
2020-12-30,2,really disappointed raised already high price food good great portion skimpy 1 egg egg sandwich 9 wo n't back unless adjust price reflect portion bagel big carbs cheap everything else sparse
2020-12-28,3,went time past year food alright jersey city wonder bagel location way ahead game o'bagel ingredient somehow dry
2020-12-28,5,lox loaded bagel perfect love smoked salmon bagel searching perfect one lox fresh bagel amazing requires modification lot place like add caper make scallion cream cheese add tomato 1 extra per mod forget n't half time dramatic think would moved recently discovered o'bagel living jc pat 3 year complaint lack good bagel place think wonder bagel ok nothing special really baffled 3 year downtown jc close manhattan ton great bagel place one day saw tik tok bagel ripped apart looked like kind bagel need low behold o'bagel hoboken looking place amazing deliver jc feel like living world dominated overrated plastic wrapped mediocre bagel feel like going crazy know deserve better o'bagel
2020-12-23,1,place absolute worst customer service infuriating order constantly changed time without even asking first run plain everything bagel time even run plain bagel literally nothing make 5 type bagel ca n't seem keep stock meanwhile every bagel place around 10 bagel type never issue swap bagel different flavor without asking claim tried call reality make minimal effort contact instead give different kind bagel assume okay one-off experience way happened almost dozen time past month
2020-12-20,5,hand best bagel spot hoboken go-to spot tec everything bagel never disappoints great option scaly scallion cream cheese mixed turkey bacon great breakfast sandwich new hayride little rich eat time french toast bread amazing recently tried dublin corned beef russian dressing egg recently eating lunch well also amazing love tuna salad jim halpert new go-to arugula cucumber sandwich make refreshing could eat everyday
2020-12-13,4,best bagel nj probably prize go sam west caldwell opinion interesting breakfast sandwich menu nj probably love classic taylor ham egg cheese get anywhere watchung warrior dublin delicious sinatra new favorite yes expensive like go every couple month spending night hoboken jersey city crashing sister couch well worth money bagel perfectly fine tasty fun unique option make place awesome
2020-12-08,1,well o'bag done tuesday morning ca n't call bec order answer phone say order online 3 online ordering apps three single one ordering breakfast sandwich inconvenience place n't neighborhood vibe standard operating service next tv show promo giant bagel gimmick take page tony b book better clearly trying anyway
2020-11-28,2,really enjoyed place first time went hayride delicious however came back lox bagel asked modification tomato onion toasted got lox cream cheese regular bagel disappointed service paying 26 2 bagel
2020-11-10,5,sorry took long updating review place reached last review show really follow want make sure best covid-19 pandemic line take rough time trying order line finally often public happy back store order delicious bagel great friendly staff thank o'bagel great work service good bagel
2020-11-07,2,went last weekend cashier nice promptly took simple order bagel egg cheese side hashbrown difficult hear music loud mask patiently waited 15 minute staring directly staff started realize one making food people ordered u getting order asked cashier said forgot great took another 15 minute forgot salt pepper ketchup requested bagel little small good hashbrown stale sitting grill day nj hundred bagel place replace n't get give kind poor service
2020-11-05,4,breakfast sandwich mediocre chicken salad sandwich delicious obviously quality get diminished bit delivery overall happy order
2020-10-17,2,wow year living nyc never quite experience like 1 ordered 5 bagel received 42 ordered pumpkin spice bagel got everything bagel instead 3 bagel hallowed definitely ask 4 bec simply sad thin ketchup cheese egg combined bacon almost burnt dry almost disbelief bad messed order bagel feel bad bagel honest excited breakfast hungry disappointed
2020-10-11,5,holy crap place amazing bagel plush crusty exterior nicest staff passing hoboken decided stop take bagel go shocked little pit stop led u encountering jewel bagel also still little warm rare afternoon fresh order one served cream cheese best believe stuffed good stuff
2020-10-11,2,love food every single time order always incorrect still shocked open long ca n't get order right
2020-10-10,2,quality go order diminished always come back trying give another chance continuously disappointed egg sandwich become stingy compared used look unappealing second time row bec completely unappetizing
2020-10-04,5,best bagel ever watchung warrior halzenut coffee cant wait come back
2020-10-01,2,first time trying o'bagel always seem busy expecting good experience nope ordered pork roll egg cheese sandwich n't one since pre-covid really craving one well waste small egg almost non existent cheese 2 thin slice pork roll sandwich left unsatisfied bland soulless would never go back
2020-09-19,5,best bagel hoboken bring family massachusetts bagel good
2020-09-14,5,begin review say started making nervous finished extremely strong ordering process unique feel would went ordered person would quicker ordered online wound forty five minute wait local would work could time right coming north arlington caught guard first love washington street vibe great atmosphere ok got track got ridge diablo sandwich consists bacon taylor ham scrambled egg pepperjack cheese picked jalapenos chipotle aioli sauce yes added hash brown bad boy ordered roll ran roll substituted plain bagel let known hate breakfast sandwich bagel o'bagel changed mindset bagel excellent could n't believe n't know made sandwich doughy thick sandwich world everything worked perfectly together good would n't hesitate make another drive weekend morning
2020-09-13,3,bagel best bagel sandwich insultingly light filling ordered bec one poor little egg sandwich thick bagel end tasting like eating thick bagel nothing bacon sound better need cheese egg match quantity bacon good feedback go turkey sandwich one measly slice turkey
2020-09-03,1,1 star maybe 2 pending refund every time go order messed butter bagel instead cream cheese missing bagel order half dozen straight burning bagel instead toasting ridiculous going year quality declined significantly top see even one employee properly wearing mask mouth nose many wearing glove ordering pickup area also allow adequate social distancing extremely disappointed wasting money anymore
2020-09-01,1,preface saying looking bagel cream cheese likely good experience wanted chicken salad wrap place usually go wrap closed today o'bagel definitely n't first choice figured give shot really wishing n't ordered 2 chicken salad wrap 1 avocado tomato 1 tomato cucumber first issue neither came tomato instead came cucumber normally able overlook mix try enjoy received wrap look like received pictured pretty hard ignore enjoy matter chicken salad practically nonexistent could barely taste small amount given overwhelmed wrap also wrap falling apart seemed like whoever made n't know actually wrap wrap basically smooshed strange folded situation definitely expect 11 chicken salad wrap look like honestly probably hungrier wrap
2020-08-30,4,yoooooooooo jumbo bagel ordered 30th birthday bomb easily feed small country got watchung warrior packed egg cheese pastrami issue messed pickup time ended deliver since n't ready arrived great 10 10 would order
2020-08-22,2,n't get required order online via chownow yet always forget get online afternoon tried ordering yelp also n't showing open fifth time like two month someone figure system please last time go store show employee app would n't believe phone frustrating two star breakfast bagel sandwich usually get cinnamon raisin bec since decent bagel place hoboken
2020-08-22,3,thought surprise husband treat ordered 2 lox loaded bagel sandwich o'bagel never buy bagel nj really comparison nyc thought would try one time since long since bagel year treat lox cream cheese everything bagel unfortunately still n't found anything close nyc bagel bagel tough hot chewy amount lox ok thin piece nothing like heap lox used passable sandwich 13 95 wait get back city bagel fix
2020-08-14,1,honestly place joke website crap tried place order kept getting error confirmation called restaurant basically told figure going another website versus taking order thanks go somewhere care customer
2020-08-12,1,yuck experience way covid however saw picture something social medium wanted leave review picture look way appetizing real life waited long line bagel assumed good line boy wrong-the bagel dry hard ruin sandwich worth bad bagel bagel shop returning totally fooled line hope others n't get fooled photo
2020-08-09,3,food great ca n't deny get order right every single time order never get right forget brown order half dozen bagel flavor completely wrong say cream cheese side bagel never correct
2020-08-03,1,picture posting pre-covid absolutely inexcusable circumstance send right order requested everything bagel sent pathetic amount pork roll paid almost 13 including fee grubhub took local business owner unaware customer spending extra money product little care slap face everyone order lack diligence staff part management find competent worker read comment seems one many others consistently receive incorrect order top also n't take order phone see amongst review one frustrated fear taking order n't get picked take extra 30 second take card number customer pure laziness direct result taken business elsewhere would never wish small business fail case fear inevitable given time stamp poor review seems feedback ever taken consideration also reflects poor business model top bottom seldom write review case felt compelled order keep establishment honest let others waste money seeing would probably satisfied physically ingesting dollar bill sandwich bought bagel
