date,rating,review
2017-09-03,3,shaka used one favorite spot hoboken fruit bowl poke bowl great flavor large portion justified 10 14 price point however recently cut bowl size half still charging price disappointment definitely deters going back
2017-08-23,3,3 5 star got build smoothie build poke bowl smoothie good add many ingredient want made fresh good size drink 8 poke bowl could better wish salmon menu option shaka sauce could spicier described similar spicy mayo also upcharge 1 avocado told making order go back smoothy try acai oatmeal bowl much poke
2017-08-20,4,acai pitaya bowl really yummy nice refreshing treat breakfast poke bowl good parking little challenging
2017-08-19,5,one best acai bowl ever fantastic service complaint n't opened washington street location yet
2017-08-08,5,tried shaka bowl first time referred u yum little pricey 15 per bowl hearty meal taste quality product use got house favorite sort teriyaki delicious definitely back try combination
2017-07-24,3,came couple week back fan one lacked variety protein option compared place surprised n't least salmon option stick ahi tuna amount add-in topping choose good fresh received bowl felt like definitely enough fish price paid also ordered sunny spirulina shake added protein complaint loved definitely think price good size got
2017-07-16,1,tried place first time ordered big island acai bowl first 10 get nearly much product hoped bowl wide shallow deceiving asked granola bad got granola since forced eat granola cold tasteless almost broke tooth hard acai bland watery maybe 2 tiny sprinkle bee pollen like teaspoon honey glazing bowl got go hoping make least apartment runny time drove nearest stop sign pulled ate construction site monroe 2nd fruit least fresh two bite throw aforementioned reason awful never coming back even near death starving
2017-07-16,3,acai bowl good complain portion small acai bowl shop use deeper bigger bowl sort short flat high price small portion
2017-07-15,3,came place acai best acai playa bowl acai blend watery mixed many thing good serving fruit granola need improvement acai base
2017-07-06,3,decent size good value like 3 sushi roll real poke marinade top fish authentic great concept poor execution see review people complain price however due portion size believe fair area looking nice easy clean lunch would deathly come looking authentic hawaiian pokey save change fly hawaii
2017-07-03,5,great addition neighborhood poke fan also delicious shrimp topping rice bowl copious make two meal love bowl pineapple crispy onion n't miss strawberry lemonade
2017-07-03,4,food choice west hoboken continue grow shaka bowl another welcome addition visited twice tried various ingredient customized poke bowl receive generous portion 14 plenty protein definitely come hungry prepared take home everything tasted fresh good quality note might blackened chicken bit bland server preparers professional food service seating area kept clean small place ten people could make feel crowded although small outdoor table nice weather shaka bowl loyalty card eventually earn free item hour excellent open early morning coffee oatmeal straight lunch dinner acai bowl smoothy frozen yogurt also popular choice highly recommend supporting small business providing west side hoboken great healthy food choice
2017-07-02,5,amazing addition hoboken ingredient really fresh unlimited topping worker extremely kind helpful extremely speedy perfect spot enjoy casual meal definitely returning
2017-06-21,5,love place first pitaya shake amazing bowl fresh delicious think price bit high enjoy food keep returning stop least week try
2017-06-16,5,best acai bowl ever much better place find manhattan absolutely loved shaka bowl highly recommend
2017-06-13,2,first time trying spot hoboken extremely disappointed everything service food first poke bowl offer ahi tuna disappointing best ordered mauna bowl white rice recommended one employee 14 impressed took bowl go found avocado rice cold flavorless pay 14 overfilled scallion jalapeno little tuna overall super spicy unenjoyable also seemed like sauce thrown onto tuna make seem bland onto service greeted walked since first time question woman assisting seemed irritated annoyed asked recommendation made feel like nuisance coming asking question sorry work restaurant obviously people going ask food serving 2 star detox smoothie got well super yummy perfect drink workout overall looking get good poke hoboken makai much better quality
2017-06-10,2,fake poke joint n't salmon ran tuna left poke bowl chicken shrimp topping n't normal poke bowl topping either
2017-06-05,4,checked spot due close proximity new apt hoboken impressed overall freshness quality ingredient bowl also super easy customize ordered one pre built menu option pineapple day half zoodles brown rice base v rice attempt healthy loved sauce tossed spicy shaka teriyaki piece pineapple super fresh added nice tang also generous serving tuna dont skimp anything complaint wait food three ppl front felt like forever get go bowl nice indoor outdoor space sit enjoy well
2017-06-02,5,delicious 14 get massive bowl filled base choice protein topping skimp anything trying healthy whole still enjoying meal suggest bowl half brown rice half zuchini noodle zoodles crispy fresh n't change flavor bowl great way stuff face without calorie carbs poke twice everything delicious time mauna kea favorite combination sweet mango kick fresh thinly sliced jalapeno amazing
2017-05-29,4,shaka bowl pretty solid-if n't gone check 1 pretty health-centered salad protein natural fat etc 2 price n't bad bowl come either salad rice run 14 filling-especially get rice 3 tasty breakfast smoothie option recently tried potato bowl big breakfast next day downside ton room probably enough 8-10 people sit importantly run key ingredient reason ca n't give 5 almost 3 all-convenient healthy option meal time day
2017-05-26,5,fresh food affordable price great customer service ordered family time always satisfied great addition food choice hoboken
2017-05-24,1,multiple good experience shaka bowl tuesday morning came ordered molokai cocao acai bowl usually get pitaya one worst decision life ate half whole day planned uncharacteristically got stomach pain nausea vomiting bedridden half day denial horrible sickness shaka bowl one spoonful leftover got sickness force vomit usually n't leave good bad review terrible experience staying away place awhile shaka bowl need make sure ingredient fresh date serving fruit fish
2017-05-23,5,good acai bowel hawaii highly recommend
2017-05-19,1,tried place least three occasion food good service absolutely awful waited twenty minute salad watching employee eat food right front 20 salad spent elsewhere
2017-05-17,3,food fantastic would come wait n't long place popular wait long wait three people take 5 minute line 5 minute receive order raw fish n't cooking anything n't get putting poky poke bowl sure
2017-05-17,5,hawaii 7x closest thing amazing poke bowl new fave spot poke bowl
2017-05-15,5,fully customizable poke bowl west side hoboken ca n't go wrong twice far since girlfriend life area loved time ordering simple card circle selection dry erase marker good dealing food allergy prepping food away certain ingredient bowl packed top actually save snack later night payment easy tablet reward program easy sign n't visited enough get benefit decent amount seating indoors outdoors one two poke spot know hoboken definitely back
2017-05-13,5,good food huge portion one bowl could split two people loved definitely back
2017-05-08,5,give star could absolutely delicious mauna kea bowl fantastic added crab salad delicious also place n't table service counter service super friendly everyone really special thank rob great great service
2017-05-06,5,really good fresh ingredient reasonable price friendly employee best breakfast bowl hoboken
2017-04-30,4,great spot poke acai bowl large enough left over second meal though last visit poke bowl n't nearly large first time perfect monroe center-makes easy pick food pm barre class
2017-04-19,5,awesome place dine take reminded vacation hawaii tried
2017-04-11,4,gave shaka bowl chance redeem self ridiculous experience little back 1 much lot thing much better since line door stayed door amount people day 2 bowl packed back top sloppy like last time adding flower top guess show idk honey ca n't eat placed aside tried get table dirty otherwise great fresh fruit pomegranate seed seasonal fruit totally reccomend hemp seed got sure u got discount top reward point girl black hair glass always sweet walking around asking everyone enjoying meal table set outside spring
2017-04-08,5,wanted try place since opened line door well worth wait staff friendly ordered able snag table outside eat got bowl zoodles menu make sure ask loved large portion choose many add one topping want acai bowl delicious
2017-04-04,5,picked delicious bowl sister dinner tonight must say impressed absolutely love ahi tuna poke bowl fresh flavorful great size money loved alternative rice base green delish ca n't wait try acai bowl breakfast get used eating hawaii feeling going enjoy hawaiian vacation jun trying
2017-04-02,3,relatively good long expect authentic poke ok interpretation poke case n't like music loud high table stool would recommend take different poke
2017-04-01,1,complete copy cat total nutrition serving even bowl poorly executed staff unknowledgeable friendly went try acai bowl one person front took almost 20 minute get bowl got completely wrong melted boot asked new bowl said suppose 1000 acai bowl know suppose served melted usually give place second chance terrible service time
2017-03-29,5,love place love close apartment nanner favorite oatmeal bowl far peanut peanut butter banana something else ca n't recall promise delightful also juice well poke bowl poke bowl flavorful fresh juice pricing fair getting happy place nearby wish delivered somemornings cold want oatmealbut walk butt although hey keep moving least definitely check place
2017-03-28,5,outstanding poke hoboken spending day hoboken decided stop spot quick lunch really quaint relaxing atmosphere decided order ahi poke bowl white rice avocado scallion mango jalapeno cilantro wonton w spicy shaka sauce made bowl felt like minute second taking first bite fire alarm went initially caught guard realized exactly alarm went place fucking fire absolutely lit alarm went 4 time time made sense last absolute must next time hoboken found shaka flex
2017-03-27,4,went recently tried available bowl really good huge portion great value something new hoboken
2017-03-21,4,first poke bowl experience huge fan super delicious fresh ingredient time back staff super helpful great recommendation
2017-03-21,5,six u went christmas walked loving place one left hungry portion generous tasty seemed figured right ingredient recipe bravo sampled one another plate one incredibly delicious smoothy excellent well love fact build dish good luck hope see shaka bowl opening hand five star review
2017-03-15,5,really like place dine least week working upstairs great fresh ingredient love pineapple day bowl dinner oatmeal breakfast hearty stingy serving clean operation
2017-03-14,5,freshness poke bowl great great variety ingredient build bowl always smoothy delicious healthy also tried acai bowl yet soon service hit miss either great service slow service great busy service go drain want get people get rid rush bit pricey also wo n't deter coming back
2017-03-12,5,happy found place right light rail catch bite eat way home work delicious food bit pricey use premium fresh ingredient chicken poke bowl veggie teriyaki sauce well banana shake came 23 good staff friendly two people ahead received order le five minute excited finally another healthy option hoboken many pizza junk food place town
2017-03-06,5,love place food great fair price also service also amazing recommended everyone
2017-03-04,5,reaally amazing ahi tuna poke bowl ingredient fresh great smoothy sure location open like different delicious
2017-03-02,5,new family run business hoboken love place ingredient fresh bowl made order poke acai bowl large great quality price returning weekly
2017-02-27,1,local girl hawaii crave certain food time time poke 1 list lo behold shaka bowl hoboken offer poke bowl live north bergen short ride place staff welcoming poke bowl anything write home share anyone else total disappointment rice fully cooked nishiki sushi rice would good choice n't hard cook rice rice cooker going give second chance let see truly know make acai bowl aloha hui hou
2017-02-26,5,coming least week since opened poke bowl amazing tuna always fresh love first wave smoothie well nitro cold brew staff always nice service fast recently added new bowl smoothy menu ca n't wait try
2017-02-23,4,dying go back place small small space pretty busy made way random sunday evening prefer eat bowl comfort apartment anyway chose make poke bowl seemed little pricey especially considering takeout guess going rate day
2017-02-22,3,everything pretty good nowhere near awesome poke hawaii food fresh great quality pricing bit high parking tough
2017-02-20,5,new craze poke bowl acai bowl place try yes little pricey bowl big portion sometimes ca n't finish entire thing everything fresh fruit used acai protein veggie poke poke bowl n't start 11 acai pitaya bowl day also get smoothy coffee well bowl choose selection create menu simple either bowl choose base topping many choose question worker helpful always glad help join reward club receive point app
2017-02-20,5,got big island bowl strawberry blueberry banana granola bee pollen honey literally ca n't stop eating got pitaya base also get acai also rina bow look super fresh bowl 10 though pricy huge enough two people make smaller portion lower price
2017-02-09,4,love concept location lady behind counter friendly made poke bowl ahi tuna assorted choose topping huge serving felt like 14 great deal even tried red velvet frozen yogurt delicious complaint amount dressing little heavy bit spicy next time get side also ca n't wait try acai bowl glad close apartment back thank shaka
2017-02-09,4,restaurant adorable interesting idea made poke bowl fantastic except amount dressing put asked side still put bowl could taste would love got different fresh healthy sauce bowl sauce asked try tasted like ranch back acai bowl another dressing poke bowl
2017-02-06,3,went pretty new loved small place cute since poke bowl always need little time order staff think even manager something rushing u n't friendly made moody already since love actually enjoy food food restaurant experience also nobody behind u sure girl behind bar made bowl super friendly tho made happy bowl great price like manhattan price hoboken meh need variety fish tho tuna shrimp chicken little compared went cali definitely would go back since closest poke bowl spot around
2017-02-05,2,excited finally try happy see restaurant open back hoboken meal tasty definitely warrant ridiculous price 15 option meal sparse put 3 ounce meat meal paid 15 bowl rice chicken piece crummy veggie thumb
2017-01-28,4,definitely fan place welcome hoboken needed wanted great place get poke acai bowl unique sweet dragon fruit pitaya bowl ask try curious little pricy quality type food getting thats people working super nice helpful patient anyone question special food need primarily take place since seating limited small store front thats standard many convenient food place around parking tough thats expected something cant control whole 30 place work feel like 30 hoboken feel worth include review get mauna kea salad remove spicy shaka dressing make coconut amino sesame oil bam put flavor mouth happy shaka
2017-01-25,5,twice recommendation co worker beyond outstanding time food fresh service quick even line often done build poke bowl time literally licked clean happy poke place hoboken close home also acai bowl cool breakfast smoothy defiantly try soon highly recommend anyone area
2017-01-25,5,delicious live block away go regularly great tasting really refreshing little pricey worth mind get honest goodness quality food make feel good
2017-01-23,3,fish rice ratio poke bowl could better otherwise say well crafted bowl felt hungry eating mauna kea sustainability core value hawaiian culture would nice know fish sourced sure go earlier day ran fish first two time stopped look forward trying smoothy acai bowl next time
2017-01-22,5,place awesome got mauna kae extra tuna way tuna expected big plus cooky also world
2017-01-22,4,great place compliant super expensive price give extra topping minus protein charge
2017-01-21,5,delicious place poke fresh sweet shaka sauce best combo hawaii agree founder become obsessed poke happy decided come hoboken great see diverse food option coming town combination creative also cater bowl like ca n't wait go back
2017-01-18,5,really dug shaka bowl boyfriend stopped week ago snowy saturday great selection base including zucchini noodle well protein topping sweet spicy shoyu sauce really solid also pitaya acai bowl ton topping homemade dessert coffee definitely back
2017-01-15,5,couple time love new acai poke bowl movement absolutely delicious best feel bad eating one like cacao nutella acai bowl super filling nice power breakfast lunch acai bowl run 10 also enjoy poke bowl usually build mix match green base general protein add sweet spicy sauce give nice kick poke bowl bit expensive running 14 even though place bit expensive still much cheaper nyc spot good luck parking area also small seating area
2017-01-12,5,want lunch healthy fun tasty poke bowl right size service quick nice got mauna kea took home even better soy sauce glad place
2017-01-07,4,food bowl awesome lot food super fresh ingredient complaint would came back couple week later run tuna told get fresh shipment day already run back though
2017-01-05,4,poke popping everywhere glad see hoboken n't far behind trend son thunder pokeworks city shaka bowl nj entirety bowl important really make break poke fish need fresh marinated correctly served bowl rice correct temperature lot fun topping add flavor without overwhelming shaka bowl nice job thing price fixed good cheap get literally everything want trust want everything nice balance spice sour sweet fruit salt course fish convenient location would still lived one block away pretty easy time parking run sure poke continue pop city hoboken far pretty stiff competition yes know food would hard pressed come get bowl deliciousness
2017-01-05,2,good super pumped poke spot hoboken first experience good brown rice raw point thought chipped tooth also barely tuna bowl payed 14 bowl uncooked rice sure give second try experience
2016-12-31,3,poke bowl hoboken needle say hyped try place maybe overhyped maybe memory authentic poke hawaii still lingered palate food ok creative n't quite live hype admittedly self manufactured pro fresh ingredient simple menu nice staff zucchini noodle con terrible rice sushi style sticky sweet dry flavorless costly 15 per bowl
2016-12-18,4,love place food fresh healthy presentation beautiful big fan poke bowl option add-in sauce topping base great zucchini noodle fantastic reason giving 4 star instead 5 last two time ordered add-in n't make bowl yesterday ordered mauna kea avocado missing last week ordered mauna kea asked add napa cabbage missing always disappointing bring food home realize exactly ordered notwithstanding occasional missing ingredient food good enough keep going back shaka bowl new establishment hoping improve ingredient accuracy coming week get resolved solid 5 star
2016-12-15,5,love place one actual healthy place hoboken food fresh customize anything everything great also vegan option hard come town
2016-12-14,5,staff always super friendly food always fresh also never wait long order bowl great usually pretty hangry come wish still carried salmon guess enough people ordered keep menu
2016-12-11,3,manager staff attentive customer failed attempt try food offered free poke bowl made way perusing menu cashier engaging helping understand build bowl option preparing bowl dining invite take seat bring bowl nice husband pineapple day poke bowl built shrimp rice mixed green mango pineapple spicy shaka sauce wonton chip fresh ingredient especially fish reason review n't stunning little bit much first two time poke hawaii inherently simple dish fresh fish seasoning dressing light simple packing flavorful punch poke bowl take simplicity originality away reminds chipotle except fish shade chipotle btw nothing wrong per se poke bowl think unfortunate thing original first shade comparison n't acai hawaii maybe try acai bowl sometime enjoy great service fresh food ask
2016-12-10,5,happy see acai restaurant open hoboken acai bowl amazing large portion 14 might sound lil steep acai bowl size bowl much bigger one would get juice generation liquiteria 12 build many topping like also tried poke bowl obsessed poke well big raw fish person chicken option made go glad downside location bit way way back west end hoboken would probably order least one week offered delivery service
2016-12-08,5,going review people leave 2 star le clear live amongst whiny spoiled brat business open half hour later leave negative review poke bowl pricier expected leave 2 star give break place gem perfect place hoboken perfect shaka bowl inexperienced staff working behind counter one founder always around lend helping hand answer question food fresh delicious plentiful energizing pricey sure dare find cheaper spot hoboken jersey city leave satiated feeling good shaka 2 block away house go weekly competition city honeygrow total nutrition kitchen pricey actually believe shaka bowl offer better ingredient fresher food business perfect rather spoiled brat leaving negative review adversely impact small business speak manager owner alternative leave comment restaurant particular need normal one try tuna poke bowl die make sure avoid jalapeno wasabi n't spicy
2016-12-06,5,obsessed place take acai bowl whole new delicious level ordered different place nyc could n't get shaka soooo disappointed shaka hand best place wish much success hope open many location keep amazing work shaka
2016-12-03,5,visiting family weekend 4 daughter used live hoboken sister recommended shaka bowl hesitant go-to place ordered 4 poke bowl amazing good fact came back breakfast oatmeal acai although everything great acai bowl star great work
2016-12-02,5,must try poke acai bowl seriously best portioning acai owner super friendly food good
2016-11-28,4,past thanksgiving weekend aka pure gluttony lot sleep looking healthy detox meal lunch stumbled upon shaka bowl great find 15 get customized poke bowl fresh quality ingredient yes expensive used price thanks honeygrow also acai bowl smoothy looked amazing coworker opted preset menu pineapple bowl spicy bowl blown away good really wish place washington closer office lunch place bit way worth travel walk forget avocado bowl reason happy add told bit pricier side fast friendly service quality food lunch
2016-11-27,4,really great addition food scene town portion appropriate price food well prepared presented got mauna kea bowl fiance created absolutely back try rest menu
2016-11-16,5,first time eating fantastic eaten similar style food city excited see shaka bowl open hoboken ahi tuna veg sooo fresh also tried banana almond butter little cake blown away guy said gluten free yet still good lol tried understatement delicious see guy soon
2016-11-06,5,daughter stevens student recommended try shaka bowl staff friendly bowl excellent
2016-11-06,4,decided give new place try got pineapple day bowl loaded edamame mango pineapple tuna scallion crispy onion 2 type shaka sauce filling sure worth 15 fresh ingredient cute spot good luck
2016-11-05,5,staff really attentive multiple people asked u friendly delicious fresh smoothie awesome treat
2016-11-05,4,love atmosphere great service even though line waited longer five minute portion size great first wave smoothie super fretting would would doubt returning wether get quick snack lunch great hangout area nice fall day interesting secretion home brew tea next list try
2016-11-02,5,awesome food friendly owner set place apart spicy sauce protein freshness
2016-10-30,5,pineapple day bowl wow delicious came 15 buck tax expensive really ca n't complain raw fish safe eat huge bowl fixing pretty full eating 2 3 bowl fine lid take go great snack later pretty crowded today weather unusually nice guess pineapple day bowl good spicy sauce pineapple fish cilantro actually go together really well rice sauce taste great even though normally rice person return smoothie bowl soon looked pretty yummy saw people eating
2016-10-29,5,came visiting city loved poke bowl even better pokeworks never thought say 14 average price shaka give unlimited free topping mix in awesome solid portion tell owner truly care business customer nice see definitely back next time area
2016-10-25,5,delish mauna kea bowl like deconstructed spicy tuna roll ca n't wait try pitaya bowl next ti
2016-10-24,5,stopped yesterday pretty limited experience poke bowl aside one time inquiring picked pineapple day poke bowl smoothie great took 2 sitting actually finish bowl definitely got board customer intend stop back soon
2016-10-23,5,place delicious fresh healthy filling highly recommend pineapple day mauna kea definitely must try
