date,rating,review
2021-10-05,5,love place good healthy meal staff always friendly ingredient always fresh order always prepared quickly could never go wrong ordering
2021-09-10,1,wish could give good review place watching girl make food touching phone texting touching raw food ca n't even covid stuff dealt right
2021-06-08,4,quality food smoothy acai bowl complaint extremely priced 9 tax smoothie go smoothie hilo also like banananutty acai bowl
2021-05-22,4,excited try place hawaiian food common area location one block 9th st light rail station convenient whoever take light rail work first menu option fantastic many different thing type diet appreciate multiple vegan option well ordered jackfruit taco trio first great job food delicious also light fresh point noticed cutlery takeout item eco friendly usual plastic love saving planet initiative also noticed many healthy option plus located right next gym post gym poke anyone also think pricing reasonable well n't biggest fan bbq jackfruit taco meal pretty good overall looking forward going back trying thing menu
2021-04-22,4,spot tucked away monroe center food definitely speaks liked poke bowl whole bunch topping wo n't bore got rvery topping fresh important always prefer topping crunchy like wonton chip crispy onion edamame sauce also worked wish put sauce wife got chicken bowl since pregnant ca n't eat raw fish n't biggest fan would stick poke solid choice poke bowl seemed really taken last year place right check
2021-02-08,4,yum yum yum shaka bowl awesome whoever said ca n't eat healthy yummy grub time never tried place chronically addicted winter special sesame chicken taco lava rock shrimp taco spicy salmon poke bowl rock sock biggest fan acai pitaya oatmeal yogurt find rather sweeter like everything else especially taco damn good
2020-07-13,2,poke fanatic pretty much love poke anywhere pretty disappointed got bowl shaka bowl 12 dollar smallest size without additional costly topping bowl half size bowl poke place price fish taste fresh could n't bring finish bowl fearing could get sick hoboken place beautiful worker really great friendly
2020-06-22,5,smoothy awesome staff always really nice used work upstairs building would occasionally stop right opening never problem serving always really helpful answering question definitely asked lot usually cute sticker grab
2020-03-14,5,cute place nestled neighborhood business many dwelling plenty seating cool vibe personally love acai pitaya bowl addicted banana chic chip protein ball want try thing usually n't get past item n't smoothie twice good got choc chip cooky good wish nutrition information available asked n't gotten reply
2020-03-10,4,recently replied email owner shaka bowl response got original review former business partner replied almost immediately let know initial issue addressed person longer company happy give another chance believe supporting local hoboken business big supporter sb really grateful get reply gotten first place thanks kg
2020-03-05,2,picked two bowl taco unfortunately pork cold guacamole brown rotten staff nice friendly unfortunately management invest quality ingredient favor walk right
2020-02-16,5,best poke spot hoboken poke bowl always fresh filling delicious also tried acai bowl smoothy avocado toast fantastic service always quick love table outside summer
2019-11-05,5,excellent food choice second time consistently yummy healthy eating small chicken shaka bowl lot add in walked lunch crowd order online extra bowl bring home husband love decor
2019-09-29,4,trying find good poke bowl around area came across place prayer answered definitely recommend look small size poke bowl n't going enough decided go large could n't even finish small enough eat n't feel overstuffed gross eating bowl made happy large allowed unlimited side awesome get small limited 5 even right amount thing say need little flavor got teriyaki sauce seemed much like soy sauce regardless place good
2019-09-20,5,yooooo place make best acai bowl area delicious smoothy hilo favorite top-notch cold brew peanut-buttery nutella banana toast imaginable time parent come visit brunch spot choice
2019-09-16,1,high expectation place based review sadly enjoy food service staff friendly helpful explaining go bowl bowl got dry lacking flavor seemed used regular white rice instead sticky rice weird poke bowl place add ponzu make edible ugh definitely going back place even mean trek washington poke
2019-07-18,5,great food friendly people came corporate event food delicious restaurant great atmosphere would highly recommend
2019-07-02,5,amazing additional hoboken food scene utterly obsessed vegan funfetti cookie im far vegan poke bowl always fresh amazing salmon peanut bowl favorite havent lot smoothy arent thing ive sip also amazing def recommend going u want healthy filling meal snack bowl come two size convenient want small dinner
2019-05-31,5,friendly enthusiastic service every time visit go aloha smoothie salmon always incredibly fresh little sister obsessed pitaya bowl load nutella recently tried sweetberry jersey city compare finally got try funfetti vegan cooky might obsessed
2019-05-06,3,still expensive place get poke hoboken 14 bowl expect huge serving size great selection tasty mix-ins unfortunately bowl small mix-in list charge avocado guacamole seaweed salad hoboken poke restaurant offer free last two time ordered substitution made ran ingredient last time went completely forgot include protein 30 price n't even include well green also usually skimp sauce overall mood poke n't willing walk washington street place terrible choice
2019-05-04,5,really dig place ambiance self service course food really hip nonsense bowl joint get spicy tuna bowl full size pure heaven quite big like fact tv self serve hot sauce area one quick go-to place lunch
2019-04-28,5,shaka bowl quickly become one favorite spot hoboken thing upset n't around lived hoboken smoothy baked good wow delicious favorite smoothie hilo smoothie sweet love anything peanut butter really stand vegan funfetti chocolate chip cooky ca n't express delicious usually vegan cookie tell always fresh satisfy anyone sweet craving area looking something healthy fresh place variety extends well beyond smoothy smoothie bowl
2019-04-18,5,place great located main floor e building monroe center indoor seating would say 16 seat weather warms outdoor seating well quite enjoyable review actual location poke bowl thing buy offer two size option snack size limit 5 mixins including base protein also regular size give free range whole menu many mixins heart desire place first opened portion amazing started changing container felt like cheated back better sized container leave feeling satisfied worth money spent favorite poke build version truly customize bowl favorite flavor unsure however several predetermined choice equally delicious place great healthy lunch snack atmosphere chill islandeque give try wont disappointed
2019-04-03,5,went grab something munch boyfriend yesterday loved food especially excited pulled pork taco sure visit near future
2019-03-25,1,maybe stick bowl really craving taco thoroughly disappointing bottom fall three cold chicken completely bland could n't even eat fork
2019-03-14,3,food ok bit mushy expected freshness department pricey get step guy maybe visit fresh coast newark see done better sayin
2019-03-13,4,great quick stop light lunch stopped made bowl chicken 24oz bowl mixed salad zoodle base lot topping could add many like garlic lemon dressing also add nice amount chicken exactly wanted something delicious filling heavy
2019-02-24,5,place go poke hoboken end story smoothy awesome buffalo shrimp taco changed life
2019-02-19,3,3 star soley oatmeal soooo excited try oatmeal bowl went first thing morning 8am right opened waiting 15mins finally got bowl disappointed anticipating warm spoon full oatmeal surprise oatmeal cold maybe thought oatmeal meant nice warm breakfast n't happy outcome
2019-01-26,5,happy fine place right near studio client love shake yogurt parfait
2019-01-07,5,absolutely best food good many good combination small store front good takeaway well
2019-01-02,5,ugh love shaka much listen customer keep innovating making sure basic covered food high quality delicious best acai poke spot hoboken hand
2018-12-26,4,craving fruit bowl shaka bowl came rescue ordered usual bowl get place acai mango pineapple banana granola honey coconut good quite filling large serving friend ordered poke bowl full filling flavorful good return hard time deciding want fruit bowl poke complaint came small hot coffee staff clearly forgot ordered finally came inquiry coffee lukewarm told temperature issue said put cream per request still n't dropped temperature coffee much girl behind counter made le cream last time fine seating inside totally see place getting packed warmer month
2018-12-20,5,excellent place nice atmosphere really enjoyed poke bowl fish ingredient super fresh definitely back
2018-11-20,5,first trip shaka bowl n't disappoint butternut squash good could ordered another boyfriend chicken poke really good size fresh tasty loved menu look great ca n't wait head back asap try super impressed also get apple cinnamon oat muffin still dreaming
2018-11-09,3,come shaka bowl since beginning sad say business used come love acai bowl portion way le granola changed great tasting acai bowl spot used ill keep simple would n't come excepting delicious acai bowl especially price like 10 bit great bowl used come religiously anymore guy something win back customer know plenty people expressed concern place
2018-10-05,3,loved coming first began acai bowl amazing literally place use get idk fact recipe change way made n't taste anymore however staff always nice friendly
2018-09-26,2,really disappointed direction shaka bowl gone guess around year since last changed structure menu understand business perspective quality acai bowl quality food came acai bowl delicious smooth creamy texture also served wide bowl could mix topping acai transitioned gross ice mixture used shop hoboken like eating 25 freeze pop except freeze pop cost 10 served narrow bowl time get gross ice mixture eaten topping transition snow cone ice-pop worst sherbet life responsible reduction 5 2 star structure menu different size bowl charge extra premium topping understand move hard feeling since mentioned nice get unlimited topping last review thought update
2018-09-24,4,first time poke bowl last jan went back soon another one delicious came back around neighborhood ortho appointment stop going another bowl saw shrimp tiki taco went disappointed shrimp cabbage sweet pineapple tasty
2018-08-13,5,best poke bowl ever everything shaka bowl already fresh store delight walk poke bowl pre made menu delish always like make really taste freshness fruit fish put poke writing post thinking make crave one right
2018-08-09,4,definitely impressed decor place immediately greeted staff behind counter although n't get try food ate daughter wanted smoothie ordered happy hawaiian kid hand two minute fast delicious perfect blend fruit definitely come back try poke bowl acai bowl saw people poke bowl walking looked yummy
2018-08-04,4,love place recently saw employee playing possibly employee dog washing hand prior returning work
2018-07-18,5,delicious many choice create poke bowl lot topping sauce everything tasted super fresh new side great addition menu acai bowl huge great topping recently checked new location really liked ambiance decor used live pahoa big island shaka bowl comfort spot hoboken make feel like back big island service staff wonderful well kind friendly highly recommend check place go spot quick tasteful meal p kombucha tap die
2018-07-14,4,giving shaka bowl 4 star various reason n't good plenty topping bowl reason giving 4 star missing topping bowl mind n't busy time went also fan container harder get even proportion rice topping meat utensil also although good chicken option etc get ahi tuna seafood option guess got spoiled poke spot plan going back try acai bowl well see
2018-07-12,4,clean fast healthy eating shaka bowl one many spot around hoboken jc serving poke acai smoothie combo tried smoothy always fresh filling delicious recent trip ordered first wave mix coconut milk cold brew banana cocoa coconut super interesting way different traditional green fruit smoothie plus gave jolt energy thanks cold brew big fish person really like several poke option different protein order bowl chicken tofu shrimp steak pulled pork guess make le poke healthy bowl whatever really next time return definitely trying always long line surprising looking forward returning
2018-07-05,2,good review made seem expecting flavorful bowl instead acai watery fruit seemed canned gotten exact bowl elsewhere tasted 10x better shaka bowl hopefully poke better
2018-07-04,1,love acai bowl huge fan acai ya later washington st live 8th madison extremely excited discovered place 100 foot doorstep however going back continue make drive across town washington st acai ya later use fresh fruit acai mix watery take granola coconut flake nutella expected thing ruin bowl shaka bowl fact n't use fresh fruit canned pineapple chunk really ruin please love god use fresh fruit come back simply convenience location
2018-06-26,3,rooting hobo rooting like literally giving experience mere 3 star running really late work place open going able service picky come smoothie bowl favorite place juice house hold every smoothie bowl place juice house standard le 5 minute order get food job soon walked pissed go work vibe chill felt like beach eating tiki bar something greeted smile hello everyone except cashier first time large menu need look making selection ordering process fast simple took order made 3 minute lying getting three star quick hell handed smile already bag napkin reason upset untruthful pitaya base 100 pitaya hate place make blend real thing note pitaya acai blend pitaya watery tasted like banana versus actual pitaya also lot coconut well disclosed concerned allergic anything would known understand pitaya expensive alot place make blend first place stretch product n't taste disappointed 16 oz bowl 9 dollar way overpriced would dine instead smoothie bowl would get poke bowl
2018-06-11,3,husband order poke bowl lot food option great every time literally every time order mix selection luckily n't food allergy sure check double check also paid extra premium topping n't receive good place need pay attention
2018-05-31,1,time ordered classic poke bowl today first time something n't taste right today puked brain
2018-05-27,5,love fruit bowl never really busy easy go grab something fast live close convenient boyfriend get quick summer snack
2018-05-24,3,place staple mine year 2-3x per week went one standard size bowl two different size option thing kinda fell idk different size fact literally different person making every time go making consistency virtually impossible got hooked first place used bowl er'time like russian-acai-roulette peace still love shaka different
2018-05-16,1,went first time today employee rude cashier straight laughed face could n't pronounce name told whats name first bowl banana nutella said dont know like sorry work rude decided walk bad customer service sad really want try n't know provide good costumer service work somewhere n't deal people simple
2018-05-10,4,decent smoothie bowl nothing special unique flavor pretty basic compared bowl past really like atmosphere though
2018-05-07,5,come everyday everyday twice day get detox smoothie spinach mango banana lime water delicious today first day got acai bowl never acai delicious pictured acai granola almond butter banana mango strawberry kid went nut 2 year old love detox drink almost one year old went nut acai bowl
2018-05-05,1,rude unprofessional disrespectful go place every weekend two time ordered oatmeal supposed come peanut butter n't added today ordered thing reminded put peanut butter whole bowl peanut butter anything else really go back give dry oatmeal even half banana unprofessional
2018-04-30,2,used love place gone downhill lot rice cold sauce really bland also raised price topping worth anymore sure n't continue previous operation wo n't returning
2018-04-29,4,love served frozen like place decently priced amount get
2018-04-26,5,really bad day got dinner spilled rice bowl eating outside went back told refilled free nice people food good
2018-04-25,3,use favorite midweek fruit bowl stop sad changed bowl fruit fell new plastic cup get generous portion size longer price stayed loved offered every fruit previously choose three fruit topping extra understand please bring old shaka bowl back fruit always fresh delicious
2018-04-18,5,five star hand place great good friend come almost every tuesday complaint reaaaaalllllllyyyyy expensive decided go jun macaron gelato get huge thing rolled ice cream 3 le acai pitaya bowl quite scrum-diddly-umptious regardless also poke bowl expensive absolutely delicious decor give laidback bohemian surfer vibe every time step store feel like movie soul surfer bethany hamilton back love toodles
2018-04-14,5,ordered molokai cacao w acai base omg yummy could n't finish added oatmeal next morning delicious go soon try poke bowl friendly staff place recommended co-worker right
2018-04-04,1,hate spicy food also eating meat currently ordered blackened shrimp labeled wasabi blackened shrimp instead price high bowl small n't spicy incredibly spicy bottle water cost almost 3 00 ugh unreasonable around fail
2018-04-04,5,ordered honi acai bowl amazing topping fresh atmosphere great simple taste hawaii east coast
2018-04-04,5,honestly first place ever tried acai bowl moved jersey city area never place made area live 20 minute away shaka bowl literally come almost every day acai pitaya bowl day head work ca n't understand negative review definitely dont think skimp fruit topping one regular bowl fill hour staff always super friendly welcoming keep place really clean boyfriend tried place first time yesterday went today probably pop sometime week thanks shaka bowl fueling new addiction
2018-04-01,1,super stingyyy fruit tinier ever portion small barely fruit even 1 full sliced strawberry horrible dont come anymore acai ya later way better lost customer front girl nice rest attitude whole time especially blonde girl
2018-03-31,2,sad say hate used come every day staff sooooooo rude customer acai extremely sour mediocre trust better place hoboken
2018-03-30,4,place great tried almost everything go spot although last time went felt poke bowl got smaller one worst thing poke place skimp ingredient n't huge difference definitely back friend love go breakfast become almost tradition overall great place unique meal smoothie
2018-03-17,5,shaka new green bowl spinach based pineapple banana bee polen honey oh absolutely delish
2018-03-05,4,fan shaka bowl since day opened yep waited long line get since moved hoboken tried many acai bowl none compare shaka bowl coworker life area every month brings one however noticed size bowl changed much smaller 17oz v 24oz yes nerd science experiment still delicious acai bowl ever satisfy craving keep feeling full good amount time said go shaka bowl
2018-03-02,5,love shaka bowl neighborhood always friendly service clean great healthy food option thank shaka
2018-02-25,5,great acai poke bowl new weekend lunch spot everything taste fresh bowl combo great five star
2018-02-17,5,work building stop smell good really cute place even though seems stop dine ambiance cute kinda put good mood owner nice answered question even though busy first time wanted oatmeal tried granola pitaya sp base first disappointed n't oatmeal turned pretty amazing filling also light somehow granola super tasty next day still craving oatmeal tried one pb banana good filling could n't even finish bowl saw poke bowl day today stopped try looked good make loved got grilled chicken avocado mango cilantro edamame crispy onion salad rice mixed wasabi teriyaki sauce think place better poke place hoboken le expensive get literally could n't finish bowl saved half think eat pretty normal portion say people could get two meal chose rice base plus totally make ton option one washington one chose tasted fresh amazing incidentally reward program signed good place might habit forming
2018-02-12,4,updating review previous time came back initial complaint friendliness promptness staff well management must addressed issue pleasant experience time since returning favorite kilauea brown white rice choice protein prefer ahi tuna carrot cabbage mandarin orange scallion jalapenos cilantro chopped peanut sesame weed wonton crips spicy peanut sauce sriracha gots little kick great quick access fast made thanks updating service
2018-01-31,2,loved shaka bowl since day opened used give generous mix-in protein etc past time noticed skimping mix-ins filling bowl much rice today went saw changed bowl according size 24 ounce def seem smaller deep enough paying almost 15 lunch bowl expect loaded full rice hardly good quantity fresh ingredient advertise needle say find another lunch spot sad see business take good skip critical piece staying consistent food
2018-01-23,3,recently discovered poke absolutely love typically order brown rice salad base tuna protein edamame avocado sweet fruit like pineapple mango coupled sesame seed crunchy noodle sweet spicy sauce today first time shaka bowl thought good-not-great compared hoboken spot visited multiple time makai washington overall dish tasty liked mandarin orange makai n't found price significantly higher fewer sauce choose additionally poke bowl ended watery bottom drowning dressing never happened makai definitely going keep poke kick opt makai instead
2018-01-18,5,great place right around corner coming breakfast pretty much every day last week usually get oatmeal smoothie staff super friendly service quick place calm relaxed atmosphere music always good
2018-01-02,2,great experience shaka bowl time visited 4 5 star last night got delivery first time really disappointed find frozen clump acai bowl never experience bought bowl in-store texture acai in-store always great sure due delivered know visit shaka bowl person get delivery conclusion delivered acai bowl 1 star acai bowl received store 4-5 star
2017-12-27,1,tried place first time yesterday never going back expensive little portion fish called dinner good
2017-12-22,5,good spot fair pricing really enjoyed bowl issue wish seating inside
2017-12-04,5,drive almost 45 minute come show amazing food
2017-11-27,4,place bomb diggity term pitaya bowl 10 get healthy refreshing bowl fruit nut topping desire unlimited topping although bowl may look small guaranteed make full worth money n't tried poke yet eventually get sometime future business need get reward program going entice customer return often
2017-11-24,3,obsessed place went 20 minute closing told already closed update closing time case
2017-11-23,5,slight premium place decent healthy food option usually order build bowl seafood protein rice abundant amount topping resulting meal pretty satisfying overall think food fairly average expensive hoboken however personally highly recommend smoothy plenty healthy nutritious innovative option satisfy people variety taste
2017-11-20,3,chicken teriyaki bowl tasty price needed better skimpy sauce included 4 small cube avocado would added moisture lieu sauce added extra avocado home
2017-11-03,5,really excited see new location opening washington street hoboken absolutely best spot poke acai well treat nitro coffee oatmeal bowl smoothy reason place best ingredient super fresh portion compatible price tried various place bowl hoboken place really best aside good aesthetic decor menu cutlery really go theme food important seasonal menu variation really cool make want continue coming try new thing really commend two owner young entrepreneur nailed successful timeless business
2017-10-28,4,good tasting fast service side far alllllll way monroe street hope washington street location open soon
2017-10-27,5,love shaka bowl addicted acai pitaya bowl also love poke bowl service great food always point owner staff friendly remember u every time come highly recommend
2017-10-22,2,ordered acai bowl disappointed base tasteless tasted like straight ice hint blueberry
2017-10-07,5,delicious nice healthy option like hoboken large portion food really good quality nice customer service husband back
2017-10-06,5,favorite neighborhood spot grab quick healthy dinner love ahi tuna shaka bowl service always point well guy add ginger cayenne juice shot menu
2017-09-16,3,seeing lot new poke spot opening hoboken excited see spot acai bowl place little tucked away compared shop washington st place clean adequate seating inside menu pretty expansive service quick house special ordered build bowl 14 brown rice zucchini noodle base fyi get zucchini noodle bowl going get soggy lot water sitting bottom ordered tuna avocado cucumber pickled onion scallion mango mix-ins topping ordered sesame seed crispy onion unlimited topping whch great went ponzu sauce overall biggest feedback need cut topping much finely eating difficult small plastic bowl also clunky first time experience poke bowl poke bowl meant resemble sushi hojpoj felt like someone roughly chopped veggie threw bowl raw fish n't feel genuine acai bowl 10 much better fresh acai juice instead frozen pre-packaged stuff biggie unlimited topping sensibly went every listed fruit cause got granola almond chia seed honey topping coming back acai bowl poke bowl better poke spot area n't expensive area
2017-09-05,1,glad updated store hour major online source made special trip 20 min way oh wait n't others close 9pm
