date,rating,review
2016-10-23,5,walking past shaka bowl excited see opened friend decided finally go last night dinner pleasantly surprised amazing got poke bowl muana kea pineapple bowl really delicious ingredient fresh flavor amazing quantity food pretty large took doggy bag home food amazing decor modern cool staff incredibly friendly knowledgable especially liked everything menu really healthy wait go back try smoothy acai bowl also got one cold brew cold brew lover must say one absolute best cold brew ever
2016-10-22,5,acai based molokai cacao bowl good 10 big enough share filling healthy nutritious also organic loved hoboken needed place could get healthy fun food great job
2016-10-21,5,honestly new favorite place hoboken ca n't get enough try super worth fulfilling wo n't regret
2016-10-21,5,went shaka bowl last night first time impressed absolutely making regular spot got pineapple day poke bowl fresh delicious filling fine 14 price given fresh raw fish ingredient get unlimited topping similar reviewer would bit worried serving raw fish lower price point staff super friendly took time explain ordering process food came quick within 2-3 minute ordering make great grab-and-go place back week try acai bowl smoothy maybe even another poke bowl great place neighborhood good luck shaka bowl
2016-10-20,5,man alive people harsh place open le week expect totally perfect well cater entirely personal need opening restaurant small feat especially place like hoboken involves raw fish take time get feel thing really appreciate owner trying something different healthy away sea mediocrity washington street n't usually review anything new operation made exception place principle friend went hour closing day opened ordered mauna kea kona fresh delicious maybe little much spicy shaka sauce kona good sauce think better go conservative give customer option request also n't crazy edamame kona something texture n't work might others got rice one brown one white hope eventually offer option mix green rice half half ask next time also really hope offer salmon future fair amount ingredient overall price tax come nearly 15 seems pricey something served plastic bowl hoboken raw fish often find hoboken expensive manhattan sure little suspicious place offering raw fish vegetable cheap staff nice attentive place clean cute left full happy satisfied plan return future poke stuff
2016-10-20,5,staff welcoming attentive food craving made exactly looking delivered aspect fresh quality food genuine staff experience n't even get started ambiance decor phenomenal would go back anytime
2016-10-20,5,place new go-to hoboken breakfast lunch dinner staff super-friendly place immaculate poke bowl build absolutely love never seen anywhere else food extremely fresh well since open past week gone everyday zero complaint tried everything menu love people complaining pricing realize normal pricing poke acai bowl anywhere northeast try cold brew coffee well good
2016-10-19,2,let start saying sure know poke guessing harder critic lived la prior hoboken poke typically raw tuna marinated soy sauce scallion sesame etc order two poke bowl smoothie ordered muana kea bowl boyfriend build bowl first thing noticed fish n't marinated soy based dressing making simply raw fish poke bill 38 two bowl pitaya smoothie bowl cost 14 smoothy 8 14 pretty steep size bowl amount actual fish product receive maybe spoiled southern california wish even give rice make appear like getting overall 14 pretty nut agree reviewer method build bowl awkward wait call back create bowl instead order assuming kink quickly alter two star cleanliness granted brand new business staff friendly return think thing quickly worked good luck shaka bowl
2016-10-19,5,poke bowl delicious got pineapple day bowl house favorite ahi tuna extremely fresh portion size perfect mix spicy shaka sauce shaka teriyaki sauce delicious mix-ins unlimited plus also got clean complexion smoothie tasted amazing refreshing atmosphere decor restaurant made feel like spending day beach staff friendly greeted soon walked door definitely grabbing lunch 3-4 day week felt extremely satisfied healthy eating poke bowl smoothie
2016-10-19,3,place definitely lot potential know opened seemed slightly chaotic wished set differently way order imagining like chipotle assembly line type process build bowl wind calling name pay turn build bowl wound waiting long time one employee acai bowl side acai bowl got fine think employee overwhelmed left two large frozen acai chunk bottom bowl pleasant want give another try poke bowl maybe logistics worked better
2016-10-18,5,mauna kea bowl brown rice delicious atmosphere great food fresh something everyone menu shaka bowl definitely great addition hoboken definitely going back trying acai bowl could hazardous bank account
2016-10-17,4,big fan poke bowl check spot ordered mauna kea bowl came ahi tuna avocado jalapenos mango creamy spicy sauce warm sticky rice choose brown rice green well far taste go good ingredient fresh complaint portion size also good comparable qdoba chipotle bowl gripe price total 15 bowl would expect pay maybe 12 something like probably come frequently due price distance washington st
2016-10-17,5,pineapple day poke bowl white rice base never leave review really like supporting small business hoboken especially great new food spot bowl really good flavor worked well together plenty food fill definitely back soon
