date,rating,review
2021-11-08,5,7 hr layover new jersey time leave airport get something eat decided try vito glad busy service great food even better
2021-10-11,5,loved vibe especially sandwich looked picture however feel really missed ordering roast beef mutz gravy instead gravy side think gravy mixed would really melted mozzarella cheese made sandwich even mouth watering
2021-09-27,4,first foremost cuban world parking issue local either know get around live close enough walk need business anyone coming town aware worth wait lucky get parking place legitimate italian everything italian cousin critique every place matter would validate place feel like man helped u lifer part experience offense given appreciate especially sure order n't like feeling rushed could go back might take time order get side item say little envious little lady got get true deli item real deli take home probable apartment n't quite exist thanks ginger z husband rec
2021-09-20,4,stopped way nyc seen place featured online tv wanted stop get lunch way city located nice recently updated street diagonal parking large sidewalk inside deli pretty small could overwhelming area would say possible familiarize menu n't stand looking menu board staff friendly enough overly pushy could smell town nice enough much stuff wanted try buy premise pasta sauce buy gotten well meatball salad cutlet etc etc ended getting smokey hero two type mutz mozzarella pesto spread tomato really good would liked spread though would come every time area try something new also brought mozzarella back week looking forward
2021-08-31,4,italian cuban hero enjoyable normal sandwich maybe 12 le exciting average cuban sandwich impressive component like pork loin sharp provolone anti-fusion vibe disappeared within second strange think might improved higher pickle ratio
2021-08-21,5,amazing amazing amazing sandwich matz must go visiting hoboken area
2021-08-20,3,mozzarella literally best nj fresh creamy sundered pepper delicious sopressato bland worth tripvito hero ok bread chewey place tiny 2 charge credit card15 cent bag
2021-08-08,5,eat vitos special everyday actually almost eat one everyday  great hero best mutz try go hour waiting line
2021-08-02,5,ca n't go wrong takeout classic italian deli opinion best mutz town ultra fresh smoked variety well tried chicken cutlet sandwich fresh mutz marinated pepper pesto spot especially perfectly crisp italian hoagie roll came soprano sandwich concept except switch chicken fresh hand cut italian meat also knocked ballpark everything good come
2021-07-20,5,vito italian sandwich sweet house made sweet pepper phenomenal top choice decade everything menu worth trying feel lucky neighborhood
2021-06-27,5,literally one best sub ever bread perfect soft turkey salami ham mozzarella sub delicious
2021-06-07,5,vito great reputation hoboken rightfully deserved time grab sandwich always impressed last weekend loyal customer forever tray sandwich catered party everyone raved delicious fresh sub customer service excellent well staff store took time pick best sub arrangement would work delivery time minute early little thing like go long way recommend vito enough thank vito team
2021-05-31,5,vito fresh mutz favorite vegetarian sandwich world mutz flavorable balance pesto roasted pepper masterful sorry say love n't ventured try rest authentic look though would think standard worth detour
2021-05-22,1,decent food awful service staff called ahead could pick sandwich 10 minute seems reasonable vitos kept telling wait 30 minute ordering phone would 5 minute order person furthermore said nobody in-person waiting would extra fast might seem logical small child adult think see see massive flaw reasoning woman phone proceeded get rude nasty reason treat customer like especially italian deli every two block hoboken vitos n't even best one ended getting delicious le expensive sandwich lisa people incrediably kind made 10 minute called ahead see vito hard losing customer n't treat well encourage staff treat customer like people accomodate request please get rid policy taking 30 minute prep order phone side note vito always closed half week along way treat customer guy need money scream front italian mob
2021-05-09,4,ca n't pas trip vito area huge completion year hoboken italian deli walk vito lot imported italian item well homemade normally come fresh mutz sandwich lot people come sandwich notice famous roast beef crowd favorite go lot customer ordering fresh mutz good well salted good texture way go vito
2021-04-29,5,review literally one asked constantly looking additional italian deli become dependent fiore apple apple 1 roast beef fiore flavor2 mozz vito softer feel fresher although smoked mozz option 3 delivery vito 4 accepts card vito 5 availability vito thursday saturday roast beef 6 brown gravy think split vito thicker like velvety brown gravy really hide fact roast beef essentially flavorless fiore loose like au ju chunk meat ton garlic neither sauce would go well others sandwich imo really determines mood order pro tip suggest get either gravy side 7 roasted red pepper fiore since house made full garlic popped jar 8 bread fiore choice either hero keizer vito softer hero n't thin vito win mozz hard admit fact fact also convenience side n't cash need delivery food always arrive hot weehawken portion great le messy overall matter someone happy able order time see consistency cold cut regular sandwich let real care
2021-04-28,5,got vito first time weekend sooner got vito hero chicken sorrentino delicious vito hero definitely going order also grabbed buffalo chicken pasta phenomenal n't pas
2021-04-25,5,favorite deli store hoboken say like roasted beef mutz gravy hero fiore available day really good selection sub service really friendly efficient also got nice freezer ton homemade ready-to-cook dish wait come back try thing menu
2021-04-16,5,stumbled across vito yelp looking source authentic antipasto making ship utah birthday surprise new italian son-in-law saw gift basket offered establishment looked packaged offered little vegan daughter called place talking danny found looking helpful deliver locally n't ship danny guided process arranging ups italian veggie cookie cannoli platter arrived today son-in-law said best mozzarella cannolis ever cannolis n't sweet example daughter raved artichoke heart veggie bed marinated arugula managed nail presentation item boxed shipping beyond everything beautifully contained pepperoni shaped like rose sure shipping expensive ups delivered refrigerated truck extraordinary personal service delicious food thank danny making special experience family
2021-04-09,5,never thought write review salad go stumbled upon restaurant pure luck grubhub diet wanted order salad absolutely delicious ordered vito house salad come mutz roasted pepper sundried tomato onion fresh plentiful salad one size enough two hand devoured entire thing honestly best mutz sundried tomato roasted pepper ever tasted asked crouton even great pretty sure homemade well done sangwhiches look ridiculous 100 trying immediate future hell diet
2021-03-06,4,obsessed place time time delicioso complaint get lil stressful small space busy time could add charm though also sometimes observe sure hygienic behind counter definitely reason remains hoboken staple though
2021-01-22,5,breaded chicken cutlet red pepper mutz balsamic vito favorite sandwich ever yes said amazing spot great selection pasta unbelievable plenty variety sauce necessity next sunday dinner best italian deli hoboken
2021-01-19,3,admit little disappointed chicken parm hero plenty chicken mozzarella cheese chicken n't seem like super fresh cutlet thick made hard eat never tried sandwich maybe give try better experience next time
2020-12-30,5,best deli hoboken ai n't even close happy hour special best deal ever come across best mozz town
2020-11-21,5,amazing dont even really like sandwich still loved favourite eggplant parm since im huge meat bf loved chicken cutlet
2020-11-17,1,ordered sandwich tea took forever get n't customer line long time waiting asked order waiting said name time saw make order poor customer service overpriced n't even satisfied food
2020-10-22,4,catering review recently ordered two platter catering great experience vito us site called ezcater basically like seamless catering process easy picked wanted chose pick-up time also opt delivery paid ahead time got vito order ready waiting ordered platter penne vodka chicken parm serving 8-10 people penne bit weird different sized penne mixed together still delicious nonetheless chicken parm n't best chicken parm still pretty good n't skimp mutz loved also give bread go food mean least entire loaf already cut convenience overall great experience price reasonable fact 15 20 cheaper comparable place hoboken
2020-10-11,5,love place go spot whenever mood mozz forget swedish meatball chain
2020-09-22,1,paid 17 00 stale prosciutto parma sandwich ice tea know everyone hurting covid-19 fair take advantage customer
2020-08-27,5,honest review could easily come one word wow amidst deli option hoboken hand best first foremost n't care anyone say best mutz mozzarella hoboken sorry fiore intended downplay good business guy real deal work citibank event employee decided work best deli town always got catering team christmas party owner son awesome asked could sandwich shape business name citi said would make happen employee bos people branch even came office visit heard got food vito business banker branch manager let tell place ran well produce good quality pasta salad delicious every sandwich tasted fresh could tell make food care could go want thank vito son danny professional making food make feel good hoboken check
2020-08-20,1,used love place beyond lax safety measure covid staff wearing mask properly also allow customer place without wearing mask disappointing done place good deli hoboken
2020-07-18,5,ca n't go wrong authentic italian eatswalk wait line get vibe picking sandwich pluck side two enjoying day
2020-07-05,5,ordered specialty sandwich vito never disappoint yesterday used vito catering service close family 4th july celebration omg everything outstanding baked ziti vito specialty salad chicken finger addition great food vito followed request salad dressing side extra tomato sauce side bread even provided plastic serving tongs family delighted quality food could n't happier thanks vito special attention wonderful delivery service please keep good work
2020-06-26,5,new england know italian friend real deal best grinder hoboken brought visitor month got way many time already good
2020-06-17,5,beyond thrilled find deliver weehawken got vito hero pictured best cold hero last year easily fresh mutz make still thinking also got roast beef fresh mutz pictured saving another lunch nice lady phone recommended hot roast beef eager try next time tip neighborhood delivery imo better deal takin light rail lyft total 34 definitely want order might become regular occurrence
2020-06-16,5,great sandwich fresh mutz sure check happy hero hour deal 5 50
2020-04-26,5,vito pinnacle sandwich making absolutely need try first time vitos real secret mix hot sweet banana pepper need request hot roast beef mutz gravy also outstanding stepping fiore toe usually 15 minute wait weekend well worth go sure check cool memorabilia around place
2020-03-14,5,great sandwich spot many menu option store mozzarella fresh service quick whenever get sandwich ca n't wait go back try something else sandwich better next
2020-01-24,5,place legit chicken cutlet prosciutto w fresh mozz roasted pepps go
2020-01-23,5,best italian deli hoboken literally ca n't go wrong anyone place sandwich die service great option drink choose even comprehend true old school nj italian deli best area
2020-01-09,5,n't inside ordered uber eats sandwich great caesar salad bet hoboken also uber eats one favorite place get delivery
2019-12-26,4,vito go-to deli hoboken countless time provide consistent high-quality sandwich every time accommodate favorite make sandwich chicken cutlet mutz ltm one turkey salami mutz ltm sandwich slightly smaller deli quality always top notch knocking star personally think deli lack pre-made side fan rice ball macaroni salad pesto mutz tomato salad etc addition sandwich hometown deli always many fresh side choose showcase wish would increase offering bit vito delicious high quality recommend
2019-12-19,5,looking good sandwich delivery place living jersey city height knew go soooooo good great quality meat mutz bread ordered uber eats delivery quick satisfying lunch
2019-12-17,5,one best best italian hero life fresh mozzarella amazing hot roast beef muzz unreal great great deli
2019-12-07,4,sandwich never disappoint catering order single sub always leave happy waiting next opportunity come back staff friendly helpful catering order may take bit line long sub order still recommend vito anyone looking delicious hearty sub love prosciutto breaded chicken sandwich also love olive tapenade delicious
2019-10-27,4,work hoboken decided get italian hero dinner mom delicious
2019-10-26,5,husband love look best italian deli tried several place amazing ordered fresh mozzarella different deli area never thought would find another place would like definitely best mozzarella jersey hat mozzarella roast beef sandwich trust say best town compared acclaimed one jersey back
2019-10-25,5,first vito experience important one needed great moving used online order option get lunch mover fate stuff hindering deli-ciousness fortunately hit chicken hero italian cuban hot hero chicken salad home-runs hungry crew order fast correct importantly crazy good hero made hero
2019-10-25,5,go school near never tried place one friend telling 5 50 special tuesday thursday 2-6 pm went right class got prosciutto mutz basic hero soooo worth money portion size big n't skim meat ingredient super fresh mozzarella sandwich delicious super soft went well sandwich also got balsamic glaze made everything taste even better alot seating two table outside business also take card small fee decide use credit card fee debit cash
2019-10-12,5,best fresh mutz ever fresh mozzarella best ever delicious sandwich side also tried swedish meatball incredible moist delicious thick sauce tried porcini mushroom penne today delicious creamy tried lobster crab cake today shell one little dry side would n't get everything delicious sell imported grocery italy favorite glass jar nutella hydrogenated oil stop try mutz wo n't find better prepare spoil taste bud usually buy pound time water today got 1 2lb always fast friendly service
2019-10-04,5,n't know could love deli got hoboken mom got chicken sorrentino panini grilled chicken loved sandiwches artichoke hoboken sandwich delicious everything else pesto eggplant mozz red pepper olive tapenade spread added ca n't wait go back bring home eggplant parm selling refrigerator also grocery like fresh dry pasta cooky cracker spread 5 5 perfect deli though seating would also great
2019-09-21,5,flawless classic new jersey deli travel world never find anything like italian deli hoboken give place shot
2019-09-02,4,place automatically get good review open sunday italian deli jersey city hoboken area closed came sunday labor day weekend buy last-minute ingredient pizza guy helping let sample pepperoni delicious spicy sopressata vito also pretty wide selection meat tomato cheese pasta name place kind small sure get pretty crowded n't let deter quality ingredient friendly service top-notch definitely come back ingredient might need sandwich heard much
2019-09-01,5,lot place claim authentic vito real deal mutz mozzarella fresh meat juicy delicious sandwich twice big price would manhattan much room sit eat within building physically waterfront back next time go hoboken
2019-06-09,5,best italian deli hoboken favorite ever freshest ingredient parma prosciutto mutz sandwich absolutely die food sandwich homemade pasta frozen dinner 5 star quality definitely recommend going spot hoboken
2019-06-03,4,vito default sandwich shop hoboken eaten many time lunch used catering larger group order never disappointed like best vito quality ingredient everything top notch really make flavorful food second offer true variety stuff order ton different sandwich lot different hot food salad definitely reason always line saturday
2019-06-02,5,best italian sandwich hoboken saying lot steep competition town classic vito sandwich always solid anything featuring house made mozzarella winner besides sandwich also sell great premade meal thing like chicken parm lasagna baked ziti come super handy lazy dinner night guy working place always super friendly warm always leave happier arrived
2019-06-01,5,okay go without saying hoboken strong deli game bring something deli counter sure want little extra magic vito spot sub fantastic fun name hot cold salad pasta mouthwatering ca n't get least two go sandwich order entire vito crew treat everyone like family genuine kind passion come every single time want hoboken finest pay vito visit n't settle anything le
2019-05-28,3,vito second best course next fiore best part vito delivers fiore far know vito better sandwich place hoboken cheese might better uptown washington sandwich vito better thanks
2019-05-20,5,great sandwich definitely get fresh mozzarella everything staff friendly helpful arrive takeout order prepared soon put order
2019-05-19,3,two sandwich soprano italian tuna good filling bread disappointingly doughy actually distracted quality ingredient might willing give vito another try doubt given many option nearby
2019-05-09,5,honestly vito sandwich best italian hero husband ever moving area brooklyn really missed access really good reliable old school italian sandwich shop vito satisfied craving far exceeded expectation recommend get sweet pepper flavor explosion
2019-05-04,5,fugetaboutit pal remember old school place mom dad took kid well place old school authentic italian charm keeping pace modern food expectation fast friendly deeeee-lish
2019-04-19,5,loved place came saturday around 11am crowded sure beat rush getting 2 sandwich early lunch also got italian bread ring love chili pepper frozen ravioli fresh pesto next day one ravioli actually made vito goat cheese meat one made another brand sandwich soprano prosciutto mozz red pepper accidentally put red pepper soprano instead spicy pepper honest mistake still amazing n't care sandwich normal size manageable compared deli area mozzarella die absolutely coming back
2019-04-13,4,one best deli around little hectic walk place might little crowded lot choose sell kind stuff cheese meat homemade prepared food frozen non frozen drink course sub tried sinatra put lot meat mozzarella sub trust need ask extra mozzarella mutz call freshly made believe go almost every single sub sell also put homemade olive spread sub added little extra flavor thing could improved taste bread wish little bit crunchier happy hour 2pm-6pm tuesday thursday definitely come back try sell certain sub 5 50 time would give 4 5 star
2019-04-13,5,n't vito deli hoboken run walk crawl whatever need get addition far basic hero also variety specialty one also many choice deli selection spread italian specialty good delicacy homemade marinara sauce chicken parm many great fresh mutz bombbbbbb yummmmm
2019-04-11,4,love place n't get authentic italian deli joint really great sandwich filling piled high great item deli case small section italian grocery place interesting hour double check open great spot lunch come chicken cutlet sandwich occasion wife love panini also great spot get ricotta salata easily top 5 favorite cheese list service decent quick usually line two move fast slow could pas however food always prepared care bound find something keep coming back
2019-04-10,5,awesome deli pricey side love deli sandwich great breakfast good also buffalo chicken pasta salad fire traditional stuffed rigatoni salad even better delivery go pick
2019-03-30,4,classic italian deli usuals expect asked chicken caprese n't menu offered right away make mutz chicken pesto tomato pressed great sandwich great customer service pleased negative long wait time one sandwich got one
2019-03-27,5,number one deli sandwich hoboken fresh mozzarella amazing sandwich large portion generous amount deli meat nice selection dinner shell chicken parm eggplant etc quick family meal
2019-03-02,5,time update review withdraw previous review happy report gotten sick since one incident 3 year ago go sandwich place normally order chicken cutlet mutz prosciutto mutz sandwich mutz always look daily counter special buffalo chicken pasta salad burrata favorite offered daily
2019-01-17,4,came right closed sunday little line always good sign although normally dont line starving waited classic nj deli fixing buffalo chicken pasta salad counter looked awesome definitely wanted guy ordered even gave bigger container ordered closing probably going waste great gesture appreciated sandwich got roast beef mutz hot gravy good ballpark fiores also tried smoked mozz sandwich smoked fresh mozz pesto didnt particularly care smoked mozz weird flavor didnt play well ingredient end vito hit spot food service definitely back recommend anyone
2018-12-10,5,oh goodness place saw place tv show waiting go four five year finally area got let tell well worth wait strangest thing hoboken parking slot seem backwards encouraging people back fine good n't bunch people behind seemed hurry tailgaiting jersey though got parked went deli smell unbelievable small place n't notice place eat outside cold anyway definitely table inside taking sandwich back connecticut anyway got smokey smoked mutz mozzarella pesto tomato fresh italian hoagie roll hour later still one best sandwich ever eaten kick buying like five bringing back la vega freeze eat later could go one right honestly everything looked good entire deli case behind counter take order truly epic deli case ever seen fact one worker wearing mets hat instead yankee hat enough give five star joking course plan jersey next october one first last stop trip getting extra sandwich area get place promise worth
2018-11-24,4,would give vito 5 quality food would give 2 seating one point constantly bother quality food everything well mutz every year ranked 1 hoboken say something city pride italian heritage
2018-11-09,5,great deli amazing food intimidating line go pretty quick friendly staff go 1-2 time week
2018-10-21,5,five star event catered u mozzarella salad chicken franchise cannoli shrimppasta awesome hosted 15 people brought everything organized manner george hope great help menu
2018-10-03,5,firm catered food vito amazing food right time hot delicious even kind enough include utensil serving whole bottle dressing salad everyone loved got second third thank vito ordering
2018-10-02,4,solid spot post activity sort hoboken area small seating area right outside deli 2 couch two chair coffee table got vito sandwich mutz fresh plentiful although sandwich bit pricey lack sustenance stuffed long time weekday happy hour special original sandwich 5 50 hour 2pm 6pm 6 95 20oz drink deal
2018-09-20,5,bought pasta tonight really good food authentically italian problem really expensive also close extremely early great place go italian grocery food
2018-09-02,4,one two spot absolutely must visit go hoboken one iconic place would shame pas make excellent turkey mutz sandwich bread firm outside soft inside mutz fresh flavorful bread turkey mutz tomato lettuce onion oil vinegar leave satisfied customer added couch outside enjoy sandwich since seating limited space inside price high sandwich 10 glad treat definitely come back
2018-08-20,5,great neighborhood deli like ambiance got vito parma prosciutto sandwich good saw somebody ordered eggplant platter look super delicious definitely come back
2018-08-18,4,sandwich huge got salami mutz sandwich breakfast ended eating whole day gave good amount food greasy cheese good expected come back try stuff next time
2018-07-30,5,literally amazing sandwich weekday 5 sub deal great love coming also always sooo nice friendly
2018-07-27,2,lived door away couple year smell great inside course sandwich one great one dry made incorrectly minute ago called simple pickup sandwich 45 minute wait pick-up come walk stand wait whole time make absolutely zero sense last two time wait young counter person get cell phone behind counter obviously issue food place sure food good yelp say live 256 foot away sure shame
2018-06-03,4,plenty good sandwich shop nyc vito hoboken joke suggested grabbing sandwich met folk hoboken prior departing ocean city md heard buzz place n't fiore yet list nonetheless yes told whatever get seemingly ca n't bad make sure sammich includes mozzarella generally die little inside hear referred muzz vito mozzarella delight grilled chicken pepper broccoli rabe balsamic glaze mustard goddamn delicious vito frill italian deli putting great muzz bangin sanguichs
2018-05-15,5,vito whoah oh oh oh best deli hoboken jersey city far tuna fish good order take rest home one daughter love much great bread awesome broccoli rabe delicious italian hero although build scratch rather order menu ham salami coppa provolone lto v oregano pepper smothered hot pepper use banana kind solid salad thing love consistency fifty time ordered office one bad meal happened today called tell courtesy asking anything let know little today love place much manager owner called back 15 minute later completely distraught wanting know exactly wrong n't angry generally cared product vito part old school put love food make every day order something vito order one roooooooaaaaddd
