date,rating,review
2012-03-06,5,n't every sandwich place hoboken vito best sandwich hand city fresh mozzarella sure top 2 hoboken fiorres guess throw lisa mix well line usually pretty long go sandwich around lunch time weekend n't expect speedy service sandwich made order rewarded waiting usually get rendition sandwich every time turkey fresh mozzarella lettuce tomato mayo hero bread always fresh great chewy crust said cold cut always sliced fresh order believe boar head product mean anything anyone marketing anything another great option choose sometimes chicken cutlet another good choice topped fresh veggie amazingly awesome fresh mozzarella hand cut large chunk put sandwich sandwich big jam goody back knife close vito offer number spread olive pesto dozen others put sandwich also panini large number varying salad rotating daily option got bean salad past weekend pretty darn tasty also offer number hot option including aroncini empanadas believe made fresh daily basis vito also decent looking selection frozen pasta made store dry good n't tried either one favorite option lunch weekend check
2012-03-04,4,good italian deli sandwich stacked never disappoint bread meat cheese fresh delicious definitely recommend
2012-02-25,5,seriously n't even like sandwich asked ideal lunch would sandwich would nowhere near yet vito may changed mind showed sandwich really could 8 95 received sandwich big head could easily two meal totally famished also glutton sandwich punishment bread crusty outside soft inside chicken well chicken good roasted red pepper flavorful mutz well wtf n't know call truly life-changing thinking get another sandwich soon definitely soon
2012-02-09,5,difference amazing sandwich perfect sandwich simple-minded palate give 5 star rating like charity vito italian deli actually worthy 5 star rating found perfect sandwich hoboken jersey pretty well known good sub idea would ever find place rival ny went pretty standard italian sandwich ordered one signature sandwich prosciutto de parma every single ingredient used flawless right bread place known mutz call fresh mozzarella hoboken ever mozzarella fancy italian restaurant well mutz use ten time better charge 8 50 huge sandwich get sandwich mutz trust n't slouch amount meat added either course top quality well also n't overdo oil vinegar like lot place establishment probably wo n't go wrong whatever order come come holy grail sandwich shop part torn write live nyc give credit credit due one people hype place live immediate vicinity rookie keep real great food around know seek find found place right defonte brooklyn yeah back
2012-02-07,5,vito never go wrong ever always swear eat half sammich save rest later honestly delicious put expect wait line staff friendly move quickly get eats maybe depends time day go bread best part whole sandwich really soft warm close second mutz good warning sandwich practically guaranteed induce food coma
2012-02-05,4,sandwich good however bread little hard taste sure vinegar oil soften time like dig right definitely come got ta walk around washington st little bread ready eat enjoy
2012-01-22,5,honestly n't vito sandwich 3 year today blissful reunion meeting hoboken placed order well ahead time delivered exactly needed baller status time decided branch try sinatra sandwich never actually year hey know like dare stupid beast consists sopressata salami sun dried tomato infamous vito fresh mozzarella choice spread went roasted garlic pepper yeahhhh buddy amazing blend flavor glad see quality sandwich decreased epic deliciousness ten buck monster sandwich count full meal probably wo n't need eat several hour yeah worth get yo as cousin vito scarf piece heaven
2012-01-09,4,best italian deli hoboken mile get hot capacola hot sopresetta chicken cutlet sun dried tomato muzz garlic spread macaroni salad solid well prepared wait 30 minute around lunch time
2011-12-12,5,aggghh miss mutz parma sooooooooooooooooooooo delicious ca n't wait go back
2011-12-09,4,parking hit miss hoboken n't let deter great sandwich perfected meat cheese ratio bread never seen neat either definition appropriate sandwich messy eat book sinatra included sopressata salami mozzarella sun dried tomato pesto spread choice homemade spread great sandwich best mutz ever eaten far boy always enjoys roast beef mutz gravy look forward trying menu staff friendly helpful efficient work well lunch rush
2011-11-17,4,c'mon vito people mecca sub hoboken place unassuming small soon inside overwhelmed feeling small italian deli huge selection sub faviorate smoked mozzarella peppered ham pesto spread like stated place small enter packed service super fast great staff live hoboken visiting must-go-place doubt
2011-11-13,4,people often compare vito fiore yes italian deli hoboken similarity end went fiore asked half ingredient vito would probably punch face vito nice whole wheat wrap veggie want good line long sandwich slinger fast another plus open sunday
2011-10-10,5,bangin deli seriously tried numerous sandwich bomb homemade muzz phenom bread great compliment sandwich quality cold cut used side quality well price reasonable reason seems quality italian deli boken compared part nyc hey area either biancamano
2011-10-09,4,hoboken seems like mecca italian sub sandwich find anything looking style bunch place go stand others vito one really good deli hoboken go wrong wide variety food choice mainly come get italian sub fix day different choice sub order one specialty sandwich create ordered roast beef mutz gravy thought good bread warm soft roast beef pretty good quality none hard chew stuff mutz also pretty good gravy topped typing making crave another one shop big deli really matter issue lunch time rush get little hectic crowded people order wait sandwich would say door five ten minute top staff extremely friendly helpful answer question overall gave vito four star delicious sub good quality sub friendly staff small italian deli feel suggest anyone northern end hoboken looking good sub
2011-09-24,5,love place quite small crowded stand line order counter make everything order quite specialty sandwich well ordered parma prosciutto hoboken sandwich good dry olive spread delicious make mozzarella call mutz must bread long french bread-like roll quantity great price awesome sandwich amazing
2011-09-24,4,great place need italian sub fix let show size sandwich order make nice fresh muzz every sandwich chalkcboard muzz little robotic sandwich provolone guy started put fresh muzz remembered couple outdoor seat good fall day find good place take nap watch football sandwich
2011-09-15,5,vito one several amazing deli located hoboken others p fiore great italian sandwich made awesome brick oven bread daily hot food special also good salad great especially antipasto salad mutz good tried item top quality staff great
2011-09-13,5,busy unsuccessful day looking apartment hoboken needed get quick bite eat stumbled upon place ordered soprano sandwich sandwich awesome really good meat quality employee helpful great place
2011-09-08,5,vito amazing fresh mutz sooo good come pretty much every sandwich menu fave chicken sorentino grilled chicken mutz proscuit eggplant optional garlic spread great bunch different spread choose garlic roasted red pepper etc portion big usually eat half save half later super busy saturday sunday 11am-3pm try call order btw recently rather wait line sometimes go door picked order sandwich missing mutz called apologized immediately asked could give mutz side said would slice right could pick whenever live nearby showed 5 min ready huge portion apologized considering crazy busy weekend forgiveable handled nicely
2011-08-15,4,cousin found place yelp find shared two different sandwich def left over delicious mutz freshest tasted area semi complaint bread little harder like def recommend place must mutz
2011-06-12,5,easy give vito 5 star far favorite italian deli hoboken usually get thing turkey pepperoni mutz work perfect amount everything italian bread amazing mutz delicious think trump fiore know know people n't agree like better hot roast beef mutz order compare fiore friend mine think fiore beat vito sammie regular sub vito
2011-06-08,4,excellent sandwich mozzarella number time small complaint little pricey side sandwich approaching 10
2011-06-06,5,vito hoagie italian cuban panini absolutely fantastic seriously best sandwich ever
2011-06-05,4,outstanding n't gone another deli hoboken 12 year one bad one good sure give tip buck get order dude deserve
2011-03-15,5,love place fresh mutz best usually try get something special menu everything awesome sandwich huge could easily split one save half later
2011-03-01,5,go 5 star pretty easily mainly going rank deli tri state area win overall place make sandwich perfectly actually understand cut bread way eat n't spill side n't anything overly creative ingredient first rate execution perfect sandwich made otherwise say first rate mutz prompt service delicious food recommendation vito italian combo basically legit top bottom fact default mozz sandwich show know whats go deli nyc put thick sliced american cheese sub gross place drizzle oil vinegar also us lettuce went meat slicer stringy crunchy always hate eating sandwich entire lettuce piece fall eat driving texting somehow get messy custom steal itchicken cutlet sandwich provolone balsamic glaze bruschetta lettuce unreal meat tender perfect cant cutlet taste like muzz roast beef good fiores better hate fiores freak invention food ca n't explain unless eat think mozz milker meat tender vito roast beef still trump 99 establishment ive area nice way saying 2nd best
2011-01-15,5,place make best grinder world mozzarella prosciutto sandwich best must stop
2011-01-12,4,good deli compare place fiore deli adam street walk drive extra block washington street go fiore one best sandwich nj
2011-01-04,4,place much deli seriously sandwich awesome mozzarella amazing cut thick slice sandwich sub price reasonable n't hoboken deli one def one favs
2010-10-29,5,great stuff ordered sigma sandwich yesterday pretty damn delicious everything perfect amount meat cheese pepper seasoning fantastic pricey 10 sandwich completely worth splurge lunch totally recommend place fellow hoboken-ers appetite try ever area walk away happy full
2010-10-26,5,vito idea sandwich could taste good ordered vito hero sock knocked combination fresh mutz sweet pepper fresh bread lettuce tomato meat melded perfect symphony mouth much wanted eat could finish half sandwich amount deliciousness get price reasonable life vito hard n't know ever look sandwich way vito always tastebud
2010-09-22,5,good price good food good deli go-to stop jet giant game grab bite food always fresh made order good pricing seal deal ca n't really beat deli hoboken
2010-05-30,5,thanks fellow yelpers gave vito try today lunch better imagined fiore delicious vito would 1 pick two vito hero hot pepper burst deliciousness mouth think reasonably priced big sandwich n't skimp meet mutz one complaining price service helpful friendly enjoyed sitting outside eating hero red umbrella outdoor area really nice would n't expect deli seating definitely plus ca n't wait go back
2010-05-18,2,ordered fresh mozzarella tomato italian vito sub sandwich mozzarella made expected felt like got supermarket mushy expensive charge pound something like italian sub good bad expensive would order sandwich skip appetizer
2010-04-22,4,without getting much detail pick 17 sandwich hungry people stevens tech since nearest old school italian deli hoboken decided come place looked like modernized version fiore constantly long line match staff friendy acccomodatin sheer selection item second none although sandwich acclaim everyone got one stick commenting got got special mixed grilled veggie eggplant red yellow pepper zucchini portobello mushroms homemade mozzarella tomato lettuce onion garlic spread also added homemade roast beef bread far best part delicious perfect sandwich mozzarella great quite good fiore better lisa roast beef veggie could better however grilled gave generic smoky flavor obscured normal flavor also went light veggie also saw one order placed regular veggie special great sandwich best even hoboken definitely worth special detour
2010-04-06,5,customer vito 16 year one best italian deli hoboken friendly service dedicated staff employee even vito assist every need huge fan london broil mozzarella also ca n't get enough tricolored tortellini pasta salad vito hero must try new customer classic italian hero vito signature homemade mozzarella mutz classic hoboken fresh roll downside vito get busy weekend line door lunch rush saturday sunday large order always call ahead deliver found delivery take 45 minute hour often worth wait
2010-03-14,4,amazing food great price amazing painfull wait place good line door almost every hour weekend place really amazing homemade mutz fresh mozzarella real way made quality deli meat bread italian grocery slice benny going sandwhich vitos day always work well thing n't line good thing come wait especially behind yenta huge bedazzled bag hit nut everytime line move got ta get pastrami
2010-02-21,5,say lunch washington street vito sweet pepper fav try different spread well worth every bite oh one last thing tend get salad lunch pasta salad marinated mushroom great line n't worry worth wait
2010-02-16,5,really one sandwich soprano best deli sandwich ever mutz cold cut amazing garlic paste used soooooooooooooo good
2010-02-09,5,hand best sub ever come across fresh mozzarella outstanding service good price reasonable
2010-01-12,5,place make proud italian best cold sandwich hoboken great bread tasty italian import primary supplier nutella college year go stevens
2009-12-20,4,weekend used vito cater 100 person party elk lodge course working catering menu food delivery deposit return handled expertly staff attentive working menu u food excellent received great response party goer delivery right time even though delivered active party n't even notice staff going job placing tray lighting sterno definitely use
2009-10-17,5,fantastic sandwich amazing fresh mozarella make sure get football start sunday vito close crew catch game great neighborhood touch slightly inconvenient
2009-09-13,3,understand everyone love vito fact overpriced compared italian deli option hoboken fiore lisa luca brasi thought chicken mozz mozz better luca fiore lisa spinach good 9 95 half sandwich retarded give credit creative menu deli around hoboken price still high
2009-07-31,5,must vito everyday senior year college ca n't find deli like anywhere else amazing roasted pepper spread great sandwich place far way better deli area also staff great try get lunch hour bc seen line door several occasion
2009-03-18,3,first thing first came free mozz bother fancy sandwich etc bottom line fiore better much better
2009-03-08,5,authentic good went couple time get lunch sandwich roll could n't contain moz roast beef think ended eating second half dinner sure whether like vito fiore better
2009-03-08,4,like said coming back sat night midtown stopped vito w couple friend grab proper breakfast line long stood behind young man hairiest neck ever saw dressed like leprechaun old italian gentleman w hairest earlobe ever saw purchase 140 dollar worth mutz sub long wait worth though b c proclaiming vito best chicken cutlet sandwich eva
2009-03-02,4,mmm meat though peter graciously blessed u ticket ny wine expo last sunday bit concerned following equation noontime drinking empty stomach bad math however right entering peter whisper seductively ear got something baby flick wrist spun around main floor javitz center threw bench looked dead eye growled d'ya think handle know first time point got really nervous standing sitting position first thing came mind many talent bella donna subsequent misdemeanor receive committing inappropriate act public sunday afternoon le sensing anticipation subtly gestured towards bag hand every heaving exhalation chest slowly love pulled 12 inch pure italian meat hoagie vito two exact original virginal innocent overflowing succulent ham tangy salami creamy homemade mutz jersey speak mozzarella fresh lettuce tomato yet dripping fresh extra virgin olive oil briny vinegar oregano pickled sweet pepper however soprano went downright dirty jerzey taste bud violating tender ham spicy cappicola creamy homemade mutz original combined peppery homemade garlic spread sweet pepper crusty italian bread eyelid flutter gawd good belief mutual pleasure devoured 6 inch respective sub masticating side side moaning loudly good never satisfied full sandwich please note vito quisnos subway even old-school blimpie food porn form hero got lifetime subscription review based solely take-out best believe stopping next stay boken
2009-03-02,5,quick awesome service guy hot sandwich amazing lol need say
2009-02-24,5,great sandwich possibly best hoboken go sat morning expect line worth wait anything gotten simply great make sure try different spread sandwich little pricey compared fast food option like subway excellent choice nonetheless
2009-02-05,4,great deli fresh meat creative sandwich pile meat high extremely hard finish even half sandwich mozzarella good nothing compared fiore definitely authentic italian deli except fact call mozzarella mutz absolutely drive italian roommate bonkers
2008-08-31,5,dear friend steven deli lover made get sandwich said best mozzarella tri-state area line going door got sandwich damn good
2008-07-05,5,vitos everything expect truly authentic italian deli hoboken meat fresh especially prosciutto melt mouth vitos also known fresh mozzarella commonly refer muzz great place grab sandwich italian combo sausage pepper etc order fresh meat cheese gripe open late
2008-03-12,5,guy work happy speedy everything imagine guido look like haha day pre-st paddy day celebration took vito special hot pepper buffalo mozzarella sooooooo good bread bit hard eat bench washington everyone walked watched unsuccessfully bite softer roll would make sammich much better ill settle hard roll close early random hour make sure get time feed need
