date,rating,review
2018-04-03,4,absolutely phenomenal italian sandwich alive early 20th century imagine would eaten lunch classic deli sandwich made quality ingredient authentic n't indoor seating would nice least one table something still one best option part town lunch
2018-03-23,2,unfortunately giving rating food ordered chicken wrap bacon hot sauce mayo chicken cold felt dumped half jug buffallo sauce barely could eat without mouth fire barely mayo plus charged nearly 12 wrap manhattan cost 9+tax food 1 star nice atmosphere customer service great pleasant people judging food personality
2018-03-13,5,excellent italian cuban bad thing forgot take picture sooo delicious thanks vito
2018-02-26,5,best overall option sandwich around food ca n't miss anybody visiting need check go wrong choice
2018-02-17,4,wow stopped grab sandwich happy hour 2-6pm week discount basic sandwich 5 95 grabbed turkey mutz sandwich huge filled mozzarella chunk hot sauce turkey fresh mozzarella great texture taste bread fresh crunchy expected italian deli also picked box italian chocolate cooky 6-7 limited shame devoured like 2 day would stop midtown hoboken p charge 3 surplus credit card debit card cash hand
2018-02-11,2,really sure place high review went sunday afternoon pick two sandwich ended getting pepperoni provolone sandwich turkey mozzarella course add topping lettuce tomato etc also ended getting 2 italian ball forgot correct name place way priced 30 dollar average sandwich alright ball top waiting like half hour idk decided gon na stay wait disappointed returning many mouth watering deli better sandwich around point paying waiting something worth time money
2018-01-03,5,donald trump may look like cheetosand pie may taste much better fritosmichaels may talented titosbut sandwich better vito'sthe best way may still carlito'secuador may quito'sthat serial killer may cut three toesbut sandwich better vito'sthe u may still misuse u n veto'sand least mexican chip may dorito'si may suck men mosquitosbut sandwich better vito'sme brother may well still bro'sgirls may love thick torpedoesalmost big inflated egosbut sandwich better vito'sfuggedaboutit owned vito corleone vito one top 5 italian deli united state also one top 5 hoboken sound weird testament good deli vito one faves make truly delicious tasty sandwich guy work real italian jersey guy also really cool sandwich off-the-charts spectacular get better vito sandwich may others town good town deli said may little pricey vito perfect absolutely love sandwich try another really great thing vito put kind delicious veggie dressing sandwich deli n't fresh mozzarella amazing would expect hoboken simply must try vito hey met youand crazybut number jersey number corleone maybe let tell secret best italian deli world new york city hometown whateversville missouri italy france although damn good sh forget long island sorry chicago nope best italian deli world hoboken jersey city yes true n't ask 5 spot ho-broken vying title world best italian deli ca n't decide 5 best people taken differing opinion although one thing agree 4 n't exist one remaining would best world good 5 fran andrea salumeria p biancamano vito fiore going 5 fave longest time gun head pick one pick 5 selling point 5 good deli area fresh mozzarella mean fresh fresh literally fresh like still gooey warm squidy made absolute heaven imported meat best best bread seasoning incomparable ca n't get better sandwich come try ruined italian deli everywhere forever traditional italian sandwich nothing ever compare hoboken vitout ado let sign review peter gabriel hit song vito original song one important song ever youtube com watch v=luvp original lyricsazlyrics com lyric pete september 17hoboken weather fineit lunchtime usualin area code 201oh vito vito vito'soh vito vito vito'smutzarella mutzarellathe sandwich deadthe sandwich deadwhen try sleep nighti dream breadthe outside world mutz whitewith roasted red pepper redoh vito vito vito'soh vito vito vito'smutzarella mutzarellathe sandwich deadthe sandwich deadyou gobble half subbut ca n't eat entireonce mutz begin digestthe appetite expireoh vito vito vito'soh vito vito vito'smutzarella mutzarellathe sandwich deadthe sandwich deadand eye yelp watching nowand mouth yelp salivating
2017-12-13,5,lot italian deli north jersey vito far one best mozz hand absolute best get full sub saturday morning half morning half dinner
2017-12-03,4,went vitos-italian-deli-hoboken last night amazing place great restaurant
2017-11-26,5,think vito super neat-omakes sense guess make seem like speaking nonsense prosciutto mozzarel sandwich ya zzzzz seriously though ca n't go wrong sandwich fresh mozzarella a1
2017-11-16,5,oh vito love thee staple italian deli heart hoboken place always packed reason literally everything make good salad sandwich hot food special made day staff always ready greet smile execute italian delicacy choice art form pricey get great bang buck sandwich definitely last 2 meal go salad great place highly recommend
2017-10-29,5,best sandwich hoboken hand wish open later n't rush get work
2017-10-18,5,best hoagy hero town went hour mani next door n't wait 5 minute sandwich opted vito hero basically italian deli carry assorted array italian snack includes pizelle vanilla wafer portion generous bread soft even order one 3 afternoon like hero good one back home philly maybe even better
2017-09-29,2,food good customer service attitude bad went pointed hero sandwich board 10 99 asked get half one sandwich said sure ready said 10 99 plus tax questioned said n't make half sandwich showed large roll cut sandwich suggested mentioned ordered half sandwich dismissed completely need bit common sense dealing customer
2017-09-17,5,know want move fast staff friendly helpful quick also love open sunday good mutz deli n't plenty option choose got italian cuban soprano mozzarella delicious really generous much mutz give bread really good bit hard stuff sandwich bunch ingredient loved pepper garlic spread soprano go well ham hot cappi cuban favorite pork loin ham pickle garlic mayo ooey gooey provolone definitely want come back try side nice cozy outdoor seating area
2017-09-11,5,never anything le mouthwatering vito friend family back philly actually send muzz burrata order know heading back way ordered large cheese tray christmas could fed army army super happy chowing delicious cheese christmas eve even happier n't attempt cook anything jarred sauce happily welcomed home even standard italian fiance known homemade sauce entire life go sandwich half day work spends day salivating future order call ahead order place bumpin day last thing want waiting 45 minute exaggerating wait time vito hoboken staple muzz preference always
2017-08-27,4,mozzarella mutz really good bread used sandwich bit hard next time think go panini version got veggie mutz portobello roasted red tomato grilled eggplant veggie n't bad mutz truly star definitely ask side hot pepper make world difference also bring cash 3 99 charge credit card
2017-08-25,5,could give deli 5 star would upstate ny visiting best hero ever life top awesome food customer service super friendly great place would n't change thing thank great experience
2017-08-20,5,n't write ton review felt compelled recognize outstanding crew vito always make feel like family go extra step let appreciate business smile often crowded hectic never take inordinate amount time order always right nice support local business truly deserves
2017-08-16,4,love cuban sandwich little skeptical ordering italian cuban sandwich recommended mutz festival delightful satisfying thought price little steep bread good vito skimp ingredient took half home delish five hour later
2017-07-21,5,place real deal italian always appreciate place keep traditional got good ordered bag full food headed central park picnic friend
2017-07-12,2,buffalo chicken sandwich ordinary chicken bland chewy would definitely get sandwich next time
2017-07-08,1,place worth hype ridiculously overpriced ordered chicken cutlet sandwich broccoli rabe hero came single thin piece chicken 11 70 seriously place half portion anywhere else hoboken double price luca brasi blow place water never return
2017-06-23,5,love love love place grew hoboken eating fiore biancamonos sure never really tried vito month ago obsessed first sandwich n't skimpy like fiore crazy gigantic like biancamanos right like main go sandwich fresh mozz roasted red pepper balsamic drizzle sandwich pair kettle chip omg addicted
2017-06-19,5,place real deal italian hero fresh especially homemade mutz bread incredible bought bunch dish serve father day every loved
2017-06-08,5,easy review delicious food best sandwich really nice staff great breakfast
2017-05-28,4,daughter picked sandwich macaroni salad dine sandwich big nice bread good quality cold cut macaroni salad ok nothing spectacular nice italian sandwich
2017-05-04,5,absolutely love vito happened italian deli town boston visiting friend moved west village hoboken find line long small space usually get quickly regardless worth wait roast beef sub amazing bread nice crusty portion generous waiting line enticed jar homemade roasted garlic marinara bought one try unbelievable subsequent trip stock multiple jar use home gift done voted best mutz homemade mozzarella hoboken mutz fest sometimes lucky enough get sample wait make sure get sandwich take home
2017-03-23,5,chicago accidentally ended last time area thank lucky star god delivered gem deli life mutz outta world customer service great five star definitely making pilgrimage back sooner rather later
2017-03-20,4,another fantastic italian sandwich shop deli centrally located part washington street hoboken parking next impossible area plenty option choose ingredient fresh delicious get authentic jersey hoboken italian deli experience mozzarella delicious though take issue fact sign crown best mozzarella hoboken p hoboken muzzfest competition last several year solid deli 1 hoboken
2017-03-08,5,seriously best italian deli town wo n't go wrong stopping always end buying eat stand waiting line getting hungrier hungrier thing display cabinet always amazingly fresh veggie
2017-03-08,5,really ca n't say anything negative first time vito brother life hoboken introduced mr c hot roast beef mutz brown gravy made wish got whole one cut third share eye roll also introduced first cannoli heavenly decadent really satisfied one even though tempted half dozen fast forward today made happy hour brings price sub significantly around 3pm two customer everyone helped quickly efficiently waiting two hot roast beef mutz brown gravy making mistake sharing one time casual conversation gentleman goatee damn forgot ask name mentioned california loved sandwich cannolis nice generous included delicious cannoli house excellent sandwich excellent staff sure continue visit vito every time come visit recommend visitor area
2017-03-06,5,want say much wife enjoyed delicious sandwich got prosciutto mutz roasted pepper got grilled veggie mutz delicious ample sandwich highly recommend order advance especially saturday line looked incredibly long avoided
2017-02-22,4,great sandwich tried many never bad one florence lace cooky good ate whole container cooky one day
2017-01-29,5,place one favorite place italian sub tried many sub amazing love fresh mutz guy behind counter always friendly time line place move pretty fast love vito
2017-01-15,5,simply best nothing like turkey mutz weekend afternoon worth line every time
2016-12-09,4,get roast beef mozzarella sandwich grilled veggie top super generous sandwich taste great minor gripe bread use really hard bite chew could use little salt last one personal preference
2016-10-30,5,best hero hoboken staff always friendly n't skimp topping vegetarian veggie available hero best thing ever cheese selection best ca n't wait explore delicious menu highly recommend
2016-10-19,5,absolutely delicious moved weehawken told try vitos gave try best sandwich mozzarella ever return every week
2016-10-08,5,godbless vitos everything staff touch gold favorite include italian hero cuban always amazing side well like broccoli rabe buffalo chicken pasta salad expensive lunch good expensive worth vitos worth
2016-10-08,4,great food price getting hand sandwich easily go 10 ea vito need appreciate inflation low several year price need reflect often long wait also add damper good sandwich
2016-10-05,5,man think might put place frans fiore hot roast beef w gravy hoagie world bread perfectly soft hold form roast beef tender go perfectly gravy top fresh mutz amazing soft melty delightful sammy italian cuban delicious well get either two sandwich ca n't go wrong
2016-09-03,4,best deli hoboken whether looking hot food cold salad sub place go swedish meatball macaroni cheese great staff also extremely friendly gave 4 star delivery sometimes little slow food well worth wait
2016-08-27,5,one best italian sub ever top amazing customer service definitely ordering
2016-08-11,5,love italian deli sandwich began thankful introduced young age frustrated many place never compare since best pure simple whatever want spot legendary
2016-07-31,3,ordered first time today woke super hungover obviously first instinct fatty sub decided create sub ordered chicken cutlet prosciutto mozz pesto spread sundried tomato spread tomato welcome get drink chip also deliver since one sandwich together came 20 little pricey know finally arrived could n't unwrap fast enough saw grilled chicken cutlet pretty much almost teared going let go till looked sandwich see muzz regular sundried tomato instead spread one ever call complain food 20 buck muzz cutlet woman super nice said would send new one immediately thank goodness second one arrived get grilled chicken second time instead cutlet point eating anyway sandwich bomb take star away two wrong delivery definitely back next time might best pick
2016-07-22,5,best fresh mozzarella planet hand bunch award hoboken definitely deserve sandwich killer also make amazing arancini rice ball dream pasta salad everyone work friendly helpful quick nice outdoor seating area get busy lunch time prepared wait come earlier whenever back town stop get little bit everything bring home u mouth watering
2016-07-18,5,amazing sandwich place get pretty packed prepared line definitely worth wait make sure get fresh mozz die huge selection sandwich side plenty go item e dessert homemade jarred sauced etc indoor seating limited outdoor seating front definitely returning soon
2016-07-16,5,new hoboken never vito nearby trying order sandwich door shop run ingredient took walk stumbled upon vito walked knew real deal started study menu could n't decide get guess looked new great guy behind counter said hi asked ever told new hoboken welcomed told must try mutz brought plate delicious fresh amazing mozzarella ever eaten helped pick sandwich floored size great price happy hour deal took sandwich go ate outside apartment first bite amazed best sandwich ive ever bread delicious meat veg crisp tasty dressing spice point live hoboken area n't need go anywhere else get sub place perfect going back thank vitos
2016-07-14,5,great sandwich love folk work always pleasant deal quick get order ready vito always stop u friend come visit
2016-05-18,5,amazing sandwich try sinatra wo n't regret service little confusing due small space large number costumer lunch time little bit patience rewarded tasty food
2016-05-10,4,great delithe sandwich always enough put hearty piece mutz never skimp meat either
2016-04-28,5,vito sub mozz killer friendly quick service enough said
2016-04-24,3,moved hoboken somewhat recently really wanting check place pretty decent line sunday afternoon moved promptly service quick plenty option get great old school vibe decided try version italian sub vito hero ingredient fresh tasty part thing really lacking sub concrete bread use also fact use italian dressing instead oil vinegar pretty lame decided stick menu ask adjustment regret def try place ordering something new maybe another option roll bread
2016-04-18,5,sunday indulgence sure probably best italian deli hoboken downside delivery time order time call phone best bet go store order
2016-04-14,3,vito italian another entrant already crowded italian deli lineup hoboken feature right biancamano frannie popular lunch joint get early otherwise stuck line vito differs little bit offer one sandwich particular day like thursday strictly tuna sandwich day sandwich available course get pasta time want sandwich aware sandwich menu however due lack selection n't reach height competitor
2016-02-27,4,vito sandwich joke bite italian classic take good way plenty selection choose always default ham salami cappy style sandwich mutz pepper wish bread tad bit softer always delicious every often buy pound mutz devour addictive little pricey addictive also vast selection italian specialty item line shelf store ever need rich balsamic spot
2016-02-16,5,visiting chicago looking quick snack heading dinner came across place saw sign went right realizing gem place first reading chalkboard menu seeing mutz ingredient embarrassed ask heck mutz clearly must great ingredient everything even saw flag washington st advertising mutz festival deli also sold various salad jarred pasta sauce cooky nothing gave clue mutz finally pick sandwich italian cuban chip drink place eat took back hotel room examining sandwich variety meat cheese condiment could figure mutz sandwich delicious fresh ingredient tasty still could n't figure part mutz bread wrapped day later visiting family bronx asked new mutz still answer discussion figure muuutzarrella oh goodness love traveling always learning experiencing new thing
2016-02-15,5,chicken cutlet roasted pepper extra balsamic hero vito closest f'ing thing magic ever seen 100 10 every one friend made vito staple visit hoboken
2016-02-09,5,food absolutely amazing order often especially lunch hour customer service also really good looking forward going back
2016-02-06,5,place best prosciutto di parma mozzarella sandwich hoboken n't know already really go try
2016-01-17,4,hungry solid sandwich yelped nearby deli vito came rather high step front entrance desperately looking way maneuver stroller one worker saw struggling came rescue menu plenty option spotted prosciutto mutz ordered yummy good brought family back month later ordered thing believe secret though line weekend quite long even placed order took 10 minute sandwich made
2016-01-17,5,bacon egg cheese never compare prosciutto egg breakfast sandwich favor get fresh mozzarella honestly cure everything life eating sandwich good borderline disrespectful
2016-01-14,5,tried fresh muzz two month ago four year rut really delicious stuff two item give 20 second head buzz eating o-toro taro sushi brooklyn prepared owner sano muzz vito talking tongue point head better whippits drawback need finish one day loses taste texture soon sometimes cover evoo help somewhat actually compliment salt bath evoo buttery rather grassy look forward trying made order burratta
2016-01-03,4,really enjoyed vito tried vito traditional sub packed meat mozzarella say though taste pretty bland overall wanted hot pepper loaded banana pepper kick near satisfying biased place street p deli much better italian sub out-weights vito sub scale dollar overall 4 star still italian sub nj top 5 category definitely worth try another sub
2015-12-27,5,great selection sandwich side thanks teaching mutz italian grinder taste like place outstanding grab takeout lunch n't mind wait
2015-12-23,5,place great definitely favorite sandwich place town chicken sorrentino possibly perfect hero although sinatra pretty awesome roast beef mozzarella n't know great ca n't go wrong
2015-12-20,2,place really good food loyal customer hoboken resident however come take delivery awful customer service tell 2 hour wait delivery try call order pick tell hour wait today got hung trying order go order said n't time take order big catering order hung much love food vito refuse give business disappointed
2015-12-18,5,deal without di parma get regular prosciutto pricey watch line slow service busy time order ahead time holiday football sunday nothing compare fresh mozzarella love smokey garden state plain prosciutto mozzarella long stem artichoke always great vito favorite italian deli hoboken trust
2015-12-03,1,despite decent food occasional stale bread service terrible third time messed charging order specify every aspect order n't give expensive option without asking example ask chicken get chicken cutlet instead plain grilled chicken happy hour sandwich supposed 4 n't give discount asked afterwards made quick excuse rudely rushed phone last time order better going lisa deli 9th park food better staff n't try swindle
2015-11-29,1,given place many chance due location however men working always use hand make sandwich glove even glove one hand make sandwich hand without glove pretty gross considering likely due wash hand priced dirty sandwich
2015-11-05,5,sandwich good got turkey fresh mozzarella yummy also picked thing olive bar along stuffed pepper artichoke looked amazing
2015-10-31,5,people incredibly cool work best italian sub long time vito bust
2015-10-27,5,come mozzarella leave hero hero huge generous meat portion bread act perfect vessel soft hard mozzarella perfection love sinatra soprano hero awesome staff others noted service excellent considering always line door vito life hype
2015-10-24,5,amazing mozzarella best mozzarella basil tomato sandwich excellent quick friendly service definitely come back
2015-10-14,5,vito quite possibly best italian deli nj fresh mozzarella best ever tried warm meal delicious reasonably priced chicken marsala particularly good best thing vito specialty sandwich meat delicious mozz always fresh glorious get soprano add prosciutto lil balsamic best sandwich ever eaten try thank later
2015-09-26,5,always looking quality quick breakfast hoboken finally found place actually real egg perfect portion size quick service 9:30am saturday impressive definitely back
2015-09-18,5,vito italian deli best fresh mozzarella ever wonder voted best mozz hoboken soft light texture great flavor perfectly balanced way mozz walked store super friendly staff unison yelled oklahoma told proceeded tell award get year year mozzarella sandwich every helpful friendly prepare simple mozzarella salami basil garlic spread hero even though ingredient definitely one best sandwich ever life piled high salami also n't skimp mozzarella also grabbed different stuffed pepper pound great mozz bread go cheese great snack simply olive oil salt pepper bread cracker month still dream delicious sandwich make back sure next visit jc ever sure stop grab one specialty number already prepared dinner entree place great glad found
2015-09-10,4,get meatball review based alone amazing amazing downside place weird hour close early etc
2015-08-28,4,sinatra hero excellent flavor mutz apparently mozzarella awesome make fresh bread little tough maybe used type bread overall enjoyed sandwich
2015-08-21,4,homemade lobster ravioli vodka sauce make worth drive certainly n't skimp filling ravioli lobster sauce always fresh best red sauce well vodka sauce good red sauce fan general
2015-08-10,4,love sandwich fresh mozz n't order delivery waiting long time always long line worth also outdoor seating nice
2015-08-06,5,stopped sandwich enjoyed much full disclosure come b c p closed glad decor typical italian deli hoboken small waiting area counter full delicious meat cheese menu ca n't miss everything could want sandwich stayed ate sitting one outside table nice bathroom doubt one customer staff everyone friendly accommodating food sandwich classic italian hero fantastic right size say big fixing tasty served hard bread prefer soft n't think ask soft fault also bag chip water value n't spend 10 solid really good value dollar huge fan vito certainly back future still think p king vito close second book
2015-08-05,5,second time eating vito two day finally decided give try ca n't stop parma prosciutto die pesto artichoke basil oil vinegar oregano favorite sandwich date food delicious people friendly great service everything made order show highly recommend place anyone come hoboken
2015-07-05,4,oh vito know way heart mutz good fresh rubbery mutz premium cheese premium place ordering bit challenge let pay order 100 ready n't rush busy offer apps customer make want two hero keeping going back new experience long stay open would suggest option toast bread make le tough offer softer bread get messy ripping apart bread juice fly place large selection oil vinegar italian delicacy sale multiple award best mutz town say place rest drop ask special day know disappointed weather nice sure sit patio front people watching eating best mutz town life
2015-06-19,5,hoboken fell love moved town go school year later still pleased every time go great sandwich fresh mozzarella truly treat taste bud
2015-06-17,5,rave best best sandwich massive hero award-winning mozzarella astounding hot dish imported italian goody ca n't find anywhere except italy daily special salad pesto sauce olive spread dried tomato spread top notch catering great service great value yum
2015-06-17,4,authentic old school original one-of-a-kind try roast beef sandwich special wednesday delicious
2015-06-02,5,deli real deal ordered turkey mutz sandwich pesto to-go ate path train wanted exclaim good fellow rider probably already knew speed scarfing reside brooklyn deli lurk every corner deli sandwich good graham avenue meat deli williamsburg super fresh super tasty super simple perfectly full
