date,rating,review
2015-05-20,4,italian deli hoboken pretty solid read great thing mozzarella sandwich give test-drive good wow definitely good much going small deli hard focus meat cheese bread sauce wine pasta hard focus definitely great place stop sandwich even get ingredient go home cook feast four star
2015-05-07,5,place amazing past friday ordered 6 foot sub 100 wing le 24 hour needed delivered mayweather fight arrived exactly said would everything great still eating sub today next day good arrived first time ordering vito definitely last
2015-05-03,5,wow place truly life hype sandwich delicious fresh mutz hero fresh mozzarella roasted pepper basil italian dressing world good seating limited parking hard find worth
2015-04-08,5,wow 0 complaint amazing customer service amazing bread amazing meat course amazing mutz n't really need say
2015-04-07,5,delicious friendly turkey meatball parmagiana fantastic 10 star place really delicious wish eating area would n't drive hot sandwich 3 mile go worth every penny great seasoning great bread perfect amount marinera truly hoboken gem
2015-03-26,5,ordered hot roast beef sandwich fresh mozzarella delish also ordered macaroni salad also fantastic loved atmosphere people working nice lot different choice choose price point pricy mean good classic italian food
2015-03-14,5,better mozzarella anywhere considering another deli fuggedaboutit vito best taken mozzarella tour hoboken tried 5 famous spot none hold candle warm salt briny buttery melt mouth perfectly addictive mozzarella vito churn fresh 4 time daily loved vito year 28 year exact grew hoboken spoiled mozzarella live tn find anything even remotely resembles vito cheese fair hoboken true hobokenites eat vito mozzarella n't matter long line wait mozzarella salt brined wet warm roasted red pepper sundried tomato light drizzle balsamic vinegar sandwich getting sandwich life every time like first dom bakery provides bread also like vito perfect cry mozzarella good worth flight tn worth ship overnight 2 day express
2015-03-12,5,classic classic hoboken vibrant storefront awning resembling italian flag food go wrong fresh mutz hero guarantee great experience almost every single time make sure call 1 1 2 hr ahead time want delivery
2015-03-04,5,best deli hoboken folk work including namesake real nice make sure get want line beast n't go football sunday eaten twenty time never disappointed
2015-02-16,5,came recommendation friend boy happy got garden state spinach broccoli rabe garlic mutz amazing literally best thing ever vegetable fresh garlic spread mutz point heavenly also got piece chicken cutlet plain side also tasty folk super friendly made everything quickly highly recommend tip nowhere sit eat saw know order eat elsewhere place
2014-12-31,4,ordered parma prosciutto hot roast beef hero waited line 25 minute everyone friendly mutz unbelievable hero delish think fave wad parma prosciutto
2014-12-19,5,surprised place n't review hand one favorite deli sandwich broccoli rabe fresh noodle could go nothing n't amazing
2014-12-01,4,work weehawken nj frequently order vito yet disappoint mutz always super fresh sandwich portion extra generous favorite include pressed panini grilled chicken fresh mutz spinach roasted red pepper balsamic vinegar another made-to-order hero time chicken cutlet mozzarella avocado garlic spread sun dried tomato like italian deli get opportunity eat vito definitely recommend
2014-11-29,5,favorite mine 90 attended stevens tech living virginia since graduation nineteen year later wife 4 kid area stopped sandwich hard pressed find restaurant could keep quality long time vito disappoint great bread kind get new jersey new york silky smooth mutz made fresh daily salty goodness prosciutto parma yum delicious death row given last meal brainer prosciutto mutz vito get one meal hoboken go vito
2014-11-08,3,ordered rock mutz-iano panini surprised find white sauce seemed like horse radish n't clear strong flavor panini completely masked called find woman answered n't know sauce asked confirm apparently n't aware internet reference menu including site lacked detail pissed one obnoxious flavor omit mistake sure though even include n't fit flavor profile offered make another delivery n't want make come back one sandwich picked different sandwich beforewhich solid overall much difference place 3-4 similar spot hoboken
2014-10-24,3,staff vito nice food fresh taste good ca n't say best ever bit pricey crazy come lunch time
2014-10-21,5,think vito make best mutz hoboken honor go fiore however vito still excellent deli separate vito fiore lisa two outstanding italian deli town unlike others vito several legit vegetarian hero option favorite garden state
2014-10-12,5,best mutz hoboken hand one best deli area service always great despite long line vito staff always make feel home never time n't stop ever hoboken
2014-10-10,2,vito let talk mozzarella barely even noticeable sandwich ordered prosciutto di parma mozzarella nothing else italian way excited devour almighty sandwich fell short reasons:1 bread typical italian deli tear gum apart bread soft rectangle-ish yellow whereas used long pointy brown crispy bread sammiches 2 mozzarella barely noticeable sandwich fresh homemade mozzarella supposed warm juicy milky taste like nothing 3 paid 14 50 sandwich snapplethe prosciutto tad salty sure exactly parma considering bright red browner color parma prosciutto either way taste good wo n't go back although nice market selling packaged italian food novelty go elsewhere strongly recommend p biancamano deli block uptown best mozzarella hoboken want great mozzarella go giovanni secaucus buon appetito
2014-09-15,5,love place come specialized italian item cook cheese pasta meat condimentsetc usually get anything mutz fresh mozzarella favorite sandwich though hand parma proscuitto fresh mozzarella garlic spread eat two although one large enough eat lunch dinner
2014-09-13,5,best north jersey get mutz salted even bettereverything great priced like rest hoboken
2014-09-03,5,many time one life sandwich stand would take time post vito right stuff love craft sandwich artfully done huge case authentic italian meat serving artist tool must go hoboken resident visitor 5 star
2014-09-02,4,mutz say rare eatery life hype mean really could possibly amazing deli sandwich case everything went staple hoboken nj one famous artisan crafted hero sub staff friendly even offered nice piece freshly made mozzarella mutz try prepared sandwich everything menu look good hade sinatra homemade garlic spread roasted red pepper delicious also assortment non-sandwich goody mood something different place great definitely worth visit city
2014-08-19,5,one best deli ever sinatra hero favorite italian meat huge slab fresh mozzarella cheese hero big make meal definitely spot eating hoboken
2014-08-19,1,stay away come purchased 5 10 coupon livingsocial vitos right expired last week went visit vitos use closed week long vacation opening deli back coupon expired suspicious right thinking honor coupon following week since closed establishment full week without warning well case would honor 5 paid coupon disappointing since go vitos time without coupon fault could n't use coupon expired since closed deli honored coupon instead throwing fuss used stupid 5 put plus little b c wanted get sandwich get never come spend penny tell friend family coworkers anyone else listen hoboken jersey city new york city never come instead recommend going fiores adam st p biancamano washington even tony bologna first better sandwich anyway dare pull fast one customer like absolutely respect customer yes used livingsocial coupon also forget customer like come vitos many time without one way retain customer vitos learn retention marketing maybe also get lesson customer service never eat
2014-08-09,5,one best deli fast friendly food killer order mutz ie mozzarella wo n't regret boyfriend ordered turkey sandwich mutz tomato lettuce really good think next time order something italian like meatball prosciutto sandwich still tasty though bit pricey 11 well worth ca n't wait come back try thing
2014-07-25,1,would reasonable give 3 average disappointment service v food nah mad went yesterday work pick sandwich roast beef+mutz gravy parma prosciutto roast beef sandwich delicious shared gf given wrong prosciutto sandwich found late tried calling already closed understand mistake happen know guy front ordered prosciutto+mutz+pesto sauce cost 1 le fan pesto really upset minor mistake called morning opened see would apologize compensate giving wrong sandwich got laugh face hahaha funny even money principle behind handled situation even though 11 sandwich rather excessive compared deli area 1 nothing ca n't tell excited parma prosciutto huge let ok done venting wo n't back
2014-07-15,4,wow mozzarella faboulous eaten got vito loved flavor service friendly went extra mile make tourist atl feel welcomed walk counter seating perfect go lunch
2014-07-10,5,one favorite place eat absolute best mozzarella make love prosciutto mutz hero ravioli fridge walk sometimes get chicken parm hero amazing also funny friendly despite tight space often crowded
2014-06-28,3,got turkey cheese sandwich 8 95 roll 10-12 inch long enough two meal sandwich good service bit rushed service system disorganized long standing establishment think would kind clearly labeled line system worked enter see one line right another spattering people left sort look like line well unclear stand ordered go want quickly grab packaged item go line wait take 10 minute serve 5 people 5 people working behind counter finally got end line right discovered line ordering sandwich told man would like turkey provolone cheese sandwich whole wheat bread lettuce tomato onion mustard oil mayo asked wanted vinegar oil found strange told please oil mayo said put sandwich told asked repeat order opened sandwich white bread ok understand busy strange also would nice cashier hustled little everyone else around constantly motion stare ahead proactive trying assist people either waiting line looking confused side note bit gruff phone tried order sandwich 8:30 phone half hour posted opening time man answered said lady know opened tried place order good food questionable care customer
2014-06-18,5,vito sandwich delicious make sure ready wait line worth sandwich also good vito sandwich best far
2014-06-09,5,loved vito perfect nj italian deli vito helping customer making sure everyone taken care got fresh mutz smoke mutz good
2014-05-28,3,food pretty good delivery inconsistent today called order 4:50 stop delivering 5 told delivery guy already left
2014-05-25,5,place nearly 5 star review good reason food absolutely chart bread cheese advertised best hoboken possibly best part place vito could n't ask nicer guy
2014-05-22,5,best fresh mozzarella nice place good selection breakfast offering well
2014-05-04,5,sandwich mozzarella cheese sun-dried tomato arugula balsamic soooo good best mozzarella long time
2014-04-22,5,one best deli ever granted irish italian well versed experienced come deli hard pressed name deli would league vito really want try something classic italian hoagie pa would waste time know would missing sorry like like review another cool thing place couple dude raider fan like see rocking silver black cap sunday like believe get extra slice two ham something common bond probably plus big flat screen staring face nfl game sunday n't miss beat satisfying sunday afternoon craving nursing sunday afternoon hangover ben stiller say oscar winning remake starsky hutch hit vito
2014-04-19,5,absolute favorite place hoboken service spectacular sub ridiculous long line reason worth wait would eat every day girlfriend would let
2014-04-15,5,quality fresh muz italian sandwich fresh bread nice hot pepper spread thinly cut meat place must anyone visiting hoboken guy behind counter friendly line move quickly great italian deli
2014-04-06,5,landed ewr headed straight vito roast beef sandwich mutz gravy one word awesome
2014-03-24,5,vito fantastic new area looking good italian pork store far best spot area homemade mozzarella sandwich highly recommended get early though always line good reason
2014-03-18,5,amazing experience anytime get something eat
2014-03-10,5,wow wow wow thought true italian deli came mozzarella die bread amazing roasted red pepper better one italy prosciutto still drooling write review put 4 simple ingredient together best sandwich ever eat actually ate slow wanted savor every bite thought luca brasi good vito spot dreaming next sandwich
2014-02-26,2,ugh place basically ruined super bowl sunday crazy review line place super high expectation firstly better mozzarella local shitty market mozzarella rubbery tasteless also n't impressed bread hero also pretty tasteless hard prefer semolina least seeded hero bread thought cold cut n't great either super disappointed
2014-01-26,5,best deli hoboken vito hero far favorite lunch hoboken bread perfect fresh mutz amazing culcuts always fresh highly recommended
2014-01-25,5,upper echelon deli hoboken opinion top 3 sure n't long time result meager attempt stay healthy indicative pure awesomeness place term mutz premiere league like great deli hoboken complimented fresh high quality bread meat vito like place signature sandwich picky order whatever like split time regard want make easy get signature sandwich soprano freaking great also like hoboken deli find great italian cooking ingredient goody see shoprite p
2014-01-19,5,stumbled vito amazed good sandwich guess lucky find vito return every time visit hoboken place every city delicious
2013-11-26,5,one sandwich six word roast beef sandwich fresh mozzarella bread soft perfect vessel delicious creation right amount gravy muz creamy delicious roast beef perfectly seasoned mouth watering write review highly recommend one tip though make sure deli open go tried going one monday excited find vito closed monday make mistake enjoy
2013-11-24,4,n't get hoboken much go least two place never tried since place bookmarked block away amanda brunch knew try definitely must try neighborhood wife probably could spent lot time looking italian grocery frozen pasta item told like kid candy store line long moved pretty quickly sunday afternoon knew order ready got front counter many option came two sub imported parma prosciutto fresh mutz basil italian dressing sub smoked turkey fresh mutz roasted pepper balsamic vinegar brought home u dinner place old school italian deli everything imagine aged cheese salad featured espn fanwiches food network also best mozzarella hoboken contest
2013-11-08,5,amazing chicken sorentino buffalo chicken sandwich
2013-11-07,3,used like vito lot experience kind exasperating food excellent worth dealing disorderly line unavailability item bad hour high price many people behind counter long wait make sense shame least deli small town
2013-10-29,3,food 5 star service 1 star average 3 separate instance customer service person cash register driven nut part nothing guy make sandwich 1 refused let use debit card 9 purchase even though used go 2 3 time week understand 10 minimum really bust chop dollar charge 10 cash understandable blow mind next time went person ridiculousness tell sorry last time regular n't done said problem take 1 today order received chuckle charged full price 2 never charge amount order mild pet peeve 3 day week went afternoon get sandwich apparently used special deal sub mid afternoon go get rung person made sandwich tell person cash register give special price responded 3 minute early proceeded ring full price really bad c book left without paying come back 5 minute later befuddled paid left needle say still go vito every amazing sub near volume used
2013-09-06,5,got parma meatball huge sandwich good neat little place could tell local favorite noticed employee addressed many customer name come hungry great little park block away near water take away great view ny skyline
2013-08-25,5,mutz must delicious ever specialty sandwich amazing grab sandwich walk waterfront bam perfect afternoon
2013-08-12,4,love fresh mutz amazing extremely filling could eat half gripe bread hard still amazing
2013-08-03,4,place great fresh mozz great loved got smoked turkey fresh mozz roasted pepper pesto soooooo good gon na eat half sandwich ate whole thing staff friendly helpful prefer place fiores go deli hoboken must try reason n't give five b c think bit pricey also seating outside want eat
2013-07-29,5,went last week discovered amazing italian bologna called mortadella delicious def changing regular plain bologna mortadella
2013-07-13,5,one favorite sandwich place world think pretty much sandwich come mozzarella fantastic hot roast beef one favorite
2013-07-05,5,get vito garlic spread hot pepper amazing
2013-07-01,4,4 5 star second fiore deli hero vito ridiculously good bread fresh meat prosciutto mortadella delicious excellent quality inside deli actually really nice imported italian food place nicest part really clean bright chalkboard menu awesome touch little tough read losing eyesight 29 service aka guy gal making sandwich behind counter pretty good despite long line outdoor seating area great people watching downside kind expensive hero cost 10 buck guess get pay take credit card order 10 buck back whenever uptown
2013-06-28,5,experienced vito first time love wonderful deli everyone inside friendly especially vito cousin checked table outside offered bring napkin shelf stocked authentic italian product many recognized month italy prosciutto mozzarella sandwich sun-dried tomato oil vinegar huge divine absolutely come back next time hoboken
2013-06-27,5,friendly filling fast describe whenever go end getting call 16 sandwich proscuitto mutz brocolli rabe sun dried tomato pretty pretty great
2013-06-05,5,vito 4 1 2 star could n't disappoint tried going long business complaint would price food hoboken risen vito deservedly one local institution made hoboken desirable first place
2013-05-13,4,best proscuitto fresh mutz big fan worth wait
2013-05-06,4,vitos pretty good would probably go lot cheaper could accept duckbill anyways everytime go come happy usually get feel like eating likely sub chip creme soda
2013-04-09,4,obviously vito pretty freakin good sister life hoboken stopped pick thing bought fresh mutz mutz point good pretty stringy tasted incredibly fresh also sampled one vegetable slider sandwich made sitting behind counter good fresh veggie tasted great even bread nice fresh envious people living hoboken many great italian deli stop get fill great stuff vito definitely
2013-03-09,5,great sandwich good salad pasta salad enjoy rice ball underrated also good ravioli sauce available time something get playoff super bowl chili mac cheese sooooo good
2013-02-26,5,upon entering vito two word whoa noms start salivate looking around inconspicuous little deli outside appear house much oh oh much discovered inside amazed sheer amount italian-deli-crap make every italian deli jealous currently present home-made pasta freezer twenty different variety italian chocolate candy licorice fresh bread deli meat shake stick fresh muzz sandwich meatball-mozzarella-marinara-daily special delight consumed firstly 20 second drive take get deli transit secondly train home thing absolutely beast like hold two hand still quite fit shove mouth foul know get mind gutter enjoyed came saw ate passed mozzarella meatball heaven god dayum lovely companion mine kind enough share bite one basil artichoke red pepper mozz sangwich divine vegetarian therefore healthy even though size lurch dome-piece nom nom nom nom
2013-02-22,5,fairly certain heave made mostly vito mutz serious sandwich coco banana complaint weird hour
2013-02-21,5,buddy mozzarella get together last night absolutely fantastic great flavor high quality come mozzarella cheese huge difference everyday supermarket average deli stuff comparison vito like night day stuff amazing sandwich delicious well great old school classic italian north jersey ny deli high quality product
2013-02-02,5,wait line well worth everything perfect make sandwich care truly take pride
2013-01-25,4,eaten vito time really make high quality italian sandwich little heavy ham liking hot roast beef one best
2013-01-21,5,dare find better sandwich parma proscuitto fresh mozzarella garlic spread vito make best melt mouth mozzarella hoboken
2013-01-12,4,great sandwich would recommend chicken parm usually exclusive tuesday keep mind closed monday 10 minimum card
2013-01-12,4,say first time came disappointed well redeemed fan got hoboken grilled eggplant fresh mutz artichoke roasted red pepper balsamic hero got whole wheat hero could feel like healthy delicious looking forward going back maybe trying something else although knowing probably get thing
2012-12-21,4,last day nj stopped got vito special drove sinatra street road ave sandwich good service good salami salty big sandwich ate mutz side mutz good nice way end trip
2012-12-13,4,live directly across street vito thus vito intake quite high would expect upscale italian deli sandwich excellent high quality ingredient around staff cool yet disappointed want large flavorful sub albeit upper end price scale wont leave unsatisfied
2012-10-12,5,operate heavy machinery consuming vito special love place sandwich alone sure make thing really well probably never know like ten inch hero roll scoop bread top fit component sandwich got prosciutto ham capocolla lettuce tomato hot sweet vinegar pepper course 1 2 inch thick house made hoboken muuuuttzz delicious
2012-10-02,5,one simply describe vito vito phenomenon force nature collection mutziest fresh mutz perfect sub anything everything italian delicious n't know want check chalkboard left pick best sandwich ever 10 n't favorite tremendous also buy hot food like chicken parm purchase italian goody imported across sea people learn system one line ordering wait sandwich pay respect system live hoboken work uptown vito yet leave join u one u one u
2012-08-20,4,awesome deli new favorite hoboken meat tasty mozzarella fresh service fast also like hot pepper shooter 3 different kind want go back try dish lived uptown would probably frequent deli often
2012-08-20,3,done place sandwich gotten smaller expensive today sent sandwich mutz charge 8 95 little sandwich forget one thing allegedly famous time time order screwed never make right vitos many italian deli area reliable food good way overpriced getting smaller
2012-08-02,4,vito make amazing sandwich tried vito fresh mozzarella delicious ca n't wait go back try different signature sandwich try wheat roll
2012-07-19,5,usually go vito sandwich perfection high quality fresh-slced meat homemade mutz awesome bread sometimes remember also wonderful daily italian food special son visiting got 3 dish share lasagna sausage-and-peppers veal parmesan yumm yumm yumm
2012-06-30,5,best deli ive ever toif want mozz head road little p baincomo fiores best
2012-06-19,5,amazing mutz fresh bread great meat mozzarella perfect old school place old school vibe usually line go pretty quick great place
2012-06-18,5,lot amazing sandwich think favorite hot roast beef motz italian cuban panini also pretty incredible n't miss place
2012-06-13,5,great place great food line go quick guy behind counter know usually get thing need experiment know like roast beef mutz roasted red pepper
2012-06-04,4,n't go often usually long line long wait surprising sandwich good addition deli meat also different kind grilled chicken prepared balsalmic buffalo etc grilled vegetable also kind gourmet side spread etc course excellent mutz soft almost buttery n't load sandwich much p biancamano sandwich also bit expensive vito take bit gourmet approach wonder popular long
2012-05-31,5,going call best deserves 5-stars excellent bread compliment high quality ingredient consistent delicious great italian deli hoboken would disservice least try vitos
2012-04-27,5,another superb lunch vito honestly say vito w hot pepper perfect friday lunch fresh mutz great meat perfectly prepared going vito 20 year tried sandwich salad prepared food everything menu never disappointed nothing better getting warm fresh mutz snacking top great food guy behind counter always friendly smile laugh even line snaked door hoboken fawn reality star stop vito happier
2012-04-27,4,really like deli hard find good deli around one one keep list normally line please prepared wait bit getting served place sit eat order run basically deli sandwich really good salad fresh looking good hero place go
2012-03-25,3,vito good deli unfortunately located hoboken probably rank 4th overall better option make going unlikely unless close want mix thing said steven duck sandwich good recommend mutz also tasty ca n't really good wrong make sandwich long throw mutz
