2015-01-03,3,I had such high hopes for this place. Who doesn't like a good tapas joint? Four of us sat outback in their outdoor space on a cold January evening and were nice and warm and toasty thanks to their heat lamps! Our waitress came to take our drink order (never caught her name) and I was immediately feeling rushed to order by her. We placed an order for a warm truffle mozzarella and some bruschetta. I was BLOWN AWAY to learn that the bruschetta was $3....per piece. $12 for bruschetta? I mean some restaurants put it on the table for free. Seemed a bit steep considering the tomatoes were hardly seasoned. The crab poppers were actually a crab popper...singular. And it was just a run of the mill lonely crab cake. The eggplant dish was delicious. The Bolognese fries were the only dish I felt we actually got our money's worth of. What is this? A center for ants?I would definitely recommend sampling some of the pizzas. We did the truffle pizza which could have had some more truffle oil on it if you ask me. The Salami Picante, burrata, shishito peppers, mozzarella pizza was my favorite. I could have eaten the entire thing. Their wine list is reasonable but their dessert menu is lacking....considering they don't serve any dessert. I don't feel the need to go back uptown to visit again.
2015-01-02,3,Have been to Bin 14 many of times.  Never had a bad experience there, but haven't had an "out of this world" one either.  The staff is friendly, knowledgeable and very helpful when making a wine selection or looking to pair food with wine.Always enjoy going later in the evening after the dinner crowd left and you're not sitting on top of each other.  You'll probably wind up spending more then you think you're going to, but it's kind of to be expected when going to a wine bar like this one.Overall, it's a solid wine bar with a great selection.
2014-12-20,1,My fiance and I have been here several times before and were looking for another great evening.  We arrived at around 6:20 and waited close to 10  minutes sfor the hostess who was on the phone.  When we decided to seat ourselves the hostess finally came over and said that all of the tables were reserved.  At this point there was only table occupied in the entire restaurant.  We have always loved going here and Anthony Davids but the  hostess was rude and we will think twice about going back.
2014-12-18,4,The lobster bruschetta is literally amazing. I really want to check out their pasta but it seems that they only have it on their dinner menu. Will try to find some time to try that soon.
2014-12-11,5,I randomly stopped here on a late Sunday afternoon for a drink and sat the bar.  The bartender was super nice and I told him I wanted to try a new beer and told him what kinds I like.  What he recommended was excellent, I think it was called la bionda.  I also tried one of their pizzas (the one with the pork belly) and that was amazing as well.  Definitely have to go back and try more stuff!  Everyone raves about this place and I definitely had a good first experience!
2014-11-16,4,I like this place because the bartenders and staff are well versed with pairing their wine selection with their menu. They have a cheese plate option where you can select 2-3 different cheeses that you may like. Whether you choose the wine first and ask for a cheese to compliment or the cheese first with a wine to tie it all together, they always seem to give very good advice.
2014-11-11,3,Went here for dinner. Great atmosphere. Lovely heated back patio, perfect for out anniversary dinner. Private and more calm outside, a little loud and hectic inside.Very knowledgeable waiter who is very helpful with suggestions. Portions are very small but perfect for ordering multiple dishes and sharing. Not impressed with the entrees.Its nice that Hoboken has an upscale winebar but its certainly a place to go to for winelovers not so much foodies. AND they do not offer dessert!
2014-11-07,4,Great level of sophistication and atmosphere here!My cousin and I each had a flight (1 red & 1 white) to start suggested by our waiter based on our wine preferences. The waiter was very knowledgeable about what they had to offer, which was very impressive for the extensive wine list. He also knew a lot about the food, which was also delicious. We shared a few of the small plates, none of which were left with any scraps. My only recommendation was the waitstaff alert the customers of the prices related to ordering a flight and any glasses thereafter. My cousin ended up choosing a $15 glass and had 3 of them so the bill was a lot higher than we expected.My boyfriend later joined, and had the gluten-free pizza which was great! That's a big plus for us looking for GF-friendly dining experiences. Great place for just catching up with friends/family over a few drinks and an appetizer or even a full 3-course  meal.
2014-10-29,5,Fantastic food, great ambiance, great wine menu.  They are very busy and popular.  But they always make an effort to accommodate you.  I like that.  I wish there we more places like that in Hoboken.
2014-10-21,3,Greaaaat wine bar. Prosciutto pizza took a huge step backwards in replacing the fig with plums. Ain't nobody got time for that.Service is awesome, so be nice to the servers.
2014-10-19,5,Excellent food and service. There is not one thing I can ding them for. The bartenders were extremely knowledgable on their wine, and our service was pleasant and attentive. We shared two bruschetta's, tuna and beef (excellent), honey truffle mozzarella (melt in your mouth) and the duck risotto and beef/sausage bolognese. We both had mutilple glasses of one of their finer Pinot Noir's which was a great pairing with our dishes. I also need to credit whomever decided their playlist tonight because I loved every soon that was played. We will definitely be back!
2014-10-19,4,I enjoyed bin 14, I dined with a group of friends out on the patio while the weather was still nice. We tried several dishes and ate family style, my favorite was the pork belly and the pumpkin and sweet potato ravioli. The wine selection was nice, the server was very friendly and knowledgable. I think this place would be great for girls night or a date.
2014-09-30,4,It's good for what it is, if you want a wine bar then here it is.  Service was punctual and polite, 4 drinks cost $40.66, so reasonable.  Quiet until 7:00, then gets packed.  Bar seating as well as around the wall
2014-09-30,4,First time here. Excellent food and wine. May be a bit understaffed but that is part of being lean and green. Shrimp and grits awesome ! Wine selection impressive! Staff is responsive, polite and a tad overworked.
2014-09-28,2,Been there three times now and always is the same: terrible service, OK food (sometimes even good) and overpriced wine. Probably not coming back anytime soon. If I want tapas I'd rather look for a Spanish restaurant in Manhattan.
2014-09-28,3,I absolutely love the food here. However, I've been here two times and both times I've experienced unusually unenthusiastic and uncharismatic service, from two different waitresses! It's as if they are trained to act this way... weird. Be less miserable waitresses!
2014-09-20,4,One of my favorites in Hoboken, but stick with the pizzas and only go for dinner. Lunch appears to be their B team.
2014-09-16,5,Great wine bar and restaurant.  Wide selection of wines and servers seem knowledgeable on different wines they have on hand.  Ask for a sample if you're not sure, they will happily give you a taste before you order a glass.The food is excellent too.  Menu changes a little from season to season but it is always very fresh and well prepared.  They small plates are definitely on the small side so be sure to ask how big the servings are to know you are ordering enough.  They have a nice patio area in the back with heaters, i would recommend the patio or out front seating if weather permits.  I think the patio is open year round.
2014-09-13,2,Terrible, atrocious service.  Dined with a group of 5. Waitress immediately asked for drink order. Given the voluminous wine list, we asked for a minute and she rudely huffed away.  She didn't come back for more than 20 minutes. Didn't come back to take drink orders throughout the meal.  I ordered a 6 oz glass of the Brunello; it  clearly had been poured from a bottle that was open for about a month. After the waitress came back 30 min later, I said I would pay for it but couldn't drink it due to the sour taste. She grabbed my glass, sipped from it and then tried to argue with me about it!  During the entire meal, the owner or manager was screaming at the line cooks about turning the food out.  One chef threatened to quit and walk out. This went on for 2 hours, all in ear shot of the diners. Such a disappointment.
2014-09-13,5,Expensive but you do get what you pay forThis is my favorite place to eat in HBKGreat seasonal menu and of course the wine and cheese plates are TDFPlease keep the bolognese sauce on the menu all year long
2014-09-07,5,Can you say "Eli Manning"  WHOOP WHOOP!!!!!!!! Yes I saw the one and only "Eli Manning" from the NY GIANTS!! The wine and food were great but seeing "Eli" was the highlight of my night. Unfortunately I had to play it cool, but inside I was "Happpppppppy"!!! And yes he is a "Cutey" :-)))))) I'm coming back to Bin 14 for the food, drinks, and "Eli Manning"!!!!! ;-))))))))
2014-09-06,4,Best wine bar in Hoboken. Wine recommendations are great and the staff really knows their stuff. The food is good. Sometimes great but not consistently. Great for a date night or girls night out.
2014-09-04,1,Food was flavorless. Pasta was cooked very well (we love it al dente), but you need to drench it in grated cheese for taste. Won't return.
2014-08-17,5,Celiacs dream! Bin 14 is hands down my favorite new spot to go for dinner.  I travel from Morristown just to go to dinner there and wish they could bring a Bin 14 here. Not only is the wine list absolutely amazing but the Wine Director Joel is very helpful.  I have now come to Bin 14 twice and on both occasions Joel was spot on with his suggestions and Maddy, one of the bartenders, was equally as helpful and knowledgeable about the wines.  They both are completely aware of gluten allergies and double checked on anything i had questions about.  The gluten free bread is so amazing that my friends love getting it which makes my life so much easier.  We get mostly apps and small plates and pizzas and split everything and because almost everything on the menu can be made gluten free it makes sharing dinner easy. They have separate fryers as well so there is no cross contamination.  I honestly asked if I could order the bread online and have it shipped to my house! (the answer was no haha). Bin 14 should be your next dinner spot!
2014-08-14,4,The staff was as sweet as can be and the food was delicious. The portions are nice and small -- leaving you satisfied & not disgustingly stuffed. The place is decorated very tastefully, with subtle lights and wine bottles everywhere. They have an endless supply of wine... go thirsty and tell the waitress what you like and she'll bring you a few options to try. First come first serve for the outside seating so go earlyish.Also-- no dessert.
2014-08-04,5,I've been going to Bin 14 for years, and will continue to do so. Chef Justin is always changing the menu based on what's in season. He's never afraid to take risks, and try new dishes that keep me coming back. If you're looking to spend 10 bucks on a chicken parm, this is not your spot! This is the place to have a nice glass of wine and do some people watching. This is the place to have an intimate dinner before a night on the town. This is a place to bring someone that you are trying to impress (i.e. 1st date).  But I must say, I've also had some great brunches here, and will pop in from time to time just to get a cheese plate and catch up with old friends.
2014-07-28,5,I have been coming here for years. There is nothing like it in Hoboken. Great wines, great menu and fun bar scene. They always keep the menu fresh and interesting, I enjoy reading the specials board to see what pops up. The wine tastings are amazing. Its a solid choice whether for date night, girls night or solo. You will never feel uncomfortbale going alone and hanging out. The staff and management are very friendly.
2014-07-20,1,A disturbing, Sad and salty experience. Will not go back, for the expensive attitude - neither the absolute salty meatball - Pizza fiasco and non less a wine glass so expensive that makes absolutely no sense.the facf of being the only wine bar in town, gives them power to charge and have an attitude. I try it a few times already over the course of a year. at this point on, after this past experience on thursday, I won't go back. Not for the fact of saying that in Hoboken the food scene is pretty repellent and represent no part of the world in a fare and pure way. By the way: management - get a less according to the role snob attitude. My wife ask one simple question, and one only. " Excuse me Sir - would you mind to check on our food " - here is what you answered: Calm down we are busy - Hold on ill go check.Not worth a penny to go back.
2014-07-17,2,Food is great. Service is not.They have a strict reservation policy which is hilarious considering I've seen empty tables OFTEN on Saturday nights. Front of house is a mess (receptionist.) Also our service could've been much better. Server kept messing up our order - forgot food and added food we didn't order - and then when the bill came, the mistaken food was still on! Furthermore I was a little off put that I ordered a glass of wine - then asked for a bottle...and since we spent so much money at your restaurant, I thought the one glass wouldn't be on the bill.
2014-07-16,3,Should be getting two stars but the place itself is good.  It is the service...lack there of that was a HUGE turn off.  Went there to find out about reservations a few days prior to family in town and was told they don't take reservations after 6pm.  Thought great, so I had a glass of wine and ordered a flatbread that looks great...15...20...30, finally I asked about my appetizer and they said they forgot about it...WHAT?  So came back the following week with family and was told I need a reservation and had to take them somewhere else!!!  While walking to a different restaurant, my family from out of town commented on how the host was rude when telling me that his staff would never say such a thing!  Funny part was my family said they would never go back based on the 3 minutes of interaction with the guy!  Service horrible... restaurant great...wine list AWESOME for Hoboken...Hence only 3 stars
2014-07-10,3,Excellent wine selection and small bites, but the service was a bit off. For a wine bar, they have a nice relaxed atmosphere, though the music was constantly a few clicks too loud. The wine list was great and we found some treasures as was the menu, especially the calamari which we got after seeing every other table in the place order it. Loved the tanginess of the peppers with the calamari. Service though left something to be desired. Quite slow, didn't really check up on us, and loudly complaining about coworkers in front of patrons. Not cultivating the desired wine bar atmosphere. En vino veritas
2014-06-27,2,The food is good but the service is TERRIBLE! We arrived at seven, were first told the wait would be ten minutes, then a half hour.  An hour and twenty minutes later both the hostess and the waitress had no clue what planet they were on.  No apologies were provided.
2014-06-27,3,Been here now for brunch once & dinner twice.  It is OK, bit pricey, but more so because anything cool they have on the menu (octopus, pork belly, interesting pizzas) is all barely passing & certainly doesn't hold up to similarly priced places I have been  to elsewhere.  There was literally BBQ sauce on the pork belly.  That is a first.  And it was dry & tasted like a rib. Enough said. Wine selection, though is excellent - Great options for middle priced wines & good variety.  Service and ambiance also great.Just stick with basic Italian/American dishes here & you'll enjoy it.
2014-06-07,1,Sitting and eating lunch in the back courtyard. The food is good but the service and our waitress was very arrogant and unhelpful. We have a 8 yr old with us and we asked our waitress if we could get a simple dish like pasta for her. Those of you who have been here before or have had a look at the menu would know what I am talking about. The waitress shrugs her shoulders and says they can't do that. My husband asked to speak to the  chef and she says the "chef is not prepared to talk to us" and the kitchen is not equipped to make pasta. Seriously, what equipment do you need to make pasta? Anyway, the owner then came out and said sorry.I would not recommend this place for anyone with kids and specially if you are looking forward to courteous service.
2014-05-21,3,Outdoor seating in front and back patio. Huge wine list. 2 oz and 6 oz pours. Average price of a 6 oz glass of red was about $12. Delicious and smooth. Waiter was very knowledgable. No big complaints. Nothing particularly outstanding. I might return and try the food next time.
2014-05-18,1,I would actually give this place 0 stars.  My husband and another couple waited till 945 for our reservations and we were starving.  Server was nice and she was prompt.   However,  we were sitting by the kitchen and a song came on we liked but couldn't remember who sang it.  We asked the employee next to our table.... Just standing and not busy working.  He informed us he wouldn't answer because he was the head chef... And was very rude.  So we got up and left.  Will never eat his food. Douche
2014-05-14,4,If you're going to charge $5-$6 per piece of bruschetta, it better be pretty damn good.  Well, Bin 14 holds up to the challenge.  Definitely the most inventive and delicious bruschetta around.....some of my favorites include the steak tartare with raw quail egg yolk, and the blue crab with mango and avocado.  I want to try them all!And it's not just the bruschetta that's excellent.  Throughout the menu you'll find ingredients and preparations you won't find anywhere else in town.  Grilled octopus.  Lamb chops.  Lobster pizza.  Quail.  To name a few.It is a pricey, classy wine bar, so you can get dressed up, but casual is ok too.  Portions are very small, so expect to order several courses (which could get expensive).  There is an outdoor patio in the back, which is also nice.  We had brunch there once and had a great experience.They have fixed seating times on weekends, which can be annoying because they usually book up way ahead of time, but usually you can snag a table outside, which is first come first served, or sometimes you can get an inside table if people don't show up for their reservation (which seems to happen a lot).  Based on the food and atmosphere, I want to give this place 5 stars so badly....but I can't.  Because the service, though friendly, is slightly lacking.  Let me explain...I would think they have the fixed seating arrangement to make things easier on themselves, meaning they would have the whole service thing down to a science....but they don't.  If the main premise of your business is that you are a "wine bar", you better make it a point that nobody has an empty wine glass.  Ever.  Yet, there have been several occasions where we've had to eat entire dishes without any wine in our glasses and no waitstaff in sight.  This takes away from the experience because you look forward to the pairing of the wine with the food.If it weren't for that one shortcoming with the wine service, this place would be pretty near perfect in my opinion.  Nevertheless, it remains one of the more unique food establishments in town and their food is truly a work of art.
2014-05-12,4,I have to say this place was really good. It was probably in the top ten places i have tried. (keep in mind im new to the area) Coming from the east village i had a good selection of small plate type places and this one does a good job of proving me a good place to go.  Id suggest getting thier homemade mozz (all of them are pretty good) and the truffle fries. Both were a great starter to a meal. I still need to go back and try other dishes but for me to visit more than once is a good thing.
2014-05-11,4,Managed to stop by on a weekday during lunch and were seated outside on a particularly warm and lovely day. The food. The food was so so so good.Blue crab bruschetta: divineGrilled octopus small plate: heaven-sent Pizza: I can't remember the name but there's one with an egg on top. You cannot skip this. It is amazing!! Must return.
2014-05-11,4,Really enjoyed an evening catching up with friends over great wine! Food looked delicious and I plan on coming back next time for a bite as well. After months and months of being skeptical of this restaurant due to staff being unfriendly, rushing you out of the restaurant and overall just feeling unwelcome, I stand corrected. Staff was pleasant, accommodating and engaging. I will spread the good word about bin 14 from this moment on. Cannot wait to go back :)
2014-05-04,1,Good news - gluten free pizza crust that can be used in place of bread for a few things on menu. Bad news the Sunday morning wait staff is awful. Lazy and annoyed. My husband ordered a side of bacon and when it didn't arrive with our food he asked the waiter about it. The response? "I only have two hands) this is after we sat for several minutes just watching our food sit waiting to be picked up.  My fork was dirty with lipstick. And there you have it. It's like I was transported to Brooklyn.
2014-05-03,5,Possibly the most innovative restaurant I. Hoboken--wonderful wine list, a consistently excellent tapas menu that seems to change seasonally, great atmosphere. You have zero chance of getting a table for dinner without a reservation, but lunch is always easy for a drop-in. The grilled octopus and the quail egg/steak tartar crustini are among my favorites.
2014-04-23,4,Came here with a friend one night.  Great spot on the main street and very laid back environment.  Management is super hands on with the staff and greeted me when I went to pay the bill.  As for dinner, we had the risotto grits which was awesome, octopus was on point, pizza with truffles (my personal selection) and the meatballs (also very good).  Would def come back and their wine selection is on point!!! I stick with the reds because they give me a good buzz.  Overall i would come back again.
2014-04-21,3,I went here with 2 friends on a week night and we had a nice time. We ordered several plates to share and while nothing was particularly unsavory, I can't say that I was impressed by the food. Each plate was very one-dimensional in flavor and texture. However I enjoyed the Service, wine, atmosphere and will most likely return.Sharing plates is always fun!
2014-04-18,2,Apparently they don't take reservations?  The entire process was confusing. Was told at 6:30 the next available table for 4 was 9:30 (? Really?) Ok we will have a drink at the bar, the hostess tells us the bar seats are all full. . Which should've been or first indication they didn't want us there. Foolishly, we decided to stand at the bar and have a drink. Had a rose, it was okay.The hostess came over and asked us to move to the waiting area in the back, so we could clear the area for servers.Why not just say can you please go stand next to the bathrooms (completely in the way of everyone) and be made to feel totally unwelcome so you drink your wine really fast and get the hell out. Womp. Went next door to Madison's and probably had 20x a better dining experience than we would've had here.
2014-04-17,2,When this place first opened up I thought it was awesome. However, I feel that there's been a decline over the recent years... I went once with a group of friends. We each ordered something at the bar. My friend's food came out but mine didn't. I assumed it was still cooking. I had to follow up with the waitress and ask what happened. Turned out she forgot.... Went a second time with one friend and got seated next to a nice and DRAFTY door... Lovely. Ordered the salmon and felt starved afterwards. I also paid a ton for the wine and the food.
2014-04-13,4,I am a big fan of Bin 14 and was a bit shocked when I realized just now that I've never given the Yelp world my 2 cents on this Hoboken staple.WHY is Bin 14 the only wine bar in Hoboken?! You would think a restaurant like this would be such a win in this town! Their selection is fantastic, and the servers know what's up. I've only been disappointed by 1 selection, and in the half dozen times that I've been there since, I haven't seen that server, so let's just assume she wasn't a good fit.The food selection rotates somewhat seasonally. Via weekend specials, Bin 14 does a good job at keeping up with what is in season. But the not-to-miss dishes would have to be the bone marrow, pecorino fries, blue crab bruschetta, foie gras bruschetta, the beet salad and the mussels. I've never once been disappointed when ordering those items, and my pup Luna especially loves when I have the bone marrow because it means she gets a delicious treat once I get home! Are the prices at Bin 14 on the high side? Probably. But you're paying for pretty darn good food... So you're probably asking why the 1 star reduction? I've found that service is not the most consistent. Sometimes the waiter/waitress is always around and sometimes I can't find them for a stretch of time - almost always when I'm antsy to continue my evening.
