2021-11-06,4,This place was amazing. We went here while on a bachelorette trip and did a pre ordered 5 course meal! The location is great, the restaurant is tiny inside but has a nice back patio that is heated and a front patio. We started with meatballs, burrata and eggplant parm. The meatballs were SO GOOD. Flavorful and tasty. The eggplant parm bites were pretty good! Crispy, unlike a lot of eggplant parm. The burrata was just okay. We then moved salads - we have the Cesar salad and the kale salad. The kale salad had a citrus vinaigrette on it that was so refreshing. Next - we moved to pizzas! We didn't love either pizza. We had the prosciutto pizza and the margarita. Both were average, not very flavorful and small. The best part of our meal was the pastas!! We had an array of entrees - pastas, steaks, burgers and all of them were amazing. The steak was cooked perfectly, seasoned properly and came with side salad/ fries. The bolognese was incredible, the truffle pasta was to die for and the sausage cavatelli was out of this world. You can tell that the pasta is hand made and all of the sauces too! The truffle bucanti was probably the favorite. The service was a little slow and they didn't mention that gratuity was already added.  Overall, would definitely go back!
2021-11-06,1,We wore there today November 6 2021 first the food was over priced and it's nothing to talk about my wife order the salmon and it had no flavor the mashpotatoes wore the consistency of rice pudding and then with out asking my wife's food was taken away with half her salmon still on the plate and told we have a party coming at 8 would we like the check thats fucking disgraceful and our bill was 300 dollars wtf  never going there
2021-10-15,4,Great food and ambiance! I got a couple of brunch drinks and the cacio e Pepe pizza - highly recommend !!! It has a good brunch and dinner menu and vibe for friends or date night. Although I would make a reservation and be there on time! We got there a little late, and they ended up having to kick us out bc they had a big reservation coming :/ understandable but it was a bummer.
2021-10-12,3,Brunched here on Sunday with some girlfriends. The live jazz music was a nice addition to our meal.Bin14's outdoor setup is great - it's a large covered deck area shared with The Madison. It started to rain while we were there and, aside from a few gusts of wind, we stayed completely dry!They offer a brunch deal (zeppolis, small plate and an entrée) for $29 but it felt like too much food so I opted for Al La Carte brunch. The brunch menu itself felt somewhat limited and I, lover of breakfast, ended up getting the sausage and peppers pizza. The serving size was just enough, but was just OK.I think I recommend Bin14 for dinner over brunch.
2021-10-03,3,Ordered the sweet sausage and pepper pizza (without ricotta). It was absolutely delicious, but the pizza itself is very much a pie for a 2nd grader. Very very tiny. I also ordered the zeppoles and they were stale, and I'm guessing baked? They also had the strangest metallic after taste. Not the typical fried and airy light ones you'd find at a local pizza shop. Overall, tasty pizza but very overpriced for the portion size. Zeppoles are terrible, skip them.
2021-09-14,2,Just finished dinner here and certainly won't return. Food was meh. We had the kale salad, 2 bruschetta, the Tuesday mussels and a chicken milanese. The kale salad and bruschetta were fine. We sent one of the bruschetta back but it was more that the toppings we chose were turned into a paste which was unexpected but maybe some people like that. The mussels were cold but the spicy sauce was pretty good. The white wine sauce tasted like water. The chicken milanese was pretty tasty though slightly unconventional bc it wasn't a cutlet, it was like pieces of fried chicken. I would say the shining star of the night was the wine- the Malbec was delicious. And here's where it gets into the no-way-I'd-ever-return territory. Our waitress was TERRIBLE! She was standoff-ish and unfriendly from the beginning but also went MIA after our mains were served. Not MIA exactly as we could see her inside on her phone the entire time. We asked a different waitress for a second glass of wine, finished it, and still no waitress. At this point we have no wine, no bread, an overflowing bowl of empty mussel shells and still no waitress. My boyfriend decides to go into the restaurant to retrieve her and she is...wait for it...on her phone, taking pictures of Barbie dolls. Long  story short, impressively bad service.
2021-09-13,4,I wish I wrote the review while I was sitting there because now I don't remember the names of our dishes ... I do remember the mimosas though The service was great.  The people were nice and helpful and kind and the food tasted awesome Had a great time Would definitely go back when I'm in the area
2021-08-11,4,Brunch is good. 2 eggs & meatball, polenta - The poached eggs are perfect. Egg in a hole is also good.
2021-07-16,2,This place used to be great but there are issues. 1. The menu rarely changes. They just rearrange the same main things and call them new dishes. Todays pork belly is tomorrow's bacon pizza. The whole menu is like 4 ingredients. I'm exaggerating and a lot of food is good but there used to be more variety. 2. The decor is dated. There's been the same damaged art in the front of the restaurant that's ugly and sun faded and wrinkled for literally years. Not a cute high end environment. 3. Climate control. There is none. Don't go in the summer because there's no functional air conditioning. It's been broken or just terrible for years. In the winter it's the reverse. Bring a down jacket to eat in. Also the bathrooms are moldy and never clean. The owner does not invest in this business. I really love this place and want to see it continue to succeed but some things need to be addressed. The only highlights are the staff. David, Soureya, Kristine, Juan, Stephanie, Angela are amazing.
2021-07-08,5,I've never eaten at the restaurant but we ordered delivery for the first time and everything was SO GOOD! The portion sizes were very generous, and everything was well seasoned. I would definitely recommend the food here, I'm excited to try it in person one day!
2021-07-02,3,I have celiac and frequent Bin14 as they are one of the safest gluten-free spots in town.  They have so many gluten-free options and a GF fryer, which is a rarity (the fries are amazing).  I only gave 3 stars because they had such good wings with a dry rub, but recently changed to what tastes like store-bought bbq sauce.  They also had a great GF kale salad, but substituted it for a salad with farro (gluten).  Please bring back the old wings and GF butternut squash salad for your GF crowd!
2021-06-27,5,Absolutely love this place!!! Perfect spot for brunch. They usually have live music too :)
2021-06-14,2,I wouldn't recommend...Staff and service was good but food was not good.My bucatini tasted like the pasta had been cooked for 20 mins and the burrata tasted like it was purchased from Shop Rite last month. It was hard  and not fresh. The pizza margarita looked like it was made in a college dorm, and tasted like it as well. I ate dinner with 3 other people and not one of us enjoyed our dinner...It was very disappointing as the decor and ambiance is super cute.I'm not sure if this is a post Covid thing based on the other reviews, but my experience was the food was awful.
2021-06-14,3,I think overall I would give it a 3.5/5. Environment and service are great, wine list is solid, but the food was underwhelming and under seasoned. Ordered the meatballs and octopus small plates as my meal. The octopus to garnish ratio was a total bummer. I love grilled octopus - I order it every time I see it on a menu. The cook on the octopus was a little off. Overall good for a drink and an app, but don't know if I'll be back.
2021-06-13,4,We ordered Bin 14 for the first time last night via Uber eats.  Everything was packaged great!The truffle burrata: the crostini's were great and had some garlic butter on them.  They went perfect with the burrata.  There wasn't much of a truffle flavor though. Clam pizza: this was good but someone had a heavy hand when adding the garlic.  If it were less garlicky, we would have loved it.  Note- I LOVE garlic and can eat it on its own, but I feel that it shouldn't overwhelm other flavors.   The spring rabbit cavatelli: the rabbit was cooked perfectly and fell apart as I ate it.  The sauce was also something I wanted to dip my bread in.  Now the pasta... out of this world.  We will order again.
2021-06-07,5,Hands down my favorite local bar to frequent. Everyone at Bin 14 is friendly and treats you like family when you are there. Service is A++ and food and drinks follow suit. We typically come in for dinner and drinks and have never been disappointed with the menu or wine selection. The bartenders (David and Kristen) always seem to know what I am in the mood for and provide an excellent background on whatever wine they have selected. Their vast knowledge in wine is what makes dining here incredible. The wine menu is always rotating and never disappoints. Stephanie the manager is the best in the biz. She is the sweetest most accommodating person and always makes sure we are happy when we come in. She assisted in planning a birthday party that we held in the back patio area that was truly an amazing experience. Also big thanks to Sirai - the wonderful server who goes out to her way to make sure everything is perfect each and every time we come in. Food is excellent - the homemade bruschetta's are out of this world. Pizza's compete with the best in Hoboken. Any of the entrees are always cooked to perfection and tasty. The addition of zeppolis to the menu have been a real pleasure, being able to stay even longer for dessert and a night cap!
2021-06-07,5,Bin 14 is truly the best! We are locals in Hoboken and every time we come in we are greeted with the utmost happiness and politeness. Every single staff member is caring and friendly! Stephanie the manager is truly one of a kind; respectful, caring, and hard working. She truly tries to make every experience the best for the customers. The food is fantastic as well as the cocktails and wine selection. EASILY the BEST wine bar in Hoboken!
2021-06-07,5,Whenever I'm in Hoboken , Bin 14 is a must visit! Consistently amazing , from the great service , delicious food, and the best of the best wine selection. It's a win for any time of the day.
2021-06-07,5,Definitely my go to place for brunch (and sometimes dinner lol) in Hoboken! Great food, warm welcoming staff, great cocktails. Whether you sit inside or enjoy their outdoor seating you're guaranteed to have dining experience that will have you coming back. Bin 14 is must! Love it there!
2021-06-01,5,Absolutely delicious! I'm gluten free and almost everything on the menu could be prepared gluten free. They made their own gf bread, and it was so yummy! Highly recommend!
2021-05-30,5,I cannot say enough great things about Bin 14, we had such a lovely experience dining here the other night. I was charged with organizing a dinner for a large group of people where all the important factors were up in the air until the very last moment. Could be 12 people, could be 6, could be anywhere in the middle? On Memorial Day weekend? Lots of things had the potential of going wrong. Bin 14 was so patient, helpful, and adaptive every single step of the way. Even at the last minute when the weather shifted to be colder than expected, they were able to move our party to the back room with the heat lamps. I am truly thankful for all the hoops and the back and forth that the staff had to go through. Christy the event manager was especially instrumental to making everything happen, and even personalized the event by getting a "happy graduation" card for the graduate we were celebrating that night. The restaurant is split into three sections, the outside front, the inside, and the outside back. Both outdoor areas are covered from the rain, the back being a little more enclosed. The entire place was very nicely decorated and had a very nice vibe. I loved all the plants and all the interesting elements that they incorporated into the decor. They say this place is known for their wine, and every bottle that we had was great. The food was delicious as well, we only ordered small shareable plats for the table but each one was delicious. We unfortunately only had one pizza, but I'd love to come back soon and try the others as well as their entrees and pasta dishes.  Thank you again, Bin 14!
2021-05-30,2,I wonder if Bin 14 is under new management?  My wife and I went last weekend for our anniversary, having been at least 2 or 3 times before (though last time was probably 5 years ago).  Prior times would have been 5 stars, but this time, the food was just totally bland and underwhelming.  It seems like the chef has changed, the crostini were not good (again, not like times past), and the pizza was just good - not great.  We ordered several different items off the menu, and none were better than average.Our waitress was good and made a good wine recommendation for my 2nd glass - but SAD:  Bin 14 has fallen off the cliff!  I would not visit with high expectations, unfortunately.
2021-05-23,5,This place is one of my absolute favorites! I love the staff - especially Sarai, Kristen, and Carlos.  The food is consistently delicious and it's easy to book for a fabulous table inside or out.  It's great for a date night or family dinner - pretty much any occasion.  If you didn't know, their gluten free pizza is THE BEST IN THE STATE! The octopus starter is yummy, and I love the wild mushroom pizza.  Visit and enjoy!
2021-05-23,1,They misleadingly advertise many of their fried food as Gluten Free. After being a loyal customer for over 10 years someone on the staff informed me they couldn't guarantee food is Gluten Free because of cross contamination due to frying zeppoles in the same fryer. Never once in the dozens and dozens of times I've been to Bin 14 has a waiter brought this cross contamination concern to my attention. I used to consider them a champion of Gluten Free dining and am extremely disappointment to have being misled for so long.
2021-05-18,5,Food was delicious and service was great. Came on a Tuesday night for their mussels special and it was totally worth it. You have a choice of 2 types of mussels, they're served with fries which are delicious and warm bread. Very filling and freshly made. I've also been here on another occasion for brunch and it was also very good. The staff is very attentive and friendly. I will definitely be back.
2021-05-17,4,Honestly I've heard of this place and I have probably driven by over 100 times and never actually knew where this was. I was recommended this place by my sister and decided to have my birthday dinner here. So let me begin with saying that the Washington St. Swizzle was amazing. My girlfriend had a white sangria and noted how great it was. For my entree I decided to go with the Sausage and Beef Bolognese and I do not regret it. It was by far one of the the best pastas I have had in a long time. I was so hungry that I ended up eating my sisters leftovers. My younger cousin and sisters boyfriend raved about the hanger steak and claimed how delicious their steak was. I am curious about the brunch and will be looking more into that for the summer.
2021-05-17,5,Neighborhood classic. Always an interesting selection of wine. My fave burrata in Hoboken.
2021-05-10,1,Did mothers day brunch.  Party of 7.  None of us enjoyed the food at all.  The pizza was bland, meatball was eneatable, burger was tasteless, zeppoles burnt , and one of the brushetta tasted like mashed BBQ  sauce..  The small plate amd entrée items on the menu domt even pair together well.  Choices made no sense.  The service was slow and lacked. Entrées being served and app plates not even cleared first.  Ugh,  what a waste of money and poor choice for my special day meal.
2021-04-25,5,I'm so glad we discovered bin 14. We had a fantastic dinner experience there last night. We got a bottle of the super Tuscan wine to split, which was full bodied and complimented our dinner. The black truffle burrata was delicious. We could've benefitted from a couple extra crostini to more evenly spread the cheese, but it was otherwise fine. The meatballs were fire, especially the red sauce. The meatballs were juicy. The prosciutto di Parma pizza was also fabulous. The cheeses were so creamy, and the fig was the perfect pop of sweetness to bring it together with the salty prosciutto. Finally, for dinner, our waitress convinced us to get an order of the zeppole and she brought us a complimentary glass of wine. The zeppole were yummy, like fried donut holes. We absolutely will be back at bin 14 in the near future. Also, the outdoor set up was great.
2021-04-18,5,This is my second time here and let me tell you why. The first time I was too drunk to remember. So I'm glad I tried again but it was DELICIOUS. I'm a tough critic of cacio e pepe after living in Italy and Bin 14's version on pizza is outstanding. Prosciutto pizza also amazing. Service is great and our waitress had great recommendations for wine pairings. Also they followed all Covid protocols. Can't wait to come back!
2021-04-16,4,Full disclosure I would give this place 3 1/2 stars.So we had brunch at Bin 14 over the weekend. It was a very cute setup outside and felt very safe and socially distant. All the staff were friendly and helpful.I made a reservation for the backyard garden but when we got there we were seated out front. I asked what happened and the host said there was a private party and they moved us. Would have been nice to have been told that before.At brunch there was this great band, but they were SO LOUD. We could barely hear ourselves and had to shout the entire brunch.The food was good, I had the salmon Benedict and we shared the shrimp polenta which was amazing!I like this place and would recommend going for dinner but would not go back for brunch, just a little too loud for me.
2021-04-07,4,Came here for brunch with some friends Easter Sunday food was delicious seating out side was beautiful, there was live music and it's dog friendly. Drinks were decent but i didn't stumble out of there like I hoped lol. Definitely would recommend!!
2021-04-05,4,I fantasize about this calamari from Bin 14. It's perfectly crispy, the capers and the peppers go perfectly...it's all just 'perfect' and magical. This is the first place I'll go for an app and a drink when I return to Hoboken.
2021-03-29,4,The one thing I love here more than anything is their calamari with peppers and capers. It's so delicious. I also love their bolognese, the other pastas aren't worth it.
2021-03-28,5,We came for a friend's bday dinner and could not have been happier. This type of dining (shared plates) is excellent for small groups as it elimates the weird moment at bill time. Easy to just split it! Everything was good, so many things we wanted to try on menu that we didn't have room for, so we will try next time. I believe based on the bill that waiter was David (blue hair) and he was EXCELLENT. We were very impressed by how friendly, attentive, and quick he was with service. He helped when I asked them to do a little bday candle with our dessert zeppoles and he even sang a bit which was fun. A very nice dinner that made for a very nice night!
2021-03-22,2,Honestly we weren't impressed.  Sure the brunch crowd packed the place both outdoor and indoor, we liked the band a lot and looked pretty good in the beginning....  but....Things went downhill pretty quickly.(1) Music.  We sat at the front window seat so we were able to hear the band pretty clearly but the restaurant decided to blast their own crappy 80s-2000s music to cancel the band music out.  I understand that the music is also for back patio customers who would have no way to listen to the band but why not just live feed the band music to the entire restaurant?  That's what ANY restaurant with live band would do.  I mean, I'm sure the band would have preferred to have the entire restaurant being able to listen to their music. (2) Speaking of music... the band went on break after a while and I saw that they were fed their meal but they were forced to stand with no space to eat at all.  I was not ok with the band members getting treated like that.  They should have been allowed to sit down like normal human beings.  If the restaurant was fully booked as I mentioned, the restaurant should have saved the space for them to eat.  (3) When the band came back from the break and started playing again, the manager decided to shut the door so that we couldn't hear the band.  Also the restaurant was getting warm and we would have appreciated the breeze from the door. Both myself and a couple from the next table protested to the manager and she was very arguementative.  This should not have even been a subject for debate at all.(4) Food was nothing special.  I had salmon benedict.  And it was too small for the price.  I had better ones in the neighborhood for sure.  We also got chicken sandwich and the chicken was too fatty.Overall, combined with rather sub par food quality/quantity and the way the management treat staff and customer in general, I don't believe this restaurant deserves that much of a hype.  There are plenty of better quality brunch spot in Hoboken that treat people better.  I don't think we would return and my recommendation is, don't waste time/money there either.
2021-03-21,2,Unfortunately, I can not give this place a higher review because trying to make a reservation for 7+ ppl was insane. They say on the website and when you call that all you have to do to make a reservation of this kind is to send an email. I have yet to receive an email or an acknowledgment of my email and my event was yesterday. Mind you, these were not last minute reservations. I think it is extremely unprofessional especially when I was not guided at all when I called to check on my reservation. When I called, I was told that someone would get in touch with me eventually and when I asked to speak to the person, they automatically said that person was unavailable. No option to leave a message or anything. I even sent 2 follow up emails and still received nothing. It is a shame because the food was good but trying to get in contact with someone was a huge disappointment. Because this was basically the only option for my friends and myself for a surprise birthday, we still went but could not have the amount of people that we desired. Overall my friend was happy but I can't help but think that she may have enjoyed her experience more if 2 of her other close friends were able to make it. If this were not the only option for us (because everywhere else did not have reservations for that day and we were able to make a reservation for 6 through the online portal) we would not have chosen this place due to the way we were treated trying to make a reservation. That is unfortunate because the food like I said was really good.
2021-03-19,4,My boyfriend and I stopped in Bin 14 for lunch a couple days ago. No one was inside which was great! The waitress seated us and gave us a minute to look over the menu on our phones.She didn't ask me what I wanted to drink which worried me "right off the bat." I just had some of my boyfriends sparkling water. Poured my glass.We ordered the Calamari to start, the Brussels sprouts, and the Bin Burger with fries extra crispy.Food came out pretty quick which was great. Sat for a few minutes cause the waitress wasn't around. Whatever. The calamari was very salty but we liked it haha. It had hot peppers and capers with it. Calamari was cooked perfect and breaded perfectly. Nice crunch. Okay portion for $12. We would get it again. If you have high blood pressure or heart problems though, don't get it haha.The Brussels sprouts were cooked perfectly. Not a bad portion for $9. Nice crunch and tasted fresh. We would get them again.The Bin burger had a thin patty. The bun was fresh and soft. $16 was a little on the high side for its size. We like dipping our fries in Bleu cheese and they don't have bleu cheese, for anyone else who wants to know lol. Fries cooked perfect!! Great chef! And we got cheddar on the burger, which the waitress asked which was nice. It was a good dish.We will be back to try other menu items. Maybe when business picks up there is two waitresses.
2021-03-13,1,Hostess was nasty, they messed up our reservation, did not answer the phone beforehand to clarify and then told us to leave. Did not even try to accommodate for 3 people on a 2 person reservation.
2021-03-10,4,Great food!! So so yummy. Kind of pricey but would still highly recommend. And the ambiance was amazing, perfect date spot :)
2021-03-10,5,I visited Bin 14 for Valentine's day and really enjoyed everything about it! We made a reservation in advance and were sat as soon as we arrived. The staff was really friendly and kept our wine glasses full. The plates were a little small for the price, but the quality was so amazing. Would highly recommend!
2021-02-28,5,Great food and great environment. Had dinner with a group and everything was delicious.
2021-02-15,3,We went to this restaurant as this place offers enclosed outdoor tent as well as outdoor heated seating which during the pandemic is a key criteria. We got the smoked hot Apple cider margarita and it was a perfect winter drink to have! We liked the truffle fries and fried eggplant Parmesan. The cauliflower gratin was a bit disappointing. We got the smoked chicken risotto and a margarita pizza which were also good but not something I would crave and go back for. The service was great and the menu offers some great variety!
