2017-03-24,5,Visited Bin14 on a Saturday night around 9pm for dinner with a friend. We were able to be seated without a reservation right away in the back patio with the cover and heaters. It was a great environment and very comfortable. We started ordering things off the menu one by one just to share and take our time and relax. We ordered 3 cheeses, we wish we asked for more bread because they give you honey and jam on the side which went so well with the cheeses and bread. We also ate the prosciutto and fig pizza. Very good. Our server was great with offering wine choices and letting us try some before we made a decision. I am looking forward to going back!
2017-03-13,4,The highlighted of this meal was the gluten free calamari. They have a dedicated Fryer for gluten free and use chickpea flower. The waitress was very friendly in making sure we knew what was gluten-free. A lot of the menu items are gluten free. I also liked the sausage crostini as an appetizer. The shrimp with polenta was also a highlight. The pizzas were OK compared to the appetizers. Very nice and warm atmosphere. I would come back to have some appetizers and wine.
2017-03-12,4,Came here for the GF pizza and was delighted to find out their fried calamari is gluten free too! I haven't had fried calamari in years!
2017-03-01,3,I would probably give this restaurant 3 and a half stars ... but the app doesn't allow it.  My girlfriends and I started out with wine and apps!  We ordered calamari, meatballs and the mussels! All were good -- the calamari and mussels were my favorite. For an entree I ordered the chicken ravioli with the shiitake mushrooms--- this was good and had a little kick to it. All in all the food was good but not stellar. Fun night out with the girls or your significant other :)
2017-02-20,2,After much hype, I stopped in bin14 for some tapas tonight. Cool atmosphere + concept. As far as the dishes (not so much):Truffle Mozz- very tough, kinda gross, only gave 3 mini toasts for the two of usBurrata mushroom pizza- canned mushrooms not fresh, definitely not burrata. TASTELESSRicotta ravioli with pork red sauce- no taste. Kinda tasted like chemicalsTruffle fries- theses were the only good things but they're pretty hard to fuck up so...We tried to put the sauce on the pizza and it didn't help. Still tasteless. Two thumbs down on dinner. Maybe brunch will be better?
2017-02-18,1,The food is great. That said, we were turned off by our server from the start. She was unfriendly and unhelpful. After being seated late we were asked to expedite or meal around an hour and a half in because "the kitchen was closing." Then minutes later the hostess came by to tell us they had another reservation at the table and they wanted to leave. We continued finishing our drinks as we had bought a bottle of wine then the bouncer came to make the same request. This was all within two hours of getting to our table. I cannot stress how unprofessional this experience was. I've never left a 0% tip, but hey, there's a first time for everything.Edit: the waitress asked us what happened because of her tip and told us it was" the restaurant's policy"... I would say the fact that the hostess said the kitchen was closing when it wasn't didn't help
2017-01-29,1,Abnormally Small portions for the price!  Spend over $300 and leave VERY hungry.  All mediocre food....
2017-01-28,1,We made a reservation for 7:30 to celebrate our best friends pregnancy. We have been to this restaurant many times before, but likely will never be back. The entire meal we felt extremely rushed. Our waitress was at times rude, and only offered the most expensive wines and meals as suggestions for what to order. Promptly and abruptly, at 9:15pm, while we still had food and wine at the table, we were told we had to leave because another party had reservations at 9:30. They also did this to a table two down from us. It was an awful experience and NOT how you treat customers who are spending their hard earned money (our check was just about $300 for 4 people), at your restaurant AND chose your restaurant out of the many others in Hoboken that are just as good to celebrate a very special event. We weren't even able to order desert, which we had planned on, because we were being kicked out.  These people need to remember why they are in business and start treating their customers with more respect.
2017-01-21,3,I have been here twice before but both were a few years ago. I came here once again a few weeks ago for dinner with my good friend.It was 8 pm and the small place was very busy, all the tables and most bar seats were taken and there were plenty of people trying to get a seat. My friend, who got there a few minutes before I did, got us two seats by the bar which were the only ones available at the time. Unfortunately those seats were very close to the door, which kept being opened and closed by the same people trying to get a seat at the restaurant, so I ended keeping my coat on during the meal.Since we were sitting by the bar, one of the bartenders was the ones to take our drink order. He then proceeded to not pay attention to us for a while when we tried to get his, or any of the other bartenders', attention in order to place a food order. I got a glass of cava while my friend ordered dry white wine, both of which came to us quickly and tasted pretty good. Due to my self imposed dietary limitations (being picky and ,more recently, not eating meat) there were not many options. I was considering getting a personal pizza and a salad but ended ordering a kale, ricotta, garlic and lemon zest pizza and truffle fries with romano and black pepper. My friend ordered the Ravioli with chicken, shiitake, caramelized onion, ricotta and braised tomato sauce. The pizza was really good although it would have not filled me up on its own and my friend enjoyed her ravioli as well. However, the truffle fries seemed overdone and were truly an overkill for me, should have definitely gone with the salad. I do no recall the music but it wasn't too loud which allowed my friend and I to have an intimate conversation.Although it has been a few years since my original visits, my impression of Bin 14 is the same: the dishes are either hit or miss (the pizzas are definitely a hit) but either way are overpriced for both the size and the quality of the food. However, since Hoboken lacks in the cocktail/wine bar scene, I do believe I will be back but with low expectations.
2017-01-19,5,Nice wine bar with a good variety of wine. Good service and nice music. A nice addition to hoboken area! Come by for a glass or a bottle.
2017-01-08,1,I have been to Bin 14 multiple times and the food has always been mediocre. I decided to go today with a friend during off hours as I had my young son with me. I was chastised by the manager, Robert, when my son ran several times from the front to the back of the restaurant. I had already paid the bill and was planning to leave before Robert decided to make me look like a terrible mother. In short, if you have young children, and you like good food, Bin 14 is not a place you  would want to go. This was my last visit to Bin 14.
2017-01-02,4,I came here while visiting some locals who are big fans of this spot. It was a Tuesday night and the earliest time we could reserve a table was at 8:30! The place doesn't have a lot of seating, especially for parties larger than 4 people. The setting is very intimate, with candles at every table and low lighting. A great date spot! The staff was friendly enough and everything was clean. It had a social vibe to it, but we were still easily able to talk to each other with the buzz around us.If you come here, prepare to spend quite a bit of money. The waitress explained that it's a 'tapas style restaurant' so you can order lots of small plates for the table. And they are indeed small. For me this is no problem, especially being there that late at night. However, for big eaters like my husband, that's an expensive problem to have. Everything tastes great, though! We had the charcuterie platter, which has very modestly sized pieces of 3 cheeses and 3 meats. An order of meatballs, bruschetta, and bottomless mussels filled 3 people happily. The bottomless mussels (available Tuesdays) were fantastic and each bowl came with a plate of topped fries as well. I could've eaten them until morning but the offer ends at 10pm.  Being a wine bar, it has large selection of different wines. We tried the Pentimento wine and I fell in love. We tasted a few varieties for our second bottle but ended up deciding to stick with our first choice again because it was so good. The bottle was moderately priced for the quality. Like I said, this wine was the best I've tasted yet in my short life.
2016-12-30,5,Best wine spot in Hoboken. The staff is super knowledgeable. If you interact with them, you are guaranteed to learn something. I enjoy their wine flights and food menu. The icing on the cake is that they dont have any TVs! Makes for good conversation on date nights.
2016-12-20,1,Bin14 was recommended by a few friends that live in Hoboken. I had a date meeting someone for the first time. The experience started off fine, the place was nice but very small. My reservation was early 5:30 as I wasn't sure if we were going to eat or just have drinks. We ordered drinks and 3 appetizers to share, food was good, portions were small though. Now for the problem. After finishing our food my date declined a second glass ofnwine and within minutes the bill was delivered to the table without me even asking. We spoke about another 10 minutes as I finished my drink and then the staff came by to remind us they had other reservations coming in a few minutes. I asked why we were being rushed out and they said it normal to notify parties like this. In short both my date and I were quite shocked by the way we were treated being asked to leave. I will never go back to this place again, even!
2016-12-06,3,I guess this place is good for Hoboken but honestly I think it's overrated.  Been here a few times and I am never wowed just always thinking its good for Hoboken... on am mission to find some spots in this town.
2016-12-04,5,Okay after today def 5 star Paul is wonderful the perfect host! The food came out in a timely manner and we were a party of 14, our drinks were all delivered    correctly and service never lacked. If you like wine this is the place for you...thank you for the lovely time and the bday girl, my cousins fiance who is very picky loved it! Thank you again for a wonderful night
2016-11-23,4,Good food and service. Atmosphere is nice. Been here a few times and consistently good. Value for money could be better.
2016-11-12,3,Food here was good and service was friendly.  The burrata had a nice kick to it and was really good.  The lamb tacos and meatballs were also good, but the caesar salad was a bit over-dressed and the risotto was just ok. Cocktails were good too.
2016-10-28,5,This place is one of the best in town. The wine selection is impressive and the food is delectable!
2016-10-27,5,Visiting the area and googled wine bars and Bin 14 caught our eye. Tired from a red-eye flight and not able to check into our hotel room yet, this place was a refreshing "lay over"! A very nice selection of vino and some interesting spirits. We didn't eat only because we weren't hungry, but the menu looked very tempting! Stu was a great host and quite efficient interacting with the patrons and tending to his tasks.
2016-10-19,4,Very good service always having new wines to sample. My favorite of the wines is a white wine called Rainstorm. Also a must have is the mozzarella with honey and the meatballs. So good!
2016-09-22,2,We booked a reservation for 13 for a casual birthday dinner and were given instructions to arrive early since there are 3 seating's per night and would have to relinquish the table by 9:30, but told it would likely be free ahead of time. A few days before, the restaurant called to tell us they were not sure who took the reservation, but they absolutely could not accommodate that many people. Thankfully our party size had dwindled to 10 which they could handle. They wanted to make sure everything was going to run perfectly. This was music to our ears since we were looking for a better group experience than gourmet food, something we typically shoot for. We understand serving a large party can be tricky, but with a little attention, it can run smoothly.8 of 10 arrived by by 7:25, two were slightly delayed, but the table was not yet ready. Ten minutes later they led us in to the back to 6 seats. Someone had removed a 4 top and sat customers at it. This took several minutes of us standing in the middle of the kitchen flow before anyone could figure it out and then remove the 4 customers.Our server let us know that we were fortunate to arrive just short of what would be a packed section for him, but he had our attention now. Maybe it was harmless and poorly phrased, but something about the way he said it just sat oddly with several of us. Bin 14 serves small plates meant for sharing, but after being here several times, IMHO I did not think they could pull that off with more than 6 people so I advised everyone to order an app and entree.  Initially, I also suggested everyone order wine by the glass to take advantage of their wide offerings rather than me choosing and limiting the group to bottles. Both of these things seemed to annoy our server. We ended up ordering a few bottles for the table anyway since we had an easy going crowd and I was thankful that we did.The appetizers came and the food runners could not get it right, they brought the dishes to whomever was near and asked if it was theirs and then went around the table until they found a match. This forced all of us to help figure it out, the loud restaurant only made this game worse. After trying this for most dishes and still having one she couldn't place, I asked the runner to confer with our server to help organize things, but she didn't. The apps tasted fine. nothing spectacular. Stand outs would be a smokey octopus dish, though many of the potatoes in the paired fingerling salad were undercooked and a somewhat bland burrata dish  that should have been served closer to room temp and with some crostini. We asked for some and got cold, thick bruschetta pieces (leftover?).I wanted to see a wine list and consult someone to pair some red wine with our final courses, but as the night progressed we hardly saw our server. Additionally, I wanted to ask them to clear the app plates and bring us fresh silverware, but before I could do either our entrees were being served. As soon as I saw the runner pulling the same nonsense as before, I implored her to confer with the server because I was not happy about their inability to distribute food, but again, no luck. The entrees were just OK. One dish of diver scallops had 2 diver and one bay sized scallop, who the hell plates that and deems it passable? A short rib dish was a bit bland and there were several large pieces of Gorgonzola that were cold and threw off the balance of the grits. The crab risotto tasted ok, was texturally off. Usually good food is overshadowed by bad service, but I tend to overlook service flaws as long as the food meets acceptable standards which unfortunately, it did not.I know the standard is 15% for basic service, 20% for superior, but being close to the industry and given the types of places I frequent, I default to 20-25%. Since we were a large party 18% was included and frankly I feel robbed.
2016-09-19,4,We were here on a Sunday night, and this place was pretty busy. We had great service (wait staff was very knowledgeable about the wine and made awesome recommendations). Wine was great - selection was awesome, and I really enjoy being able to sample new styles with the 2 oz pours. We also had the cheese sampler and were very impressed, delish! The main reason that I'm not giving this place 5 stars is due to the food. Not very good... definitely not with the price. We were pretty disappointed. We'd definitely come back for wine and cheese, but not to eat dinner.
2016-09-14,1,Below is the email I wrote to Bin 14 themselves, before deciding to take my disappointment to Yelp.  All I wanted in return was a simple apology, and assurance that my experience at Bin 14 this time around was nothing more than one bad night.  Apparently, management doesn't care enough to reach out - and it clearly shows in the form of the downward spiral this place has been in over the past few months.  Due to length restrictions, I've removed a few paragraphs: My Girlfriend had made reservations for a party of four, as we had friends visiting who had never been to Hoboken.  We decided to choose Bin 14, as we've always enjoyed coming here together or with a group.  Upon arriving to the restaurant, slightly early for our reservation, we were greeted by the hostess who begun the conversation by saying, "Just a heads up, we are going to be really slow tonight, so I wouldn't expect to have your drink and food orders taken for about 15-20 minutes after your seated".  Not a very pleasing start to our evening, but we sat down nonetheless.  The server finally arrived at our table to take our drink orders.  We ordered 2 bottles of wine and a martini. He never once mentioned his name, and had a hard time helping us choose our wine.  There are only 4 bottles of Rose - all we wanted to know was whether the options available were sweet or dry - apparently they were 'basically all the same' according to our server.  After about 5 minutes, the server brought our bottles of wine, returned to the bar for the martini, then brought that to our table as well.  At that point, we told him we were ready to put our appetizers in, knowing that we may not see him for a while after that.  He responded by saying "Ok no problem....be right back".  We weren't sure what wasn't clear about wanting to put our order in, but he then disappeared for another 5-10 minutes. At this point we were seated for about 30+ minutes before the server returned to take our food order.  Already frustrated with the inattentiveness, we couldn't have imagined it would get worse.  It did.. We decided to place our orders for both our appetizers and Entree's so we weren't left waiting come that time.  We put our order in for about 5 appetizers, then followed with our entrees.  My girlfriend was met with rude criticism of her order because it was "so boring".  The server asked, "Why would you come here and order that? There's so many other things on the menu!".  The first time he said it, we played along and asked his recommendation.  Not only did we not once receive a recommendation from him, but he repeatedly insulted my girlfriend for her choice.  Finally, as he finished pouring a glass of wine for my friends girlfriend, he must have realized enough was enough.  He concluded the interaction by attempting to place the wine bottle back on the table, but instead slamming it onto a water glass which resulted in the glass breaking.The server returns a minute later with the glass, proceeds to ask how we're doing and how our food was.  He then pours a glass of red wine for my friend, and while attempting to place the bottle of red wine on the table, hits my friends girlfriends wine glass, spilling the wine all over the table and myself.  As you can imagine, at this point, I was thoroughly disgusted. We received our entrees, and they were all very good.  No complaints regarding our food or wine choices for the evening.  Our server was walking towards our table from the back of the restaurant, and without fail drops and shatters a handful of plates literally within one foot of our table.  At this point we couldn't even believe what was happening.  It almost felt as though we were on hidden camera to capture our reactions.  We had finally had enough, as my girlfriend and I were getting tired of apologizing to our friends for the experience.  We asked for the bill, paid for our evening, and left.  We talked about our server the rest of the night, and even into the next day because of how unsettling the entire scenario was.  I'll conclude by saying I hope this was a one-off night, and not something we can expect to happen on a regular basis.  We do enjoy coming to your restaurant, but are still undecided if we'll ever be back.  We attempted to show friends what both Hoboken and Bin 14 have to offer, and were extremely disappointed with how this evening played out.  I can guarantee that in the case that we do return, we will immediately ask for a new server if we receive the same gentleman.  Not even a simple reply, to apologize for the disastrous evening we just went through?  Get your act together Bin...
2016-09-07,1,This place used to be one of my favorite spots in Hoboken, I'm not sure what happened. We showed up on a Thursday evening and oddly enough the place was fairly empty, so we sat down at the bar and waited a few minutes for the bartender to acknowledge us. I asked if we could have a samples of the Grenache blend, it was terrible. Super warm (75 degree warm), in fact so warm, I really couldn't get a great wine taste. Nasty. My boyfriend tried a Portuguese white wine, it tasted cheap and too sweet. He drank it. I ended up ordering a South American white. Decent at best. Bartender wasn't the most friendly bartender I have ever met. She was nice to the 'regulars', a bit indifferent towards us. Anyway, we started with the truffle honey warm mozzarella, I was expecting delicious homemade mozzarella. This was far from homemade. It tasted like mozzarella that had been sitting in a grocery store for days. Not great. The truffle honey barely had any truffle taste and the whole dish was bland and old. I then ordered crispy calamari, hot peppers, capers & lemon. The dish was terrible. 100% sure the calamari was completely frozen and was over fried. It was disgusting. My boyfriend ordered the falafel. I tried a piece, it had no taste at all and again, tasted like it was frozen and re-heated. I told the bartender I wasn't going to eat the calamari and she asked if I wanted something instead. I thought my boyfriend was going to smack me because he was go over the restaurant that all he wanted to do was leave. I have no idea why, but I really wanted to give this place another shot, so I said, sure I will have the jerk octopus instead. GROSS. I just wanted one dish to taste good. Nope. Nothing. The octopus was mushy and nasty. I've gotten octopus many times in my life and this was the worst tasting octopus I have ever had. I ate it because I felt bad giving back yet another dish. All and all, terrible food and I thought it was me, but my boyfriend expressed how extremely disappointed he was as well.
2016-08-31,4,Such a great date place! I love the small plates and the ambiance. They are mainly a wine bar but now have a liquor license to make great cocktails too! Great for me considering I'm not a big wine drinker. Can be a little pricey but worth it!
2016-08-19,2,Food quality poor - very rubbery mozzarella and the calamari was cooked in old oil. The meatballs were more like bread balls and the tomato sauce was bitter and unpleasant. Service was also very slow.
2016-08-11,3,The noise level is horrendous.  This really takes away from the experience.  No dessert!  That also takes away from the dining.  The food was fine and so was the service.  Nothing special though.  Will have to try again at another time.
2016-07-29,5,Great food and service. We came here for my birthday and ate/drank everything. I recommend the bruchettas, calamari, wings, mozzarella with honey and truffle oil, pizza with fig, and short ribs. The manhattans are good as well as the vast wine selection. Also Joel who took care of us have great recommendations and service.
2016-07-29,2,Good wine, food is very very small portions but done well. The service and hostess were horrific. The hostess had the nerve to tell me I had a time limit on my table which I not only made reservations for, but arrived on time/early if I "wanted a seat inside", on a 95 degree, 90% humidity day. No other couple that was seated, while I was standing there (three other parties), were told this. Have been there before and enjoyed it, but I don't think I will ever return. Our waiter told us to literally get up and leave, I guess not realizing we'll never be back. I actually regret tipping well. Incredibly disappointing.
2016-07-18,1,My most recent experience here is my last - the waitress spilled an entire container of ketchup on me.  When I complained about being covered in ketchup the individual who claimed to be the Manager said well if she said she was sorry that's ok.  Really?  Sure no problem I will pay the dry cleaning bill for my new shirt thanks a lot.  Even at Stout in the city when a waitress spilled a drink that barely touched my friend they reimbursed for the dry cleaning bill with her receipt and gave us a free round of drinks that night.  Unreal...
2016-07-16,2,I went here recently and the ambience looked great from the outside which grabbed my attention. The pros are cute wine bar and great wine options. Now the cons were we had pretty off service. From the moment we walked in, the hostess just stared at us without saying a word. We felt very un welcomed and confused at if we were even "allowed" to sit at a table inside. After sitting at the bar, we felt as though we were bothering the staff to order and ask questions about the menu. It was disappointing because this place seems to have a lot of potential. Maybe it was a bad night for them but it definitely put a bad taste in my mouth and I wouldn't recommend this to anyone.
