2019-12-30,3,Went for brunch. The food and drinks were good, but the service was poor. Our waitress would vanish for very long periods of time and we waited over 35 minutes after we were done eating for her to come back to our table so we could ask for our check. When we asked other servers if they could get our waitress for us, they stared blankly and would walk away.
2019-12-18,5,I don't normally use the word exquisite to describe anything, but my experience here was just that. From the moment I walked in I was greeted with kindness and provided a generous wine sample within seconds of sitting at the bar. All of the wine I tried was incredible and there was not a wine I did not like. Joel was very knowledgeable regarding all of the wines and Dave an excellent bartender, they both truly made my night. The bruschetta here is to die for and the portions are very generous for that dish. If you love wine, good food and company I suggest you drop by Bin 14.
2019-11-16,3,Great wine, atmosphere and reasonably prices. Burrata and bruschetta are delicious. Pizza was great but not the best. Good portion for personal size
2019-10-28,4,Cute location and has a really great brunch deal. The drinks are great and are only $3 when you do the brunch deal! Totally recommend the Hoboken Tea!
2019-10-14,4,My husband and I went for their Tuesday special, all you can eat mussels and fries.  It's a great deal if you like mussels, it was fresh and tasty.  It's a 3 stars for food but a 5 stars for our lovely server, Zehra!  She was attentive, engaging and friendly even though only her and another server was working that evening with the restaurant completely full!  We would go back just for Zehra.
2019-10-12,5,I was in Hoboken for a couple of hours and was hungry. I stumbled upon this wine bar that looked great. The bartender was very hospitable and friendly. I ended up getting the burrata and arugula pie. It was amazing and worth trying. They also have a good happy hour and a back porch area.
2019-10-12,4,The staff is okay, but the food is a above average. There is a plethora of gluten free options, but I've had better gluten free pizza at other places. Overall, Bin 14 is a cozy spot in uptown Hoboken great for a date night or catching up with friends. The fried calamari is gluten free and a highlight of the tapas style menu.
2019-10-10,4,Nice place for a date night. The ambience was very pleasant. Most of the things we had were great and some were just good. Portions were small but that allowed us to order a lot! Cute outdoor seating as well.
2019-09-24,4,I'd say come for a glass of wine and a pizza, otherwise you may leave hungry. Our waitress was super friendly and made great recommendation on wine. She also helped me settle on something when I couldn't decide between the paella and a pizza. But pizza it was. My Wild Mushroom pie was perfect and covered in delicious mushrooms just as I'd hoped. My boyfriend, who hates mushrooms, stared in disgust. It was a white pie and covered in arugula. So tasty and the perfect size for a dinner for one person. Super reasonably priced too at $14. My boyfriend got the carnitas, which although tasty, were only two tacos. Maybe they were on the filler side but still, not really anything substantial. He ended up getting a pie for himself as well. The carnitas were $16 which blew me away for two tacos. But he loved his pie and in the end left full and happy. Along with a glass of wine, it was a really nice dinner. Maybe a little on the pricey side. But I have big plans to return one day soon for that white clam pizza.
2019-09-19,3,This place has a really good wine selection but the food is alright. We got one pizza and it was okay, the pasta carbonara was decent (peas a little undercooked) there's timed seating for an hour so you can't relax there the whole night
2019-08-20,3,Love this place especially Kristen & Joel.  I stop by weekly but have slowed down coming in because of the lack of air conditioning, and also the relaxed attitude to the details lately not reflective of the staff.  Hoping for improvements; one of the best places in Hoboken and has more potential.
2019-07-08,4,The food was tasty but the portions are way too small for the price you're paying. Definitely not a place I would go for dinner again, just a place to have a quick meal before a bigger one. Other than this, the staff was very friendly. The place itself was also very calm and clean!
2019-06-29,4,I went on a Saturday with my friends for brunch. It was pretty low key and wasn't too busy. We all enjoyed the food and appetizers which we shared. The best part was the option to enjoy multiple drinks during the unlimited boozing 90 mins. The variety was refreshing and their wine director credited himself for that. Definitely a great spot to try out on the weekend. I didn't love my crab cake sandwich but might just be a personal issue. Just didn't win me over but everything else was delicious.
2019-06-17,5,Extremely friendly and helpful staff that are so welcoming and helpful especially when picking wine and food! We love coming here. Some food favorites include: cavatelli pasta, octopus app, and the 12th & Passyunk on gluten free crust! Sitting at the bar is the best experience.
2019-06-13,5,Food was absolutely delicious. I ordered the gluten-free pizza and the beet salad.. went with a big party so we all tried each other's food and it was great. Best gluten free pizza I've had thus far. Also, they had organic wine. I've never been to a place that has organic wine. I was amazed!!!! The only thing I would say is we waited 45 minutes to get seated and we had reservations ... but everything else made up for it. I would recommend them for their high quality ingredients.
2019-05-23,5,The best experience i've had in a while in Hoboken.  Excellent staff, knowledgeable, hospitable and accommodating.  Wine selection was the best i've seen in North Jersey.  Food was paired perfectly.  I'll be back in the not too distant future.  Thanks again! We had a great time !
2019-05-11,4,After coming to Bin 14 a number of times over a solid year, I have been able to eat and drink through the extensive menu enough to know it warrants a solid 4 stars.The wine program and cocktail list is quite extensive and Joel the sommelier is more then willing to cater to what you like and challenge you with new drinks that might lie a little outside your comfort zone. Even if your standby is a good ol Gin and Tonic, the amount of different Gin styles they have behind the bar will keep you trying different combinations for a long time.With the menu changing seasonally, it can be hard to have your favorites stay on all the time. Yet even for all the change, the food ranges from very good to above average. From the past year, some of my fiance's and my own personal favorites include the fried chicken, all of the bruschetta, the mushroom pizza and burrata pizza. The one complaint about this place is that the price you pay for the food compared to the portion size is way out of whack. You can walk out of the restaurant paying close to 100 dollars per couple in wine and food and still be hungry for a late night snack. Overall though, if you are looking for an extensive wine list and interesting nibbles to have on the side, then Bin 14 should be on your list.
2019-05-06,5,Probably one of my favorite places in Hoboken. There aren't too many true wine bars around so I thoroughly enjoy this one. They have a good selection of wine and good food to pair. My favorite is the mozzarella and the rock shrimp with polenta. What I love about this place is that it's cozy. It's small and quaint... like a wine bar should be. It has out door seating up front and a heated garden seating  in the back. I've sat in all places and have never had a bad time here. I prefer to sit at the bar because I like to interact With the bartender. Years ago when I was going here more often it wasn't really over packed. Now it's become popular and it's hard to get a table at times. I think they should open another one ! Hint hint.. anyway a great date night spot if you're looking for one but call ahead especially on the weekend!
2019-04-19,4,Came here here last summer in June and this place is def memorable !, they have so many delicious gluten free items for people and I didn't even notice until after I finished the calamari lol ... we sat at the bar and I believe his name was Gary ?! Possibly lol, but he was extremely helpful finding us the perfect rosè to try out... the Resturant was still fairly new and it was quite inside so I just snapped a few photos of the beautiful decor before I left ... I will def be back when I'm in the are la to try some new dishes , the meatballs were my favorite !!!
2019-03-30,2,Mediocre food with terrible service. Our waiter seemed very out of it and kept forgetting about our order. At the end when we didn't understand the bill, they sent someone over with a calculator to do the math in front of us and rudely explain what the charges meant (the charges didn't seem to match the prices on the menu so we were confused). Not worth the hype. I do not plan on returning.
2019-03-25,3,Meh.....Most likely this type of dining just isnt my thing because other people seemed to be enjoying it... but then again a lot of people do stupid trendy things just because other people are doing stupid trendy things.  We had fresh mozz with truffle honey... it smelled like gym socks and had very little taste. Wild boar sausage pizza, the meat tasted old (but that's because it was wild game). Steak tar tar.... totally tasteless. Roasted beets.... exactly the same as opening a can of beets at home. The margherita pizza was ok and so were the meatballs. But for $14-18 per small plate I expect something more than just ok.   Much to do about nothing.We wont be returning
2019-03-09,4,We went there for an evening date night. The place is quite cozy. From time to time the place does get noisy but overall ambience is feel good vibe! Wine list is average. We just had several small plates and appetizers. Food was pretty good. Their Mozzarellas are nice and so is beer salad. Overall nice, friendly Hoboken spot!
2019-03-08,4,I went to Bin 14 for a girls night dinner and the food was amazing! As a gluten free person (not by choice by celiac) I truly appreciate when a restaurant has tons of options for me to choose from.  Highlight for me was the calamari (which is done in chickpea flour).  It was so so good! We also had excellent service and a great waitress who continued to re-fill our wine glasses.  All in all, great food and options for gluten free people as well. This place continues to be one of my favorite restaurants in Hoboken.
2019-02-23,4,I love this place. Great wine selection and the food is so good too! Cozy and warm vibe. Perfect for a date night. The only negative is that the plates can be kind of small, but so good that it doesn't matter. Make sure you try the truffle fries.
2019-02-17,4,Great brunch for $29... have to try the Bloody Mary and the meatball For small plates!
2019-02-15,4,Bin 14 has amazing food, drinks, and service. But There were 1-2 mishaps that I find really unprofessional. Disclaimer: I think some of my issues had to do with that it was Valentine's Day, so keep that in mind.The good:The food was the best I've had in Hoboken and I've lived here for a few years now. The service was impeccable, our drinks were never empty and the environment of the place was very nice. The food came out quickly, but we never felt rushed. I had the lobster carbonara and the creamy arancini. All of our wines and drinks were really good. I was very happy when we finally got seated. The bad: I had a reservation for 9pm and I got a text message at 7:57 telling me to be there in 30 mins. I arrived on time at 8:30 and was told I will not be seated until 9:30. Thankfully there is a bar next door and a few nearby. We told the hostess to call us, which she didn't...we walked back at 9:25 and saw two empty tables. Maybe it was perfect timing, maybe it wasn't? Who knows. The day after I booked the reservation online, I received a call around 8:45pm from bin14 confirming my reservation again over the phone. I don't think businesses should be calling that late at night. That's poor judgement.
2019-02-10,4,Went here for brunch- good deal. Three course meal for 30 dollars. Starts with zeppoles and then a small plate and entree.  Service was good they checked in on us the right amount. We sat outside, which was fine. But the inside looked way cuter and nice.  Would go back again.
2019-01-27,4,Since the waiting staff has been changed through years, I really have been enjoying the place lately. I can tell the food has been pretty consistent (which is important), wine list is always very impressive (a bit pricey though) and as I said before people are very welcoming there and warm. I hope they will keep it, I always loved the spot, but never was regular because of the unwelcoming atmosphere. Now, they have hooked me for sure
2019-01-26,3,My girlfriend wanted a boozy brunch for her birthday and this place came highly recommended. She made a reservation for a group of 10 that was CONFIRMED for 1PM. However, when we showed up at like 12:50-12:55,  we were told that we had to wait until another party left because they had the other half of our table (one table was set for 5 already and they gave our other table away). So we ended up waiting for 30 mins for our table, which was extremely annoying and unprofessional. It would have made it better if we received any type of apology or anything but the manager was very unapologetic.Anyways, we all decided to partake in the Bin Brunch which is $29 that included 1 drink, a small plate and an entree. And drinks after that for 90 mins are $3. Food & Drinks1/2 -  I started off with the rock shrimp, which came served over mashed potatoes, which was actually delicious. The sauce on the shrimp combined with the potatoes was a lovely blend. My SO decided to go with the meat and cheese board, which also was very delicious with the different variations of meat and cheeses. For the entrees, we went with the crab cake sandwich and the mushroom pizza. While my entree was pretty great, the mushroom pizza was bland and a bit oily. The one star deduction is due to the drinks. While our first drink was good, the subsequent drinks progressional became more watered down and longer to obtain. They really milked our 90 mins. Service0.5/1 - Our waitress was uhm, angry. It appeared she may have woken up on the wrong side of the bed. Just uninviting overall. Price 2/2 - For price point of $29, you can't say it isn't a great deal for the amount of food you get. I'd probably just avoid getting additional drinks, you're paying $3 for a mixer at that point. Happy eatings!
2018-11-11,2,Truly I'd give this place 2.5 stars. I had a reservation for noon for 2 during Saturday brunch. The place was pretty busy when I arrived. Our waitress was MIA for most of our stay. It took 15 minutes to put in an order, our drink arrived shortly after, but the time between the zeppoles, appetizer and then entree felt like it took forever. The waitress barely checked on us and getting drink refills was very difficult. I thought that the food was okay but nothing special, I had the bin benedict which I know would be tasty but the focaccia bread it was served on had a burnt taste which masked any other flavor there. The potatoes were fantastic, flavorful. Had my dish not had the burn flavor I know it would have been delicious. After we finished it took another 25 minutes of idle sitting and asking our waitress twice for the check before she finally brought it over. While I think that they were understaffed in general, this waitress still could have been more attentive, I was disappointed. Based on what I thought was the value of my brunch and lack of service, I may try bin 14 again to give it another chance but I can't see myself eager to go again.
2018-11-04,5,One of the best restaurants in Hoboken! Great for a date or a big group. Food is so good. Lots of small plates so everyone can try a bite of something. Pizzas are delicious.
2018-10-29,5,What a great spot! Wonderful selection of wine and Johl the waiter /bartender was fantastic. Knew exactly want we wanted.  The chef did a wonderful job at creating a mixture of palettes. The buratta, the toast, all so delicious.
2018-10-19,2,Food- delicious! Honestly, 5 star for experience- so you know what's coming... our waiter was pretty terrible (I was a waitress, so I come from an understanding of all the things involved in the experience, I promise). However, we were sitting outside in the back, where only one other table was. We constantly had to waive him down and, at one point, we were sitting with empty plates, empty wine glasses, and empty water glasses in front of us (which he could see from 5 feet away I'm sure)- and he SAT DOWN with the other customers to chat! Not kidding. He only came over when my husband went to try to get a dessert menu (probably was worried he was going to complain)- to rudely tell us they don't even have dessert. The food probably won't even be enough incentive to return for that type of treatment.
2018-09-26,5,One of my favorite gluten free spots in Hoboken. The gluten free pizza crust is amazing! The staff are super friendly and great at sharing drink suggestions. Highly recommend for a date spot a hangout with friends. Small place and can be hard to get a seat on crowded nights, but worth the wait.
2018-09-18,5,Favorite restaurant in Hoboken.   Amazing wine list and you can even buy the bottles and take them home.  The octopus is to die for.  Not to crazy bout their brunch menu but there dinner menu is top choice.
2018-09-14,5,The grilled octopus is to die for and their selection of wines is top notch!  Went here in a date night with my lady and was very impressed.
2018-08-13,5,It's inexplicable to me that this place isn't rated at least 4.5 Stars. The food is fantastic, great wine selection and ambience. I've been coming here for years and it's always been a success. Take it from a foodie who has spent the last 12 years dining all over Manhattan: this place is fantastic.
2018-08-06,1,*2018 Summer Hudson Restaurant Week Review*When you first walk in, you will be greeted with the smell of a toilet. The outdoor back patio area is slightly less toilet-smelling, so try to get a seat there if you can. We went with the RW menu, which was $30 for dinner and includes three courses. For the first course, my BF and I both went with the mixed bruschetta (tuna tartare and goat cheese fava). The color of the tuna tartare looked a little bit off but I ate it anyway and it wasn't bad. I gave the goat cheese one to my BF since I'm not a fan of that cheese. For the second course, he had the rock shrimp (polenta, pecorino and chillis) and I had the artichoke and potato rosti (poached egg, truffle cream). The polenta was actually pretty good, but the shrimp was sad looking/tasting - like those little tiny frozen shrimp you'd get from a supermarket. The rosti wasn't bad either but I couldn't really taste any artichokes in the dish. For the third course, he had the duck pizza (cabbage, gorgonzola, currants, ricotta, poached egg), and I had the fried chicken (toasted corn salsa, fingerlings, pickled red onion, hot honey). The pizza was not good. The duck tasted old and dry. The fried chicken was pretty pathetic as well. They were also dry, and probably should have called them chicken nuggets instead, because that's pretty much how small the portion was. The hot honey and the corn salad were the only things that were good about that dish.Maybe their regular menu is better than their RW options? I'm not sure but I will not be coming a second time to find out.
2018-07-30,3,I love a good brunch so I decided to give this place a try. While the food included in the brunch deal was really good (zeppoles, a small plate, and an entree), I'm afraid I can't say the same for the service. I would be more understanding if the restaurant was busy, but that was not the case. Each time one of us asked our server for a drink, it took incredibly long which became frustrating because it was very clear there was no sense of urgency. I gave three stars because I did enjoy my food and mimosas. The mimosas seemed to have the perfect champagne to OJ ratio. However, I'm not sure if I will be back.
2018-07-19,1,Nah. Mediocre at best. wine selection is good. The people are Hoboken basics so be weary. Good selection is lacking . Go only for the wine
2018-07-17,4,Came here on a Friday night, it wasn't too busy. I wanted to sit outside, but the outside area in the back is not a good atmosphere so I asked to move. I wasn't getting food so I just sat at the bar.The bartender provided great suggestions on wine and allowed me to taste before I committed to a glass. I also tried a cheese plate, a sampling of three cheeses and it came with honey, jam and toasted bread. Overall, a good experience. I would come back again, in hopes of sitting outside (in the front).
2018-07-16,5,Love their weekend brunch special can't believe I haven't been here sooner! Brunch price included a appetizer, meal and a brunch drink. Everything was delicious. Would definitely return!
2018-06-23,4,Trust the servers here - their wine recommendations are great. The place is small and can get noisy on a busy evening, but it has the right energy. Servers appeared upbeat and happy, food was great, and I wouldn't have been able to pick a better Rose had I tried - I totally trusted their recommendations on the food and drinks. The moz and bruschetta were pretty good.
2018-06-16,4,Cozy hip wine bar.  Unique wine selection and menu.  Love the small plates tapas style.  Try the Octopus and the meatballs.  You won't be disappointed.
2018-06-11,2,Surprised we were so disappointed! I've been to Bin 14 a few years ago and remember the food being exceptional. we went this past weekend and the food was average with some dishes being borderline bad. We ordered the tuna tartare, date bacon gorgonzola, and steak tartare bruschetta. The tuna tartare was super bland. The date bacon was the best one and it was pretty good. The steak tartare was downright inedible - it tasted like ground beef right out of the packet that was dried out. I'm not a picky eater but i could not eat this one. The only thing I liked was the small plates - beet dish. Maybe it was just refreshing after my bad steak tartare bruschetta? The ambiance was nice though if that's super important to you. Surprised we were this disappointed, wont be back anytime soon.
2018-05-30,1,I am not sure what went wrong with the restaurant, but had a terrible experience last October. I decided to give it another shot yesterday and nothing improved. I have been in Hoboken for 7 years, and Bin 14 was my regular place to bring friends and family. However, something had changed, from swanky wine bar the place turned into neighborhood watering hole. The bartenders are rude, dismissive and have no knowledge about the wine. The food portions are a 1/3 the size. Not to mention the music, listening to "slap the bitches" in a wine bar is really not my thing.
2018-05-29,4,I went to Bin 14 with my dad while he was in town because he was really looking to try out a wine bar type of experience. We made a reservation and were seated immediately on arrival. Staff was generally nice and attentive. We ordered a couple of bottles of wine, which I thought were reasonably priced (mostly in the $40-60 range). We also ordered 5-6 dishes to share including the mix cheese and cured meat plate, tuna tartare bruschetta, roasted carrots, prosciutto pizza, burrata, and pecorino fries. Everything was generally very delicious(especially the fries!) but we found the portions to be extremely small, especially for the $33 mix cheese and cured meat plate. You get 3 of each but on tiny quantities! Also the tuna bruschetta was only 1 piece which would have been nice to know when ordering since we were a table of three people sharing everything.  For those who care, the bill came out to almost $200 + tip. Very pricey but I would generally recommend Bin 14 if you are in the area. I also noticed that they have a garden in the back which might be very nice for summer and/or larger groups.
2018-05-27,3,I went here today for bottomless brunch with two other people and the waitress we had was absolutely horrible. I work in the restaurant business so I understand when things get busy but there was absolutely no need for the trash service we received from Sarai C. Out of the hour we were there, she came to our table twice-- first, to take our order and then second to drop off the check. She never checked on our table and never even made eye contact the entire time we were there. The food runners and bussers were outstanding and took care of us, instead of Sarai, whom I have no idea how she is still in the customer service industry. We asked a food runner if we could have a last pitcher of the bottomless mimosas before our time limit was up. Sarai, our waitress, then dropped off the check 15 min later and we were still waiting for our last pitcher only to be told that our waitress already closed our tab. We kindly asked her if we could have our last pitcher and she said (with the worst attitude I might add) that our time limit was up and we explained to her that we ordered the pitcher before she dropped the check off and she said "your time is up I can't bring you another one, I have another party coming in and I gave you perfect service this entire time so if I give you another one you have to drink it fast" (when she in fact did not lol. Long story short, I have never received such absolute TRASH SERVICE FROM SARAI C. in my entire life. If you come here request someone else because she is absolutely horrible.
