2015-11-05,1,In the mood for steak and not wanting to travel back into the city, or Weehawken for that matter, my fiance and myself, along with a friend decided to give it another shot here.  I wish I hadn't wasted $360.  This is the second time I've been here.  In these two times, we've ordered a total of 4 steaks.  Out of 4 steaks ordered at a steakhouse, ZERO of them have been cooked properly to temperature.  In the previous review, they may as well have served a cow on the table this thing was so rare.  This time, my fiance got a ribeye rare.  I had a T-bone, and our friend had the sirloin.  Fiance's came out Medium well (ordered rare).  Mine came out well (ordered medium). Our friends came out well (ordered medium).  It's beyond shocking to me that a STEAKHOUSE can't cook a steak properly.  My fiance knew the steak was overcooked before she cut into it just by pushing on the meat.  If she can figure this out, how is someone employeed to cook these cuts of beef not able to do it properly?Everything else was immemorable so I won't bother boring anyone else on the details since I don't remember.  Never again.
2015-10-25,1,Yuck! Yuck! Yuck!  I had been here before for a business dinner I hosted and I was not that impressed but I guess we drank so much wine I didn't pay attention that closely.  We came in late this time on a Friday and I guess the staff was ready to go (around 10PM).  The service was rushed, the wine was not what I had ordered (the year was off and when I pointed it out, the manager shrugged it off like it was no big deal - the menu listed a good year, what was served was a bad year).The steaks were charred and awful, the starters were only passable.  NOT COMING BACK!!!!!!
2015-10-07,5,Soccer Dad's night out is always a steakhouse! Decided on this as the Pope was going to be in town that day. Great choice - good location, very old school atmosphere. Smoked Bacon and Calamari as appetizers - the bacon was very good. I had the Rib Eye med-rare and it's better than Old Homestead, it was perfect (at $52, it better be). Mashed and asparagus as sides and it's a perfect steak dinner. Service was friendly and professional.
2015-09-27,2,To some this place might be nice, but I urge you to try ANY steakhouse in the city to understand how short this place falls from a service perspective. Unfortunately this place is trying to be a Manhattan steakhouse, so it's going to get reviewed like one.....I was hoping for good things based on some other reviews, but sorely disappointed. This place makes a killing taking advantage of New Jersey people that haven't travelled across the river. Instead they are presented with service comparable to IHOP with prices that arguably beat Manhattan. It started on the wrong end with attitude and waiting 45 minutes to get a table we reserved. Good thing this place is basically an Irish pub that serves steak, so we had some Manhattan priced drinks getting nudged by server traffic every 30 seconds. We tried to stay patient because this is supposedly THE place to go for steak in Hoboken.We were just about to give up and we finally got seated. On a positive note, our server was very friendly and helpful. But when I'm spending $150 per person on a meal, I expect service to match. There was our server and maybe one bus person for the whole place. We spent a lot of time with empty drinks and finished plates sitting in front of us. They didn't even refresh bread plates with appetizer plates, so I got to enjoy some bacon dipped in olive oil and bread crumbs. Then came the main course....Most steakhouses when serving steak for two will take the initiative to serve the first portion, not this place. Here's a knife, go....here's some sides, go...The food, overall, was just okay. The steaks were not the best cuts, but they were cooked as ordered. The sides were much smaller than usual places in the category. We were unable to get much more than a tablespoon serving to each of the 4 people at the table.I'll give this place 2 stars for a friendly server, but I won't be going back again.
2015-09-23,5,Dino and Harry's is always a great meal and last night was no exception. Whether it's fish, fowl or steak you can't go wrong and the variety of sides and starters is great !!
2015-09-03,3,Enjoyed my dinner. Lamb chops were perfectly cooked med. rare. I did not give it another star because it took a very long time between courses. I thought they had forgotten us. After asking the waitress why the delay she said it takes a long time to cook lamb chops!  Really?
2015-08-14,4,Came here three times over the past 6 months and the food has been consistently good.  Highlights:1) Steaks were cooked the way you ordered and were flavorful2) Thick cut bacon was always delightful3) Corn Creme Brulee Improvement Needed:1) While service is usually pretty good, there are times when the servers aren't really paying attention to your needs. Overall one of the better steakhouses in Hoboken
2015-07-31,1,Just got in with reservations and I was informed that I have to wait 10 minutes. Not impressed so far. What's the point of reservations if I have to wait for a seat.
2015-06-26,3,If I was rating Dino & Harry's on the food alone, it would easily be a 5 star experience. Unfortunately, dining is about more than just the food, so the service plays a big part in my rating. Dino & Harry's was on my boyfriend's "must try" list of Hoboken places, so we headed there for his birthday on a Saturday night. Because we had other plans that night with friends, we went for an early dinner (around 5:15). When we arrived, the restaurant was basically empty, yet we were still seated pretty far back. This wouldn't have been an issue as we were dressed in a dressy casual way, so could see why we weren't front and center. The service was chilly at best, and extremely rushed. Within a second of being seated, we were asked about drinks and our server seemed annoyed when I said that we hadn't looked at the menu yet. She was back minutes later, so we made a rushed wine decision, though our instincts were right because the wine was delicious. As soon as drinks were delivered, our waitress was back to take appetizer orders (the applewood smoked bacon for BF, Caesar salad for me). Appetizers arrived quickly. The bacon is absolutely beautiful to look at, and my boyfriend said it was incredible. The pieces are cut thick, and again according to him, are perfectly cooked. My salad was also very good - Caesar salad can sometimes taste too fishy or overdressed, but this was great. I ordered the Chilean sea bass for dinner and boyfriend ordered the filet mignon. Again, entrees arrived very quickly. The sea bass was lovely, cooked perfectly and was a great portion size. The filet was as a filet should be - cooked beautifully, which is what a steakhouse is all about. This place, as to be expected, is NOT accommodating to vegetarians, but again, it's a steakhouse so that should be assumed. Pescetarians can enjoy a variety of seafood dishes. Like I said, the food at Dino & Harry's would give the place a five star, and that may be what some are looking for, and that alone. I would not return there because for $150+ for two, I'd also like good service, which I do not think is not asking for too much. For arriving at 5:15, we were finished with wine, appetizers, and dinner by 6 pm, so not even an hour later. The experience was much too rushed for me, and not the caliber that I would expect from somewhere with such a great reputation in Hoboken.
2015-06-15,5,Great steaks, great atmosphere (a scene from "On the waterfront" was filmed here.I almost always share the porterhouse for two, great presentation and service, there are two older ladies who I like and a younger brunette named Jennifer.Drinks aren't cheap nor sides, but it's worth it in the long run.I'm not crazy about their steak sauce but their steaks are so good you don't need it.Mac and cheese a d Brussel sprouts I'd recommend.I like it better than Ruth Chris, Morton's, or Wolfgang s
2015-06-15,4,With Capital Grille, Ruth's Chris, and Morton's popping up in seemingly every mall parking lot, I embraced frequenting a local establishment for a friend's recent birthday dinner. The vibe at Dino and Harry's is spot on classic steakhouse with a mahogany, mirror, and glass bar, vintage tile floors, warmly painted walls and low lighting. The room was bustling on a Friday at 8:30, packed with rosy faced men in button downs on their second (or third) happy hour cocktails.We were seated at a table in the bar area by the front window, the hostess explaining that it was more fun there as a musician was about to begin his set. My take is we were markedly younger than other patrons and she thought we wouldn't be as bothered by the noise. It was too loud and the music, heavy on Ben Folds Five and Coldplay did not fit the environment.Of the appetizers, the thick cut applewood smoked bacon was a hit. Flavorless with unseasoned batter, the calamari was not. All of the sides, lyonnaise potatoes, macaroni and cheese, sautéed spinach, and Brussel sprouts, were delicious. Everyone in our party ordered filet. Though boring, this coincidence offered an opportunity to gauge the kitchen's skill in cooking meat to temp. We had 2 medium rare, a medium, and a medium well. I was happy to see that my medium rare filet had a hard sear outside and was warm and red in the center. All of the temperatures were perfect. When it came time for dessert, the waiter, who was notably absent after taking our orders, apologized and offered us a complimentary round of drinks, a highly appreciated gesture. The desserts were unremarkable, easily the worst part of the meal. But I enjoyed my serving of port and my friends loved their beautifully presented coffees with Bailey's. While D&H doesn't match the very best spots, it delivers a great steak without having to venture to the city.
2015-06-13,4,Great food great service. A bit loud couldn't hear the piano player, table was super small and  too close to the other tables.  I would visit again maybe not on a Friday.
2015-06-09,5,I would recommend this place to ANYONE! Both the food and the service are fantastic. It's such a nice place for both locals and visitors!
2015-05-28,2,Ordered my steak medium and they gave me it well done. Server took it back and it came out rare the second time. Overall, not a good sign of a quality steakhouse. Too many good steakhouses in nj/nyc area to come back here.
2015-04-18,5,My only regret about Dino and Harry's is that I waited so long to finally come here!!  My fiancé and I recently went here for our anniversary, and our experience all around was excellent.We started with oysters, and shared the sea bass and rib eye with a side of the creme brûlée corn and a bottle of Shiraz.The oysters were the only thing that were so so to me, just because they were very large and I prefer smaller ones.When we ordered and asked to split the two entrees, the waitress was nice enough to perfectly split the sea bass across two plates and have the chef cut up the rib eye into pieces porterhouse for two style for us.I'm not usually a huge fan of fish, but we wanted something light to start. Let me tell you, this fish was perfectly cooked! Crispy on the outside and moist on the inside. The balsamic sauce it was paired with had me saying OMG and I nearly licked it off the plate!The rib eye was sheer perfection - crispy crunchy outside but a nice bleeding medium rare on the inside. Might be one of the best steaks I've ever had, and I've had Peter Lugers.  Also, the corn was amazing, it was sweet but I was expecting that and I like sweet creamed corn.  The Shiraz we had was very reasonably priced for such a fancy establishment.Also, our waitress was sweet and always made us feel like a valued customer, just wish I remembered her name so I could give her a shout out.  We will definitely be coming back for more!!
2015-04-14,2,The space is so beautiful with details that make the room really sparkle... too bad the food was mediocre (both entrees and dessert), and the service, less than genteel... felt as though we were at a diner. How disappointing.... may be have a drink at the bar and order the bacon appetizer (yum) then go for dinner elsewhere.
2015-04-13,4,Went here for a large group birthday dinner.  This is a bare knuckles, old school steak house.  It looks and feels like Peter Luger but making reservations for large parties is a lot easier.  This spot gets crowded quickly even though it's away from the crowds of downtown Hoboken.  There's a good variety of items on the menu and it's hard to think of this place as a steak house through and through given the fact that there's almost as many non-red meat choices as there are steaks on the menu.  Like most steakhouses you won't be disappointed by the seafood.  Hard to believe that butchers and connoisseurs of the cow can be so good with the meat from the sea but this is one more example of a steakhouse that serves up great oysters, clams, prawns and other seafood items.  The service is attentive and friendly and every once in a while you feel like you're in the old world confines of a Morton's, The Steakhouse of old - private, intimate, reliable with prices (not completely reasonable) to remind you of Luger or Morton's today.  However, it's definitely worth going back.  Cheers!
2015-04-06,1,Worst Steakhouse Ever. If you want a good steak don't come here. We ordered the porterhouse which came out raw. Our waitress was miserable and couldn't be found. I finally had to get up and grab a bus boy and asked him to please have the chef cook the steak a little bit more. Still no waitress. When he brought the steak back it was charred on the outside and still undercooked. (we asked for it medium) We finished our bottle of wine...still no waitress. Very poor service, menu seemed outdated. Asked for our check, yeah!!! finally saw the waitress, who BTW could care less that we were unhappy. Plopped the check down and walked away. Such a shame! We drove a good distance to try this place.
2015-03-14,2,Steaks were definitely not worth the price.  Waiter was very rushed and service was poor.  Won't go back unless I hear that they have better service and steaks that justify the very high prices.
2015-02-25,4,Excellent Porterhouse. Cooked exactly the way it should be. Cons included slow service and they were out of the 2 wines we tried to order. And the one we finally ordered came but was a different vintage from the one on the menu. Im just nitpicking thouigh becuase the steak was unexpectedlygood.
2015-02-21,4,The food and service are excellent and I like how rooted they are in Hoboken specifically and Hudson County generally.  I'm knocking a star off for the same reason I see others have: they do not execute on some little things that should be easy for a place that aspires to be a classy joint.  My party and I all came from work and it was cold so we had jackets and whatever bags we bring to work but there was no chance to check them.  The menus are also in disrepair.  Very odd things to not get right.
2015-02-19,5,Service and food was unbelievable. Made reservations for Valentine's Day and couldn't be happier with the choice I made. Didn't feel too crowded although you know they were busy. Never felt rushed at all. Drinks always filled up. Portions were amazing. Steak was really steak they were huge. I had the porterhouse and wifey had ribeye. Unbelievable flavor and cooked to perfection. The food was still just as good the next day after warming it back up from being in the fridge. Definitely would come back and definitely recommend the French onion soup, ribeye, and the porterhouse.
2015-02-17,4,A year later I went back for a second run, I was actually pleasantly surprised this time.  Steak was prepared perfectly and seasoned just enough.  Sides were scrum and they even split the wedge for us after we said we were sharing it, which was also delish.  Bottom line is they will go in to the rotation, no every week but a couple times a year for sure.
2015-02-16,2,A sad, mediocre, and ultra expensive steak house with no identity. If it's wasn't for the owner hard work, and charm, the staff, would run the place out of business in a month or so. Why's still open, is because of him. Yes, him, the owner, the Duracell charged - Martini Funny and loving man. Without him, nothing will exist.The last of the many appearances, the pretend to be millionaire club clients, and the day of stock broker seal the deal are always in the front line table; why ? Because they like to be seen..What is not to be seen instead is a high quality meat, served to an absolute imperfect temperature - Almost burned perhaps requested medium rare. I am writing this after 5 long wait dinner at D&H - how sad. The menu is a old stale amount of buttery dishes - that's don't even talk about the dessert, three out of five visits I order the entire dessert menu and they seem to have had a serious lack in identity of flavor I'm not sure the reason of why they're even on the menu if they taste the way they taste- wait how do they taste again?! It's 2015, there are a very versatile amount of restaurants and great eatery in the area opening up and ready to welcome you and your family. By the way, it's time to change those cigarettes butt smell like - waitress that hardly come to check on your table. Fastest response you get from them is a minute before you asked for the check... the check it's been dropped without notice.Sad to share these news - hoping for some changes here.
2015-02-06,4,The one and only steak house in Hoboken. Love the old school steak house feel. They have a coat check right up front. There is a long bar and several different seating areas that are cozy and romantic. We were there for Hudson Restaurant Week. The staff was friendly and quick with water refills and checkins. Nice bread selection prior to the meal. Meal was very yummy- we started with the bacon and then had the steak and for dessert had the snoboken. All was very yummy and big portions. Would love to come back for another fun and romantic night.
2015-02-05,4,One of the better steakhouse around. Come for the steak or don't come at all, actually come for the atmosphere or special occasions
2015-01-22,4,I really want to give this place five stars, but I can't. Let me clarify; five star food with good service, but some things were off that a five star restaurant would never overlook.The restaurant itself if beautiful. You feel as though you entered into history. We arrived early for a 7pm reservation to have a cocktail at the bar. The bartender made excellent drinks - I have an Old Fashioned and my wife had a dirty martini. The first thing I noticed, however is that there was no music playing, but instead ESPN was on the TV. Look I have nothing against sports...I love sports. But when I walk in to a steakhouse on a date during dinner hours I expect some music for ambience and the TV - if there is one - should be on mute. When we finished our cocktails the hostess sat us. Now mind you it's the middle of winter and we have big jackets. She never offered to take our jackets from us. As you enter the dining room you see people sitting with big bulky jackets on the backs of their chairs. I typically don't even like to check my coat, but I expect certain things when going to a traditional steak house and that's one of them. Is that weird? Anyway...When we're sat we have a beautiful table next to the window in the quiet side room. We're greeted by our waitress who drops off the menus. When I open the menu it's FILTHY. I mean really filthy. Blood and drinks stains all over the menu. Look if you're charging $50 a steak (which is worth it by quality) I expect that you are properly managed and looking through the menus daily to see where you need to print new menus. I mean they are literally printed on printer paper so it's not hard. For our dinner we ordered a bottle of the Etude Pinot Noir. Roughly a $80 bottle. Not crazy, but not inexpensive. The wine was lovely, but the bottle, like the menu was a bit dirty. It had wine spills on the label. I mean c'mon, blood on the menu, wine all over an unopened bottle. Keep it clean people. But I digress.... The food!I ordered the Filet med rare. It was perfect. I mean absolutely perfect. My wife ordered the petite filet med plus. It was also perfect. Cheers to the chef. With the steak we ordered creamed spinach and brussel sprouts. Amazing.So as I said above, I really want to give this place 5 stars. I love it and I'll return, but if you want to be the best you have to act like the best and it seems as though owners and managers are not doing their jobs 100%
2015-01-19,5,Beet salad was substantial, cocktails expertly prepared, filet perfect and tuna was done perfectly. 3 people,  1 cocktail, 1 bottle of wine, 2 salads, 3 dinners, three sides of veggies, 3 after dinner ports $500 with tip.
2015-01-09,2,First of all, we were recommended by a friend to come here so we were expecting a great experience. However, it ended up being the complete opposite. The food was definitely good but the service absolutely sucked. The hostess had such an attitude and seated us at a very isolated area of the restaurant when i clearly told the hostess it was my dad's birthday; I even put it in the description box when I made the reservation. In the end, the hostess did not care to communicate the information to our waitress and had such an attitude throughout the whole process of switching our tables. The bottom line is: the food was good but the service, especially the hostess, was absolutely awful!!
2015-01-02,4,Came here New Years Eve so this place was mobbed and looked like the staff was overwhelmed.  We actually had an issue as we had an additional person in our party and was flat-out and rudely told by the front desk that they would not accomodate any additional people.  We did not want to leave but obviously all wanted to eat together, but we had then been told if we decide to leave they will charge the credit card $50 a head.  Next comes a chat with Dino.  After explaining the situation to him he goes off on a tangent! This is a business, this and that yata yata yata.. Perhaps they were all stress as it seemed like we were being treated like jerks when we were simply asking for some options.  Anyways i'm not sure what happened but Dino's mood changed and he looked into trying to accomodate us.  In the end it could not be done but we appreciated the fact that Dino tried to do his best.  We shared some shots and ordered for 4 while the other rotated through the bar.Now comes the food part.  We ordered the porterhouses med-rare and they were outstanding.  Absolutely delicious steak.  Their steak sauce tasted like they mixed ketchup and worcestershire sauce but that didn't really bother me.  The sides were all great as well, we had the potatoes, corn and onions.Overall, the decor is what you would expect for a great steakhouse, the owner Dino turned out to be a great guy, and the food was outstanding.  I would certainly repeat.
2014-12-29,4,Great food, good service. I ordered the roasted chicken which was delicious but my boyfriend got the steak... His dish was even better. I was pushed up against a wall in a tony, dark room (poor ambiance) but besides that no complaints!
2014-12-29,5,So, Im actually annoyed with myself for not having eaten here sooner. Rookie mistake for a long time resident. I just recently came for dinner with girlfriends before the holidays and was totally thrilled with my experience and meal. I got there early so I had martini by the bar and I have to say it was absolute perfection. How hard is it to screw up a martini I know right? well trust me I've had enough crappy ones to appreciate the great. Once our party arrived we were seated promptly in the back. The atmosphere was nice old time but quaint. Loved that they have a piano player. Feels like you're taking a step back in time while you enjoy your meal.  Our server was knowledgeable and attentive. She kept the wine flowing which was much appreciated. As for the most important part.. the food. Incredible. For apps we had some oysters, shrimp tuna tartar and these short rib balls that were awesome. For entrees myself and a girlfriend ordered each the petite filet and split mashed potatoes and grilled asparagus. Our steaks were cooked medium to perfection. Another friend got the scallops which she loved and the last ordered 1/2 order pasta dish. We left stuffed, tipsy and happy! This isnt your every day restaurant- well my every day restaurant- but for a special occasion or on someone else's dime this is the place to go.
2014-12-28,4,This place is amazing. We got a Caesar salad and French onion soup and then we split the porterhouse steak for 2 with a side of sauteed spinach. The soup was the best French onion I have ever had. It was delicious. The salad was good but you could really taste the anchovies in the dressing. I'm sure most people like that and that's probably how real Caesar salads are supposed to taste but I wasn't a huge fan. The steak was insanely good though. It was cooked perfectly and the outside had this crispy crust on it that we couldn't stop talking about. We were so full but we ate the whole thing because we couldn't stop. The spinach was really good too. I've been here 3 times and have never been disappointed with a meal. It's really expensive but it's worth it when you want a good steak once in a while.
2014-12-22,5,GREAT food and beautiful restaurant. Our server was super friendly and very funny! Will be back for sure :)
