2021-10-24,1,Shocking how poor the service is here. The food is hit or miss. I've had a good steak a couple times but I've also had a terrible steak a couple times. Last time I tried going the girl at the entrance was so disengaged and aloof that I decided I will never go back. Past experiences with the service weren't great so I won't be giving Dino and Harry's another chance despite having lived in town for many years and my overall desire to support local businesses. Wish they would take heed to the reviews that are online because the service is commonly panned
2021-10-17,1,Owner is arrogant disrespectful uncontrollably unstable. The place is so disorganized I would never ever recommend this establishment to anyone out of 1 to 10 I give this restaurant to one. On top of all that we saw two Cockroaches.
2021-10-14,3,I have been coming once a year  every year for years .I feel its not as special as it used to be. Service not as good  or attentive food quality has gone down.Ceasear salad nothing  special not even flavorful. Steak was good.i think I'll try someplace new next time!
2021-09-17,1,Without a doubt the worst steak I've ever been to.  The customer service was lacking and it should be a crime to charge $50 bucks for the steak that turned up (overcooked and full of fat).  Save your cash and go find a real steak house in the city.
2021-09-11,3,Friday night dinner outside for 4 in September.   Food was good and porterhouse for 3 was well cooked.  However, the bill contained a $30 fee for paying with a credit card.  Really?  We spent $377 on dinner for 4 and we are getting charged a giant fee? And without communication.  Not ok.  Will not return.
2021-09-01,5,We were a big group, went on a Saturday night and managed to get an outdoor table.  Inside was packed and I would not have enjoyed it, crowded and noisy.  For a steak eater, this place is as good as it gets.  For others, salmon and shrimp dishes were the same as were the salads and side dishes.  Service was attentive.  Portion size was very good.  Prices were on the high side.  Parking was a major pain.  There's a private lot a block or two ago.  Street parking is tricky and whoever designed the parking signs on the streets must have been drugs.
2021-08-11,5,This was our first visit to Hoboken, and I never want to eat anywhere else.  Wow, what a great experience!  We are very choosy about our restaurants since my wife is an amazing cook, and Dino and Harry's did not disappoint in food, service or ambiance.  Apart from the steaks and appetizers,  I was very impressed by the quality of the wines for what I thought were reasonable prices.   My family and I met an old friend I hadn't seen in many years and his wife, and Dino and Harry's made the evening perfect.
2021-08-06,3,Came on a Saturday night. Ordered fried calamari to start, medium rare porterhouse for 2, creme brulee corn, gnocchi, and creamed spinach. Everything was just Ok. Nothing was bad, just not amazing. Porterhouse came out medium rare on the strip side but well done on the filet side. Service was mediocre - waitress was not that attentive. Did not leave feeling like I had to go back anytime soon.
2021-07-19,5,love the service. delicious food. I would recommend you to try, especially Salmon! I loved it. Thank you.
2021-06-25,4,I don't normally go to steak houses because I think it's a huge rip off, but this was a special occasion for work and I'm surprised to say that I was satisfied with my dinner here. My table ordered the octopus, calamari, and empanadas to start. The octopus was fantastic. Extremely tender and cooked to perfection. Calamari was great as well. The empanadas were just okay. I ordered the 16oz porterhouse and it was very good. They cooked it exactly how I asked (medium rare) and I enjoyed every bite of it. All sides are a la carte. Dino & Harry's is your classic, upscale neighborhood steakhouse.  So, if you're feeling bougie and in the mood for a good steak, this is the place for you.
2021-06-20,2,Used to be good but service has completely fallen off. If you're not friends with the owner, forget it. You'll have to wait forever for a table. Also don't even bother trying to use the website for pickup or delivery. Doesn't work.
2021-06-04,1,Absolutely horrible, this is the most expensive restaurant in all of New Jersey and most in NYC. The quality and taste of the food does not justify the price either. They also try to sneak 20% fees for credit cards on top of tip. The owner was so disrespectful, rude and treats his customers like trash. Would not go back to this place if anyone paid me.
2021-05-22,5,I honestly can't believe there would even be a single review under 5 stars for this place. Everything about it is terrific, from the ambiance to the staff, and of course the incredible food. Highly recommended.
2021-05-15,1,Disappointed is the word that comes to mind. Here is a full review on food, pricing, service and attitude: 1. Food: we ordered appetizers, dinner and dessert tonight. Crab and Avocado app was a 8/10. Good taste but bad presentation. Filet cooked right for medium rare and scallops golden well: 9/10. Sides: Brussels sprouts bad. Spinach ok. Corn good. 6/10. Desserts were not intricate and lacked a decadent taste: 3/10. 2. Pricing: It was expensive for the overall experience. 3. Service: I like to keep in mind covid so in 2020-2021 I don't hold it against most restaurants. I was disappointed that the waitress did not explain a 20% gratuity on a table of only 6 not 8. In addition, there was a credit card fee of $20.00 I have never seen. We split the bill among couples and each CC got charged $20.00!! 4. Attitude: when we noticed the $60.00 up charge it was brought up to the owner/Manager. Rather than explaining he went on the offensive escalating it into a heated argument. We asked how/when it was disclosed about this up charge since not on the menu and not pointed out by the waitress. They pointed to one small sign on the side window behind the door that is typically open. It simply doesn't add up for a fine dining experience. I recommend skipping this restaurant. Spend your money on a local place where they treat you right and the food is better than your own grill.
2021-05-15,1,What a rip off. Manhattan prices and inferior food. Stale bread. Mediocre dessert.  Filet was not up to par. For the prices they charge  it's a steal. To add insult to injury they charge extra 3.5 percent credit card fee and neglect to mention it    never going back
2021-04-25,3,So underwhelmed. Seems like they just couldn't get anything right. Brought the wrong wine, greasy flavorless tuna tartare, medium rare meat was charred on the outside and cooked through, no mask on our server, didn't even have paper towels in the bathrooms and had to hunt for toilet paper. Expect so much better for the price. Who's running this place? Solidly mediocre food and service.
2021-04-21,1,Very disappointing.  Steak was tasteless and pasta was ordinary.  Very expensive.  Def not worth it.
2021-04-06,4,Excellent tomahawk for two. I would return for a date and to try more cuts of meat. Oysters maxwell were tasty too.
2021-03-21,5,Hi,    Is Dino and Harry's the "former" Frankie and Johnnies steak house?
2021-03-20,5,Went to Dino and Harry Thursday for dinner again another amazing meal and service try the corn creme brûlée wow
2021-03-14,5,My friends and I came here for dinner and it was some of the best food I've ever had. All the staff were very friendly and accommodating. Nick served us and gave awesome menu recommendations and attentive service. We all tried a bit of everything and the porterhouse and gnocchi were incredible. Great drinks as well. The food is definitely worth the price. Will definitely be coming back often!
2021-03-10,5,Came here in February for a night out with friends. I was pleasantly surprised to see that they did have plastic barriers between tables allowing everyone to feel a bit more comfortable. We showed up right on time and were seated immediately.Food:Everyone got steaks, i got the prime burger. We also had oysters and a few sides. My burger was fantastic, you can tell there was a nice mix of meat and it was cooked exactly how i asked. As for everyone else's food, everyone had nothing but good things to say. Plating was beautiful, and everyone's order came out perfect with nothing to send back. Service:We were seated immediately, and the waiters were hanging in the background to take our orders as soon as we were ready. I was happy the food came out quickly.Atmosphere:The restaurant was definitely at capacity, they had the plastic barriers between tables but it still seemed a bit crowded, especially around the front door. Crowds of people waiting to be seated seemed constant throughout the night, i do wish it was a bit emptier but i felt comfortable personally and it was not a big deal. I did not use the restroom but i was told it was clean, the front of the house was also clean and i had no issue with anything. Overall this place was great. I think the prices are a little high but you get what you pay for. The food was delicious and you're eating at an upscale Hoboken steak house. I would absolutely recommend this place, and i would come back. Nice work Dino... Harry, you get the pass this time
2021-01-30,5,What an amazing place to eat! The ambiance is so pretty and relaxing and the food is even better. I made a reservation for my boyfriends birthday this past weekend and we were fully taken care of from the minute we sat down!Make sure to order the Trio of Empanadas, they're delicious, I'm still thinking about them now. The lamb chops were so good and the porterhouse steak was mouth watering! We ended the night with a chocolate lava cake that melted in your mouth, and definitely filled you up!Thank you so much for such an amazing night and experience, we will definitely be coming back again.
2021-01-24,5,We ventured to Hoboken to try this place and it was worth it! Cute ambiance, food was excellent - I would highly recommend
2020-11-09,5,I dined outside last Friday night and it was a great meal!  Their outdoor heaters work very well, but it wasn't too cool of a night and we got through most of the meal without using it.   Service was very good and our waiter was helpful answering questions.  I started with the french onion soup and my friends shared the chopped salad.  It was nice they split the salad onto two plates without us asking since they knew they were sharing it.  The soup was delicious. For our mains, we each got the petite filet medium rare and we shared sides of the mashed potatoes and the brussel sprouts with bacon.  Was the right amount of food and everything was cooked perfectly. After dinner, we were able to go inside and grab a couple empty seats at the bar for one last round of drinks - they have live music on Fridays so we got to hear the end of their set.  Such a great night!
2020-10-31,4,Rarely eat beef and the night we came here Steak was calling us . We searched up steak and found this place on the top of the list when we searched in Hoboken and I'm glad it did. The host was our waiter and he did a good job managing both since the place wasn't too packed and the atmosphere was very quaint and peaceful. We ordered the porterhouse for two which was absolutely delicious and wet down like butter prior to that we had the wedge salad as a starter with some old fashions. The drinks were just average (wifey liked them, ask for no ice) I would probably stick to beer or wine that's the only reason I gave it a four star. Service was great we also ate a side of spinach and finished the night off with some cappuccinos which were actually surprisingly coffee House material if not better lol. I'm glad to say that we will be returning whenever we have a craving for some banging ass steak
2020-10-24,1,I read so many wonderful reviews and had high expectations of this place, but it was simply NOT GOOD. We waited 45 minutes and finished appetizers before receiving a drink, which we ordered as soon as we sat down. We kindly asked for more bread and were told we couldn't have more because it was "being rationed," and were later told they "ran out" as we watched another table being served bread. The drinks are not good, the food is mediocre and the service is painfully slow. If you're looking for a good steakhouse - go elsewhere. Not worth your time or money. We had to send back one of our drinks after waiting 45 minutes for it as it literally tasted like water. The "truffle" gnocchi tasted like it hadn't touched a truffle in its life. The waitress was sweet, but that didn't make up for everything else. This is a hard pass.
2020-09-28,5,Dino and Harry's has always been exceptional. I've had family dinners here, dinner with friends from out of town and most recently dinner at the bar with my boyfriend. The steaks are amazing (porterhouse for two).. Also love the cod, octopus, burrata. So much good stuff. Great wine by the bottle & martinis. Very kind bartender and owner.
2020-08-15,5,Took the boys and wife/significant other out to this wonderful restaurant last night for a bday celebration.Lovely waiterBill came and didn't review, simply left 20%. Didn't realize tip was included with 6 or more. Left. The restaurant credited back the 20%.Remarkable; maybe there is still honor in the country.Kudos.
2020-06-29,3,I had their porterhouse for 2 ($94) and oysters. I thought it was so-so. It wasn't not good but I was a little disappointed because I thought maybe that would be my go-to steakhouse in the area. I feel like I would rather go to a nyc steakhouse with the price and quality I get.
2020-06-27,4,Food:5 starsCocktails: 5 stars Wine list: 3 stars (short list for steakhouse)Price: 4 stars (typical steakhouse price but 48oz steak used to be $98 for two. Now it's $140 for 3.)Desert: 3 stars (lack of variety)Decor: 4 starsTheir new porterhouse for 2 36oz $78 is too thin compared to their old on 48oz. Not happy that Dino changed the old 48 oz for 2 to 3, then raised the price from $98 to $140. Still very good steak. May need to get the 48oz again next time even if my family don't finish them.
2020-06-22,4,I had been to Dino & Harry's Steakhouse years ago for a charity dinner, but had not been back since.  However, my recent visit was also my first time dining out as restaurants reopened after the pandemic.  We were a bit hesitant to sit outside, surrounded by other diners, but the tables were just far enough apart, and actually more spread out than at other restaurants nearby.  Our server and all of the food runners wore masks and gloves, which we appreciated.When our bread basket arrived, I tepidly reached into it, pushing my germ uncertainty aside for a bite of Italian bread.  Sadly, it was dry and not very fresh.  My disappointment was redeemed with an excellent glass of Cabernet Sauvignon that was fruity, smoky, and a perfect pairing to my upcoming steak.  I was not entirely sure who had crafted the glorious wine, but the dinner check referenced the name "1919 Cabernet"; through a quick Google search, I would assume that this was Lopez Noceti's 1919 Cabernet Sauvignon from Mendoza, Argentina, a region typically more well-known for its Malbecs.  In terms of the food, I could not have been happier with my 6 oz. Petit Filet Mignon.  It was cooked to a perfect medium temperature with a crisp and lightly salted crust, as well as a generous topping of sautéed mushrooms.  My side of Sautéed Spinach had the ideal texture and was not mushy at all.  There were shavings of garlic cloves sprinkled in for an added kick.  I also sampled the French Fries, which had a flavorful hint of salt, but were a bit too fried for my liking.Overall, though, I really enjoyed my meal and first night out in quite some time.  The steak and spinach were both excellent, and I look forward to enjoying them again soon.
2020-05-22,2,I was so excited to order from Dino & Harry's for my brother's quarantined birthday! But after my experience, I don't think I'll order again which makes me really sad because I went by majority of the reviews and was expecting good food especially for the price I paid. The porterhouse steak for 2 was very bland, all I tasted was butter. The panko chicken cutlet tasted very VERY plain, no seasoning at all. The blackened salmon was pretty decent, it came with a side of tomato and avocado slices in a vinaigrette. I was honestly expecting larger portions of the sides...Spinach, asparagus, mash potatoes, au gratin, Mac & cheese....So disappointed with the Mac and cheese! If you're looking for plain, bland foods, then this must be a good spot for you. New York prices, just not worth it.
2020-03-02,4,Rarely do I ever find myself venturing out in uptown Hoboken. On this rare occasion, I went for a friends birthday party. Dinner reservations were all set for a Friday night at Dino and Harry's. This being my first time at the restaurant I got there early and scoped the place out. The restaurant reminded me of an old school saloon filled  with wooden decor and a piano front and center. To start we wanted wine, RED WINE. The waiter offered us some of his favorites and we went with those (they didn't disappoint). We then  ordered a bunch of appetizers as there were eight of us. Clams, mussels, and calamari-the usual for a group of Italians. Seafood can be hit or miss especially at a steakhouse but this place really nailed it! Now for the steaks. Most of us ordered the surf and turf special (SEE BELOW). The steak was one of the most juiciest flavorful cuts I've ever had in New Jersey. The lobster tail was equally as tasty as it successfully complimented the dish. The only negative I have to point out is that the price of the steaks was similar to New York steaks but didn't match up to the quality of the meat. Overall great meal and great ambience making for a great night.
2020-02-18,4,3.5 stars. The drinks and apps were great. The utensils could have been cleaned better, they had some food bits. For being a steakhouse, they didn't do a great job with the done-ness of the steaks. My medium rare didn't have much pink if any, and my friends had similar issues. The staff was very polite and helpful which was nice.
2020-02-08,5,I must say that I love this plaace. The food is amazing and the service is great. The prices are fare for the quality of food. The drinks are great. Nice people. Great vibe
2020-02-02,5,One of our favorites Uptown places for dinner and drinks.  Classy old school type of steakhouse with amazing steaks (love their porterhouses to share), fabulous sides (thick cut bacon , potatoes au gratin, creamed spinach and my all time favorite, corn brûlée).For less formal dinners, grab a seat at the bar and any of the bartenders will make you a perfect dirty martini while you wait for your food.  For dinner, they also have a very impressive wine list.Friday night features live music and always packed.Come for the atmosphere, stay for the food and drinks.   this joint!!!!
2020-02-02,4,Celebrated a friend's birthday here with friends. The bar and restaurant is a beautiful space. I ordered off the restaurant week menu and had the kale, arugala salad, the cheese ravioli with mushroom sauce and apple crisp. Wow..the ravioli was delicious! Hubby had snowboken for dessert which was fantastic! Apple crisp was large, hot and crispy. We had a great night! Thank you!
2020-02-02,4,Service was wonderful although we went on a late Thursday night. After reading reading about a rude waitress I was a little worried when the only waitress (all others were waiters) happened to be serving us but she was great!! My husband's steak was a little overdone and she gladly brought him a new one. I had the grilled shrimp entree which was sort of a salad but way better! far beyond my expectations and really delish. The ambiance is nice, think rustic steakhouse (steakhouse meets pub?) rather than mod steakhouse. Price was okay but also my only major negative because I felt like it was NYC prices
2020-01-30,5,What an amazing time I had with my family and friends, and D & H helped to make our time  together  the best ! Food Was delicious, my steak made to perfection. And a  yummy  apple crisp and snowboken. Deserts.Customer  service was friendly and attractive.   Well  done, I can't wait to come Baal soon.
2020-01-23,4,My 1500th review goes to Dino and Harry's!It was my fiancé's Dad's birthday and we were looking for a last minute dinner spot after Augustino's gave our table away. We found a reservation for Dino and Harry's so it was perfect - we've been meaning to check it out anyway. It was MLK Jr. Day so it was pretty empty at around 6 pm. To start, they brought us the best bread basket ever. It included hot/freshly baked rolls, bread sticks (the crunchy sesame ones), and flat bread crisps. It was nice that they provided a variety. For food, we ordered a bunch of things to share amongst four people. We ordered the Scallops (roasted cauliflower, Pearl barley with a morel mushroom sauce). The scallops were perfectly cooked but a little too salty. Luckily, the rest of the dish was not. I loved the creamy mushroom sauce. Paired with the Pearl barley, it was very innovative. For steak, we did the 32 oz Porterhouse. The menu says it's for two people but this with the scallops and two sides was more than enough for us. We even had leftovers. The steak was good but pretty oily - probably the reason why we all filled up rather quickly. Creamed spinach and brussel sprouts with applewood smoked b weacon were the sides we picked (all sides are $10 each). The creamed spinach was a bit off to me. For some reason, it tasted minty to me (it was just me though). Surprisingly, I enjoyed the brussel sprouts even though I normally don't like them. Food was good overall, service was great - definitely don't mind coming back for another special occasion.
2020-01-19,5,Great atmosphere, great for date night or just a drink at their bar - however , u have to stay and enjoy something off the menu   . As some say NYC prices however you get what pay for. I have tried many dishes on their menu and it NEVER  disappoints.Drinks: are not weak and all properly prepared   Porterhouse; always made to your liking fresh and tender Pasta; perfectly made al dente Thick cut Bacon ( appetizer)   It's very thick cut and has a greaT flavor to open the palate for the main course Grilled  Octopus;  is very good, just wish it was a larger piece .Lamb chops: wow !   They are large pieces perfectly  chard on the outside and med inside ( as requested )  They are my new favorite  at Dino's Desert: are light and just the right amount to share                I personally enjoyed the  lava cake more over     the cheese cake Over all great staff and very attentive  , The only complaint  you might have is the wait for a table, however  it will be worth the wait.
2020-01-14,1,The food is not the problem here. By the way, its good steak. My fiance and I went to dinner here with a friend of ours who is pregnant. We were early for our reservation but the door staff wouldnt seat us until 30 minutes after our reservation. The part that really dissapointed us was that it was a busy Friday night and our friend was not offered a seat at the bar or a chair to wait, and when we asked kindly for an update we were given a dismissive response. Our friend was great about it and didn't make a deal of it despite having to stand in a crowded bar for a half hour, but I found it to be the least compassionate service I've ever encountered- especially when we already had a reservation.Just know this is what to expect if youre expecting.
2020-01-04,3,Walked in early on a weekday, empty. Needed a table for dinner. Host said "we are booked". I laughed. He was serious. Ok, then he worked some apparent magic to get us a table. He said reservations are pouring in now. Ok, gotcha. Hours later after we finished a full steak dinner with apps and dessert, the tables surrounding us were only partially full. Next time Mr. Host, make your guests feel welcome, not like you are doing them some grand favor. Food: steak good, oysters great, wine list ehhh. Sides good. Dessert, abysmal. The bread pudding was microwaved rubbery crapola. Sent back and said no way. Price: higher than NYC prices, holy moly bring your Amex.
