2014-01-20,2,This restaurant hates babies. Dino hates babies. The hostess hates babies. Let's set the scene: 2 couples and a baby go out for a steak during restaurant week. Make reservations via Open Table and in the notes section request room for a baby accompanying us to dinner. I arrive early, check in with the hostess. Hostess scolds me for making the incorrect reservation, I apologize. She agrees to seat us reluctantly but once again reiterates how wrong I was in making the reservation incorrectly... Once again I apologize and thank her for accommodating us and allow us to eat their $50 steak. We get seated quickly, once again get scolded since our friends arrive 10 mins late after looking for parking. At this time, I'm annoyed - we get it lady, you're impeccable and we're the worst at being diners. Cut to: being seated. All's well, waitress is friendly, can't wait to eat steak. A man comes over and introduces himself as Dino. Rants for about 5 minutes on how wrong we were in bringing a baby without calling ahead. I tell him I wrote it in the notes section in the reservation. He says he is too busy to read notes. I apologize. Sorry, my psychic powers were turned off that day. He continues rant about how accommodating they were in allowing us to eat at his establishment. Friendly waitress then profusely apologizes for Dino's behavior. We eat good steak, mediocre wine and chocolatety dessert. A for food; F for customer service.
2014-01-15,5,What a place! Simply a great local joint for those in / close to Hoboken.Old school steakhouse atmosphere, friendly staff, and delicious food!I usually start with the bacon and possibly a wedge salad or shrimp cocktail and then cap the night off with a beautiful Porterhouse or Filet, depending on my appetite.Wash it all down with a glass of wine or your choice of cocktail and you have yourself one of those great Hoboken nights.
2013-12-09,1,I've been going to D&H's for several years and never had a problem. Always enjoyed the food and service.Unfortunately, this past Saturday night my opinion of this place changed forever. A few points to preface. First of all, my wife, son and I have probably eaten here half a dozen times in 2013 alone. We always come between 5:30pm and 6pm and never have an issue getting a seat. Also, they do not take reservations, so it is first come first serve. On Saturday, we brought our nephews so we had five people in total. When we arrive, at 5:55pm to a restaurant that is 75% EMPTY, the hostess says it is going to be a problem seating us because a party of over four people needs a reservation. I hate when restaurants go in between like this. Either require a reservation or don't. There is no point in doing both.She checks with the manager and they say the next time they can seat us is 7:30pm. This is impossible since my son is 2 and would be a wild man halfway through dinner at that time. This brings up another interesting point. They are counting my son as a fifth when a two-year-old really shouldn't count in the equation.Since they were unwilling to help us out, even though we had three children, all under the age of 10, we left. The manager sensed we were quite angry and chased after us saying "what do you want me to do it's the holidays, I have a lot of parties coming".Maybe take care of your best customers, especially when they are trying to show their nephews a nice dinner in Hoboken.I will never go here again. I hope they don't treat future families like this or they'll be out of business quickly in a town that has a lot of other dining options.
2013-12-08,4,I was here for an all-guys birthday dinner. Great place for that... steak and Scotch in an upscale atmosphere. We had the fried calamari and empanadas for apps, both delicious. I had one of the specials, the 18 oz. sirloin steak covered in blue cheese... and it was delicious. A few of the guys got the 24 oz. Porterhouse... man that steak is a beast... and they thoroughly enjoyed it. Another enjoyed his filet. All-in-all, a good time.
2013-11-29,4,Went here last Saturday (11/23) with my boyfriend with no reservations and we were seated quickly, which was surprising as it was past 7. We sat at a cozy table for two in the back and ordered a glass of wine each (I ordered the 1919 Malbec and he ordered Merlot), both of which were excellent. For appetizers, I had the crab cake with remoulade sauce and he had French onion soup. The crab cake was huge and could almost have been a meal, and was stuffed with giant pieces of succulent crab meat. For our main entrees, I ordered pan-roasted salmon with potatoes in a boullionaise sauce and my boyfriend ordered porterhouse steak (medium rare). The salmon was cooked perfectly, but was so large I couldn't finish it. Likewise, my boyfriend couldn't even get through half his steak. The service was pretty good, if a little slow, but a word of caution: do NOT eat any of the flatbread sticks in the bread basket. They are highly addictive.
2013-11-16,2,Cannot believe that this joint has gone down hill so fast.  We've been here a number of times and the the steaks were generally pretty good.  Last night all the food was way below average.  Bone in filet was just bad- the salad was tasteless the fish was dry...the good things were the piano player and the $150 bottle of wine I purchased.  Our very expensive meal as a means of celebration had us leaving very fast without eating even half of our entrees...it used to be so much better.  Note to management:  the quality of food that you're buying is saving you money but you're losing customers as a result.
2013-11-14,5,THE BEST SIRLOIN I HAVE EVER HAD. PERIOD. (I worked in a big name steakhouse in manhattan for 10 years...) The service rocked also. Love the old school experience. A LOT.
2013-10-18,2,Picked up to-go while on business in Hoboken.  Typical steak house atmosphere, nothing special and neither was the food.  My biggest beef, :), with this place was the service.  I will give them the benefit of the doubt, being that it was only 6:00, however the hostess literally pointed me to the bar without saying a word.  The bartender, just gave me my total.  That was it, no hello or good bye or anything else for that matter.  And to cap off the horrible service, they didn't even add silverware to the bag.  Wont go back.
2013-09-10,1,Everything about this place was terrible.Tables on top of one another with no ambience whatsoever. Old decor and a dirty bathroom. Now onto the food.... I ordered the rib Eye and half of it was complete fat. My girlfriend ordered the sirloin and asked for medium and it was overcooked.
2013-09-10,1,If you've ever had good steak and service, don't bother going here.  My husband and I were craving a nice steak dinner (think Striphouse or even Del Frisco's) and this place has a pretty good reputation (in Hoboken).  We were so disappointed.  It felt like we were dining on a groupon - based on the quality of the food and service.  The waitress acted as though she was working at Ponderosa and gave us an attitude when we wanted to change one of the selections we made.  The tables are packed on top of one another.  Don't bother trying the strawberry shortcake dessert - it's basically a scone which tastes as though it's made out of crisco.  For a better local alternative (still not great) go to Ruth's Chris in Edgewater.
2013-08-29,3,Went here for a surprise 40th birthday party.  The place itself is really nice, the decor is old school with lots of dark, rich woods (rich Mahogany anyone?)  I had the Porterhouse steak, which was OK.  The filet side was like butter, so tender.  The sirloin side was a little more tough, even though I asked for it medium, it was more medium/well.  Overall, I am not a huge steak guy though I was not disappointed going here.
2013-08-28,5,My experience at Dino & Harry's was long overdue after multiple recommendations on the place. I had only seen the restaurant from the outside for quite some time before I said screw it and made a reservation for my birthday. The best way to describe Dino & Harry's is that it's a necessary establishment that belongs in Hoboken. This is the only steakhouse in Hoboken that matters. Yes, there are restaurants that have good steak in Hoboken. But this place has it all. Between service, ambience, and excellent food, I'd recommend Dino & Harry's to anyone who's looking for a great steakhouse experience. Sure, you can visit Ruth Chris in Weehawken, but it's not the same. There's nothing about Dino & Harry's that feels like it's a chain or franchise. The best part? I am a little unclear on whether I had a bone-in ribeye or NY strip. But I will say it was perhaps one of the best cuts of meat I have ever had.
2013-08-26,4,A MUST for Hudson restaurant week! Also a really nice place for a special dinner out. The bacon appetizer is dreamy.
2013-08-09,4,Never had a bad meal here.  I stick with the ribeye and porterhouse for two.  The applewood bacon app is great and the Brussels sprouts and pancetta is a great side
2013-07-28,4,I love this place. I usually go for steak but tried the ravioli last night and it was the best I have ever had. Unfortunately, my boyfriend was not so lucky with his choice. He got the penne with chicken and it looked, tasted, and smelled awful; like a frozen dinner. This was the only bad experience we have ever had here, but everything else is delicious.
2013-07-07,5,Between atmosphere, hospitality, service and food, this restaurant is the holy grail of fine dining in Hoboken. Upon walking in, the stately decor is intriguingly offset by the diverse combination of both old and young diners. My boyfriend and I were sat in a cozy nook by the windows, off of the main dining room. The loudness of the dining room was pleasantly muffled and made for a romantic experience.Our server was a lovely, grandma-esque lady who was attentive but not overbearing. We began our meal with the Salmon Tartare, which was incredible. A perfect combination of the fresh fish flavorfully combined with ingredients that stood alone yet melded together in harmony.Our main course was the 48oz Porterhouse for 2 - Medium Rare, Augratin Potatoes and Brussel Sprouts with Pancetta. The steak was very well seasoned (perhaps, for some, overseasoned) with a nice dark crust, and the Filet portion was perfection. Unfortunately, we discovered that the New York Strip side was gristly and inedible for the price tag. Our waitress realized something was wrong, so we told her our disappointment with the steak. Without hesitation, she offered us an entirely new Porterhouse, despite the fact we had demolished the Filet side. Seeing so much meat as overkill, we suggested that she simply bring out a new NY Strip, which she quickly fulfilled.We left Dino & Harry's with full bellies, an entire meal of leftovers, a bill charging us only for a NY Strip versus our 48oz Porterhouse, and a renewed faith in humanity.
2013-06-17,2,I called 3 weeks in advance for a reservation for father's day.  Upon arrival the unfriendly hostess told me we'd have to sit directly behind the hostess stand in the bar area as all of the other tables in the restaurant were reserved.  Food was good as usual and service was friendly.  As we went to leave I realized the 15 other 4 person tables had not been used at all during our hour and a half meal.  Super disappointing especially on a holiday.  We won't be returning.
2013-05-26,5,I came here to celebrate an anniversary with my girlfriend. Very classy place with live musicians playing on certain days. Service was excellent. Our waiter was very knowledgeable and delighted to answer any questions about the menu and wine in detail.  The salmon was delectable and the steak even more amazing. Quite possibly the best in all of Hoboken. Definitely pricey, but they definitely know what it means to create the perfect dining experience.
2013-05-16,5,I'm a fan of this place.  Came here with two other people, both meat eaters and I'm a vegetarian.  We had the octopus appetizer, salads, steaks, three veggie sides (asparagus grilled, broccoli steamed and the sautéed broccoli rabe).  Also had a baked potato.  It was all very well prepared.  Given that I got three veggie sides each cooked a different way it was a nice surprise to see that they did each one just right.  The guys had a t-bone and a filet and both were really happy.  We had visited a Ruth's Chris a couple weeks ago and my date said the steak here was more flavorful, and really tender.  For dessert we had the molten chocolate cake with vanilla ice cream and the Snoboken, which was like a chocolate sundae with oreos and coconut flakes.  That was not shared but was completely finished.  The molten chocolate cake was really good, warm and gooey as promised.Amongst us there were three draft beers, one Hendriks and tonic, one sambucca, sparkling water, two decaf coffees and an iced tea.  The total without tip was $254.  Service was professional and efficient, nothing came wrong and the timing was good so we left $60 tip.Must also point out that the music at Dino & Harry's is really good.  We came at 8pm on a Thursday and there was a pianist adding, like someone else pointed out, a nice touch.  Toward the end of the night a three person band came on.  Looked like a cello being played as a base, a guitar and I think bongo drums.  Sounded odd, but it was great.   We lingered after dinner just to enjoy them.  The music sounded original and the singer had a terrific voice.  The set-up of the restaurant is such that the music can be enjoyed without taking over the dinner, unless you're in the bar area.I'd come again just for the ambience.  It has real charm, they're confident and it's very comfortable.
2013-05-09,2,Had an 8 pm reservation on a Friday night. My wife and I had a table so close to other diners that we couldn't hear each other over their convos. Prices were a bit high, and my wife's chicken/pasta dish was mediocre. I loved the salmon though. This was supposed to be a nice date night for us, but we didn't enjoy the atmosphere because we could hardly talk to each other over the music and other diners. Won't be returning.
2013-04-14,4,#MeatcomaI guess I should update- since my last review, I have in fact joined the dark side. I just shared a porterhouse for two with my husband (medium rare, obvi) and it was absolutely luscious. A nice char but still mooing inside, with just the right amount of fat cocooning it. Whew. I need a cigarette. Again we ended up here when we couldn't get a table anywhere else and it was a happy mistake. The pianist playing "We are never getting back together" and a generous pour for my glass of Malbec made for a perfect evening.
2013-04-12,4,Have been going here since Dino was associated with Frankie and Johnies - New York, locally known as On the Waterfront.   There is never a wait (for me) for a table. Probably helps to be a regular.  Waitstaff is long standing and very helpful and polite. Prices are medium to high.  Food is good to excellent.  Chopped salad is among the best - anywhere.  I am not a meat eater (anymore) but the fresh fish is excellent. If you want to eat in the very  that Marlon Brando danced with Eva Marie Saint in "On the Waterfront" go here!  If you want to have a drink at the bar where Karl Malden slapped Marlon Brando in "On the Waterfront" ; go here!.
2013-03-24,3,The food is certainly 4 or 5 star quality. Let me get that out of the way early in the review. My deductions come in the other aspects of the restaurant experience.Food*Nice selection of steaks and prepared expertly. Our table had 3 filets and a ribeye and all that was left was the bone.*Sides of asparagus, potatoes, and mac 'n cheese. The mac was a bit plain, but fine nevertheless. *Tremendous bread basket.*Tempting dessert menu. Sorbets were flavorful and a deceptively generous portion. Looks small in the dish but kept us working for a bit.Drinks*Really great wine menu. No matter what your palette, they'll have something for you by the glass or the bottle. Reasonably priced by the glass, too, or as reasonable as you can expect.*I'd love to go back for a glass of wine or cocktail at the bar to kick off a night.Service*Here's one star off. Our server was friendly and knowledgeable, although didn't seem entirely confident. He just seemed to go missing for stretches at a time. We had an early reservation and the place was pretty empty for most of the meal, so not sure where he went. He also forgot one of the sides we ordered but it didn't show up on the bill so no harm, no foul. Turns out we didn't reall yneed it anyways. He also had some trouble maneuvering around the table. Plates also stayed on the table for a looooonnngggg time before getting cleared. Maybe there was a disconnect between service and bussers, but just wasn't the well-practiced service I'd expect from some place with such a reputation.Appointment*The atmosphere is very charming. Beautiful space with nice features and designs.*Piano is a nice touch.*It is a unique place for Hoboken...*...until the crowd starts showing up, then it's Jersey with the capital J. D&H is running a business and I get that means having to seat everyone, but what happened to class and social graces at going to nice restaurants? Bar filled up with central casting Jersey guidos. One guy in a track suit, others in jeans and tight shirts. Swearing, yelling over each other. Boisterous and obnoxious. The tables seated next as our night wound down were the trashy stereotypes. Talking on their phones, absolutely hilarious outfits/hair styles/tans/makeup, and just didn't know how to act. Just zero class. Glad our bill came when it did.*Factor in the piano and the goombas and it was impossible to hear anyone at our table, but we heard loud and clear that "yeah, mah sistah's comin' from bayonne, save huhr a seat. hey, tommy how ya balls?"Great meal, so-so service (or maybe just someone new, in which case, much respect), really awful crowd. Been wanting to try it for awhile and glad it's crossed off. Not sure I'd go back because there are plenty of steakhouses that know how to how to attract, manage, and filter the right type of crowd.
2013-03-22,5,I went to Dino and Harry's with my family of 6. First and foremost, the staff was genuinely engaging, friendly and attentive from the second that you walk into this warm old-style Hoboken atmosphere. We had a reservation (made about a week in advance) and had no issues. Although we arrived right on time, we opted to have a drink at the bar prior to being seated and there was no rush to sit down. Once seated, our meal was just excellent. I personally split the hearts of lettuce salad, porterhouse steak and the truffled shrimp risotto with my sister; all of which were amazing and I recommend to everyone who goes. No one at the table had anything but greats reviews for each and every item on the table. We also sat just outside Eli Manning and David Diehl's table which had the curtain drawn after they walked in... that wasn't so bad either :)
2013-03-17,2,Went with the recommendation of the waitress, which was the ribeye.  Ordered it medium-rare and was not overly impressed.  Service was sub-par, it was very hard to get in touch with my waitress.  I would consider going back but i would absolutely not not to expect a great dinner.
2013-02-23,4,We enjoyed a fine meal at Dino and Harry's last night. The place has old-school charm with a jazz pianist and a dark, wood interior.Drinks are well made and service was quite good (although not quite up to snuff for the prices.)  The meals were excellent. We started ours with the tomato and onion appetizer, served with an excellent blue cheese vinaigrette. My wife's filet medallions were quite substantial and I enjoyed the petite filet and baked potato. The cuts were very good and preparation was tasty.All in all, this is a very good place for steak and a quiet dinner. It is a touch pricey and I'm not sure the food and service quite matched the expense, but I'd still return.
2013-02-06,5,I was told this was a best steak house in the area.   Better than Peter Lugers. I had the chopped hearts of lettuce with blue cheese and bacon.  Amazing!  Had the 10oz filet which was cooked and seasoned perfectly.  The service was top notch as well.  Very polite staff. The ambience is very classy. I will be back for sure.  It's embarrassing I've been living the area this long and haven't been here before. Cheers Dino and Harry!
2013-01-12,4,The last time I made it to D&H's was on a holiday weekend, and it was an incredibly mild scene.  Though the food & service were great, it was a lackluster evening.  This time, was exactly the opposite!My fiance & I had dinner here last night, and loved every minute!  The bar scene was vibrant, with a piano going & people crowding around.  We sat at a table in the back.  I will say that it was crowded, and the table next to us may as well have joined us.  Would be nice if they took one or two tables out to make it a little more comfortable.Beyond that, I have NO complaints!  I had a martini, Hendricks, which they were glad to garnish with a cucumber (try it, trust me), and she had a Cabernet.  We started with some Blue Point oysters, and moved seamlessly into our entrees - she had the Rib Eye & I the T Bone, which we accompanied with the ridiculously good mashed potatoes & some sauteed spinach.Great cuts of steak cooked perfectly.  Nothing more to say about that.Another update from last visit: the service was great.  Prompt, friendly, accurate.  What more do you need?$$$$, but with two 24oz steaks, we have enough for lunch today!
2013-01-04,4,After reading many positive reviews about Dino and Harry's me and my wife decided to give the place a try. I was already expecting a Peter Lugers type of masculine atmosphere and there were no surprises in that department, the atmosphere is simple and classic. We ordered the appetizer of thick cut bacon which was very flavorful and my wife had the special butternut squash soup which left a lot to be desired flavor wise.  for dinner we had the 24 oz ribeye which was very well flavored and aged to perfection and the petite filet was buttery and very juicy. For sides we ordered a baked potato and creamed spinach, both very good and we washed it down with a bottle of Valpolicella. Service was very straight forward and no frills which was fine but felt more like a diner than a nice steakhouse and the host could have been more personable as well but like most reviews state you go here for the steaks, and steaks only.
2013-01-02,5,It is the best steak (and maybe restaurant) in Hoboken, and, yes, New York City as well. The only possible superior steak would be from Peter Lugers in Brooklyn but, if you are already in Hoboken, why go to there? Seriously, anyone that gives this place a less-than-stellar review either had the rare misfortune of getting a bad cut of meat, work for another restaurant, or feels slighted by the down-to-earth service (for the record, the service is great, but some people just need the continual white-glove, ass-kissing service that some restaurants have). The steaks are unreal (even though the sirloin is the signature cut, try the filet--comes in petite and large varieties). They also have a gorgeous porterhouse, with both the sirloin and filet, but I prefer the off-the-bone filet the best; a-la-carte sides are amazing (creamed spinach, mashed potatoes, and tomatoes and onions are my favorite) and the appetizers are very good (shrimp cocktail, especially). Additionally, they just started doing a pasta dish (ravioli of the day kinda thing). Without a doubt, the best pasta I have ever had, and this includes Italy, an Italian mother, and Augustinos in town. My only complaint is that the pasta is a bit pricey for what you get, but it is so difficult to make and made to order, so I understand the cost. Therefore, my complaint is nullified. I routinely go here with some other extraordinarily finicky eaters and we are always loved and impressed by this placeFor the record, I do not work here, so its not one of those fake reviews. I just noticed that there were no reviews and people should know how amazing this place is.
2012-12-17,3,I loved the food at Dino and Harry's so my rating is based on the whole experience. I had the tomato/basil soup for an appetizer, which I must say may be the best I have ever had. It was thick and bisque-like so I really enjoyed it. For dinner I had the filet mignon and my boyfriend had the porterhouse. Although both were medium rare, I thought his steak was way more flavorful. Either way I enjoyed both ! For sides we had the lobster mac and cheese which was to die for and the mashed potatoes, also very good. They had a great wine selection and the drinks were nicely made. So why not 5 stars you ask? Well for starters the hostess sat us almost 40 minutes after our reservation. She was on her cell phone when we arrived and after about a minute looked up so I could tell her my name. For the 40 minutes we were at the bar (which was not bad since we had some coctails) she proceeded to tell us that she didnt know where the bus boy was and that our table would be cleaned any minute. This was not very professional at all. Once seated our server was a little slow getting everything to us and only checked on us about once. The ambiance was very loud as well. Not what I expected for an upscale steakhouse. All in all, if you don't mind mediocre service and disruptive noise while eating this will probably be your favorite steak joint.
