2018-03-15,4,Conssumtate NJ steakhouse experience. I have been coming here for over twenty years, when it was Frankie and Johnny's. Every time I visit the NY City area, I come for dinner at this feel-good spot in Hoboken. Tasty steaks, cooked to order, same wonderful staff I have seen for many, many years (always a good sign) and still my favorite house steak sauce. Can't go wrong with anything on the menu.
2018-03-11,5,This place over-exceeded expectations. The atmosphere was lively.  The food was delicious.  The service was impeccable.  THE Cal Ripken Jr. (who we're told frequents this restaurant often) was sitting right near us!  How can this place be bad??
2018-02-16,1,I had a bad feeling about this place from the moment we stepped inside. The areas around the maitre d's desk and the bar were packed with people still waiting to be seated for their 8pm reservations after 9pm (kind of defeating the purpose of a reservation at all, especially since they require a credit card to make one). No one seemed happy, ranging from mildly agitated to infuriated. It took a while for anyone to speak with us. The maitre d eventually reported it would be around 15-20 minutes, to which another guest responded "it'll be an hour" (another guest waiting for their 8pm reservation). Needless to say they had a few thoughts to share with management.Another guest with an 8:30 reservation started to complain again. He was curtly told there were still people waiting from 8pm. At this point I lost interest in dining here, as they clearly lacked basic customer service skills and were blatantly lying to their guests in order to keep them angrily waiting. Definitely a shame, because I've heard the food is quite good. When we tried to cancel our reservation, the maitre d attempted to keep us waiting, pointing out it had only been 10 minutes after our reservation. Once I told her I just heard her say they were backed up by over an hour, she finally relented and let us cancel the reservation.Apparently the people who stayed regretted their decision, due to the long wait and poor service during the meal, so I'm glad we left. We ended up having an amazing dinner at Lola's down the street.
2018-02-15,3,Food was above average.  Steak a little dry for the prices.  Had a terrible experience the first time as the service was the worst ive experienced.  However, I gave it another shot, and was very pleased with the service.  The lack of consistency in service is why its 3 stars, along with the quality of the food not matching the pricing.
2018-02-14,1,You're better off eating at Red Lobster. Food was way overpriced and completely underwhelming. Service was atrocious from the Maitre d to the wait staff.  Either scale back to an Olive Garden or take yourself into the city for a proper steakhouse with edible surf n turf. Not worth wasting your money, your patience, or palate on this place.
2018-02-14,2,I actually loved the food but the service here was terrible. I went here for my birthday dinner on February 7, 2018 and the hostess was absolutely nasty. When we went to the bar to order a drink it took 10 minutes and the bartender was just standing there.
2018-02-13,5,This is one of the best places in the tri-state. I remember this place as Frankie and Johnnies when I started to attend special events like political functions to birthday celebrations or taking my family for an amazing meal. The service, decor and food are 5 stars.I never had issues here just amazing memories. I highly recommend to start out with the Applewood Smoked Bacon ($16) and the Fried Calamari ($17).  For entrees I would recommend the aged steaks whether it's the T-bone or Sirloin steak (16 oz - $41.00 or 22 oz. - $52).  (They have their own house steak sauce). If you're not into meat I recommend the Chilean Sea Bass Atlantic Salmon ($33) or the Alaskan Halibut ($33).I think the T-bone is a bit farrier which gives a little bit more flavor than the sirloin but for a nice 16 oz. You're going to be just fine if you enjoy a nice steak! You have to try to make room for dessert which are amazing as well, I recommend trying the Snowbroken (an oreo dessert) or the strawberry rhubarb which is sweet and tarty.The owner Dino is mostly there and very friendly to approach and if you're lucky they have a pianoist or a band performing on certain evenings which is delightful and let's you make some requests.They accept cash or credit just make sure you area able to find parking prior, there are lots available which you can find.  I believe for 3 hours and it costs around $8.00.
2018-01-27,3,Food was nothing special. Went for restaurant week but there are better steak places around
2018-01-14,4,I would give 4.5 stars if that were an option... We had dinner here last night for the first time. We started out with a drink at the bar while we waited for our table. For an appetizer we had the grilled octopus which was good, but not great. For dinner I had the petite filet and my husband had the 22 oz. sirloin and for sides we had the gnocchi and brussel sprouts. Everything was very good! The ambiance was great and our waitress Leslie was amazing! We will definitely be back!
2017-12-01,1,The worst hostess you will find.  We had a reservation and were told that they were running 30 minutes behind.  30 turned to 40 then an hour.  The hostess was dumb as rocks and asked us why we kept asking for our table! By the time we got our table the kitchen was about to close and no apologies given.
2017-11-09,5,So I'm 8 months pregnant and my husband wanted to take me out for one last romantic dinner before we become a family of 3.  We came in on Saturday night and the wait was going to be about 45 minutes.  There was a sweet young hostess named Genesis who took one look at my swollen ankles and found us a table right away.  The food was delicious and the atmosphere was pleasant.  I don't think I could have stood for very long and I won't forget her kindness or the great food.  Looking forward to coming back as a family of 3!
2017-10-11,4,I have been here a few times and overall great place. The food is excellent, They have someone playing the piano for some peaceful entertainment.  Probably would give 5 stars but I feel they are a bit over priced. I would definitely return but probably only for a special occasion.
2017-09-19,5,My favorite steakhouse in the world. Nothing compares to the quality of food at Dino's, HANDS DOWN. Honestly don't think you'll find a better steak anywhere else. Service is unbeatable. Worth every cent!
2017-09-01,5,Only order the Filet sandwich and peach cobbler dessert and both were fantastic. I rarely order a steak sandwich but the filet was tender, the provolone cheese and mushrooms were perfect. Fried onions on the side were the perfect compliment. The peach cobbler dessert was a fine finish. I recommend both highly.
2017-08-05,5,Every bite was perfect.  I had a mixed greens salad with pears and almonds.  Followed by mignon medallions on a bed of green beans and truffle mashed potatoes.  The steak was med well and so very tender and juicy.  It was the right amount of food.  This was Restaurant's week $40 menu.  Usually all sides are a la carte and the steaks are a huge portion.  For dessert I had the peach cobbler with passion fruit sorbet.  Margarita on the rocks was perfect.  7 out of 10 cocktails I don't like but I was pleased with this one.  All around it was a great meal.
2017-07-28,3,Good spot.  Decent restaurant week specials.  Got the filet medallions.  I'd def check it out again.
2017-07-28,4,The food is pricey but delicious!! Service was great and the drinks were strong. The atmosphere is a classic steakhouse vibe and decor. A great place for date night or a special occasion. Get the ribeye! You won't be disappointed!
2017-07-26,5,Yay! For restaurant week. Parking sucks, however, there is a garage just one block away. 3 hours = $8.00. The decor and live music (pianist) made for a romantic date night. To drink: I decided on the Pinot Nior, my usual go to red and my date opted for a Moscow mule. To start: (restaurant week menu) we ordered an arugula, almond, blue cheese, fennel and apple salad and the chick cut bacon. Both were well balanced in flavor and very tasty. For entrees: we ordered the filet mignon medallions which were accompanied by mash potatoes and string beans, and the branzino, which was a beautifully pan seared filet over cauliflower rice. Both were very good. The filets were seasoned and cooked perfectly and the branzino was prepared very well. I would say top three branzino filets I've had thus far. Desert: we had the trio sorbet which consisted of tamarind, coconut, and mango over a watermelon sauce and a fudge, Oreo ice cream sundae with coconut chards. I will be back soon for a special occasion to try their regular dinner menu.
2017-07-26,4,Very hard to find parking utilize a parking lot if you can't find anything. I went for restaurant week, so the food may have been altered for the restaurant week menu. A pianists on the piano, makes for a great date night and a different venue style in the area. I had a salad (nuts, blue cheese, apple cuts), very good. I had the filet mignon and it was great and tender not much more to say about it. Ordered the orchard mule (apple/pear mule) $15 but great size and tasted great. Also, I had a desert, I can't remember the name of it but it's vanilla ice cream with fudge and coconut shavings (great for chocolate lover).
2017-07-11,5,Dino & Harry's has been my favorite restaurant for about 20 years.  I have never had a bad (or even mediocre) experience there.  The the service is excellent and the food is fantastic.  The pricing is also reasonable for a quality steakhouse.  I highly recommend Dino & Harry's.
2017-06-28,3,Porterhouse for two is excellent and a huge portion - I will give them that.  Wine selections by the glass are subpar.  Service also very slow and unattentive.  Be sure they don't seat you by the bar or else you will be glaring at the noisy drunken regulars all night while trying to eat.
2017-06-19,5,We had a great Father's day dinner. The sat us at a nice table right on time for our reservation. The waitress and bus staff were prompt and helpful. Attentive but not over bearing.The bread and breadsticks were fresh and tasty. The butter was at the proper temp, firm but not hard or melting.We ordered cocktails. They came quickly and were a nice size pour, especially for the expensive scotch I had ordered.We had oysters as an appetizer.  They were fresh and very good.The steaks came next. I had the 16 oz sirloin and my wife the 16 oz. prime rib. Both came prepared properly to our requests.Over all an excellent meal.We skipped desert. We walked to the river and got ice cream at 16 handles. Sat by the water to eat it. A nice end to a great evening.
2017-06-15,2,I don't know the history, heritage, legacy or legend of this place, but to put it mildly, was extremely disappointed. Do not make the mistake of assuming you are going to a first (or even 2nd) rate steakhouse.The positives: Started with the "Beef salad" and was pleasantly surprised with the well aged, and perfectly prepared thin strips of beef layered on top. $16 The negatives: ambiance, price, and taste of the lamb chops and fillet mignon sandwhich, $26 and $30 respectively.They simply don't know how to prepare medium well lamb (or beef). The chops came out way too charred and my wife couldn't eat them. I joked that I wouldn't even feed it to our dog. The fillet mignon sandwhich was also prepared medium well as requested but was just strips of not very tender beef with unimpressive flavor. I neglected to mention that I don't like cheese on mine, so when it was brought over I was hoping they would make another one for me, but no luck....I guess understandably so at $30 ($8 at any other diner - same flavor).Anyway, long story short...would I ever go again? HELL NO! Kinda surprised how they stay in business at those exorbitant prices, unimpressive flavor, and inability to properly cook meat to 'medium well'. They wouldn't survive in NYC and I am baffled as to how they stay open in Hoboken.
2017-06-07,4,To begin, the service is amazing. A seasoned crew makes all the difference in my opinion, our waitress was knowledgeable and attentive. The jump shrimp cocktail was the highlight of the meal, great quality and flavor. The thick cut bacon was a bit overdone by the flavors were great. The scallops were perfectly cooked with a. Nice char and properly seasoned. Not my first visit by far, but certainly a Memorable one.
2017-05-15,5,Great food the atmosphere is excellent I enjoyed the piano player.  I haven't been in the tri-state area in 15yrs I felt as if I had never left.  I will return regardless of business or pleasure.
2017-05-08,5,This was our first trip to New Jersey and decided to try an independent restaurant instead of a chain and it truly paid off. The place in itself is spectacular due to the history and the staff showed us marvelous service. We ordered the rib eye steak which was cooked to our perfection as well as our side dishes. Very fkavorful. The biggest disappointment is to think we'll  have to travel 1800 + miles to enjoy  the food and hospitality again. Linda
2017-04-29,3,Tl;dr- The only thing holding this restaurant back is the extremely high prices of their food. If this place wasn't so expensive I would visit again in the future, but I will not because I am not upper-class.  This place is just too expensive. We had an 8 o'clock reservation and were seated immediately. The waitress was good. our waiter was not invasive and waited on our cues for when we were ready to order. Our waitress was actually really goodThe interior was lit well enough to be able to read the menus and it was dark enough to provide that warm setting it is going for. It's actually really nice and decorated well. The tables are spaced well enough apart so it does not feel cramped. The restaurant is not that big. Because it is not that big it can get pretty loud sense the bar area is front and center.I had the fillet mignon medium rare. It came out to order which is good. Your meal will not come with any sides as you must order them as extra. Meal was good.  it came served with dice the mushrooms on top. The exercise I ordered I got brussels sprouts. Theu were good too.Before I begin to discuss the matter of the pricing, you will notice I've given this review three stars. If the prices were better this would be a four star review. The restaurant is priced as an upscale restaurant and as a matter fact is more expensive then many restaurants in New York City that I have been too. My filet mignon was $51 and the Side ofbrussels sprouts was $10 which means that my dish was $61. My girlfriend got the petite fillet mignon which is 6 ounces and it was $41. We split the brussels sprouts and probably should have got one more side because there wasn't enough food. This is mainly sense the filet mignon is a smaller steak which I fully understand though the sides should come with the meal. Wine by the glass was a bit pricey at $11 glass cheapest.Our bill including tip was 158.
2017-04-26,2,Mediocre food, exorbitant prices.  Clearly here to take advantage of those that don't care about either food quality or price.Most redeeming qualities are the antique bar and the piano player.
2017-04-21,4,This is one of the better steaks you'll find in Hoboken. It doesn't stack up to the upper echelon of NYC steakhouses (Peter Luger's, Gallagher's, Del Frisco's), but it gets the job done.It was a group of 6 and we were hunnnnn-gry. To start off we went with Grilled Octopus ($21), Tuna Tartare ($20), Burrata ($18), and Sliced Tomato and Onion ($13). That last one was something my boyfriend's dad ordered that I would never normally opt for. But he's an extremely picky eater and doesn't like basically anything, so he went for us. The octopus was cooked perfectly and wasn't chewy or rubbery at all like you find at even some nicer places. The tartare (or is it "tartar"?) was held together by a great mayo/sauce that really made the dish. The burrata was rich and creamy, just like you'd want.For my entree I got the Atlantic Salmon with roasted potatoes, Brussels sprouts, and a "grain mustard emulsion" ($33). I'm not exactly an emulsion expert, but I might become one. My boyfriend's mom got the Sea Scallops with sweet potato puree, lobster beurre blanc, and sauteed green beans ($34). I had a little bite and they were as good as any scallops I've had at non-seafood restaurants. My boyfriend and his dad split the 32 oz porterhouse for 2 ($80) and then we got a bunch of sides for the table - mashed potatoes, steamed broccoli, Brussles sprouts, and steamed asparagus (all $10).Our waiter was really nice, I'd rate the service 5 stars. The ambiance is classic steakhouse - lots of wood white tablecloths. The wine list was pretty extensive. There was nothing that I'd say was "cheap", but there were bottles across a number of price ranges. Apparently, there's sometimes live music and there's also a TV if you care about a big game or something.I don't think I'd make a trip across the river just to come here, but I'd highly recommend it to anyone looking for a good steakhouse in Hoboken or that general part of NJ
2017-04-06,5,We had dinner here last night for my husbands birthday and brought our two year old with us as we couldn't get a babysitter. The food and service was excellent and we will definitely be back. The staff was great with our son, especially our server (female but I can't remember her name) in making sure that he had everything he needed.
2017-04-05,5,Cozy atmosphere, perfect service and delicious food; what else can be said? Thanks...
2017-03-30,4,Great meal! Besides the steak, get the TRUFFLE GNOCCHI. You won't be the same afterwards.Amazing bar tender//great vibes overall.Below average service/server other than that.
2017-02-15,5,Came here for Valentine's Day. Unbelievable food, steak cooked to perfection, great service. No complaints. Wish I could afford to eat here everyday.
2017-02-15,2,Came here on Valentines Day. Food was really great. We started with a special appetizer which were seafood crepes. Small crepes but really tasty, basically like a bisque sauce on top. We had filet mignon, portions were of a good size and the steak tasted incredible. We also order bacon brussel sprouts and 3 cheese gnocchi which were both delicious. The food was not at all an issue. Problem was the service. It took me a little to realize why I felt the initial conversation felt awkward and it was because the waitress came over and said "Anything to drink?" Didn't introduce herself, didn't say we have some specials, happy Valentine's Day, didn't even say HELLO. Just, "Anything to drink?" I normally do not care about service too much but if I'm dropping $250 on a meal, you better dance, curtsey, and treat your patrons with respect. I wish I could address which waitress it was but because she never told us her name I can't. You shouldn't address your patrons like you're at the damn Malibu diner at 3am. On top of that, after our appetizer came we had to literally hunt down this waitress to get a second round of drinks. You think if we're dropping $30 for a round of drinks the waitress would be constantly asking if we wanted more drinks. Nope. Just the initial incredibly rude asking of if we wanted drinks, and then never again until we hunted her down to get more drinks. If the food wasn't over the top this rating would be a 1. But on Valentines Day you think you'd have your best foot forward at your restaurant but they didn't. Really unpleasant experience with the service. I won't be coming back because of it. There are plenty of places I can visit in the city and drop a hefty amount of money and feel treated with respect.
2017-02-15,2,Restaurant did not seem to be ready for the holiday rush of Valentine's Day. People around us were complaining where their meal was. It did take a while for us to get our food and when we did receive we were never asked how things were or anything until we were done and ready for the check. The meal that was ordered had tree nuts on it despite not having said it on the menu, which I was allergic to but couldn't tell the waiter since he was MIA. Food was pretty good but for the price I would not go back.
2017-01-31,4,Had a great meal on a Sunday night- we stopped in for the Hudson Restaurant week! What an awesome deal 40$ for an app, 14oz sirloin and dessert- the gentleman that took out order was very attentive and always filled our glasses with water. The bread basket to start was great as well- the menu is normally very expensive and I would recommend you go for a special occasion or celebration. The toffee bread pudding was awesome!
2017-01-28,2,Even though we had a reservation, we waited about 25 minutes.  Took some time to be greeted.  Bread arrived after our appetizers.  Second drink never came.  Food was not not great.  For the price, I'd expect more.  Our server was completely inattentive and barely came by.
2017-01-23,2,I came here once and it wasn't that awesome but we decided to give it another try. It was actually worst than the first time. For starters, let me just say that as a steak connoisseur, this place's steak is nothing to write home about. Good but nothing amazing. In addition, the service sucked, the bus boy might as well have been our waiter, as he serviced us more than the god forsaken waitress. My friends steak was too well done, and the waitress didn't even bother to check on us. She was all over the table near us though. The bus boy ended up getting my friend a new steak, but they took his fork so he had to wait another five minutes to eat the steak. And where was our waitress? Hawking some table nearby, didn't bother coming back, didn't apologize, I don't even think she's the one that took our check. If you didn't wanna serve us you could've assigned another waitress to us.  Again, the steaks weren't all that, but I would have given it a 3 maybe even 4, but the goddamn waitress really pissed me off. Nice looking place too. Waste.
2017-01-08,2,Where oh where do I begin? Lets start with the good.We came here to celebrate New Years Eve, with no reservation, so that was cool. The ambiance was REALLY nice!  I instantly felt good being there. Our server was an older woman who seemed like she would rather be anyplace but there...and it showed. After we ordered wine, she left so fast we didn't get a chance to tell her that we already knew what we wanted to order. Some time after we place our order, I asked for a side of cilantro. The server looked at me as if id asked for it in German.Once our food arrived, it took me QUITE a while to cut pieces of that steak....it was sooo tough. Wasn't any easier trying to chew it. I was only able to eat about 1/4 of it. Speaking of the size, it was the SMALLEST porterhouse I'd ever had. Suffice it to say, that was the FIRST and LAST time I try to have a steak in New Jersey. Next time, we will go back to the capital grille (in Manhattan) because they are always amazing.
2017-01-01,1,This was our third visit last night. We dined early. Each time I say for the price the food is not very good. Our first visit the server was rude.  The second time my Salmon was cooked to complete dryness and this time the Halibut had no taste, no seasoning on it.  We also shared the Buratta appetizer . It  had  no taste, the little tomato sauce which they called something else which I cannot remember on the side tasted like ketchup. It's as if they ran out of salt.  Dinner for four with tip was around $270 with one bottle of average red wine. I never complain about restaurants but I don't like to be ripped off and that's how we felt.
2016-12-27,2,My husband & I have been to Dino & Harry's probably five or so times over the course of the last few years. Up until the most recent visit, it has always been very pleasant. It became our "special occasion" restaurant where we'd go to celebrate and treat ourselves. That's why it was the logical choice for my husband's 30th this past month. I included the fact that it was his birthday in the comments of the online reservation.When we arrived (early for our res, actually) we were brought to the very back room of the restaurant where our tables were literally on top of the other tables. No exaggeration, there was MAYBE two inches of space between our table and the ones on either side of us. It was basically a communal table - the opposite of what our romantic/celebratory date night was supposed to be.Our waiter could not have been less friendly; aside from taking our order he didn't say a word or interact with us at all the entire time we were there. My husband & I had originally planned to have dessert there since we weren't having his birthday cake until the following day with friends, but agreed to get the heck out of there the second we finished dinner.All in all it was a super disappointing & frustrating experience. We won't be back.
2016-12-19,5,Best steakhouse in Hoboken, far and away. Dino's can also go toe-to-toe with some of the best NYC steakhouses. Classic selections done extraordinarily well. Highly recommend the bacon appetizer and porterhouse for two.
