2017-01-22,2,Very disappointed in Honeygrow. I used to love coming here as it was a good healthy and quick option in town. I came here yesterday to pick up a salad and honey bar. With the salad, the person making it couldn't find the correct salad dressing. After taking a few minutes to rummage around she took a to go salad dressing container and dumped it on my salad. It was not the right dressing. If they did not have the proper salad dressing they could have let me know so I could choose a new one instead of them dumping a random dressing on it to complete the order. Unfortunately by the time I realized it was not the correct dressing, I was already back home. In addition, with the honey bar, they must of mixed my order up with someone else's. I paid extra to have yogurt and extra fruit/toppings and the honey bar I received was nowhere close to what I ordered. Honeygrow needs to properly train their employees because every time I give Honeygrow another chance they mess up time and time again. This restaurant has potential but it's unfortunate that the employees can't seem to get orders right.
2017-01-19,1,Do not walk, RUN! I do not know how this place is still in business. The place is such a scam, you think you're eating healthy but all of the food is filled with oil and chemicals you can taste it. It's completely disgusting and the staff is unfriendly and not accommodating. I was so excited to have a healthy food destination in the area, but I am honestly disappointed to the point where I will never return. I'd rather eat at Mcdonalds. Overpriced.
2017-01-15,5,This place is a regular for me because of all the healthy choices ..  the local ingredients are awesome ..
2016-12-29,5,I absolutely love this place. Starting with the convenience of being able to customize your meal on the computer without the pressure of being in a line and talking about what you want. I also love how they recommend 4-5 speciality salads/stir frys with the option to tweak those or build your own. I like the fact they give you recommendations that they know they do really well instead of you only having the option to build your own. I have been 3 times and tweaked the Cobb salad options with the peppery ranch dressing and it has been superb. When I ordered for here one time, the employees were very nice asking around if I needed anything and they delivered me an extra sauce free of charge so I didn't have to go to the front and ask for it myself. Definitely going to make this a regular spot!
2016-12-12,5,I just want to say that this places rocks.  One of my co workers kept telling about this place and how great it is so I decided to give it a try.  I went to honeygrow this past Tuesday for the first time and I could not believe how busy it was for lunch.  The kios was a little confusing at first but once i got the hang of it, it was easy.   What amazed me even more was that you did not see the staff panic on how busy they where.  Most places would panic when it get that busy but your staff stayed calm.  When I got to my office and tried my spicy garlic stir fry it was great.  I'm definitely going back to try the rest of the stir fry
2016-12-11,3,Always on the lookout for healthier dining options, I was intrigued by honeygrow while walking around late one night in Hoboken. The setup of the place and ordering process is convenient for sure, but the place didn't quite connect for me in the way that I was hoping. The food, while definitely more health-concious than other washington street establishments, was on the bland side for me and the smoothie I ordered was a regrettable selection. This was made all the more unpalatable by the amount of money I paid for the late night dinner. Honeygrow has the potential to be much better than it currently is but for now isn't a terrible alternative to healthy eating when you're dining away from home.
2016-12-02,1,I usually love eating here and was craving it badly.  This place is way out of my way in Hoboken when I live on the other side of Jersey city, opposite side of JC/ Hoboken border.  I ordered my food to go, drove home, took a couple bites to find it was beef and not tofu.  I have been a vegetarian for four years and had to give up beef even before becoming vegetarian since beef started making me violently ill.  I called Honeygrow to let them know I was coming back for the correct order, they had my order number and I told them which order was mine (since there were two stir fries on the receipt).  When I made it back to the restaurant, my stir fry had not even been started.  I received no apology.  Not only was I already very hungry, but having to drive the 15-20 minutes in traffic each way, and having beef in my mouth was very upsetting.  I'm not sure I can bring myself to come back again. Every single business needs to remember the value of a lifetime customer.
2016-11-28,1,I really really loved this spot...until tonight. I came home with my take out and as I was eating I began to choke. Not in a dangerous way thank goodness, but something was definitely stuck in my throat. And it was a looooooong hair that I had to pull and cough up. I was so disgusted I got sick on the spot. Even if I wanted to,  I could never ever go back there without feeling ill because of my experience there tonight.
2016-11-21,4,So glad honeygrow finally made it to this area from Philly.  I'm a big salad person and they are the best in the area.  It helps to familiarize yourself with the menu/ingredients before you go or experiment a few times, because everything can be customized, that's one of the reasons they are so great.  The other is that the ingredients are really fresh and wholesome.  They are a little pricey, but good quality ingredients cost more and portions are more than enough.  Glad to see honeygrown is continuing to expand their market.  Great alternative for "fast food"!
2016-11-14,5,Very good, affordable lunch option on Washington. It can get pretty packed during the lunch hour rush so keep in mind you may have to wait.
2016-11-14,5,Being gluten free is a struggle wherever you go; however, Honeygrow is a great place to go. I've been there twice already and don't have any complaints. Both time I've ordered the custom stir fry. The first time I got rice noodles with shrimp, broccoli, parsley, cilantro, and spicy garlic sauce. The spicy garlic sauce is delicious, but truly spicy. They also have gluten free soy sauce which is a bonus. The downside to my delicious meal was that there were only 3 shrimps in the whole $12 bowl.  After that, I learned my lesson and got vegetables only for around $10. I got the same thing and thoroughly enjoyed it. Ordering is simple and efficient as you select your food on a touch screen desktop and pay with credit there or take your receipt then go to the cashier and pay with cash which is also where you pick up your food. When I was waiting for my order, I heard a man tell the cashier he had an allergy and the cashier immediately notified all the staff. If you're gluten free, have allergies or have any diet restrictions, they're extremely accommodating and everything is labeled.Honeygrow provides a large portion and has a nice atmosphere. It's great for friends or for a laid back date. Their sodas are all natural and the two times I had them, they weren't bad. I had the natural lemonade the first time which was perfect, but the second wasn't sweetened enough. They have many healthy options which I plan to try down the line.
2016-11-10,3,Healthy, pricey, bland.I've been here 5 or 6 times to try the salads.  I like the idea - healthy, organic salads prepared as quickly as other 'fast' food.  The salads have been decent, but not great.  Here's where they can improve:-A single portion of protein (chicken or shrimp) is small, probably only 2 or 3 ounces.  If that's not enough to satisfy you, you'll have to go with a double portion, at extra cost.  -Price:  if you go double protein, expect a salad and drink to run $15 - $16.  For what you're getting, that seems high.-Flavor:  I've tried many different salads here, many different ingredients, dressings, etc., and most combinations have been bland.  So tomatoes don't have much tomato flavor, the chicken has very little chicken flavor, etc.  Even ingredients that should normally be bold and assertively flavored (blue cheese, onions, etc.) are somehow lacking.  Honeygrow is a chain, and it seems they've focus-grouped their flavors to aim for the lowest common denominator.  That is, they've made everything mild, so as not to turn off customers with more sensitive palates.  Even the dressings, which are there mainly to add flavor, are mild.  -Dressings:  Lots of choices, but too many closely-overlapping ones.  So they've got a balsamic vinaigrette.  Also a white balsamic vinaigrette.  Also a cider vinaigrette, etc.  That would be OK if each one had a distinct flavor, but they don't.  They're so mildly-flavored, it's hard to discern differences between them.  Honestly, most bottled dressings you'd buy at the store pack more flavor than these.  (Protip:  the one non-mild choice is the sriracha one.  Go for that if you like actually tasting things.) -Ingredient segregation limits choices:  Honeygrow makes two things:  salads and stir-frys.  But for some reason, ingredients that are used in the stir-frys aren't available to be added to the salads.  Green beans, jalapeños, shredded pork, etc. can go in the frys, but not the salads.  Mr. Honeygrow, tear down this wall!Honeygrow, if you're listening, this is a decent start, but you've got room to improve.  Make these changes and you'll earn . . . my coveted fourth star!  (Cue: crickets chirping . . . )
2016-11-09,4,Love this place. We've been going since the week it was opened and all in all it continues to be a great alternative eating place to the many other "less-then-healthy" choices in the area. All the site fry options are great, I'm a personal fan of the Cherry BBQ and/or Spicy Garlic sauce. The opportunities to try a new dish and create one are endless. It's fun to mix and match ingredients and find out what works best. It can be a little pricier but you'll never leave hungry. The ingredients are fresh, the food is tasty and it's served relatively fast.
2016-10-25,4,I did the build your own and chose the spicy garlic stir fry with chicken, shrimp, spinach, broccoli, carrots & parsley. I also added in fried shallots which were a great add on for me because it had a bacon like texture (I love bacon!). Personally, I could have used a little salt or another spice to kick it up a bit but, otherwise, it was awesome.
2016-10-20,3,Honey grow definitely cleaned up their act in terms of the amount of ingredients they serve in their custom salads however... I walked in tonight to order stir fry and inquired about their missing rice option.. the girl I initially spoke to said they'd be cooking more rice and would let me know how long it would take.. then another girl approaches me and rather loudly yells "you're going to NEED to choose another option because we're out of rice". Ok, seriously? Why could you have not just told me? I'm trying to give you my business and that's the way you speak to me? I'm asking about rice. This isn't life or death. Screaming at me seems a little absurd.
2016-10-18,5,First night in Hoboken, I wanted something healthy and light. Loved the ordering process which was fast and smooth. The enormous customized fresh Cobb salad was a whopping $12. And to cement the five stars someone came out to the dining room to ask if everything was to my satisfaction, chatted a bit and offered me a glass of iced water. Great place and concept.
2016-10-16,4,We go to honeygrow so much that many in the staff recognize us.  The food is fresh, local and well combined.  You can order straight off the menu, modify their menu or creat your own.  The flexibility is great. Most nights we get a salad and a stir-fry - our favorite is the philly roast, which we swap the pork out for shrimp.  The honeybar is also nice and healthy treat.
2016-10-13,4,Our new go-to for an easy, tasty, fast and healthy(ish) meal! The red coconut curry (aka red coco aka I'm in love with the coco) is absolutely delicious!! I've tried a few of the other stir fries but this has been my favorite sauce. I recommend adding the spiced turkey as the protein instead of the tofu (unless you're vegan/vegetarian of course). Philly roast pork stir fry is also great if you're in a pork and cheese kind of mood! Two cons:1. They serve the hot stir fries in plastic bowls if you eat in. Really?? With the whole modern take on local fusion food with wood and sustainable tables/chairs, you serve in plastic bowls? I do not eat anything hot out of plastic as a rule of thumb so this was pretty disappointing. I usually do take out for this reason.2. The topping amounts are not consistent. Sometimes I get 2 pieces of broccoli, other times I get 10. To be clear, I'd prefer 10. :) When they get stingy with the toppings, it becomes just a bowl of noodles/rice...not so fun, and the inconsistency becomes quite disappointing.
2016-10-10,5,This place is great. Fresh food, great helpful and friendly staff always. I love the ordering process, touch screen monitors that are easy to use and see. Other vendors should implement them too. I love the chicken stir fry with brown rice and sesame sauce. Try the honey bar with pineapple, strawberry and bananas. Top off with coconut, choc chips and the dark honey. You're welcome :)
2016-09-23,2,The quality has really gone down since it opened.  The noodles in my stirfry have been chewy the last 3x and there is so much sauce in my order tonight that it is inedible. There are also often employees walking around on the floor reaching over counters and eating over counters. It's really gross and points to inexperienced management.
2016-09-22,4,I lived in Philly for several years and that is where my addiction for HoneyGrow started.  It has the best concept which is fast, fresh, healthy, and LOCAL food.  When I moved from Philly to NYC I was slightly devastated that I was no longer within blocks of Honeygrow. I remember when they announced they were opening one in Hoboken I was so excited that they would be closer. Yesterday I decided to venture out the city to give the Hoboken location a try.  I must say it is easy to get to from the Lower Manhattan via the PATH train. And only about a 5 min walk from the Hoboken train stop.The establishment has that modern look incorporating wood as well like many other locations.  They have outdoor seating which is great for nice evenings.  They have 4 kiosk to select your food and that evening a small line was forming to order around 7ish.  I ordered my regular spicy garlic stir fry and adding in shrimp as well.  It took a little less than 10 minutes for my food to be ready.  Once I received my food it looked amazing at first sight, but then I noticed that the noodles were undercooked and clumping together.  On top of that they went very light on the sauce which made for a rather dry entree.  At this point I am tired and hungry from a long day I just ate it as is.  My meal with my bottle of water was about $16.  They didn't knock my socks off as I PRAYED they would. Will I give it another try? Probably will but I know to ask for extra sauce and to tell them about how I want my noodles.
2016-09-15,4,I consider myself to be a pretty healthy eater. At the same time I also happen to live in Hoboken, a land where Italian and American cuisines rule. It might be surprising to some, but those two do not tend to offer many healthy dishes so I would often dream of a local establishment that could offer something else. While there are a few businesses, most of whom have closed by now, who promised a healthier option they were either tasteless or had awful customer service.When I saw that this location was under construction, it happened to mention the name of the place and when I looked it up I was very excited to find out that Hoboken was finally going to have a healthy food option that also seemed appetizing. I kept checking on the progress of the construction and was there within the first week of them opening.The service: when they first opened, people greeted you by the door and gave you the menu while you were waiting in line (and there was quite a line). Everyone working there was very friendly and was obviously trained well. While the greetings have subsided, I still find them to be very nice and do get the occasional greeting from time to time. Since you use a computer to place your order, the communication is somewhat limited as is. the food itself: I was very hesitant when I tried my first dish from them as I had such high hopes and was all too used to the disappointment. However, it was excellent! It was hard to believe that what I was eating was actually (well, mostly) healthy. Full of flavor and the serving size is enough for me to split into two meals. I also like how one can customize it, I usually get either the spicy garlic or the sweet soy spice five stir fries and substitute the meat for tofu.the price: Very reasonable considering what you are getting.The only reason this place doesn't get five stars is because the tofu has been inconsistent and overcooked on a few occasions. Also, do expect a reasonable wait for stir fries. Otherwise, I really do love it and hope it stays for a while
2016-09-14,5,So amazing, delicious, healthy and helpful staff!  This will be my new lunch spot!!  Touch order screen, which makes it super easy to order.  Was crowded, but the salad was ready very quickly and thy even helped me to my table because I was with my toddler.
2016-08-31,5,Very fond, great food. You'll pay a bit of a premium, for the location. But, you won't be disappointed by portions or quality.
2016-08-31,4,Ohhh Honeygrow, how I love you. Actually, it's love/hate because of how expensive you can get, but I understand there's a price to pay for fresh quality ingredients. This is my go-to lunch spot in the area. There was a time when I used to come here 2-3 times a week, but now that I am exploring more in Hoboken, I've brought this number down to once every other week or so. Still, when I'm craving custom salads or stir-fry, there is no better place than Honeygrow to satisfy my palate. I ALWAYS get the same thing here. Custom stir-fry with chicken, egg white noodles, peppers, bean sprouts, chili flakes and sesame seeds, with sesame garlic sauce (less sauce). I don't know why but I loved this combo so much that I never bothered to try anything else. I've heard EVERYTHING here is good though, so you really can't go wrong.The key to this place is arriving BEFORE lunch time. When there's no line, you'll be in and out within 10-15 minutes, but if you wait until peak lunch time, there's no telling how long it will take. It's also not very cheap, so try choosing a combo that you like, and prioritize the toppings that matter to you most. Customize to your heart's content! Order takeout and take your yummy lunch over to the pier and enjoy the nice view while you eat.
2016-08-17,4,They get 5 stars for service. Great staff! Noodle stirfries are loaded with too many noodles. Their salads are yum!
2016-08-14,4,I love this place!  A little pricey for what you get, but I suppose it's all fresh so perhaps it's reasonable.  I'll be coming here more often.
2016-08-09,5,I came in to Honeygrow when it wasn't busy. I had ordered from the kiosk but none of the workers began working on my order. It didn't take too long, but my order was eventually ready and a couple of the workers apologized. I was presently surprised when one of the managers, Angelo, came over to apologize. He then gave me a free smoothie and offered me a discount on my next visit. I don't normally write reviews but I felt it was important to share what awesome management and staff they have working there. Talk about customer service. Will be back :)
2016-08-03,3,Great idea, however they need to improve the execution.I typically order a salad or stir-fry.  I love the idea of their fresh, natural, veggie centered menu. However, the dressing/sauce is always too little or too much.  They can never seem to get a consistent product.The good thing is their Honeybar, where you can get fresh fruit with honey and their amazing whipped cream.
2016-07-31,4,Reasonably priced, relatively healthy option in the area.We come by fairly often and typically order the noodle option, and we find the food to be fairly filling and tasty, filled with fresh ingredients. The amount of other ingredients put in the box is sometimes inconsistent (so we check all the time before we walk out to make sure the box is filled with food), but it's otherwise consistently flavorful and fairly priced quick dinner option.
2016-07-28,5,I con only say great things about this place!  I love the touch screens where you can customize exactly what you want.  I needed a gluten free, dairy free meal and the ingredients showed clearly what to choose to be safe.  I got the cherry sour BBQ sauce with brown rice and tons of veggies.  It was great and so steamy.  My wife got the cane sugar root beer that tasted amazing.  My only complaint would be that it was just too cold in there, but that is minor.  Also, you could watch them make your food, so that is great.  And the back room behind the bathrooms, I found a wall outlet to charge my phone!   Finally, if you live in Manhattan, it is not far, we took the PATH rail and it was only $2.75 one way and only took about 20 minutes to get there, then a few blocks to the restaurant.  Then, you can go down the street to Carlo's Bakery for dessert!
2016-07-22,5,Great, friendly service! One of the workers named Shantel was super nice and helped make sure I was satisfied with my order. Will definitely eat there again!
2016-07-22,5,Love this place, come here all the time for salad, always fresh and yummy. The staff is also really helpful and friendly, Shontell Jones in particular was super sweet and helpful. Definitely coming back!
2016-07-22,5,Love this place, food is fresh, staff are friend, thanks shantelle your a great ambassador for honey grow
2016-07-22,5,The deliver what they say, the food is fresh and delicious. It was super easy to order using the kiosk and with the create your own menu, the options for food are limitless. I haven't tried the honey bar just yet and it is def on my list for next time! This place is perfect for good, healthy and well resourced eats in Hoboken!
2016-07-22,4,*review for salads only*i come to honeygrow at least once a week - it's the only place in hoboken you can get a good make-your-own, quick salad.  quality is pretty consistent, ingredients are always fresh and the service is accommodating and friendly.  only complaint about the staff is sometimes they are super slow and it's frustrating to watch - some of them look like they don't know what the word salad even means. but if ever you feel you don't have enough of an ingredient they are fast to fix it! overall great spot for fresh, delicious salad :)if anyone wants to copy my make-my-own, it's pretty great (spring mix, arugula, tomato, avocado, cucumber, chicken, pumpernickel croutons, and mustard soy vinaigrette).
2016-07-18,4,The salad I got was delicious and enough to supply 2 meals! The ingredients were fresh and combined well. I only demoted a star because my bread that I paid extra for was forgotten. Just make sure to check your bag before you leave
2016-07-15,2,Have gone here three times and each time they have messed up my order, and charged me for salad add-ins that they didn't give me. Wish it were better, because three aren't many good salad places in Hoboken.
2016-07-13,5,Shantal was such an amazing server, she was so sweet and nice and always tending to our needs and providing whatever we needed. Thank you so much!!!!
2016-07-11,5,Always have a fabulous experience, food is fresh, healthy and served with a smile.  Place is very clean. Shantelle took extra great care of me tonight, checking in to see if my drink needed a refill or if I wanted more dressing. Highly recommend!
2016-07-10,4,They somehow make Cobb salad not boring and delicious! Cool and clean restaurant. Only giving it 4 stars because the wait can get a little crazy around lunch time.
2016-07-10,5,I just moved to Hoboken last month, and Honeygrow has already become the go-to spot for me and my cousin. Aside from the food, which taste fresh, healthy, and delicious, the hospitality is unbelievably warm, especially for a "chain" restaurant. Darnell runs the kitchen with amazing efficiency, and I'm always impressed by his positive energy. In addition, Shantel has an incredible attitude- she always greets us with a huge smile, and it's a major reason we keep coming back. Thanks so much to Shantel, Darnell, and the rest of the team. You guys are amazing!
2016-07-10,4,I seriously love this place, as it's an easy go to at for relatively healthy food in Hoboken. Also the staff, particularly Shantel Jones, are super nice. I'm always greeted at the door, and tonight Shantel was amazing following up on my questions about my order and even bringing me water! With service like that, I'll be coming and dining in more often. Thank you, Shantel!
2016-07-02,5,Absolutely delicious! Pick something... Anything... Sure to delight. Staff is very friendly & helpful.
2016-06-29,2,First time I tried honegrow, there was way to much sauce in the noodles. Just tried a green smoothie today, took a few sips and then grabbed a piece of plastic from my mouth. Disgusting!
2016-06-29,5,Had a delicious and FRESH meal at Honeygrow during my visit to Hoboken. I had a salad and my friend had a stir-fry. Ordering on the screen was a bit intimidating at first, but I was happy to have a healthy, local, 100% customizable meal. Definitely check it out!
