2017-11-16,1,This place has the worst customer service and very low quality. I would give zero stars if possible. Good food when it's right, but that is very rare, so it's not worth wasting your money (have wasted $50+ on incorrect orders at this place).I stopped coming here for a little while because the peppers and green beans tasted old and were not fresh. They also got my noodle base selection incorrect multiple times. I had conversations with management and the former issue was solved.I received an incorrect order using the app which was ordered for pickup. I called and requested a refund to my credit card because I had left the store (after a very rude employee handed me/threw my food at me since it wasn't in the pickup section 10 minutes after the designated pickup time. I was told I needed to come back to the store in order to receive a refund. I will be returning to get that refund issued to my credit card. Horrible system that it can't be processed otherwise.We ordered from Seamless and yet again the order was wrong. I tried calling the store and all I got was a busy signal. Once again, another order wasted. Honeygrow, I like the food when you get it right, but when you only get it right 25% of the time, it's not worth the frustration.
2017-11-13,5,Fabulous foods! The option of creating your own plate is really awesome. Food is usually fresh and tastier than I would get in other places.
2017-11-06,4,Stir fry at its finest! Sometimes they get the orders mixed up but it's not too big of a deal. That's why I gave them 4 stars, nothing with the food just with the accuracy of the toppings mixes
2017-10-27,3,Writing an update for Honeygrow because I've gone back now 2 times since and they've had a drastic improvement (solid 3.5 stars but because they did me so wrong the first time they are at 3 stars right now, might up this is I have another good experience). The last two times I've gone, I've gotten the salad and also the stir-fry. The sauce this time was pretty yummy and my noodles were cooked. I really did enjoy my experience and there was also every staff members asking if they could take our trays away. This was a night and day experience from my first experience.
2017-10-18,2,Overrated and expensive. For many in America, Asian food means adding twice as much salt to any recipe.Honeygrow dishes suffer from this.
2017-10-12,2,I had high hopes when I walked into Honeygrow.  Choices up on the board had appeal and looked to be healthy options - the restaurant was clean and had a good energy level. Love the kiosks for ordering!The problem was that the Stir Fry I ordered (Red Coconut Curry) was quite oily and very bland. It was a little pricey but had the food been better that would have been ok. It's possible that using more sauce might have increased the flavor to a satisfactory level; not sure about the amount of oil - maybe one more try is needed to see if the heavy oil was a outlier.
2017-10-09,2,Had some good options but the overall taste was very bland. They also hold back on ingredients. I ordered spinach in my bowl and felt like i only had a sprinkle of spinach. Never coming back here
2017-09-28,5,Their salads are fresh and the homemade dressings are pretty good. Love the option to create my own salad. Impressed with the egg white noodle dishes. Definitely a nice healthy option!
2017-09-26,4,Healthy fast food?  Check.I end up here a couple of times a month when I'm simply too tired to make dinner and have to be up early the next day.  Veggies and protein are super fresh (never once have I gotten anything questionable).  Salad with cold ramen noodles and tofu, avocado and cucumbers is my go to.  Honeygrow to the recuse!Enter and walk up to the kiosks. Everything is ordered on a kiosk.  If you want to pay cash, make sure you select that at the end.  You pick what you want and custom order.  Base items are salad, stir fry or the honeycup.  Salads are fresh - there's no chance you are getting any yuck brown lettuce or ice berg here.  You can add avocado and special house made like diced pickled peppers, tea soaked raisins and pumpernickel croutons.  All the dressings are made in house and labeled GF, V, LF to make it easy.  If you want more than one dressing, just ask!  My personal fave is the honey ginger.  It's one of the only lower fat ones and it's really silky and gingery tasting.I really like honeygrow.  Like that I can choose my own ingredients for fresh salads and stir frys.  Dinner when I have had a long day has never been easier and healthier.
2017-09-25,1,Usually love Honeygrow but today it was terrible . Ordered the food and then they told me no more sesame garlic sauce and I'm vegan but I don't like the curry sauce ! How do you as a franchise run out of sesame garlic sauce so eating this stir fry with tofu and broccoli and carrots just tastes awful. The guy that was making was nice enough to at least warn me but come on a franchise running out of sesame garlic sauce is not good at all !
2017-09-23,5,This is a favorite healthier food but still tasty spot in town.  Feels clean and fresh.  Friendly but more importantly the food is freshly prepared and satisfying.
2017-09-13,4,I am OBSESSED with this place and if they were on Seamless, I'd be broke.com. It is refreshing to have a place to go to in Hoboken that has healthy and fresh ingredients. I am a fan of both the salads and the stir fry. The touch screen ordering system makes it easy to customize your order so you can get exactly what you want. This place gets super crowded during rush hour when people are on their way back from the PATH. Apparently they have an app now where you can order ahead which would be great so you can skip the line. Even when there is a line, you usually get your food within 5-10 minutes.
2017-09-08,1,EAT AT YOUR OWN RISK !!!! This place honestly is great for anyone who is wanting to eat healthy/clean . But the customer service environment? Is HORRIBLE. Is a bunch of young kids with attitudes . They don't greet you when you walk through the doors . I've had four times where either it was my order or my wife's order was missing either a topping or either mixed up tofu for turkey. I understand that this is a popular food location in Hoboken and it gets really busy but that should be enough motivation as a restaurant business to basically get it together . And have everything down packed . Every time i walk in the cooks and the additional employees are horsing around, and the employees in the back I'm guessing in the break room you can hear them yelling . The managers are horsing around with them as well and you can't even tell who's the manager . Now my question is why is it that there's only 1-2 people per station especially when it's BUSY. The other employees are in the back just hanging out . There's a good I would say 10-20 people still waiting for their foods all the time this happens. The people who run the food have forgotten to hand me the drinks that I have payed for and have the audacity to give attitude and slam the drinks on the counter instead of handing it to you. I'm usually here at least 3-4 times through out the week and it's the same thing all the time . And this food is expensive not too add . So it's not fair to have to experience an unpleasant service every single time . I'm pretty sure that's there's customers who feel this way based upon their facial expressions when they experience the same customer service as I do . To top it off I just ordered the Sour Cherry BBQ and I got NO SAUCE it was so dry and oily and on top of that I got raw garlic mixed in ?!!!! WOW !!!!!! Me and my fiancé ordered the same stir-fry and she also got NO SAUCE AND NO FRIED SHALLOTS ON TOP HOW ITS SUPPOSED TO BE DONE ! Never ever coming back . I'm done spending so much money for horrible a continuous horrible service
2017-08-20,5,Honeygrow specializes in all locally sourced products. They have a board stating where each of their ingredients originate from, including the vegetables and chicken. The place is computerized with touchscreen terminals where you enter your orders for food and drinks (no alcohol). They have already made salads and stir fry, or you could select your own ingredients. Everything is natural, organic and from local sources.When I'm craving a salad or stir fry there is no better place than Honeygrow! A great option in town for a healthy and quick bite!
2017-08-17,3,I love Honeygrow and go frequently but DON'T GET THE CHICKEN OR TOFU! I got the tofu once and, to be fair, it was around 8:30 so maybe this was a factor but the tofu was very tough. Then, the first time I added chicken to my salad I thought it tasted rubbery and uncooked. Later, I decided to give the chicken another try only to have the same rubbery taste from the chicken spread all over the rest of the perfectly good salad.
2017-08-16,3,It's great when they get your order right. Three times already they forgot to add  tuna on my salad.  I  order to go, so I don't realize till I get home. By then, I don't have the time nor energy to go back and complain. I paid shy of $12 bucks and no protein. Furious!!! It's been hours since this happened, yet I can't shake it off. So, here's my 2 cents for you, check your order before you leave. You shouldn't have to, but the only other alternative is to make your salad the old fashioned way... At home.
2017-08-02,1,Poorly run place desperately needs new management. I've always waited at this place while they struggle to new up with demands at high traffic times but just witnessed a clear violation of the health code when one of the cooks was wearing plastic gloves, checked his phone, then went right back to handling the food with the same gloves on. The staff all seem like they are not managed well and this will bet last visit after demanding a refund and leaving.
2017-08-02,5,Consistently reliable and delicious food. Easy ordering with the touch screens, with an easy to understand pricing guide as you go along. Whether you get salads, noodles, or the unique and delicious honey and fruit desserts, Honeygrow has yet to disappoint. Plenary of veg and vegan options as well. When busy the food can take a while at peak hours, but typically you have your meal in minutes.
2017-07-18,5,This is a regular spot for me in Hoboken. The menu is diverse and the create your own makes every order of mine completely new and different. I also love how fresh the ingredients are. The flavors are well developed and this kind of restaurant is what thrives in NYC, so it's great to have one in Hoboken for a few dollars less. I swap back and forth between salads and stir fries because they're both so yummy! There is also a ton of seating both inside and out, and the food comes out quickly even when they're super busy. My husband also ordered me a gift card here, and one thing I love about this place is that they HAND write cards to go with gift certificates and will mail them to recipients (if necessary), such a nice touch!So yeah. I love this place.
2017-07-10,3,I eat here 2x a week at least....and it seems that for stir fries, they always forget a key ingredient, or worse, the sauce.  Still good, but dry!
2017-07-09,5,Need one of these in Bergen county!!! The sauces are amazing and I love all of the options. Their stir fry is the best I've ever had! I've been here on the weekends and during the week, week crew is definitely better at serving sizes and customer service. I live 40 mins away and am still a frequent here.
2017-07-08,2,The star level goes for the service provided here. I do love the food here, but the service is really lacking. Rude and  inattentive workers makes me feel like I don't want to return
2017-07-02,5,We went on a very busy hour but the service was quick so we didn't have to wait long. I forgot what exactly I ordered but it's something with the sour cherry sauce and it's the bomb! I liked it so much that I had to search the recipe so I can make it at home. Unfortunately, couldn't recreate the exact taste. Lol my bf had the stir fried noodles and I actually liked his order better than mine. Right level of spice that wasn't too overwhelming. I was so satisfied with the food that I had to look if they have a branch in NYC. I hate to say that for some reason, there was a stark difference in taste between these two branches.
2017-06-28,1,Honestly, I've never been here before but they messed my bestfriends order up.. and no one messes with my best friend/people I love so for that you get 1 star
2017-06-27,4,I like their marketing; but feel they have space to improve about the quality and quantity of the food.It is totally a self-help store. There is no cashier there but only nice machines with nice pictures. The restaurant is also clean with open kitchen. You can see how they prepare food. The staffs there are friendly. The restaurant brands their healthy food, and almost convinced me: many vegetables there to choose, salad looks beautiful, until I realize it is not really healthy for their oily stir-fried category food.For the stir-fry style dishes, they are definitely Asian. As mentioned, they are oily, more than Asian-Asian and comparable to some American-Asian. In Asia things are fried in order: different food need different heats; in this store it looks like they mix whatever protein, vegetables, sauces, etc. and stir-fry them altogether with oil. Of course finally there are raw things and there are over-cooked things. Luckily I never see meat are undercooked, probably their standard is to fully cook the meat and let the vegetables whatever. I guess they should observe how an Asian restaurant in Asia works on this matter. The quantity is not much, either. They should at least offer more noodles or rice with very low cost or even no cost for people to choose. These things are cheap.But anyway, for stir-fries, they are actually comparable or even slightly better than most American-Asian in Hoboken regarding to flavor, probably much better regarding to raw material freshness, and light-year better regarding to branding and marketing. Of course they are more expensive, too.
2017-06-26,1,I've been going here for a while now and have had mixed experiences. But today is by far the worst I've had in terms of quality control. I ordered the Sweet Soy Five Spice with double protein and it came out with less than a normal portion of protein and way undercooked. They didn't even add all the garnishes I asked for. I feel like I keep going back and they find new ways to stiff me. Retrain your cooks or you're going to lose your customer base.
2017-06-11,4,Awesome build your own salad/noodle restaurant. Do it yourself order station so you dont get the pressure of trying to figure what to put in it when you get to cashier. Super fresh ingredients and definitely worth  the typical long wait.
2017-06-09,4,Honey grow is so delicious and healthy. They have a super simple ordering experience where you explore the menu on a touchscreen computer. They have juices, yogurt parfaits, stir fry, and salads. I got the spicy garlic stir fry bowl which had chicken, egg white noodles, pepper, broccoli, pineapple, onion, parsley, and spicy garlic sauce. It was so good but extremely spicy! If you don't like spicy I would definitely steer clear on any that notes it on the menu- it's definitely above a medium spice. They have lots of seating, both indoor and outdoor, and offer a water cup which I've come to appreciate. Lastly, they clearly note all diet restrictions on every order. Would recommend if you need a quick and easy bite!
2017-06-05,4,I come here 2-4 times a week- A great healthy option in Hoboken that is close to my gym and apartment. The touch screen ordering pads are super convenient and make it easy to customize your salad or stir fry. I mostly get salads, and they have a ton of veggie options to make an actual healthy salad (or a not so healthy delicious one if that's what you're in the mood for).My only complaint is the crowded pick up area and service speed. Some days I am waiting for over ten minutes, packed in the front of the place like sardines with the other people waiting, while the workers talk to each other and salads sit behind the counter, with no one making an effort to serve them out. I know this is mostly due to the rush of lunch/dinner, and they're working on speeding this up with their order number board, but it's been a constant issue even during the non-busy hours.   That said, I will still keep going back on a weekly basis. I wish they had a rewards system so I could capitalize a bit on the hundreds of salads I've bought so far!
2017-06-03,4,Honeygrow, where have you been all my life? Please open up a location in Downtown Jersey City! We desperately need your salad options here. Stopped in at your Hoboken location with my fiancée today, and our salads were great. We'll be back tomorrow for more deliciousness.
2017-05-31,4,A Hoboken Staple! Healthy, clean, quick and easy - Honeygrow is perfect for a quick and healthy meal. My favorite is their salads, their stir fry is good too but I prefer their salads. I usually make my own salad with romaine, grilled chicken, cucumbers, beets, pickled peppers and their white balsamic vinaigrette - which is absolutely amazing! A few minutes from the Hoboken Station its a great stop on your way home from work.
2017-05-19,4,I got the sesame garlic bowl which features creekstone beef. Honestly it's not as flavorful as I thought it was gonna be. But it tasted fresh and rather healthy! The best part for me was the fact that they use creekstone. As a Muslim that's clutch!
2017-04-28,3,I love this place... it gets pretty packed but the service is timely. The food is good though I wouldn't recommend the tuna (it taste like it's straight from a can). I usually get the salad with tofu and shiracha dressing. The vegetables are fresh. I would've given this a 4-5 star review however they got rid of their Brussels sprouts and roasted yams on the menu options.
2017-04-24,2,I just paid $16 for an Arugula/Tuna salad and when I get home and open theres no tuna in it. And very little of each topping, is basically arugula, radishes and dressing. This was my 3rd time giving it a try, but each time it got worse, last time my noodles choice didn't have the mushrooms I paid for. The concept is great but the people that prepare your meal need more training.
2017-04-21,3,I've been to this place twice first time was very good second time the chicken didn't taste good . There's a lot of young kids working here they're so loud and rowdy ... the second time I came here I was watching a young lady handle my food she looked like she didn't want to be there she kept rushing and throwing stuff . Then I seen a young man handle my brown rice with  ( NO GLOVES ON ) I know that's not sanitary.......... He seen me watch him the entire time he did it and turned around quickly ..... people at this place weren't taking their job seriously...
2017-04-20,4,It was good for some salads, but few of them are completely not tasty. Have to choose sauce carefully, Not every combination is great.
2017-04-13,4,Food: 1 starsDecor:3 starsHoneyGrow ..or HoneyNO that is the question?   The inner hipster in me wants to love this place, but be fooled not by the fancy decor. I do love the touch screen pads that you use to place the order especially if you're slow to order like me there's no pressure to choose something. The building is beautiful its simple but yet fab at the same time. To me it was an upscale McDonalds. The workers were very very meh except one young lady she was very nice. I was asking questions about the sauces and she let me try them I thought that was nice. She was the only one who wore a smile.  Even the cashier attendant who just called out the numbers of the orders like a drill sergeant. So maybe all of that influenced the overall taste of my food.  As far as the food goes it could use some work. Just because its vegetarian doesn't mean it should lack flavor. I got the stir fry noodles with egg and spinach and chicken.  The noodles were great the spinach was great, the chicken is another story. I was sold on the idea that this is all organic or farm raised . from farm to plate type thing. But just because its organic doesn't mean it has to lack flavor. I wanted something super quick and light that is what I got essentially but I wish it had more flavor. The chicken really reminded me of that chicken from subway G R O S S.
2017-04-11,5,Honeygrow is a frequent stop for me, and I think my boyfriend would eat here every single day if he could! The menu offers a bunch of salads and stir fries that sound pretty great as described, but it's also super easy to modify any of the offered items to your liking OR create your own (customers create their orders manually on a very user-friendly computer). My go-to is the sweet soy five spice stir fry, modified to replace spiced turkey with chicken and rice with egg white noodles, but when I'm feeling reckless I opt for the spicy garlic stir fry (which is pretty damn spicy but very worth it). I love these two stir fries so much that even though I would like to try other items on the menu, I can't bring myself to deviate! Fast ordering, efficient service, affordable menu, and consistently delicious healthy options? Five stars for Honeygrow!
2017-04-05,5,I have a friend visiting from out of town and she stopped by and ordered a salad for lunch. She loved it so much that she went back later to get another salad for dinner. Seeing her salad and hearing how good it was made me want to go. I ordered the Spring Thai'm salad and it was absolutely delicious! Everything was perfectly made and definitely hit the spot. The staff are also very friendly and all had smiles on their faces.I've always enjoy eating from here. The portions are enough for me to have two meals out of them. I usually get noodles, which always hit the spot.
2017-04-01,5,Super fresh food! I love the simplicity of ordering your food on the iPads and customizing however you want. I just wish they delivered!
2017-03-26,5,If you're looking for a solid salad in Hoboken, this is your spot. It's take out or dine in, and on non-peek hours its fast. On peek hours you'll wait a little but nothing too bad. The salads are all customizable or preset recipes which can be edited. It's all done on a touch screen which is pretty effective. The ingredients are hearty and quality, with a large selection of options. They also specialize in stir fry which is great, never been disappointed. Again you can customize or get a preset recipe. And the root beer, it's the best I've had - worth a try. Really not sure why this isn't 4+ star right now, people in Hoboken complain about EVERYTHING it seems... And they drop 1 star bombs if anything goes wrong - get real people. One thing I will say is that they should offer some free foccacia bread with the salad, it would be a nice touch.
2017-03-25,3,Quality has gone down in recent months. Twice received brown avocado in a salad (that I paid extra for) and another time, they forgot chicken (that I paid extra for).
2017-03-16,5,I wouldn't keep coming back if this place wasn't delicious! I started coming to Honeygrow in Hoboken when it first opened in q4 of 2015. First impression was amazing- with touch screen menus, assortment of tasty yet healthy options, and a friendly staff were all there from the very beginning. Now that it has been almost a year and a half, I'm not surprised in the slightest at the success this eatery has achieved!Honeygrow is by far one of the more popular lunch/dinner places on Washington Street, given it's optimal location, and fast/reliable service. Although the place can be crowded from time to time, the line is usually pretty quick, and most people do take out so there is plenty of space to sit. The wooden tables and chairs are a nice touch, and really gives the place a lot of personality. I've tried just about every combination of stir fry imaginable and they are yummy! The portion is pretty reasonable and not overpriced. The staff is incredibly friendly- they even offer to take your tray from the table when you finish eating.To summarize, Hoboken is happy that the Philly native has come to town!
2017-03-07,4,My boyfriend picked up salads last Friday for dinner and they were great! We plan on doing the same thing this weekend because they were just what we wanted. Instead of getting pizza delivered or dining out, we decided to keep it light (so we could go HAM on Saturday nights and not feel so guilty, duh) and try out honeygrow. Exactly what we were looking for! I enjoyed the "make it grain salad" added on cucumbers and chicken! Mmmmm!
2017-02-04,4,I love it here been here three times already. You order your salad on the tablet like screen they have and then pay but the cashier once it's finished. I can't say specifically what I eat there because im always switching it up.The salad is fresh,some of the workers are very helpful and others eh. There's indoor and outdoor seating.
