2021-11-15,3,Okay food for this area. Most veg food isn't very good or is too salty around here, so the options are limited. This wasn't bad, but was oily and I don't think I'll order it again. We had the Red Coconut Curry and a create your own rice noodle stir fry.
2021-11-08,5,Been waiting to order here since I moved to Hoboken. I ordered take out and got a salad and it was so fresh and delicious. I did a great your own and they got everything right. The dressing was so good and the focaccia bread and croutons were amazing! Can't wait to order from here again!
2021-09-30,2,Got egg white noodle stir fry with chicken and other toppings, plus spicy garlic sauce. Egg white noodles were not cooked fully in my opinion, and there were only 3 small cubes of chicken included. More parsley than noodles, to boot. Not to mention their chip readers were all malfunctioning.
2021-09-25,2,I ordered The Vegan Sesame Garlic Stir-fry and Brownie Crumble. I substituted the beef for chicken (chicken was salty as hell, have a bottle of water nearby). It had a burnt smell and sure enough when I was eating I tasted something funny..it was the  black burnt bits and I picked out some more pieces.I was looking forward to the brownie crumble but it was a big disappointment. It  had three pieces  of brownie  and  a ridiculous amount of chocolate chips. Maybe they should change the name to chocolate chip crumble. Grapes and strawberry added nothing to the overall taste. I won't be ordering again..
2021-09-23,1,I used to order here from time to time over the last couple of years and have been fairly happy with the food. Today, I ordered a Caesar salad. Greens were partially frozen and not fresh. Chicken was very very salty salty, as if they put that much salt on it to preserve it. Halfway through the salad, I couldn't eat it anymore. I don't remember the last time I didn't finish a salad. Needless to say, I will never go back here and will let all of my friends know. This place will close down within two years if not less, is my prediction.
2021-09-12,5,Both dishes were good! Sesame was classic staple and miso was good to venture off and try something new.
2021-09-09,4,Extremely tasty.  I had the Sweet Soy Five Spice stir-fry and The Cobbler from the honeybar. Both had really delicious flavors. I do think it's a little overpriced for the portion sizes you get especially if you order for delivery, so I can't say I'd be a regular (almost $30 for the 2 food items and a soda, delivery service fees not included) .. but that's really the only slight downside IMO. I will definitely order again sometime...
2021-08-24,1,I placed an order online which was supposed to be ready at 7:22 pm. I got there at 7:40 so plenty of time to be ready. When I walked up they said no we don't have it go talk to another employee. The other employe said ya I made yours so sent back to the first employee. They had gave away my food to the wrong person. I wanted patiently thinking they would just remake my order. 20 min later and they asked each other should we remake hers? Then asked for my order again, this whole time that's what I thought they were doing. At that point I requested a refund as ididnt want to wait any longer and they said no problem but gave me no proof of a refund.... Really bad customer service. I understand they were busy but they could have communicated what was going on.
2021-08-19,2,I loved honeygrow company , however this location really lacks. I ordered through doordash and asked for sauce mixed in and sauce on the side ( yes i paid for the sauce on the side 66 cent i believe) all to get ONE sauce on the side and nothing mixed in. So i gave honeygrow 66 cent for nothing. Also my vegetables are uncooked! everything is tasteless and mediocre. I dont understand how this comes to $40 for two bowls and our food is weltered and taste like something from Mcdonalds. Extremely annoying
2021-08-03,2,Literally just ordered take out from here and the box is literally half empty... why am I paying $13 for half an order. And this is literally the 3rd or 4th time this has happened. That's why I'm writing this review. It's incredibly ridiculous I don't know how someone can fill half the box and think that's ok? Again this has happened multiple times that's why I didn't know what else to do but write a review at this point..
2021-07-26,2,Usually I always have a good meal at this honeygrow but tonight not so much. The chicken tasted like leftovers, they used the wrong sauce and didn't put some veggies in my stir fry. Oh also my Mexican coke I paid extra for they "ran out of" and gave me an expired regular coke for the same price. Don't know if it was a bad night for them but I'm very disappointed.
2021-07-25,1,Very rude as others have said. The food looks great but we were told you need to punch in every ingredient if you wanted the salads pictured on their displays. And the way she spoke us... I hate leaving bad reviews but this place needs it.
2021-07-14,2,I've been to Honeygrow in other places and this has got to be the worst location. Since the panoramic (lol) I order most of my food either on an app on call ahead. Honeygrow makes it easy to order your food ahead on the app. I ordered food for my partner and I before a road trip. We are both vegan and I am gluten-free. I ordered him the wheat noodles. I ordered myself the rice noodles (because again, I'm GF). My error was opening the food on the road and not immediately. The wheat noodles lacked any kind of sauce and the vegetables were sparse. Tasteless. My rice noodles were wheat. I couldn't eat it. After paying over $30 for food, I couldn't eat, I was annoyed.
2021-07-07,5,I eat here all the time, maybe 1x or 2x a week, i am vegan and they have plenty of options for me but i tend to stick with the red coconut curry. theyre food is always fresh and tastes fresh. the red coconut curry is always the perfect sweet and spicy meal, i never get tired of it lol. also whenever i order for pickup, its always ready on time which i appreciate. i have to say since i have ordered here many times, sometimes i'll get a dud order. as in, they skimped me out on my food or they messed up. i will contact their customer service and they respond quickly and give me a credit which i appreciate. this doesn't happen often though, but i just wanted to point out there good customer service. also it is a bit pricy but its worth it.
2021-06-24,4,Great healthier option for takeout! Created my own salad and added their seasonal watermelon and mint toppings! Also, the rosé vinaigrette is fantastic! Wish there were more menu items already created. There were only a few for each category and then a build your own.
2021-06-14,3,Delicious but overpriced.So because of that, I will not reorder.We ordered delivery for the CYO salad and the Keto Stir Fry.The keto stir fry was $19.70 and the CYO salad was $20.15! Crazy. Portion sizes were average. Everything was good and fresh and cooked perfect but nothing really stood out. I can't say it was worth the money.
2021-06-09,1,Did a DoorDash order, it was 2/3 empty and there were barely any veggies. The amount of food that was in there was enough for a 4 year old. I ordered from here to eat healthy not to pay 18 dollars to starve myself.
2021-05-29,1,This spot was very rude when I walked in after the mask mandate was lifted. They made a company policy to wear a make even if vaccinated and I will not be dining here until they lift it. I know many others won't either and they will be losing business.
2021-05-19,4,Ordered again. This time I added shrimp as my protein and the quantity was good. So changed my rating to 4.
2021-05-18,2,I acknowledge that COVID may be impacting things here - but - I have been super disappointed by honeygrow's salads the last few times.  I feel like the quality and quantity of ingredients and gone down significantly. They options feel more limited and what I do order there is not much of in the salad - it ends up being mostly lettuce.  Hopefully with time they can get their groove back!
2021-05-15,4,Been going for their delicious noodle bowls. Good vegan option with nice tofu and flavor / sauce. Just wish the portion was a bit bigger (I eat a lot) and that you could get more vegetables and toppings without racking up a bill
2021-04-11,5,Got the shrimp bowl and wow! Highly recommend it! Love this location. Glad honeygrow is here ! Repeated customer! All the bowls are great and always clean! Highly recommend it for speedy service and delicious bowl
2021-04-07,4,Treated myself to a honeybar snack this afternoon and it was delicious!I ordered ahead and at lunchtime the wait was only 15 minutes which is very reasonable. Ordering via the app, I started with the Fruit & Granola option and swapped out a few things based on my preferences (hello chocolate chips - goodbye coconut!). I like that you can see the prices for the add-ins while you're creating your order. They offer curbside delivery; when I texted upon arrival, someone wearing a mask brought out my food almost instantly! 4 stars because it's pretty expensive for the size of what you get ($7.50) but as I said before - it WAS delicious.
2021-04-06,3,Ordered the spicy garlic noodles with chicken. The flavor of the noodles is really good, with the heat of the sauce coming through and a good texture. Good balance of vegetables and meat. However, the chicken is not the freshest and the broccoli is slightly undercooked.
2021-03-28,1,Company gave a credit for this awful food. Just cashed it in - and I can confirm that this order was equally terrible. Maybe it's better if you order in person but don't bother with delivery. Hardly edible.
2021-02-11,4,The good: The ingredients are fresh and delicious. I made my own stir fry with kale, mushrooms, scallions, jalapeño, chicken, and sesame seeds, with the sesame garlic dressing. The dressing is super flavorful! I like that they label all of their ingredients that are vegan and gluten free, it's very helpful. In addition, we ordered via Uber eats during lunch time and it was delivered in under an hour (with our correct order).The not so good: Like other reviews mention, it's a little pricey especially in terms of their portion sizes. My fiancé's stir fry with double protein came out to be $22 which even with an extra protein side seems steep. I definitely love this place for a healthier lunch option but wouldn't order from here often due to the prices.
2021-02-08,4,I've been introduced to honeygrow by patronizing the Philly locations.  And when I was in the north jersey area, I was extremely excited to find out the chain was also there!  While in the area I've gone to this honey grow tons of times and I've gone even more since the pandemic started.  This Hoboken location is right smack in the middle of the hot spot location in Hoboken and finding parking is nearly impossible.  But since the pandemic, ordering to go makes life really easy.  I've ordered on the app, received a text with the estimated completion time, arrived 15 min later and texted CURBSIDE, and they bring the food to my car fully masked. While I've tried all the sauces and fixings, my go to is the coconut curry with shrimp and rice noodles.The staff has always been friendly and helpful.  Prior to the pandemic I lost my wallet and this was one of the places I stopped and they were helpful in trying to help me recover it by reviewing their cameras and following up.
2021-01-17,2,We thought it was risky since it's a fast casual chain, but wanted to try it. My friend and I are both disappointed. We both got a stir fry with the whole wheat noodles. They were definitely the best part. I got the red coconut curry sauce which was good. He got the spicy garlic which he called "uninspired". Our vegetables were raw and almost nonexistent. Also paid extra for 3 pieces of pineapple. The crispy shallots were stale. And the entire dish had a hint of gasoline...I guess from the stir fry stove...but - gross!
2021-01-12,3,I was extremely hungry when I ordered but I got the sesame garlic noodles with beef it was pretty good overall I can't complain probably would have definitely been better with it a side of rice. The apple pie was terrible to sweet and way off from your traditional apple pie.
2021-01-06,4,I absolutely LOVE the salads here. I love the seamless ordering process through the screen kiosks. I love that you can pick and choose your ingredients and I love the assortment of ingredients they offer. But how many times can I say love? ha! The food is healthy without tasting boring and bland. Today I give it 3 because I ordered the sesame garlic stir fry and my friend ordered the spicy garlic stir fry but I was not fully impressed by either. Mine was a glorified lo mein and a bit on the salty side but my friend's spicy garlic stir fry tasted like curry so I felt like the name was misleading. I would probably not reorder either of those. However, when it comes to the salads, I would give this place a solid 5. Love their salads so much! I would drive out of the way to Hoboken to fill a salad craving here. Moral of the story, stick to the salads. Also, love that they have outlets at every table here. if you spent a long day walking around Hoboken and you need to charge your phone while eating, its a good pit stop. It's a clean modern interior, a little nicer than a Panera but it's nothing too fancy.
2020-12-11,1,I ordered via DoorDash app.  Very disappointed.  This place is too expensive for the lack of ingredients they don't include (which you would typically get) in a salad!I ordered a CYO salad and you're only allowed one vegetable add on - okay, so I added cucumbers.  It was literally mixed greens, cucumbers and tofu.  That's it - no carrots, no tomatoes, etc. So 12.00 for 3 ingredient salad.  I could have made my own for less than $5 with a lot more ingredients!I also ordered a CYO stir fry - they forgot to include all the ingredients I asked for - mushrooms, spinach, etc.  wth?!  Were they in a friggin' rush?  Unreal.  $14 for noodles with barely nothing in it!Not sure why this place has such high reviews.  Their food is okay and way overpriced.
2020-11-17,2,I eat here a lot.  It's the only true tossed salad place in town, and the salads are pretty good, but ingredient quality does fall a bit behind Sweetgreen. Prices went up a bit to cover costs during COVID, which was fine.  Now I think they are now skimping on quantity as the last few salads I got were barely more than half filled bowls for $13-$15 salads, which is not cool and makes me feel like they are ripping me off.  Their CURBSIDE deliver service never works, so I would advise not waiting in the cold to avoid going indoors.I want the place to be better, and they're ok.  If sweetgreen, just salad, Chopt, or another competitor comes to town, I will ditch Honeygrow in a heartbeat.
2020-09-26,1,Noodles are stiff and undercooked. Terrible.Moldy onions - I hope I don't get sick. They forgot the spinach mix in. This place used to be very good. What happened???
2020-09-23,3,Honeygrow has quality ingredients and flavors but the salad I got recently was a let down. You can no longer argue the price points of salads, it is what it is. What I will say is that my bowl was filled 3/4 of the way including the toppings just sitting on top. I paid extra for broccoli and got about 3 stems. Salads at places like quality greens and alfalfa are packed. I struggle to get through them. That doesn't happen here. Please add more toppings, fill the bowl. If I'm paying I want a fair amount of protein and toppings that make that price justifiable.
2020-09-22,5,Love honey grow- this one is always fast and warm when it comes out. A great go to spot for stir fry or noodles, even salads '
2020-09-02,2,This place lacks any human interaction.  They botched my salad that I spent 5 minutes on a tablet ordering.  $18 salad and barely filled their little to-go bowl.  Would be nice to say "a little more of this and a little less of that." But when you order through a tablet you get "machine" portions and no input of your food.  No option to request more greens (wth)?  So the girl skimped on the greens and then proceeded to put a whole cup of shredded carrots in.  That would be a carrot salad and not what I want.  Then a ton of mushrooms instead of a nice garnishing.  Who teaches these people ideal portions?  Overrated.   Glad I didn't have to leave a tip cause this service is non-existent.  Order their pre-determined salads, or go to a place where you might actually have some input.  Also if you could order bigger bowls of greenrather than the "waif" sized salad bowl would be nice.  Very disappointed.Update:  9/20I keep wanting to like this place but have been disappointed every. Single. Time.  Went a couple times this summer and again today.#1.  Chronically Tiny salad.  What gives?  For $15??#2. No way to request more greens.  Greens are cheap but I'll pay an extra $1-2 for more.#3. Waited 10 minutes for a salad! And no one in line before me.  3 people standing around not making my salad.  Then made the wrong salad.  Software glitch apparently.  Oy!
2020-08-27,2,Im not certain why this restaurant can't EVER include everything ordered in my deliveries.  Cross the T's and dot the I's...it's that simple.  On at least 3 occasions I've ordered from this Honeygrow and only part of the order arrives (via Doordash or Seamless).  VERY FRUSTRATING.  Honeygrow Manager/Operator, if you're reading this... TRAIN PEOPLE ON HOW TO PACK ORDERS!
2020-08-23,4,I would like to update my review as I tried this place again after craving for some good NEW YORK CITY noodles which was closed. I am glad that I tried it again. This time I really liked honey grow and the quality of the products they use. Definitely going to try it next time now that I know what combinations I prefer! I ordered the red coconut curry through their app which btw is super friendly and easy to use. Also I would prefer ordering from there instead of going to the store and standing in the line if at all. I just have one complaint that the sauce used was too less and I kinda felt like I needed more curry sauce with my noodles as it was mostly dry after couple of bites. I will make sure to mention that to the person there next time.
2020-08-03,5,Update, got my refund. Handled it very professionally, also got a $10 reward which was really nice. Definitely will be visiting again just double checking my order before leaving.
2020-07-22,1,I ordered here twice. The first time, my food arrived slightly late and I received the wrong items. The food was very good though, so I decided to order again.Tonight, I ordered delivery at 7:43 pm. The latest arrival time was set to be 8:10 pm which was very reasonable. Then it got delayed to 8:30.. 8:50.. 10:10... then just completely cancelled. I am so hungry. No explanation from the restaurant. This is absolutely ridiculous and I will NEVER order from here again. I DO NOT RECOMMEND THIS ONLY FOR THE HORRIBLE SERVICE.
2020-07-07,5,Delicious salad! I was craving sweetgreen for lunch, trying to be healthy and all, but unfortunately the chain doesn't have a store near me. I was a bit hesitant to order at first because I was worried it would be a salad with tons of lettuce and no toppings, but it was packed with meat, veggies, and flavor. Quite filling.
2020-07-03,3,Here's the thing, Honeygrow is good, but the portion is tiny. I got a salad with chicken and it came out to almost $17, but it was VERY small.The ingredients are good and quality, just not worth the price tag. Also, it's definitely more of a lunch spot versus dinner.
2020-07-01,3,Forgot my sauce on the side so I have super dry noodles thanks guys I have to see what's in the fridge to add it just not the same
2020-06-21,1,Using the self-ordering kiosks was a huge mess. The first time I ordered and paid, the order never went through I was waiting 30 minutes until they realized there was a problem. The second time I ordered, I chose tofu as my protein and they mixed tofu and chicken together. I am vegan, so the food was inedible. Never going here ever again.
2020-06-05,5,I honestly think Honeygrow makes the best salads in Hoboken. Huge portion. A TON of ingredient options. Everything is fresh. Pretty affordable. I've always gone in and placed my order on the big touch screens and it's ready in like 15 minutes tops. My last order was during COVID so I placed my order via Yelp and opted for Curbside Pickup. I received a message saying that I'd get a text when my order was ready. Great in theory but after waiting outside for quite some time, I never got a message and ended up going in the store to check. My order was waiting on the table. Not the end of the world and I'll still 100% come back next time I want a delicious salad but still a little annoying. I usually go for the "Create Your Own" but they have some really great precrafted options, my favorite being the Make it Grain. (I'm just a sucker for roasted beets). Maybe ask for extra dressing because once or twice I did wish I had more. Anyway, thanks Honeygrow for letting me eat healthy and not letting me be bummed about it!
2020-05-31,2,I've ordered from Honeygrow several times and not once has the order been correct. Today was the last straw. Decided to give one more shot, and not only were the items I ordered incorrect again, but my husbands food wasn't even in the bag. There was no offer to remake the food either. The only reason I've given two stars instead of one is because the person I spoke with when I called immediately offered a refund for the whole order. I appreciate her effort to resolve things quickly.Super disappointed in this place though. Will not be ordering from here again.
2020-05-18,1,Honestly, love their stir-fry and had returned a second time for it this week. That's when things took a turn for the worst.Placed an online order for pickup at 12pm. When I arrived, there was a long line of people waiting for orders which didn't deter me and I had waited for my turn. However when I arrived at the front of the line, it was made aware to me that the employees had accidentally given away my order to another customer. I told them I'd return in 30 minutes and give them time to remake the orders. An honest mistake, which I understood.I returned back to the facility 30 mins later, and was greeted by a different employee who had no idea what had transpired half an hour ago and didn't have my order for me again. They told me to give them another 15 mins to make the order and I watched them rush to put together my order that was placed an hour ago.I understand that businesses are working hard during this pandemic but I am a healthcare worker and had to return twice to the location for lunch during my break and while I'm on the clock. It's completely unprofessional how service is at this place was. While the food was good and I enjoyed it, I don't believe I'll be returning to this establishment because of how terrible this experience was.
2020-05-15,4,This place has some really delicious, fresh food. Any stir fry is really good and filling. I like the aesthetic and set up as well: you order on a screen that is really easy to use with pictures and information on all the ingredients. I've always been very satisfied with the quality of ingredients that they use. I've never received a soggy piece of lettuce or anything less than super fresh. The honeybar is kind of nice too but a little too simple for the price. It's about six dollars for a small cup of just three kinds of fruit with honey and maybe a couple other toppings. The only reason I give four stars instead of five are some of the prices. The stir fry price is pretty fair for the portion, quality, and location but I wasn't thrilled with the salad I got. Good fresh food but it was skimpy on the toppings. Three vegetables are included but you don't get much of each. I also paid over two extra dollars for a small amount of "spicy" tofu added which I thought was bland. I was still hungry after and I know many places in the area that you can get a more filling salad for the same price. I will definitely keep recommending them and returning for their stir fry though!
2020-05-01,2,Recently ordered from them this past Sunday and received my order that was undercooked, missing ingredients, and they forgot my drink. I spoke to Sharon and she said that they would refund it (which they didn't). I gave them the benefit of the doubt and ordered from them again on Tuesday. This time they never delivered my order and offered to refund it. Again I spoke with Sharon and AGAIN they have yet to refund my order.
2020-03-25,3,Not bad at all and we appreciate them being open during such a crazy time. Good price and nice amount of food (we all wished we had some soy sauce though.) I got the apple ginger juice and it was amazing!
2020-03-14,1,Ordered two bowls of create-your-own noodles today. Delivery was fast. Food was disappointing.For the bowls, we choose to add broccoli, edamame and mushroom. And there's literally NO broccoli and NO edamame. It was just noodle, salty sauce and mushroom. Disappointed.There were vegetables in the second bowl which my boyfriend had. We ordered the SAME thing but how can they be so different?? The vegetables were still raw and overall it was just overpowered by the sauce. Spicy and salty.It was our first time ordering from here and will he the last.
2020-02-25,5,They were super understanding and caring about the situation and fully refunded my order!
2020-02-24,1,Did anyone else get poisoned on Sunday night Feb 23rd, 2020? I ordered a salad on seamless and it was two hours late. Got grilled chicken salad with romaine lettuce and some veggies with the avocado dressing. I was in the bathroom the entire night. I have not been poisoned like this ever in my life
