2018-10-03,3,Very modern! I really like the order process with the computer & check out options w CC machine or cash.  Convenient!! Looked very clean & the staff is friendly. I'll def come back!!
2018-09-18,3,My friend was coming over and sent me a quick text saying he was at honeygrow and could pick something up for me on his way.  I had been eager to try the healthier quick-serve restaurant, so this seemed like the ideal opportunity.  I decided to Create My Own Stir-Fry, starting with a base of brown rice.  I then added their non-GMO, roasted spicy tofu as my protein and contemplated my selections for the 3 included vegetables.  I wound up opting for the shredded carrots, snap peas, and mushrooms, and then proceeded to the sauce selection, choosing the sesame garlic sauce.  Unfortunately, I was not aware that I was also entitled to 2 garnishes, such as pickled cucumber and spiced agave cashews, so I missed out on those toppings.Once my meal arrived, I smiled at the familiar Chinese takeout packaging and grabbed some chopsticks for the fun meal that awaited.  The tofu had a subtle kick that was still distinctive beneath the heavy amount of garlic sauce.  All of the vegetables were crisp and fresh, but I was disappointed to find snow pea pods instead of sugar snap peas.  Snow peas were not even a menu option!  Also, my friend had apparently asked for them to go easy on my portion of sauce, though I found it rather saturated.  Overall, the flavor was rich and impactful though, so I would say this would be more of a 3.5-star rating.
2018-08-31,1,I had a horrible experience here. We were waiting at least half an hour (being generous) for our honey bar order. Not even a stir fry- honey bar. When we got there there was hardly a soul in the place. When we left there were about 25 people waiting for their orders to be done. As per the worker their machine wasn't working so they weren't getting orders. Not sure why the mass group of people did not allude to something being wrong but it is what it is. He assured me he'd get right to it. I waited about ten more minutes- saw that there was no sense of urgency from any of the staff. I left without my food as I had no where to go. $7.00 and 45 minutes shot to hell. Not happy about it. Sucks because I used to love this place.
2018-08-28,2,Customized my salad. They did not include everything I ordered. Salad is very small and not worth the price. Will try their noodles and stir fry next go around.
2018-08-28,2,I've literally been waiting 40 minutes (and counting) for a salad and decided to write a review since I've got all this free time.The last time I came, they completely forgot to put the chicken in. It's a chicken salad, and they forgot the chicken.I used to come here just about everyday as my office is nearby. It used to be pretty good then and it was my go-to spot. But the quality and service has gone downhill in a big way over the past couple months, and it seems from all of the other recent negative reviews that I'm not alone in thinking that. The customer service reps at their HQ are always super responsive and helpful, but I shouldn't have to reach out to them so frequently about order issues.Unless you're okay with waiting 40 minutes for a salad that might be wrong anyway, go somewhere else.Giving them 2 stars for the quality of the ingredients they use (the veggies are always really fresh) and the fact that they do get my orders right the majority of the time.
2018-08-01,1,Honeygrow has a great brand and great staff, but the food not so great. Not only waiting 20+ minutes (only person at the restaurant at this time), the food was undercooked and drenched with thick sauce. The stir-fry comes out slimy, unhealthy, and a waste of money. My instructions were not honored and I felt rushed out of the restaurant. There are too many great food options centralized in such a small place that I'd recommend look elsewhere. I hope to return some day if I see some improvements.
2018-08-01,1,Ordered seasonal crab noodle take out. Charged $5 for the crab. Got ZERO crabmeat. Make sure you have the protein you ordered before you leave.
2018-07-29,3,I enjoy the food, but this place will be completely empty and still take over 10 minutes to make a salad. It's so frustrating. The Parmesan crips are great salad add though.
2018-07-26,2,This place is the worst. When done properly, their salads are good. Unfortunately, they consistently and without fail screw up my orders. Did you pay an extra $1.25 for parm crisps? Oops forgot those. Did you pay an extra $1.50 for avocado? Forgot that too. Does a Cobb salad have bacon? Oops we left that out. Their salads are pricey to begin with and when they charge an additional 15% to 25% for add-ons that they forget to include, it ruins the experience. I recommend avoiding Honeygrow.
2018-07-26,1,This place is in serious need of a manager. I once waited 39 minutes for my food and even then they forgot half of my order. Gave them another shot recently and both times ingredients were missing from salads. Complained to their customer service line and never even received a response. This place is run by children. Don't waste your money here.
2018-07-24,1,Heard a lot of good things about this place and decided to try it out since I work so close. First of all the female workers attitude is disgusting. I had ordered food with brown rice, one of the employees had explained it would be 15 mins so the rice could cook. I didn't mind waiting...until it was past 30 minuets so I had asked how much longer and the female works had rolled their eyes at me. They were extremely rude to be verbally and attitude wise. I don't recommend anyone going their again. Update: I took my food home and there was paper in my food
2018-07-24,2,Delicious, but evidently the stir fry comes in a half portion now. Used to come in a larger takeout container, then in the Chinese food container (cute but less food), now it's half a Chinese food container. All for the same price.  Will be our last order from Honeygrow.Update: I emailed honeygrow this morning per their instructions below-still waiting for a response.
2018-07-22,4,Since moving to Hoboken, I had been wanting to try Honeygrow. I hadn't yet because it was a bit of a walk from where a live. Fast forward to one Sunday, when my BF and I were walking around trying to decide what to eat for lunch. We wanted something relatively healthy, and that's when he pointed out HoneyGrow.Once you walk in, it's a self-ordering system. They have a few stations where you can pick what you want and customize it to exactly how you like it. I went with the summer seasonal item, the Chesapeake Crab (noodles (+50 cents for wheat), with tomatoes, red onion, scallion, parsley, and swapped the bell pepper for bean sprouts). It was served in this tomato brothy sauce, which was packed with flavor. They also gave a generous helping of crab, which I did not expect. I enjoyed every bite, especially with some Sriracha sauce. BF got the Sweet Soy Five Spice (brown rice, spiced ground turkey, green beans, red onions, sesame seeds). He liked his too but his portion looked small - smaller than mine at least.My favorite thing about Honeygrow is that the menu items are customizable. If there's a menu item you like but an ingredient in there that you don't, you can easily swap it out. If that's still not your thing, you can always create your own stir fry. Be prepared to wait though. We waited about 15 minutes before our food was finally ready. But it was worth the wait.
2018-07-18,2,I have eaten there 4-5x per week for the last 6 months. No longer...their staff is inattentive, more aloof than rude. Orders are long delayed leaving the kitchen and are often incorrect. Ownership and management should make changes immediately.
2018-07-17,2,Only giving 2 stars due to the NEW APP which SUCKS!!   You need to go back to the previous app for ordering, I get food for executives at my job everyday and this order was a nightmare.  First I couldn't get the app to work, then I had to leave a co-worker dealing with the problem placing the order and calling the location manager to troubleshoot.  While all this is happening I am driving to the location to pick up the food!  Bad idea changing an app that was just fine!
2018-07-13,5,The employee who responded to me sent me a giftcard for $15. Thought this was very nice. Got a salad and its pretty good! I appreciate good customer service
2018-07-08,1,Place really fell off. I ordered the make it grain salad and I was not a fan. The flavors did not work and the dressing was overly salty.  They claim to have all these ingredients in the salad but there is barely anything in there. I should have listened to the reviews of this place before ordering. They also gave my wife a completely wrong order. The guy over the phone refunded us the salad which was a saving grace. Looks like the quality has gone down here...
2018-07-06,3,We ordered rice noodles in coconut curry, which was good. Although it would taste better if the food was more warm and there was more of the curry sauce. You can choose your veggies and protein through a kiosk, which is used to place your order and that is what I really liked about the place as you can customise the dish as per your taste. But we ordered for red yellow bell peppers and instead got green capsicum. Otherwise overall it was ok.
2018-07-02,1,I'm so grossed out. I was about halfway through eating a stir fry and I found a big fly in it. I was actually enjoying the meal until I found this. Safe to say, I will never be returning.
2018-06-24,4,I love this place because of the humanely, locally raised protein they get. The selection in this area is slim and they do a great job at a quick, healthy, delicious fix. This is a great place to sit and do work but...Except for my biggest problem which is that the music is TOO LOUD!!!! Way way way too loud. It's too loud to do work, to sit for my meal, and to talk to someone sitting next to me or infront of me. The music selection is amazing, but please tone it down.
2018-06-19,1,Food is pretty good, but service is terrible. If you order more than 1 item prepare for them to forget something. It happens at least half the time you go in there. And instead of apologizing for you having to stand there while orders placed after you come out before you, they just try and act like nothing happened. Update:1 star- they consistently give you an incorrect or incomplete order and you don't realize until you get home and open the box. Then they tell you to come back if you want a refund. I came there to get a quick meal on the way to something else I have to do, I'm not coming back because I don't have time
2018-06-15,4,Good and speedy service and great taste. However, it is a bit expensive for fast food.
2018-06-15,5,The food is fantastic, everything is always fresh.  I can eat this everyday.  Customer service is absolutely amazing.  We had ordered honeygrow for our military unit and they were very accommodating.  Thanks again for the great food and excellent service!!!
2018-06-15,5,I have eaten at this location multiple times and it has never failed to provide a delicious fresh meal! Recently I put in a catering order for my company for several days and Steven the Catering Manage r has been nothing but supportive, patient and helpful. Despite changing our order several times and having some difficulty with the payment issues Steven worked with us every step of the way! I would recommend this location for just an easy lunch or dinner  but also for any of your catering needs. I love honeygrow!
2018-06-13,3,Like the concept of self service order kiosks. Wasnt very impressed by the food. Will give it a couple of more trys.
2018-06-05,4,I ordered a vegetarian CYO stir fry from this location through yelp.The pickup was quick and easy but after reaching home discovered that the meal had chicken pieces in it. No reply whatsoever on calling the location.Eat at your own risk !Update:I was reached out eventually by the business and I was compensated fairly for that .
2018-05-18,1,I went back to HG today for the first time since my last review. My order was prepared incorrectly yet again. There was an extra item that I had paid for which was left out of my salad. Unfortunately I did not realize the omission until I was already home. I actually emailed the management team as I had been asked to in response to my last review and never received a reply. Maybe it's all for show - asking those that leave negative reviews to contact them.
2018-05-15,5,Great fresh salads. Love how you give you options and let you make your own dishes as well. Last time we tried the noodle salad and it was awesome. This time we made our own salad and stir-fry and they were amazing. After a great workout we wanted to eat healthy and this was the perfect spot
2018-05-15,5,Why has Honeygrow not yet eclipsed Sweetgreen?!? It's better quality, better tasting, and less expensive. Plus- so easy. When you walk in, you use the giant touch screen (there are several) to customize your order and pay. Your delicious salad or bowl comes out fast, and you're good to go! It's the perfect spot for a healthy lunch, especially in a busy work day.Any dietary restricted humans can find something to love here. I customized a Cobb Salad and let me tell you, mesclun+spinach and balsamic (no cheese, thanks) makes it a healthy salad and super fresh.Rooting for honeygrow to steal the market from sweetgreen
2018-05-09,1,Was looking for a salad place in Hoboken, and came across this place.  The spinach salad was dry, the chicken was almost frozen, the vegetables and toppings were not fresh. would not recommend.
2018-05-02,2,When the place first opened it was amazing. But the food product has greatly decreased since then. I am writing this review after my last 3 experiences were bad. Yes, I gave it 3 more tries because I used to love this place. One time the stir fry was burnt, I actually returned it and ask for a new one. The second time there was barely any sauce on my stir fry. And well this past week I got my stir fry and it wasn't cooked. The spinach looked the same way it would on a salad and the pineapple was still cold. I really hope management comes in and pays attention to the product going out to its customers. Unfortunately, I won't be returning.
2018-04-30,2,The first few times I ordered from here I really loved it. Ordered last night and they mustve changed up their portions to save money. I ordered tofu as my protein and there was only 3 tiny cubes of it in the whole salad. Also added avocado and there was only one sliver of it. If youre paying extra for items you expect there to be an acceptable quantity of them.
2018-04-21,1,Avoid, was once good but service has rapidly declined and workers almost always forget items in orders. I was given a stir fry with NO SAUCE, how is that even possible? If you want a good meal go up the street to quality greens kitchen, forget this place
2018-04-18,4,I got the egg noodles with chicken, broccoli, green beans, and carrots with spicy garlic sauce. Topped with sesame seeds and pickled cucumbers. Their lemonade is really good too. Ordering on the kiosk was easy but it was crowded so it took a while to get the food. The floor was a little dirty with food in the dining area.
2018-04-09,2,Service: 0 stars; Food: 2. They lost my order when I was standing at the counter - frustrating experience when you only have a 20 min lunch break. Food is ok but not a lot for your money.
2018-04-01,4,This is one of my favorite places to get stir fry! I like using the kiosk and it gives the customer the opportunity to look through the ingredients thoroughly. Staff there is very nice. I have gone there mostly during lunch hours so it is usually pretty full in there and the wait can take a while. Overall I enjoyed my experience here and the food is great!
2018-03-26,4,The food is amazing!!.....however expect to wait at least 25 mins. It's not a quick grab and go experience after work!
2018-03-24,4,I loved my meal. It was delicious. I ordered the chicken stir fry and the better off red cold pressed juice (pre-packaged). It's an open kitchen so you can see them cook your meal in front of you, which is nice. Portion was a good size for the price. Ordered on GrubHub through yelp. It was convenient and quick.
2018-03-22,5,William was very professional. He took matters into his own hands and helped me immediately, definitely come back again:)
2018-03-22,1,Complete and utter disappointment. I paid $12 for one of the smallest portions I have ever seen. Although the flavor was good, 100% not worth the money and would not recommend. The picture below is exactly how it came, untouched & uneaten.
2018-03-22,1,really bad stirfry and extremely overpriced for the amount of food. They also didnt close it properly and it went everywhere
2018-03-17,3,Love this place good tasting food good quality   one time my salad was missing ingredients and the manager was nice enough to waive the cost for my next meal there
2018-03-08,5,I love, love, love this place. For my first visit, an employee asked me if I had any questions and, after finding out it was my first time, talked me through the menu. She listed her favorites, and was also very descriptive on flavors of topping options. The portion sizes are huge and I always feel full after eating here. I highly recommend if you like healthy and fabulous food selections.
2018-03-07,5,This place is delicious. Great healthy options and the service is awesome!! Love the honeybar option for a treat!
2018-03-01,5,I love honeygrow! The Hoboken staff is so fast and friendly but the best part is the quality of food. The stir frys are always made fresh to order and there is nowhere around like it!
2018-03-01,5,Just tried the red coconut curry and LOVED it! Will definitely make this a new go-to to pick up for lunch or dinner! Everything was super fresh and you can customize whatever you want on the menu! Always hard to find quality places for value in the city, so happy to have found honeygrow!
2018-02-21,4,First time visit. Had tuna salad with some add-ins. Tasted fresh. Not too much dressing. Hubby had Cobb salad with add-ins. Liked his too. We shared fruit & honey for dessert. Lovely! Open one near us in Bergen County.
2018-02-15,2,Service needs significant improvement!I'll start by saying that the ingredients and meal overall is always good. I've been going to HG for years and usually get salads because of the ability to customize and enjoy the stir-fry when I do order.However, HG has always struggled to get customer service right (at least at this location) and similar to other reviewers, there's usually something incorrect about the order.Tonight was the first time I got so frustrated I almost walked out. I encountered a very negative employee making salads that incorrectly put tuna on top of my salad (side note: who actually likes tuna?). When I corrected her and told her it was okay just to take it off she had an unnecessary attitude, threw the salad out, did not apologize for the already 15 minute wait and aggressively slammed together my new salad. Without speaking one word. I want to be understanding that there might be something happening in her personal life but I have learned in the service industry you must put on a poker face and be pleasant to customers and fellow employees.I will likely be returning because I do enjoy the food, but if I'm in a hurry or trying to avoid negative vibes will likely go elsewhere for lunch and dinner.
2018-02-01,1,Why is this place so crap?  Keep messing up our orders and providing such bland food??  Never going back.
2018-01-30,4,Been wanting to try this place since being in Hoboken as it looks pretty good from the outside. This review is based off of a one time visit. I ordered shrimp stir fry with spicy garlic sauce and rice noodles. Serving size is decent so price of almost $12 is reasonable. Problem is the meal lacked salt. Understanding that it is a "healthier" alternative to take out foods in Hoboken which I am thankful for, I won't go too hard on the review but as we know , even a hint of salt can change the world. Anyway I liked the experience because I ordered and received my meal in about 5 minutes and the food is fresh.I will try again and update my review if there are any changes.
2018-01-25,4,I give this place 4 stars because their ingredients are great. I will say that they've gotten my order wrong multiple times and it's been frustrating. However, when they do get my order right, the meal is great. I typically get stirfry because that hits the spot with my tastebuds, but I have gotten salads here and thought they were fine. I can tell that they've hired some new staff and they are trying to do better with their customer service so I do want to give them credit for that. There was a period of time when they handed out coupons because I think they realized they were getting a lot of orders wrong and trying to bring back customers, which I think was a great idea.Overall, my experience with them has been average. Mistakes happen and sometimes too often, but the food makes up for it and makes me want to keep coming back. I don't know what is in their sauce but it is so great!
2018-01-24,3,Decent taste, little expensive lunch option , definitely healthy options , always choose ur own plate
2018-01-13,3,Healthy fast food option. Pretty pricey for what you get, but food is fresh. I like that they have an app, so you can order and pickup on the way home.
2018-01-10,3,I'm upgrading to 3 stars since the food has been consistently good and without missing ingredients lately.  However, the portions seem to have been cut by about a third, with the prices at or above what they used to be.  Not a good move.
2018-01-09,4,I didnt expect much but it was pretty good. I came after the gym thinking it would be healthy but not everything is, or rather the bowl i made was not. I got the egg noodle bowl w mushroom, tofu, beans, broccoli, cilantro and fried shallots in a red curry sauce. It definitely tastes good and has a nice freshly cooked charred flavor.  Id come again!
2018-01-04,2,GREAT food, but so, so, so slow service and cooking time! Waited 30 min for a stir-fry! I'm not expecting speedy Micky-D servings, but 30 min for a to-go meal is simply too long. Never again - sorry, Honeygrow.
2017-12-19,2,I usually love honeygrow! As a gluten free person I love that they have rice noodles! Sadly, they just gave me the incorrect order which I didn't realize until I got home. Thank god I realized the noodles weren't what I ordered otherwise I would be super sick! Note to self, always double check your order before you leave any restaurant!
2017-12-13,5,I want to give a huge shoutout to Shenise! Thank you so so much! My husband and I walked in at 9:58pm and they were already starting to clean up. We asked if they were closed and she said, "What time is it?", when we said 9:58 she said, "We're open, put in your order!" She was so kind and made our salads so quickly and not even complaining, even though I'm sure she was ready to go home for the night. At the end we offered her a tip and she so politely refused and said they happily accept reviews on Yelp, so here it is! Thank you Shenise!!!!!!
2017-12-13,3,I am a regular customer at honeygrow so when I saw that they changed the size of the salad bowl I was very upset. The bowl is much smaller than the original size and the prices are the same, which is expensive. I asked for a salad with extra dressing and ended up with a container of oil because there was not enough vinegar mixed in with the oil. The salad was not appetizing at all. I really hope they change the size back to what they had because the size they have now is not filling.
2017-12-04,5,BEST STIRFRY IVE EVER HAD!! I got the Sweet Soy Five Spice stir-fry bowl and substituted the turkey for Tofu 5/5 Stars
2017-11-28,3,When they get it right, this place is great - but I've now had multiple instances where my order doesn't have all the ingredients I chose, some of which I paid extra for.
2017-11-28,2,ReAlly liked honeygrow at the beginning but lately my salads started getting lighter and lighter until the day when they called my number and the lady handed me the paper bag to go and I literally thought she gave me an empty bowl  so I opened and voila new to go bowls which are smaller and filled much less salad. Not more my fave place I'll buy my salad elsewhere. For over 11$ I want more salad ! It's not filet mignon its salad !!! And that small bowl was not even filled with 4 poor tofu bites. Disappointed very very much
2017-11-21,1,Unfortunately I had to write this review. I actually like the food but their service sucks! This literally just happened: Ordered through Seamless at 8 pmGot a text at 8:30 pm saying the food is on the way9 pm the food still didn't show up Seamless order tracking said the food has been deliveredCalled restaurant 5 times nobody picked up Called Seamless and they couldn't reach the restaurant eitherCanceled order through Seamless at 9:20 pmThe delivery guy showed up at 9:30 pm and said he won't give us the food because we canceled and he walked awayCalled the restaurant another 3 times still nobody picked up. Don't order from this place unless you are interested in waiting for 1.5 hr for nothing.
2017-11-18,5,Dennis and Will were super helpful!!Grub hub a delivery service, failed to deliver food items ordered.BUT the manager and staff completely compensated me.This the of customer service should not be over looked in the food industry:)Also the food is delish, Very happy customer.
