2018-01-24,2,I was looking forward to trying this place after hearing good things but it was just ok.  Ribs were the best of the smoked meats and corn pudding was the best side.  They were slightly above average but nothing to write home about.  Everything else was average.  Not bad, nice place, server was nice but the food is average and because of that it is overpriced.
2018-01-16,4,I came here with my boyfriend and his best friend and we have not stopped talking about the chips and queso blanco. You have the option to add in meat to the queso. We added the brisket into ours and it was life-changing.We got the platter that feeds four and comes with two large sides. You can't get fries as one of those sides; you have to choose from their list then pay additional for the fries, so you basically have three sides. Other than that, the chips and queso and drinks were awesome.
2017-12-25,1,This is the third time I'm giving this place a chance and I am making my review final.Service seems to be getting worse and worse as the staff in this place are extremely lazy and clueless.The barbecue in this place is entirely flavorless and dry, it doesn't even seem like they use a smoker it seems like it's baked in a regular oven.I've left a review for this place in the past and the owner made it a point to get my review erased from Yelp and was offended when I spoke the truth. If you are in the mood for barbecue go to Jersey City and try Hamilton pork.  It's well worth it believe me.
2017-12-21,3,The food was great, they had live music when I went , the band was good the only issue I had was the guy at the door checking IDs was rude, and we didn't see a server for a good half of the night after she took our order.
2017-12-16,5,My husband and I had our rehearsal dinner here, and it was just amazing! Not only is the food delicious, but the drinks are fantastic and the staff is super friendly. The view (waterfront!) is unbeatable, and all of our guests are still raving about how cool it was to do our rehearsal dinner there.
2017-12-05,4,I came here with my fiance after running the city challenge race in Hoboken for some celebratory drinks (a free one for race participants) and celebratory wings. We sat at the bar and unfortunately the bartender didn't honor the free drink without the drink ticket... which is attached to your race bib and seemingly gets ripped off when running obstacles. Not a deal breaker and of course there are in house policies, but it would have been nice for this to still be honored.In any case, can't go wrong with beers in general (most of the time), but really came to review the delicious smoked wings. Marinated so well, peppery with an incredible BBQ sauce. Highly recommend stopping by for this solely.
2017-12-05,5,I don't think these reviews do this place justice!! Easily one of the best restaurants in Hoboken. Chris was an especially great server - he spent so much time chatting with us about traveling and his hometown! Thank you Chris and thank you HOQ!!
2017-11-14,4,Meat!!!! Yum. Was here in August for a birthday celebration and loved everything! Fun part of Hoboken, cool atmosphere. Sadly missed the live music. Corn pudding and ribs are must haves. Yum!
2017-11-03,1,DO NOT ORDER FROM HERE. I ordered via Seamless the brisket sandwich with two sides- mac and cheese and potato salad. The food came and was lukewarm at best. The macaroni and cheese tasted like it was from a frozen dinner and the brisket so overcooked and fatty it was literally inedible. I contacted Seamless with photos at the ready and they contacted the restaurant. The girl, Jenna, apologized and asked how she could make it right. I was so grossed out I just asked for a refund which she outright refused. The only solution she offered was sending another sandwich- why would I want another sandwich when the first one was so repulsive? It's not like they just forgot something. I am completely grossed out and lost my appetite. Why would Jenna ask how to make it right if you can only offer one solution? I had Seamless call back to get her name and she hung up on them. I strongly advised Seamless not to work with them in the future. Gross food and awful customer service makes me wonder how much longer this place will last. Avoid avoid avoid.
2017-10-25,1,I loved house of que until tonight. Me and my friend walked in at 10:19PM and they had all the chairs up and said they were closed. The doors say you close at 2am and the site says 12am. It looked like staff was more happy about counting their tips behind the counter vs helping us and seating us. Horrible service!
2017-10-12,3,FOR Delivery: guys the rumors are true, delivery is really really slow and our order came with no BBQ sauce at all even though I asked for extra on the side!
2017-10-08,4,Oh yes! I have been yearning for the corn pudding since I left.  I'm glad I listened to other yelpers and tried it. It's delicious.  So get it.  Seriously. The brisket sandwich with fries was good. I also enjoyed the platter of brisket and ribs. They were solid without fuss and tasty.  I  got to really enjoy the flavor of the meat.  The Mac and cheese was OK.  The greens were good especially when I added a little bit of Tabasco for heat. Overall a strong barbecue meal with a great location. We got to sit outside and enjoy a great view!
2017-09-30,1,If you are coming in as a couple to enjoy the piano players just forget about it and turn around. They "reserve" ALL the tables by the piano to groups. The staff is not accommodating whatsoever. I came in with a friend and the manager was super rude when we pointed out at the empty tables.
2017-09-17,5,I've been fortune enough to have visited a bunch of great BBQ spots near the University of Georgia and House of Que is right up there with those authentic places. I highly recommend a visit to House of Que to enjoy the smoked brisket, delicious sides, etc.
2017-09-12,4,The drinks were interesting. Ambience was good... live music. Service was good. We ordered the spicy drinks... extremely tasty
2017-09-11,4,Fun place to go on a summer night! We sat outside on the patio with great views of the city. The service was good and beers reasonably priced. The BBQ was better than I expected - their brisket is actually really good! Also tried the pulled pork which was a little dry. The white queso appetizer was a hit with our table too! Overall it was a nice restaurant to sit outside with a few drinks and enjoy a summer night on the river.
2017-09-07,5,hoq is great service and great food...great place to watch a game unlike some other places in hoboken where you are surrounded by a bunch of bros whoever runs this place is doing a terrific job, hats off to them as michael corleone would say: don't ever take sides with anyone against the family
2017-09-06,2,You can find better barbecue elsewhere. My family and I were craving for some serious "low and slow" barbecue process and came here with high hopes based on yelp reviews. The prices doesn't do justice. The brisket, ribs and Chicken didn't have any barbecue flavor at all. Makes me wonder what type of wood they use to smoke them. The sausages were very dry. Not sure what everyone was talking about... I guess they all have bland palettes.
2017-09-03,3,The meat was tender but a little salty. Baby back ribs, pork sausages, beef brisket. The cornbread was dry.
2017-09-01,5,It's my favorite sports bar when it comes to big games. I was here to watch World Series 2016 and Super Bowl 2017. It's very friendly environment. The waitress are very nice and they have a really big screen. My friend he loves the steak here a lot.
2017-08-29,4,A fun place to go to Happy Hour after work. The margaritas were half off & came out really quick. The foods pretty good but expensive. The corn pudding side is a must have when you go there!! The baked potato is a great choice for an entree - it's big & you can load it up with whatever you want (pulled pork, cheese, sour cream, etc). We sat outside on a beautiful night. Their patio overlooks the city so you get food & a view.
2017-08-20,3,So we went back to Que last night for dueling pianos.  Our server, Ross, was amazing.  He worked hard, he read his tables and catered to all of them, including us!!!!  We had wings and nachos, which were good.  I had peach sangria, tasty, but a little bland.  We added Malibu, and it gave it the right amount of flavor.It was dueling pianos last night.  Great concept.  Sound was a little off (the guy was close to us and harder to hear).  The girl was, by far, much clearer and therefore better.  BUT, and there is always a but.  Dueling Pianos gives out a request slip to play songs you like, and you give them money for this request (not free of charge).  We were early.  We sent in 4 requests with money inside.  It became apparent as the night went on that the more money you gave, the quicker your songs were played, if at all.  I understand they are there to make money, but to hear all night "I have 5 good reasons to play this song",  "I have 20 good reasons to put this song to the top", "I have 50 good reasons to play this song again".  I get it!  Money gets the songs played, but while we were there so early without the 20 and 50 good reasons, our songs still did not get played, so therefore, we essentially just tipped them for the entertainment.So should Que charge so this doesn't happen?  Should the dueling pianos put an exact number to be paid for a song so that those with more money don't get their songs all night.  Table 42,34, that is all we heard all night.It was definitely entertaining, but something needs to be tweaked.
2017-08-19,1,Let me start off by saying I will never come back to House of Q again and I will say why okay one I did not know it was live music night but like most places you think you would be courteous to some people who actually want to have a quiet peaceful meal or at least a decent sounding conversation so the music doesn't override you and this case they didn't have a private room like Maxwell Tavern did so it was hard for me to even enjoy myself I could not talk I could not think I could not speak to my friends and have a conversation or sit down and eat I actually lost my appetite all I got was a bottle of water and then I found out that it's a $15 minimum if you want to pay with card so if you come to this place getting something cheap you better have cash it makes the night worse knowing that parking sucks around here there's a parking lot around from house of q but it's $25 good luck I want to come back here if they gave me free food for life
2017-08-16,1,Ordered a pulled pork sandwich, mac and cheese, beans and brisket. The one star is for the beans. The brisket has no flavor, the mac and cheese wasn't edible. I spat it out. The pulled pork also had no flavor. This is by far the absolute worst take out I have ever had from any establishment. I'm appalled they even serve this stuff. GROSS.
2017-08-11,1,This review is based on multiple visits. Food is average, sometimes okay and sometimes is very bad. Service is not something that I would recommend to other places to study from. Rude approach and disorder when crowded. We will not come back to this place due to an average food and bad service.
2017-08-05,5,Before House of Que opened, to get any decent BBQ, I'd have to traverse into Manhattan and wait 2+ hours for a table. I've been here a few times since it opened in 2015, on different days of the week and at different hours. Food is consistently good. I brought friends a few time and they loved it too. The nights with live music could get pretty packed. Hoboken really has every kind of food that I care about now. Awesome BBQ at my door step, no need to trek into NYC anymore, yay!
2017-08-01,3,I think this place was average. The live music and atmosphere were great, and I love the way they open the windows on the summer days/nights. Definitely a plus. They offer both indoor and outdoor seating.The drinks were great. The Big Tex Palmer and the HOQ Spiked Lemon Tea were fantastic. We kept the drinks coming! However, the food was nothing special. The Queso Blanco was okay. Fried Pickle Spears should have had way more to them - the appetizer only included 5 pickles and it just looked scarce on the plate. The Pork Ribs were very fatty and the HOQ Chicken Sandwich almost reminded me of fast food. Overall, it was very average. I had higher expectations for this place.
2017-07-28,4,Love the vibe in this place. The food is delicious too! The drinks are great and most of the bartenders are really nice. The decor is really cool and it's just an overall chill place. My only complaint is sometimes it's gets really overcrowded where you can't get a table in the front or at the bar. But I definitely understand why! :)
2017-07-16,3,You don't go to HOQ for the food; you go for the view. The barbecue is mediocre at best with uninspired options. The smoked meats are dry rubbed and there is BBQ sauce on the table. The fried pickles were five spears to an order; they were well-fried, with a creamy ranch dressing. I had the pulled pork sandwich, which was stacked with meat, Coleslaw, and a splash of sauce. The sandwich doesn't come with any sides, but for the size of the sandwich, you don't need anything else. Outdoor seating is the best part of the experience. Situated right on Sinatra drive, you have a prime view of the Empire State Building. Tables are picnic style (communal style indoors) with condiments and paper towels already on the table.
2017-07-11,5,Omggg The brisket was wonderful!!!!!! My boyfriend and i had a great time tonight and the atmosphere was great!!!! We will be back!!!
2017-07-05,2,Admittedly, this isn't a review for the food. My boyfriend and I tried to go here on the night of the derby and it was crowded.  The hostess didn't seem too engaged with customers, and plopped us down unceremoniously at a table that looked like it had been semi occupied just moments before, a full beer can on the picnic table.  We asked for another spot as we thought it was occupied but she just moved the beer.  We ended up not staying because the service was already uncaring and we assumed it wouldn't get better.  Will update if we try again, but as a hostess you probably shouldn't look like you hate everything even if you do.
2017-07-04,3,Been hearing a lot of good things about this place and seeing as it is also by the water, a beautiful July 4th day was perfect to try it. I came here with reservations for 12:30pm but didn't really need it because the place was pretty empty. I am assuming it is because of the holiday weekend as every time i drive by it looks busy. House of Que offers both inside and outside seating. The outside gives you a nice view of the water and city. We opted for the inside as it was very hot today.The staff here were very helpful and extremely friendly. Once seated we were greeted by our waiter who made a few recommendations for us. My group decided on a pound of the smoked wings naked and the Pickmaster's Pick combo with 4 sides. The combo includes 1lb of brisket, 4 ribs, 4 sausage links and half a smoked chicken. For the sides we got the mac salad, mac and cheese, slaw, and chili. The food unfortunately looked a lot better than it tasted minus the chicken. The chicken items were all surprising really good! My favorite was the smoked wings. Getting them naked really brings out the smokey taste and when dipped with ranch, it turns it into an epic appetizer. Everything else tasted okay. To be honest most of the items were very bland. Even when dipped with one of the two sauces provided it still wasn't that great. The sides were nothing to talk about either. It wasn't great but it wasn't so awful that it was not edible.Overall, this place is very average. I was extremely impressed by their staff and how quickly all the food came. The food won't blow your mind but it will definitely get you full. Next time I come I will just be sticking with the wings and drinks.
2017-06-21,3,Not much of a fan of this place. Since there arent many BBQ spots in hoboken, there arent  any other options if your craving bbq. It would be unfair to say this place is bad but the food just doesnt have the flavor of authentic BBQ compared to other places I have been too.Pros: Alot of seating, Bar, Normal service (nothing over the top) and TV'sCons: Food is normal (nothing over the top)I would come back and give it a second chance.
2017-06-18,1,Used to be a really solid place. Food went from above average BBQ to on par with microwaveable bbq. Check out photo of the "sloppy Texan", including extra bacon for 20% extra. Service is terrible too. Would never come back.
2017-06-13,5,Visited House of Que recently on a Friday night with some girl friends. We took the train into Hoboken, and the fact that this place is only a short walk away was a definite plus. Reservations can be made on OpenTable, and we were able to easily push ours back a half hour since we missed the earlier train. We were seated promptly, near the stage where they have live music, which was our only qualm as we had to shout a bit to hear each other talk. But we are pretty easy going and made the best of it. It was a warm night, so the windows were open to a patio area and offered great views of the city. The windows being open also offered extra bar-like seating facing into the restaurant, which I thought was a great use of the space.My party ordered the fried pickle spears, Texas 3 cheese nachos, state roll of Texas & two pitchers of the ruby red sangria to share. Everything was delicious. The only thing I would pass on for next time is the state roll of Texas which was a little too spicy for my taste (but for reference, my taste buds are sensitive to spice). I ordered the HOQ burger: a 1/2 lb ground beef & smoked brisket patty with lettuce, tomato, pickled onions, american cheese, queso & special sauce on a brioche bun served with fries. I also added the bacon option. I was so hungry and it smelled so good that I forgot to take a picture to show. It was cooked just the way I asked, medium well. Even though the burger was juicy, the brioche bun kept from getting soggy.We didn't stay for dessert this time, but I think it's safe to say that we will be back again for another low-key girls night out!
2017-06-12,3,For our visit, we had the chicken and it was quite salty, and a little undercooked on the inside. The corn pudding was good, the nachos were decent, and the frozen margarita was a little too sweet. Both the service and ambiance were great, especially when you're sitting outside and looking over the waterfront.
2017-06-11,4,Up there as BBQ spot. The side portions were massive. All the meats were great - I had brisket, sausage, pulled pork and ribs. All very good. The corn pudding is the bomb.com. Must get! The waiter checked up too much for my liking
2017-06-07,1,I was really excited to taste these ribs and brisket - but I shouldn't of .. I visited there on 6/7/17 around 1:30 pm I walked in and just felt the staff staring at me since no one was there . I awkwardly said hi grabbed the menu the young girl in the front just stared at me then I asked uh can I look at this menu - oh yes go head ... okkkkk I ordered 1/2 ribs 1/4 pork 1/4 brisket ... I said how long the girl said oh it's already ready I then see this other young kid grabbing the meats out of a heating fridge weighing like it was butcher meat and throwing them in a tiny plastic container .. Now we all know you aren't giving us freshly baked meats but at least pretend like they were roasting in the kitchen until I came .. I still gave them benefit of the doubt .. ribs looked dry I asked for BBQ the girl said in the bag - i left I ate .... the meats all three were dry and extremely salty . One bite of each meat my fianceÌ and I ordered something else for lunch .. one star for the corn pudding ..
2017-05-31,1,I am specifically reviewing the 1/2 pound of brisket I had here on Memorial Day. It was terrible and definitely one of the worst briskets I've ever had. I asked for fatty pieces but instead I got dry and tough pieces. Cutting it with a fork was not possible, if you told me it was top round I would have believed you.The pieces weren't even cut all the way through and were just plopped on the side of the plate.   Presentation counts for something, even if it's just properly layered and cut slices. It must have been the slicers first day since my pieces should have gone on a sandwich or something.One friend also got sliced brisket, and his portion has better than mine. It was fattier and could at least be cut with fork. I probably should have sent it back, but by the time I ate enough to know it wasn't going to get any better it was too late. Sometimes you just have to take the loss.Five other people seemed to enjoy their assorted sandwiches and salads, and the Palmer spiked tea got rave reviews from a few. Give it a try if that's what you're looking for, but as a place serving Texas style brisket it is a hard pass for me.
2017-05-27,1,This place is trash...honestly u get better BBQ at the fire pit in Belleville...the smoke flavor on the chicken was just weird!! Not to mention wit the ribs which were also dry!! Big disappointment to say the least!!! Don't waste ur time here honestly!!!! Place deserves 0 stars!!!
2017-05-22,5,Entertained about 75 guests at the House of Que for a party last night.  Our guests had so much fun. The food, the service, the space and the entertainment was enjoyed by everyone!  Appetizers were brought out on time and ample service staff was provided to keep the crowd well taken care of.  Thank you and your staff for everything !   So glad we held our party at the House of Que!
2017-05-20,1,This place may be the biggest shithole I ever been in. Sitting at a picnic table eating chicken fingers that taste like they came out of a freezer after 2 years. If they had a noose I may have hung it up. iF u ever wanna get some aggression out go here on piano night there's plenty of jerk offs in the crowd who think they know all the words signing in ur ear and any one of them would make a perfect person to pick up your first manslaughter charge on.
2017-05-20,1,I am currently here with a group of 16 people - was a reservation made ahead of time for a birthday -- let me tell you how this is unfolding...1. We sat down at 8pm - asked for waters for the table -- just got them at 9:35pm2. I asked for two new beers about 30 min ago before my meal came out - I have since finished my meal and my beers never came.3. Speaking of meals -- I ordered the pound of brisket. 3 other people did as well. For a total of 4 lbs of brisket. They brought out one tray of brisket and a half tray combined with someone else's order and tried to pass it off as 4 lbs of brisket that were apparently supposed to be shared between the 4 orders even though we were all at opposite ends of the tables....also pretty sure that doesn't add up to 4 lbs....i would think that each order would come on a separate tray since, you know, they are all separate orders....they then tried to pass it up as a complete order and only came over 20 min later with magically 2 lbs of brisket after we had all tried to ration out the measly questionable 1.5 lbs on our table. This has been far from the only error of the night --  What a disaster. 4. There have been multiple occasions where they have come to our table with other peoples orders/food. I feel bad for those people too..5. It's now almost 10 and I still never got those beers...The service here is a train wreck and I would avoid it at all costs if you have a large party for dinner!!!!
2017-05-20,5,I'm in love with this place! I've been here three times now and love it more and more every time I go. My favorite thing on their menu is the pulled pork sandwich. I'm not HUGE on barbecue sauce but the ones that they provide are great. The service was always amazing and the atmosphere is always GREAT. It's my new favorite spot in Hoboken!
2017-05-15,3,Deliecery was swift. I like their bbq sauce and corn pudding. But ribs were pretty bad. I like Carvao's bbq better.
2017-05-08,5,This is my new favorite place in Hobo. The bbq chicken tenders and homemade ranch are to die for. The bar tenders are really chill and cool too. It's awesome when the weather is nice and you can sit outside at the bar. Also have been here to watch Rangers games and they're always accommodating with the tvs. Love this place!
2017-05-01,4,House of que is great because it is so versatile. I go there when my family comes into visit and it's always a crowd pleaser, but they also offer a great happy hour (and celebrate my favorite holidays like national margarita day...). I tend to go here a lot after work with some coworkers.Overall, great place, great food.
2017-04-29,3,Really smoky BBQ and that's a good thing. Lovely Saturday nights with the dueling pianos, but if you're drinking it's best to stick with beer since they water down all the mixed drinks.
2017-04-29,4,Easygoing laid back atmosphere. Food is great Free refills.  Friendly staff.  Great place to watch sports.  Lots of tvs. Great selection of food.  Prices are reasonable.  Frito pie yumm!
