2019-07-28,2,Usually have a good time here, great environment especially with the piano. Had a horrible experience with waiter Erik. Worst service I've received there. Ribs were not hot at all and not good. Won't be going back anymore:/
2019-07-26,5,So can I just day how nice and friendly EVERYONE here is???? Like seriously, the food keep me coming back but the service is crazy amazing! I've been here 3x (July 4, 16 and 26) and seriously great people. Love all the TVs with all the sports on and love the posts of events on weeknights. I haven't come that late to enjoy them. Ok the food is really good. Might Quinn's who??? My husband asked which did I like better. Definitely HOC!!! Oh and did I say their nachos are the best I ever had (in my Drake voice Hahha) - stop by HOC, you won't be disappointed!
2019-07-12,1,Bad rating is solely for the waitress 'Gabriella'. I've been here before and everything went fine previously. The waitress was rude from the start. We ordered Deviled eggs, waitress said they're out of Deviled eggs and we asked her to check and place the order if they're available. She brought 3 halves of Deviled eggs (anywhere in the world we would get 4 halves) they're cold and tasted like left overs. At the end, after the check, she was angry for the tips given for her bad attitude and she told "try not to come back here".I will definitely come back here and leave a bad review if I encounter the same waitress. She is just arrogant!!! Remember her name, Gabriella.
2019-07-07,5,Brisket is out of this world, and a great atmosphere for watching a game. Love the sides - get the corn bread for sure.
2019-06-27,3,The service was good but the BBQ itself was just OK. The ribs felt a little dry and the sausage didn't have that much of a taste. However, the briskets were good !!! Perhaps it was because we went during lunch time and not dinner time
2019-06-20,5,Some of the best food and best service in hoboken. That place is fantastic . Burgers, wings, ribs. Best barbecue in New Jersey. Good with sit in or pickup orders. Fast service at the bar as well . Really well run establishment
2019-06-14,1,Truly, truly disgusting. Spit out the Mac and cheese bc it was mushy and sour. Chicken was so tough and salty it was inedible.
2019-05-22,5,Great food, great drinks and great atmosphere.  Love the view of NYC skyline.  After eating we take a walk down the pier to somewhat walk off the food LOL.
2019-04-13,5,House of Que is always a fun time with friends! I usually go for BBQ appetizers and drinks, and it's always a great atmosphere. The nachos are on point, there's even a little unexpected queso surprise on the bottom on the plate that's a great touch. The beer and cocktails are on point, and each day they have their own happy hour specials. It's the perfect place for casual food and drinks with friends, especially on a nice summer day!
2019-04-06,1,Zero stars for food. (4 for location & live music) baby back ribs dry, charred & overkill on that bottled smoke stuff that stains your fingers for hours. Baked beans & corn bread sides cost extra. Beans watery. Bread basic. Chicken sandwich skimpy. Waiter barely said 2 words. He must know the food sucks. I would only go back for a beer outside. Save your money- eat somewhere else.
2019-03-23,1,Not a food review, unfortunately we never made it past the front door. Turned away at the door. We dared to turn up on a Saturday night w/o a reservation. Security guard and front door staff were very stressed and not polite, for what? No reservation...we would have happily returned with a reservation at another date and time. Back to Dallas BBQ in NYC I guess.
2019-03-23,1,The people here told us there was an hour wait and did not clarify it was on a wait list rather than a reservation. After a full hour, we went and asked for an update and was told that because we didn't have a reservation, it was possible that it could be another hour. They didn't tell us this at the beginning and we wasted our time waiting. When we confronted the hostess about this, she claimed she had. Bad service. Won't be coming back.
2019-03-23,4,Decent barbecue place in Hoboken, especially for the location (waterfront) and price! My partner is from North Carolina and a notorious BBQ snob and even he liked it! Mac and cheese was decent and my BBQ chicken sandwich was also solid. Very laidback vibes with picnic benches and we went on a really warm day last week and they had the siding open and outdoor seating available which is always a plus! As we were leaving the even had live music setting up (Friday evenings at 9).
2019-03-17,2,Sub-par customer service.  We attempted to make a reservation a few days prior and the website stated "no reservations on Saturday".  We came anyway as a group of four and we were immediately told they have no seats available for the night because everything was reserved and that we could try the bar area. How confusing!  We asked why the website had no reservations listed, but now there was zero availability due to reservations.  We were met with a shoulder shrug and prompted to try the bar.We then watched other groups come in and have their names taken down.  We went back to ask again what the procedure is for getting a table, and were told they are full bc of call ins for a waitlist. We had to then prompt the hostess to put us on this wait list.  We were told there was no way we were going to get a table anyway.  We finished up our drinks and appetizer at the bar and closed out to leave. No sooner did we have our coats on, we were approached to be seated at a table.  Just a very odd customer service experience from the hostess stand.As for the food - it was tasty, but the brisket was a bit chewy - I strictly judge my bbq on the brisket.  Our orders came to the table disjointed - two plates came, and the other two folks waited 15 minutes for their dishes.  I'd like to chalk it up to a rough night - hopefully I will try them again to see if the experience is different.  But it looks like the hostesses could use more support from their management on communicating what restaurant seating policies are.
2019-03-13,5,This place is a great time! My girlfriends and I had girls night and came here to listen to dueling pianos eat some great food and enjoy a night of drinking. The one thing is that girls take a long time to get ready so we were running late when we got there the hostess said she had given away our table. Another hostess was able to give us a table still and was very accommodating.
2019-03-03,4,My rating is strictly for dueling pianos on Saturday night.  Make sure you show up early or very close to the start time because it was PACKED when we got there late.  We came back closer to the end and it was still fun.  They play all kinds of songs, not just your typical piano fare.  I heard "Wannabe" by the Spice Girls and "F--k You" by Ceelo Green.  I thought that if the City Bar had such fare for Talent Night shows I'd have enjoyed them far more.
2019-03-03,5,My husband made a reservation a day before for us and on the day of the reservation we got a confirmation call around 12pm to confirm we were going. On our way there, 30 mins before our reservation, they call us and advise there was a mistake and if we can move our reservation about 2 hours later. We couldn't, but they were nice enough to let us know there was an event going on but they would accommodate us. When we arrived they let us know because of the event, the kitchen was close but had opened just for us. The manager was really nice and apologized for the mistake and even gave us a percentage off of our whole check. We couldn't however get any of the smoked meat since that was available until after the event was done. The food that we got was absolutely amazing however. I would highly recommend and come again! The sauces were so good! We had the wings, frito pie, Texas burger and the hot dogs  DELICIOUS!
2019-02-19,2,The hostess, the waitress/staff, the food, the dueling pianos were wonderful however the event planner Natalie Jones was horrendous to work with, this is why I gave a 2 rating. Not only she was rude and not at all accommodating she yelled at my party when we arrived. Do not go through Natalie, she does not accommodate large parties. I got my own table via her and my friends LAST MINUTE got a different table across the room that day and she threw a temper tantrum, she almost didn't allow me to store my ice cream cake in the refrigerator, which was absurd and child-like. It was pretty ridiculous how greedy and rude was. Luckily, the hostess was SUPER friendly and kind and assured me that everything would be okay that day.
2019-02-13,4,House of 'Que is a solid choice if you are looking to eat some barbecue food. There is literally nothing healthy on the menu, so don't go to House of 'Que thinking that you will be able to eat something healthy. But if you like barbecue food, House of 'Que is not bad at all! If you work in the Hoboken area, House of 'Que has a lot of great lunch special options. House of 'Que is a nice spot to go out to eat lunch with your coworkers on a Friday. House of 'Que is also a solid happy hour spot to go to after work with your coworkers. House of 'Que also has surprisingly good desserts! I would recommend trying them if you are looking for something sweet. Their sliders and sandwiches are also a great option. And, of course, their barbecue sides are delicious.
2019-01-26,2,Honestly the food isn't that great but it's the only bbq place in town so what are you gonna do when you want bbq :/ at least the ambiance is good and entertainment is cool
2019-01-24,5,I ordered their white queso for delivery. And if your looking for Tex mex style queso this place has it! Including the style of chips! So good! Surprising for a Bbq joint but available!
2019-01-19,5,Went to try something new and I was left with such a great first impression! First of all, the ambience is great. We went on a Friday night and they had live music. The menu is not too big, but my boyfriend had the 2nd pick which are two chili hot dogs with frieds and I had the HOQ Chicken sandwich which can be on a brioche bun or wrap. I had it on a brioche bun. It was DELICIOUS!!! The BBQ chipotle mayo gave it such a great touch. The fries were super crispy and just the perfect amount. Kate, our waitress, was SUPER ATTENTIVE and iloved it!! We never had to look for her to ask her for anything, she was always on top of everything. It is affordable for a restaurant with a great view (by the hudson river). During the summer, they have outdoors too so you get to dine with a view. The drinks are great too! We had the drunken cowgirl and drunken cowboy, strond great drinks for the price! I will definitely go back for more.
2019-01-18,4,I haven't been back since the first time I went a few years ago. I was craving their corn pudding, so I thought why not and ordered delivery. Much to my delight (and surprise), everything was much better than I remembered, particularly the mac n cheese. Considering it was delivery, and the delay in me actually getting my food, I imagine the seated experience is even better. I'm looking forward to going back very soon.
2019-01-14,4,If you want some good bbq this is a good spot. They do a good job with Texas BBQ since it's in Jersey and all. Large place so a great happy hour spot with bench tables and let's not forget the lovely voices during karaoke on Thursday. Service was okay but our waitress was very nice and helpful when trying to decide on sides and portions.
2019-01-13,4,Went on a weeknight for a casual dinner. Food was delicious. We had the brisket and a bunch of their sides. Chill atmosphere. There was karaoke at the bar that one particular patron sounded like he was really enjoying. Bar seemed to have a good amount of people but dining area was a little quieter so a nice balance for a weeknight. Would try it again!
2019-01-08,5,Best BBQ I have ever had. Great beer selection also. Great service and atmosphere. The corn bread is phenomenal !
2019-01-01,4,Food is good but drinks are pricey. The menu itself is quite limited but for what they offer, it's pretty good. I had the quesadilla appetizer which was really good. It came with this spicy mayo type sauce that definitely enhanced the flavor. For entree, I had the house of que burger which had a slab of brisket on top of the burger. That burger was really good. The brisket was juicy with tons of flavor as was the burger. Only knack is their beers are expensive. I went towards the tail end of their happy hour. I had a shiner bock for $4. It came in a small 12oz plastic cup. Once happy hour ended I switched to a Brooklyn winter lager thinking I'd get a full sized beer in a glass. Nope. Got the same small plastic cup but this time it was full priced ($7 I believe). I'm not even sure if the cups were even 12oz but they were pretty small. But other then that the place has some good bbq.
2018-12-19,4,There aren't many (or any other) places in Hoboken for BBQ, so if you're having a craving, this is really the only place that you can go.  I used to think the food at House of Que was sub-par, but with my most recent visits, I'm changing my tune.  It makes sense the establishment has just opened up another location in Weehawken.  On to what I like: The smoked wings have a lot of flavor and aren't breaded (as any bbq wings should not be).  The ribs are tender, but not FALL off the bone which actually irks me - if I wanted meat off the bone, I would have gotten the pulled pork!   Can't forget that they offer frito pie (bag of Fritos, with toppings and choice of meat) and loaded baked potato (with choice of bbw meat as well).   I like they have two kinds of bbq sauce at the table, so you can mix and match and see what you like better!  I prefer the darker bbq sauce - it's a little more spicy and less vinegary than the other.    They also have an a la mode option with their dessert offerings!    In the summer, it's great to have the outdoor patio with the epic waterfront view. Most notably on Friday and Saturday nights, House of Que has their Dueling Pianos show where audience can tip the pianists to get their requests played & for a larger sum (usually $20), you can get them to stop a song you don't like as well.  This show is usually high energy and a fun thing do to with a group of pals. Cons:  The Pork belly appetizer I find to be too sweet and wish the fat was rendered more and the outside was crispier.   Secondly, when ordering the desserts a la  mode, the desserts don't come to the table piping hot, which makes for a sad dessert situation.  The bbq meats can now only be ordered in  1/2 pound increments, so if you're not super hungry and only want 1â„4 pound, you're out of luck.   The corn pudding is meh (get the fries instead).
2018-12-16,3,Service great, food ok but overpriced. The wings are very good and the happy hours solid. but 6.50 for curly fries is pretty absurd. Also pulled pork was ok... baked potato small and under cooked... again wings amazing so if you go get the wings
2018-12-09,4,Really delicious barbeque, coming from someone who has not previously liked BBQ food. I got either pulled pork or pulled brisket most recently and it was so good. Great for large groups, bdays, etc. Long table seating is fun! Beer towers are also a must for the cost and for the fun of it. Dueling pianos also a really nice time! Have gone for that and beer towers a few times.
2018-12-09,1,Food was cold and tasteless. Not worth it. Quality has gone down hill. Ordered the pulled pork, chicken, and ribs. The pulled pork was served like a ball all cold and tasteless. The ribs were cold. The chicken was warm the best of the bunch. Mac and Cheese was tasteless.
2018-12-02,5,This is the first steakhouse I've been to in a while. The atmosphere as well as the ambience was very energetic with the sports fest, featuring Sunday night football going on in the background. The staff was friendly as well as helpful in every aspect. Providing great service especially with the knowledge of the house made sauces. The item that swept my tastebuds had to be the brisket. The tenderness as well as the smoked flavor was spot on. I had to say, the house made uncooked BBQ house sauce was the best I've had ever. The wings were delightful, cooked with finesse and just the way you would picture wings to be. Recommended to all who are in favor to BBQ which is a home away from home. Enjoyed the food and a great place to dine and have great dishes.
2018-12-02,5,The wait staff was attentive brought us everything and kept our hands clean ! The brought every slice they make here and it was all so good!
2018-11-28,4,I always thought no two things went together better than BBQ and piano bars. So happy I finally found a place that agrees with me. Met my brothers here for a drink and a burger and was pleasantly surprised to learn that we were in for a show. Dueling Pianos meant two people both on pianos taking requests for songs from the audience and they were both incredible. I think this happens every Saturday (she said, marking Dueling Pianos in her calendar for the next 10 Saturdays). I started off with chicken wings but just got them naked (no sauce, get your head out of the gutter!) and used the BBQ sauce that they had on the table. I must say, it is nice eating wings without the mess. Whoever thought that a finger food should come smothered in sauce definitely didn't think the whole thing through. But nonetheless the wings were cooked perfectly! Next was the burger. It was great but I will say that I asked for medium and it was a lot closer to well done  than medium. But it was still a great meal so I won't complain. Upgraded to the sweet potato fries which were alone 5 stars. The place was huge with nearly half of it being filled with picnic tables. I'm not sure if it was because of the show, but the tables were very close together. To the point where we had to climb on chairs to get to our own table. Although it was not a huge deal, I did wish we could have a bit more elbow room. All in all, it was a fun night and a really nice surprise to find a great show. See you soon for Dueling Pianos and maybe a good brisket.
2018-11-20,3,Food is mediocre at best, bbq sauce lacked a bit of a zing. Mac and cheese was just straight up flavorless. Their drinks and queso dip were the saving grace, but over all underwhelming
2018-11-17,5,some really great bbq && some really great sweets including their pecan pie pictured here a must hit while in the jc or hoboken area
2018-11-09,5,I ordered delivery from here tonight.  I was soaked and it was pouring rain, and nothing is better the eating BBQ on a cold rainy night.  I had the Mac and cheese, fried pickle spears, and the wings.  All five star worthy.The wings were a little messy.  But that's normal.If you're looking for BBQ in Hoboken, I totally recommend.
2018-10-13,1,Literally the meanest staff ever. Don't waste your time. Made reservations a week in advance and we were waiting on one more person to arrive to our table because the PATH was closed and they were threatening to give our table away. Not how you treat anyone on their birthday.
2018-09-30,4,I love this place! After going the first time I went back multiple times in the same month because it was a fun environment with great food. When the weather is nice it's a great option to sit outside. All the food we have gotten here has been flavorful and cooked well, modifications were always correct and the service has been great every time.
2018-09-23,3,Decent BBQ if you can't go to Texas, Kansas, Illinois, Alabama, Missouri, or the Carolina's. :-)The view was great from our table to see the city, the food wasn't the best tasting although the brisket was tender and juicy. The wings were also pretty decent. The rest was just meh, the service was pretty good from start until finish.Don't think I would return though.
2018-09-07,4,This place is so much fun! I had a reservation and went with a small group for Dueling Piano night (Saturday nights) and we were seated at a circle booth right near the stage. I definitely recommend coming with a group for this event, it's a fun night out. As far as food, we shared a bunch of things- nachos, Frito pie, brisket, ribs, sweet potato fries, and corn pudding. Everything was good, but my personal favorite was the corn pudding- it has the consistency of a casserole with pieces of corn. It was delicious! The drinks were good and strong and our server was great- very easy to communicate with despite the high level of noise. Also forgot to mention the location is great, right across from the water. I want to come back and try dessert, not sure why I didn't get any!
2018-08-31,1,The dueling pianos was talented but pretended that we didn't pay any money for the song requests.  $50+ dollars down the drain.  Some horrible woman with profanities on her jacket ruined the whole night  for the entire bar.  If I ever come again and she is there, I won't spend a dime because it's a waste of my time and money.
2018-08-30,3,Went for lunch with my husband and kids - kids menu is limited to chicken fingers, burger, hot dog all comes with fries. My son had the hotdog, he ate it which is a good sign because he is kind of picky when it comes to food. Out good could've been better everything tasted like it was reheated. We ordered the brisket sandwich with corn pudding and brisket chili as sides. We ordered sweet tea - it's brewed not fountain so I was expecting for it to taste great but it didn't. We ordered the cookie and that was warmed up in a microwave (you can taste it). I feel like this place is probably known for their night time atmosphere and not so much for their food.
2018-08-23,4,They are much better than when they opened a few yeara ago.   I will definitely be going again!
2018-08-13,5,We celebrated my wife's birthday at HoQ and couldn't have been more pleased.  We worked with Natalie who is the event coordinator that handles large parties (we were a group of 20). She was a true professional and made sure all of requests were taken care of prior to our arrival. Our party was on a Saturday night so we had the dueling pianos for entertainment. I was immediately introduced to all of the staff I would be interacting with throughout the night. The members of our party began arriving at 7:30 and were taken care of right away.  We pre-ordered some food and drinks and our server even re-checked with us when we wanted them delivered to the table. We did adjust the delivery time of some of the items and that was handled without issue. We enjoyed the Texas Sampler (wings, stuffed jalapenos, state roll of texas, fried pickles), brisket and chicken tenders.  Everyone in our party raved about the food and we even ordered more throughout the night.  We ordered ALOT of the specialty pitchers of alcohol and they must have been really good because they just couldn't disappear any faster.The dueling pianos were absolutely fantastic.  They kept the entire place entertained the whole night. Although our night was an absolute success and we will, without a doubt, be returning to HoQ there were a few things that could use a little improvement. The seating/tables in front of the stage are absolutely packed in like sardines. I understand that the more people the more money but it can become uncomfortable real quick.  With the amount of people at those tables they should look at the amount of staff dedicated to that area. I am not sure if they could do anything about the temperature inside the building because the entire front is left open to entice people passing by to come in but it was about a million degrees in the place all night.
2018-07-25,4,Really good spot. Awesome atmosphere with a sweet Southern charm and great view by the water. I went on a Sunday afternoon but I'm sure it's a hot spot on a weekend night. They had signs up for Dueling Pianos every Saturday night which sounded like a great night out too. Had the State Roll of Texas, Fried Pickle Spears, BBQ Quesadillas, Curley Fries, Pulled Pork, and Brisket. Everything was amazing and probably the best quesadilla I ever had. The chicken was so juicy and The State Roll of Texas was practically orgasmic. The only reason I gave this place 4 stars instead of 5 was because the brisket was a bit dry. But the house BBQ sauce was slamming and had to have a cocktail so I got the Driftwood Sunset Punch and it was quite delish. Definitely will be returning...and with more friends.
2018-07-19,4,Being from Texas (and doing college in Austin) I have a soft spot for what they're trying to do here. It's great having Shiner available on tap, the margaritas are pretty good (other than the spicy margarita, wasn't a fan - not really spicy enough). The BBQ is pretty good as well, close enough for NJ!Definitely come on a weekend to check out the dueling pianos, but make sure to make a reservation to get a good spot.
2018-07-08,1,Worst BBQ I ever had in my life. Got the brisket that was loaded with fat and the pork ribs that were dry and tastless. All items are al-a-cart and do not include sides. Everything is extra. I will never go back. Not worth my hard earned money.
2018-07-05,3,This place can be really great or really average depending on what you're looking for. The space is great. It's very open and fun, and the outdoor seating is in a prime Hoboken location--right by the river with great views. The drinks are also pretty good. However, the food is extremely average. Nothing was bad, but the queso dip and nachos were very underwhelming. This was a big minus for me, especially since I was with a large group that was sharing a lot of plates. I would recommend, but only for the space and the drinks.
