2016-06-13,3,I came here on a Sunday after the Hoboken Arts Festival and it was just that -- alright. For one, the wait was very quick ( actually no wait at all) for our dine in. ( There was a bit of a wait for the outdoor seating). Upon being seated we asked if we would be able to try a sample and the staff was really nice about that. Despite that service is SLOW! My uncle ordered a sandwich and his fries weren't bought out until he was completely done! ( However the fries were apart of the meal). I had a rather light meal and went with the sides. I got the deviled eggs, mac & cheese and potato salad. Let me tell you the deviled eggs were AMAZING but then again how could one go wrong with that anyways? The mac& cheese was horrible and I was actually sad because I really wanted to like it but I couldn't. The potato salad was OK. Nothing I would come back for but it also wasn't horrible. Overall, this isn't a bad place but again it's just okay for a quick bite to eat. I probably wouldn't come back. I felt like trying this place out one time was good enough. I think they definatly need to work on their service and being a bit more attentive to their paying customers.
2016-06-11,1,Came here at 5 was told we'd get a table after the Belmont race. After the Belmont no table. Way to cater to your resident crowd.
2016-06-11,2,Went for a birthday dinner with family. Got one of the bundle specials which apparently doesn't allow any substitutions, I get it but still kind of annoying.Food was... fine. Not terrible but definitely not great and as someone who visits Texas frequently not, "authentic." Brisket was probably the best but even still was kind of meh. Service was great at least. Drinks were very good and I bet it's fun at night with dueling pianos. Definitely would not recommend for food.
2016-06-11,1,Distasterous management.Requested outdoor table as indoors was too loud. Told 1 hour wait so we agreed. 1 hour 20 mins passed - asked for an update - was told only 2 ahead of us. Ok - busy night but almost there - WRONG!Fifteen mins later got called and informed that a table was ready - INDOORS (still too loud due to over amplified amateur pianists)Asked how long for outdoor table and was told another 1/2 hour. That would be over 2 hours after arriving. Now too hungry to wait any longer we left and had a great mean elsewhere (good food great service and atmosphere but wont say where)Adios Que - we were obviously bypassed in your queuing system and ultimately treated like the meat you cook. Your management truly sucks!
2016-06-08,5,So I'm kinda in love with this place. I visit my friend in Austin multiple times a year and we will inevitably do the famous BBQ places (Franklin's, County Line etc). This place is legitimately the closest I've come to matching my favorite Austin BBQ places outside of Texas.  The Bingo night on Tuesdays is always a blast.  Food wise, you must do the ribs and the brisket chili (no beans!!!) and don't forget the Pecan pie ala mode for desert. My new favorite date night out place.
2016-06-07,4,Really enjoyed the brisket sandwich and collard greens both times I came here. Some drinks are tasty, especially the Bloody Mary. Unfortunately the spiked tea's are lacking in kick. Came once for lunch and once for dinner on a PACKED Saturday night for Dueling Pianos. Obviously they're doing something right to have a consistent crowd. Great atmosphere, but like everything else in town--pricey. A once-in-a-blue-moon type of place.
2016-06-07,2,My review can be summed up with: no corn bread.Granted it's not the only awful thing about the place, the no corn bread really did it for me. Came here on a double date after a day on the pier and as BBQ fanatics, we were all excited to try House of Que out given it's prime location on the waterfront. It was insanely expensive and all of the food was underwhelming. I'd go as far to say as the sausage and the mac and cheese was gross. The only thing I finished was my pickle.Service was also lacking. Our waitress came by once to deliver extra wet naps but drink orders were only taken once at the beginning. She forgot to bring a portion of our order until she was reminded.I'm not mad - I'm just disappointed.
2016-06-05,3,For an update..,I had made my reservation through Open Table.  The next day I got a message from Open Table admonishing me about not showing up for my reservation and if it happened too many more times...well just don't make us have to come get you Lady!  I responded to Open Table with a copy of my check, server name, a bunch of stuff indicating I did keep the reservation and oh by the way, I would not be going back.  Aside from the bad experience, they didn't even acknowledge my reservation in the system? Egad!
2016-06-04,2,Never again will I go here.   Terrible service, waited way too long to get a waiter and way too many screw ups on the meal.  My wife and I had to send out salads back.....TWICE.   The table next to us got up and left before they could order because it took too long.  Decent food but terrible service.
2016-05-31,4,I like this place. Been a couple times, and both times, the food was pretty solid. Liked the ribs and pulled pork the best. Brisket chili was also good. I'd return, for sure.
2016-05-31,4,Only there for drinks looking out over the water.  It was good, lights were kind of bright but that's for the people eating.  Crowd was big, as were the portions being served.  Seemed a little over the top, the slices of meat were enough to feed a whole family, but I guess people like that. The view was good, and the live guitar player was talented.  They have dueling pianos some nights, would like to see that.
2016-05-30,2,Ive visited House of 'Que twice.  The first time with my little family of four, and the second time with my extended family of twelve.  I really wanted to love it both times, but it's just "meh".  I think part of the problem was that we had the same waitress twice, and she's pretty awful.  Both times we waited a really long time for her to come to the table, for drinks and for our food.  On our first visit, the food was pretty decent.  We liked the variety.  On this second visit, much of our group decided to order a special that was listed on the board outdoors, but were told that it was not available after 3:00.  Really the board should NOT have been up if that was the case.  Three of us ended up getting burgers.  No one ever asked what temp we wanted the meat done, and when a member of our party asked for baked beans instead of fries the waitress said "no substitutions". There was pretty much no rhyme or reason for how these burgers came out two had bacon and one was covered in weird runny cheese sauce, no one requested any of this...and my mom's food came out a full 20 minutes after the rest of ours did.  We sat with empty drinks for more than half of our  two hour experience. When my mom told the waitress we needed refills, she was fed up and a bit nasty.  The waitress got even nastier and never once apologized for the obviously horrendous service nor sent a manager over to apologize.  I really wanted to like this place.  The decor is cute and the location is even better!  Sadly the service is pretty terrible and the food is hit or miss.  Some recommendations: 1)Throw some cornbread on the table when people sit down (even Boston market has this "luxury")! Then people won't notice it takes 90 years for the waitress to come back.2) Hire a food runner.  Both times I've noticed the manager running food.  He'd have more time to help customers and monitor tables if he wasn't picking up the slack for the craptastic waitress.3) If your special board is out, offer whatever is on it.  If not, put it away.4)  With that, it makes no sense that the pick three items special isn't a normal menu item.  There should also just be a single side choice to go with all sandwiches. It shouldn't be a big deal if someone wants to trade out french fries, just up charge a replacement.  I don't know, maybe Gordon Ramsay should just take this place over.
2016-05-30,3,Was excited to see a BBQ place -- and with a view.  Today was Memorial Day and so I hope the service was unusually awful.  People were waiting for waiters for more then 15 -20 minutes and the bartender who took my order for ribs was a bit overwhelmed and ordered me pulled pork by accident.  Cause it came so late -- almost a 1/2 hour later - I just kept the pulled pork.  It was bit dry but the sauce choices were nice and helped.  The potato salad was tasty.  The tea vodka drink was awful - no vodka and bland - but he Bloody Mary was decent.  The Bartender was nice and comped me for the drink because of the mix up in the food.  All in all -- I think it has real potential and so I will try it again and I hope it will all be a bit better.
2016-05-30,1,This will relate strictly to the (horrible) service, since they didn't give me the opportunity to even rate the food. Arrived at 2:15 and ended up walking out at 3:15 since my table was yet to even receive water, let alone the drinks that we ordered. For some context, this is the first time I've ever walked out of a restaurant. I'm generally empathetic to servers and front of house staff (used to serve in college), but when we asked where our waters were about 50 minutes in, we were told "the manager is working on it", without any apology. We gave it another 10 minutes, but nope. The table next to us also walked out - they had two toddlers and an elderly couple and also didn't receive any water or drinks. I'm open to coming back because I'm a big BBQ fan but I'm less than impressed with the service and general lack of organization.
2016-05-28,1,bad experience, ordered a chicken wings without pepper (smoked Wings NAKED) served me a very spicy, complained asked to exchange, the waitress made the charge on my check. I not come back ever again. after she complained that came with "SORRY" missed. always check your pay!!!!
2016-05-24,5,i eat there a lot, big fan of brisk, pork ribs. I do not like chicken. Else is good. The cool sides is very good, better than hot sides.
2016-05-23,2,I love the atmosphere and space they've created but the food was OK at best. The brisket was a bit flavorless. Really good wings. Side items were good like mac and cheese and collard greens. Biggest problem I had with House of Que was the service. When I go bbq places I expect hospitality and I didn't really get it here. And I think this is a management issue because no one seemed to be trained very well. It could have been an applebees for that matter.
2016-05-22,1,Tried to come for my brother's birthday. We had a reservation for 8 outside at 2pm- we show up right at 2pm and there were zero available tables. Not only was the hostess unapologetic, but there were zero offers for proper resolution and the hostess gave other tables away as they became available instead of asking if we were interested. I was excited for BBQ but will not be back to see how it is here. Poor poor management and hospitality. What a shame.
2016-05-22,3,Dueling pianos is a lot of fun and great entertainment, especially in Hoboken which is really lacking in live music. Our server was awesome and food was delicious! I only gave 3 stars because of the drinks, otherwise I'd give it 5 stars. We ordered the spicy margaritas and you couldn't even taste the tequila, so for round 2 we ordered doubles. Still nothing and we were going through these drinks fast (bc it just tasted like spicy soda). Round 3 we got vodka sodas and again still not even a buzz? Found out later the bartenders use automatic pourers on the bottles. Stick with beer or shots at this place or you're wasting your money on expensive cocktails.
2016-05-22,3,Food is decent here. Honestly I like the portions it comes in, but they make it without any sauce and it causes the meat to become really dry. The two sauces are at the table. I lived in Texas and there is no greater BBQ than there. This place falls short on the menu. The mac n cheese is pretty good. The peach cobbler with icecream is fabulous. The atmosphere is really cute and fun. They have live music once in a while. Cinco de mayo was really loud and we had a 2 year old. Not they're fault and will not hold them against that, but if that's your thing, I can see it being a lot of fun. Just be prepared the BBQ won't be up to par.
2016-05-22,3,My first visit was FUN.  The atmosphere was great and the owner Creedo was amazing.  He checked on us three times.  The brisket was good and the sauce was good.  The greens, mac & cheese was tolerable.  I'm very picky about the two items.  I will be back!  FYI... If you park in the garage the restaurant will discount your bill.
2016-05-21,5,Food and service was excellent. It's a good value for the quality. Brisket chili was amazing and the brisket was perfect.
2016-05-21,5,I rarely write reviews, but when I do, it's because the owner comes to chit chat, the staff is awesome, and the food/drinks are amazing.
2016-05-21,4,The place was pretty decent, I went in with some friends on a Friday and even though we made reservations it took them a couple of minutes to get us a table (could've done a better job) and the place was very busy, they had some kind of piano duet that was pretty cool and made the environment super casual, the server (Winston) was super nice and helpful though he was super busy, but he was very apologetic about it and professional. Now let's talk Food and Drinks, shall we? Ok.. I had a brisket sandwich that was so good it would make any other brisket taste like a car crash in your mouth,  the ribs were pretty good too with a spicy flavor at the end kinda smoky-ish but it was delicious. for the sides we had the salad, potato salad and mac and cheese (not impressed). For drinks I was feeling like having cocktails so I went for the spicy margarita and it was really good, probably in my top 5 I've ever had. Definitely recommend the place, overall the food was great. I would recommend to go on a more quiet day to really enjoy it.
2016-05-19,5,I've heard great things over the last few months about this place but had not had a chance to stop in and try it myself. I finally stopped in for an early dinner and had a truly terrific experience.  Before I get to the food, I was really impressed with the vibe of the place.  Great location, great staff (so friendly well trained), great city skyline views, loved the communal tables, tons of TVs, validated parking, fair prices, loved it all....totally authentic.I was with a bunch of big eater male friends, so we ordered virtually everything on the menu.  There were no weak points but I'll tell you my personal favorites:* The wings were truly amazing.  And I consider myself a bit of a connoisseur in this area!* The mac and cheese - fantastic.* The Ribs are meaty, and fall of the bone tender.* Deviled eggs - not something I would ordinarily order but one of my buddies insisted.  They were excellent.* Brisket / Chili - one word.....PERFECT.* Corn pudding - if you decide to give this place a try and don't get this, HUGE mistake.  It's the BEST.Not sure if the owner is there all the time but he was when we were there.  He checked in frequently to make sure we were being taken care of and seemed like a genuinely good dude. He really seems to care and is dedicated to making this place a long term success.Bottom line:  Hoboken needed a place like this and I'm thrilled we have it now.  Welcome to the neighborhood!
2016-05-18,5,Favorite BBQ joint in jersey, they accommodated my group of 8.  Good drinks and great food, live music put it over the top.  The atmosphere is very rustic and manager and owner came up to our table multiple times to check on us.  It's great for big groups, we stayed all night.  If you want to have a good social experience plus great BBQ check out this spot.
2016-05-18,5,Arrived on a Sunny Saturday afternoon, quick seating and sat outdoors. This is a family style spot, we ordered a pound of brisket (delicious!), half a chicken (it was a bit dry but okay), mac n cheese (could have been more cheesy) and the corn pudding which was everything! The corn pudding tasted like a dessert so I wanted more! Quick service, we pretty much sat and ate all in 30 minutes. Great food, service and drinks, I'll definitely be back.
2016-05-17,5,Live music at 8:30 on a Friday night pair nicely with the amazing BBQ! Loved the vibe, the staff were super attentive, and even when the bar got backed up and our beers were delayed they made it up to us! Our waiter brought us a round of shots for our table to apologize for the wait, that's above and beyond good customer service! Definitely recommending to all my friends for delicious food, great service and even a spectacular view of NYC!!
2016-05-14,1,I hope they get their act together cause it could be an awesome place. Went there tonight (Saturday) for the dueling piano and it was packed and a great crowd. Put in our name with the hostess, she said it was a 20min wait and would text us when table was ready. Never got back to us so 45 minutes later we sat at the bar. Well that was a mistake because to get someone to wait on us to longer than running a marathon. We asked 3 waitresses and they all said they would send someone over and they never did. Finally the bartender took our drinks and a waitress came over and said "oh great you guys are good." We told her we wanted to order, and our food came fast. The second round of drinks was even more painful, we watched our drinks sit at the bar window for awhile and when she picked them up the beers were warm and flat and there was no vodka in the iced tea. After we were done we could have walked out because it took her forever to bring our check. I hope they were just having an off night but if they don't get their shit together it's not going to be there for long.
2016-05-11,2,I am a lover of all things BBQ and I was excited to try House of Que. I read that the pit master was from Austin, Texas so it had to be good! I was a little disappointed when I tried the brisket, sausage, BBQ beans and corn pudding. The brisket was moist but it lacked the smokiness of a brisket that's cooked for an extended period of time, the sausage wasn't that great either it lacked the flavor that we were used to during our many trips to the state of Texas and the baked beans also didn't have very much flavor either. If this review offends anyone, don't fret it's just one mans opinion. I'm sure there are folks that may like it. We all have different taste. The last thing I want to do is ruin a business but I thought I'd give my honest opinion.
2016-05-10,1,Overpriced bad food and terrible service.  The brisket chili had more chunks of fat than actual meat.  In addition, my order was screwed up and I was over-charged.  Did I mention we also got an attitude and a lecture about how the customer is supposed to have singles to pay with and the restaurant doesn't have change? Spend your money at any of the other restaurants in town.  This one gets a big thumbs down.
2016-05-09,3,Loved the decor.Manager was on site and was super helpful and extremely nice.Chicken wings were amazingly delicious!That said, everything else was mediocre. It's also not exactly cheap, so... It's 3 starts for me.
2016-05-08,3,The 'cue is real, none of that liquid smoke nonsense. And it's good. Sides are good too, the right balance of salty and sweet to pair with the meat. I keep going back for the food, but the service needs a tweak, hence the rating. It's friendly - and that's half of it for me - but the attention to detail is just not there. Every time I've been there, something comes out wrong, something's missing from the table, whether it's something I ordered, or there's no BBQ sauce on the table, or no paper towels (and you will need them!)...sometimes multiple mistakes in one visit. Maybe there's a communication problem between the servers and the kitchen, maybe it's the kitchen, maybe there aren't enough servers or busers, I don't know. It just seems disorganized and that puts a dent in the experience. As another reviewer mentioned, I'm rooting for this place too. I really look forward to updating my review. Just get it together a little bit! Also, a small lagniappe would go a very long way - pickles, hushpuppies, cornbread or something to munch on with your first drink while you peruse the menu and wait for your food.
2016-05-06,5,Love the ribs and corn pudding! Corn pudding is amazing! Brisket Chili side is recommend!
2016-05-05,1,I don't often write reviews, but this I had to.  So, me and my GF decided to go on a Weds night because we we're craving BBQ.  Brisket to be more specific.  We get in and are seated immediately and the waitress takes our drink order.  We order 2 tap beers.  15 mins later someone comes by and asks if we need drinks, we say we already ordered a while ago, but would like to order our food now.  We order the brisket with a side of coleslaw and mac and cheese.  Then, the waitress comes back with our beers.  The were COMPLETELY flat. I mean zero carbonation, basically beer flavored water.  The other guy comes back and we tell him the beer is completely flat, he apologizes and gets us two different beers, and says "I'm very sorry, these beers are on me."  Very nice of him, however those beers were flat too, so something is clearly wrong with their entire tap.  Food arrives and we are starving so we dive in.  Doesn't take us long to realize this is literally the worst brisket either of us have ever had.  It was WAY over cooked, (wouldn't be surprised if it was days old and "resmoked").  It tasted more like dry corn beef with a smokey flavor than BBQ Brisket.  We eat it anyway cause we were starving.  The sauces they had helped a little, but even they were bland.  Moving on to the sides, it's really hard to mess up simple things like mac and cheese and cole slaw, and although neither was terrible they were not very good at all.  The Mac and cheese was very blah, I could have made a better mac and cheese at home in 15 mins using 3 ingredients. The cole slaw was clearly a prepackaged mix that had zero flavor to it at all and was overly watery. We aren't the type to complain so we get our check and notice the 2 flat beers that we're "on me" as the guy told us, we were indeed charged for...whatever.  We pay the bill and leave and realize if we had spent 15 mins to take the path into the city we could have not wasted our time and money on such a disappointing experience.  Bad restaurants don't last long in prime locations here in hoboken and this is one of the worst I've seen in a while.  Don't waste your time.  I have had amazing BBQ in the city, just take the extra time to go there.  This is crap and anyone who is rating this place well or saying this is actually good BBQ doesn't know what the hell they are talking about.
2016-04-27,4,Great addition to the Hoboken waterfront.  Ordered ribs and brisket, with two sides of slaw and brisket chilli.  Everything was good, service was nice, live music was a good touch.  I will say that these are probably not their signature sides, next time will try others.   Was surprised that there was no option for cornbread though!  Will come back for sure.
2016-04-24,5,Awesome food and service. Went to my nephews first birthday party there. Singer playing guitar and face painting for the kids, apparently they're there on Sunday's. More food then we could eat (50 people). Brisket was moist and tender, ribs fall off the bone. Wait staff never kept us waiting for a drink, and the owner ( always checking in) never rushed us out ( he also seems to be the bus boy).We will be back, and if you want a great authentic Texas bbq, this is the place! Throw in river front setting, and validated parking, they get my first 5 start review (I'm a pain in the butt)
2016-04-23,3,Ordered from Seamless on a Thursday night. Delivery was prompt so that was a plus. Delivery BBQ, I will admit, isn't the best way to enjoy this type of food. I ordered brisket, ribs, collared greens and beans. Everything was very tasty - he brisket a little salty the rib meat tender the collard greens flavorful and he beans rich with chunks of meat. They also provided plenty of BBQ sauce - big plus. But the portion was tiny and the price was 30 dollars. When I say tiny I mean one rib, two pieces of brisket, a handful of beans and another handful of collard greens. Lost s star because of the price and portions but the food is solid.
2016-04-19,2,I like House of Que, but there is room for improvement.  I recently came here on a nice spring Sunday with a friend and wanted to sit outside.  There were several open tables outside and seats at the exterior bar.  We weren't sure if we should sit ourselves since no one was outside, but the bus boy said check in with the hostess.  The hostess told us it'd be a 45 minute wait, despite there being several open seats.  She ended up calling us 20 minutes and said we could sit ourselves at any open table outside.  We had cocktails - a mojito and a spicy margarita.  They were good - but I'd expect that for $13+ in hoboken.  We both ordered the pulled pork sandwich.  We were very disappointed when it arrived.  The pork wasn't pulled at all - rather, it was chopped.  I would expect at a BBQ place they'd have pulled pork down to a science.  When we asked the waitress if the meal was correct, she answered - "yeah, this is the sandwich.  Sometimes they chop the pork instead of pulling it."   If I wanted a chopped pork sandwich, I would've ordered that.   The place can be fun with friends, but it's BBQ is overrated and overpriced for what you get.
