2021-10-27,5,I want here on a first day and the food was delicious. They have an array of sauces for you to dip your meats in and plenty of choices for you to choose from meats. Also the sides were delicious I do recommend they are corn pudding side I do believe. It was so delicious and sweet. Also, it's by the waterfront so it's great to take a stroll after a day. I do recommend this place if you are on a budget I want tasty  food and a great view
2021-10-24,1,This was among the worst bbq I've ever had. It was bland and fatty and everything (the pulled pork, mac & cheese, and cornbread) tasted the same. They forgot by Texas BBQ Beans, which was one of the sides that was supposed to be included.
2021-10-17,2,The worst bbq I've had since moving to Jersey. They're ribs were a 2 out of 10 at best and their sausage was underwhelming.Their cornbread pudding was delicious though. I enjoyed that and only that!
2021-10-15,1,This is a little late (okay VERY late) but...The kicker is that we walked about 3 blocks away and had the best meal at Zero Otto Uno Cafe on Washington Street. Some of our party decided to part ways due to the delay/disaster at House of Que so it ended up being just 8 of us left. The staff of Zero Otto Uno Cafe literally MADE space for us as their sidewalk seating was mostly occupied when we arrived. So, they brought tables from inside the restaurant and set them up adjacent to the seating area that already had outside. Talk about going the extra mile...especially when House of Que seemed to go out of their way to NOT seat us!
2021-10-02,1,This place has been reported to the Better Business Bureau of New Jersey. They blatantly lie to your face and say there is a "$50 minimum to get a table by the live music"  when we confirmed and said "$50 a table we can do that" we are not corrected. When it came time to get the bill we were told we did not reach the minimum and we had to spend $200 ( there was 6 of us total) and they said it was "$50 a person". Since we were almost at $200 we said we would order another round to reach it. When we ordered the next round the waitress said "sorry I hate to do this but you actually have to meet a minimum of $320. At this point we called them out on this scam and the "security" came to "talk" to us ... he tried to rough us up and scare us into paying. We finally came to an "agreement" that we would pay $250 because we did not want to cause any problems. This place is a complete scam and needs to be investigated and honestly shut down. Do not go here. Very disgusted by what happened...
2021-09-20,3,Meats are quite good, especially the brisket. However, it's definitely more expensive than usual. I guess they have to pay more for the location. But overall great experience between the view, atmosphere and foods.Will come back again once for a while to enjoy the atmosphere. Would not come too often for sure based on the price.
2021-09-07,1,While we had a great time, and the view was great, I though the food was borderline inedible.  I don't know if everything had vinegar in it, but the smell was off and the food did not taste fresh. We tried just about all the smoked meats- even the chicken- and it also had an awful, almost turned type flavor. Some of the worst barbecue I have ever eaten.
2021-09-05,4,We came here on a Saturday night for dinner and it was pretty packed. We got the 48 hour smoked wings to start and they were really juicy and the bbq sauce was sweet. For the main course, we got 1/2 pound of brisket and 1/2 pound of pork ribs and a medium texas slaw. The brisket and pork ribs were really tender and went great with the bbq sauce. The texas slaw I wasn't a big fan of just because I usually like my cole slaw sweeter. We also got drinks and they were really tasty.The ambiance of this place is great. There was live music and the performers were great! I would definitely come back here again when I'm craving barbeque.
2021-09-04,3,I came here with my family for a birthday celebration. I am not usually a huge fan of BBQ food, as I am not one that can eat a whole lot of meats. I am more of a sides kind of gal. We came here on a recommendation and for starters, the vibe, views, and atmosphere was really spot on. We decided to dine outside, and the weather was just perfect for it. The views are also spectacular as it was by the water.We ordered the loaded nachos, the smoked wings, and egg rolls. The loaded nachos were mediocre, it was not anything too special, but the portions were decently sized. The wings were def. smokey and really flavorful; however, we had hoped the meat would be a bit more juicy/tender, which was not. The egg rolls were really good, it was crunchy/flakey and the filling as cheesy. For the mains, we got the Pitmaster's Pick, which contained 1 lb of brisket, 4 ribs, 4 sausages, 1/2 smoked chicken, with a side of mac n cheese and collard greens. The meats (brisket, chicken, ribs) were generally very dry and lacked the smokey flavor. It did not appear to be smoked and the brisket especially did not have that "fall apart" factor. The meats were nevertheless "alright" in overall flavor, but the texture was lacking. The prices for the food was a bit high as well, and while we did not mind paying a higher price, the food quality did not meet those standards.
2021-08-28,5,Their BBQ is my favorite. This is the spot I bring all my friends when they ask me to recommend a place for a group gathering. Brisket, fire. Ribs, fire. Pulled pork? Fire. Go. You will not be disappointed.
2021-08-15,5,Got really excited when I learned of this local BBQ spot near me. It might be my new go-to favorite spot in Hoboken. The great live music, the outstanding food, and the skyline views along the water on the summer night made for a solid night out. Was it the absolute best BBQ I've ever had? No, I can't say it was. But it was good and the whole experience was worth the money overall. The server, Melissa, was an absolute gem. Good vibes all around. We're definitely excited to bring company here when they visit.
2021-08-04,3,Came here with a party of three on a Thursday night and they had trivia inside but we wanted to sit outside by the water. Maybe it was because we were the last table but our service was horrible. Our server came by probably once every 30 minutes and was impossible to wave down. We ordered the pitmaster's pick which was more than enough food for three people plus leftovers. The ribs and brisket were decently tender but not incredibly flavorful. The sausage was ok, nothing special and the chicken was incredibly dry. The corn pudding was by far the standout and best of the sides with the brisket chili also being good but nothing super special. I would pass on the mac 'n cheese and potato salad - you can find better at the grocery store. Overall, the location is nice and would probably be fun to come for trivia but don't expect much from the food or service.
2021-07-27,1,We got unnecessarily excited upon finding this place. We are from Austin and miss real true southern flavors- we saw Austin BBQ, read the pit masters credentials, and that's where we should've known... it was too good to be true. The decor is very Texas... But, the meat is not. It does not appear to be smoked and if it is... it's not properly done. Meat is overcooked, chewy, and somehow flavorless - It is not fall apart or melt in the mouth. You cannot smell the pit at all, which makes us wonder - is there one? The prices are high (and not worth it), the food is not hot... it's barely room temperature. We got the "18 hour smoked" brisket - overcooked, no flavor, lots of fat, and chewy... The "local Texas" sausage was WAY overcooked - maybe they cook that for 18 hours? The collard greens are not anything more than chopped up greens in some oil and cooked.Pickles are store bought, jalapenÌƒos are pickled, pricey, and not spicy. Corned pudding & Slaw were the most decent sides. Sadly, we learned the answer to "why would a good BBQ place be in Hoboken?" (Spoiler, if there is, this is not it). And that credentials on paper mean nothing if it can't be executed in real life. The search for BBQ on the east coast continues.Can't recommend this place to anyone.
2021-07-21,5,My friends and I made a reservation for 20 with Natalie. She was very sweet and helpful. The night was a blast. We all loved the drinks and food. Must go for BBQ!
2021-07-04,4,Very Busy place, but the food is Delicious! We ordered the BBQ wings, HOQ salad & 1/2 chicken with Mac & cheese & sweet potato fries. It took a while to get our food. Approximately 30-40 minutes after ordering. My husband received his food  first.  However, the rest of my party received our food 10 minutes later. The service was pretty slow but our waitress was very nice.
2021-06-26,5,Great atmosphere to sit outside on the weekend. Being from Texas I was so happy to find a good BBQ place near me. Great selection of food and the drinks are on point. Ask for Jon or Vanessa because they are the top notch servers
2021-06-24,5,I've been to House of Que 5 times and I've had a wonderful experience every single time. I am not even a huge meat/BBQ eater but the food here is so good and so is the 512 sauce which I would eat just by itself if possible. The sides are all delicious but the corn pudding is above and beyond. I dream about it, I think about it all the time, I wish I was eating it right now. I don't even have photos of the food because I eat it all so quickly my brain doesn't have time to process the idea of taking a photo. I've also had a GREAT time at Dueling Pianos (I'm the nerd asking for them to play Hamilton.) I highly recommend stopping by!
2021-06-10,1,If you're looking for good BBQ please turn away! I ordered the ribs which were over cooked and no flavor! The Mac and cheese was served cold! My friend got a burger medium and it was charred and dry! Which was $18 dollars. The 48 hour wings had no flavor whatsoever so I highly doubt they were smoked for 48 hours!
2021-05-26,1,Ordered for the first time yesterday. The presentation was on point! The food looked amazing. However, when I took a bite it was disgusting. They don't season the food at all. No dry rub, just charred meat. The Mac and cheese was great! The Texas beans were God awful and had chunks in them, never seen baked beans like that.
2021-05-22,3,This a great place if you like your beer warm and your BBQ cold. The place says something about Austin in their name. If I was Austin I'd get an injunction. What did Austin do to you that you would sully their name so badly. Has anyone at House of Que been to Austin? I'm not sure how the kitchen fell apart. The pork belly appetizer was great. Queso perfect. Service great. But when it came to the main event, BBQ,  it was like the whole kitchen went out for a smoke. The brisket sandwich was so cold that I asked the server it it was supposed to be cold because it seemed intentional it was so cold.  I mean what do I know, that could be their thing, right?  She said no and immediately tried to correct the issue. A few minutes later, a new sandwich comes out with out the chill on it but still cold. Maybe that's how you're supposed to order it...I'll have the brisket sandwich without the chill. Now I'm having trust issues at this place. I'm guessing, no thermometers? Having issues working an open flame? IDK. What I do know is that hot food should be served hot and cold food should be cold. Simple. When it comes out somewhere in between I feel like someone is daring me to eat it. Like, the kitchen is telling me I don't know right from wrong, dangerous from safe. With respect to all the other types of cuisines on the face of the earth, BBQ has got to be in the top 5 of easiest things to do, except in Hoboken at the House of Que. I feel bad. People want to come out.  People need to get back to work and start making some money.  And this place had the business but the kitchen was asleep at the wheel. They ended up taking the sandwiches off the bill but 2 appetizers, one side of fries, 2 beers and one Texas mule, 60 bucks. Then I got it! On the way out I look around and my wife and I were the only schmoes who had been eating. So, jokes on me. They don't really want to sell food. Their not kidding anybody except people who are not from Hoboken. It's alright. They got me once, you know what I mean. And if anyone in the kitchen gets a whiff of this just know it is super disrespectful to your coworkers to put their livelihood at risk because you don't feel like doing your job properly. Yous should be changing tires on the Parkway.
2021-05-02,2,This place is extremely over priced for just ok food that usually arrives cold. It was pretty decent when it opened, but COVID has not been kind to it. The meat was tough and under flavored. The service was slow. Bright side, the sides are still pretty good.
2021-05-01,2,Well I can say probably won't return here, VERY over priced. Before we even get to price our party was already turned off as we approached the podium to be seated we were not greeted warmly, as we felt like what do you want, later I was told the guy was a manager named Zeus that was covering the podium 5/1 late afternoon...as I was not in a mood to make this a race thing I proceeded and decided to see how this played out. One thing these establiments need to realize is you never know WHO is walking thru your doors...well today it was a YELPER & a Google Review Guru with over 2.5 MILLION views of my pic's etc. So after the rude approach upon seating us, we were seated and not really feeling the seating we asked if we could change the young man said oh you have to ask the guy at the podium..after how we felt.. I refused and was annoyed as we asked you and you work there and I need you to go inquire for me as a customer. We moved. Vanessa came and introduced herself she was nice and professional- Service was ok. Food was Super overpriced and we ordered these "48 hour wings" which were OK, tasted like the same wings I make in my air fryer and 6 wings for 14.00? Air fryer wings?? The Cowgirl drink was nice. We ordered burgers and fries. Burger was good and flavorful. Our bill was 140.00.3 drinks, 3 meals, & 6 wings & order or fries. The liquor store and Five Guys may have been a cheaper option LOL  #YOLOI will need a redo of my B day Kick Off...smh
2021-04-17,4,This is a half a pound of brisket ($16). It's three pieces. Sides were one cup each ($6 each). You should go with the single meat plate and two sides for ($23) it's the same amount of food.
2021-04-16,1,Awful service and do not follow COVID restrictions. Do not recommend at all would leave zero stars if possible
2021-03-18,3,Climatic view, lackluster que.I'm gonna keep it straight up, I was really disappointed with the food. From what I got, this is an excellent spot to listen to some country, have some drinks and look at the skyline. And I would definitely come back for just that. But to spend a good bit of money on the barbecue again, I don't think so.We started off with pork belly and 48 hour smoked wings. The pork belly was pretty good and left me expecting a bar to be hit by the other food. More like 48 minute smoked wings...the wings barely had a smokey flavor and I felt they just dumped sweet baby Ray bbq sauce on top of it. The texture was no good either. For entree we had brisket, which was very very dry. The pulled pork really didn't have much of a taste either. To sum it up... the bbq we ordered felt like it came from a restaurant that doesn't specialize in bbq! This was a first to me when the bbq at a bbq spot was not more than good. The Mac and cheese too...smh.
2021-03-06,1,Great views but that's about it. Food is mediocre and Covid guidelines are laughable. Singing, pianos and dancing during a pandemic. Fully packed indoors and outdoors.
2021-02-28,5,This place has great live music and an amazing staff. I never write reviews but the staff was so good that I had to. They went out of their way to make us feel comfortable and asked if we wanted them to tell creepy, unwanted guys lingering at our table to take a hike. Fries were great and they had hand sanitizers on every table. We will be back!!
2021-02-23,5,Love this place. The atmosphere is fun. The hostesses and the girls who took care of us were great. Food is delicious. If you've lived in the south and have been craving biscuits and gravy, this place does a great job of it as part of their weekend brunch. Check them out, you won't be disappointed.
2021-02-21,4,Made reservations for a Saturday night, to come to this restaurant with my girlfriend.  We were in the mood for some BBQ food, and this place had the best reviews in our area. I had been here once before years ago, but this was my girlfriends first time. We got lucky and got parking right outside this place. Once we were seated, we started with some drinks and ordered the Chipotle BBQ Wings. I had an ipa beer to start and my girlfriend got a mixed drink. The wings were excellent. We loved them so much. The meat was cooked perfectly, nice sized wings, and the chipotle BBQ flavor on them was so good. After a second round of drinks, we then put in our order for our main meal. We ordered a BBQ combo platter of different meats and sides. We went with the brisket, pulled pork, bbq beans, slaw, and mac n cheese.  My favorites from this was the brisket and the bbq beans. The brisket was amazing.  So good.  The pulled pork was pretty decent as well.  We enjoyed all of our sides. Everything was really good. We had such a great time here. We would definitely come back for some more bbq options.
2021-02-18,5,Wings and nachos are top notch stuff. Great specials for large parties too and Trivia on Tuesdays!
2021-02-16,5,I came here with 5 of my closest friends for my birthday this past weekend and it was such an amazing time. My boyfriend and I chose this place to celebrate because we've came here before and were accommodated so nicely by the most generous staff, note: we traveled in from Staten Island to see Dualing Pianos. The piano show was so much fun! The food was outstanding, we loved the wings. They offer a beer tower which we refilled a few times and it worked nicely for a table of a bigger party. I have to say, Natalie (the woman who I was in contact with for about a month re: the reservation) was so kind and knowledgeable via email and each email I sent received a quick response. Our waitress Mel was very patient with us and a lot of fun, the manager Chris came up to our table to thank us for coming. All in all - excellent experience, yet again.
2021-02-14,1,Very disappointed in the service my group received. Considering the amount of money our large group spent, you'd think we would have been treated better. We made reservations in advance to make sure the night of would be enjoyable and stress free as we were there celebrating a birthday. We requested far in advance that our tables be placed next to each other and we were told by the women in charge of reservations that we were all set and that it wasn't a problem. Of course when we arrive we find our tables were not placed next to each other as promised. When asked to switch tables we were told we weren't placed next to each other on purpose because they didn't want to have to yell at us to sit down the whole night....? Staff was very rude in this regard. Male host got aggressive and threatened to kick each person out if they were to stand up out of there seat... all because we asked to switch tables. We should have never been told in the first place that our tables would be next to each other if they weren't!!! Also it was never advertised that it was "UFC night" and that the TVs would be blasting. We couldn't hear the dueling pianos AT ALL from where our tables were placed. When asked if the TV volume could be lowered we were told "no it's ufc night" again, we were never told this. I was in contact, texting and emailing, the women in charge of reservations ALL WEEK to make sure we were set to have a fun night which we were extremely excited for.  Imagine our disappointment when everything we were promised by this women was not delivered whatsoever. I made it very clear we wanted to be next to each other and we were there for the dueling pianos. We should have been told from the start that the area we were being placed in was for "ufc night" and that we wouldn't be able to hear the pianos. We were given the run around by this women and were treated extremely poorly by the male host/manager the night of. Again you'd think they'd be nicer and more accommodating considering we were a large group giving them A LOT of business.
2021-02-05,4,This is definitely a spot for recent grads to hang out and drink. This isn't a family type restaurant. Food was ok, definitely a bit overpriced but it's in a prime location in Hoboken. Drinks are decent. Music was great ! I would come here if you're into a casual sports bar type vibe ! Restaurant is taking protocols for covid which is comforting.Overall, pretty decent spot.
2021-01-30,1,Avoid this place at all cost. This was the worst place I have ever been to. Location is the only thing going for this place. The service was the worst I have ever experienced. Do not see Vanessa. The food took long and was not good I ended up just throwing it away. Drinks were horrible server kept talking to my guest and not me even though I was paying and made the reservations and all. I was excited to get bbq after moving here a month ago from down south. But this was a huge disappointment. I should have paid on my credit card so I could have disputed the charges. Do yourself a favor do not go there.
2021-01-24,5,We had my daughter's 5th bday "party" (my family + my sister's) here and it was the perfect place! Natalie who is in charge of their events replied back to my reservation request immediately and made sure our request for 2 tables was met. They allowed us to have a banner and balloons and made us feel welcome the whole time. Special shout-out to our rockstar server Vanessa, who made sure everything went well, and her upbeat attitude livened up the "party". The food was great as always. Thanks to the entire crew at House of Que Hoboken!
2021-01-23,1,Probably the worst host I've seen to set people in an empty restaurant next to the door when it's close to 30 degrees outside. Went to celebrate a birthday on a Friday night instead got sat close by the door. When asked to sit in a both the guy ran up to the hostess to seat in a high top table. When neither of us wanted to sit there. When asked if we can sit in a booth was told they were all reserved by people with a reservation. I myself had a reservation but was not able to sit there. Thanks to that terrible/worst host that sat us. We bothered not to celebrate there. Other than that the food and waitresses that served on us were amazing. If only that guy wasn't there to ruin our celebration night.
2021-01-21,5,Unfortunately I did not get to take photos because I was too busy eating so fast! I had a very smooth experience here. My party was seated quickly on a weekday at 6pm since it was empty there. They seat people at every other booth to make distance, which was great. The staff was so friendly! The manager (I think) went and helped out at our table and was made jokes that kept us entertained and our waitress was really sweet. She suggested a drink that I really liked.For my meal, I had the 'Que Burger with curly fries. Very juicy and flavored burger. I hadn't had curly fries in a long time so I was excited. For drinks I got the Drunken Cowboy and the peach mule. Both fruity and the mule tasted herbal-y which I liked a lot. Def going back! Also so convenient since it's a 5 min walk from the Hoboken lightrail station.
2021-01-16,4,I attempt to sample BBQ from any smokehouse or pit I can. I'm big into the food and culture of BBQ, often spending hours smoking meats at home. Needless to say, it's a major hobby of mine. House of Que was a place I stumbled upon accidentally. It has ample seating, a great beer selection, and friendly staff. Their house BBQ sauce is quite good. Us, loving BBQ, did the smoked wings as an appetizer and the Pitmaster's Pick. The wings were excellent. The sampler was also quite good. The sausage was excellent, as were the ribs. The brisket was a bit dry, in my opinion. As for sides, we did the beans, Mac and cheese, and chili. All were excellent, but the chili was our favorite of the group. Overall, I plan to visit again and would recommend it. Authentic BBQ flavor in Jersey.
2021-01-09,5,If I could give more than 5 stars I would. I can't begin to tell you how fantastic this place was between the food, drinks, and the superior customer service. Our waitress Vanessa was awesome! She made sure we were very well taken care of as well as the manager Chris. He and Vanessa made me and my girlfriend feel like family even though it is our first time here. We most certainly will be coming back to enjoy another great experience at the House of Que. To Vanessa and Chris, keep up the fantastic work! This can't be topped by anyone else!
2020-12-30,2,The food is okay. Brisket was super dry. Sausage is disgusting. Mac & Cheese were basically buttered noddles, no cheese or flavor. Potato Salad was super dry. The only good thing was the egg rolls appetizer. Drinks had absolutely no alcohol in them. Disappointed.
2020-12-29,1,Absolutely awful food and the place is extremely dirty. Steer clear of this place 100%
2020-12-21,5,First time my girlfriend went out for a while and decided to watch some football. So many screens to watch for which was super clutch. The food was sooo good i definitely recommend their nachos and wings. A lot of beer options and the staff is so friendly
