2021-11-06,5,Il Tavalo...or the Table...is an absolute gem of restaurant specializing in outstanding Italian cuisine.  Located on 7th and Clinton Street in Hoboken, it offers both inside and outside dining year round. Our party of four was welcomed at the door and sat in a beautifully curtained off area..in the main dining room.  The room is anchored by a magnificent table..set in the middle of the room...lite by a gorgeous contemporary chandelier.   A really excellent arrangement for a birthday dinner or family gathering.Our gracious server took our drink order and our delightful evening began. For starters my table ordered succulent mussels in a white wine sauce.  Perfectly prepared meatballs.Delicious fried calamari and an outstanding stuffed peppers dish..prepared with cheese..that everyone who loves peppers should try.For the main course the shrimp and chicken scampi over risotto was delectable.  A special for the evening was the shrimp fra diavolo entree over Cappelli. The dish is prepared with just the right spiciness that make it simply perfect. The short rib ragu over pasta must truly be ordered, at least once, that's how delicious this dish was. The award winner of the evening, and to be the lucky person who ordered it, is the pork chop with peppers. It is the largest, juiciest, perfectly prepared and presented pork chop you will ever have in your life. (I'm not kidding)There's a excellent array of desserts to choose from.  The really outstanding dessert for us was the pumpkin cheesecake.   Perfection!The restaurant offers a full bar, excellent wine selections and an assortment of special cocktails to fit any occasion. The restaurant is beautifully designed and decorated.Robert, who I believe is the manager,Is a truly gracious host.  He stopped by a number of times throughout dining evening to say hello and then to check on how are evening was coming along. A great night out!Bill Hayes,November, 2021
2021-10-30,3,I was Introduced to IL Tavolo by My Good Friend Giseli.  She Had Been There for Dinner Several Times, and She Highly Recommended the Place and it Had The BIG FOUR -- Great FOOD, SERVICE, AMBIANCE & DRINKS!  In Researching The Restaurant I saw that they Had a Brunch.  Her & I went there Several Months Ago.  At that Time We Said We Have to Come Here With Our Group Of Friends  That We Basically Have Not Seen ALL TOGETHER  Since Before the Pandemic As The Case May Be..... So We Planned to Do This Gathering on Sunday, October 24, 2021 at 1PM.  There Were 9 Of Us, And ADMITTEDLY We Are a VERY LOUD Group When ALL 9 of Us are in the SAME ROOM..  5 of Us Came From NY, While the Other Four, Including the Main Hostess  are From NJ. By the Time we ALL Got together at the Restaurant, it was 1:30.  The Jersey Crew got there first, and Actually Warned the Staff that We Would Be LOUD & BOISTEROUS!  We sat in the Back Room at a Long Middle Table, And the Restaurant Lived Up To it's Forte Of Service, Food, & Service--Our Waiter (MATT) Was FANTASTIC, So Much So we Gave Him Extra Tip on Top of the gratuity that was automatically Added.  OUR GROUP, As Promised WAS VERY LOUD & BOISTEROUS & HAPPY, So Much so, that Several Parties that came To The Back Room were Reseated in the Front Room.  We WERE NOT DRUNK, Or RUDE, JUST FUNNY, BOISTEROUS & LOUD!! In Our Time There(2-1/2-3 Hours) we Spent a TOTAL of NEARLY $900.  ALL Was OK, Until we Were Told That We NEEDED to Use Our INSIDE Voices, in NOT Such a Nice Way by the Assistant Manager.  Hearing that Kinda Deflated Us, and there was No More Fun To Be Had, Had it NOT Been for that RUDE COMMENT, We Would Have Probably Stayed Longer and Had a Few More Cocktails....This Place is Great For the Big Four, But If You Intend on HAVING A LARGE HAPPY PARTY & GATHERING, This is NOT The Place For IT!!
2021-10-24,3,Been to this place many times before and brought many friends there .. the food is simply excellent and the waiters are amazing . However today's experience wasn't exactly the best .. it started great but than it was interrupted by a sour person (Robert / the manager ) . I was there with a group of 9 people who came from far away just to have the experience, we are a very LOUD and fun group , we laugh a lot and joke a lot . Some people decided they needed to seat in the front room because we were actually a little loud . But that's ok , is not if they were loosing the costumer , they were just seated at a different side of the restaurant because we were obviously to loud for them . And that is ok because everyone in our group was just looking for a great time . Well 3 hours and $900 later we were told we needed to use our inner voice because we were loud . Well .. no one was drunk or causing any problems so to be honest I didn't understand the attitude. I would like to know who spends $900 in 3 hours . So considering the fact I brought all these people there today and others before , I must say I was disappointed with the non sense . Next time we will have to reassess our options as where we want to spend so much money and such little time . If you want great did you can go there .. but if you want a great time than consider going else where .
2021-10-23,2,I ordered the Carbonara through Uber eats and what was received is not traditional Carbonara. It was more like fettuccine alfredo which was very disappointing considering the dish cost $25. The description didn't say "creamy" sauce on the menu, it said a "dreamy Parmesan sauce" which is completely different if you know what Carbonara sauce tastes like. Real Italians do not add cream to Carbonara...Also, this dish requires the egg to be part of the sauce which it was not. If you like this pasta dish the traditional way, I would recommend to look elsewhere or to make it yourself.
2021-10-03,4,Ordered the carbonara for delivery. It was a sizeable portion and came slathered in a rich, creamy sauce. The linguini was cooked to just the right level, and the pancetta and peas were tasty and colorful. The fried egg on top added a nice touch. Perhaps the sauce could be a little bit lighter.
2021-09-21,4,Haven't been to this location since Clinton social was around. Decided I wanted a quaint Italian dinner and stopped in last minute for a solo dinner.  It was Friday night and the restaurant was not overly crowded. I sat outside on the side of restaurant and the set up was very cute with lights around. Let me start with the staff. The staff was extremely friendly and attentive. There were several different servers that came by to ensure my water was filled, my wine was full, and my food was to my liking. To eat I started off with Bruschetta Board. I got the Sausage, Tomato, and Oven Roasted Tomato with ricotta. All were very good. They were on toast and was the perfect small starter. For entree, the server recommended the Breaded Chicken Cutlets which I loved. The dish was a good portion size. It had burrata and balsamic as well as arugula and Roasted peppers. I truly enjoyed it. It was the perfect combination of flavors. I definitely will return and try some other appetizers and entrees. The menu looked pretty good and I heard others raving about their food.
2021-09-20,5,A Hoboken hidden Gem for sure! We went for dinner last night - food was incredible. Had the stuffed rigatoni. Really amazing- the staff was extremely nice. Shout out to Dante who really had an amazing personality and made us laugh. The owner Frank came over to ask how everything was and if they can improve anything which we really enjoyed. He is doing a great job and we are so happy this place is right around the block from our house. Stop thinking about it just go!!! We will definitely be back soon. Bravo  great local place!
2021-09-16,5,Great Food , Great Service , lovely Ambience !We made a reservation for 8 pm and we're seated right away on arrival .We got the bruschetta Board : Sausage , Artichoke Hearts , oven roasted tomato and Prosciutto di ParmaAlong with a bottle of Chianti.Artichoke and Sausage were my fav !! We experimented with the Fried Burratta and so glad we did ! Absolutely delicious I got the shrimp Tavolo for my main .It is served on a bed of pesto risotto . It was light and yummy .I just wish we had bread to soak up the wine sauce .My husband got the Aglio o olio with breaded chicken. The chicken was delicious. The almond cake for dessert was great too . A little too sweet for my liking but my partner enjoyed it a lot .The outdoor seating was really nice and  the weather was great ! Service - Quick ! Quantity is fairly good especially for the appetizers.Would definitely come back to try the other things on their menu :)
2021-09-12,5,Had a very nice meal here. Food portions were generous and staff was in general very friendly. Will return.
2021-09-05,4,For the most part, the food is pretty good. I definitely don't recommend the linguini with clams. The chopped clams on top were overcooked and the dish was pretty tasteless. I exchanged it (which I NEVER do!) for the Short Rib Ragu with Orecchiette which was delicious.
2021-08-28,5,This restaurant is fantastic. We thoroughly enjoyed every portion of the meal the ambiance and service were top notch!  We will definitely revisit in the near future.
2021-08-28,5,We came here a few months ago for brunch and wow, we are not from this area, but already thinking about when we can come back. The brunch here was awesome, so flavorful, and just a must go, if you are in the mood for some gooood, decadent brunch food. We ordered the bruschetta board because we saw a lot of reviewers order this. We got the tomato bruschetta and the Prosciutto Di Parma bruschetta. The tomato bruschetta gave a powerful garlic but tomato-y punch and was refreshing. The bruschetta bread was crunchy, but soaked in all the juices well, which made it SOO ADDICTIVELY GOOD. We also got the prosciutto, which was so creamy, paired with the ricotta cheese. We wanted to order more! For entrees, we ordered the potato hash with sausage gravy and topped with a sunny side up egg. This dish is so decadent, and creamy, and just full of goodness. It was not too creamy, where it was overpowering, but it was creamy enough to coat the potatoes so well. The potatoes in this dish were really crispy and thin, but also really flavorful because the creamy gravy coated it really well.  I am still thinking about how decadent this dish was. The portion size was not crazy big, so it can def. fill up 1 person.We also ordered the Frittata. The egg was fluffy and creamy in the middle, which was flavorful and packed with ingredients. Def. coming back here again!!
2021-08-28,5,A wonderful experience! The food was delicious and the service was some of the best I've had post-Covid. You can't go wrong with anything on the menu, but the stuffed rigatoni (with some extra sauce) was my favorite. We didn't feel rushed and the manager came over to check in as well as clean up plates, which I appreciated. Will definitely be my go-to place the next time I'm in Hoboken.
2021-08-17,5,We had an absolutely AMAZING experience here. The food was just wonderful and the staff was so great. Definitely on the top of the list for restaurants in Hoboken.
2021-08-16,5,Food:  Well above average and everything was delicious.    We had the La Nonna and carbonara and the burrata appetizers. Plates cleaned. Service:  Superb. I am not a stickler with service, but it was nice not having to ask for our waters being refilled.  Attentive throughout the meal. They also were wonderful to the kids.  They even brought them toys to take home at the end of the meal.  If you're looking for a date spot or somewhere to take the family for Italian home cooking flavor this is the spot.
2021-08-13,5,Really really good. Def one if not the best for Italian in hobo. Meals were good portions, delicious and service was great. Pasta was cooked perfectly and nice heavy sauce creamy sauce. Highly recommend!
2021-08-07,5,Shrimp and Chicken Scampi is to die for; heaven on a plate. The service is top notch. Drinks are great!  I truly can't say enough about this "Diamond" in Hoboken. Try it now before it becomes hard to get a table.
2021-08-05,5,Found this place by accident when attending a local festival. Festival was too crowded so we walked down the block and stopped in to grab dinner. I was blown away. I had with me another adult and two small children (1 & 3). We devoured everything, kid's orders also! We started with the stuffed long peppers--yummy. For the kids we ordered just basic buttered noodles and chicken tenders but they were done super well, not frozen like other places. The chicken was actual filets that were pounded out and cut in strips with a light batter (served with delicious red sauce for dipping) and I don't know what they did with the buttered noodles but they were really tasty! For the adult mains, we had the short ribs (I am still thinking about how great they were) and the stuffed rigatoni with vodka sauce. There wasn't a drop of food left. All wonderful!
2021-07-31,5,We came here for dinner with friends. It has a very friendly and warm feel to it. We really enjoyed our food, ordered burrata bread for appetisers, orecchiette pasta and summer sauce pasta for dinner. Everything was good and nothing to complain about. Service was great as well. Its a little on the pricier side. We were a party of 4 and got a bill of around $220 including drinks and tip. Will come back again and will recommend to friends too.
2021-07-31,5,Absolutely delicious hand made pasta and Italian meals! My boyfriend has to abide by a low carb diet, and this is the perfect spot, as they have many entrees that are healthful but also filling. He got the breaded chicken cutlets and i got the sausage and broccoli rabe pasta. I will definitely be back again, this time with my whole family as it seems like a great family spot!
2021-07-26,5,Excellent Italian. Not cookie cutter and each dish was original and fresh. The wait staff was on top of it and they really hustled!This will be a regular visit for me!
2021-07-26,4,Really enjoyed our first dining experience here. Really good service and food. The Manager here really makes it 1st rate. I had the Carbonara and it was great. We're coming back.
2021-07-25,5,Had an amazing family brunch there- everyone loved EVERYTHING!! The  egg sausage hash , the lemon ricotta  pancakes , the frittata, the chicken with gravy - all outstanding- we cannot WAIT to go back - wonderful attentive friendly staff makes the experience even better !
2021-07-24,3,I was looking forward to eating here and was disappointed. The food was ok but the service was bad. We were a party of 2 seated on a 4 person table. When our burrata came out the server thumped it on the table while talking to another employee - the burrata was literally on the edge of the table without the slightest effort to appropriately place it in front of patrons actually eating it! The burrata was good however I digress. My wife wanted bread for the table and when she asked our server, the server walked away and imitated my wife asking for the bread! I literally saw her doing it given she walked away and looked back while doing so! I don't know if this was a one off however I will not eat here again. The staff here need some training.
2021-06-29,5,The food and service were incredible. Went for the first time the other day and we ordered short rib ragu and the NY strip special -  amazing!! We'll definitely be going back!
2021-06-28,4,Their food is so good, very obsessed with their carbonara w/ fried egg on top. However noticed that depending what site look to order takeout from, prices vary (is that normal..?) also, $9 for this little portion of spinach was a bit disappointing. Seem to get a better bang for your buck in person.
2021-06-18,5,Delicious food and great service! Would definitely recommend if you live in or are visiting Hoboken!
2021-06-11,5,So my wife and I went there for our anniversary and they could not have been more kind and generous. The food was absolutely delicious. We started with the watermelon salad, I got the braised short rib - AMAZING! My wife got the eggplant - also delicious! The cocktails were balanced and smooth! Perfect place for a great dinner. We loved it so much we went the following week for brunch! Again - just great, got to sample their sangria (Thank you Frank) - So refreshing and fun! Looking forward to going again soon!
2021-06-07,5,I only write if something is really out of this world; and this place was out of this universe!! If the Italian ancestors could eat, they would come here. After looking at the Yelp reviews about this place, I had to check it out for myself. Myself, my boyfriend and his friend all got carbonara (two dishes actually), shrimp tavolo, watermelon salad and clams oreganato. First thing I want to mention is that we ordered this as take out. The presentation was as if we were sitting in Hoboken at the table. The scent of true Italian seasonings and oils hit your nostrils and immediately felt the serotonin exploding. The portions were large and truly to the Italian form of having more than enough to have left overs. I can't speak for the boys who had carbonara, but I can tell you that it looked fresh, creamy and you could see that the vegetables were full in color. I had the shrimp tavolo; the pesto risotto was unbelievable. The creamy basil mixed with the soft small noodles and off the boat shrimp :insert Italian kiss here: . The tomatoes were stewed and seasoned to perfection. 10/10!!The watermelon salad is a perfect summer salad. The watermelon was so juicy and crisp as well as the thinly sliced red onions and a touch of mint. The balsamic dressing was the perfect amount and brought the salad together. The clams of oreganato was pretty much standard issue clams; fresh, but nothing super out of this world. I wish I had pictures to show the food, but we were taking out the food as soon as the aroma left the opened bag. We are on the roof and it was a great night. If you're still reading, dude, eat from here, you won't regret jt. CarbonaraWatermelon Salad
2021-05-16,2,Tried this place out for brunch for the first time today but Unfortunately the experience missed the mark. While the service was very friendly, it felt slow and the items came out from the kitchen incorrectly.  We ordered their new seasonal watermelon salad to share to start. Once we started eating it, we all realized they forgot the ricotta cheese (one of main ingredients of dish besides the watermelon). Rather than make us a new one, they just gave us a side of cheese. I wanted to try the lemon ricotta pancakes for my main but they didn't have them today. Thought that was odd since nothing really that special in the ingredients. My friend asked to add avocado to her fried egg sandwich but they had none either.  I went with the stuffed French toast since I couldn't get the pancakes. Was okay but got pretty soupy. I wish they'd put the dollop of butter on the side. They also messed up and put blueberries instead of chocolate chips on it. I like otto strada's  French toast better. The restaurant took off one of the items from the bill which was kind. Just had higher expectations and was let down.
2021-05-10,1,We decided to go to Tavolo for our first night in over a year. The menu looked amazing so we were really excited. Unfortunately the food was unremarkable and bland. For apps we got calamari and grilled octopus - the calamari lacked seasoning and grilled octopus was well cooked but nothing special. I got a watermelon spritz and my husband had a beer. As for entrees, the short ribs and polenta lacked texture, looked completely unappetizing, and the stuffed ziti was bland. A top both entrees was cold burrata that did nothing to help either dish, and both entrees also had a few leaves of mixed greens on top - which had do business being on the plate. We finished our drinks with our apps and were looking forward to getting wine with our food. However once our entrees came, our server never came by to check on us. It was only once we were done that she stopped by to check in. At that point, there was no need for another drink. We skipped dessert and left feeling completely underwhelmed and disappointed in our date night.
2021-05-10,4,Have been many times and each time I'm delighted by something new! I've now been for brunch and dinner and I honestly can't pick which I liked more. The Eggplant Casserole and Boneless Short Ribs are to die for! So many amazing layers of goodness! On the brunch menu, go with the short rib grilled cheese...trust me!
2021-05-10,5,Quaint restaurant that had everything I wanted for mother's day. Great food, service and music. Wish I remembered my servers name but he was knowledgeable, I asked him for a white not dry wine and the wine he recommended was great. I tasted alittle bit of everyone's food at the table amazing. The brushcetta was small but so amazing best brushcetta I ever tasted. Could not find anything wrong with this place. I would go back again. Think it was the owner that came over and asked us where we are from and if everything was too our liking. I was there with my mom and aunts along with my cousins for mother's day. My family is hard to please but everyone thoroughly enjoyed. Check this place out I will be back again to enjoy. Thanks for the good food and service. You guys deserve all the stars for this gem.
2021-05-02,3,Entrees were mediocre not nearly as good as I've had in other Hoboken restaurants. But the staff was super nice and the meals came out super fast. The bruschetta boards are to DIE FOR! We got the tomato bruschetta and the broccoli rabe boards and they were so so so good. They charged $12 for a measly little chicken cutlet to be put on top of the stuffed rigatoni entree. CRAZY!! There was a man that came around multiple times checking in on the customers including us and he was super sweet and attentive, I'm pretty sure he was the owner.
2021-04-30,5,Had the burrata, chicken cutlet and calamari.. everything was excellent.. our table was unstable and without us even asking, the owner had the waiter correct it... very friendly staff, definitely will return to try more!!
2021-04-28,5,We celebrated my Son's Birthday at the restaurant and had a wonderful experience! The service was excellent. We enjoyed our dinner, selection of wines and desserts! IL Tavolo di' Palmisano is on our list as a definite go-to return restaurant. My Family highly recommends it.
2021-04-27,4,Great Italian spot with huge portions!! I was there with my aunt and boyfriend and we had a great time. They were running a special "board and bottle" - we got 4 bruschetta breads and a bottle of wine for $26! Our entrees could feed 2 people each. My boyfriend got the pork chops. My aunt and I got salmon piccata, and the salmon special. Both were delicious. Outdoor seating is adorable with cute lightening. The fresh baked bread in the begin was the show stopper though!!
2021-04-24,4,Had an amazing meal at IL Tavolo. The focaccia was great, the Old Fashion and wine by the glass (Nebiolo, Malbec) were also excellent. We had the garlic shrimp appetizer (amazing sauce), the breaded chicken (amazing) and La Nonna also amazing. The place makes its own pasta and it's fantastic. Owners family owns Biggies. The cheesecake was also great - the chocolate cake was ok. The service was very friendly and attentive. The outside eating was ok but looking forward to eat inside at some post pandemic time.
2021-04-11,5,Their Shrimp Pete's & linguini is amazing. The shrimp are crispy and the source has perfect amount of spice. The staff/owner are friendly and cares a lot about their customers. I placed an pick up order via ChowNow and  didn't notice it wasn't correct until I reached home. I called the restaurant and was pretty upset about the situation. The receptionist connected me with a gentleman (I later discovered he might be the manager/owner). Despite the restaurant doesn't do deliveries, this gentleman brought my food to me on a raining Sunday afternoon. Really appreciated their customer service. Recommend to try their pasta.Shrimp Linguini
2021-03-25,4,Had a nice Sunday evening family dinner here.  Wonderful streatery with igloos.  They offered to zip them up and turn on the heaters but it was warm enough that we didn't need it.  Staff was friendly and attentive.  Nice cocktail list.  Calamari appetizer was a nice portion.  The short rib ragu was delish.  Kids pizza was kind of a thin pizza-dilla.  Great place, looking forward to going back again.
2021-03-20,5,We went to Il Tavolo for dinner last night and it was amazing. The ambiance was very comfortable and the bar area was beautiful. The restaurant was also much larger than expected. The food was very delicious - highly recommend the bruschetta boards and one of my favorite dishes I've had in a while was their stuffed rigatoni topped with burrata. The staff was very friendly and we would definitely recommend and can't wait to go back!
2021-03-18,5,I can see why everyone raves about this. The food was amazing! The meatballs are a must. The service was lovely!! I've barely gone out because of covid this year so if anyone is considering it, this is the go to place for a safe dining experience! Reserve an igloo, the waiter did not even come into the igloo. Instead, they just hand off everything and talk to you from outside. Will undoubtedly come back. My one thing is, I do wish the view in that area was prettier (you're literally next to an Aldi), but the food makes up for it.
2021-03-13,4,Really enjoyed our meal at Il Tavolo! Amber was a fantastic server and very accommodating. The food was delicious, we will be back!
