2020-09-13,3,The food here was very good, but the service was so bad. This was my first time here- I called the day before (Friday 9/11 at 4:56 pm- they can check their phone records) and made a reservation for 3 at 8:00, and we still had to wait 45 min for our table. I later found out that they don't take reservations, however no one ever told me that when I called, and in fact, I was confirmed for a reservation for Saturday 9/12 at 8:00. After waiting for a long time I asked the hostess what was going on, after we were waiting for 45 minutes when we were told our table would be ready in about 5 minutes, and I was told "We aren't in the business of kicking anyone out." It came across as very rude and inconsiderate, especially since we were told we had a reservation. I understand not wanting to tell a table to leave, but for the guests that are coming there for the first time, this was a rude response and made me feel like my business didn't matter. As someone who has worked in the food and beverage industry for many years, there was a much better way to handle this situation. Furthermore, though our waitress was very nice, we were often left at our table without drinks or were searching for her to get the check or other things we needed. Likely won't be going back.
2020-09-12,5,Delicious dinner at Il Tavolo tonight. We were a party of 7, and were able to call Friday for a Saturday night reservation (don't think they take reservations for smaller groups). Servers were attentive; cocktails took awhile to come out, but apps and main courses were well timed. Nothing felt rushed and we really enjoyed our meal.Stuffed long hots (spicy!) and octopus appetizers were great; bruschetta boards were just ok. Based on other reviews, two of us got the boneless short ribs with polenta, and three got the breaded chicken. Both did not disappoint. One of my friends called the breaded chicken with buratta magical!Will definitely eat here again!
2020-09-10,5,This was such an incredible restaurant and experience! Everything was so lovely. The food, the drinks, and the staff are incredible. I will definitely be coming back here! Thank you all so much! I definitely recommend!
2020-09-04,5,Excellent food! Came with a group on a rainy night and the staff was very accommodating. All our food and drinks were excellent. We got a variety of bruschetta boards, breaded chicken cutlet, gnocchi special. The chicken cutlet was the best Italian style chicken I've ever had! Cannot wait to go back!
2020-09-01,1,They prepared my order 30-60 minutes prior to pickup (placed via grub hub for pick-up not delivery), told me they would remake it for my arrival and ended up sending me home with the original food - cold.
2020-09-01,3,Three stars given for the meals served to my party of 5 dining guests. I stuck to the fish and my friends all ordered everything but... The chicken cutlet Burrata was awesome, the short rib special was tender and good flavor. Drinks were also good. I ordered the octopus, which was dry with no flavor, Although served with a delicious bean salad. The calamari also didn't have any flavor. The salmon was dry and tasted a little too much like 'fish'. So overall a good dinning experience with the exception of the fish I sampled. Everyone has been raving about this place so maybe my bar was set higher or everyone just ordered the chicken cutlets :).
2020-08-31,4,Open with a very nice outdoor dining sitch. They don't take resos, but will do day of call ahead. I tried around noon and didn't get an answer, tried again closer to 5:30pm and was able to get my party of 3 on the list for 8pm that night. We wound up waiting a bit for our table, but clearly were prioritized vs. the walk ups. They are serving a full menu. Good variety between first, second and primi. They also have a full bar and fun cocktail list. Unsure if they would still let you do BYO, we ordered off cocktail menu. For apps we had the sausage stuffed long hots- these are spicy! And burrata- pretty standard. For entrees my friend had the short rib and polenta, I got the carbonara risotto and my other friend had the spicy shrimp and linguine. My carbonara risotto was the clear favorite of the night. It was so delicious,  not too heavy, super creamy and flavorful. Only complaint was timing of the meal. We ordered apps, but they came out with entrees. We were also starving so, an app ahead of entrees would've been nice vs. waiting.
2020-08-29,1,Yesterday was our wedding anniversary. I reached out to management about a reservation via Instagram the day before. I have been a huge supporter of this place since day one and wanted to keep giving them business. They were kind enough to make an exception regarding a reservation and promised to hold a table for us. We arrived at our designated time and while my name was written down, there was no table. The hostess said it would be 20 minutes, and although it was slightly irritating we were fine waiting. It then started to rain, and I went inside to see if our 20 minutes was realistic since we were getting soaked. The wait jumped to 40 minutes, so we left. My biggest issue is that if the manager said we don't take reservations but call ahead, I would have, but to leave people high and dry (or wet) on a special occasion is not right. We went to Amanda's on Washington Street where there was live music and great food - it was a wonderful evening regardless.
2020-08-26,1,My wife and I went here the weekend they opened. Unfortunately, they were way understaffed and we waited over an hour (with no food on the table yet) before asking for the check. The owner and manager came over, kindly, to assure us they would make things right and offered us a coupon for our next visit. This evening we were headed out for one of our final nights out in Hoboken before moving and decided to give the place another try - it's been a few months since opening and figured they would have worked out the kinks by now. I can say the food did come out in a timely manner this time, but maybe it shouldn't have. We were underwhelmed with the appetizer options but decided to go with a bruschetta board (one of the three types we ordered was incorrect). They were underwhelming to say the least, and truly lacked any developed flavor (about as basic as they come). My wife got the mushroom risotto and I had the cacio e pepe - it's an Italian restaurant, so we assumed that pasta and risotto would be a walk in the park. We were wrong. The cacio e pepe was a collection of undercooked (and clearly not freshly made) pasta sitting in an unappetizing puddle of pasta water. Not a single grain of salt was added to the dish. The mushroom risotto had the opposite presentation; a bold and rustic looking plate with an overwhelming amount of salt and vegetable stock that hadn't been properly sautéed into the rice. Our cocktails were certainly a saving grace, as the bartender knows how to actually give you what you pay for. Our wait staff was pleasant enough, but sweatpants and a t-shirt raise a red flag when you're being served food for an $80 dinner. The outdoor seating was nice (a necessity during the Covid era) and we had no problem getting a table when we arrived. The dinner as a whole was underwhelming and though many reviews here seem to think you get plenty of flavor for a fair value, I must disagree. The restaurant needs a new chef or would benefit from a MasterClass in seasoning and pasta, which again, amazes me for an Italian place.
2020-08-25,5,Delicious  The food was fresh and tasty, the service was friendly and the atmosphere outside was great. Will definitely come back!
2020-08-25,4,Seems like this restaurant has recently opened but the service and owners make you feel like you're at home! Their outdoor seating has tents, just in case for possible rain. I came for my friend's birthday and she enjoyed her time here because the staff was so friendly and engaging. They always asked us how we were doing and if we needed anything. They have a nice drink menu too. I got the watermelon spritz and it was really nice. For food, I got the grilled portobello mushroom, burrata and shrimp linguini. I loved the appetizers, they tasted so good. The mushroom really stood out and I would definitely come again for the appetizers. The shrimp linguini was good too, but it wasn't too memorable. Overall I'm really happy with my experience and would definitely recommend this place to anybody looking to try a new spot!
2020-08-25,4,Great local Italian restaurant that recently opened. They've done a good job adjusting during COVID. There's tents setup and the tables are seperated a good distance from each other. The staff is super friendly and accomodating. The owner stopped by personally a few times to check in on us. They have a great selection of cocktails. For food, we split the burratta and grilled portobello mushroom for apps. I was a big fan of the mushroom. I ordered the short rib for my entree, which was pretty good. The polenta was a great compliment to the dish.
2020-08-23,5,Wish I could give this restaurant 10 stars. The customer service was above and beyond from the minute I walked up to the restaurant. Being in Hoboken where I bring my pup everywhere, naturally I brought her here. They are SO dog friendly...I had 3 different people (that worked there) walk by asking if they can bring her water. One gentleman (I believe his name was Robert), came out and asked if she can have a biscuit. I have never been to a restaurant that was so great with dogs! It made me immediately fall in love. The waitress was very attentive and knowledgeable. She gave a few recommendations of the menu, which we decided to go with some of the options she mentioned. Starting with the artichoke cakes, they were fantastic. I wasn't sure what to expect since I've never heard of these- but I was so happy to try them. We also had one of the brushettas. Forget the name, but it's a soft cheese with soppressata- amazing! Highly recommended! I had the chicken cutlets..which I normally would never order, but the waitress recommended them and i was so happy to listen to her! They came with roasted red peppers and burrata on top...how can you not love that?! My friend had the shrimp Pete's which was also amazing...a little bit of spice so it was a great kick. Just based on customer service I would come back in a heart beat...add in great food and it's a huge win! So happy this place opened!!
2020-08-23,4,Dinner at Il Tavalo di' Palmisano! Italian food has always been a favorite of mine and this place was fantastic. It is a brand new restaurant without many reviews on yelp so we were a little nervous at first but when the line was out the door, we knew we had picked the right place.Starting with the aperitivo, the grilled octopus was cooked amazing. The chilled beans, arugula, and lemon over the top paired greatly with the flavor of the octopus. For me, I like it to be charred a bit more, but it was still not chewy at all. I would definitely recommend ordering it. Their watermelon insalata was great as well. It was not anything spectacular but was very refreshing for our warm summer evening.The Carbonara Risotto was delicious but compared to the short rib, did not stand a chance. I do love a restaurant who has a whole section of their menu dedicated just to risotto. The short rib was a recommendation from another waiter passing by. He stopped to tell us some of his favorites and we are so thankful he did because we were not planning on ordering it at first. The meat just fell apart and paired so nicely with the creamy polenta underneath. Definitely a must order if you are to visit this restaurant.
2020-08-21,5,Decided to try a new Italian restaurant in Hoboken for dinner and Il Tavolo did not disappoint! Their outdoor seating was very cute and well decorated. Staff was pleasant and attentive.Our party had the stuffed long hot peppers - was good, but very spicy! Eggplant casserole - great take on eggplant parm, marinara was rich in flavor. Boneless short ribs - cooked perfectly! Also had a great selection of cocktails. I had the La Espoloma - was the perfect amount of espolon tequila and grapefruit juice.Looking forward to trying more on their menu. Would highly recommend to anyone who is looking for a new restaurant in the area!
2020-08-14,5,We've been there around 2 weeks ago, but I couldn't let the opportunity to leave a review pass. That's the best food we have eaten in our lives so far haha Even better than a Michelin Star Restaurant in NYC. My husband got the Chicken Marsala and I got the Ribs and Polenta. The polenta was crispy outside and soft inside, just like it should be. The ribs were cooked to perfection. The mascarpone was a delicious add. I tried my husband's sauce and it was delicious. And I'm leaving this review because we're day dreaming of this place, but it's already closed - so, next time. Waiter was also very polite. I hope they can keep the quality of food and attendance.
2020-08-12,4,Very nice outdoor dining space. The staff was extremely friendly and attentive. I can't remember our servers name but she was very sweet. Great guest service. I ordered the artichoke bruschetta which was OK didn't really wow me. My husband had the seafood salad which he enjoyed. Very fresh. Lightly seasoned. Hit the spot. I ordered the short ribs which i NEVER do because   I always regret it. They are typically too fatty or chewy..... but I wanted to try something different and I'm glad I did. They were melt in your mouth delicious!!!! Not over seasoned - so you could taste the quality of the ribs. Of course there was fat - it is ribs however the cut of meat was very good. A Beautiful sauce over the short rib was well balanced. The polenta was buttery! Yum! My husband ordered the salmon he enjoyed it and said it was cooked to perfection. A great summer time dish compared to my short ribs but who cares. I loved them! We will be back!
2020-08-11,5,Service was great! We tried the watermelon salad, burrata, cacio e pepe, and sausage/broccoli rabe pasta. All were delicious and serving sizes were good, we both took home about half our pasta. We also had the ice box cake for dessert which was tasty but nothing special. I would definitely return!
2020-08-08,5,Absolutely love this place. It's very new so not sure the word has got out about this gem. But food is amazing and fairly priced. The outdoor setup is very well done and allows for a ton of seating. Owner came by to ask how we were doing -- just friendly all around. We've been by three times so far post COVID and will keep coming back!
2020-08-07,5,Went tonight with my husband for the first time and it was excellent. We did not have reservations and went at 6pm on a Friday night and nearly every single table was filled and they had a ton of tables, so next time I'll certainly make a reservation. The food, service and atmosphere was all great. We started with cocktails and I got the Mediterranean mule and he got an old fashion (or 3) and they were very tasty. As an app we got the seafood salad and 3 bruschetta's. All were delicious but I particularly loved the bruschettas, and we got the artichoke, roasted tomatoes and roasted red peppers bruschettas. Then for our entrees I got the chicken cutlets and he got sausage and broccoli rabe oriechette. The chicken cutlets were pounded nice and thin and they were very well seasoned, and on top was roasted red peppers and two burrata's with a balsamic reduction drizzled over it. Absolutely delicious. And the pasta was extremely tasty as well. The service was outstanding, the manager Robert was extremely sweet, and I cannot wait to return.
2020-08-03,2,Wow. I'm gonna try to keep this brief. I have zero complaints regarding service, both waitresses we dealt with were attentive, kind, and knowledgeable. The food, however, is the absolute definition of mediocre. I had a bad feeling when it took less than ten minutes for our food to come out, but I figured it was a slower day, despite most tables being full with guests. The red sauce tasted like it was straight from a can, bought next door at the Acme. Like, it was indistinguishable from the same sauce I cook in my own home. I am NOT a good cook. I got the Chicken Travolo, and while the chicken was certainly serviceable, NOTHING about it made me feel like I was eating quality food. Both meals screamed microwave. The portion sizes were incredibly off, I received maybe a 1/3 of my GF's portion, with both of us ordering similar meals. Both of our dishes were between $22-$26, the quality of food we received is not worth half of that. Despite living less than a block away, I will never come back to this place.
2020-07-28,3,Unfortunately we didn't have the same experience others have had here. Maybe it's better in person?We ordered delivery Thursday for the burrata and chicken Parmesan Tavolo. The burrata is $15 so we were expecting a decent size burrata with a decent size arugula salad. The balsamic drizzle was good. The arugula was very scarce. Tomatoes were fine. Burrata was very small and had some pattern in it like it was in plastic. It tasted like plastic to me. I would NEVER order this again. I definitely don't recommend it. Way overpriced. Container arrived very empty.The chicken Parmesan Tavolo was okay. We've had better chicken parm at Augustinos. There was two flattened pieces of chicken that were cooked perfect. Not much cheese at all. The pasta was cooked al dente which is perfect. This is also a small portion size for $24. Not worth it in my opinion. Way overpriced compared to size. Many other choices in Hoboken.We won't be reordering delivery but may give it a try with outdoor dining and different plate choices. We will see.
2020-07-26,5,Ordered delivery for the first time after not feeling up to our usual places. The food was AMAZING. My husband had the pork chop and raved about it from start to finish. And I had the Risotto Carbonara and I can't say enough about it--probably the best risotto I've ever had!!! Delivery was on time and everything was hot and ready to eat. This will definitely be part of our "usual places" from now on!
2020-07-14,5,This place was amazing. Had been recommended to go here by a friend and so happy we did. Everything from the drinks to the food was excellent and the staff was top notch. Such great customer service!
2020-06-27,5,We have been here a few times and absolutely love it. Incredible service, great food and love the ambiance - whether you're inside or outside. It's definitely one of our staples in Hoboken. The cocktails are incredible as is the food, Cacio e Pepe is one of our faves if you're looking for pasta!
2020-06-20,5,Was walking by last night and popped in to see if there was a table available and boy are we glad we did! The food was absolutely delicious- started with stuffed peppers then shared short rib with polenta and the pork chops and peppers. I would order both again! The wait staff was absolutely fantastic and were just as attentive and helpful as expected pre-pandemic. I can't wait to return!
2020-06-04,5,We ordered takeout and it was incredible!  The short ribs were amazing.  Great addition to the neighborhood.
2020-03-19,5,Just got take out from here and it was absolutely delicious. (I would highly recommend the eggplant sandwich.). Will definitely order from here again.
2020-03-14,5,Wife and I were invited by the fam - we shared and split a few dishes - they were all amazing. Started with the Artichokes - better than Mom's but don't tell her -Dinner- pasta, meatballs, veal, shrimp, beef - all cooked perfectly and full of flavor. Desert - home made Cannolis with Espresso and Buca. Chris the waiter - on point.
2020-03-09,5,Just finished dinner at il tavolo. We had some of the best Italian food in Hoboken.. my wife had the tagliate very good and fresh.. with real San Marzano tomatoes.. I had the fresh paccheri pasta some of the best I had outside of Italy.. the service was very good and accommodating..Great job!! We definitely coming Back!!
2020-03-07,5,Ordered the Chuck Roast Au Jus this afternoon and it was incredible. Muscles and calamari to start were delicious and cooked perfectly. Great service super at tentative, will definitely be back.
2020-03-07,5,Great new spot in Hoboken. The bruschetta is very large so when we picked 4 options it was too much for 2 people. The options are standard for an Italian place. I had the veal picatta which was great, but wish there were a few more inventive options on the menu that would drive us to come back.
2020-03-05,4,The carbonara is AMAAAAZING. We started with the four selection bruschetta platter which was very good. Large pieces of bruschetta with a nice variety. Our server was also great - let us take our time, but yet attentive. I got the white cucumber drink which was very refreshing. The only thing I will say is that they need to get a curtain to cover the entrance so the cold air doesn't come in. We were right by the door and we were freezing. All in all I will definitely go back.
2020-03-01,5,Food was Delicious!! Appetizers, main course, drinks and dessert!! Friendly staff, nice atmosphere!! Franky best of luck!! The bone-in short rib over creamy palenta was delicious.
2020-02-29,3,The food was great, even if we are picky. Prices are very reasonable. The biggest complain is service. Understandable that some  servers  were new, but still I expect better knowledge of menu. And  unacceptably that tables around sat dirty for the whole hour, and it was not a busy time. One more thing about, ac blew such a hot air.Hope this place will fix this minor issues, will defiantly come back
2020-02-25,5,Excellent first time experience. Delicious chicken. Milenase.  Arugula salad. Good. Specialty cocktails good. Robert Hoff continuallyWalked around to check in with us. Frankie checked in with us friendly. God Bless. Can't wait to come again.
2020-02-23,5,With so many Italian spots you have to stand out and this one definitely does! The apps were amazing, shrimp petes, long hots & calamari...I'd go back just for that! I was with 8 people, the chicken parm, pork chops, and eggplant & chicken piccata were all getting great reviews. I had the cacio de pepe and was amazing not overly creamy. Espresso martini and mediterranean mule were both awesome. Great atmosphere, great food I will definitely be back! Well done Palmisano's!
2020-02-22,5,Came here for drinks on Thursday with Marlena and had a lovey night, but knew I had to come back for dinner. When we came for dinner Saturday and didn't have a reservation l. we first met with Erica who was lovely and told us roughly an hour. We quickly ran next door and did some shopping and came back and lucked out with spots at the bar. Amber was absolutely lovely with her drink suggestions. Once we had two seats we decided to try the cheese plate which was great ( Brie could be more flavorful). We then had the small portions of the Caesar and carbonara which were bomb.com and the short rib which was fab. Everyone we worked with was amazing and we CANNOT wait to be back.
2020-02-22,5,Loved the lunch here! First weekend open. Just wandered in, walking by. Ordered the porchetta sandwich, with pesto, ham and cheese on toasted baguette. So good! Trying to avoid bread, but it was amazing, especially showing up as a toasted baguette. Robert, the manager, is so sweet, and welcoming! The ambiance is so laid  back. Just locals. Kind of gotten sick of the other Italian places, shuttling you and out, so unfriendly. Here, Michael, the very professional and discerning wine manager, (and bar tender,) talks about his expanding and lovely wine selections. Had two glasses of Carpinetto San Giovese and Cab. . .Felt so relaxed in this setting. Beautiful! Will be back here...often. Great, great  addition to Hoboken Italian fare! Shhh...Don't tell anyone!!!
2020-02-17,5,Second night open and was a good experience. Service was very honest as kitchen was backed up but even with that the wait was not bad.  Food was excellent.  Service excellent and when they get things together only expect great things.
2020-02-17,5,This restaurant screams FAMILY ! As soon as we arrived we were instantly greeted by owner Frank Palmisano and manager Robert Hoff and i knew immediately we became part of the family.  The bustling energy of the restaurant and the delicious comfort food I ate will surely bring me back to il tavolo very soon. Take my advice: go soon, and  meet and become part of the family.
2020-02-17,5,Wow!!!! Let's start with the vibes of the new restaurant in town Il Tavolo, the pretty new place owned by proprietors 'Fratelli Palmisano'. It's decorated in an industrial homey type feel you'll love. This restaurant which will surely become your regular spot is a wonderful addition to the 7th and Clinton neighborhood. Secondly, the service....Chris our server was spectacular. He truly wore his roller skates on Saturday night! Lol. He went above and beyond on an extremely busy night to make all the diners at our table feel like well fed and watered 'family'.  Robert, the restaurant manager greeted our table of twelve very warmly (like family). You could see he wore many hats the night we were there and was always there lending a hand to his staff.  Now the food, prepared by chef Clinton and his kitchen staff was amazing old school Italian..portions are big and delicious. My eggplant casserole was exactly the comfort food I was craving and it didn't disappoint. I'm not going to comment on all the dishes we ordered from appys to dessert to delicious espresso. Go and experience il Tavolo for yourself. You will not be disappointed!
2020-02-15,5,Great service. Great food. Great people. What more can I say? Robert Hoff runs a great house and Tiff is a great server! The must haves are the carbonara, short rib, and the Palmisano cut pork chop.You're in for a treat!!!
