2021-03-13,5,This place is incredible! The dishes are expertly crafted with each individual component perfected. The little "igloos" were spotless and definitely made us feel comfortable Covid-wise. Above all else, the service is impeccable. Our server, Eddie, was extremely helpful. His recommendations were based on his extensive knowledge of the restaurant. He was warm, friendly, professional, and efficient. Truthfully the best service I've ever experienced at a restaurant. If you go here for dinner, I promise you won't regret it.
2021-03-08,5,Girlfriend and I got an igloo, split a bottle of wine and had the chicken parm / short rib and polenta / two bruschettas / stuffed long hots. Red sauce was light and flavorful, polenta was creamy and short rib was tender. Couldn't ask for a better Italian meal in Hoboken.I usually steer away from Italian food when eating out because no one makes it better than momma but was pleasantly surprised with both the service and the food.Even if you don't want entrees the bruschetta toast and wine is not only affordable but wonderful to consume. I'll be back, maybe bring some friends/family next time but if you're looking for a nice night out in an igloo this was great. P.s. Italian long hots can range from fuck you spicy to was that even a pepper? Proceed with caution although these weren't too bad.Peace love and eggplant
2021-03-08,5,My husband and I went to Il Tavolo last week for our 20th Anniversary.  It was a great experience from start to finish. We made reservations through OpenTable and there were no issues, they even sat us early. Our server Amber was attentive and super nice.  We started with the bruschetta boards (roasted tomatoes with ricotta & hot honey - YUM!!)  We will definitely get this again.  We also got fried calamari, which did not disappoint and liked the taste of the marinara sauce.My husband got the rigatoni special with chicken sausage & hot peppers. I got the boneless short ribs with polenta.  OMG - both amazing.  Robert, the manager was there to make sure everything went smoothly and we enjoyed our conversation with him.  The staff went above and beyond what most restaurants in Hoboken do. You really feel like they treat customers like guests in their home.We ate inside and the tables were spaced out and the staff wore masks, so again they were really concerned with the comfort of the guests.We will be back for special occasions as well as just a regular night.  I think we may have found our new go-to restaurant in Hoboken!
2021-03-06,3,What a 3 star restaurant! When you walk in you can just tell it's going to be a 3. Like, Future Husband and I automatically mouth to each other, "Three." It's just that we are in New Jersey, and authentic Italian food CAN be found. This is more of that "spaghetti and a cocktail" type of joint - think Bensi (I won't say Olive Garden). The food was honestly OK. Burrata wasn't the most fresh I have ever had, they didn't give warm bread or a decently size portion of bread. I got a tequila mule and it was very average. I will say tables were nice and spread out which I of course appreciate during COVID. I'm pretty sure they were even more than 6 feet apart, so at least this place is abiding by the rules, allowing very few people in at the same time. Service was straight up OK too. Towards the end of the meal we waited awhile for the waiter to come back with our check and that always bugs me a bit. The bar atmosphere is cool - dark and cozy. But again, nothing special. If you want this type of Italian food - the type where everything tastes OK and almost every dish is covered in balsamic - then it can even be 4 stars in your book. But when Future Husband and I are eating Italian we want Jersey Italian food - Augustino's in Hoboken, Libretti's in Orange, Angeloni's in Caldwell, Chef Vola's in Atlantic City. Olive Garden in malls everywhere.... NO see! I fooled you! For a second you thought I was being serious-that's exactly what this restaurant is, sort of like a made-you-look Italian joint with one weird long table in the center of the room that kind of makes me feel like I'm eating in The Great or Game of Thrones or a themed Bar Mitzvah.
2021-02-13,3,Food was good but that's about it. Service was horrible, our server maybe said five words to us and was miserable. Restaurant was absolutely freezing. Valentines weekend, you think they'd be a bit more put together but it was just "meh". Bathroom was disgusting, you think during covid they'd be on top of it. Won't rush back, will probably do takeout tho.
2021-02-13,5,Great decor, food and service. We got the Garlic Shrimp, carbonara, Breaded Chicken Cutlets, Short Ribs, La Nonna and others other items that were all delicious
2021-02-10,5,All the way from Texas to here. The staff is very friendly, and the food is absolutely amazing. Clean, sanitized environment. Definitely recommend everyone give them a try. Y'all, will never be disappointed.
2021-02-06,4,IL Tavolo looked so good on Instagram and was given great reviews by most social influencers. Being from NY, Staten Island, and governor moron having restaurants on lockdown, wanted to enjoy a meal indoors.Our visit didn't begin well, as we waited 5 minutes to be acknowledged with water, and another 5 for a waiter to arrive. Once the alcohol was ordered, it was off to the racesFor appetizers, we tried their bruschetta boards, which consisted of many types of topping combinations on top of a big piece of toasted bread. It was far from bite sized and was cut up in pieces. The meatballs were average at best. The carbonara, with a sunny side egg on top was amazing. Best dish of the day in my opinion.For entree, I went with the boneless short rib over creamy polenta. This too was delicious, but didn't stand out to me as something you couldn't get elsewhere. The rest of my group enjoyed each of their meals as well. No complaints Plenty of restaurants to choose from in Hoboken. If you haven't been, you should try this one
2021-02-05,5,Absolute fantastic service and delicious food. We got the fried calamari, steak, aglio e olio, artichoke bruschetta and tomato bruschetta. The manager, Robert came by multiple times during our meal to check in with us which was such a special touch. Plus, we were celebrating a birthday and they brought over 2 desserts. I'll be back very soon!
2021-02-01,5,Second visit to Il Tavolo in a few months. If my first visit earned 4 stars, this one earned 5.The service was great, and the food was even better. A group of us split several menu items, all delicious. Grilled octopus, meatballs, and stuffed peppers to start. Short rib (my favorite dish), chicken cutlet burrata, and pork chop and peppers for mains. No complaints on the food, it was all excellent.Pro tip: order extra peppers and balsamic with the chicken cutlet burrata. Game changer
2021-01-31,5,This was the best meal I've had in a LONG time. Like in 2 years. I ordered the shrimp risotto and it was creamy and dreamy and exploded with flavor. Plus, the experience was 10/10. We ate at the restaurant in one of their igloos and it was such a fun and safe experience. The igloos were toasty warm and zipped shut. Plus, we saw them disinfect the other igloos and it gave us peace of mind to know that the restaurant was taking high precautions.
2021-01-30,5,Delicious thin chicken parm and short rib! Will definitely order again. Great food and service.
2021-01-20,5,My first dining experience at IL Tavolo di' Palmisano took place outdoors and was stellar in all aspects, from the food to the service.  So, the other day, I wound up introducing some family members to their excellent cuisine by picking up some appetizers to-go.  The Nonna's Meatballs were firm, but not too dense.  They were served in a hearty marinara sauce with a spoonful of creamy, lemon basil ricotta that melted in our mouths.  We had also ordered the Garlic Shrimp, which were even more spectacular.  As on my previous visit, the jumbo shrimp were plump and crisp.  They had been simmered in garlic, oil, and fresh herbs, and were then draped over toasted crostini and topped with shaved Parmesan cheese.  The sauce was robust and garlicky, but not overpoweringly so. We all loved our savory bites, and I was thrilled to introduce my family to such a terrific restaurant.  I look forward to more culinary experiences at IL Tavolo di' Palmisano.
2021-01-19,3,Heard a lot of great things about this place but have to say the owner wasn't wearing a mask at all which, even though he seemed nice, was super stressful! the octopus appetizer we got sadly had barely any octopus in it and felt overpriced for what we received. The server was doing everything on his own so it took forever.. he was very sweet and apologetic and gave us free dessert but it wasn't amazing. The owner not wearing his mask was a dealbreaker.
2021-01-18,4,We dined in one of the igloos and it was amazing! Had no trouble getting a same-day reservation (it was Tuesday) and the igloo was warm (there's a space heater) and seemed very clean. Staff was very friendly and nice, also attentive which was great since whenever we eat outside I worry we'll be more likely to be forgotten about. For a starter we got one of the crostinis that had sausage and broccoli rabe. Loved the cute, personalized cutting board it was served on, and that it was pre-sliced into 4 smaller slices - great for sharing and less messy to eat! Got the breaded chicken cutlet for an entree, which comes with roasted red peppers and burratta on top. So great! The chicken itself is pretty standard, but is made special with the toppings. Generous portion of burratta, which is always appreciated. Second entree was the carbonara - absolutely delicious and so fresh and creamy. However, never could have eaten the whole thing because it's incredibly rich, so very happy we had already planned to share both the chicken and carbonara. Only thing I did not like was my cocktail (forget the name and can't find it on the menu currently) - it was a mule with tequila and iced tea. I normally love every one of the ingredients but mixed together it was an odd, disappointing flavor. Would NOT recommend that, but everything else was great and cocktails are always a personal choice so I don't think that ruined or tarnished my experience. Probably would have been a 5 if not for that.
2021-01-17,5,Hoboken is full of Italian places and I am so sad it took me so long to come here thinking it was like all the others. It is NOT like the others. It was so good, true Italian food. The La Nonna is the kind of meal you think about often. The pasta was all cooked perfectly, and you can tell everything is fresh. Had some espresso martinis and they were delicious. The service was great as well. Can't wait to come back!
2021-01-16,5,The igloos were so fun, the waiters were so nice and attentive and the short rib was one of the best meals I've had in a while! 10/10!
2021-01-14,4,I ordered the salmon risotto and the salmon came out soo dry and the risotto was leaking oil. It did not have much flavor. I am giving this place 4 stars because of how cute the atmosphere is and the exceptional service!
2021-01-03,4,This place is delicious! We were in one of their outdoor igloos (due to Covid) and it was very comfortable.  Four of us went and we got the tomato bruschetta and also the salami/cheese bruschetta.  Both were wonderful! For an entree I got the salmon piccata which was so good!  Can't wait to go back and try more dishes!
2020-12-29,5,Had a great meal here on Monday night. Started off with 3 different types of bruschetta, all were really yummy. Then I had the La Nonna Pasta, it was to die for. My fiancé got the carbonara which he loved, I didn't get to try any because he ate it all. We were too full for dessert but will definitely come back. Service was great as well.
2020-12-18,5,I was feeling some Italian and I noticed that Il Tavolo was voted "Best New Dinner Spot" in Hoboken Girl's blog, so I decided to order some takeout. It did not disappoint. Started with the calamari and meatballs, both were to die for (and still hot after a long, 30° walk). The calamari was crispy and perfectly seasoned. The meatballs were some of the best I've had in Hoboken, ever. For entrées, we had the chicken parm and eggplant parm. HUGE portions (which I love because I can eat the house) and the quality is unmatched. Truly one of the best Italian meals I've had in Hoboken in a long, long time. If you're contemplating takeout/a great Italian meal, do not hesitate and order Il Tavolo. Not the mention was staff was very kind and helpful when picking up our order.
2020-12-14,5,Great spot especially with the new outside igloos! I had the burrata chicken and it was amazing! Can't wait to go back. Everyone was friendly and socially distanced as well!
2020-12-14,5,All I can say is 'wow!' They hit every nail on the head. The food, service, and drinks were all amazing! We were so excited to try it after hearing such great reviews and we were blown away. Our group got the shrimp Pete's, the long hots, and the calamari for apps. For dinner I split the carbonara (absolutely delicious and the egg on top was cooked to perfection) and the Sunday sauce which was also fantastic, the pasta was cooked perfectly al dente and the sauce was delicious. Everyone got espresso martinis Abe the spritz which were strong and perfectly made. Our waiter, Conrad was very friendly and attentive. Can't recommend enough!
2020-12-13,5,Wow the outdoor dining set up here is pristine! Outdoor heating lamps, individual igloos, plastic covering to block from wind/pedestrians, QR code ordering...etc. All staff were wearing masks. Menu was limited and the descriptions could be better with pictures, but all restaurants are adjusting during the difficult time. We ordered calamari, chicken cutlet with burrata, and sausage and rabe ravioli. The food was amazing and the weekly special ravioli was definitely the highlight. Since moving to Hoboken, we've been so unimpressed with the food and IL Tavolo will definitely be our go to! Can't wait until I can drink again to try out the drinks!
2020-12-11,4,Il Tavolo opened next door to my apartment just a few months ago and has really become a gem of the neighborhood. A small menu ensures high quality dishes and great cocktails gives the place an enticing vibe. They've gone to great lengths to stay up to COVID protocol and provide a safe and enjoyable experience. Definitely worth a chance for your next date night or GNO.
2020-12-11,5,The best spot for Italian in Hoboken! Although the menu may look simple, every dish has so much flavor and is so fresh! Amazing portions, great service- the staff goes above and beyond to make their guests feel accommodated. Highly recommend the burata, shrimp Pete's, ravioli specials, weekday bruschetta and wine specials. make sure to visit!!
2020-12-07,5,So incredibly happy Il Tavolo opened up when it did. Not only is the food incredible, the service is amazing. Every single time my fiancé and I have dined there or ordered in, the staff is so friendly and attentive. Robert, the manager, is so warm and accommodating - we love seeing him!The food honestly is delicious - do yourself a favor and get the icebox cake. It is, to die for.
2020-12-06,5,Worthy of #1 for best italian. The burrata, carbonara, and la nonna were delicious and filling, you could tell they use the freshest ingredients
2020-12-04,5,Tried this place for the first time a month or so ago, I was pleasantly surprised! I ordered a short rib over oricchiette special that was amazing! The  service was fantastic, and so were the specialty cocktails!
2020-11-16,4,Had a lovely experience at Il Tavolo on a Friday evening. Since it was a colder evening, we decided to sit inside and was sat immediately. I loved the ambiance of restaurant and the staff was very friendly. The highlight was the salmon - it was an awesome portion! You could tell the food was very high quality and made fresh. Excited to come back and try more menu items.
2020-11-13,5,This spot is a hidden gem in the heart of Hoboken. Our server Jennifer was stellar, making everything super accommodating and enjoyable for outdoor starting, even brining over an extra heat lamp! Food was so good , service just as great! Highly recommend!
2020-11-13,5,If you are sitting in Jennifer's section, she is the best server. The food was amazing but her service was supreme. 14/10
2020-11-13,5,Everything was amazing! Our server Jennifer was so sweet, friendly and went out of her way to drag over  heat lamp for us! 12/10 would recommend! Food was so delicious.
2020-11-13,5,Food was really good, tasty well presented and quick. Place is big trendy and clean. Would definitely come back .
2020-11-12,4,This is one of those new places that sneaks up on you. I had no idea there was a new restaurant at this location until I ran by one time. The set up is pretty straightforward with high top tables and a bar in the front. They also have a back room with more tables if you want a more private experience.We ordered a few different things starting with the meatballs and bruschetta with artichoke. The meatballs had good flavor and the sauce had a nice tang to it.  I had never seen bruschetta server with artichoke but it didn't impress me too much.  The thing that impressed me were the entrees. The La nonna is a must order and tastes like something an italian grandma would make. So good. It is pretty much grandma's sauce with meatballs and sausage.  The pasta is also perfectly al dente. My wife got the salmon piccata and it was delicious. It is light and lemony which I love. Sometimes piccata is more buttery than lemony but not here. It is just right. For dessert we had the rice pudding but it was bland and needed cinnamon. Overall it was a good meal.  The only thing I didn't like is that it has that old bar smell. I know that smell and it is very offputting. If they sort it out it would make this place even better!  The entrees were really solid and that will definitely draw me back.
2020-11-11,4,Excellent meal and service for me and my wife. I had sausage and broccoli rabe, and my wife had the breaded chicken cutlets. Everything was delicious. I gave it 4 stars instead of 5 because the bread (excellent focaccia) was served with prepackaged tubs of butter, and the ice tea that I ordered tasted as if it can from a machine instead of fresh brewed. It's the little things that make all the difference, but all in all an enjoyable experience.
2020-11-05,2,This place has potential, the food was pretty good overall. The calamari was pretty flavorless and chewy, but the meatballs were decent. Both of us really enjoyed our Short Rib, it was delicious and the dish was balanced perfectly.The service was almost comically bad, though. Our drink order took 20 minutes with literally only 2 other people in the entire place, and after those 20 minutes we were informed that they didn't have one of the drinks we requested... uhhh you're a waiter you should know what is 86ed and if you don't just let us know when you put in the order not 20 minutes later (I've sent back drinks only one other time in my life, this was the second time, the blueberry basil tasted like straight cough syrup)Also when we sat down in the back room it was uncomfortably quiet, it's a large wood room so everything was echoing, my wife and I were having fun with it but we had to request some sort of music to be played because it was simply painfully quiet. Every word of the other parties conversation was heard clearly across the room. I'll give it another try because I think it's solely an issue with management, but so far I'm very disappointed.
2020-11-02,1,Tried to come here on a Saturday night a few weeks ago and was told there would be a 2 hour wait... I walked around the outside of the restaurant and counted 6 empty tables! I doubled back and tried to make sure the estimate was still accurate, because maybe she didn't realize how many tables had cleared, but she confirmed the 2 hour wait and that I could put my name and number down just in case. A server overheard this on his way out and shook his head and even muttered "this is ridiculous." We ended up putting our name down but in the 15-20 mins it took for them to call us we were already seated with a glass of wine a few blocks away at Grand Vin. Wanted to support this place because we know it is new and it's probably tough to build up your reputation, but not a great way to start out... hopefully we will try again and update the review after that.
2020-11-01,1,Really adorable spot and a great atmosphere. Very great service in the sense where they are new and make you feel really welcome the moment you walk in. I would actually try to lift this new business up in these trying times, however, the bartender spent the entire time not wearing a mask. Which in a world where new businesses should be fighting for business and to be safe and accommodating in these trying times, I found to be absolutely disrespectful. Hoboken has worked hard to keep their numbers downs and I have gone to restaurants that I know better and am loyal too and they have been following the rules and going the EXTRA mile to make their customers feel safe. No matter what you believe, you are in the SERVICE INDUSTRY and you should be making people feel comfortable. I would 100% recommend this restaurant to friends to be a Hoboken resident that lifts and helps new restaurants out but be respectful and don't let your beliefs seep into your workplace. Do the right thing. Ironically in the bathroom, there is a poster explaining how wearing a masks saves lives and protects others. At least in the women's room they have this poster and she is a women so I know she sees it every time she goes in. It's so simple. I want this restaurant to succeed but step up. It's New Jersey when there are Italian restaurants on every corner, step up to the plate because I have endless options.
2020-10-10,3,It was good, service was excellent. Everyone was very nice and the outdoor dining set up was great.
2020-10-10,4,Another Italian restaurant to check out in Hoboken. We were given a choice of seating on a Tuesday evening and chose an outdoor table separated from other tables by a tarp. Tuesday nights they have a board and bottle special with a choice of four boards and a bottle of wine. With four of us dining it was perfect choice as each board was cut into four pieces. All the boards were terrific. I ordered the skirt steak pizzaiola, but received the grilled steak. I didn't complain as I was fine with what I was served. My medium rare was more medium but enough for me to send back. The bigger disappointment was the lack of taste or seasoning. Chicken Marsala was served a little gummy, maybe from being under a heat lamp. Not good enough to take home the leftovers. The other dishes were okay, nothing special. Service was very friendly and though we had a big space between the apps and main, our server didn't disappear.
2020-10-10,5,Came here for dinner with my boyfriend. We were sat outside right away. The service was AMAZING but the best part was the food. It was so delicious!!!! We ate every last bite. Highly recommend and will be coming back again and again.
2020-10-04,5,Had take out from Tavolo and it did not disappoint! Forgot who I talked to (maybe the manager) but he was a such a sweetheart!!! Beautiful interior, made me wish that I was eating inside. The boneless short rib - delicious, tender. Shrimp linguini - kinda basic (nothing special nothing wrong)
2020-09-25,5,I'm going to say it: best new Italian restaurant in Hoboken. Delicious, fresh, sophisticated dishes accompanied by a hospitable wait staff and a genuinely friendly manager, Robert. This restaurant has made it into my rotation. My Italian-descent father approves (note: last notable Hoboken Italian restaurant I took him to he said "never take me back there again." In contrast, he shared with Robert that he will come back to Il Tavolo on his next visit).
2020-09-20,5,Very delicious food with great menu options that you don't see at typical Italian restaurants. My boyfriend and I started with the artichoke cakes with Parmesan sauce, highly recommend. I ordered the mushroom risotto and it was a 10/10 I wouldn't change anything about it. It was creamy, incredibly flavorful, and filling. I really appreciate that they have vegetarian options that are on par with the rest of the menu and don't leave you feeling like the dish was lacking something.
2020-09-19,4,No bread to start but the food was great. It definitely feels healthier than other Italian spots. The food was not over seasoned which I appreciate it. I got the skirt steak with risotto and broccoli rabe which was perfect. Chicken and linguine was delicious as well. Linguine was cooked to perfection.
2020-09-19,5,AMAZING. Everything was absolutely amazing. The service was great and we were not rushed AT ALL. The drinks were amazing. The bruschetta boards were fabulous (we got every option and I cannot tell you my favorite) and the RISOTTO OH MY GOD. This place is newer to Hoboken and it is going to be tough to beat. Amazing. Amazing. Amazing. Get some heat lamps for the winter and I will be a regular!!
