2015-02-05,2,I just got back from having dinner at Leo's, and I have to say both my partner and I were very disappointed. It's a shame, because we were both in the mood for Italian, and I have been wanting to give this place a try ever since I heard Sinatra was a frequent visitor, but it's clear this place is riding on it's name only. I rarely write restaurant reviews, but this place definitely needs a wake-up call. About the food: For appetizers, we had the warm prosciutto and fresh mozzarella and Leo's "Famous" Mussels (in garlic and wine sauce). The first was two slices of meat and two tiny pieces of mutz over a generic salad. It tasted ok, but the portion was a joke for $11. I mean, are you kidding me for that price? I'm still shaking my head. It was all salad, barely any prosciutto or mutz. The mussels were on the half shell (very odd choice) over a very watery, bland sauce. The real kicker is the mussels were clearly pre-frozen or cooked earlier and reheated (my money is pre-frozen). I know mussels very well and cook them regularly at home. These were fishy tasting, and had an almost pasty texture... no resemblance to fresh mussels. Honestly, they were some of the worst I've ever had, and my partner agreed. We ate a few and stopped, and I'm now hoping they're not going to make me sick. For entrees, we both had veal parmesan, and while it wasn't nearly as bad as the appetizers, it was very mediocre and unseasoned. All I tasted was the tomato sauce that the veal was drowning in. Not worth the money. We both wanted to get a veggie of some sort instead of pasta as a side dish, and that was a $3.00 upcharge - each. We got broccoli rabe and spinach. Honestly, those two simple, sauteed greens with garlic dishes were the best thing we ate during the whole meal.Other negatives: When we sat down our table was dirty, and the floor was very dirty. Positives: The restaurant has some great old school charm, and I am a sucker for that kind of vibe. I love restaurants that have been around doing the same thing forever. Also, the service was quite good-- the young waitress we had did a nice job and we didn't wait long for anything. To sum up, I'd never go back. There are too many other (better) choices in this town. For $85 for two people, without any alcohol or dessert, we expected much more... or at least an average meal. You get (very weak) pizza-joint level food at Italian bistro prices. My advice to whoever manages this place: Get a new chef who can do justice to classic Italian food, clean the place up a bit, get some real napkins and silverware, and you'd have a real gem on your hands. As it stands right now, it's a pretty bad dining experience.
2015-02-05,2,I don't get why anyone calls this "the best" or even "good".1) It's dirty. Very dirty. The entryway is dirty and this should've been my tipoff (dust and dirt all over the walls). The table itself had crusty food still on it (how hard is it to wipe down a glass topped table?)2) "Leo's Famous Mussels". Leo is rolling over in his grave. So is Sinatra. These were clearly frozen mussels in a watery garlic sauce. No flavor, gross texture. Why use frozen mussels? 2.5) "Warm prosciutto and mozzarella". $11. Less than 1oz of either prosciutto or mozzarella over a majorly overdressed salad. Their cost? $.253) Veal Parm. Not bad. Might've been pre-frozen (kind of tough), but when you bury it in a salty enough tomato sauce it's hard to tell where any flavor is coming from. The only bright spot was the broccoli rabe and spinach, both of which were a $3 up-charge on an already overpriced dish.Total bill was $84 after tip (the service was good), which is insane given no alcohol. I would never return given the other options in Hoboken.
2015-01-30,4,Best home style Italian Anerican pasta in Hoboken served in a very quaint and cozy environment. Walls strung with photos of Sinatra and hearts. Service could not be better! (Thanks Ben, still surprised you are not a singer). My husband got the warm appetizer, an array of mussels, stuffed clams, mozzarella sticks, all very good.  I got the short rib pasta special and oh was it delicious and a very generous portion of ribs with meat falling off the bone so tender. It was memorable!  The Pinot was very good too. Finally the bread basket (did I espy Dom's bread) was as good as it gets esp when dipped in the chilli infused high quality house olive oil. I would have bought that olive oil were it on sale.
2015-01-11,4,I went here for a date last night (1/10/15). I was able to get a table for 2 around 8pm without reservations, despite Leo's having a pretty good crowd. Service was excellent- all staff I encountered were notably friendly and helpful. My meal was good, could have been excellent if I had asked the pasta to be prepared al dente- it was a little overcooked for my taste- but the bolognese sauce was terrific. We stayed for coffee and dessert, and enjoyed a nice conversation without feeling rushed out. I'll be back here again.
2015-01-08,1,We just left Leo's  and the service was poor.  We sat and waited for their signature mussels for an hour.  When the mussels marinara came they seemed cold and the sauce looked more like tomato juice.  They were small and nothing special at all. Our entrees came within minutes.   We were starving at 9:15 on a Monday and there were 3 servers in a small place!  Our entries were tasty but a bit salty.   They came with pasta or fries, salads were extra and overpriced.   We will not return and were extremely disappointed .
2015-01-04,5,Great home cooked pasta dishes as well as a fun evening with family or friends!  The juke box and Sinatra memorabilia are amazing!
2014-12-27,2,Frankly this was extremely disappointing - after hearing great reviews both on Yelp and from some family friends I was excited to try it out. The Good - Bar pizza was interesting and different/enjoyable for bar pizza (got a goat cheese/salad pizza).I ordered a meatball parm sandwich and Alfredo pasta - two Italian dishes that should be simple to get right and that any Italian place should pride themselves on - the meatball was bland and tasted like there were no spices used. The Alfredo tasted like a mix of jar sauce cut with water - terrible. Will likely not go back - if only to grab a wine and bar pie at the bar.
2014-12-12,2,The place is nice and the staff were attentive, but the food is lacking.I went with three people and nothing anyone had was great.
2014-12-06,5,Leo's is a Hoboken Institution where you feel like you are visiting friends and family each time you go. The food is delicious. The specials can be out of this world. Try the fish specials or the braised short ribs over rigatoni if they have it cause it's just sooooooooo good. Sergio and Nick take terrific care of you and the waitstaff is the best.
2014-11-27,4,Great food, great atmosphere, great service.  Very reasonable prices.  Great spot in Hoboken.
2014-11-24,5,Without question, this is the best Italian restaurant in Hoboken! And that's saying a lot! Linda, Betty and the whole crew could not be any nicer!
2014-11-22,4,Good food, sometimes if ur not w regular service could be improved... Fortunately I'm a regular so good food and friendly service for me!
2014-11-11,5,The best thin crust pizza and pasta Diavolo we've ever had. Our server was Ben and he explained the menu and made suggestions based on his favorites and both were superb. We like the menu options, the homemade rustic warm bread, and the service. This was truly one of the best meals we had in 11 days on the East coast. Not too expensive and great flavor.
2014-11-11,4,Pretty good italian restaurant in Hoboken. The food is delicious and the wait staff is very friendly. I ate the veal marsala and the sauce was a little too thick for my liking but everything else was delicious. It is cash only so be prepared for that!
2014-11-10,1,We went here based on some recommendations we read. We were seated way in the back next to the kitchen door and experienced all of the traffic in and out of the kitchen. Our food arrived in a decent amount of time and was not that bad, What was terrible was the waitress. She gave us a bill and most items were much higher than was on the menu. When we pointed out these mistakes, she said I will fix them. She then took off $1 for a $3 over charge on one item. $2 for $2.50 over charge. We spotted another over charge and she said she would total it again and took my credit card. She came back minus the itemized bill and said all was fine. Later, we discover that we were charged $18 too much. I do not know if this was something dishonest or a completely incompetent waitress, but the result was the same. I would recommend avoiding this place since there are so many other good Italian restaurants in Hoboken. This was my first and last time eating here.
2014-10-22,3,I heard a lot of fan fare about this place. I visited a few months ago and was a little disappointed. The service was good, the bartender was nice and they were accommodating to us despite the lack of a reservation. So on service I would give 5 stars no problem.The food was the issue. I had chicken parm, it was definitely over salted and the sauce was overwhelming. I felt like it was drowning in it. We had salads to start, they were fine. Nothing to talk about really. I wouldn't come back unless it was to grab a. Drink at the bar before dinner.
2014-09-28,4,4 stars only because of Ben, our waiter. The food was taking a long time & he kept coming out & apologizing, making sure we were ok, Etc. He was great - definitely an asset to the restaurant! I wish the food could have been a bit better. We had the hot antipasto ; the eggplant rollatini was excellent, I loved the sauce, but the mussels were tiny & clams oreganata  hardly had any taste to them at all.  Did I mention Ben was great?  I'll go back next time I'm  In town to try again. Thanks for a helping make such a not so great night so much more pleasant for us, Ben!
2014-09-16,4,Very nice Italian Restaurant, If you a Frank Sinatra Fan you are going to love it here. There tons of his pics all over the restaurant and they play his music in the background, the ambiance is quiet and romantic. I skipped the appetizers and jumped right into dinner. I had the Sinatra Shrimp Dish. It was delish! Will def come back soon!!!
2014-09-13,3,Leo's barely deserves 3 stars. We went last night and it was pretty disappointing. We ordered the antipasto, mozzarella pizza, and rigatoni bolognese. The antipasto and pizza were ridiculously bad. Although the pizza was only $3.75, I'm pretty sure it was a frozen pizza that they just heated up. The antipasto had a few pieces of salami and a random shrimp- gross. I did, however, like the rigatoni bolognese. They were even nice enough to split it onto 2 plates for us. That was really the only thing the place had going for it. Also, not a byob. I would def skip this place.
2014-09-08,4,Best Italian restaurant in Hoboken. Authentic, cooked with love like your grandma food. I will say that the servers are a different story. They don't seem to care if you are there or not. I've come to think of it as part of the charm of the place! Know this going in and you'll have a great experience. It's cash only. In case you're out, they have an ATM in the restaurant!
2014-09-06,1,Serious this is not good Italian food.. As in other posts the tomatoe sauce is horrible.. How do they let this garbage come out of the kitchen.. Really the owner needs to change the food.. Everything poor quality and is tasteless.. Even the bread.. I do not think the chef is Italian .. Worse Italian food I have ever had ..I am not going to waste my time telling you all about what I had and how horrible it all was.. Just want to let owner know you need a new chef. And he or she should have knowledge of Italian cooking if you are an Italian restaurant..
2014-09-06,1,Honestly the worst dining experience I've ever had. Over priced. Terrible terrible service. Waitress served us half used pitchers of water and didn't take drink orders and forgot an entire entree. Do not ever go here. Food was below average as well. I can't stress how bad this restaurant is.
2014-08-26,4,Excellent dinner of shrimp fra diavolo and the monk fish special.  Tasty.    Bread is always warm and crisp.
2014-08-18,5,This is my favorite restaurant in Hoboken. The service is great and the food is phenomenal. It tastes like my mothers home cooking! I love the jukebox with all the Sinatra. Always feel like your family / a regular by the staff.
2014-08-07,3,Solid food, decent prices, but hit or miss wait staff. Some of them are really attentive and polite, while some of the ladies make you feel like you're bothering them the entire time, and will rarely come check on you. I guess if they never come to be table then anytime you actually need something, it does feel like you're bothering them. Stick with take out. Cash only, but there is an ATM at the front.
2014-08-03,1,Overall bad food, bad decor, bad service. Not sure what the hype is about this place but it is just bad. How about ordering a chicken parm and it comes battered in a franchese egg batter opposed to bread crumbs. It was also 2 inches thick!  Really?  That's a first. And they sell their own sauce in a jar if you like watery marinara sauce. I think Ragu does it better.
2014-07-25,1,Heard great things about this place and was thoroughly disappointed this past Wednesday night. My boyfriend and I went with his parents and uncle and I was actually embarrassed to have brought them here. His mothers pizza came out 10 mins after the rest of the food and looked like it came out of the microwave. The shrimp fra diavola was soggy and the chicken was just okay. The service was even worse than the food. Needless to say we won't be going back any time soon.
2014-07-13,4,The atmosphere is quite old school and a bit boring, but the food speaks for itself. Amazing pasta dishes from the mussels to linguine and meatballs. Even the bread is delicious. They also had a special edition Italian beer that was quite good and went well with the food. The fra diavolo sauce on the mussels was delicious and good and spicy. They even made a special sauce for our pasta which was delectable. Great place that makes you feel at home and far off the beaten, touristy path of the rest of Hoboken.
2014-06-28,3,Food was good.  Wait staff was better.  Our server and the other servers seemed sincerely interested in making sure we were having a good time and enjoying our food.  It made us feel welcome.Oddly, someone was playing a lot of Fleetwood Mac on the jukebox when we were there.  I'm a Fleetwood Mac fan, but it just seemed out of place with all the Sinatra memorabilia on the wall.  It feels like there should be nothing but Francis Albert playing in there...
2014-06-15,2,Leo's is a big place, good for a group, and loud kids. The staff is friendly. Recently attended for a birthday and we were all pretty disappointed in our food. I will start off with the mussels. The menu states that they are known for them. It literally tasted like they dumped a bottle of Ragu over steamed mussels. I wouldn't even do that at home. A signature dish should be a show stopper. Next, I got the linguini with white clam sauce. Another mistake. First of all, they make it with canned, chopped clams. They added three clams in shells to the top (along with their broken shell bits in my pasta, seriously?!). The broth was terrible. It tasted very strongly of butter and that's not the way the sauce should taste (white wine and garlic). Stick with the bar pies.
2014-06-05,3,A bunch of coworkers and I came here for a classic Hoboken meal and we had a really great time.Decor: I would classify the decor as more bar than Italian restaurant, cut that is not a bad thing. There are tables in the front, aka the best seats in the house, and a bunch more in the back. The bar, though, is the nicest part as it is big and very inviting. Every wall is also a shire to both Jersey, Hoboken, and Sinatra - should come as no surprise to anyone. It is also a bit off the beaten path, being deep western Hoboken.Bathroom: It's a bit small and cozy but it gets the job done. It isn't filthy but I also wouldn't eat off the floor.Staff: The bartender was fast and pretty friendly, although he seemed to want to keep it strictly business. Our waitress, however, was awesome.  We were a group of 7 guys and she was quick with the uptake on jokes and wasn't afraid to banter back and forth with us.Food/Drink: They have a full bar and cold beer, no complaints. The food is hit or miss, however. I have been here in the past and had a pretty good meal but this time was certainly different.  We started off with some mussels (I didn't have any, but the others raved about them) and a few bar pies (really, really good!) and moved to the main courses: I had the Chicken Francese (sub-par at best) and the others had an assortment of things (which they all claimed were good). I guess I just ordered the wrong thing and I wouldn't hold it against anyone but myself.Value: The prices are very reasonable for the portion sizes, food quality and location.While I did not particularly enjoy what I ordered I definitely had a great time. It could have been the company I was with but, remove my meal, everything was good. I'd come back again, but not before trying a handful of other Italian places.
2014-05-28,5,Leo's is one of my favorite restaurants in Hoboken.  The food is that good, old fashioned Italian food.   The service is friendly and fast.  I love to take family and out-of-towners here because there is quite a large menu to make everyone happy.  They even offer gluten free pasta as an option!   I love any shrimp & pasta dish and the baked ziti, while my husband loves the chicken parm.  If you dine here, you must order the cannolis as dessert.  Best cannolis ever!  Even if I am too stuffed for dessert, I will ask to take a cannoli to go.  If you are looking for a restaurant that is not on Washington street, where its mostly locals, definitely try Leo's!
2014-05-17,3,I wanted to find a cute, atmospheric, and reasonably priced good Italian restaurant for dinner. I Yelped the place before coming and thought it sounded pretty good. However when I got there I was a little disappointed. I order the garlic wine mussels and the hot antipasta and although I consumed the whole thing, it wasn't amazing. I thought the muscles were a little dingy, and the wine garlic sauce could have been done better. It should have been served in a deeper dish so that the mussels can simmer in it's flavor. The hot antipasta was good, ha mussels, bakes clams (that was a bit too baked), shells, mussels, and shrimps (they were pretty good). My boyfriend got the spinach ravioli and told me that it tasted like it looks--drenched in Alfredo sauce. My aunt got the chicken Marsala. They did an I interesting spin on it and made it sweet. I thought it was tasty but I can see how the sweetness can get to you at the end. Overall nice staff, decent prices, fun decor with pictures of frank Sinatra all over the place and a cool bar in the middle. Food ....mediocre Italian.
2014-05-15,5,Went to Leo's for the first time last night and was very impressed.  The atmosphere is beautiful and Linda was friendly and welcoming.  Great wine, great people - will be back... a lot!
2014-04-29,3,I came here once for my roommate's father's birthday dinner. Everyone seemed really happy about the food and the ambiance, and I have to admit I had a fun time at the dinner, mostly because they were very accomodating to our large group (about 10 people). The only reason for the 3 stars is that I am not a huge "red sauce" italian food fan, but the food was decent for what it was.Pictures on the wall of Sinatra were very cool. All-in-all, a place to go if you like Italian food. Or Sinatra. Or wine.
2014-04-26,5,This place was recommended to us and we were so pleased.  We are in town for a wedding, not familiar with this city.  The food was plentiful and delicious!  We had Kathy as a server, it seemed like half the restaurant did!  Lol she was focused and friendly!  Thanks Kathy, wonderful evening at Leo's.  And your entree suggestion, it was wonderful.
2014-04-19,1,Just awful! I had the Hot antipasto. One of the worst plates of food ever set in front of me. Clearly prefab, old mussels, tiny tasteless baked clams, awful mozz sticks that clearly came from the supermarket. A Good Friday meal that was anything but good. I've been here before and it wasn't bad but my last visit to Leo's will be my last ever. It was that bad and not cheap since it was the quality of hospital cafeteria food.
2014-04-16,4,Food is delicious.   Baby spinach salad is terrific. Portions are good for the price. Decor is a throwback and homage to old school Hoboken which is great particularly the bar.  If you have anyone from out of town visiting this should be near the top of the list to visit.
2014-04-15,4,Love Leo's!!!  The servers are extremely nice and accommodating.  The food has generous portions and  is awesome.  It is definitely well priced for the portion size and quality!  So many carbs!  Bring it!
2014-04-03,5,If you're looking for "Old Hoboken Italian Eating", this is the place. The food was terrific and the service outstanding. We had it all - pasta, meat, fish - the four of us enjoyed ourselves thoroughly. The wine selection was an added pleasant  surprise. We drank 2 bottles of Amarone.The oval formica bar is classic and could be declared a city landmark. Go there as soon as you can!!!
2014-03-26,5,What can I say, Leo's, I love you! The red sauce is sweet and bold. The prices are unbeatable and the bar pies will blow your mind. Try a couple different pies to start off your meal. They are small and tasty. The service could use a smile here and there, but I come for the food!
2014-03-21,4,Came here for the Gluten free options. There was pizza and cheese ravioli. Despite the limited pasta choices they said you could pick any sauce on the menu, same for the toppings for the pizza.The one downfall as far gluten free is that the waitress  didn't really know what was 100% gluten free, we appreciated the honesty thoWe went with the ravioli with meat sauce which was AWESOME.On the pizza we got Italian sausage and smoked mozzarella. It was pretty good as well but could have been more crunchy in our opinion but we are picky pizza eaters.Overall good and nice for a decent price.
2014-02-19,1,Really Hoboken?  This place was AWFUL!!!! If you like good north jersey Italian food do yourself a favor and don't go here!! This is Italian good you would get in the Midwest. I don't understand the reviews below. I even went there after happy hour- when everything tastes good- and couldn't eat my food. It was that bad. I would not trust one persons review that thought this place was good.
2014-02-14,1,Sitting here waiting 2 hours and 15 minutes for my order now. Njwaiters (delivery service) won't tell me where the food is. Says they'll call back but they don't. I try and they don't pick up the phone. Call restaurant. First employee tells me it went out "a looong time ago." 5 minutes later, new person. "Oh it went out 15 minutes ago." No one cares, I already paid, still no food. Don't ever, ever order delivery from these guys.  Your food will never arrive and nobody will take responsibility for it. Money down the drain.Update: driver showed up, said she was pulled over by a cop. I guess for an hour? Anyway, resolved. Still not happy though.
2014-02-12,3,We've dined here a few times and it's generally pretty good.Very much old school family type of restaurant...somewhat chaotic too.This is not a quiet dining experience- it's lively.We've sat at the bar and had pizza & wine...pizza was pretty good.We've had groups of 10 people and had a solid time.Generally speaking, the food is old school Italian.  Sauces are good, the meatballs were OK, pasta dishes were good.Not outstanding and not subpar, hence the 3 star rating.You'll have fun here.
2014-02-05,4,When I lived in Hoboken I always passed by this place but never checked it out until last night. They have a full bar in the front and plenty of seating in the back room. The place does have a cozy and homey feel that most reviewers mention. The glasses of wine were priced at $8. They have plenty of options if you want a bottle. I had the Penne alla Vodka with chicken which came out to $19.50. It was a good portion size for the price and it was absolutely delicious. I wish it had more chicken of course. Our server was Kathy who was super attentive, friendly, and funny. At one point I wanted her to sit down with us for dinner. She made us feel at home. This is a great Italian restaurant that I plan on returning to, for sure!
2014-02-04,5,Leo's has been and will always be my favorite restaurant in Hoboken. There is not one negative aspect about this place. From the decor, staff, food, and overall mood everything is marvelous. What sets Leo's apart from the other Italian restaurants in Hoboken is that it has stayed true to their roots. The decor is true "old Hoboken" as some may call it. Frank Sinatra photos hang all around the restaurant, and you'll catch some of your local citizens who have been in town for years dining at Leo's. As for the food. Delicious is all I have to say. I have had their penne aka vodka, baked ziti, chicken parm, and seafood. All of the dishes are superb! Perfect portion size, temperature is always warm, and the ingredients taste authentic and fresh. The bar pie is a must have appetizer or even addition to your meal. If you are looking for a nice family feeling restaurant in Hoboken go to Leo's and ask for Cathy! She has been the waitress there for over 26 years and has been doing a fantastic job.
