2021-10-10,5,A local treasure, and a real piece of Hoboken history.  Go for the great Italian classics.  Play some Deano on the jukebox, or that skinny local kid.  Embrace the moment, and enjoy the timelessness of the place. Mangia!
2021-07-30,1,Food is excellent but service is horrible.  My wife and I went to have dinner on Friday and the waitress was so disrespectful.  She gave us the wrong order and when we asked to change it she started having a really bad attitude.  Never have we been treated this way in any other restaurant in the NYC/Jersey City area.  So sad that a nice place like this would have such a horrible waitress.
2021-07-29,1,WATCH OUT!! The other night I ordered two chicken meals for me and my husband and was told it would take 40 minutes for pickup.  When I arrived the place was empty and food was already cold.  I signed the receipt and walked away.  The next day I find out the gentleman who charged my credit card decided to TAKE IT UPON HIMSELF TO INCLUDE AN ADDITIONAL $12.00 TIP (without my consent). . . Not Cool, Not Right,  Not Fair!!!  Made me wait 40 minutes and food was already cold.  Won't be going back that's for sure.
2021-07-12,1,my wife had days asking meTo take her to this place, what a waste of money, time and food, the food was awful, I ordered a spinach carbonara the worst pasta I had eaten in my life I couldn't finish eating, how can you messed cooking pasta?, my wife ordered some gnocchi that were ok, the sauce lacked flavor.. thank god we ordered a pizza for starter that saved me to starve, we are not ever going back to this place. A food court pasta is better that the one I had here.. without exaggerating the pasta made me nauseous it was so nasty.. I don't understand how they have so many customers
2021-06-26,5,Service goes a long way.Since living in hoboken I have tried many delicious places. However, one of the complaints has always been the serive isn't great. May be contributed to the virus and short staff. But Leo's service was excellent and refreshing since moving here. The waiters were very friendly constantly asking us how the food was. They also have live entertainment on Wednesday and thursday! Great for a nice day to relax and eat some great food. Definitely plan to come back not only for the food, but excellent atmosphere.
2021-06-18,3,Leo's is a place I've been coming my entire life, and probably will for years to come. My family knew the staff... Kathy and Betty were the absolute best. The place was tiny, dark, and smelled like gravy cooking. When it was packed, you waited and the food took a little long but was the best in Hudson county and you could share everything... all while Sinatra blared from the jukebox. Recent visits have been different. Entree's sent back because Truglios closed and they couldn't get veal that came close to that good, free apps with a drink at the bar, mussels served lukewarm or so spicy they were inedible, smaller portions, and almost triple the seating capacity which if you ask me is the reason for the decline. What's worse is no one came to Leo's for chicken cordon blu or bass with purple potatoes... Leo's was the best red sauce joint I ever ate at. A positive is that the red sauce in question still tastes the same after 20 years and Linda is a reminder of the former charm. No one asked for my advice, but I feel such a connection with this place that I had to write something. I'll always support and go back when I can in the hopes that the charm will be back once again.
2021-06-14,5,Delicious food!! Warm bread to start the meal and a large menu with options for everyone! Definitely try the bar pizzas they are the perfect size for an app! Baked ziti came in a skillet and was cooked to perfection with the perfect sauce to cheese ratio.
2021-06-11,1,I picked up an order here after reading so many good reviews, but I was seriously let down. First off, the pasta is Barilla. The sauce all tastes canned and jarred. The penne vodka costs $18. You are better off getting a pasta meal from a nearby pizza place - it will taste better and cost less. I also had one of the veal entrees, which was like cutting and chewing rubber. The bar pie we ordered was okay, and probably the only thing that was remotely close to be worth the price we paid. Altogether, three dishes for $70 is outrageously priced for the quality of food. You are better off ordering pasta from a pizzeria or getting much higher quality food for the same money.
2021-05-28,3,We live nearby Leo's and always see people dining outside so we figured to walk over yesterday since it was so nice outside. We were seated right away and given menus. Unfortunately I had to request a bread basket two times since I saw another table with one who were seated after us. My husband ordered the mortadella and burratta and was not blown away. I ordered the baked clams as an appetizer. It was a giant clam opened, lukewarm and extremely under seasoned. Anytime I've ordered baked clams at an Italian restaurant it would be small clams with plenty of garlic and breadcrumbs seasoning. We were underwhelmed with the appetizers.Hoped maybe our entrees would be better: my husband said the chicken parm was ok. Nothing great. Pretty tasteless. My entree was the mussels in marinara sauce, which came out also lukewarm and tasteless. The sauce barely tasted cooked and had no seasoning of a marinara sauce. I just felt so sad that this local place that always looks crowded was so disappointing. We don't plan on returning and we would not recommend.
2021-05-11,5,I can not speak high enough about Leo's.  If you are looking for fine dining, no, but if you want amazing red sauce dishes, run.  We do tend to be there a fair amount and it's the kind of restaurant that makes one feel like family.  Strong applause for Linda, who you will find behind the bar.  If you are looking for old time Hoboken with casual dining this is the place, where one can feel the spirit of Frank.
2021-02-23,4,The food here is very good. Came on a Monday night without reservations and got seated right away. The tricolor gnocchi and seafood salad was my favorite. The chicken cutlet & veal cutlet was breaded and seasoned perfectly!! Would love if the vodka sauce was a bit more creamier. Overall very good and can't wait to come back!
2021-01-07,5,I LOVE this place. I get takeout occasionally and it's always been great and I appreciate the healthy options.
2021-01-01,5,What can I say. This place is a staple in town.  Bar pie, mussels, veal saltimbocca...madonnnnnnn!!
2020-12-30,5,Leo's has amazing food! We ordered through doordash, order and delivery was seamless. Everything was extremely fresh and tasted so good. We ordered the mussels in white wine sauce, tortellini Alfredo with shrimp and penne ala vodka with chicken. Food was cooked perfectly! Can't wait to dine-in next time!!
2020-11-16,1,Tonight I bought two chicken parm cutlets with linguine from here and it was honestly inedible. The pasta/sauce was okay, but the chicken tasted like it had been sitting out all day. The "fried" outer part of the cutlet fell off and tasted burnt, and the cheese was almost hard. Extremely disappointed. Paid nearly $75 with delivery fee and was only able to eat the pasta.
2020-11-02,5,Great food! Just had mussels and the special beef stew! Out of this world ! And thank u to tessie the best bartender...... highly recommended beef stew
2020-10-10,5,Great spot in Hoboken-- old school, family owned and operated. Food was delicious and a great price. $100 including tip for 2 ppl, drinks, large portions of pasta and dessert. More than enough space between tables and hand sanitizer at each for covid rules. They let us hang out and relax until close. Can't wait to go back!
2020-10-02,5,Leo's Grandevous is not only a Hoboken staple and a previous favorite haunt of Frank Sinatra's, but it is also a delicious restaurant that really lives up to its hype.  I have been there several times since my previous review, including my most recent trip, which was my first since the pandemic began.  The restaurant offered a breadth of outdoor seating options, including several tables on the sidewalk across the street and a few just adjacent to the building, which was where we sat.  Our server approached and handed us separate drink and food menus, which I was hesitant to take hold of with everything going on in the world.  Though they offered hand sanitizer on each table, I still was not thrilled that they did not offer digital menus.  Aside from that, we had a fabulous experience.  I ordered an Aperol Spritz, and as on my previous trips, they made one of the best and most balanced versions of the cocktail.  For my dinner, I went with my favorite Shrimp Sinatra, which consisted of plump shrimp sautéed with artichoke hearts and mushrooms in a herbed white wine sauce.  The dish was typically served over fettuccini, though I substituted spinach to keep it low-carb.  It was absolutely delicious!  My friend loved her Penne alla Vodka as well.Leo's Grandevous offers traditional Italian fare in a comforting environment, making it worth a visit.
2020-08-19,5,I absolutely loved my recent experience at Leo's! They have a great outdoor space across the street and all the staff is super friendly. The Burrata was to DIE for and the baked shells with grilled chicken was delish. The prices were a little high, but for great food and awesome service during this time - totally worth it.
2020-08-16,1,I'm really disappointed in this place during the pandemic.  They have not taken customer safety seriously and just about every time I've come here during the pandemic there are staff not wearing masks properly or at all.  They have also let customers sit at the bar and not wear masks even though they have the takeout food near them.  I'm not going to be back here for a long time at this point.
2020-08-08,5,First time trying Leo's, overall a great experience. Friendly staff & great food. Chicken parm and prosciutto pizza were both delicious. Definitely recommend this spot - will be ordering again soon
2020-07-30,5,My family and I really enjoyed eating here the other night. Because of COVID and no indoor seating, they did a really beautiful job with the outdoor area. We ordered the fried ravioli and the white bar pizza for apps. Both were fantastic but the pizza was my favorite. We then ordered many specials for entrees, but the entree that stood out the most was the gnocchi!! Tessie, our sweet waitress, recommended and did not disappoint! Drinks were delicious, even served in their plastic to go cups (COVID reasons) Support family owned restaurants and come here! Top 5 Italian I've had!
2020-07-20,2,We went here the first weekend of outdoor dining and unfortunately our waiter didn't have their mask on properly (wearing it under the chin)! We were disappointed as this was one of our first times outdoor dining. No one (including the owners were there) addressed the employee.
2020-07-12,5,Already a legendary Hoboken eatery, this Italian gem has nailed everything you want in a COVID world and all restaurants should take notes...Tables spacingTable cleanliness - witnessed thorough table wipe down as well as salt & pepper shakersPlastic cupsPaper napkinsPatron packs "to-go" bagBring paper check without check presenter/holder
2020-07-08,3,I dined at Leo's the third weekend of outdoor dining.  We got there around 7:30 on a Friday and it was only about a 20 minute wait for a table of 2. We were sat in the high top tables next to the restaurant (as opposed to the new dining section they created across the street).  The service wasn't great but the waiter seemed to be hustling as much as he could.  It took a long time and a few prompts to get water, silverware,  butter and plates for our bread.   For our appetizer, we shared the burrata stuffed beef steak tomato with pesto drizzle.  It was good but not out of this world.   For our mains, we each got the Gnocchi trio - I had seen photos of it on Instagram so I really wanted to try it.  I really enjoyed all 3 sauce flavors - it is a pretty heavy dish though so definitely expect to take home leftovers or it would be a good dish to share.
2020-07-01,2,Not impressed. I went here bc of a Recommendation on a blog and was not really excited to eat here. We ordered a beef steak tomatoe with burrata, watermelon salad, and the tri gnocchi. The tomato burrata was literally a tomatoe with a scoop of burrata on topWatermelon salad was good but missing somethingTrio- all about the insta but no taste! Plenty of other good Italian restaurants in the area.
2020-06-05,2,Recently ordered takeout.The fried raviolis weren't breaded, as expectly. They were simply fried and quite hard.. not to mention cold.Penne vodka - the vodka sauce was good, but there are so many better places to get pasta in Hoboken
2020-03-07,2,This is a review of a delivery order so may be better in the restaurant...but I wouldn't order in from them  again.I ordered the cheese sauce gnocchi and got the plain marinara. The meatballs didn't taste home made and the pasta was okay. And they just tossed the bread into the delivery brown paper bag without wrapping it at all, seemingly without care so it was rock hard and cold by the time it got to me.
2020-02-16,4,Small Italian restaurant with great service and great atmosphere.  Waiting staff is very nice and quick with refilling water.  Very family friendly, and love Frank Sinatra.  Ordered the salad, which was good and made to order.  The chicken parmigiana sandwich was very good and not too filling.  Definitely recommended!
2020-02-14,1,What the actual hell! I waited 30 min for the delivery guy to bring my food- and it was cold and small! Last time EVER will I use their services! I need a refund
2020-01-20,1,Placed pick up order for chicken parm, was quoted 20 minutes, went to pick  up, and waited another 20 minutes ((40 total)). Got home, food was cold and there was no cheese on chicken parm. Very confused how you can get something so easy, so very wrong...
2020-01-08,4,Leo's is the prime Italian Jersey dining experience. The food is delicious, the people are great, and the atmosphere feels like your grandmothers dining room! I ordered the veal piccata with spinach and it was so tasty with the perfect sauce. It's hard to find one that's not overpowered by lemon but this was just right. The prosciutto and mozzarella was amazing too, and the wine pours were generous and delicious. The people are incredible too. Liz was our waitress and she was so helpful with our order and wine selection. You could tell she was a real born and bred Jersey girl too.. so friendly and brightened up our whole dining experience! They're also really willing to make accommodations/alterations to menu items.We left with clean plates, full stomachs and are 100% planning our next visit.
2020-01-06,5,Amazing pasta!! They don't do delivery but I order take out and grab it myself. I make sure to pick it up piping hot and also saves me on delivery tip. I've also eaten there a few times - my son's name is Leo and we convinced him that this is his special joint. It is a Hoboken institution with over 80 years and a street named after it. Here are the crowd pleasing dishes we typically go for:Penne alla vodka with shrimpChicken marsala with angel hair pastaMeatballs in marsala sauceStuffed shells with grilled chicken
2019-12-23,1,Ordered pickup, gave them the full hour of the estimated 45-60 mins. Order was entirely forgotten but they played it off like it would be a few minutes. We stood there for around 45 mins for the order to come out, which was not only missing an entire meal, but when the missing meal was brought out it was still wrong and clearly thrown together last minute. Not even an apology or an offer to sit while they made our forgotten order. UPDATE: The Chicken Marsala came with free food poisoning :(
2019-11-15,5,Brought my family here for my birthday and everyone was impressed. Amazing food, great portions and the server was friendly and quick.
2019-11-15,5,Great food, exactly the type of atmosphere I was looking for when I searched Italian food on google and took an Uber from JC. Absolutely worth it. Management was EXCELLENT handling a situation that was my mistake. Will definitely be back when I'm on the east coast to satisfy my Italian cravings.
2019-11-12,5,Classic Hoboken spot. Established in 1939. The place is adorned with Sinatra pictures and memorabilia of the time. Must visit in Hoboken. Great family spot and feel good spot. Feels like you're at a big Italian family's Sunday night dinner.
2019-10-29,5,I came here in the August during restaurant week. The price was right and the atmosphere quite relaxing. I honesty thought the food was delicious. I came with my friend who ordered watermelon and feta which looked amazing. I ordered some dishes I never had before. Below I'll write my first impressions on each dish I ate.Appetizer: Beef Tartare w/ quail egg - It did taste a tad bit metallic but overall this was a hit for me. The quail egg was so rich that it enhanced the meats texture. Main Dish: Fig and Prosciutto stuffed quail over potato pancake, madeira wine sauce - This dish was so tasty. Saltiness from the prosciutto mixed with the sweetness of the fig was pure harmony. Ice Cream Brownie - dessert was okay. They put it together fast. Overall, I would recommend this place for a cozy night out in the city.
2019-10-14,2,Unsure what is so special about this place other than the Sinatra mystique.  Service was generally poor-long wait for waiter despite restaurant mostly empty, couple of bland pasta dishes.  But at least it was cheap.
2019-10-07,4,The oldest restaurant in Hoboken has survived for a very good reason, good traditional Italian food. Not fancy but really good. Service was very good and attentive. Must have the mussels, which is available in several sauces. The marinara was our choice and there is plenty of bread to soak up the tasty sauce. The minestrone was very fresh with plenty of vegetables and a great broth. Scungilli Fra Diavolo was perfect and spicy. Clams and linguini had about a dozen clams on top. Wine list has many choices starting at around $30.
2019-09-28,2,Good for the price but I wish they had better pizza crust. I have got cheese pie twice and there are no chili flakes or anything on the side which is odd for the pizza delivery.
2019-09-24,3,Second time eating here, first time really good, B+ food and service with an A atmosphereUnfortunately, second time , a Saturday night, I made reservations for 11, my family from Florida. I wanted to expose them to a really good Italian Hoboken restaurant that would leave them wanting to come back and impress them. I left having to apologize to them for the restaurant, making excuses that perhaps they were too busy to serve good food.The service was slow and un-attentive, the baked clams were under cooked and raw, the sausage on my brother in laws main course was over cooked and hard as a rock, my meal, the Frank Sinatra pasta dish was under cooked and tasteless.I will probably say that overall the restaurant is good, only if there is no one in the restaurant, once it gets busy, it's not good.My recommendation, drive to Arthur Avenue in the Bronx, it's worth the trip.
2019-08-13,5,Wow. Best Italian meal I've had in a very long time. Nothing needs improvement at all. Don't change anything! I love all the Frank Sinatra memorabilia in the restaurant and has the required Frank in Jail Booking photo. The third generation owner greeted me and exchanged a great conversation since there wasn't a crowd. The place has personality and oozes class. Full bar. I had the veal, so good, nice a light, fresh, good breading and not over cooked. Just the right flavor of the sauce. Side of meatballs put this over the top. Meatballs that taste like meatball and not filler. With places like this why do people go to Olive Garden? Hats off to the cooks and Nick (owner) on keeping tradition alive and not selling out! Veal A#1 = $22.00, Shrimp Cocktail $11.00, Meatballs and a coke.
2019-08-07,5,This is my favorite restaurant in Hoboken. Every time I go in the vibes are amazing. I love the ambiance, the music and the lighting. You are greeted right away and it feels like a friendly, neighborhood hello. The service has always been great and the people are cheerful. The food is always delicious and the prices are extremely fair. I love the bar pies for an appetizer, they are delicious. The bottles of wine are also fair price and not ridiculous. Leo's is doing it right still and there's no wonder why they've been around for 80 years. I highly recommend this place!
2019-06-22,5,First time trying Leo's. Was recommended by a few coworkers who have lived in Hoboken for decades. The bread that they bring out before you place your order was decently warm but nothing special. I'd rate 7/10. My girlfriend and I ordered the Margherita Bar Pizza and the Fried Raviolis for appetizers. I'd honestly rate the pizza 10/10. It was some of the best pizza I've ever tasted. As for the raviolis, I'd rate them somewhere like 6.5/10. Being my first time trying fried raviolis I was unsure what to expect. They were pretty dry but were definitely tasty. For a main entree I ordered the Cavatelli and Broccoli. It was very good but needed some cheese to add flavor to it. The sauce was a 9/10, while the broccoli and pasta itself prob fall into the 7.5 range. Overall, the service was above average. It wasn't too crowded and it was a very chill setting. Definitely looking to go back in the near future.
2019-04-28,4,We came for the first time in over 15 years, we had moved away from the area but were so pleased to see the original place is still here and being run by family members.  We sat at the bar and Phyllis is still there, she has been here for 30 years.  It's a good local place, welcoming, down home atmosphere, very nice staff.  The young "kids" working there were all very sweet, attentive, energetic and nice to talk to.  Since we were at the bar, we would have conversations when they came for drink orders.  Lovely girls I must say.  Had the Leos salad which was always my fav, and it still is.  I love the salami and provolone cheese on the salad, brought back memories. My hunny had the mussels in wine sauce and as they were years ago, still a big draw to the restaurant.  Next I had the pasta with short rib ragu ( a special that night).  This was a very disappointing. The meat was tender but the sauce was non existent.  My pasta tasted like meat and water.  I think the chef needed to give the pot a stir and it would have been better. There was barely any "sauce" on the pasta. Hunny had a pizza also very good. Even though I would never get that pasta dish again, the salad, mussels and pizza all were winners. If you plan on having several glasses of wine, I recommend getting the bottle, it works out much more economical than buy the glass. We really were looking to hang out for the late Sunday afternoon when parking is easy so my hunny had a bottle of wine...I was driving so no biggie. Good afternoon, again, nice staff. We will come back, glad to be back in the area
2019-04-23,4,Dinner was good but i wasn't "wowed" by anything. The mussels and Caesar dressing weren't as flavorful as I thought they would be. The ambiance was nice. I liked how it had an older feel and you could tell it has been there forever.
2019-03-20,5,Excellent! My boyfriend and I came in Sunday night to try this place out since we live pretty close. We sat at the bar. It was cute in side. I like the dim romantic lighting. It wasn't that busy which is nice sometimes. Service was great. We were immediately greeted. We got warm crostini with butter which had the perfect crunch. We tried the mussels with marinara. Great flavor and cooked perfect. Nice portion size. We got two pizzas. Both were very good. One with buffalo chicken and the other with prosciutto. Prosciutto was thick cut. The buffalo chicken was perfect. Would order it again! We were very full.
2019-03-09,5,This place is always a good meal. I've had a few different pasta dishes and they're always delicious the muscles are some of the best I've had. They also are always warm friendly appreciative of your business and pour a very generous glass of VinoHoboken has a ton of Italian joint but Leo's is as good as any
2019-01-28,5,Leo's was very quaint and cozy! We had a great meal and the service was wonderful. Our server was very kind and helpful and everything came out in a timely manner. Not to mention the food was all DELICIOUS!
2019-01-24,5,Came to Leo's on a Saturday night and were seated immediately. Having passed the restaurant multiple times on the outside, it's surprisingly large when you go in. It's also bustling. The decor is classic and the bar looks great. The service was very friendly and we end up sharing bread, mussels fradiavolo and a mozzarella bar pie as well as tiramisu. I ordered the veal parm and she the chicken parm. Both came with a side of linguine. Wine by the bottle doesn't go higher than 39 with the by the glass options at 4. There are also cocktails and beer. Frank Sinatra apparently loved this place. It's a nice place for locals and reasonable priced and everything is served hot and well made. Nothing was mind blowing but when you pay like 5 bucks for the bar pie you have to calibrate. I'll definitely be back. Everything was excellent.
2019-01-23,3,Our visit was underwhelming. Our waiter was not very attentive or welcoming, and made us feel as if we were a bother. The food was average but based upon the way I felt I will not return or recommend this restaurant to anyone. They cannoli shell tasted stale. Sad to say the best part of our meal was the cappuccino.
2018-12-28,5,This is my favorite restaurant in Hoboken. The food is always amazing and the people here are so great. 10/10 must try.
