2016-11-20,2,Ok... So this was going to be an OK review but something at the end that just burns my A**... which drives this down.  Looking for a quick place in Hoboken that fit the bill this past Friday Night..  Casual, good reputation, a little atmosphere, and good food... So off we go and arrive to this well thought of place by many in the Yelp community as well as a recomendation from our concierge at our Hotel. First off I HATE HOBOKEN....  An hour to get there from Secacus because some brain surgeon decides to shut down them main artery for construction at 7PM during rush hour.... Then you get there to "LEO's" and there is absolutely no parking so you have to 2 blocks "LONG BLOCKS" to the parking garage and then walk back... Place is real quaint, big half moon type bar with real casual dining tables very old place with paper napkins... in short its not formal dining but that is OK..  Supposed to be A Sinatra place with Sinatra music, but I didn't hear anything. So we arrive and its JUMPING every table taken the bar is packed and we are seated in the back near the kitchen when a table opens and its directly under the A.C vent which now I know why nobody is sitting there... our server says no problem move to next table... which we do and are told nope can't have that one need it for a bigger party so we move again and this time it's different servers area so nobody comes to us for 15 minutes STRIKE 1.  Order some wine which was not over priced by any means the win menu was fair. Finally Grace the original Owners Grandaughter a very nice lady take our order.... Fresh bread really tasty is provided.  We order a Hot Antipasto for 2 which some things were excellent while others just ok.   The Mozerella sticks were store bought deep fried and well you get the idea, the dipping marinara was a little thin but tasty.  Baked clams were tasty but not piping hot as were the famous mussels.. clean and tasty but not hot enough.  Real winner was some of the best Eqqplant Rolotini I've ever had... Entrees....House Special tonight was a parpadella pasta with pulled short ribs in a marinara... I personally thought the pasta was over cooked and again entree was NOT piping hot Other entree which was a veal Saltamboca .. which was very good quality veal, over spinach with demi glaze and mushrooms. All good quality ingredients but sauce was very bland..  Side of Pasta no up charge angel hair with olive oil and garlic was a winner... OK so we decide to head to the bar for coffee and after dinner drink...  and here is where it gets wierd.. Grace on her way out the door I had paid the check and tipped her very nicely... walks by and says thank you ... and tells the bartender red headed girl There coffee and after dinner drinks are on me... she acknowledges this.. and then as we are leaving says its $20.00..... I mention Graces offer which by the way I didn't solicit and she just says Sorry didn't hear her.. and takes my $20.00....  Honest mistake possibly but honestly I don't think so.. Figured we were 1 timers and she'd make a quick $20.00Summing it up... if the incident at the bar hadn't happened I'd probably been a 3 star good yea I'd go back type place but after that... Sorry folks better options out there.. trust me the $20.00 bucks doesn't mean a dam thing to me, but don't take advantage like that.. that's just Rude.
2016-11-07,5,Not sure how anyone could give Leo's a negative review - it's some of the best Italian in North  Jersey. You can smell the garlic simmering from blocks away. Everything we've ever ordered comes out quick, hot and full of flavor and authenticity. It's a small place so beware of showing up on a Friday or Saturday at 7PM and expecting not to wait. I also wouldn't recommend going with a party larger than 4 people. On my most recent trip there it was a Saturday night and they were offering a $20 bottle of Chianti as a special - score!
2016-11-02,3,Hit or miss every single time. That being said, we keep coming back because there have been some good hits. This past weekend's delivery experience was EXTREMELY SUB PAR - food was 2 hours (we live 1 block away) and yes, we got delivery... but it was raining and we were hungover. We called a few times to see what the delay was, and they 1st said it was on the way, then 30 mins later said they were just making it....? There was barely any sauce on both of our pastas - we ordered Penne Vodka and Fettuccine Alfredo. Extremely watery. 1 note - when the mussels are good, this is one of the best mussel sauces i have ever had. (when they are good).Also, don't go on Sunday nights - the amount of kids in there will drive a sane person crazy.
2016-10-01,5,Absolutely delicious garlic bread with cheese and last with meat sauce. I don't order anything else but have been coming for the last 16 years and the quality is so consistent and delicious, we keep coming back. Very friendly staff. This is a legacy Hoboken joint and is very authentic old school Hoboken complete with juke box and Frank Sinatra photos on the wallWell worth a visit for dinner!
2016-09-15,5,There are a handful of Italian joints in Hoboken, but none of them stand up to Leo's. The mussels fra diabolo are an absolute must. Their 3 cheese gnocchi is incredible and their chicken parm is also great. I've never had a bad meal from here, which can't be said for other Italian joints in town. If your in the area and looking for a good authentic Italian meal, I would recommend stopping in.
2016-09-06,3,Solid dependable Italian food.  This place is not looking to revolutionize the old standbys but rather provides reliable and tasty staple comfort food.  Their chicken franchese and penne vodka are standouts if you're not too full from chowing down on their delicious hot Italian bread! I bring my family here from out of town & country to experience some NJ Italian nosh - its so unique and good.
2016-08-23,5,Leo's is incredible. I felt right at home (and like I went back in time) as soon as I stepped in. Everyone is so friendly and there are many regulars. My two friends and I tried various drinks made by Nick (he's the best!). The bar pies are so cute and perfect to fill you up -- so many different kinds and a staple at Leo's. The pasta was delish and you should definitley ask for an order of mussels or mussels oreganata. The mussels are how Leo's all started! The cappuccino and nutella mousse were INCREDIBLE. Make sure you ask if they have any of the mousse available. You cannot leave without having it. I'm upset I didn't visit sooner and I can't wait to go back! Thank you, Nick and Grace!
2016-07-27,5,The food tastes like it was made in heaven and the staff is extremely friendly!! If you're looking for a great date night or family get together I highly suggest this place. Thanks for having us!!!
2016-07-20,4,The wife and made our annual trek to the East Coast to visit relatives.  Although we generally stay at the Sheraton Lincoln Harbor in Weehawken, NJ we had never made it into Hoboken for dinner until this trip.  I'm glad we did.  The place is filled with wonderful neighborhood restaurants and Leo's Grandevous is no exception.  Since finding street parking can be a problem, we took a short cab ride from the hotel.  That worked out well.  Being a weekday night, the place was not very busy, but we had called for reservations anyway and we were placed at a seat by the front window.  It was great watching most of Hoboken parade by this corner restaurant.    As the locals filtered in, they all knew the wait and bar staff on a first name basis.  The staff knew them as well.  Boy, this place is as comfortable as your favorite sweater.  But we came for food as well as atmosphere.We were in no hurry and ordered drinks and antipasto to start.  I'm used to cute little California wine pours, so when my Straccali Chianti came filled to the brim of the glass, I knew that was going to like this throwback restaurant.  Then came the antipasto.  It could have been our meal, especially since it was accompanied by a basket of yummy bread.  What a great start!I ordered the night's special,  veal osso bucco.  Special indeed!  Tasty, tender and more than I could eat.  My wife had pasta and meatballs.  Big ass serving.  We tried to stuff a shared dessert down.  After another round of overfilled wine, that cab idea sure looked smart.  Nice neighborhood restaurant.  It probably looks the same as it did 30 years ago.  Good wholesome Italian food.  Friendly service.  Try it you'll like it.
2016-06-26,1,Maybe its because im a italian from brooklyn, but i didnt like the food at all.The atmosphere was old school / sinatra style, which was cool and the staff was nice and attentive, but as far as the food i did not get one bit of authenticity.Imo it was a regular restaurants take on italian food.
2016-05-31,1,The sauce is too sweet and the food is overrated. We ordered salads and there was no dressing.
2016-03-06,5,They have the best Alfredo sauce I've ever had! Fresh bread and a great atmosphere!! We'll definitely go back!
2016-01-31,2,VERY DISAPPOINTING on many levels....Last night was not the first time we have dined at Leo's, although it will certainly be the last time we return.After finishing an appointment in the neighborhood (approx 6:00pm-Saturday) my husband and I thought....Let's go to Leo's for an early, casual dinner. He ordered a draught beer, I ordered wine. The server returned soon thereafter to inform us that they did not have either of our selections available. We made new drink selections and ordered dinner - after having to ASK our server about any specials that were being offered. Once again, she returned to explain that they were sold out of my husband's dinner choice - veal and peppers. Really?! It was too early in the evening to have had a "run" on this dish....and the kitchen had NO veal?...NO peppers? They obviously did not care to be accommodating.... about anything. The paper napkins they use are flimsy, cheap-- not even of the quality that come with pizza or Chinese food delivery. And there should have been more wait staff working, as well. The food was OK - not outstanding, not even HOT by the time it arrived.Unfortunately, on numerous occasions we have found Leo's to be a mis-managed neighborhood place to eat; cannot really be considered a restaurant. You will be disappointed (and frustrated) if you are expecting a nice dining experience.
2016-01-30,4,If you want authentic Sinatra era Hoboken this place is for you. From the 70s decor to the sinatra photos you feel like your italian grandparents have cooked every dish for you.  The Italian is authentic and the simple dishes have been mastered for decades.  Be sure to bring cash.
2016-01-19,5,Wow... just a staple. Likely the best old school restaurant in Hoboken. No glitz no glitter. Just perfect bread, food, drinks and environment. Juke box is an added treat. Kathy was amazing. We miss you.
2015-12-20,3,We wanted a Hoboken restaurant with a connection to Frank Sinatra and a friend recommended Leo's. The food was good but one dish was painful. My friend ordered Fettuccini Alfredo and it game out with pieces of grilled chicken. That was strange but the worst part was that the chicken was inedible. It was flavorless and rubbery. I literally couldn't swallow the piece I sampled. Was it frozen and reheated? I don't even know. Waitress did bring us a fresh dish with no chicken!
2015-12-19,3,I've only had the pasta here and it is solid. Fun environment to eat dinner and staff is friendly. Haven't had delivery from here, so can't comment, but it's a top spot here because of the food.
2015-11-14,1,Just finished a meal from here. Once again, like so many places in town, the food tasted as if it had been frozen awhile-sausage was cardboardy, no seasoning; meatballs were only slightly better-they were a little fresher. The sauce was greasy and watery- again lacking in seasoning. All in all, for 12.95, it didn't even meet that low bar. Did give me a lot of decent bread and the delivery was fast. Pass on by this one if you're a serious Italian foodie.
2015-11-08,5,Mmmh mmmh mmmh! Love their food! Lobe their prices! Love their service! Only opem for a couple of hours a day, but worth it! Definitely recommended!
2015-11-07,5,Always great, quality food. FromThe caesar salad to the bar pies and every pasta I have tried to date has been delicious. Even the bread they bring you is fresh out of the oven. Laid back atmosphere makes this the perfect go to.
2015-10-30,2,It's pricey, $20 for a plate of pasta pricey.  My plate of pasta came with very little meat and I thought I was eating chef boyardee's for a super inflated price.  The waitresses were super nice and the atmosphere was authentic Italian.  As a while the experience was mediocre, there was nothing special about the bread or pasta.
2015-10-12,5,We had our daughter's baptism here on a Sunday afternoon and everything went perfectly.  I enjoyed working with Grace and Sergio while planning the party. Grace was so kind and attentive throughout.  She thought of every detail, including serving all of the kids a special pizza during the first course.  The staff was so patient with us and the kids and the restaurant was so accommodating.  The food was delicious and came out quickly.   Will be back and would highly recommend to everyone.
2015-09-19,5,Met friends for a casual dinner. This is old school Italian food at its best.  The service was really good. The food though is as good as it gets. We had their mussels as an appetizer along with one of the salads and garlic bread.  WOW!  The main courses were all terrific. We even had cannoli and tartufo for dessert.   All of left really happy.
2015-09-06,5,This year marks 19 years of living in Hoboken and dining at Leos. I love having it right down the block and taking a stroll down the street to get my delicious dinner fix. my off the boat from Sicily dad loves this place too. Their eggplant parm is my favorite and tastes like my Nonna's. mangia mangia!
2015-09-05,1,Had a strange but seriously concerning experience on my only visit to Leo's.  We are new to Hoboken and live close by so we stopped in late one night for a drink.  We sat at the bar and immediately met the owner who introduced himself as so.  He was the bartender at that time so we ordered a couple of beers.  We watched as he introduced himself to others at the bar as the owner and shook everyone's hand as he did so.  Within a few minutes someone ordered a mixed drink.  Instead of filling the glass with ice with a scoop he actually reached into the ice bin with his bare hand to fill the glass with ice.  This IS disgusting.  Needless to say we have never been back and intend to stay away.
2015-08-31,2,I've been going to Leo's for 10 years.  Recently it seems like there has been lot of new staff turnover and the place isn't the same anymore.  I've probably had 20 chicken parms over the years and the last 3 times the chicken has been terrible.  The first time the chicken wasn't fully cooked.  The last two time the chicken wasn't tender and tastes like it was frozen.  Not sure if they changed their supplier and got lower quality food or if there is a new chef in the back but something has definitely changed.  Was willing to give them the benefit of the doubt since it was so good for so long but 3 strikes and your out.
2015-08-29,5,Authentic Italian!!Leos has been a long-standing Hoboken establishment from the Sinatra days. The food is authentic and unapologetically Italian. If you're feeling hungry, Wednesday's is lasagna night - yumm! Besides the lasagna, I recommend ordering the mussels a diavlo and meatball bar pie. A MUST visit for any Hoboken resident in which it will undoubtedly become one of your new favorites!
2015-08-14,4,Very cozy family style restaurant. We had the shrimp fra diavolo and the shrimp with Brussels sprouts and pancetta. They were both very tasty meals with very generous portions. Shrimp was cooked wonderfully.
2015-08-11,1,It was nice of the manager to comment here but it didn't change the experience. The day of the reservation was the same day I left the review, July 1st at 9:30PM. I
2015-08-11,4,I love Leo's.  Classic staple Italian food in a no-nonsense setting.  Generous portions and large menu with Italian classics and some specials.  Not a super fancy joint by any means, but  quality and dependable food.  And the waitresses are Jerseylicious.
2015-08-08,5,At first I would of given this 3 stars because when I received my penne alla vodka it came a little dry and without chicken. It wasn't the restaurants fault as delivery.com failed to have a drop down option for the chicken so I just assumed that it came with it at the $15.50 price. I called and they were quick to bring me a whole new order with more sauce and added on the chicken for free. The guy on the phone was extremely nice and attentive to my feedback and was quick to offer me a new dish on the house. I will definitely be ordering again. Great food, better service . Thank you !
2015-07-22,5,I sat at the bar for a bite and asked for a 'classic' dish. Nik the bartender gave me the fantastic recommendation of vodka sauce pasta and side of meatballs. Absolutely delicious. Some reviews have called the restaurant dated, but in all honesty that's where the neighborhood charm comes from. It's a relaxing and fantastic place to eat.
2015-07-20,4,Just moved to hoboken and this is by far one of my favorite spots..food has been on point each time i have visited, and the personal service by Sergio is  fantasticEveryone is extremely friendly and the pesto chicken pasta is one of the best i've ever had. I will become a regular bar fly as i set up my roots in New Jersey.- x new york city food snob
2015-05-29,5,From reading other reviews, I get the feeling a lot of the negative comments are from people who don't know real Italian food or just can't handle New York Metro attitude. Leo's is an institution and the best of its kind outside the Bronx. I used to live in Hoboken and my family still occasionally meets out there for dinner despite geographic inconvenience. It's great, not overpriced, and no one I've gone with has ever been disappointed. We love this place through-and-through. It is a member of a dying breed of delicious, independently-owned Italian places that don't solely exist as a tourist trap. Definitely check it out. Leo's beats Carmine's.
2015-05-16,4,When I first heard of Leo's Grandevous, I was intrigued once I learned of its history.  Opened in 1939 by Leo and Tessie DiTerlizzi, it was a favorite of Frank Sinatra's.  Whenever he was in the area, he would always pay a visit, usually after hours as he enjoyed not only the food but the company of Leo and Tessie.  Here is an article that talks about all this:  nj.com/sinatra/ledger/in...We were visiting our daughter and her family for Mother's Day and decided that we would try to have dinner here.  They don't take reservations but we took our chances and showed up around 5:30 p.m.  The place was busy but they were able to put together some tables so that there was room for the 7 of us.Looking around at the customers, it was clear to see that most were older folks which I suspect were part of the BNR (born and raised) Hobokenites.  It also appeared that much of the staff was also.We found service to be friendly and efficient.  For starters, we decided to get a large antipasto to share.  This dish is attractively presented and consisted of black and green olives, salami, iceberg lettuce, tomatoes, hot peppers, shrimp, roasted red peppers and wedges of cheese.  We liked most of it, except the cheese.  Most antipastos have mozzarella in them but here the cheese was, apparently, romano which didn't go well with the other items.  In fact, most of us didn't like the cheese with the exception being one of the grandsons.  In fact, when his brothers discovered that he liked the cheese, they gave him their portions LOL!One of the specials of the day was filet mignon served with mashed potatoes with gorgonzola cheese.  Our son-in-law wanted this until our daughter guilted him out of it by telling him that we were in an Italian restaurant that was well-known and he should get Italian food.  So, like me, he ordered chicken parmigiana with angel hair pasta.  I had heard that Leo's red sauce was on the sweet side but that wasn't the case.  It had good flavor and wasn't at all sweet.  The portion was huge---2 chicken cutlets (one would have been fine!)  You are given a choice of sides and I chose angel hair pasta, as did my son-in-law.  I think that the pasta was from a box as it didn't have that homemade flavor.  The cutlets were breaded and thin plus the amount of mozzarella on them was generous.  We both enjoyed our meals.They don't have a kids menu here so I told our daughter to ask if they would do a half-portion.  It turned out that they indeed do offer that option.  So the 3 kids got cheese stuffed tortellini with red sauce.  All of them just about inhaled their food---they liked it that much!Our daughter got the eggplant parmigiana with a side of pasta (I forget which kind).  She raved about her eggplant saying that it was the best she ever had.  In fact, she told me that she can't wait to go back for more!  I tasted some and I agree that it was well prepared and flavorful.My husband got sweet Italian sausage with penne and red sauce.  The sausage was nicely flavored with fennel.  He enjoyed every bite!For drinks, my husband and our daughter each had a Peroni beer.  I had wanted some ginger ale but they were all out.  So my son-in-law and I had Pepsi.  Our server brought us a pitcher to share.  The kids had water.We all left feeling quite full!  The kitchen was on the slow side but I think it had to do with their being busy.  We didn't mind as we were in no rush plus the wait wasn't so long that we felt annoyed.  Prices are very reasonable as all our entrees cost less than $20 each.  The large antipasto was $9.50.If you are in Hoboken, I recommend a visit here, if for no other reason than the history.  There are lots of Sinatra photos on the walls and the jukebox is filled with Sinatra music.  It's an easy walk from the train station---find your way to 2nd Street and it's right on the corner of 2nd and Grand.
2015-05-14,4,Went back for a second time and the bartender was very friendly. The food was pretty good too. Would come back for a bar pie and a drink or two.
2015-05-14,2,I have heard good things about this place from friends. Got it delivered tonight. Got the rigatoni bolognese. They apologized on the package that it was penne, not rigatoni, which I did not care about. But while eating I bit into something gritty and hard. It was a piece of glass. This I am not ok with. I hope the chef and his kitchen staff use safe and careful food prep in the future. I will be giving it a second shot at some point because I believe in second chances. It just sucks that my first experience here was not great.
2015-05-12,3,Well, this is an institution. Good 'ol hearty Italian food. Very saucy, lots of rich pasta dishes. Sinatra playing loudly in the background. The food is okay, but I didn't find it that impressive.
2015-05-08,5,Their food..is...delicious!! The service is great and my fav dish hands down has to the Penne Vodka! it is absolutely mouth watering!
2015-04-04,5,Don't understand the other reviews.  This place is always spot on when I go.  Service has always been great, food has always been superb, and the ambiance takes you back to the times Sinatra roamed the place.
2015-03-03,1,I have fond memories of my first and subsequent visits to Leo's. The food was nothing short of a portal back to my childhood in Brooklyn eating good old fashioned Italian staples bathed in a great red gravy. More recently though my visit was a major disapointment. The bufala mozzarella and tomato lacked the basic oil and vinegar you would expect and was room temperature.That was followed up by mussels in red sauce. For reasons I can't understand they are cooked and served on a half shell. This of course leads to the dry rubbery items I found before me.Having ordered the veal parm I expected good things to come despite the two previous courses. Instead I received some water logged pasta and veal so thickly coated in egg that it tasted more like an omelette than anything else.Once upon a time Leo's was a great place for Italian comfort foods. Nowadays it seems they rely on the fact that Sinatra once ate there and have little concern for what they put on a patrons plate.
2015-02-16,2,I don't get the hype about this place at all.  I've tried it twice and twice have left disappointed. Not a good spot, not a place for a date and not good in general.  I feel as if they litterally stole my money.
