2014-01-26,4,Wonderful! Will definitely return. Had the Shrimp Sinatra, excellent dish. Would only have liked to have been able to hear the wonderful music at the tables in the bar area where we were seated, but overall very enjoyable!!
2014-01-20,4,Decent Italian food
2014-01-16,4,This place was just MARVELOUS!! What a gem in this neighborhood. Everything they served us was just as you would imagine it should taste.  The deserts we had ( I had the tiramisu) were marvelous. I am not listing everything we had because there were 5 people and we got 5 different things and EVERYTHING was superb and not one complaint. All finished plates and no to-go's! If I am in the area again, I will make sure to stop here. The service/servers were all so wonderful and attentive.Why the missing star? They don't take credit cards!! Its 2014!! People have been to the moon!! Suck it up and take credit cards! I guarantee your profits will go up because people will order more food! I know we were all wondering if we would have enough cash to cover everything. Get a credit card machine already and get the ATM out of there, it trashes up the place!
2014-01-15,4,This should technically be a two part review. I came here for my company team luncheon and ordered the veal, which turned out to be a sad meal. The bar pies were pretty good, but not good enough for me to come here just for that. I came here again last weekend and ordered off the menu. I had the chef prepare a broccoli rabe and sausage with pasta in white sauce and that definitely nailed itself a 4 star. My previous boss had introduced me to it and I'm a fan now. Although his wife's version is still much more delicious. I need an invite myself to his house for dinner :)
2014-01-14,5,Hoboken, NJ was the first place I moved to when I graduated from High School. So feeling nostalgic when friends wanted to go to lunch, I said let's go to Hoboken for good italian food. I had never been to Leo's but googled it and the menu looked good. And it was! Located on the corner of 2nd Street and Grand Street the food was authntic, service easy going and inviting.  The bread was great served warm with olive oil or butter. I ordered the Mussles in white wine and Garlic and Linquini with tomatoe sauce.  I was not disappointed. I would have had desert but I was too full. Next time. If you want to feel like you are in Italy go here! And NJ still has the best Italian places, you DO NOT HAVE TO GO INTO NYC for a great meal and great time.
2013-12-26,2,Came here with a few coworkers for lunch.  Not impressed by the food or atmosphere.  It does have a very "homey" and comfortable touch to the place but ultimately I came for the food.  We started with the pizza which was ok.  For an entree i had the pene vodka and it was ok along with the eggplant parm.. very mediocre. The service was not the best.. waiting 20 minutes for pizza, 30 minutes for entree.. it was a project.
2013-11-12,5,I've only dined in once and the service was fine. The food, however, is excellent. Anything with meatballs, the penne vodka, and the chicken parm (and I'm sure everything else, but those are what I normally stick to) are top notch
2013-11-11,5,We love Leo's!!! The food is basic old school Italian and absolutely delicious. We always get a bottle of wine, a Caesar salad, and a (free if you like them on Fb) order of mussels in white wine and garlic. Wednesday night is lasagna night which my hubby loves. Nightly specials are always tasty too. The servers are unique - friendly but in an old school Hoboken way which we love. We live only a few blocks away which is good for our taste buds but bad for our waistlines! The new ricotta cheesecake is outstanding. And, btw, they ACCEPT credit cards now!!!
2013-10-19,5,We went tonight and as usual, the food was fantastic. I ordered chicken stuffed with prosciutto and asiago in a Madera sauce off their special's menu. My dh ordered the scungilli fra Diablo and mussels. Their mussels are the best value and very tastee.  We also had dessert, not usual for us. The tiramisu was ok but the cannoli was good. However, I know I wouldn't get it again. Since we had not planned on going there, we were a little short on cash. When the bill came my dh told the waiter he was going to the Atm up front. Guess what.... It wasn't necessary. LEOS NOW ACCEPTS CREDIT CARDS!!!!!
2013-10-05,5,This is as good as it gets when it comes to italian food in Hoboken. As old school as it gets and still going strong.
2013-09-28,3,A solid place for feel-good, comfort Italian food. I went there last night (09/27) with my boyfriend for dinner, and although the service was a bit spotty in the beginning, it improved as the meal progressed. I ordered the baked ziti with ricotta and mozzarella, and my bf ordered the veal Parmesan. We both had a glass of wine with our meals--Chianti for me, Chardonnay for him. I really enjoyed the consistency of the pasta with the baked/melted cheese, but my boyfriend wasn't thrilled with his veal, claiming it had a "overly-fried" texture. Our waitress was very friendly and helpful (when my bf tried to pay with his Citi card, she subtly whispered to him that Leo's is cash-only, rather than loudly announce it to the whole restaurant, which I thought was rather considerate). The only issues I had with the overall service were that we had to ask for water twice, and one busboy kept passing our table without bothering to refill our water glasses. The place got a bit noisy towards the end of our meal, but that's to be expected from a local Italian eatery. We'll be back.
2013-09-11,5,Continuous Frank Sinatra in the background, local crowd, simple but tasty menu, authentic decor, and decent prices make this the best Italian in Hoboken. Stay away from that faux-nouveau Italian crap that takes up many spaces on Washington.
2013-08-16,2,Although the reviews speak highly of this place, the food was mediocre at best. Both dishes, baked shells with cheese and chicken picatta were extremely bland. We tried salt, Parmesan cheese, pepper but still nothing. The meal was sadly disappointing.
2013-08-07,5,This is hands down my favorite restaurant in Hoboken.  The food is absolutely delicious and the staff is friendly.  They have an awesome jukebox too!  I've been going to Leo's for over 5 years and it never gets old.
2013-07-16,4,Leo's is a favorite.  They have great red-sauce Italian food, a fun jukebox, mean martinis and a staff that makes you feel at home. Fancy it isn't, but get over yourself and enjoy why you are there - for old-school, quality time with friends or family.  There are some reviews referring to servers as rude or scary.  I don't understand why these reviewers would be so rude.  The staff at Leo's, including the sisters Kathy and Linda, are dedicated to making your night easy - they'll make recommendations based on what you want, and remember you when you return.  Big difference between new-school polished and old-school real.  Remember where you are and you'll love every minute here.  We do.
2013-07-15,5,great food, reasonable prices and a family-like wait staff (the wait staff and patrons seem chummy with one another as if they all grew up together asking how each other's family members were and all - I mean it is Hoboken, and the Hoboken community is tight, so who knows, they might have all grown up together!) i'm such a fan of the food (i usually get the pasta dishes) that i even go out of my way to buy their jarred sauces to make at home when i'm entertaining company...I'm not from Hoboken, so it's quite a trek for me.  Sauces are always quality ingredients and fresh tasting!
2013-07-03,4,Good food, good prices, friendly staff.  Leo's is a nice mix of atmosphere with family style casual in their backroom seating, and more intimate seating in the bar area.  However, it wouldn't be an Italian place without some TVs with the soccer game on!My cousin and I didn't feel like cooking our own Sunday dinner so we decided to go check out Leo's.  We ordered some pasta dishes and split a bottle of wine.  Their marinara sauce had a ton of garlic, so if that's not your think, order something else!  The bolognese was very tasty.For the super healthy eaters, their menu had plenty of dishes that weren't straight pasta.  Also, their bar pies looked really good too, and I definitely plan on making it back to try one of those!
2013-05-14,5,My boyfriend and I have ate here on a few occasions - some take out, some dine in. We have never been dissappointed! The food is delicious and comforting, as we both come from big Italian families. Also, you can not beat the prices here, especially for the quality (note: they only accept cash).We dined outside one day with our large dog and our waitress (an older woman) was warm, kind, and attentive - even to our dog! We left feeling very satisfied with our meal and the service and appreciation we received.We will be back!
2013-04-06,3,I had been looking forward to this place for a couple of months and when my gf and i finally got there, it was a bit of an anti-climax. The food was good, but we have way better boot food in L.A. I guess it being in NJ, I'd had high expectations of it. We went there because we're fans of Sinatra and live and die for Italian cuisine but the service was minimal for a restaurant setting. I guess non-Italians from out of state just don't get the same level of customer service locals would. Meh.
2013-03-24,1,STAY AWAY FROM SCARY KATHY! She is a miserable server who has no class, no hospitality skills and is down right mean. I feel sorry for her. She must be a sad person. She was so rude to us on 2 different occasions. She was also argumentative in front of the owner, Sergio, who has no clue and did nothing to appease the situation. His response was, Sorry, she is Old Hoboken and has been with us for 25 years. He is clearly scared of her and I get it. She is scary. The food is great and most of the other staff is friendly. Too bad that Kathy will prevent us from ever going again. TERRIBLE SERVICE. She definitely has a chip on her shoulder for no reason. Very disgusting. We will be sure to let all of our Hoboken friends know to stay away as well. STAY AWAY!
2013-03-18,2,Possibly would have given it three stars if not for the terrible service. I don't think I've ever felt so unwelcome walking into a restaurant. We came in as a party of 4, and two waitresses just looked at us. We asked if we could sit at an empty table in the window and were told we could after they had a conversation about it. The bread was very good, other than that, meh. Clams and mussels were ordered for the table which were just ok. I had a Leo's salad which was basically iceberg lettuce, topped with a julienne of salami and a small dice of provolone. Three of us ordered pizzas, they're bar sized, also just ok. The fourth in our party had a scungilli salad which was obviously canned scungilli over lettuce.
2013-03-11,5,Jeeezus H. Christ of Latter Day Saints, this food is good!!Best Italian food I've EVER had in my entire life. Went on a Saturday night around 10:00pm. Had the usual headache of finding parking in Hoboken, but once that was settled my fiancee and I trekked down to 2nd St & Grand. The restaurant itself is a pretty comfortable mom & pop style place. The place is an ode to all things Frank Sinatra. Hundreds of photos and portraits of Sinatra line the walls all around the restaurant and they play a never-ending stream of his hits playing through the speakers. It's actually quite pleasurable.We bypassed the bar  and went towards the dining area. We did not see anyone at the door so quickly realized we could sit where ever we wanted (after confirmation from one of the passing servers). The place was about half filled since it was later in the evening (they closed at 11 on Sat.) so it was easy to find a table and it wasn't too loud. Our server was nice and down to earth and checked on us frequently enough so that we didn't feel ignored and was careful not to be annoying and hover. Him and the rest of the servers are super helpful and seem to care that their guests get everything they want.The menu is pretty extensive, offering loads of traditional italian dishes. We ordered the Warm Prosciutto & Mozzarella & Mussels in Garlic sauce for apps. For entree we got Three-Meat Lasagna (beef, pork, veal, i believe) off of the special menu and the Veal Saltimbocca off the regular menu. We also combined it with a bottle of pinot grigio (Leo's is not BYOB since they have a full bar). Warm Proscuitto & Mozz Salad: HOLY SMOKES--orgasmic salad. I wish I was exaggerating so it wouldnt come off as me just being cray cray but im so serious. The proscuitto is a great salty season to it and has a lovely soft texture thanks to the mozz. Combined with the crunchiness of the (also seasoned) salad and it was absolutely perfectMussels in Garlic Sauce - I'm not a fan of clams or mussels so I didnt eat it but my fiancee did. He said while they were good, they werent amazing. He ordered a small tray but it was still a HUGE portion so he didnt finish it.Three Meat Lasanga - This was another hit, beautifully executed and a perfectly balanced taste. Their tomato sauce is so boss and went well with everything. Perhaps one of the best lasagnas I've ever encountered, hands down.  It came with a choice of two additional meats on the side--I chose a meatball and sausage but didn't finish because of the next dish....Veal Saltimbocca - If the menu is the Greek pantheon, then this is probably Zeus. The veal is so friggen tender! And the saltimbocca...What the heck is in the sauce!?!? My fiancee ended up taking pieces of bread that they brought out to our table earlier and sopped up every last inch of the liquid off his plate. I joined in (lol). It also came with a side of spaghetti (also good).To say we were happy campers by the end of the meal is a vast understatement. We were pleased, surprised at the huge flavors, and thankful. Funny because a woman at a neighboring table quipped to her date "i wish i could live here..." At the end we got a slice of red velvet to go (which was decent, but i dont care for red velvet anyway).Our entire meal rounded out to around $85--VALID! For the amount of food and sheer awesomeness (including a whole bottle of wine) that is relatively cheap! the most expensive entree on the online menu is $19.95 so its definitely affordable. I almost forgot to mention that each course was timed perfectly, our entrees coming out in about 20 minutes.In one visit Leo's has stolen my heart and I intend on bringing my whole family here. Definitely want to try the pizzas too since I've seen rave reviews about it. If you're an Italian fan, do yourself a favor and go to Leo's!!TIP: this place does NOT accept credit cards of any kind so make sure to bring cash or be prepared to use the ATM.
2013-03-07,4,Bottom line - Fantastic food.  I came here after a number of people recommending it as well as the stellar yelp reviews.  Came on a Tuesday and the place was almost empty when we arrived at about 6:45.  By around 7:30, the place filled up, the music came on, and it was lively and a great ambiance.Food:App - Mussels in the garlic white wine sauce. Entrees -  Rigatoni Bolognese, and the Shells with chicken, pancetta, and mozz in a red sauce. All the food was delicious and the prices were reasonable.  The waitresses were nice enough.  Great overall experience, will definitely be back.
2013-03-05,5,I must say that I really, really love Leo's. When I eat here, I feel like I'm eating in the Hoboken of 1952. The servers are a bit cantankerous in a fun sort of way, really adding to the atmosphere.The salads are kind of bland, but I never go to an Italian restaurant for the salad. I ADORE the mozzarella-topped garlic bread with marinara sauce. It's pretty much the reason I go there. Otherwise, the baked macaroni and gnocchi are delicious!!
2013-02-16,5,A+.  Leo's is the kind of place you eat at once a week.  the food is delicious, the service is great and the prices are very reasonable.  the pizza is great, chicken parm is great and the veal saltimbocca is my favorite around.  the place is always packed and there is a reason for it.  the ambiance reminds you that the place has been around for a million years and hasnt changed.  those who prefer trendy spots may not love Leo;s but i will be dining there often.
2013-02-01,4,Came to Leo's to celebrate a friend's birthday with her family, and had a lovely time.  Leo's is a bit off the beaten path in Hoboken - a few blocks west of the popular Washington street strip.Uncomplicated and thorough Italian options on the menu - we started with an antipasto, which had amazing eggplant & ricotta bites as well as fried clams & shrimp.  Homemade  Italian bread as well.I tried the house specialty, the Chicken Sorrento - a balsamic glazed chicken with a strip of eggplant, mozzarella, red sauce, and penne.  Bangin' combo. Also tried a friend's vodka sauce - SO good.  Would go back to order anything in that sauce again.
2013-01-07,5,We visited Hoboken to pay our respects to the Chairman of the Board. The Frank Sinatra Birthplace is nearby on Monroe. We walked in at 4pm and unfortunately the dining room was closed. But, the bar was open! Sergio is the man in charge hear and he made a good stiff scotch and soda. We dropped $5 in the Juke Box and listened to Sinatra and Count Basie live at the Sands. I perused the pictures on the wall and sipped my cocktail. The place was a great place to rest on a cold January day after hours of walking Manhattan and Hoboken.Sergio was very kind. We had asked for another place to eat since the dining room was closed for another hour. He said this was the best place in town. And I must admit, he was right. We stayed in New York for a week and this was the best meal I had the entire 8 days. This is the place served up the best Lasagna I had ever had in my life. The meatballs were to die for and the sausage...oh the sausage was delish! So glad we stayed for dinner. Everything is right about the place. The history, the vibe the location. I don't know when I will be in Hoboken again but I will gladly come here again. Great food, great service, great place. You MUST eat here if you are a Sinatra aficionado.
2013-01-03,4,Family owned, waitresses that have been there for a long time, Frank tunes on the Juke Box, cash only.  Classic red-sauce Italian that is a pleasure to revisit. Food is good, ambiance makes it better.
2012-11-10,4,Service was super-friendly. Ordered clams oreganata and penne alla vodka with shrimp to go. Took it all over to the hubster while he was on break at a gig he was doing while in town here. Even lukewarm, everything was delicious and the shrimp were plump, meaty, fresh deliciousness. I had to ask for plastic ware (was only given one set) and there were no extra napkins, Parmesan, red pepper flakes, or olive oil put in my bag. Not sure if that's an east coast thing, but the food was delish and needed no extras so its all good. Would've liked to dunk chunks of that crusty bread in some garlic and evoo though...
2012-10-22,5,After visiting Hoboken for more than three years, I finally checked out Leo's. It was great! Very old-school Italian vibe, and the staff was really friendly and welcoming. We had to wait just about 15 minutes for a table, but there was a spot at the bar, so we had drinks, and the wait wasn't a big deal at all. When we sat down, the waiter brought us a basket of bread... seriously delicious, warm, crusty, bread. We ordered the mussels special to start, with corn and tomatoes in a white wine sauce, and they were fantastic. The rest of our meal was great, especially my penne with vodka sauce. Our entire meal cost about $80, including alcohol and tip... not bad for a Saturday night in Hoboken. I'd definitely go back!
2012-10-16,4,Food is delicious! The inside is somewhat dated and run down and the staff is a bit older but the food makes up for it! Great Italian- cant go wrong.
2012-10-11,4,Great place to eat in Hoboken.I swung by here with a date on a Friday night. Managed to have seating within 10 minutes - so ultimate win right here. I found the service quick and attentive despite how rumbustious the place was at the time. I don't recall her name, but our waitress took great care of us. Very friendly. Seriously. Mega-friendly, even.Food was fantastic. Both times i've been here, I've had meat raviolis & the baked ziti. Simply to die for. You will not find anything wrong with the pasta selection here - they know what they're doing and they do it well.Prices are good.Two thumbs up here. I'll be back here many times in the future.
2012-10-02,5,This is probably my favorite place to eat in the entire world! I had family that used to live in hoboken back in the day and they came to Leo's all the time. As a child i was brought here as well and always had fond memories of bar pies and pasta just as if my mother made it. Yes, i am Italian, and it is very important to me. Being at Leo's is like being at home surrounded by family enjoying great food. It's a very intimate place. you WILL rub elbows with people and wait in line for the bathroom, but the food makes it all worth while! The only thing that never liked was the parking and the fact that they don't take cards. For the parking, it's hoboken. what can you do? get there early or go to a parking garage. For the no credit cards, they've been doing it by cash for years. you'll just have to bring some. I think they might even have an ATM to use.
2012-09-13,3,It's fine. Nothing particularly special. Okay food, okay service. Affordable, good if you're craving some chicken francese or something.
2012-08-27,4,Great. Food and inexpensive.   But. Not. Accessible. No. Parking.   And.  The. Service. Ends. Too.   Early.  Kitchen. Closes.  Early. Xcept. On. Friday. And. Saturday.     Good. For. People. Who.  Live. In. Hoboken.  AreLocals and. Can. Walk
2012-06-26,5,I googled "Best Italian Restaurant in Hoboken NJ" and this place appeared on my Blackberry. So I HAD to investigate as I have yet to find an amazing Italian place in Hoboken. This place is not on the beaten path; it is tucked away, far from Washington street where it's ALL about location and less about taste and service. The waitresses, two lovely ladies who happen to be sisters, are super friendly and endearing. They bend over backwards to make sure you are taken care of and get your order exactly how  you want it. The place is clean and is clearly a tribute to Frank Sinatra (who was born in the same hood and used to frequent this place ages ago).The food is SUPER yummy. Authentic Italian all the way AND moderately priced. They have a cool looking bar where locals sit and chat to the bar tender in a separate room. You can tell this place is for the locals, by the locals. I heard the owner died a few years ago but the staff still speak kindly of him and want to uphold his high standards. This place is so cozy, friendly, tasty and cool, I am going to become a regular. LOVES IT!!!For once I've nothing negative to say. Meow.
2012-05-21,2,I've been raised by Italians my whole life; this is NOT Italian food. The prices are reasonable and the staff, attentive; however, the food itself was below average. My linguini with clam sauce was swimming in butter. My boyfriend also got a pasta dish where butter seemed to be the main (if not the only) ingredient. While there were actual clams in my sauce, there's no question that the rest of the clams were canned. Our hot antipasto consisted of all frozen, deep fried, finger foods. To top it off, the soda was  disgustingly flat. Try washing off two day's worth of oil and grease with flat soda ... it's the worst. I'm usually very generous with my ratings, but when the best part of the meal is the bread that's served at the beginning, the place deserves only 2 stars ... at best!
2012-05-21,1,So I go with the gf because we feel like some Italian.  I lived down the block from this place for a year and never went in.  Too bad I had the bright idea to try it today.  We got the hot antipasto or as it should be know the pre frozen deep fried special - fried ravioli, mozz stix, and some pre frozen mussels marinara to boot.  Oh there were 2 baked clams in there as well.  Nice the waitress failed to mention this as we also ordered a dish of baked clams.  Maybe we would of stuck with them or got something else, as a former waiter, to me its just good service to mention you are getting the same thing in 2 dishes.On to dinner, yes the hill only goes down in this place.  I got linguine carbonara. Pancetta instead of bacon, yes it should be a nice dish.   I got a child's portion of pasta swimming in cream sauce.  The amount of sauce (heavy cream and butter) could have been good for 5 lbs of pasta.   The gf went for linguine with canned white clam sauce.  They actually threw  in 6 real clams to top the dish off.  I guess even they have limits on the minimum acceptance of the slop they serve.Leo's is def in my top 3 most disappointing meals of 2012.Leo's Grandevous - OUT!  do yourself a favor and Rendezvous elsewhere.
2012-05-14,5,Love this place! I've been eating here with my family for years.The food is delicious, the portions are large, and it's reasonably priced. The servers are extremely friendly and attentive. I would recommend the Mussels, the Meatball and Prosciutto Pizza Pies, the Linguini and Clam Sauce, and the Veal Parmigiana.  All very great choices!
2012-05-13,2,Blandest pasta I've ever had....real Italian food when they don't even have fresh Parmesan??this place had its hey day but now is just a run down place that's getting by on the glory of its past....
