2021-11-04,3,3.5*sI have been to Monroe's several times and spanning various experiences - from happy hour to full meals.  Each time I visit, I leave with the same feeling that the drinks and vibe were great, but that the food was simply OK.  While the menu is extremely unusual, the preparation can fall a bit flat.I will try to summarize a few of the menu items that I have tried.  From a beverage perspective, I do love their Avissi Prosecco from Veneto, Italy, which is available by the glass and also during their happy hour.  Their cocktails change seasonally, which I appreciate, and a recent one that I tried was the Dressed to Empress.  The drink included Empress Gin, Grand Marnier, lemon juice, peach puree, Junmai Sake, and club soda.  When the pretty orange beverage arrived, I took a sip through the straw and found the drink super sweet and juice-like.  However, after a quick stir, the cocktail became much more balanced and enjoyable.  When it comes to the food, I have mainly tried their seafood dishes.  The Misfit Tacos came in a trio and consisted of raw salmon, red onion, jalapeño, and a ginger soy sauce, all within a heavily-fried shell.  Though the fish was fresh, I was not a fan of the crunchy shell, which had reminded me of an egg roll wrapper.  The Eel and Avocado Roll was tasty, but rather mushy and a bit too warm temperature-wise.  The Salmon, Avocado, and Mango maki was an improvement, and the included fruit added a refreshing sweetness.  The Sexy & I Know It specialty roll was decent...The inside included cooked shrimp, cucumber, and mango, while slices of seared scallop and avocado were draped over the outside.  There was supposed to be a wasabi truffle sauce included, though, looking back, it had not been.  Lastly, my companion had stated that their Angus Sammy Burger was also just fine, and after sampling one of his accompanying French fries, I found that they tasted like they had been frozen; they were also very bland.I will also note that there is a Prohibition-style cocktail lounge called The Sinatra Room that is hidden behind a bookcase in the basement.  This was a cool space with a separate beverage menu.  I wound up just getting an Aperol Spritz there, but it was a well-made one, and I did enjoy the hidden, secret atmosphere.While I like the vibe Monroe's is after, I think the food could be a bit better.
2021-11-03,1,DO NOT EAT HERE! I made a delivery order last Friday night as I was craving some sushi and had been to their restaurant before and enjoyed the food. Huge mistake! My food arrived and as I opened the container to one of my meals, a small COCKROACH crawled out of a sushi roll and on to my table. I was so shocked and immediately called the restaurant to inform them of the situation. They validated what a problem having a cockroach in my food was but then told me their manager couldn't be available at the moment and would get back to be ASAP. Personally, I think that's ridiculous that a manager couldn't step aside to discuss a roach issue with a customer but I let it slide being that it was a Friday night dinner time. I've worked in many restaurants myself so I tried to be understanding of that. A few days later....no one reached out. So I called back to re-introduce my problem and get in contact with a manager. Again, no one was available to speak with me. They then suggested that I email the manager myself to request a refund and discuss my situation in which I said absolutely not because I should not be the one hunting down their management to get refunded for a roach in my meal. It's been almost 6 days now and I STILL HAVEN'T HEARD BACK. I'm absolutely shocked and disappointed in the lack of follow up and "service" of this business. I haven't even received a refund for my meal yet which I entirely threw out after finding the roach to begin with. I will absolutely not be giving this place any further business and will make sure to spread the word to family and friends not to either. Roaches and poor customer service. No thanks!
2021-10-26,5,We've eaten dinner here many times and the food is always delicious and the atmosphere is fantastic.Recently we hosted a baby shower here. Yin the manager was very nice and super accommodating. Everyone said they had a great time. A few people said "when I have a baby shower, this is what I want." The day couldn't have gone better.
2021-10-23,4,The drinks here are amazing. The flouts flower bomb is probably my favorite. I love the theme and decor and this place has one of the best happy hours in Hoboken. The food is OK - I tried the guac with dumpling chips. The guac was amazing but the chips just tasted fried and lacked flavor. You can't go wrong with their sushi rolls though!
2021-10-16,5,I hosted my 27th birthday party at The Sinatra Room (in the basement of Monroe's) and can't say enough good things about it! Firstly, Yin helped me plan the private event making sure that every detail was perfect leading up to it. I even got to choose 2 signature cocktails (and name them!) which were presented to my guests in a cute frame. If you have been here before, you know that the music, food and vibes are on point and this night was no different. The bartenders were great too and made sure that our glasses were never empty during the open bar! I would host an event here again in a heartbeat.
2021-09-25,3,so here's my take on Monroe's. The service is absolutely horrible, there is no other way to put it. They need to either hire more waitresses or get better ones. The food was good but the sushi took over an hour to come out and was definitely sitting out got a while and the drinks were rushed and not amazing. This place has the potential to be great but service is super important and needs to be handled first.
2021-09-25,1,I want to start by saying the 1-STAR review has nothing to do with the food. The food at this establishment was AMAZING but the service is HORRIBLE and for this reason I will NEVER be returning.We had a 7:30 pm reservation for 6 people. As soon as we sat, we were greeted and asked what type of water we want. We ordered drinks and they took awhile to get to us but we were okay, it was Friday and we were busy catching up.We order 4 appetizers. They take awhile too. During this a drink is spilled on my by accident by the waiter. No biggie, accidents happen. But I was wet and sticky and surrounded by glass. A bus boy came to clean it up and didn't clean under our table just around us. The waiter was SO apologetic. Randomly 30 minutes later (after ordering a second drink) I get a drink from the manager to apologize for the spill for a drink that I did not like from the first go around.Then we order dinner. We were with my pregnant girlfriend. We specifically came to this place because they have cooked sushi options. My fiancé and I actually raved about it because we came in the spring with family and LOVED it. My girlfriend confirmed her rolls with the waiter and he checked with the cook to ensure it would be safe to eat. We order dinner and continue to catch up.Then two hours go by. It is almost 10 pm and we do not have dinner nor has anyone come to check on us, ask us to order drinks or even fill up our water glasses! We go and speak with the hostess and she goes to check on our food.Finally the food ones... all on one plate for 6 people. We ask the hostess and waiter which rolls are which and get conflicting answers. Now I am a picky sushi eater, I want what I ordered and my girlfriend is pregnant - she does not want to risk eating something she isn't supposed to be eating. It is chaos. Finally the manager who is also pregnant (whom must of said that to us a million times) said she eats this roll and points to a roll all the time and she is fine. Well I am sorry that answer does not sit well with us. We did not drive an hour away to for cooked sushi that we think my pregnant friend could eat. She did not feel comfortable eating there so she did not.We asked to speak to a manager and we informed by the hostess that she was the manager. Instead of apologizing all this manager did was make excuses. "I am 6 months pregnant," "We are slammed tonight," "It's his 4th shift," "there is a language barrier with the chef." Not once did they own up to their mistakes and apologize. Then she left us and never came back to check in or apologize or work anything out with the bill.We also had 9 pm reservations in their speakeasy for a night cap after dinner. Needless to say, we did not want to go. The manager saw us leaving and finally came up to my fiancé and I when our 4 friends had already exited saying please come down for drinks, we will comp  them. I told her how embarrassed I was for dragging my friends an hour away for an evening that was anything but horrible and  that we just wanted to go home. Again instead of apologizing all she did was blame her pregnancy and how packed they were.It was honestly THE WORST DINING EXPERIENCE I HAVE EVER HAD.The chef is amazingly talented though - the food was bomb. However Monroe's needs to restructure their staff because it is being poorly managed and driving customers away from such a gem.
2021-09-24,5,Cool vibe, Unique menu,  lol the tacos are mini but if you  more plates you will be fullFun dinning experience Amazing service, Hannah is a sweat girl that took great care of our table
2021-09-22,5,The food and drinks were on point and the service was spectacular. I've went back more then once because I love the food
2021-09-20,2,I do think this was just a bad night. We waited for someone to take our drink order for only a couple mins. But then 3 separate people came out to take it. They didn't taste right but they were just strong. We finally ordered after another good 10-15 mins. We tried to order another round of drinks but none of them came out right. Come to find out their bartender had walked out on them. We decided to call it a night and just asked for the check. It was impossible to get any service at that point. When we got the bill we saw they had charged us for numerous drinks we had never received so straightening that out required the manager who actually said to us "look, I'm tired and pregnant" - guess the customer isn't always right. Maybe we'll give them another try. But the prices were high for such awful service.
2021-09-10,1,No stars.  None.  This place is a disaster.  The worst dinner experience ever.  Service was horrendous.  Our drink orders were always wrong.  Always.  At times the waiter tried to pass them off as being correctly made.  Not even close. Most times they never reached our table.  We complained over and over and we were told they were sorry.  Over and over again.  But no attempt was made to rectify. It just got worse. We asked for the check which the gave to us promptly. Imagine that. The check had $100 + of drinks that we ordered but never received.  Never received.  The ones that we received were wrong. More I'm sorry's.  I was with an  important business client and his wife.  I was mortified.  An absolute dumpster fire. Avoid.  This place is an embarrassment.  They didn't even have sake and they service sushi. Epic fail. You deserve better.
2021-08-26,2,I have returned numerous times. The service here is really really bad. Slow, forgetful, unattentive. Sat outside and got ignored. Sat inside with few other tables, and got ignored. Honestly, good food but go to Saku instead for sushi
2021-08-01,1,Just go for brunch, you'll see! Slow service, mediocre food, lack of management. $0.99 drinks with brunch entree but it takes 99 mins for a refill!
2021-07-17,5,This place is the full package. You can make a whole night out of dinner, the Sinatra room, and the events they host. The food, specifically sushi was great, cocktails were awesome, and service unmatched.
2021-07-15,2,Last night I came here for friends 30th birthday with my girlfriend. The drinks were good, a little on the stronger side, but good indeed. The food options were delicious and no complaints there. The only thing that bother me was that there was more than 30 ppl in attendance and not one fork or spoon for the sauces was in sight. I mean come on I get it's finger food but it's party you should be prepared with silverware and napkins not just food on plates for ppl to pick with their hands. Besides that the staff was pretty great. JoJo I think her name was soo nice and kept the party goers entertained. A1 service from her and the lady that was running the food and swiping cards for tabs. The bartenders on the other hand, little short Spanish lady, didn't get her name but could careless for it anyways, but if misery was a person it's her. My girlfriend tried to strike up some friendly convo to only be hit with a nasty and rude response. Ignored me to use her phone while I was standing there waiting for a drink and they asked someone else who came up after me if they needed help. Smug attitude like she didn't want to be doing this party. I mean come on. I've been in the industry for years. If you're bartending you should be smiling and inviting so people will want to come back. I mean Jesus what's the say? "If you don't like your job then quit!" Literally written all over face how she wasn't haven't it. I give it to her for making good drinks but shit girl smile more you'd make more in tips and people would actually want to come back and see you. Other then that one bad apple I had a good time and thank everyone else for playing their part...
2021-06-28,4,Nice jazz band at summer nights. but in terms of the capacity, you may need to ask for service a couple of times. Overall it's a good place to chill  and chat.
2021-06-27,5,This is a pretty nice spot. Food and drinks were pretty good ! Can't complain about the service, our waitress was very friendly and attentive
2021-06-25,2,I came here for brunch with a group of women to celebrate my friends Bachelorette party and her birthday party.  The restaurant is really nice aesthetically both inside and outside which will make for great IG posts. The menu is interesting and the food was good I had one of the poke bowls and I cannot complain.  Where Monroe's falls short is their service.  Our waitress was less than hospitable and appeared to be bothered. There is a choice between mimosas or bellinis which are reasonably priced for brunch. When people in our party were ready for their next drink they were told they needed to finish what was in their glass before another one would be given as they use the same glass. So at one point our waitress was taking all of our glasses away to refill them with mimosas but how could she possibly know which glass beloved to who? This seems like a very unsanitary practice to employ. Also before they would bring out our meals she said that the appetizers needed to be finished first, it just felt very controlling. Then when it was time for the bill we saw that gratuity was already added which explains the poor service.  I think this restaurant could provide an overall great experience if they focus more on service as well as not reusing glasses and making guests finish their apps before their meals would be brought out.
2021-06-12,3,Food - CreativeAmbiance - Old SchoolMusic - Lovely  Service -GreatSo why three stars?Flash Migraine inducing photography!
2021-06-10,4,Nice sushi menu , bar is good for cocktails and sheeshas. They have amazing outdoor sheeshas which are seasonal. Overall a nice place in Hoboken to meet friends or have relaxed time with your better half
2021-05-28,2,Poor customer service all night-- took forever to greet us and take drink orders, food came out at separate times, no soy sauce for sushi rolls, etc. Then slapped our party of 5 with the 20% auto gratuity which was policy for parties of 6 or more. Not classy-- won't be back!!!
2021-05-22,1,This place was absolutely terrible, first of all their was no AC and it was 90 degrees inside the restaurant. The sushi looks like it was made 2 and half years go. Please do not go here. I promise you will be wasting money. 160$ for 2 people. I would've rather had a dirty water dog.
2021-05-22,1,Such a scam, they charged us $40 for water?!?! This is absolutely ridiculous. We asked for "still water" over sparking, after given only two options. Thinking "still" was the only option that wouldn't cost me the equivalent of a bottle of wine. I asked to speak to someone about this and was immediately brushed off. BEWARE would not recommend. I am highly disappointed in the service. $40 for water?! Thanks Monroe's. I won't be coming back.
2021-05-22,5,Great service, food, etc. The staff is so sweet and the food and drinks are exceptional !!
2021-05-15,3,The food itself was tasty, but the entire atmosphere was quite strange. All of the decor was themed based off of Marilyn Monroe but the food was a asian fusion with sushi being the majority of the menu which I was not expecting. The lighting was very dim, making it hard to see the people I was at the table with and the music was very loud so I needed to shout to be heard.
2021-05-08,5,I loved this place! Great atmosphere! Amazing service! Amanda was amazing. Argenis was wonderful too! This place is great but make your reservations before you go! You will not be disappointed
2021-05-07,1,Super disappointed. I got there at 845 pm and ordered within 10 minutes. We did not receive our food until 1045. Once we received the food it was not good. Not only did we not get a single apology but we were asked twice how everything was before we got our food. Lol. On top of that. We paid $260 (before tip, it wasn't the waitresses fault) for mediocre food and a 2 hour wait for food.
2021-05-05,4,Was super surprised to see the inside looked the way it did. Had never been here before. Really dark but definitely like older times vibe. we had sushi and two Asian appetizers which were all amazing. Drinks were good, but service was slow which is my only complaint. Food runner was so so friendly!! Will definitely be back.
2021-05-05,4,This is the second time I Have been at Monroe's.  The first time I was hear, I sat outside. I ordered a few drinks, calamari, sushi rolls and a hookah. This time outdoor dining was not open (they were shooting for may).  There were only a few tables when we sat down inside and the service was alright upon arrival.  We ordered the chips and guacamole to start. These were pretty good.  We also ordered a few rounds of drinks (beer and a margarita). Both were pretty solid. By the time we went to put in the rest of our order the place filled up in front quickly.  The staff was definitely overwhelmed.  The forgot on of our apps but blamed it on another server for not ringing it in and then later saw it on our bill when we were closing out. The food here is really good and the pricing is reasonable.  Once they hire more staff for the summer I'm sure the service will be back to normal.
2021-04-28,3,We got there pretty early and was one of three tables. Service was pretty good from the beginning since it was pretty slow. As the night went on the tables started to fill and the servers were def overwhelmed. If they had more staff this place would be dynamite. The food was pretty decent. The wings had really good flavor, guacamole was alright, actually liked the chips more than the guacamole. The sushi roles were good and fresh. NThe atmosphere is really cool in there with a good vibe. There is also a speakeasy downstairs that seemed to be pretty busy. I'm assuming the staff was split between those two spots which definitely hurt the Resturant a bit. I'd like to come back once the outdoor space reopens. They have really reasonable prices on the food as well, would like to try a few more rolls next time as well as the nigiri. Hopefully they are able to get a little more staffing by the time the busy summer roles around.
2021-04-03,5,Firstly, I just wanted to say thank you to the entire staff. My party of 3 last night had the best time, and I cannot say enough good things about the entire experience. The staff was attentive, friendly & incredibly knowledgeable. The drinks were amazing & it was the perfect night, really. I have not felt comfortable going out AT ALL minus the essentials during COVID times & Monroe's/The Sinatra Room staff put my mind at ease completely. It was so worth making reservations & having to wait a little. Seriously- come here!!!
2021-03-30,5,What an amazing experience! We made reservations for a large group for a Friday night and due to COVID were highly concerned that they could not accommodate us.  However, the manager made sure to go above and beyond to make sure we were taken care of. The place is very nicely decorated with a decent amount of tables.  there was also live music which was a great touch to our night.  Additionally, the service and the food were both great and overall we had an amazing night.  Thank you to the management team for truly taking such good care of us!
2021-03-29,1,HOLY CRAP! Good luck trying to get a reservation to the new Sinatra Room with these INCOMPETENT fools. I've been trying for weeks to get a damn reservation, and it's been the most painful experience in my lifetime. Reservations can only be made via email, and they have idiots handling the account. "I'll take your first available Friday or Saturday in the month of April for 2 ppl between 7-9pm". WHAT IS SO DIFFICULT!?? It is beyond infuriating that this moran cannot comprehend what I'm asking. 3 days in between each email correspondence for stupid follow up questions with incorrect information. I was so excited to come here and try out the new drinks. Until you can get some competent staff to take reservations or better yet, a reservation system that is not via email - I would love to one day try this place. How can I give YOU a date when YOU are all booked up?! I'm asking YOU for your first available date! Wtf is so hard to comprehend???
2021-03-29,4,I have mixed reviews on Monroes. The ambiance is awesome. There was a live singer and then great music afterwards. Drinks were pretty good but nothing crazy. Huge food selection! We got the Tuna Rice Krispies and wow, definitely my favorite! Also got the Yellowtail tacos and the Cod Bao buns, both were good but wouldn't get either again. As for the sushi, our two sushi rolls tasted very similar/bland despite being completely different fish. Service was really great and attentive in the beginning and then started to dwindle. Our sushi entrees were brought out with our apps, which was overwhelming. I also think we were given one wrong sushi roll but our waitress swore it was correct. We then waited a good 20 minutes after dessert just to see our waitress and ask for the check. Overall, I would go back and maybe try a burger and then hit The Sinatra Room downstairs for some cool cocktails.
2021-03-27,4,Our daughter, who lives in Hoboken, took us to Monroe's and we had a great experience, except for the noise level.  We were a party of 5 with her roommate and her roommate's boyfriend joining us as well.  We all had a very difficult time communicating to one another across the table.  I thought it might be due to our age, but given that my daughter and her two friends were in their early to mid-20s and also couldn't hear, we felt the noise level took away from the wonderful experience of the restaurant.  I mean, who goes to a restaurant to not talk?  We asked the wait staff a few times if the music could be turned down, but they were unable to accommodate us.  Oh, I should mention that the live music that evening (March 19th) was fantastic!  She was a great singer and had a beautiful voice, but again, the only problem we had was that we couldn't communicate amongst ourselves.  The table just in front of the singer was a bridal party and they had no problem screaming at each other to be heard, but to the detriment of the performer who probably picked up on some of their screeching in her mic.    Anyway, overall, good food and fun drinks were had!
2021-03-24,4,The ambiance and decor was a cool vibe! The menu had a bunch of interesting options to choose from. The Asian fusion sushi take menu with a pop ambiance made this a fun experience. The actual food itself was good but could use more flavor.
2021-03-11,5,Monroe's holds a special place in our hearts. We have been twice, both for Drag Brunch, and the energy is u matched. The staff is welcoming and professional, the owner Melanie is amazing, and the performers and vendors brought in our so much fun! The pricing is so great for a 3 course meal and endless bubbly and it's sooo good. From sushi, to burger, to steak, to dessert it's all so good! We have planned this for our anniversary dinner this year and we can't wait for the next Babes who Brunch! Make a reservation here, it is a must!*returned last night and Alondra provided amazing service again! Sushi was fresh so great see the pizza guess below!
2021-03-06,5,Monroe's has excellent service and great  food!  Tables were socially distant and all staff wore masks and practiced Covid safety protocols.Make reservations for the Sinatra Room a secret bar located downstairs of Monroe's.For our GNO, we shared the wings and guacamole for starters. I ordered a Hoboken Girl hard seltzer, and my Girl Gang had some mock-tails and cocktails.I ordered the Sammy burger- tasty juicy burger with cheddar cheese and bacon on a soft bun served with crunchy fries. The menu had a lot of sushi rolls and unique fusion dishes. We didn't have dessert because we head some drinks at the Sinatra room downstairs.Looking forward to coming back to try the brunch!
2021-03-06,5,This bar has the best service in Hoboken. The food is great and the vibes are even better. The hostess's kindness and compassion blew me away. I believe her name was Erica. I highly recommend Monroes!
