2021-03-05,5,Monroe's is fantastic! The night was great, we got to see the speakeasy, try some delicious cocktails and the food was great as well. The server was accommodating and kind. I will definitely be back!
2021-02-28,5,Came here with my husband to celebrate our anniversary and I'm so glad we did. Started with dinner at Monroe's. The food was so good and fresh. My favorite appetizer was the misfit tacos, we had tuna and they were delicious. My favorite sushi roll was I only love my sushi and my momma, I want to go back for that for sure! We were super impressed with the quality of the sushi.  It was so fresh, perfect temperature, and prepared perfectly. The cocktails were very good and nicely presented. We will definitely be back in the future. The Sinatra Room. Loved it! The service was great, the cocktails were delicious, and the ambiance was perfect. Also, the bar so was so clean. The server thoroughly sanitized all areas every time a party left. My favorite drink was And then he kissed me, so refreshing and tasty. My husband really enjoyed the Life is but a dream. Copacabana was also very good and easy to drink. We loved the decor and the set up. The drinks came out quickly considering they are cocktails and take time to prepare unlike a simple rum and coke or just ordering a beer. We had plenty of time to order all the drinks we wanted even with the 90 minute time limit. Can't wait to be back with some friends to enjoy these delicious cocktails.
2021-02-28,2,Real shame, real shame. Good food, awful service. Saturday night date nights should be memorable, but when the entire staff forgets that you exist it leaves a bad aftertaste. We showed up ten minutes prior to our reservation, and as we were watching the high top I specifically requested (and was told by the hostess minutes prior) be cleaned off for our use, it was given to some snobby couple that walked in after us, and we were then given the table that they had turned down (I had SPECIFICALLY requested a high top). As I sat down I proceeded to unroll the napkin and my knife fell out, not a big deal, the hostess came and retrieved it, I never saw a knife again, isn't it common practice to replace dirty silverware at restaurants? Now, our server, if you can call him that, took over ten minutes after we were sat to pour us water, we were unable to order drinks or food quickly enough as he disappeared again. 7-10 minutes later he reappeared and took our drink and appetizer order. The crunchy rice cakes by the way are awful, Hudson and CO's are far superior, there is far too much rice in the ratio at Monroe's and it legitimately hurts to crunch, what the heck. Our server then dropped off incorrect drinks (that's fine because we weren't charged for them), and take our entree order, this would be the LAST time we would see him basically all night. The hostess came and cleared all plates, chop sticks, and silverware, giving us a gentle nudge to leave, only thing those were our appetizer plates and we hadn't even seen our entree. So when our entree was brought out, we had no utensils or plates to speak of, had to flag down a completely different server to provide us with the essentials, oh and soy sauce doesn't come with their sushi apparently, had to ask for that. By this time my beer was empty, and the server glanced from a few feet away as the other server brought us what we needed, obviously assuming he didn't need to help us since another staffer did? Wrong. I watched as our actual server chatted up other servers at the bar POS system, in plain sight of everyone in his section. I never got another beer, and the server had the gall to show up an hour and twenty five minutes into our reservation to see if we needed dessert or drinks. No thanks. Real shame, because everyone had told me this place was such a great establishment. Best part of the night? Picking up Artichoke Pizza down the street to wash the Bad taste of this bs experience out of my mouth.
2021-02-27,1,Let me start by saying this is the coolest idea. The Sinatra room speakeasy downstairs has great cocktails. We did have to wait over 30 minutes for each round so by the end of our 90 minutes time limit, we had just received our third drink. We had booked a dinner reservation for upstairs at Monroe's after the speakeasy reservation. The speakeasy reservation ran over because the drinks so long so we went upstairs to the Monroe's hostesses about 9:30. I explained that we had made a post speakeasy reservation for dinner and the reservation downstairs ran long. The one hostess told me to give them 5-10 minutes to clear the table and they'd seat us. After about 20 minutes, I approached the other hostess to ask about the status of our reservation. She nastily responded to me that i didn't actually have a reservation and that they were doing what they can. I told her I had both email and text confirmation of the reservation and showed her the text message. She then told me the table was being cleared and it'd be about 5 minutes. About 10 minutes later, she told me the party was leaving and we'd be seated. We waited almost an hour to get seated after initially being told it'd be 5-10 minutes.Once seated, we were not provided or offered water: the waiter came over and asked for our drink and small plates order. I ordered a couple of plates of the fries and we as a group ordered some cocktails and additional appetizers. A few minutes later, the waiter came back and asked for our entree orders. At this point, I asked for water because it still had not been provided or offered.We received cocktails before the sodas that were ordered. We receive entrees before the appetizers. The order of fries was a joke compared to the price. The slush orders did not come with soy sauce. When you asked for soy sauce, you received a tiny plastic container. The staff at Monroe's made us feel unwelcomed, and the drinks and food did not make up for it. This is a great idea with terrible execution. In addition, the women's bathroom was disgusting. It looked like it hadn't been cleaned in days and stalls were missing toilet paper.Do yourself a favor and go elsewhere.
2021-02-27,1,I really don't like to do this - please let me preface with that. But holllyyyyy cow.We started the night down in the speakeasy called The Sinatra Room. You get 90 minutes and only 2 cocktails. Grant it, the cocktails are delicious and the vibe is fun, but really? 2 cocktails in 90 minutes. Yikes.We had a reservation schedule for right at Monroe's after but after everything was said in done...we were late. And then they tried to say we didn't have a reservation. They would accommodate us though in 10 minutes (but really it was 30+).Don't waste your time at Monroe's if you want good service and good sushi. Especially for their price point. It is not worth it. We had to ask for water. It only got worse from there. We ordered cocktails and some non-spirits (literally a Diet Coke and sprite) and we got the sodas after the cocktails. LOL wut? Where is the logic. Our food orders were delayed and out of order. Sushi rolls and main entrees came before appetizers and sashimi. What we got was not what was pictured on their social. Don't expect to get soy sauce with your sushi automatically either - you need to ask for it.  Not worth it. There are better American/Japanese fusion spots in the area. I understand that the establishment is new and but yikes. There is a lot of room for improvement. A lot.Best of luck but I wish this was still Biggies.Also, did Frank Sinatra and Marilyn Monroe even eat sushi? Just wondering. LOLAnother edit: what is up with the sticky bathroom floors? And there was no toilet paper either? Lmao I'm so glad I can laugh about this with my friends. This is wild.
2021-02-27,2,I have no problem paying for quality but this was just meh. The food is not worth the price. The speakeasy bar is great but avoid the restaurant.
2021-02-14,5,Great place to go for a girls night or take a date out. I live the Roaring 20 vibes and the food was delicious. They had everything from sushi, seafood to steak. Out waiter also mention, it will now have a speakeasy bar. Follow Instagram for the password. Great place for a cocktail to start the weekend.
2021-02-12,5,Loved the service! The food was amazing. Usually i'm not a big fan of sushi since i'm a simple girl. but they changed my mind towards that! i loved the food so much, it was delicious and amazing. Also, the staff was so nice. they gave us everything that was needed and didn't have to repeat ourselves once. they did their jobs very well, i had a great experience overall. I was a little iffy due to the fact i've never been here but they didn't disappoint. I will be coming here every time i have a special event and will be recommending everybody to come to this place. Not just for the food, but for the experience and the staff. If i can give more than 5 stars, i will.
2021-02-11,1,Went for brunch. They had one waitress servicing in the entire restaurant. I was ordering regular cocktails (not even the brunch specials) and it was impossible to get fresh drinks. Two women who appeared to be managers were working ... but not helping the staff on the floor at all.They then started an Instagram photoshoot! They had a ring light that was  shining in our eyes. I didn't care for the strange asian-fusion brunch selection and the food was mediocre, too.Will not return.
2021-01-31,5,Loved their new cocktail and brunch menus. The atmosphere is great and always great food. Since i last visited in summer this place has come a long way and I'm excited for the new speakeasy to open. Recommend - Rice Krispies and I only love my sushi and my momma roll.
2021-01-28,3,I'm so glad this place is open during this terrible pandemic. Very nice atmosphere as well good drinks. Wings were ok sushi was magnificent. Would recommend for a nice cozy date.
2021-01-19,5,This place was a 10/10 for us! We went for Brunch on Sunday after finding out about it on the ig. The brunch deal is amazing - $25 entrees and then 99 CENT cocktails! Our waitress Alondra was absolutely lovely and so much fun. The restaurant was quiet when we first got there and followed all covid precautions. We will definitely be back and do recommend to anyone on the edge of deciding to go!
2021-01-17,5,Came here tonight and had the best time. The cocktails and sushi rolls were both amazing. Ordered the Spicy California, Shrimp Tempura and a Salmon roll. They were all phenomenal. I had a Moscow Mule. Ordered a second, that's how good it was. The cherry in the Old Fashions was great. Staff was super kind and attentive. Would definitely come back again. The bartender also informed me a speak easy will be coming in downstairs. Excited to check that out. 10/10 for me. I highly recommend this place. The rolls are decently priced. Nothing over the top. Specialty drinks are as they would be anywhere else. Make a reservation if possible. You won't be disappointed.
2021-01-04,4,Nice drinks, date night environment and HOOKAH! Our food was pretty flavorful. The drinks were a little weak but everything else checked out. I love finding places in the Hoboken area that support an urban crowd. Finally a nice place, great location, good food, decent music and hookah. Sounds like fun to me!
2020-12-30,4,The wings were tasty, even though they didn't travel super well (wings often don't). I could tell that they would be even better when fresh or even heated up in an air fryer. My cousin reheated the leftovers the next day this way and said they were better after being crisped by the air fryer. The wasabi blue cheese was very good. The wasabi was very subtle, not at all overwhelming, which I had been worried about because I'm not a huge wasabi lover. The rosemary fries were fun but steak fries aren't my favorite. I think they'd be better as smaller fries. I did enjoy the mustard dip option they came with. The green salad was ok. Nice fresh ingredients for sure, which I appreciated, but just a little over-simple. The adult kale seemed to be missing something, since it can be hard to eat raw and relatively  plain. I'm a kale fan, so I did eat it :)Very cool fusion menu here. the last item we tried was a sweet potato roll. I was tempted to try additional sushi rolls but there was already too much food for two of us :) Sustainable and nice packaging.
2020-12-14,3,We have mixed feelings about Monroe's! So the drinks were amazing. We got a complimentary tequila hot chocolate where they came over and roasted the marshmallows on top. I also got a drink called the butterfly effect that changed colors when you stirred it. So the cocktails here are 5/5 on presentation and flavor. On the other hand, we were not to impressed with the food. It was pretty basic calamari and a pretty basic burger. Nothing really stood out too us besides the drinks. So we recommend this place for cool drinks and appetizers!
2020-11-09,5,Try the lavender drink! Really fun atmosphere. The Rice Krispie apps were the best !!!
2020-11-08,3,I reviewed this place extensively before going, and  despite the mixed reviews, I went because it was a nice place for people who like sushi and are with people who don't, so I appreciate the variety in their menu. We got the beef misfit tacos to share (we knew that they were going to be that small), my friend got the Old Money pasta dish, and me and a friend got two special rolls, Lost Love & All I Need. The tacos were okay, I tried my friends pasta dish and did not like it all, it was very plain and bland; obviously nothing compared to pasta I could get at a real Italian restaurant in Hoboken, but it was fine for my friend. The rolls were fresh and yummy. We sat outside and the music was extremely loud and annoying to have to scream across the table to talk to your friends. Overall would probably not come here again, as I've better sushi elsewhere
2020-11-01,3,I would give Monroe 3.5 stars if possible. My boyfriend and I came here for a late dinner on Halloween.  We got the Blurred Lines and Butterfly Effect to drink and The Blind Date appetizer to share. The drinks tasted ok but we could barely taste the alcohol. The appetizer was tasty but expensive for what you get. The tostones could have used a little salt.To eat we had the Carraway pasta and Kennedy burger. The pasta was good and the burger was ok. Overall our experience was just very average.
2020-10-11,1,Wow!! just wow!! and not in a great way. First, I would like to say unbelievable! I thought Monroe's would be a great choice after passing along a few restaurants but boy oh boy was I wrong. It's a Sunday so they are serving brunch and the first disappointment  was the weird avocado toast which was on lightly toasted wonder bread with artificial crab meat that was Strike 1 but hey let's give it a chance right? Here comes second course this should be better right .. nope it gets worst, Mushy French toast with canned mango fruit and I guess it was also suppose to be coconut syrup. I took a bite and couldn't believe what they were serving not to mention the scramble egg and onion something something tacos (couldn't make out the rest) that also came to the table ... this is when I had enough and asked to speak with the manager ... here I am about to spend $80 for this?? Come on!  Okay I guess the drinks are cool and the atmosphere but what about the food? Maybe if I had got tipsy enough before eating at this brunch spot I wouldn't have noticed and my standards would have been so low that I would have been tricked to pay this bill.  But I wasn't there for the drinks I was hungry and wanted something good to eat. I asked the manager to allow me to pay for what I ate and not to serve me the rest. She came over with an attitude and continued to talk over me before listening to reasoning. It was set in her mind that their food is delicious and that I was going to pay the bill. I politely removed myself from the table to have a conversation with her on the side where others would not be interrupted while having their meal. She refuse to keep it between just us and snatched my money (upset that I only wanted to pay for what I eaten) said her kitchen is struggling and yelled for me not to come back. I was flabbergasted. So this is why I'm being treated this way because your kitchen is struggling??? I yelled back at her (mask on) Have a great day!! But she didn't like it that much and continued to share her unprofessional(ism) with her other guest and continued to talk about me as I walked away. All I wanted was to pay for what I ate and leave but she continued to send others out to talk to me and give me a hard time. Who does the hiring around here. I honestly feel anyone above her wouldn't be any different. The only thing I can do is not ever go back there. I didn't get her name but she claimed to be a manager. All I wanted for this Sunday is to get something to eat outdoors and have a wonderful day and I did just that I walked a few feet up to La Casa (latin American food) and the food and service was impeccable! Thanks for ending my day :) Stay Away From Monroe's if you want good food.
2020-10-11,5,Fantastic place. Sucks they opened when they had to but the staff is amazing and the food is incredible. Great place to go if you want sushi but you're with someone who doesn't love sushi. They have everything. Cocktails are amazing too. One of the better openings in Hoboken recently
2020-10-06,4,post-Covid, Monroe's is all the vibe. the music is lively, the drinks are fun, and the spacious outdoor seating and decoration is charming.went on a Sunday night around 7:30pm, energy was pretty low key but they do brunch so the attendance was fizzling out by then. a dynamic menu to choose from including sushi, burgers, salads, and tacos. seems crazy to blend all that but it works and it's all quality. service/our server was ehhh but the manager Ben is a way cool and generous dude that made our time memorable. cocktail menu is interactive and refreshing. great place for a 1v1 date or a group setting.
2020-10-04,1,Sadly, I had a horrible experience today at Monroe's that wasted 40 minutes of my time. Today, I made a 1 PM lunch reservation at Monroe's Hoboken and truly looked forward to dining outside and ordering sushi.When we arrived, it was slow to be seated. After seated for about 5 minutes, a woman arrived & nicely asked if we had any questions about the menu. We said no & stated we were ready to order. She explainedthat we had to wait for the waiter. I did feel bad noticing they only had one waiter for all the tables outside. Finally the waiter came to take our order at 1:40 PM. We waited a full 40 minutes for him to come. He then told us that we "had to order alcohol" and that we wouldbe forced to do a special brunch menu. I explained we don't drink alcohol but would be happy to order a la carte. He said no - we would have to order the pre-fixe brunch menu & that this came with a carafe of alcohol that we would be charged for, even if we don't drinkalcohol. Nowhere online did it say this when I made the reservation. Additionally we were not told this when we were seated. We had to wait 40 minutes for this news to be delivered. Truly upsetting and a waste of time since we left after that. To force people to order alcohol - and to not allow people to order a la carte is irresponsible. There was in fact a minor at the table next to us, who was not carded & he was gracious enough to say that he was not 21 - but then was still told he would be charged for the alcohol despite this. I won't return to Monroe's and feel these business practices and encouraging binge drinking is irresponsible. A carafe of alcohol per person is frankly ridiculous.
2020-09-30,4,Monroe's went above my expectations - pricey but the food is good. Came here twice during the pandemic and I felt safe both times. It's an interesting mixture of modern American Asian cuisine with a hookah bar. Starting with food, again it's pricey ($$) - rose fries (thick cut fries, not my favorite but you can't go wrong with fries)- cry me a river / onion rings: not worth $10. Thin slices, oily and not flavorful- misfit tacos: you get to choose 3 of the same tacos for $9. Super flavorful BUT small. Each taco is the size of a slice of orange - sushi: good combination of flavors. Didn't like that most of their specials had shrimp tempura since I have a shellfish allergy - skip the crispy fried cheesecake, it's just okay Hookah/shisha was a fun experience. Try it with the pineapple head for more flavor; and they give you individual tips to avoid contamination - a big plus during the pandemic. Finally, Monroe's is exceptional at service. Our waitress Z was really nice and helpful with recommendations. She made the experience worth it and from other yelpers, seems to be a common experience!
2020-09-27,4,Came here during happy hour and the outdoor seating is spectacular. They just hadn't updated their menu officially so a lot of things I wanted were not on the menu. Service was nice though!
2020-09-17,5,Love the brunch there !! My friends and I were walking around looking for a place and the outdoor seating area caught our eyes... The food was delicious.
2020-09-13,5,I was very visiting my daughter and this place caught our eye because she's vegan. Dang that edamame was amazing. My drink was so good, blurred limes. You gotta try it. I shared a burger with a friend and it was tasty. Had a very hard time deciding on an entrée because everything looked great but I realized sharing was better since we planned on drinking after.  Great staff and Vibe
2020-09-06,1,I was very excited to visit Monroe's for the first time! A different type of spot in hoboken with an Asian fusion! I went with five girlfriends for brunch. We arrived and were told we were not allowed to order any drink or item outside of the brunch price fix. We told our server we would be happy to pay the additional price for a different beverage since the price fix including beverages had to be ordered together. They were also out of 2/5 of the drinks on said menu. She told us no and then finally agreed to check, which was approved. When she came back she told us that was ok and she had recently started there. Understandable and a couple of us have been servers so we were trying to be nice. Every request was met with annoyance (basic things like salt/pepper, pitcher of water, etc). We had to ask for our drinks and items multiple times. The manager came over and was unapologetic and told us the bartender was busy and could not make additional sangria. The place was empty and when I went inside he had ordered domino's at the bar. The food was lackluster and one of my friend's got avocado toast which one side had no avocado.I never write negative reviews and normally give the server the benefit of the doubt but the lack of care was really what got me. The majority of the staff needs a class into speaking with people and customer etiquette. Icing on the cake 20% was included on the tip. So apparently they don't care about customer service since they know they're getting the tip. I didn't have it in me to argue.I left in a horrific mood which never happens to me post eating and drinking. Monroe's did that to me. Do not go!! Such a horrible experience all around. The one bright spot was the lovely employee who did not speak English and helped us adjust the umbrella that kept falling on us. He deserves all the praise and was so friendly and accommodating! He is why I gave one star.
2020-09-01,2,While the food at Monroe's was super good, their service was not. Our waiter kept coming over to us to tell us we only had a few mins left until we had to leave even when all our food wasn't on the table yet, we felt so rushed (on a night that wasn't even busy, majority of the tables were empty) We even ordered a hookah that took 30 mins to come out so we didn't understand how they expected us to just rush through our food and hookah when they were the ones taking long. -- once our friend came who knew the waiter personally, she never mentioned the time limit again which was so annoying because it just showed how when it's people she knew the "rules" didn't apply.
2020-09-01,3,Tasty food/drinks were good, and the service was alright. The music was extremely loud, it was barely 2pm on a Sunday. I asked if we could be moved because we were sitting directly under the sun and at first the girl told me there was nothing she could do about that but then she figured it out. I appreciated that but she should have not told me she couldn't do anything about it before trying something out. Something that I did not like was the added gratuity on to our bill, it was just two of us and the 20% gratuity did not add up the total of our bill. With tax our total came to $79.99, the gratuity added as stated on the receipt was 20%- $15. I am sure they manually imputed the gratuity because clearly the math does not add up. I am super generous when it comes to gratuity but when it's imputed on a bill of only two parties and clearly inputted wrong, it makes me question what other shady stuff they're up to...
