2020-08-30,1,Were really in a mood for hookah. Got there at 4pm on a Sunday. The hostess made us a reservation for 4:30pm which was fine. Waited by the water looking at the menu online and picked what I wanted to order. Came back at 4:30pm and got seated. They had my favorite hookah flavor, peach, on a  menu. However, the waitress told us they only had limited hookah flavors. So I had to order something else. I wanted to order the drink I picked and was told I can't do that and can only order from brunch menu which is served until 5pm. After looking over a brunch menu we decided we don't want eggs at 4:30 so we thought we can just smoke hookah and have drinks and wait until 5pm to order from regular menu (once brunch time is over). When the waitress came back she informed us that we can't just do hookah and drinks. We HAVE to order brunch or make a new reservation for 6pm and come back then. We just got up and left. Would be nice if all these weird timing and food ordering process would be mentioned online or by the hostess when we made reservation in a first place.
2020-08-27,5,Earlier this month was my first time dining at Monroe's and I already made plans to go back!!! This quickly became one of my favorite restaurants in Hoboken and our waitress Z was AMAZING. When I go again I will seriously ask to be seated at one of her tables bc she was that awesome. The food is amazing and definitely unique -that's what I love about this place is you won't get this food anywhere else. We had the squid rings as an appetizer which were incredible (shared with about 4 people and there was plenty to go around) & the old flame special roll for dinner (again, absolutely delicious). Would definitely recommend this place!! Even the cocktails were superior!
2020-08-27,2,I wanted to like this place (- I had a reservation)and try out the food. But when I went the Music from the live DJ was so loud. it sounded like a club! I had to practically yell  at the waiter was 2 feet away (that was the only way she could hear me) was the music going to be this loud the whole day? She said yes. There was no way I could eat and enjoy good conversation without yelling. 3 hours later the place was packed and the music volume was still lower but still loud you would have to really exert yourself to just talk. Outdoor seating is great, if  I have to yell more over the music defeats the purpose of safe outdoor seating- covid can spread in airborne particles. Specially if you are speaking louder and sitting on the same table.
2020-08-23,3,When we got there, our group was sat in an extremely sunny area, although most of the other tables were covered with umbrellas. When we asked to move somewhere more shaded, the host told us there was nothing he could do. Although eating while sweating profusely, the prix fixe brunch was yummy and more than filling. The included karaffe very likely had only a splash of alcohol in it, although it was refreshing. When our server realized how hot the plates were (from baking in the sun, along with us), she had a busser BRING OVER AN UMBRELLA. It was that simple, so it was evident the host was just shady (pun intended). The service otherwise was great. However, beware, gratuity is included (even for a party of 3!). While we fully intended to tip well more than 20%, this not being communicated was also shady. Probably won't be back but I enjoyed my meal here.
2020-08-23,1,Waitress would not keep her mask on. When it was on it wasn't on properly. Many of the waitresses did the same thing which confused us. Additionally waited 57 minutes for our food and things were still missing when they came out yet we were still charged for them in the end. When I asked about the missing food the waitress said "oh should I cancel it? Everyone's waiting." Wouldn't come back! I suggest working with the staff on proper hygiene during a global pandemic. The only people who were practicing safe measures were the awesome bus boys, we appreciated them for that. Perhaps promote them to waiters?
2020-08-22,5,Our waitress Zuleima gave us excellent service. The food and drinks were great. Zuleima made our stay very amazing. Great overall service. Will definitely be coming back.
2020-08-22,5,Zuleima gave us the best customer service I couldn't ask for any other waiter. Very courteous and had a strong understanding of what was on the menu and gave us great recommendations. I would highly recommend her for any questions on may have for a great night out at Monroe's. Thank you Zuleima, I drove an hour away to come here and you made it worth it.
2020-08-22,5,Food was great drinks were great ! and our waitress Zuleima was amazing ! for sure coming back !
2020-08-20,5,Service was great!!! Food was wonderful !!! Would come again !!!  Gotta try the Spicy California Roll !!!! Ask for zulima
2020-08-20,5,Zuleima was the best waitress! First time here and she definitely had the best recommendation for sushi rolls  would definitely come back
2020-08-20,5,Loved this place! Z was great- even when the food took a little longer she came over to update us and made sure we knew how much longer it would be. The tacos are tiny but DELICIOUS and the sushi was amazing. Definitely will be coming back!
2020-08-20,5,Monroe's is a great spot!! Great sushi and very Covid friendly! Our waitress Z made the experience very enjoyable!
2020-08-20,5,Z was an amazing waitress. The sushi was incredible and the service was 10/10. Great social distancing. Highly recommend
2020-08-19,5,Such a pleasant experience at Monroe's! The menu is pretty wholesome so you get a great variety BUT needless to say that the sushi is the star here. Fresh & delicious. Our service was also top notch! Our server, Z, was an absolute sweetheart who took the time to actually chat with us (but not overbearing!) She was attentive and just overall a great addition to the Monroe team!l.
2020-08-15,5,My best friend recommended we go to Monroe's for her birthday celebration and we loved it! Our server Z was nothing but excellent the whole entire time! Making sure we were happy and had everything we wanted. She also made sure my best friend enjoyed her celebration! The drinks, sushi and hookah we amazing!! Can't wait to go back
2020-08-15,5,I highly recommend Monroe's! I happened to stumble upon this place when I was walking by one night and finally had the chance to try it out ! The atmosphere is a great vibe and our server made it even better ! Make sure you ask for Z! She exceeded all of our expectations and gave us recommendations and would constantly check up on us , super nice girl ! Not to mention the hookah was great ! Definitely going back to try out brunch make sure to give it a try!
2020-08-15,5,My God where do I begin!? Came here with my home girl a few times already and the experience is to die for! Not only is the food impeccable but the service and hospitality during these hard times is top notch. The staff is so attentive and detail oriented which makes this place one of a kind. Hands down to their sushi and Margaritas the best I've ever had so far!
2020-08-15,5,From the service, to the food, to the hookah... everything about Monroe's in Hoboken is fantastic! I recommend it to everyone I know and they say the same. The fusion sushi is absolutely amazing - I suggest the Mistress, you won't regret it - and the atmosphere is comfortable during these Co-vid times. On the weekends they have a brunch special and a DJ playing outdoors! Gives you a little sense of normalcy during these times.
2020-08-15,5,I absolutely love this place. The food, the atmosphere, the service is truly top notch. Their dinner menu is to die for and just recently tried their brunch and it did not disappoint! This is a truly hidden gem and I will continue coming back over and over!
2020-08-15,5,This is one of my favorite restaurants. I went for drinks on the soft opening night and fell in love. I love the entire menu, both food and drinks. The sushi is soooo good. I can't even choose what to highlight because I love it all. Their brunch is definitely worth a try. The atmosphere and theme of the restaurant is so unique. I mean who doesn't love Marilyn Monroe?! The staff are very attentive and friendly. And they have hookah, which is a plus. Overall this place is welcoming and you leave happy and satisfied.
2020-08-15,5,Monroe's is such a fun restaurant/lounge! The staff is super friendly, the food/drinks are amazing & let's not forget that this is the first spot in Hoboken to have hookah!! If you havnt yet tried this place you need to ASAP.
2020-08-15,5,My friends and I came to this restaurant last night and let me just tell you.. the outdoor seating is SO cute! When we walked up to the host stand (because we had a reservation and also called to confirm we were set for 8:30 and were told yes) the host told us that she actually never accepted/denied our reservation. She then proceeded to get a little nasty with the one waitress and told us that "she's sorry for her(the waitresses) mistake but she guesses she'll seat us anyway" now myself and my friends all work in hospitality so right off the bat, we knew that wasn't the right way to handle a situation. As soon as we sat down THATS when our reservation was denied because we got a text message at exactly 8:30 saying so. But we weren't going to let the hosts rudeness get in the way of our night so we sat down and was greeted by the MOST AMAZING waitress named Emma. She was extremely sweet and gave us the best service we could ask for. The bartender Ben is also phenomenal! We kept telling him to make whatever drinks he wanted and every single one was great! I am so happy we didn't let the first impression of the restaurant make us leave because both Emma and Ben made the experience so fantastic and we will strictly go back to see the both of them!
2020-08-14,2,Main issue with Monroes is the lack of masks and hygiene for the staff.  Our waitress repeatedly removed her mask when taking our order and even when it was on her nose was popped out the top. Took longer to get the drinks then it did the food. I'm actually still here waiting for my entree when my friends had already finished their food. Overall the food is okay - wings were good but the sauce wasn't great, tasted like a blend of franks red hot and kimchi.Drinks are also alright but nothing to brag about.
2020-08-14,4,I loved the atmosphere and the variety of types of food on here! The sushi was good, our drinks were great, timing was good, and our waitress was very friendly!I give it a 4 due to the manager. We ordered a medium burger and it came out with raw meet still inside. We like pink, but this meat was raw. Our waitress happily took it back but a few seconds later the manager came back with the plate in hand and stated that this is what we ordered and this is how a medium comes out. We stood with our decision that it was raw to us, and we would like it cooked more. She proceeded to 'inform' us that it's based off temperature and this is what a medium always looks like. Without arguing we still wanted it cooked more. She said she was able to take it back to, but that "for our future orders there, or in any other restaurant" that is what a medium looks like. I've ordered many medium burgers and none of them have come out RAW. Just an overall aggressive attitude making it award for both the waitress and us. On top of that she stood at a high top behind our table and sat on her phone smoking hookah blowing it into our table. Like I said- good place, not great management.
2020-08-12,4,Monroe's did a great job with the outdoor dining space! Tables are distanced appropriately and it's fully shaded for a hot summer day. We enjoyed all the rolls we ordered! The system they have for taking down orders seemed to be a little disorganized but could have just been an off day- one waiter would take down drinks, another waitress would ask if we ordered our drinks, that same waitress would take down our food order, the waiter would come back with the drinks and asked if we ordered our food etc. But overall great ambiance, friendly service, and loved our outdoor dining experience!
2020-08-07,5,Came across this spot this weekend and what a nice surprise! The patio was perfect especially during quarantine, they had great sushi rolls (who would've thought) but the overall vibe was my favorite. Unlike a few of the "bro" bars in Hoboken, this place was perfect for hanging with friends and GREAT cocktails. I got the Cool as a Cucumber drink and it was light, refreshing and not too sweet; def recommend if you like gin.
2020-08-07,5,Stopped by this little known gem on a Friday night. The patio is beautiful and perfect for a date night setting or a Nice Sunday funday out in town. I've read a few reviews complaining about the long wait time for drinks. But anyone who actually knows about craft cocktails know it's not as simple as pouring a jack n coke so we didn't mind the extra wait especially since the place was so packed. I got the "Hbkn Smash" which was fruity and refreshing but still packed a punch with the bourbon. My girlfriend got "The Butterfly Effect" which comes with a whole show and dance at the table. We stuck to the sushi rolls which were mouthwatering and out of this world. Everything made fresh to order and it shows. Overall had a great experience and will definitely be back!!! Show support to your local businesses during these trying times
2020-08-06,3,Cute outdoor area but terrible service.  Took 20 minutes to get a drink and over an hour to get our food (we were only a table of 3).  Think they are understaffed and all would be fixed if they just added more staff (refill my water please!).  The waitress told us both the bartender and sushi chef were very busy so that was why everything took a ridiculous amount of time.  They also had someone walk inside without a mask and she walked by 3 staff, made it all the way to the back of the restaurant, and then was told to go get a mask.  This really bothered me - she should have been stopped at the door or by one of the 3 staff she walked by.  Food was average - wouldn't say it was necessarily worth the wait.  Sorry, Monroe's!
2020-08-04,5,Had to say, it's my first time dinning post-covid, looking forward to eating and lounging out. Monroe's met my expectations and more. The Hookah and service was just extraordinary, not only because of the nice ambience but mainly the service. My server, Zulina (Z) who was by far the most on point, friendly individual I met. She kept connected with her customers evenly and often enough but yet where it's not too much!  Just something I look for and promote in a restaurant. Definitely a spot to visit. Hookah is good!
2020-08-02,3,Went for $36 prefix brunch. It comes with a Karaffe of your choice. I ordered a mimosa. This drink did not have alcohol in it. I asked the waitress to go light on the orange juice but she reported they were premade. Basically you're getting orange juice and water? Possibly a splash of champagne? Otherwise the food was delicious. Definitely will be returning to try their dinner fusion options. The server was very attentive and the outdoor decor was "insta-worthy"
2020-08-02,1,It's a beautiful looking place. This was my first and last time coming to this cocktail bar.. The prices seem reasonable but the drinks were so water down with so much ice. It was terrible. We order a pitcher of the blond margaritas and it was like drinking a pitcher of lemonade. Even the capton and coke was watered down that my fiance ordered. The rose fries are gross. The fries was really mushy, soggy and cold in the center of them. We also ordered the Calamari which was also soggy and cold. I thought the choice of sauces with it didn't really go with the Calamari. Also the service was lame. The waiter wasnt friendly. We felt like they were rushing us to finish fast even though there was a 90 min time. They took our pitcher off our table when we didn't even finish it. And when we complained about the food the waiter did not say one word to me. The waiter even try to charge us extra for something we didn't get. This was the worst place in Hoboken. I rather have the old restaurant that was there before. This place sucks so bad.
2020-07-30,1,I went to this restaurant in July and it was a less than ideal situation. It took about 20 minutes for us to get our first drinks. I went with a small group. We ordered appetizers and entree at the same time. The calamari was bad and heavily fried. It came with dipping sauce of mustard, ketchup and spicy mayo (wtf?). The edamame was decent. I ordered a burger and the others ordered sushi. I got my meal about 10 minutes after the apps. The others did not get sushi until 60 minutes later. I expected the sushi to be shortly following my burger. As a polite person would do, I waited. We tried to order various drinks during this waiting period but we were told numerous times that they did not have the ingredients to make the various drinks. Things like a kamikaze shot, green tea shot, two different signature drinks they had on their menu, limes (at all). Not sure what restaurant doesn't have limes. We very politely were wondering why the sushi was taking very long and the manager told us the sushi chefs appendix just burst. I guess that was a very unfortunate circumstance. Either way, nothing was worth going to this restaurant. Don't.
2020-07-21,2,Heard about this place for sometime now & wanted to check it out. It has a beautiful eating set up outside with enough space to follow social distancing rules. Food was delicious (edamame, fried squid, lava cakes). Unfortunately the place is severely understaffed & it will have you waiting for a longggg period of time for things. Sooo, if you're hungry please bring snacks in your purse lol. If you're inpatient I wouldn't suggest going right now, especially in this heat. Or order everything in one shot.
2020-06-25,5,I went to wine and dine by myself and got the best experience thus far as a single wine and diner. I recommend this place for date night and girls night. It is appropriately sourced for both accommodations. I loved the food and drinks I cannot wait to come back here. Also do not forget the Palo Alto smudge when you go into the restrooms
2020-06-13,5,While both the food and service were excellent, the Friday night band was SO loud that we literally could not have a conversation throughout our dinner, making it NOT an ideal place to meet to catch up with friends. Our throats literally hurt from having to scream over the music to speak all night. It was only 7:30pm! Monroe's desperately needs to sound check but otherwise the menu was great and has potential to be fun. UPDATE: since our first time, we have ordered Monroe's pretty much every Friday during quarantine, and must say that they have been truly great. They are delicious, creative, and we genuinely enjoy the food so much. We love the sushi and appetizers. Definitely worth checking out for delivery!
2020-06-12,5,This place is off the hook! The food is orgasmic!! The sushi is unlike I've ever experienced. The buffalo chicken wings are beyond words with the blue cheese garlic dressing. It's a marriage made in heaven! Every single person in Hoboken and Jersey city should have the privilege to taste the delicacies of Monroe's. Ask for Argenis, he's a champ!
2020-05-14,4,I needed sushi last week! Like was on a mission but was nervous about quality- Monroes didn't disappoint! I ordered directly from their website (as many 3rd party are taking profits) and called to ask them to modify something and the manager couldn't have been nicer! She assured me everything was fresh and noted not to add salt to the fries. I offered feedback in adding a comments section to their site when checking out to avoid calls and she mentioned it was a new platform and appreciated my suggestion. I ordered Rose Fries ( they are very thick steak fries, not what I was expecting), 2 role combo: My Sushi Romance & Dilemma (very good) and a spicy California roll! Rolls were generous and packed perfectly. They included a side of soy sauce and chopsticks which I appreciated! I didn't see any brown rice options or no-rice rolls? But I would recommend if you really need your fix! Hope they do well and happy to support!
2020-03-30,5,Honestly the best restaurant in Hoboken.  I went when they first opened and the ambient is so lavish,The food is amazing and the service is outstanding, everyone was so friendly , and now during this hard time when all the restaurants are closed Monroe's team has the best and fast delivery service I've ever had. is awesome that you can have the Monroe's experience in your house as well.
2020-03-30,5,Never disappoints! The service is wonderfully refreshing, the ambience is delightful. They're offering take out and delivery service during these terrible times where businesses can no longer be open to the public. So I encourage everyone to order for delivery or pick up, because these small businesses are the ones that matter the most. Especially when they're great!
2020-03-30,5,I heard about this restaurant via a friend who said they were delivering during quarantine. I live 23 miles away from Monroe's and they still came and delivered to me! The food and cocktails were delicious! The customer service was beyond my expectations. ( they even added free shots as a thank you) Once we get through this pandemic I will definitely be dining here in person. 10 stars!
2020-03-24,5,You can't go wrong with anything on the menu everything is absolutely delicious! The "Me steak love" is so tender and juicy and the "lost love" sushi dish is  execellent!
2020-02-24,4,This Is a new place, me and some friends tried it today for lunch. The menu is options aren't much, and they have a buffet style lunch which was good but didn't offer many healthy options. Will like to come back and try the drinks and hopefully they'll add more to the menu. Overall I liked the space and ambiance.
