2019-07-03,4,Napoli's is very solid. Portions are large, food is good, and despite the exaggerated delivery times, it usually comes much earlier than expected. Delivery folks are very nice, as well. I've had the pizza while dining in and I've had it thru delivery, and I have to say - it's just not the same getting it delivered. It's still good, it's still hot, it's still fresh...but it's just more soggy. It makes sense, because brick oven should be eaten fresh out of the oven. So maybe call it my laziness and lack of walking around the corner to eat a pizza hot out of the oven...but I still wish it was delivered a bit less soggy. Also, would help if it was cooked a bit more and the cheese sometimes slides around the box. Anyways, you can't go wrong here. Get their app and order away.
2019-07-01,5,This place is amazing, they were really nice and helpful with questions that we had since we were visiting. When I tried their pizza, I was mind blown, definitely the best pizza I've ever had ! I recommend the bruschetta pizza !
2019-07-01,5,Now THIS place is amazing! We came here at about 5:45PM, and I must say, I was a little worried, because it was totally empty. Me and my 3 friends ordered 2 large pizzas: one chicken parm pizza and the other one was half meat lovers and half bruschetta pizza. All of them were really really good!The chicken parm one had big dollops of ricotta cheese, which was yummy, and the meat lovers was tasty as well...but oh man, the BRUSCHETTA PIZZA was one of the best pizzas I've ever had...the sauce on it was good to the last bite!Finally, the servers were very helpful, friendly, and quick. I definitely recommend this place!
2019-07-01,5,In a town full of local pizzeria's, Napoli's downtown is hands down my favorite. First off, the food is amazing. We always order Napoli sliders, they are a must have. We then order a pizza, which we always mix and match and have never found one we didn't like! Next are the people at Napoli's. Definitely some of the friendliest people, from the owner down. Special shout out to Isa, who we look forward to seeing every Saturday night when we go. She has become our favorite waitress in Hoboken and is always giving us honest recommendations, helping with our complicated orders, making sure everything is perfect, and also being so sweet to my kids. She is a gem and part of the reason we keep coming back for more!!
2019-06-28,1,I don't get it. I heard this was one of the best pizza places in Hoboken. The crust was so dry and tasteless and even tough to bite through. Slightly burnt too so it had a bitter taste in spots. Sauce..bland. Toppings were good I guess but nothing special. The staff was nice and so were the guys making the pizzas so I feel bad giving this review but I have to be honest...Maybe they were having an off day??
2019-06-24,5,This is my go to spot for pizza when in the Hoboken area. Went for a biz lunch and ordered a bunch of pies. My two favorites were the white pie and the Chipotle Chicken pie. Yes, Chipotle Chicken! The chicken and fresh tomatoes were delish along with the chipotle sauce. How about chicken parm sliders served on garlic knots...absolutely awesome, cmon! Everything was so good that I decided to order some catering for my sons grad party and nothing disappointed...chicken parm, stuffed shells, penne in vodka sauce all were outstanding and there was plenty of food for my guests but nothing left over. Lastly the owner Frankie couldn't be a nicer guy and his staff is the same way. Will be back soon!
2019-06-15,5,Every time my family comes into town I bring them to Napoli's for fried calamari and pizza. The service here is incredible (thank you Freddy!) and we always feel that we can take our time and relax.
2019-06-13,3,Surprisingly, there is dearth of great pizza in Hoboken. But there is a lot of good pizza. Napoli's fits in that group. Go here for a nice lunch or quick dinner. The pizza won't wow you but it won't disappoint you either. The margherita pie is strong. The eggplant parm pizza is filling and a good pick if you also like ricotta. There's outdoor seating too if you want to on a nice day.
2019-06-01,3,Eat there, don't get it delivered.My eat-in experience has always been a 5-star event.  Food is great.  Service is good.My delivery experience, horrible.  My last delivery was 40 minutes late, burnt and cold.  It was so cold, it looked like left over pizza from the night before.
2019-05-15,2,Long waits but the food is good. Why two stars? Because they can never tend to get my order right at 100 percent. It's either they don't give me the right drink or a drink at all, they don't give you the extra blue cheese you ask for, or they miss something specific you ask for in general. They give you a credit, which is nice, but that doesn't stop the inconvenience of going to the store or not being fully satisfied after you eat a meal you've been waiting for at least an hour. I haven't ordered from the uptown one in a while but is this just a downtown thing?
2019-05-10,5,I regret writing my previous review. I've ordered from here over a couple dozen times since, and the experience (delivery, quality, service) has been nothing but spectacular. In a town overflowing with Italian food, I legitimately think these guys and gals are a few steps above the competition.
2019-04-29,4,This is considered to be one of the beat pizzerias in Hoboken, yet I've lived here for almost three years and never tried it...until last night.I ended up ordering a personal pizza with two specialty flavors: half spinach and artichoke (white) and half eggplant parm (red). Delivery was very quick, definitely under "30 minutes or less." The presentation of the pizza itself was pretty, but you didn't quite know where certain flavors stopped and others began, but maybe that's part of the fun.Generally, the pizza is standard for a Jersey pie: crust that's the perfect hybrid of chewy, soft and a little bit crunchy, rich sauce (creamy with the white sauce and great acidity on the red sauce), and strong flavors that showcase every single topping. However, I did like the spinach and artichoke slices over the eggplant parm ones. The spinach and artichoke slice tasted like a homemade dip spread all over pizza crust. You get great flavor from the garlic, creaminess saltiness from the cheese, and good texture and color from the veggies. As for the eggplant parm, it had rich sauce and perfect eggplant pieces (both in terms of breadedness and overall flavor), but I would've liked less ricotta cheese, which, while presented prettily, made the slice too heavy and too rich. All that said, I'd definitely eat from here again, but maybe try a classic slice?
2019-04-03,5,AMAZING FOOD!!! I order here at least 2-3 times a week and can say that everything on this menu is delicious. Good thing I live right across the street
2019-03-27,1,The. Worst. Service. I ordered a salad and was last to get my food. We were probably sitting for 15-20 minutes before even getting water. The waitress came back multiple times to question our order. We all got salad or wraps. No appetizers and nothing complicated.
2019-03-17,5,Very nice ambiance.. good food.. quick service compared to any other restaurant on any Friday evening value for price waitress gave nice recommendations and enjoyed my Personal Ciao Bello and Pesto pasta was nicely prepared and presentation was good Best part is BYOB + Pizza == Full Enjoy
2019-03-08,4,Decided to stop by after reading reviews. Very busy with both to go and dine in orders. We were quickly greeted and seated. We were craving a good ole Italian pizza so we decided on 1/2 margarita pizza 1/2 pepperoni and shared a Vodka pasta. The pasta arrived first, the sauce was very flavorful, wish they would have served bread with the order. The pizza followed and it was perfect. The sauce was just right and the crust was thin but great. We all devoured the pizza. Great ambiance, location and attentive staff. The staff offered suggestion of places to visit near by. Parking was tricky but we found parking not too far.
2019-02-16,4,The food here is amazing and they're vodka sauce (and anything on the menu that has it on it), is the best I've ever had. You really can't go wrong with anything but personal favorites are the buffalo chicken wrap and the vodka pie (pictured here). The uptown location is often pretty full so suggest popping into the downtown location if you experience that or are worried about that.Highly suggest only dining in here. While their food is really really good and I suggest everyone try it for themselves, the take out is TERRIBLE. It's odd cause everything else is so great including in dining service but the delivery may be the worst out of any in Hoboken. Not sure if it's their timing or what but food often comes really late, cold and and wrong. That said, i wouldn't let it deter you from trying them regardless.
2019-02-04,5,Yet another BYOB favorite. On the recommendation of a friend, my boyfriend and I came here for dinner on a Friday night with a bottle of wine. After much consideration, back and forth, and debate, we decided on a large pie half zucchini primavera, half penne vodka. All I have to say is *kisses fingers while very dramatically saying muah* it was magnifico. The crust was soft and burnt just enough. The sauce on the Zucchini Primavera was delicious and the mozzarella was not gloobby, as it can be when the cheese isn't over the entire pie. The Penne Vodka was also incredible and the call to add sausage to it was my boyfriends call and one I will only admit was a good one here, on Yelp, where my secrets are safe...We got the Clams Oreganata as an appetizer and, although tasty, it was nothing special and I probably wouldn't order it a second time. The staff was incredibly kind and attentive and did not SEEM to mind at all that we took forever to order. Really, it was forever... But with so many insanely delicious looking specialty pies, we couldn't decide for the life of us. So happy we gave this place a shot because I am very confident it will be our new go to pizza spot. Although we were sitting right by the door and had to keep our coats on the entire time, it is super cozy and good place to polish off a bottle of wine and kick back with some great pizza.
2019-01-07,5,Great customer service. Pizza came out hot and crispy. Also, loved their  fettuccine Alfredo, very creamy and flavorful. Will definitely come back.
2019-01-05,1,The absolute worst delivery service I've ever experienced...I placed my order and waited 2 hrs to get the food! I kept calling and every time it was the same answer, "they should be there any minute". Pizza came cold, dry and unfortunately we couldn't enjoy what we hoped we would get.I'm sure the pizza is good but delivery service needs major improvement.
2018-12-15,3,Great food but was a nightmare tonight. The poor staff had to deal with a bunch of loud kids running around with the parents ignoring them.  Then the parents were yelling and encouraging the kids. Then a bunch of drunks started screaming and bumping into guests and the servers. Not sure why the manager was awol on all this but how about stepping up next time so all your customers aren't miserable.
2018-12-03,5,Great to have Napoli's near to us it was a way to go to eat at the other branch, same good pizza in a different location, I think the menu got bigger but I only ever eat pizza, the wait time for take out seems long to me 90mims on a Friday night but I never order take out so ...Best pizza in Hoboken in my opinion
2018-11-12,1,This review is due to their delivery service and lack of customer service. I ordered our lunch at 1:02pm on a Monday via their website and finally received it at 2:32pm after calling twice. Each time I called I was transferred 2-3 times and had to retell my story to 3 different people.  By the time the food arrived, it was ice cold.  When I asked for a refund, they could only offer to remake my food and deliver it hopefully in another half hour. This did not work as I needed to leave for an appointment and did not have any faith the food would arrive in that amount of time.  Of course there was no manager on site to talk to.  I am actually moving 3 blocks from this location and they just lost a customer.
2018-11-11,5,A great little place with authentic pizza you have to fold to eat. We went to the one on Clinton St, Hoboken. The crust is crispy around the edges and has a chewy bite-sauce is mild with the flavor of basil. We got there after 10, and the staff was making a fresh pizza, available for slices. Two, by the way, were enough to satisfy! There is a full menu, pasta included. Staff, friendly and pleasant.
2018-11-08,4,My new favorite place to bring family and friends for a BYOB dinner. The food is great and the pizza is definitely up to par with Hoboken. Most recently, I went with two friends from college and they wanted a quiet place to eat, drink, and possibly watch some college football on a Saturday night. When we got there, there was a TV but it was playing a different game. We asked the waiter to change it and he did with no issue. We ordered garlic knots, mozz sticks, and two personal pizzas for four of us. It was more than enough food and it was incredibly priced. We even forgot out leftovers and when I ran in, they were already thrown out. The manager gave us two new slices to take home. Fantastic service!
2018-11-04,4,Tried pesto pasta, marinara sauce pasta and veg pizza. Everything was quite flavorful but  definitely try the pesto pasta. It was really good and creamy.
2018-09-29,4,The penne vodka pie. that's all I'm gonna say. Crispy, chewy, flavorful (sometimes penne vodka pizza can be bland). Haven't even tried anything else on their menu because I'm so obsssed with this pie. Get it!
2018-09-29,2,I have actually been looking for a great buffalo chicken pizza to eat again after attending a party but did not remember the name. After trying to search up which pizza place had some pretty good reviews and apparently "the best buffalo chicken pizza ever", I tried out Napoli's. The pizza slices had a hard and thin non-chewable crust like when you bring home leftovers to heat up in the microwave, the pizzas weren't as cheesy as I was hoping for, and I was a bit disappointed to see that they grab and heat up the pizza slices/pies with their bare hands up front. Aside from the cons, the slice of buffalo chicken pizza I had was okay but could have been fresher and better.
2018-09-23,5,Best service I've ever had. Period. Plus, the food was better than the service. The world needs more restaurants like Napoli's. My girlfriend and I walked in around 8:30, our first time at the restaurant. Unsure of how to be seated, we asked the first waitress we saw. She immediately showed us menus, asked us if it was our first time, asked what kind of food we were in the mood for, and told us about a wine delivery service we could use (the place is BYOB). She sat us outside, and our service was quickly taken over by Isa, our waitress for the evening. She was incredible.As if our direct service wasn't good enough, we were constantly checked on by Frankie, Jay, and of course the waitress we'd spoken to first. I had the chicken parm with vodka sauce (recommended by Isa), my girlfriend had the Ciao Bella pizza with marinara sauce (which of course I tried-- amazing), and we split the pear salad--best salad I've had in a very, very long time.All in all, the place was authentic. It didn't try and put on fake faces in hopes of decent tips, but instead showed real emotion that was reflective of a well run business, and employees who cared about their customers. Well done, Napoli's.
2018-09-22,5,Best pizza in Hoboken!! Frank and his staff were very attentive and made sure my pregnant girlfriend feel right at home!!
2018-09-17,2,Decent garlic knots but pizza is lackluster. Ingredients are not fresh and flavor is lacking
2018-09-14,2,Love the food. Two stars Bc I ordered a small pie w black olives and they give me Greek calamata olives. Not only that but I pay extra for a topping and it is so little amount. Didn't really matter Bc calamata olives is not what I asked for.  So so poor!!! Some slices don't even have anything on them.
2018-09-07,5,My favorite place to get pizza! They also make the best sliders! Get the garlic knots with meatballs!
2018-09-02,2,Thanks for the raw pizza and the cooked salad. Staff was real friendly, so there's that.
2018-08-25,5,Best pizza I've had in my life! We came in 20 min to close and The whole staff was awesome and took us setting us a table after they had already cleaned the place. The pizzas were amazing and Frank gave us special attention making sure we were not rushed at all and making us feel like we were having a true Napoli pizza! Kudos!!
2018-08-04,5,Came for brunch with some friends and I was very impressed with their top notch quality food and great service! The owner frank greeted my friends and I and seated us. Our waitress knew the menu very well too and recommended the breakfast pizza which was phenomenal. Prosciutto, fresh moz, and 2 over east eggs - one of the best brunch meals I have ever had!Not only will I be back but this will be my go to place for brunch in Hoboken
2018-07-22,1,2 hours to deliver a single pizza.  What a joke.  I called twice for an update (nobody called me) and both times they claimed "it was on the way".  There are plenty of other pizza places in Hoboken.
2018-07-13,5,This place is a hit. The pizza, the atmosphere and the people are all great. We got a large pizza; half Eggplant Parmesan, half Zucchini Primavera. The pie was huge and the flavor didn't disappoint. I don't normally eat just veggie pizza, but these two hit the spot. The Eggplant Parmesan is creamy and filling and the Zucchini Primavera is light and fresh. We sat at an indoor/outdoor table and really enjoyed the day and the ambience. And the staff were great too, always checking on us and super friendly. Can't wait to go back!
2018-06-03,5,I live in New York, my family came to visit. Took them to some pizza spots -they all decided they liked jersey pizza better. The tomato sauce is my favorite and why I return to Napoli's. Any of the pizzas are delicious.Staff is the nicest, most accommodating restaurant staff I have ever seen. It is exactly what you want and expect from a good neighborhood spot. Also, BYOB
2018-06-01,5,It's great to find a restaurant in Hoboken that has great food and lets you take your time without trying to rush you out to fit in the next table. The food is delicious and I love a good byob. The service is great - the servers are friendly and efficient, and Vito is super sociable and speaks to the various tables. Apparently you can order wine for delivery even, and the prices are really reasonable (both the delivery booze and the meals). We brought our own wine this time but will be ordering in the future! We had the Napoli sliders and a large pizza, and it was a solid and delicious meal for three people. Would definitely recommend!
2018-06-01,5,Big fan of Napoli's -- the food is delicious, Vito and his crew are super friendly, and you never feel rushed while you're eating. Super convenient, my favorite pizza spot in Hoboken. Great service, indoor/outdoor seating, BYOB. Also has wine delivery option in case you forget your wine. Can't get much better. Can get a specialty pizza and half plain, which is my JAM! Very accommodating. Bottom line, come here for pizza, it's awesome.
2018-05-29,5,If I could give this place more then 5 stars I would! The location was perfect from where my boyfriend and I were staying! We didn't wait to be seated at all fast service and delicious food! It was 4 of us and we ordered 2 pies, mozzarella sticks, and garlic knots! So far I was impressed on how quickly they brought our food out yet it tastes like a home cooked meal. Our waitress was excellent, funny and so attentive! But what really impressed me was the owner! He was so lively and in good spirits it radiates off of him and into his business! Everyone there was so happy and enjoying everyone's company! I feel silly for forgetting the owners name but you will recognize him when you enter and never forget him when you leave! The pizza was crispy and delicious! It was so good we went back the following day for dinner again! What a good spot for some good ol' pizza! ITS BYOB!!! This place is the best!
2018-05-27,5,A wonderful and welcoming pizza place. Sells good times and memories along with great pizzas. Veto is the man!!
2018-05-27,5,This place not only has some of the best pizza, but it has some of the nicest people! One of the owners, Vito, is so friendly. He was greeting people, cleaning tables and making sure everyone was having a great time. Our waitress, Isa, was very personable and took great care of us. Highly recommend this place to anyone looking for good food and great service!
2018-05-27,5,SERVICE: Vito just welcomed us in here on our first night in Hoboken and made our night! We came in as a family of 6, on a busy Saturday night, with my dad in a wheelchair. While we were standing awkwardly outside trying to figure out if we could get him up the stairs or if there would be a table open, Vito came out and quickly ushered us in, saying "everyone is welcome at Napoli's!" He even offered to help carry the wheelchair, and immediately cleared a couple dirty tables and pushed them together for us to sit down. Somehow extra chairs and servers came out of nowhere to help him get it all together. I have never in my life encountered this level of welcoming service at any restaurant, let alone when showing up with special needs on a busy night. Kudos to this place for setting the standard of service for every place I'm going to in the future. FOOD: Pizzas are just incredible! It arrived very quickly after we ordered, piping hot. We ordered four so we could try more sauces and variety and every singe one was delicious. The penne vodka pizza is super yummy and very filling because of all the carbs ;) Ciao Bella was also a standout, very fresh ingredients and cheese. Also ordered salads and they were simple, and very good but order several if you have a large group, they are small side salads. Note: It is BYOB so my hubby ran out for some bottles of wine and they provided the glasses.
2018-05-25,5,Great food, great service! Classic Italian and I'll definitely be back. Clam pizza is delicious and you can't go wrong with the pastas.
2018-05-20,5,we had dinner last night and Vito at the front was extremely welcoming. i was outside with my father in law  who's in a wheelchair and Vito offered to lift him into the restaurant exclaiming "if we can't help each other, what good are we". and throughout our dinner i saw the same hospitality to everyone that came in the dooroh and the pizza was pretty damn good too
2018-05-17,4,Full Score: 4.43As an unbiased new member of the Hoboken area, I can say the Napoli's staff knows how to make a slice. Beautiful brick oven inside with a nice layout for take out orders. The whole staff was on their toes not their heels, ready for customers to walk in or take a call. I went with a large original cheese pie for my first time, as any pizza veteran would do. I was able to get down 5 slices, and plan on at least putting down two more in the next few hours. Based on my first experience, I'll be venturing into Napoli's various topping selections in the future and will do a Follow-Up review. Stay tuned and as always, talk to me nice.
2018-05-08,2,Got a very disappointing pizza from Napoli's this past weekend. I ordered a pie, half with cheese and pepperonis and half with mushrooms, onions and no cheese since I am vegetarian and lactose intolerant. I wrote in the notes that it's important to make sure half the pie was without cheese and meat and to call if there was any questions. Instead I got a pie with an abnormally abundant amount of pepperonis, mostly on the half of the pie that was supposed to be just mushrooms.  Since I'm a vegetarian I took off all the pepperonis and underneath there was barely any pizza sauce or any of the other toppings I ordered. I called the restaurant, very disappointed, and asked for a refund. They insisted to send me a new pie but I said that it was too late and I wasn't going to be home.  I don't have a problem with their pizza quality but their customer service is poor. If you can't follow directions, at least provide your customers a refund. They just permanently lost my business :(
2018-05-08,5,Such a great place. We had my daughters baptism brunch here last min and the staff and manager were so accommodating and attentive. Highly recommend dining here . The food was outstanding and what even better it BYOB  So if you are in Hoboken and have not stop in I highly recommend dining here ASAP... Looking forward to my next visit Recommend ordering Fried Calamari Clams  Pizza  Rice Balls Stuffed Mushrooms And my personal fave Rigatoni pasta dish with sweet sausage and broccoli rabe ENJOY !!
2018-05-06,5,Best pizza in Hoboken!! We have not eaten at any other pizzeria since Napolis opened on Willow. Iza is the best waitress and makes you feel right at home. Everyone at Napolis makes the dining experience amazing!
2018-05-06,5,The pizza is great and the people who work here are very friendly. The penne vodka is also delicious. The redone inside (after taking over the old Grimaldis) is a big upgrade and they are BYO.
