2018-05-05,5,One of my favorite pizza places in Hoboken.  They have the best Brick Oven Pizza.  Service is great. Tonight we walked in without a reservation.  Party of 12.  Stroller in tow.  Vito, the owner, was so kind and accommodated us.  He went out of his way to make sure our dining experiences was pleasant.  Our kids loved the traditional pizza.  We enjoyed the wings and Margarita pizza.  Highly, highly recommend their wings to start with.  Go early as this is a Hoboken hot spot.  Don't forget to bring your favorite cocktail as it is BYOB.  Outside seating available.  Great place to dine especially if you want to eat where the locals go!
2018-05-04,5,Perfect spot with outdoor seating just off the busy Washington St.  BYOB with great service.  Buffalo Chicken pizza is a must!   Owner/manager Vito is extremely inviting and friendly and makes the entire experience more enjoyable.
2018-05-04,2,Had to call a waitress over after 29 minutes of sitting inside even though they were clearly fone taking care of the customers next to us. Don't know how long we would have had to wait if we didn't call someone over, very unprofessional and quite annoying.
2018-04-30,2,I'll start with the food was delicious. Went there on a Sunday night with a friend. It was pretty quiet with maybe 2-3 tables full...after we sat down we waited for another 10 minutes before the waitress dropped  our menus on off on the table..didn't introduce herself and the rest of the night was just a display of bad service. The waitress and who we assumed was the manager would shout back and forth to each other about orders or just general conversation across the tables in front of customers. The tables were clearly not cleaned after people had left (including ours which still has crumbs on it)..maybe we went on an off day maybe not but I live a block away and I can assure you I will not be back. I have too many good options in Hoboken to go somewhere with subpar service. It's too bad because I love the Napoli's uptown which has amazing service & waitstaff and was excited that one opened up closer to my apartment..
2018-04-27,5,This place is great. Amazing pizza, even better service. Have never had a bad experience, whether I get take out or eat in. Plus, they're BYOB!
2018-04-25,4,I went here and I have 0 experience with authentic New York-style pizza, so this was just a darn good slice for me. I got buffalo chicken, which isn't the most common pizza topping, but it was good. Prices are reasonable and the slices are FRESH! It's a good place to grab a bite, for sure.
2018-04-22,5,First time at any Napoli's location, but will definitely be going back! Super friendly and attentive staff who were quick with their recommendations.  The eggplant parm and broccoli rabe pizzas did not disappoint. Personal pizza size was super generous for $12.  Definitely ask for a side of the vodka sauce for crust dipping. Only mistake we made was not grabbing a bottle of wine beforehand - they are BYO. Looking forward returning soon and enjoying their outdoor seating.
2018-04-05,5,wowwww was this an amazing first experience at Napoli's! Went here on Easter Sunday night craving a perfect NJ pizza and they did not fall short. we were instantly greeted with warm welcomes and it felt like a typical Italian family vibe. They offered us descriptions for different menu items and insisted we sit while we wait for our pizza. We were able to see the guy make our pizza from start to finish and it made it that much more mouth watering. The pizzas are made in wood fire ovens and cook super quickly! We brought it home and even after our 7 min walk, it stayed crispy and warm. Not to mention DELICIOUS. I recently moved downtown and this will 100% be my new pizza spot.
2018-03-26,4,My friend and I were enjoying drinks at The Nag's Head, a casual neighborhood bar that allowed patrons to bring outside food, when she asked if I wanted to share a pizza.  I agreed, and she followed this up by asking if I had a favorite spot in town.  I immediately said Napoli's.  I had only been to the uptown, Washington Street space, but knew that they had just opened a second location on Clinton Street, just a few blocks away.  We gave them a call and ordered a small pizza with mushrooms to be delivered to the bar.  The added topping took the cost over the $10 minimum delivery fee, which was great.  We were also able to swap the basic crust for a whole wheat version, which did have a rich grain flavor, but was still very enjoyable.  As always, their marinara sauce was well-spiced and slightly sweet.  The cheese was gooey; and the mushrooms were freshly roasted.  The pizza was as delicious as any other I had ever had from Napoli's.  The 6-sliced personal pie was also the perfect size for our light evening dinner.  However, I took away one star from my review, because my friend told me that the delivery man criticized her tip amount...
2018-03-02,5,This place is BOMB!  Pizza is fresh and flavorful (get half and half when you can't decide), the menu is extensive, and the owners/staff are friendly.  It's BYOB and there's a liquor store ~2 blocks away.  Ends up being a cheap meal for a TON of delicious food that you'll have left over for the next day.It's pretty casual with a neighborhood vibe and is great for any outing -- date, family dinner, or catching up with friends.GO NOW
2018-02-11,5,We just returned home from an adult birthday party at Napoli's Pizza  Restaurant.  We were a bit surprised about the choice of restaurants.  Pizza was served as an appetizer.  We fancy ourselves "pizza snobs". After one bite,  we understood the dining choice.   The crust was thin and crisp. The mozzarella was fresh slices as opposed to the shredded we are used to.  Since we were going to be served a meal,  my friends and i only opted for one slice.  My husband couldn't resist a second slice.  Next various types of salads were offered.  They were scrumptious.  When my meal arrived,  I had it packed up for lunch tomorrow.  Everyone we were sitting with said their meals were equivalent to an upscale restaurant.  The wait staff deserve 5*****. Vito was not only accommodating,  but,  my friend and i agreed that he was the afternoon entertainment.  He sat down with us when there was a lull and mesmerized us with his stories. I'm sorry i don't remember the waitresses name.  She was also quite attentive.  Looking forward to returning soon!
2018-01-22,5,I have been dying to try Napoli's and was so excited they finally got a downtown location. After all the instagrams of their pizza once I saw the penne vodka pizza I knew it was time! I ordered a personal penne vodka pizza online And the pizza was ready at the exact time they told me it would be! It was soooo good and made my night. Can't wait to try other pies! Finally a nicer pizza place downtown that you could even just get slices from!
2017-12-31,5,Wow what a pizza!!! The pasta de napoli is amazing.  Ignore all the strunzos who don't know Italian food. Vito is the man and will give great recommendations
2017-12-30,5,Consistently excellent pizza, they always have a solid selection of slices on offer. My personal favourites are the BBQ chicken and the meat lovers which has a phenomenal meatball. You honestly can't lose if you're after a quick, delicious New York style thin crust pizza!
2017-12-28,1,Love the pizza, hate the service. You're better off ordering delivery from their other original location uptown, at least you don't get bad service and attitude. Not sure how someone with any common sense acts the way our waitress did. She didn't write down anything we ordered and forgot half of it, brought us the wrong stuff, and I was super nice about it but she gave me an attitude and made me feel bad. Very weird!  Dinner for 2 was $50, for just 2 personal pizzas and a salad. We will resume the $30 delivery from the uptown location instead, at least we can enjoy our food without getting a bad attitude! Hire a more professional waitress please.
2017-12-27,1,Arrived early to pickup a personal pizza that had already been sitting in the back for a while. Once the staff finally found it, I returned home with quite the disappointment. Instead of a Napolitano style pizza with fresh mozzarella, juicy sausage, and garlicky broccoli rabe, I got a dry/flavorless mess. The pizza was stiff and tasted like the cardboard box it came in. I'm not sure how they think they could get away with replacing fresh mozzarella with the dry stuff in Hoboken of all places. Sausage was just bad so I picked it off. Finally, the broccoli rabe was an afterthought as someone obviously forgot to put it on before the oven. On top of everything the pie was cold after a one block walk and continues to make my stomach rumble as I type this. I hope Napoli can get it together soon.
2017-12-15,5,Great food , love the new  place , more parking at this location ! Waitress always super friendly and so is Vito !
2017-12-14,2,The food is decent but portions are very small. Sides are basically the size of condiment cups and salads are $12 & essentially a tad larger than a side salad
2017-12-10,5,We'll definitely be coming back here! They have some of the best Italian food and pizza in the Hoboken/Jersey City area.We ordered a margherita with breaded chicken, creamy Cajun fettuccine, and arancini. The pizza had a nice savory sauce with just the right amount of crunch to the crust. My favorite part of the meal was the creamy Cajun pasta! The sauce wasn't too heavy with cream and had a delicious kick from cayenne and paprika. The arancini was a hit, too. I traveled along the Amalfi Coast this summer and Napoli's arancini was legit; better than half the ones I had eaten along the coast.Go check this restaurant out! And say hi to Vito! His hospitality really made the dining experience 100x better. He checked in with us frequently and made us not mind the 30-minute wait to be seated (they were pretty crowded that night).
2017-12-09,2,Went for the first time tonight, and ordered the Sicilian pizza... it it was only ok, the crust was very thick and puffy. After gulping down three slices and being full, I was left very unsatisfied because of the lack of flavor, and the sparse toppings.Service was very poor. We had to permanently be looking around for our waiter and the cherry on top was when we had to walk our bill up in order to pay it and leave.I understand this is a casual place but with so many other better options in Hoboken, you would do well to skip this one.
2017-12-05,5,I've eaten here and taken out a few times since it has opened. Great food and the owners, Vito and Frank, are great hosts and genuinely care that you enjoy your experience. Great for a Friday night to bring a bottle of wine and get a pie!
2017-12-02,5,Love the new location of Napoli's! Inside is cute and very clean. I like the setup of this location much better than the uptown Hoboken location. We ordered caprese and calamari for appetizers which were both delicious! Eggplant parm and chicken Marsala for entrees. Highly recommend the eggplant! Our food was delicious and our server was very friendly. Great BYOB Italian spot. Will definitely return!
2017-11-20,4,We were excited and curious to see how the new Napoli compares to the old Grimaldi's and all of the seemingly endless parade of new pizza/pasta joints.  I'm pleased to report a very good experience.  Staff was friendly and attentive.  Layout was comfortable and kid friendly.  Got the American Sliders appetizer - delicious!  Managed to save room for a slice of pizza which was very good.  Will definitely be added to our rotation.
2017-11-19,5,Always been a fan of the up-town location so when i saw that they were opening one in the location formerly owned by Grimaldi's I was thrilled since i live around the corner.Have ordered twice so far and it's been great each time. Second time, i messed up an ordered through a delivery app and did not realize it was for the uptown location. When i came in not only did they understand the situation, they upgraded the size of my pizza and let the uptown location know i wouldn't be making it! So, great pizza and awesome service, will be a great addition to this area!
2017-11-19,3,This is where the other hoboken Grimaldi's was. They could use some work on their ambience. We went on a Sunday evening and the place was brightly lit up it is not so warm and inviting as the Washington Street location. The waitstaff is pretty Friendly. We ordered a salad the slider appetizers and the margarita pie. My husband really liked the sliders. I thought the arugula salad was good the dressing is sweet it is my only complaint.  The pizza while hot was good but the crust gets chewy as it cools off. The crust is our biggest complaint but it does make the pizza.
2017-11-18,4,We've had deliveries from the uptown location and were always pleased.  When the downtown location opened up we were excited to give dining-in a try and we were not disappointed!  Our server made great recommendations for sharing our pizza and we were served promptly.  It was fantastic. The crust was thin and crispy and the toppings were fresh and high quality.   This place is a great value, with lots of variety and healthy options on the menu.  This will be our go-to pizza stop in the neighborhood.
2017-11-17,4,I used to go to the original Napoli's every couple of weeks for pizza and then I moved downtown and it was kind of far... So I was thrilled to see that they have very recently opened up in the old Grimaldi's spot on the corner of First and Clinton.They have done a great job of renovating the restaurant. There's a new frontage, lots of wood and some nice lighting. It's a 'boken pizza joint so it's not super fancy or anything but I prefer it to the original, overall it looks a lot more modern.The menu is a lot bigger than it used to be but apart from an occasional salad for the table all I ever come here to eat is the pizza! The pies are thin crust NY style pies and I would recommend spending an extra couple of bucks and ordering a Margherita rather than the Original pie. I'd also recommend sticking with the more traditional toppings rather than the more inventive ones.There was a bit of a mix up with our pie - we received one with sausage and anchovies (why would you order that?!?) - but they made our correct pie quickly and comped our drinks to take care of the mix up. The pizza here is excellent just as good as at their other place. There's a few kinks they need to iron out (get a door closer on the front door to stop the draughts and for the love of God give the servers pencils and pads so they don't screw up orders) but I'll give them a break as they only just opened.What else do you need to know? It's BYOB like the original and they have the two slices and a soda deal like the original at lunchtime. And it's insanely cheap for the quality of pie you get, dinner for two for $25.00 is a deal in anyone's book. We'll be back.
