2018-03-30,5,Best casual Chinese and sushi place in Hoboken! Their lunch specials really hit the spot - well priced, and satisfying. Everything from the seaweed salad, fresh sashimi, chow fun, chicken wings, and sushi rolls were generous and tasty. All and all a solid lunch or casual dinner, delivery, and takeout place to satisfy your titillating tastebuds for Asian noshes. Ooh the mochi is good too. Next time tuna pizza, you're on deck.
2018-03-23,4,The food is OK - not great. Good hot n sour soup, edamame.  Ok Protein Trio and Pepper Chicken. Quality of rest of food varies.  Their Sashimi is not great. I would have given them a 3*. But their service is very good. And while their interior is casual, it always feels warm and intimate.  Being BYOB helps too.
2018-03-13,1,This place has changed a lot. I'm not sure if it's under new ownership but the customer service sucks and the sushi is sub par. I used to enjoy coming here but that isn't the case anymore. I guess that would explain the restaurant being empty every day when I walk past. I really hope management changes the wait staff and get some people who are personable and know how to ensure he customers keep coming back. Sincerely,No longer a customer
2018-03-05,1,Did Precious change ownership or management? We used to love it... the white meat chicken used to be great. Our dinner last night tasted and looked like it came from a different restaurant. Gross, chicken was not nearly as "fresh" tasting. Really honestly odd and I don't think we'll be ordering from there anymore. Unfortunate, it was our favorite (and only) Chinese place in Hoboken.
2018-01-26,1,I used to like Precious until I started ordering delivery from them. Their delivery driver is violent and abusive. If you do not give him what he deems as an acceptable tip, he will curse at you and slam the doors in your building. Each time I gave him a 20% tip and he freaked out. I called after he left and the person on the phone replied "sorry". Last time I order from them, or even go there to eat. "SORRY" but you just lost a customer.
2018-01-05,1,I am a regular.  Ordered delivery.  They sent the wrong dumpling.  I called to tell them.  Not credit.  The next time I ordered I mentioned that they sent me the wrong dumpling the last time.   Not a knowlegdement....doubted me.  I spoke to the same person...I know them there.  Disappointed in the customer service.  Food is fine but due to this recent issue my score is low.
2018-01-04,1,This Chinese spot is awful! I ordered food here for delivery and it arrived very late. The food is disgusting! I got 2 orders of Thai iced teas and it taste so bad. I ordered a vegetarian soup and lomein and it's so bad I had to throw everything out!
2017-12-25,1,Zero Stars, but you have to place 1 for a review. I decided to give this place a second chance as the 1st time their was a dead roach in my appetizer. This doesn't ever happen to me but stayed calm and brushed it off as bad luck? The second  time was just as bad but with poor customer service. We came in and was quoted some time to be seated. Patiently waiting we saw 2 tables come available with a 3rd table already paying which would accommodate us. Instead they gave 2 tables away to two other parties who came in after us. Don't expect a quality meal nor service, just rude staff! There's better options than this place. Never again!
2017-12-25,5,Excellent Chinese Food + Excellent Waiter Service! Very convenient location on Washington Street in downtown Hoboken. Comfortable atmosphere for dining in, and our favorite take-out in Hoboken.
2017-10-17,3,I usually like their food but something has changed. The fried calamari was tasteless and there was only 5 pieces on the plate. I ordered the Shrimp & Scallops in garlic sauce for my dinner. The scallops were non-existent. It's like they took one scallop and chopped it into pieces. Very bizarre. The broccoli was also WAY undercooked. Can't say I'd recommend this place anymore.
2017-10-10,4,I like their General Tso's chicken!  They make it really well and everything they make is fresh.  Other places the food looks like its been sitting around for while but Precious you can tell its freshly made and its really good. Their soups are excellent!  The one with all the mixed vegetables and chicken.
2017-09-24,3,Gen Tso chicken I thought was sweet and spicy ... oh well this was only sweet - average taste. I did ask for an  additional order of plain white rice in the additional comments - to no avail. Well presented though, e.g. 2 enclosed tea bags with the fortune cookies, and other condiments is a nice touch.
2017-09-08,4,Ordered food for delivery! Got to my apartment a little before it was supposed to be delivered! I ordered an egg roll, wonton soup and chicken & broccoli. I loved the egg roll and the chicken and broccoli (don't know how a Chinese food place food mess it up). Was very pleased with my meal until I had the wonton soup. The wontons were over cooked and were falling apart. The brother had no taste at all with huge price of spinach  floating in it. Since the broth was very blended it absorbed the flavor of the spinach. Other than that they are very good
2017-07-07,1,This place closes their kitchen earlier and earlier every time I call and try to order food. Tonight is Friday night and they are supposed to be open until 11pm. But I just called at 10:35pm and was told that oh no kitchen already closed!!  Not the first time this has happened. During the week they are supposed to be open until 10pm. But good luck getting anything from them past 9:15pm. Although their food is pretty good. I've finally given up trying to order from them and am now looking for a better and more customer friendly restaurant.
2017-06-01,4,My favorite go to dish is chicken and broccoli.  They are a solid Chinese restaurant.  The service is good!
2017-05-27,1,Had dinner Saturday night, atrocious service, rude waitstaff, terrible experience. Don't ever come here!I will never come back!
2017-05-20,4,crab ragoon is my all time favorite, their mei fun and  pineapple fried rice is also really good and thier sushi.
2017-05-17,1,Didn't give us what we ordered and no sauce with delivery. Delivery guy didn't even wanna climb a flight of stairs. Avoid this place
2017-03-18,1,Note: I have not eaten here, but when you see my photos, you will understand why.  I walked by this morning and saw their food delivery sitting out in the open, on the dirty sidewalk, exposed to whatever anyone wanted to put in it. Perhaps there was a miscommunication between their supplier, or the person accepting the delivery was late, but either way, food should be packaged in a certain way when it's delivered. Feel free to eat there, but you won't be enjoying my company while you are there! I know this is an atypical review for me, but I felt compelled to share.
2017-01-27,4,Really good asian food. I was sick with a cold so I ordered mostly soups and they were perfect. Hot n sour soup was really delicious, and was def the most flavorful hot n sour soup I ever had. I got the Satay beef soup with thin noodles as my main dish, it was so big I could only eat a third of it. Beef was tender and full of flavor. My friend ordered sushi (Precious Roll) it was also so amazing it practically melt in your mouth.
2017-01-15,5,This is the only Chinese food place that offers white meat only in the sesame chicken and general tso.
2017-01-01,5,Stopped in during my Christmas Break. Kiddos don't do sushi. Ordered Chinese for them and sushi for hubby and me. So delicious. Bathrooms are immaculate. Service is excellent. Prices are great. BYOB helps a lot. Thought it was a fluke and went back two days later. Still awesome. I love this place and it has become my new favorite.
2016-11-29,4,Ordered from here while at a friend's house. I got the chicken and mixed vegetables with brown rice and an egg roll. Everything was pretty good! I'm really picky with my Chinese food and I'm glad they use real chicken. I hate how some Chinese food places have "chicken" that is slimy/chewy/fatty and gross. My only gripe was that when I got there she said cash only unless over $20. She didn't mention this on the phone when I placed the order for pickup. I was lucky I had enough cash on me.
2016-11-19,5,My favorite place in Hoboken hands down. The portions are HUGE and the prices are low. 6.75 for lunch special with a huge soup, a huge lunch portion, a black tea bag and a fortune cookie. That's enough for 2 of me. Literally. This is 2 lunches for me.A great deal also is the rainbow roll special which is 11$ and comes with huge portion of the roll, 4 pieces of sushi, a soup AND a salad. You can't beat that.My humble opinion anyways Oh and they have bubble tea and Thai iced tea . What else do you want?????
2016-11-10,5,Just moved back to Weehawken after 7 years away, thank goodness for me Precious is still here.  They by far have the freshest home cooked chinese and their sushi is a nice extra.  Love their "dumplings", gyoza, lo meine, chicken dishes are always superior to regular chinese places.  They deliver quickly and always have the order correct. Love that they use fresh veggies not canned, i.e. mushrooms.  The baby eggplant in garlic sauce is the best anywhere.  Very tasty and keeps for a few days which is good since the container seems endless.
2016-11-05,4,Just moved into the neighborhood and our new apartment building recommended this place so we figured we would give it a whirl while walking around. The service was great - super attentive, the food cheap & delicious. Being a big noodle fan I really enjoyed their lo mein. It wasn't greasy like you sometimes find. It was busy inside, even at weird-o-clock when we stopped in for a super late 4:45pm lunch. Haha despite being busy they still had lots of table so we were able to get a spot easily. Food came out quickly and I saw lots of people ordering the sushi so if that's your jam you'll have to check it out.
2016-11-02,3,As one reviewer put it, this is a Chinese food place worth eating IN. I mostly say that because their wait service is very fast and does a great job.As for the food...it's fine, nothing extraordinary in my opinion. I ordered a red dragon roll (crab meat, avocado, and cucumber, with spicy tuna on top) and it was a good roll, but ultimately nothing special. My wife says Precious has her favorite General Tso's chicken and veggie dumplings, but I sampled them and just don't see it.
2016-10-26,1,Just walked out on this place. There is a 15 minimum on credit cards? Really? I don't think most people realize there should be NO minimum on credit cards, let alone $15. Ridiculous. I'm letting Amex know about this.
2016-10-25,1,Food is great - the lie thru their teeth when ordering delivery - I was told the delivery guy came to my house rang the bell and no one answered so he left.  An hour later he delivered the food and said that a street was closed by me - that he had not been here - but that he was stuck in traffic.  Will never order from here again.
2016-10-08,4,It's the only Chinese place in Hoboken actually worth eating IN at! The place is really nice, and has a great atmosphere. I've come here many times and had such a great time. The place is BYO, with Sparrows liquor right next door. It's perfect for large groups, even on a weekend, because they always have room still. (Large place, never packed.) The food is very good, (Singapore chow mei fun is incredible, so is the dragon and Phoenix) although I haven't tried their sushi. The prices are low, lower than any other restaurant in Hoboken. They do take out as well, but this is really a nice place to eat at.
2016-10-04,4,Food is actually pretty good here eps Lo Mein and Shrimp and Brocoli. Dont know if its a good thing or not that its below the gym.
2016-08-25,2,This review only pertains to the Chinese dinner menu YMMV. I have been coming to Precious for 10 years now.Precious is one of the best Chinese places in town... But that's not saying much. They were really amazing a few years ago but they have been slipping year after year. Cost: They are the MOST expensive Chinese restaurant in town.Delivery: They are usually very fast. Sometimes too quick 15-20 minutes from phone call to delivery(is the food pre-cooked or cooked at all?). On rare occasions they have taken over an hour.At best: Their food ranges from ok to tasteless. Great menu options and heathy choices. Lots of veggi and vegan options. Good delivery containers and plenty of duck sauce and fortune cookies.At worst: Their food can be best described as flavorless. Soggy egg rolls, watery soups are a frequent complaint. Meat portions are small, over cooked most times and sometimes the chicken can have a strange odor. Their noodle dishes are very oily and lacks any flavor.Overall: Most times the food is edible but for the price $25-$30 (egg roll, soup, appetizer and main course) per person is unacceptable compared to other places in Jersey City or NYC for much less. I feel people eat here because there aren't many choices in town. They were truly a great place to eat years ago it's a shame to see a personal favorite get so bad. I hope they can get it together.
2016-08-21,5,Love the food here!  Delivery is always quick with good quality.  Great lunch specials as well
2016-08-15,1,Sesame chicken was great and crispy. BUT WHAT?!? Chow Mein has no noodles?!?!?!? Big discussion needs to be held in the nation chow mein temple roight now!!!
2016-07-31,1,Nooooo. My husband and I ordered delivery because it was a rainy day and we haven't had takeout Chinese in forever.  I went with my go-to general tso chicken and he got the Chang -do chicken which was described as a chef specialty in a Kung Pao sauce.  The general tso was so hard, burnt, and overcooked I could barely bite through it. The Chang-do was also incredibly disappointing and was nowhere near what I would describe as a Kung Pao, it tasted like burnt soy sauce, we trashed it. Thankfully we got a ginger salad and 2 egg rolls which were edible.  I would never order from here again sadly.
2016-07-28,1,Can't comment on the quality of the food, because it still isn't here. The delivery sevice SUCKS. NEVER AGAIN. Don't ewaste your time.
2016-07-08,3,Came here with a friend of mine at lunchtime.  The sweet & sour chicken was yummy and there was A/C on a hot day.  Great ambiance where you could have a conversation so I was happy.
2016-06-05,3,their Chinese food was very American style, not authentic Chinese food, but their sushi was really good. I love it!! I will return for sushi but definitely not Chinese food lol
2016-05-15,3,Service could use help and a little personality wouldn't hurt , good thing good was decent
2016-04-01,1,I took out food last week from precious and have never been so SICK in my entire life.  I got the worst food poisoning I have ever had from the Sesame Chicken.  I was so sick I passed out from the vomiting...I have multiple other friends who this has happened to as well.They should have a random health inspection here and I guarantee they will FAIL.AWFUL
2016-02-21,3,First time ordering .. We usually get Ho King, but my daughter wanted Chinese and I wanted Thai, so we figured we'd give this place a shot .. Excellent selection .. Very slow delivery service.. It took a long time to get the food.. The prices were good, but the food was very very greasy and the oil tasted like the fryers haven't been changed ever. We will go back to our usual spot next time.. Will not be ordering again.
2016-02-03,4,Favorite place to go for Chinese food in hoboken. Staff isnt the warmest but what can you do. Love their sushi and fried rice would definitely recommend!
2016-01-25,5,Very delicious Chinese food. There must be a few different chefs around at different times because around lunch Precious seems even better than at dinner. LOVE their egg rolls! I particularly like their pepper-steak beef and their triple delight!
2016-01-24,3,Everything here is great but the FDA needs to follow up with them in the amount of MSG they put on the food. You think a hangover is bad.... Just eat some Lo mein and you probably won't make it to work
2016-01-22,4,I always get the general Taos chicken.  Sometimes it could be hit or miss.  But for the most part it is pretty good Chinese food
2016-01-22,4,Definitely the best Chinese food in Hoboken. I have tried all other chinese restaurants in the area and none measure up. I've introduced several of my friends who've become fans as well. My favorites are beef with garlic sauce, boneless spare ribs, scallion pancakes, and pan fried dumplings.
2016-01-22,5,This is my go to for Chinese cuisine. I especially like their soups. When I get take out, they have my order ready lightning fast. The spicy chicken and broccoli is my favorite. The broccoli is always fresh and the chicken flavorful.
2016-01-18,2,Thoroughly mediocre. The foods not bad but its just standard Chinese food, not anything special.
2015-12-23,3,Got Delivery with coworkers. Opted for Chinese food lunch special shrimp & broccoli with veg fried rice and veg roll. Veg roll was drowned in oil. Refused to eat it. Oil was sitting in bag. There was 4 shrimps I think in my broccoli bowl. ummm. And a lot of sauce. Yuk. Forgot to say easy on the sauce. Fried rice is not fried really... you can see a lot of the white rice because it didn't get touched with the soy sauce at the used in the pan to supposedly fry it. But actually I ended up liking the rice because it wasn't that much fried. For vegetables it only had peas and onion tho. Coworkers had sushi. Tasted great n looked good. Will try that next time.
2015-12-20,1,Avoid this place....  The food is only so,so but cashiers - especially the young girl at checkout - is as rude as can be.  It's not worth being insulted.....
2015-12-03,2,Place was ok but food was cold. I had a cup of wonton soup with hot broth and cold wonton. Rice with sea food had bits of hot and cold pieces too. Service was good but would  not come back.
2015-10-14,4,Chicken and broccoli is great. Sesame chicken is good. And speedy delivery - will definitely order again!
2015-10-11,5,Precious is my go-to Chinese food restaurant for take out in Hoboken. Food is always delicious and quickly made. The wonton soup is one of the best I've had. I have tried many of their entrees over the years and have never been disappointed.Precious also has dine-in service.Their servers are attentive without being intrusive. There is a liquor store next door, which makes this BYO experience very easy. Precious also offers sushi but I'd stick to their Chinese food and save sushi for Robongi, Okinawa, Illuzion or Ayame.
2015-09-21,4,Ordered from this spot this weekend. Pleasantly surprised. Good Chinese food, not greasy. They had tons of faux meat options which is awesome and unusual! Really good vegetarian chicken & vegetarian scallops. Everything was really good. The shrimp fried rice was a bit heavy on the salt though..They have a very diverse menu. Didn't try the sushi - next time. Would definitely order from again. Recommended!
2015-09-06,3,Typical Chinese restaurant that also serves Japanese cuisine. Here is what we ordered:- Hot and sour soup (average)- Chicken and broccoli (slightly above average, good flavor)- Steamed chicken dumplings (good - above average, tastes fresh)- Chicken with peanuts (good - pretty well made)- Maki spicy sushi combo (slightly below average, sushi broke apart and the soy sauce was super salty. Sushi was also a little sweet. The delivery was really fast off of seamless web - we got our food in fifteen minutes and the time predicted was 40-50. They charge a 3.00 delivery fee like a lot of restaurants in Hoboken and had a minimum of 20...which is pretty high for Chinese. If you absolutely need Chinese food...you could order from here...I don't think I need Chinese that badly.
2015-08-18,3,Honestly, the food is pretty good whenever I get takeout but my first time dining in was pretty bad.I get seated outside on a weekday around 8pm. There is no one sitting outside but yet the waiter is hovering. Nothing wrong with being attentive but he was literally standing over us most of the night.Our waiter also served our appetizer, salad and dinner all at once. What was the need for this?  By the time I got to the dinner it was obviously cold.  I was also surprised that there very little rice with general tso's.  Normally when I get takeout it comes in a container but this was a tiny little scoop on the side.  When I got full I asked for the dish to be wrapped.  It was exactly half the dish. Half the rice and half the chicken. The next day when I open it up I noticed he didn't include the rice. Why would you throw it out? The bubble tea was not made properly and I would not recommend. The tapioca balls clumped together like one giant rock at the bottom of the glass.I felt very rushed and there was no need. Will probably only do takeout from now on.3 star food but a 1 star service.
2015-08-05,5,Precious is like death and taxes, you know they are consistent with quality and on time. 6 years and only one order has taken longer the 45 minutes. Most of the time they are at my door in 20-30 minutes. Precious noodle, chicken pad tai are all quality. Sushi is good for take out and you get quantity for your money. It's fresh and cold or hot depending on what you order. Keep it up...
2015-07-26,1,With so many excellent restaurants to choose from on Washington, this place should be AVOIDED. The food is only fair at best. The service is down right surly. We had two entrees. The pan fried noodles with beef was just ok. The beef strips were full of gristle and tasted bland. The sauce was runny like water. The veggies were excellent, at least. However, this entree shined in comparison to the Seafood delight. All the seafood pieces tasted just alike, like old fish. It is a bit disturbing to get scallops, crab meat, lobster, and shrimp which taste nothing like they are supposed to taste. And did I mention the surly server? Yeah, there was that, also.Just don't bother with this yuck joint.
2015-07-25,2,They literally never answer the phone when you want to order which is extremely inconvenient unfortunately. We do really enjoy the food but the whole process of obtaining the food is such a process at times it makes it unenjoyable and upsetting. Their hours are not posted online which makes it more difficult! Help pleaseeee
2015-06-21,3,Came here about a week ago with my boyfriend. We wanted inexpensive sushi and they have this awesome deal that is 3 spicy maki rolls for $15. Couldn't say no! I'm usually a special roll kind of gal but I wanted to keep it simple this time. The spicy maki combo came with spicy tuna, spicy salmon, and spicy California roll! All were very delicious but didn't taste as fresh.For appetizer we got salad and miso soup. The miso soup got cold very quick but it was like any normal miso soup. Satisfactory. The salad however, is usually my favorite infamous for the delicious orange tangy dressing- this dressing however was sweet and tasted like they added duck sauce which made me put the salad away really fast... What a disappointment :( we also got free wontons which were delicious.The waiter barely spoke and was not all that helpful but he did his job. In the end, you can't beat the price and the sushi really filled me up! I had to take it to go! Would come back to try their Chinese food but I have had better sushi.
2015-06-07,5,I give them credit for changing the chairs. My finger eventually healed and I remain a faithful customer. Thank you, Precious.
2015-04-28,5,You can trust them when you rush and hungry, they have fantastic food and so fresh sushi.......nice and worm
2015-04-23,4,The fact that this restaurant doesn't have 4+ stars is beyond me. This is by FAR the best Chinese option in Hoboken and definitely one of the best Asian restaurants overall.Their General Tsos chicken is some of the best I've had and comes with a ton of fresh broccoli, which is great. I've also tried and enjoyed dumplings, scallion pancakes, lo mein, chicken wings, egg rolls and moo shu and everything is great! Their house mustard is a must try if you are into spicy.Their wonton soup is so good I sort of hate them for it. It is indeed SO good - delicate, thin skinned wontons with a delicious pork filling seasoned with ginger and scallions, a silky salty (but not too salty) broth and a bunch of fresh spinach that they stuff in the top of the container - that I can't have wonton soup from anywhere else anymore. I actually ordered some to work yesterday from some place in the city and threw half of it out :(.You can eat in at precious too - the inside is actually pretty cute, and it's BYO which is great! I guess I'm just an eat Chinese food in my PJs while watching Netflix kinda girl....Great food, fair (ish) prices and fast delivery/pickup earn Precious a solid 4 stars!
2015-03-29,3,I always order Chinese takeout from here because a) it's good! And b) it's cheap! That being said, the quality has gone down of this place in the last year or so. Still would recommend coming here to everyone!
2015-03-24,1,I used to order from here a couple times because the lunch specials are a steal (not for dinner though way too $$ for what you are getting), however after my last meal I think its time to say goodbye.  I got general tso chicken and there was WAY too much breading on the chicken, it was gross.  The vegetable fried rice was also very dry which didn't go well with the excess flour coming from the chicken.  Satay across the street offers much better food.
