2021-11-06,5,Best in the east. Go all the time. Top spot. I like general Tsao and the egg roll. Friendliest in town
2021-10-27,1,WARNING TRIGGER PICTURES: We have been ordering from this place for a while never had a problem until this weekend we ordered sushi and we found a A LIVE WORM crawling on my shrimp tempura sushi. I was absolutely repulsed and threw up. We called the restaurant they apologized and refunded us and that was it, after literally ruining our day and probably never going to eat sushi again! DISGUSTING.
2021-10-18,1,1st & last time. Server demanded a tip after i changed from dine in to take out. (it started raining, I was outside with a dog, so before the food was even done being cooked we requested to have it to-go). chicken was not cooked through either. yuck!. trash.
2021-09-27,5,Ordered for take out. Ready when we got there and very nice people who greeted us. Food is yummy. Seems like a reliable Chinese spot!
2021-09-26,1,The food has gotten so bad you just cant eat it. Salty. Flavorless. Even the white rice wasnt cooked correctly.  Had simple food.  Spicy dumplings in hot peanut sauce. It wasnt hot. Wasnt peanut. Salty brown water with bone and grizzle fragments in the meat inside the dumplings. Awful.
2021-09-19,5,I love this spot. It's my go to for certain things. I like to sit outside and eat while people watching. It's a bring your own bottle spot. The food is great, the service is fast.
2021-08-02,5,If you grew up on Hot Wok, New China and anything that mimics fresh food cook to order then you are going to love this spot. Super delicious with speedy service. Outdoor dining is available with a nice view of Washington street. Would come back!
2021-07-10,1,The food was late because the driver went to the wrong place so my food came cold, and on top of that I found 3 hairs in my tofu. I called the restaurant and they asked me to send a picture to a phone number for "proof" I will never eat there again.
2021-07-10,1,Ask for my phone number. Repeated my address, took my entire order... asked how much I want to TIP the driver, I said $2 and he said sorry we are busy can't deliver. HORRIBLE.
2021-06-23,1,It was horrible! I went there yesterday and got a lunch special that had a roach in the food. It was disgusting! Not eating Chinese food from this place ever again. I recommend you going somewhere else.
2021-05-13,5,We ate outdoors and the waitress wore a mask. The food was exceptional! They have egg drop soup without corn!!! Hard to find and it was fresh and delicious.My son and his girlfriend also loved the vegetable sushi. The dumplings were great! I had the vegetarian version of chicken with mushrooms and green onions. Everything was so tasty and fresh. I will return soon.
2021-05-11,1,I order from precious a lot and it's one of my favorite places in Hoboken. I ordered garlic chicken and came across a cigarette butt, I'm surprised disgusted because this out of norm for them. And of course I didn't notice right away and had eaten about half of the meal. Needless to say I won't be ordering from here for a while
2021-03-07,4,I'm pretty picky about my Chinese food. I don't like anything too oily or that tastes like it's been defrosted. This place fits the bill. Good tasty food that taste fresh. Especially their BBQ spare ribs, very juicy and meaty.
2021-02-19,4,Incredible food! The menu has an great range of food and also offers sushi! My personal favorites are the dumplings, general tso and chicken amazing. The portion sizes are generous. The only thing that's lacking is the atmosphere inside the restaurant. It's evident they do a lot more take out (which may only be due to Covid)
2021-01-26,5,We just moved to the neighborhood and this was our first takeout order. The food was amazing! The edamame needed salt... but the shrimp and broccoli and the ginger chicken was so fresh and tasty!!
2021-01-21,5,After a long awaited reopening, I was finally able to order Precious. Delivery came quickly and was piping hot. I wish I tried more so I could have a longer rave but I must say, my ginger prawns with green beans was amazing. I got it with brown rice (there was no extra charge for brown rice, finally!) and it was seriously enough for two meals. I ate well past the point of being full and still had plenty leftover for lunch the next day. The prawns were huge and there were a ton of them, cooked perfectly. The green beans literally were overflowing out of the takeout box (all cooked wonderfully crunchy). Okay, I'll stop talking about how big the portion is. The ginger sauce was seriously so great. It was flavorful and rich and there was enough to soak through all of the rice. They have such a big menu with so many different options that I'll definitely want to order some appetizers next time (a lot of reviews mention the sushi pizza) but it will be tough for me to not get that ginger sauce again. This place is wonderful and I am so happy they are open again. I wholeheartedly recommend! And if you are a ginger everything enthusiast like me, get the ginger prawns.
2021-01-19,5,This is one of my go to spots for Chinese.  Very consistent.  Great for delivery.  I've never had a problem here and the food is good (caveat I've only ever ordered Chinese from here and never tried the Japanese )
2021-01-15,4,Popped in for lunch and had a great lunch meal for under $25.00 for two! What I love about Precious is if you can't decide between Chinese or Japanese you can have the best of both worlds. They offer lunch specials M-F and I got one from the Chinese menu and one fromThe Japanese menu. Two roll special, kept it basic with avocado and California roll. Very fresh rolls and delicious. It came with soup and salad. Also we ordered the general Tso lunch special which comes with egg or veg roll and rice/ brown/white/fried. One of the best general TSo's I've eaten. Not too spicy and not too fried. Perfectly cooked! Service was great. Speedy for lunch and everyone was very hospitable. Got a new lunch spot in Hoboken :)
2021-01-14,5,Just finished my meal from Precious.  I have always been a fan,  but I tried their new Mongolian beef dish.  Delicious!!!   Great addition to the menu.  I always appreciate their prompt professional service.  Never had a bad meal there.  Love you guys!
2020-12-14,2,So I'm giving 2 stars. I just moved to the are and I was in the need of a good Chinese takeout spot to order from. I ordered twice already, food was good not going to lie. However the second time I ordered, I ordered through uber eats and they didn't have the option to substitute pork fried rice. So I called them and spoke to someone on the phone. Apparently it was such a hard time to substitute for a different kind of rice. The guy on the phone was giving me a hard time and saying that I couldn't substitute because it wasn't an option I would have to go with what was set with the dish which was white rice. I tried to explain to him 5x that if it was such a big deal I'll pay for the rice separately and you can just put the fried rice in my order bag. He was still insisting that I couldn't do that. So after 6x of repeating my simple request he called the manager and the manager OKed the request. so when I asked for the add in I asked for a small order since it was just going to be me and my partner. He said no it has to be a large because it's a small uber eats ordered and charged me 10$!!! Unbelievable. It's a shame because the food was actually decent and for a second I thought I found my permanent take out spot. There's other choices out there. Don't order from here.
2020-12-08,4,I'd certainly return for the Singapore mei fun as well as the hot and sour soup, welcome treatments for a cold though maybe I should have gotten delivery instead of walking to Hoboken. The cold noodles aren't a strong point. But in addition to solid work on a couple of classics, Precious scores with a more audacious item, the tuna pizza. It has tuna and avocado and I'm not sure what else, but should appeal to non-purist fish enthusiasts.
2020-11-03,5,Really tasty sesame chicken, vegetarian general Tso chicken was very good! Sauce and quality is amazing! Soups were hot and very generous lunch portions. Free delivery with Seamless +
2020-10-11,5,Precious is by far, the best Chinese food in Hoboken. Their vegetarian meat dishes are the best I've had and I crave it from time to time. They have been closed since the start of COVID in March and no other place does vegetarian meat dishes like they do. Came in for their grand re-opening today (10/11/2020). They have new outdoor seating, glass protective screens at the register and indoor seating as well. Their food is still amazing - please get the vegetarian sesame chicken! And still affordable - lunch comes with a side of rice (brown or white) and an appetizer (soup, egg roll or veggie roll). Please don't hesitate to come and support a staple of Hoboken!
2020-09-19,5,Hands down the best Chinese food in the area. Happy to see the sign on their storefront that they plan to reopen by October! Every dish we've ever ordered was fresh, flavorful and never greasy like others can be. Generous portions at a reasonable price. Will be ordering often to support them again when they reopen.
2020-09-19,5,They might reopen in October!My favorite Chinese restaurant of all time. There is nothing like Precious. They have the biggest and best egg rolls you have ever seen or tasted. Their ginger chicken with string beans has beautiful slices of fresh ginger and garlic, large pieces of white meat chicken, and the beans are always tender crisp and green. Their cold sesame noodles are to die for. I love their pad Thai, their Kung pao, orange chicken, chicken chow mein, egg foo young, and mu shu. One of my favorites is their pineapple chicken fried rice. Literally everything is knock your socks off. I hope they really do reopen in October. I will order one of everything.
2020-02-12,4,Solid Chinese. Delivery is so freakin fast, it arrived to my apartment 3 blocks away in less than 8 minutes. I don't know how they did that. I like the chicken and broccoli, the fried rice and most everything else.
2020-02-06,1,I arrived looking to have a good lunch. I placed an order for chicken with broccoli with the notion that this is a staple at all local Chinese restaurants - an order I believed they wouldn't mess up. When it arrived it was doused in some kind of sauce that tasted rotten. In fact, the entire dish tasted like sour milk -- the chicken, sauce, and broccoli. Unfortunately, I didn't consult Yelp before patronizing this establishment but when I did I realized that there were quite a few 1 Star  reviews. The 1 Star reviews are accurate guys. Skip this place and go to the next.
2020-01-01,1,Ordered on my girlfriends grub hub account. After an hour and a half of waiting I called to ask for the status and they told me they never put the order in. Would give negative stars if that was an option.
2019-12-09,1,I rarely write yelp reviews, but I feel this is a much needed review for any new people to the area who aren't familiar with the Chinese food spots around here. I usually order from Lo-fatt-chow, which is amazing and hands down the best in Hoboken, but didn't today because they don't open till 5pm. So here we go...we ordered chicken/broccoli, chicken lo mein, and boneless spare ribs. The chicken was rubbery and the broccoli was barely cooked. The lo mein was just ok. The boneless spare ribs were tasteless. I would compare this place to mall Chinese food without the flavor. You should just grill a chicken breast with no seasoning and throw it over a pack of Ramen noodles and save yourself the money you'll waste here. Extremely disappointed.
2019-11-26,5,Amazing food, great service, and always quick! I order take out a lot and my food is always ready when I get here and always hot (whether I'm early or late). I love the lo mein, fried rice, and chicken and broccoli here. The staff is super nice and helpful and make for a great experience every time I come in. Great restaurant!
2019-11-23,4,Grabbed some takeout from Precious for dinner.  Egg Rolls, Crab Rangoon, General Tao and Shrimp LoMain.  All came packaged well in plastic takeout dishes and after a 5 min walk home all food was still at a perfect temp to eat.  Service is good and fast.  Would definitely return.
2019-11-03,1,This restaurant sucks. Don't come here. The worst services I've ever met. The waitress stupid and they spitted ptysis into the dish.
2019-10-26,1,I recently placed an order for two lunch specials of egg foo young.  When I received two orders of fried rice and egg rolls for $16. I called back to find out where the rest of my food was the hostess was nasty and said I never told them I was ordering egg foo young.  I was than told it would be an additional $23. I asked why so much and she got nasty again and said that it was not a lunch special. She continued to argue with me that I didn't order correctly and it was my fault. I ended up bringing back my dinner and the hostess was nasty again only to offer part of the refund back. This was the second time I ordered a lunch special and when I got my meal I was charged $15. When I called back I again was told I didn't order correctly.I will never order again from there, they just take orders, repeat what you ordered and than send and charge you what they want. They definitely need to work on their customer service skills
2019-10-21,3,Been hearing this is the best chinese in Hoboken so I put it to the test. Delivery took a little longer than other chinese spots I have ordered from.  I went with the classic item on every chinese restaurant menu... General Tso's. It's like the Big Mac of Chinese food. This one isnt you your classic general tso's. I prefer the classic. This one is like chicken tenders in some gooey red sauce. It isnt too spicy so you don't have to worry there. We also tried the pork dumplings and the vegetable fried rice. The dumplings were good. Good pork flavor as well. Fried rice tasted like... fried rice. Overall, good experience but not good enough to change from my normal go-to spot of number 1 fine chinese. Not bad though.
2019-09-06,1,Last time we Precious we ordered in. When I opened the container for our cold sesame noodles there was a large insect (maybe a baby cockroach?) cooked into the food and right on top of all the noodles. We immediately called the restaurant to notify them. They asked if we wanted a new dish and we told them we only wanted a refund since all the food was going in the garbage. I appreciate that they provided the refund and were apologetic, but we won't be returning here again. I've also read many other Yelp reviews of this establishment that document "foreign objects" in their food, like steel wire, fingernails, hair, etc. so this unfortunately seems to be a larger cleanliness issue and health hazard than it is an accident. Again, we won't be patronizing Precious again.
2019-07-23,2,I arrived to the restaurant and I felt pretty comfortable at first. Then my nasty server accompany does at the table. He was very dry, mean, read, and very dismissive. I couldn't believe it was my first time at this restaurant I was so disappointed however the food was really good. when it comes to the restaurant great food is just not enough. He actually stood at our table to collect our receipts and he evaluated our receipts at the table right in front of us as though we were going to under tip him. How rude is that? I will never be coming back to this restaurant again.
2019-07-20,2,Ordered lunch special yesterday, dry sauteed string brands  with vegetable Fred rice and wonton soup.Total plus tax $8, which is not bad, they also give a package of rice noodle snack with it.Dry sautéed string beans - worst I ever had, I have this dish all the time, the one I have from Chinese supermarket is even better than this...Rice and soup is okay, not good, but still okayIt's a cheap lunch, but you got what you paid for, stay away from the string beans
2019-06-23,4,Never went in person,  but I ordered deliveryThe delivery came 20 minutes sooner than predicted, so that was great.I ordered the cool summer roll which was shrimp tempura on the inside and avocado and salmon on top. It was yummy.I also had the crab rangoon. It was weird. I did see lumps of kani was was great. However, the cream cheese did not look like cream cheese. It looked like the broth of creamed corn soup. It also did not come with any dipping sauce, so luckily I had duck sauce at my home. I tried eating it plain at first, but again, it was weird.My friends ordered lo mein, which looked pretty standard, as well as California rolls. No complaints on their end.
2019-05-22,3,I have eaten lunch here several times and the food is good, but the service is awful.  The first time, I had a female server who was pleasant, but the last 2 times, I had a male server who was cold and rude.  I also ordered shrimp and broccoli and there were just 4 shrimps.  I brought a friend from out of town and she was shocked by how rude our server was.  Management needs to get on top of this!
2019-05-10,2,Let me start by saying that the food here is great. They have good lunch specials and a nice ambiance, and I frequent here a lot.The reason for the low rating is the extremely rude service. I always tip well when I eat in, but working as a dog walker, sometimes I just need a quick bite to eat (soup or an eggroll). Last time I came into an empty restaurant and asked if I could order just a soup, but was told there is a minimum to sit. No problem. I ordered to go and ate it at the outside tables (also empty). 5 minutes later I picked up my trash and left happy. Today I ordered an egg roll to go, and when I tried to quickly sit and eat outside (still an empty restaurant), I was told I couldn't eat there and would have to move. Seriously?! I just purchased something from your property that will be consumed in less than two minutes, the restaurant is empty and I am at an outside table which I will fully bus as soon as I am finished, and you still refuse to let me stay?! Terrible, terrible customer service. Shame on you!
2019-05-10,1,the service is absolutely horrendous at this restaurant. 0 for service. 7 for food. 3 for ambiance.the server will make you feel uncomfortable and tell you they're closing in 20 minutes at 8:45pm, when they aren't. they are rude and inconsiderate.also, for delivery, my friend has been called a racial slur because the driver did not appreciate the tip he was given and on a separate occasion, I was screamed at profusely for tipping within the 15% range on delivery.don't patronize this establishment.
2019-05-06,1,I guess it takes a traumatic experience to submit your first yelp review. However after finding a side of human hair in my order, after finishing said order, I cannot in good faith allow others to order from this establishment.Shame as this is normally my go-to Chinese spot in hoboken. However I may suggest hair nets....Full disclosure my hair is neither jet black, nor straight.....
2019-04-14,5,Ahhh cool this place is awesome I love the sashimi appetizer and the hot and sour soup. The spider roll also is wonderful.  Love theses guys!
2019-04-07,1,Never had an issue with the spot and has always been my go to in regards to good chinese food in New Jersey. With that being said went in for dinner on a Sunday evening. Definitely not busy and seated right away. My server immediately said " one or two?" And I responded "hi, how are you?" Server Ignored greet and asked again "one or two,? " In which I responded " just one person."Really one star rating isnt for the food but rather the service and lack of professionalism of the waiter. Didn't feel welcomed and when I ordered my food he proceeded to watch me eat my food, didn't refill water, I had to keep asking for everything like soy sauce, and chili sauce for my noodles. When the Bill came he placed on table and never once asked " did you want anything else," or more importantly refill my water. I had the bill sit on table and he walked over twice to ask if I " was ready to pay." I paid the bill which was $ 14 and proceeded to walk out. Did not leave a tip as I don't believe in Leaving a tip to a server that is rude. And glad I didn't because not even 3 minutes outside the restaurant when I left he screams down Washington running behind me saying "excuse me," with the bill in hand. I turn around and he says "no tip?" I said thats correct I don't leave tip for bad service. He gets mad and yells " next time don't sit in, order food to go." I ignore and walk away. Terrible experience and will never patronize this business again!!!
2019-02-27,5,Excellent food, fast delivery! Not sure why this place only has 3.5 stars..? Glad a friend recommended it as the "go-to" Chinese place in Hoboken. The sushi was fresh, our entrees of fried rice, chow fun, and general tso's all arrived hot, delicious and less than half an hour after we ordered.
2019-01-02,1,I've been a customer here for years until yesterday. The food is average. I had food delivered yesterday and the delivery guy was over the top rude. Apparently he figured he deserved a larger tip and didn't hesitate to say so. He became belligerent, started calling me names. I'm not kidding about that - I have never experienced such a thing from a restaurant employee. Also noticed that I was overcharged on the receipt. I would never recommend Precious - it's nothing special and they provide horrible service.
2018-12-21,5,Everything is delicious! Their wonton and chicken rice soups are the bomb! The lunch specials are such a great deal. Very generous portions at reasonable prices. Love going to the restaurant and ordering takeout.
2018-12-16,2,Ordered from this place on a Sunday afternoon. I don't even know if I'd consider this Chinese food. We ordered shrimp rolls to start and they were bland and soggy. Our entrees were also extremely bland. My boyfriend got general tso's chicken and it was covered in soggy batter with barely any sauce. My chicken and broccoli had zero flavor and the sauce was like water. Not the consistency like chicken and broccoli I've had before. I probably would not order form this place again, although the delivery was quick and on-time. Better choices in the area for sure!
2018-11-21,4,Chinese food is a hard one to say good vs bad as there isn't really a ton of absolutes. I feel like Chinese food more than any other type of restaurant is circumstance/timing on when you are there. Sadly... in any event Precious is as consistent for Chinese Food as I have experienced. I think the restaurant can use a slight upgrade in ambiance but then again that isn't why someone would go for Chinese food.
2018-11-14,2,Vegetable fried rice was dry, vegetable roll wasn't good, egg roll was dry, and garlic broccoli was fine. Thai iced tea was not good.
2018-10-20,2,First off frozen egg rolls, meh. only with msg in hot and sour - how lazy. singapore mei fun odd taste and I think spoiled meats. Not good. low mein was ok, but nothing to write home about. Definitely a reason not many people.
2018-08-22,1,an hour and 45 min for delivery when app says 45 minutes; 2 calls to resturant later and one call to grub hub, 10 more minutes 10 more minutes, STILL NO FUCKING FOOD
2018-08-09,5,First time in Hoboken and came here for dinner. Chinese food at this restaurant was amazing!!! Customer service and the quality of food was really good. Their dishes are fresh with an authentic taste. Prices are reasonable, environment is clean and relaxing. Totally worth coming into this restaurant!
2018-08-05,3,This is in response to Eric P.'s review. I read that review when trying to pick a Chinese place and laughed at the thought of a delivery guy doing that. Well. I got the same delivery guy. He gave me my food and said are you tipping in cash? And I said no, I tipped on my card. He stared at me and didn't say anything. So then I said through seamless. You tip on the card through the app. He stared at me again. He looked as if he had just been dooped. And then turned around and walked away. So weird. So uncomfortable. I assumed they would have fired him. Idk, the food is pretty decent so I guess I'll give it a three.
2018-07-28,3,This is probably one my favorite Chinese restaurant. But I have one issue with them. They don't listen to directions. I tell them every time I place my order "please no scallions" and every single time I get my food I have scallions.  That's why o give 3 instead of 5
2018-07-07,1,Extremely rude delivery person. He muttered a rude comment to me when he rudely shoved the bag towards me. Unbelievable. Will never order from here again.
2018-06-26,4,My go-to Chinese food place in Hoboken. The chicken and rice soup is delightful and can't miss here. We usually get sesame chicken, chicken with broccoli, fried rice or beef with string beans. All very good and very reliable. Delivery is quick and easy. If you're looking for quality Chinese food, this is your spot.
2018-06-20,3,I don't normally write negative reviews but I'm still upset about today. I go here often for lunch takeout because I do enjoy their Chinese food. Today, myself and 3 coworkers all ordered lunch to go. Once we got it, the 3 of them went back to the office and I decided to stay and eat it there since I had a doctors appt next door in 15 minutes. I was the ONLY one sitting on their outdoor patio (and they only had one table inside) and I was kicked out. A waiter came out and literally said "If you want to eat here, I have to put your food on a plate and you have to tip me." First of all, tipping is ALWAYS option and second, I was one person eating alone and clearly not leaving behind a big mess. I'm not sure how a restaurant who kicks their own customers out stays in business but I won't be coming back here.
