2015-03-06,1,******MUST READ******My girlfriend and I arrived home late from our vacation to St marten last night. We were starving for some quick food. We called up Precious and order some dumplings and an egg roll. Once we opened the food up and started eating I NOTICED A STEEL WIRE IN THE EGG ROLL!!!!!!!! I REPEAT A STEEL WIRE.. CAN YOU IMAGINE IF A SMALL CHILD STARTED EATING THIS AND DIDNT REALIZE IT???? This restaurant is dirty and needs to be shut down immediately. I'm also posting a picture of the wire
2015-02-21,1,Worst Chinese I ever ate!The chicken cashew was made out of processed chicken that was chewier then gum. Awful!The veggie noodles were tasteless.Don't understand the ones who give this place good ratings. They probably never tasted real Chinese food.
2015-02-19,2,I ordered take out from Precious and I would sadly say that that was my first and last time.  I was not pleased with the portion size - it was so small!  I had shrimp with broc and the food was good but I just could not get over how small the portion was.  The service was ok - they did forget my wonton soup and they did make a point to come back and deliver it.  Overall, not pleased.
2015-02-19,5,Great Chinese (delivery)  food! My favorite delivery place - great food , fast delivery and everything is always hot and fresh . Actually, I have never had a bad experience so I will keep ordering !!
2015-02-09,4,One of my favorite spots in Hoboken, for dining in or delivery. First, they're BYOB, so ordering lots of delicious food while getting drunk on a budget is definitely the move here. Nothing fancy about the ambience/music/lighting, although it is dim. Not an impressive date spot but I've done it anyway. In warm weather months, it's awesome sitting outside and people watching the streets of Hoboken.Dishes to try: sesame chicken and shrimp, chicken and shrimp stir fry, pork lo mein, shrimp toast, any of the fried rice.  Was not impressed by their curry dishes. Their sushi is also good.
2015-02-04,3,This is a decent spot to get Chinese food in Hoboken.  Nothing spectacular, does not disappoint but does leave any lasting impression.I ordered the General Tso Chicken and the Mooshu Beef.  It was pretty average.  My one critique would be the breading on the chicken was just too much, it was about 60% breading and 40% chicken.  Not what I was expecting when ordering a chicken dish.  Delivery was timely, and the person who took our order was pleasant.
2015-02-02,5,This is the best Chinese I have ever had- whether it's dine in or take out it does not disappoint. Huge step above your standard Chinese food. Favorites are- wonton soup, general tsos, chicken and asparagus and chow fun with chicken and vegetables!
2015-02-02,3,This place used to have the best Chinese food in town but it has gone downhill.  It is just so-so now!
2015-01-03,4,Its good and it does the job when I am craving Chinese food. However I did notice that it is overly salty. But hey I guess that's what Americans like.....
2015-01-02,3,This restaurant was okay we ordered the famous generals chicken and it was overcooked very dry hard to cut with a knife. We ordered the pad that I was which was really great however the lo mein was absolutely amazing. Tthat was the only dish that we were able to finish. We also ordered the vegetable delayed which was really nice the vegetables are cooked really well the greatest part about the dish was there sauce. This is a BYOB place so make sure you bring your nice bottle of wine or beer. The waitstaff is very slow and hard to understand. They take a really long time. We try to ask about certain dishes and what's in them and they were not knowledgeable in their own dishes.Overall after complaining about our chicken dish they took it off of our bill however I would not get that again. I would be very skeptical to order another meat dish at this restaurant again. However I might just go back to have the lo mein again.
2015-01-02,4,Recently moved to Hoboken and have been looking for a decent go-to for Chinese.  Precious has been our favorite so far!Our usuals - sesame chicken and beef with broccoli were both good, especially the beef with broccoli.  Delivery was pretty quick, and the food is consistently good.
2014-12-16,5,I have been ordering food from this restaurant for over 10 years. They have a great selection and their delivery service is always on time. Their staff is very organized and friendly. They offer a great selection of both Chinese Food and Sushi.  It is always fresh and hot when it arrives to my home.
2014-11-30,4,My favorite Chinese food in Hoboken. Favorites: -Sauteed String Beans (comes with lots of garlic!) The string beans are sauteed in garlic and oil or butter. They usually are cooked pretty well almost to the point where they get soft. But they are delicious for an appetizer to share (they come with rice on the side).-Hunan Chicken is a mildly spicy dish with a brown sauce, broccoli, the mini corns, and green peppers. I recommend it! -Chicken and Rice Soup is pretty good with slices of chicken, a bunch of rice, chicken broth and a few scallions. It's great for a cold night!Not So Favorite: Wonton Soup. I love Wonton soup and theirs is a little different; not the traditional wonton soup and something about it I don't like. Plus the wontons fall apart very easily. Other than this I like everything I've ordered so far.The Chinese food is good. But for Hoboken it's probably the best option.
2014-11-24,4,This is the best Chinese food I've had in Hoboken. Delivery is quick, friendly and the food is always consistent. I'm a pretty habitual Chinese food ordered so I can only speak to a few of the items including the won ton soup (good), pork dumplings (good), chicken with broccoli (very good) and the vegetable mei fun (very good).While it's not the best Chinese food in the world, it's def great in a pinch, and better than anything else around.
2014-11-13,5,Tried this place for the first time this week and the food was delicious.  There were 4 in my party so we shared different dishes and everything was superb, especially the Wonton Soup which is the best I have ever had. Extremely kid friendly and on that note,  I want to personally thank you for being so sweet and attentive to Gabriella and Victoria who is only 2. When I visit my niece Anna in Hoboken and I ask Victoria what she wants to eat, she always says Precious Chinese, and now I know why!!!!!  Looking forward to my next visit and thank you for a great experience!!!!!
2014-11-10,4,Everything I've ever ordered has tasted great. Friendly and quick service makes me want to come back. Inexpensive lunch specials especially for Hoboken. Slight substitutions allowed.
2014-11-06,4,Great lunch special! I ordered the eggplant with garlic sauce lunch special and it came with rice and soup for $6. I also ordered the green salad to try it. I really liked everything. I got the hot and sour soup and the vegetable fried rice with the special and both were delicious. The eggplant was awesome too. Sometimes Chinese places don't cook the eggplant enough but this was cooked perfectly and I loved the sauce.
2014-10-27,2,The avocado salad was literally a pile of lettuce and pieces of avocado. Most unimpressive salad ever. Restaurant was cold and my little fingers were sad.The onions in the pineapple fried rice were the size of half an onion! How did they expect me to eat that? My mouth is only the size of a quarter of an onion!
2014-10-26,4,We order from Precious regularly. The pork fried rice is very good, as are the egg rolls, wonton soup and peanut chicken. I've even tried the sushi, which is also very good. It's probably the best place to eat American-Chinese (Asian?) in Hoboken.I noticed some other reviewers said the kitchen can be inconsistent. This is true. A couple times we ordered and my favorite dishes were off. Not sure what's going on in the kitchen, but they should fix that. They also have BYOB if you eat in.
2014-10-24,4,Absolutely my favorite Seamless restaurant in Hoboken.  They have regular delivery staples like Chicken w/ Broccoli but also some pretty authentic dishes like crispy salt and pepper shrimp + squid.  Portions are generous and you definitely get your money worth! I love the variety they offer and have yet to have a disappointing delivery.  The only issue that I have is their long delivery times - but at least they mark it accurately on Seamless!!!
2014-10-15,5,Solid, solid Chinese food. The chicken/broccoli with garlic sauce is out of this world, and they make a mean lo mien. They get your food ready quick and it's always excellent. I will be a loyal customer as long as I'm in Hoboken!
2014-10-13,4,i work in hoboken and tend to order dinner out frequently and im always looking for good chinese, i tried several ones before trying out precious, and let me tell you this is by far the best chinese ive had in a while. The restaurant its self is always clean and the staff is awesome, even the delivery drivers! delivery always no more than 30 minutes after i order. Their sesame chicken is great and also their fried rice, might pay a little more than other local chinese spots, but its well worth it.
2014-10-09,4,On the brink of greatness!I implore you to try both the wonton and the sesame chicken, probably the best ive ever had hands down...Although, this restaurant can be slightly inconsistent, I repeat slightly, it is not a hit or miss type of place.Let me give you some background, the food is top notch when the kitchenis on, and good when the kitchen is off.  The wonton soup has a perfect balance of savory and salty, the addition of basil to the soup is unconventional yet adds an amazing edge to the dish.  The sesame chicken is all white, all quality chicken, and it is done right, almost every time.  The service is really good, averaging 40-45 mins for delivery but it normally gets here faster.  I like that you get to choose between white and brown rice.  As well as, I pike that they have quality Japanese options, like sushi.  Their pupu platter is really good as well as their dumplings.  However, there a things I would NOT order here, like the pepper steak I just ordered.  I normally love sweet & sour chicken but their breading is bland but their sauce is delicious.Lastly, their lunch area is top notch and you have even more comb options then at dinner.  Bang for your buck is fantastic as a local lunch option!
2014-10-08,2,Not a bad place if you like "American" style Chinese food.  If you're expecting authentic Chinese cuisine, look elsewhere.
2014-10-08,4,I have been coming to Precious for about 10 or so years. I am usually never dissapointed. I like to get the white meat General Tso's Chicken. So yummy! I think mostly can beat their take out lunch specials. You get a soup, with a pretty large entree. The presentation is great mostly. Love their chicken wings too. Overall will come back as long as they're food stays yummy!
2014-10-02,4,My favorite Chinese food in Hoboken.  I call to place an order and it's ready in 15 minutes or less. The Hunan Chicken (spicy) is a great choice and like most Chinese food places it comes with a lot of food.Definitely try the string beans - they're sauteed with garlic and for a side dish it's a huge portion. Plenty to share.
2014-08-31,5,Always like their food & service.  Recently got undercooked fried chicken - mistakes happen - and they quickly replaced it.
2014-07-24,5,I am born and raised in Hoboken....tried it all. Precious is by far the best Chinese restaurant food hands down. I love their steamed pork dumplings and wild garlic shrimp. Food is very fresh...veggies still have their bite. To others complaining about a hair on your food....yes its gross. But raging about it and shouting at other customers to warm them and storming out is not called for. I can't count the times I've ordered. Please remember everyone is human and amongst thousands of orders over time their can be a mishap. Precious is a great Chinese restaurant :) oh and I find it so funny how the delivery guys always run away after giving you your order. Lol must be very busy
2014-07-18,4,Very cute Asian fusion restaurant in Hoboken.  The staff is very nice and attentive.  We tried the calamari and it was very yummy.  We also tried the beef and peppers which was good except the onions were not cooked down fully.  We did really enjoy the garlic chicken though.  They have a huge menu so I'm sure they have lots of other good options too. We will be back.
2014-07-02,1,This is quite  possibly  the worst Chinese food I ever had.  In fact I don't usually  write reviews but I joined this site just to write it.  Soggy meat vegetables are not fresh.  The sauces are tastles except for the overreaching hot Ness.  Eat here only if u have no option.  Coming from Manhattan  I don't hope Hoboken  had better food guess I was wrong
2014-06-15,1,I really don't understand how this place has so many positive reviews. It's really bland and bad Chinese food. The spare ribs were so dry that we wound up getting our own sauce. The wonton soup had no flavor and we added our own seasoning. It goes on and on. I've ordered take out from there a number of times, so it's not just a single instance. Istana sushi and wok is much better. If you're ordering check them out.
2014-06-10,4,I got delivery from here last night. The service was quick and the food was piping hot. When you order Chinese from a place like Precious that is pretty much all you can ask for.The general tsos chicken was good and the crab rangoons were good but nothing excellent or even great. If you are in the mood for solid Chinese food that will arrive quickly and be hot then this is your place.
2014-06-10,3,Been there couple of times. First time sit-down was good. Second time take-out was bad. The Pineapple chicken fired rice was weird. The chicken was too greasy and uncooked. We had to throw it away. The Singapore noodles were good. Dumplings were good too. I wonder why there are no good reliable Chinese restaurants in Hoboken.
2014-05-18,4,The food from Precious is probably the best Chinese food I've had, outside of Chinatown. The pork dumplings are amazing and so is the meat selection. The sushi is pretty good but it needs a little more flavor. They deliver very fast, even if you're on the opposite side of town. The interior of the restaurant seems an authentic Chinese interior, but I think it would benefit very much from a remodel. Overall great place!
2014-05-12,4,Food was great, i ordered the shrimp with Garlic sauce, it was very tasty, and full of flavor, the delivery was super fast, I've never seen anything that quick, it was like Asian Magic or something.
2014-05-09,4,I've been ordering vegetarian selections about twice a month from Precious for years and rarely have I been disappointed.  The dishes tend to be oily, so be sure to ask for light oil if that is an issue (it is for me) because they will prepare the dishes with less oil if asked.  My favorite is the vegetarian black pepper "steak" with peppers and onions.  Delicious.  One order is enough for two meals, especially with the huge order of rice (white or brown) that comes with it.  I don't know if it's just me, but no matter how many times I ask, I hardly ever seem to get duck sauce with my order.  That's why it's 4 stars and not 5.  I know they have it, it just never ends up in my bag.I live in JC Heights, and the usual delivery time is 30 to 40 minutes, which it what it takes for  local places to deliver, so I consider that quick. My food is always still nice and hot when it gets here.I've only ever had delivery so I can't comment on the staff in the restaurant, but the order taker on the phone is is swift and polite.  Never messes up an order.  Delivery people are very nice.
2014-05-03,3,there's no good chinese in Hoboken. if you're going for sesame chicken and the basics I would pick this place. their wonton soup is good too. as they give a huge portion of salmon if you go for that. it's good too. decent take out.
2014-04-18,1,Horrible service we got on a weekday! This place is so not kid friendly. We were 4 kids and two moms and got terrible service and attitude at this place. Never again and I taking my family there or ordering for delivery. This place does not know how to treat Hoboken families!
2014-04-11,3,This is not a bad choice for Chinese but the service really needs some adjustments. It makes you wonder if they want you there.
2014-04-03,2,I honestly don't know how this place is one of the higher rated Chinese places in Hoboken. I have one word for the food - BLAND. I got the sweet and sour chicken and it didn't taste like there was any seasoning on it at all. Even dunking an entire piece in the sauce did not make up for the lack of taste. The vegetables and fruit that comes with it (which included maraschino cherries??) were also not seasoned and seemed like they were chopped and heated up for 30 seconds. We also got the pork fried rice which was a little better, but still I thought it lacked the usual flavor. The only reason I didn't give them 1 star is because the delivery was fast and my boyfriend seemed to enjoy the sesame chicken. Maybe I have to try other things on the menu, but for big ticket items I would expect better.
2014-04-02,4,If I want to here I like to order pick-up from here since they are not on delivery.com and seamless has them with a min of $20 plus a delivery fee. Love their wonton soup, also a fan of their crispy sesame chicken lunch special. Def worth ordering food here for lunch and their staff are very friendly! They don't give you their menu unless you take it from their podium, so make sure to grab one on your way out during pick-up or request for one when they delivery you food!
2014-03-07,5,This place is always top notch. Food is good from top to bottom . Sesame chicken to ribs, sushi or dumplings. Just awesome . It's a small quaint Hoboken place . It has become a staple for the best Chinese food in town.
2014-02-13,5,Great experience. They delivered to Hamilton Park, JC in a snowstorm.  Amazing dishes for vegetarians and non-meat eaters! Highly recommended.  The vegetarian dumplings are hands down amazing.
2014-02-13,5,Best chinese food in Hoboken. Many vegetarian dishes. The food is very fresh and the delivery is fast.
2014-01-09,4,This is the right way to go if you're desiring Chinese in the Hoboken area. If you decide to sit, they have a plethora of seating between what is available outside and indoors. The staff is pretty friendly though they leave you alone for the most part, be prepared to grab their attention if required.It's a tad bit more expensive than what you normally barter for Chinese -- but the taste is right and it's prepared well. Portions are large and tasty. Hope you're ready to eat!I've mostly ordered delivery from here while I was living in Hoboken - they're very hasty in their preparation and quick to the chase. I lived about 7 blocks from the establishment and often found my food within 20 minutes at my door - super awesome.
2014-01-07,5,This is a short review but I feel they deserved it on the one dish i tried.Ordered the young chow fried rice for lunch - delivered to work.  Expected typical take out fried rice, received a mind blowing dish of the heavens.  Roast pork was succulent, chicken was flavorful, onions had a perfect crunch, and the shrimp were deveined, clean, and juicy.  This place has sold me on its young chow fried rice alone.  Best I've ever had - and I've eaten everything and everywhere in Chinatown, Flushing, Infinity, and Beyond.  Brought some home to g/f - she agreed.Portion was huge and price was on point.I am excited to go back and try their other food - will update the review if anything changes, but I doubt any place making god-caliber young chow fried rice can do anything else poorly.Worth it to note - if you're especially sensitive to salt or oil, probably not the dish for you.  This review is from a salt and oil lover's perspective.
2014-01-05,5,This is the best Chinese food I've had in the Hoboken/Jersey City area! I'm a big fan of their flavorful chicken fried rice, lomein, cheese rangoons, egg rolls and wanton soup! The food is delicious and cooked just right, without being over-fried like in some other places. I always order take-out and have not dined in yet, but it is a cute restaurant on the inside. It's BYOB and there's a liquor store conveniently next-door to it so the location is perfect. The staff seems friendly and from what I saw at the sushi bar, they make good-looking rolls. I'll have to try those out sometime! They have great lunch specials; their dinner prices are a bit on the higher end but it's worth it. I highly recommend this joint if you are in the mood for authentic Chinese food.
2013-12-14,4,I noticed on Yelp this had better reviews than most Chinese food places in Hoboken. Cute and spacious inside. They have their lunch specials from 11 a.m to 4 p.m. I was craving shrimp broccoli even though I knew I was risking just getting 4 shrimps. But I can't complain the order comes with the  choice of soup or egg roll. My friend ordered General Tso's white Chicken but I made sure I had some of it. I'm selfish. It was delicious! The portion she received was much bigger than my broccoli to shrimp ratio. Our waiter was nice but I felt like he wanted us to rush and he stayed a little too close to our table for my liking.
2013-12-07,4,Ordered for the first time tonight. Have to say I am usually hesitant to order from a new Chinese restaurant, but they far exceeded my expectations. Used to order from Aroma, but since they closed was forced to try a new place and I'm glad I did! Delivery was extremely fast and the food was excellent...very fresh and tasty!I didn't get my fortune cookie, but that's okay, I'll let it go this time.Will definitely be making this my go-to Chinese in Hoboken.
2013-11-19,5,Delivery was super fast! When they say 15 minutes, they really mean 5 :) I love the delivery guys, they're so nice. My favorite would be the General Tso's tofu, veggie/shrimp lo mein (any of their lo mein in fact!), shrimp rolls, and their wonton soup is great. Thin dough, and they also throw in plenty of scallions and spinach.The price is reasonable, and they give you a lot of food. I have eaten in here once, and it's BYOB, which is enough to earn a whole star!
2013-11-08,5,These guys really do delivery well.  Special requests are usually taken care of, the food is great, and the delivery arrives super quick.  Plus they have great Chinese AND Japanese. I order from here at least once a week.Just a heads up-they don't have combo orders for their Chinese food, so it's sometimes a bit pricier for a meal. Don't assume something comes with rice or soup.
2013-10-31,5,I order from Precious probably 1x or 2x a week. The lunch special is the best deal in town and they are generous with the portions. Also, they let me substitute tofu (either fried or soft) in the dishes without an extra charge (for example the chicken w/ cashew nuts or chicken with hot peppers and peanuts) and brown rice is also no extra charge. I don't know if their duck sauce is homemade or not but its awesome - doesn't come in those lil packets but in a cup (it must be homemade right?). Unfortunately that means I have to get a not so healthy egg roll but so be it. The wonton soup is awesome (albeit a lil too salty sometimes!), the flavor of the food itself is better than most Chinese places I frequented on the island and in Brooklyn - that is for standard Americanized Chinese take-out/fare. One thing that I was just MEH about was the hot and sour soup. Its gotta have MUSHROOMS!!!! please.
2013-10-30,3,If you're in the mood for decent Asian cuisine, Precious is a pretty solid choice. It seems really catered to the American palate, which calls for heavy, sweet, and salty kinds of flavors. You won't find the interesting or unpredictable ingredients/preparations that you get in more authentic places, but I've never been disappointed here.
2013-10-21,3,I'm always weary of Chinese places that include Japanese into their menus, but my sushi cravings kicked in. Surprisingly fresh sushi - I ordered the spicy making combo which had three different kinds of spicy rolls (tuna, salmon and yellowtail), and all three were decent.
2013-09-14,5,The best vegetarian Chinese food options in hoboken by a landslide.Also, they're very nice.
2013-08-15,3,This review is for their delivery only. (Which is quick!)This is the type of food that brings shame to my ancestors and would have them rolling over in their graves. But sometimes I just crave some greasy ass food that is Americanized but yet considered food from the motherland (which it definitely is not). The food is not even remotely good. I normally order beef chow fun, Singapore mei fun, chicken lo mein, dumplings. All super greasy and the dumplings are usually soggy. I know when that craving hits, this is the spot I'll be ordering from cause I can always count on their food and flavor to be consistent.Btw, this food is never ever good overnight so if you don't eat it all, I recommend throwing it out.
2013-07-29,4,Best Chinese food in Hoboken, albeit a bit Americanized.  Maybe they have a more authentic menu if you ask?Really quick delivery.  Their delivery guys are constantly in our building as they are clearly a favorite.Oh and definite thumbs up for taking a complaint about one of the delivery guys seriously.
2013-06-15,5,This place is great.  My wife and I go here all the time; they have great sushi, and their Chinese is also very good.  One night when we were there, we were waiting a bit longer than normal for our soup to come out.  Our waiter came out and gave us some edamame on the house, apologizing for the long wait; my wife and I hadn't even mentioned anything about it in the first place!  This experience puts them over the top for me.
