2011-01-28,4,'twas a father-daughter lunch date on a saturday afternoon after a rousing trip to home depot... i was famished! i've been here before, will absolutely come again. the food tastes delicious, there is no doubt about that. very flavorful, one of my favorite asian fusion restaurants in hoboken. the lunch special come with soup (or eggroll) + choice of rice, which is clutch because other places upcharge you for brown rice. service could be better, especially since it's a small place with only about a dozen or so tables and i should not have to ask the waiter for more water, but all in all it's always a very pleasant experience to eat here. two things i do not know about, though: how is their sushi? is it BYO?
2011-01-25,5,One of my Top favorite places to eat thus far in Hoboken! I bring my own bottle of wine and eat DELICIOUS FOOD! chinese and some japanese too! I def recommend!
2011-01-20,4,Quick, tasty and reliable. Particularly good value at lunch time where the lunch special includes soup and a main dish. Best Chinese food in Hoboken. Also do quick and reliable takeout and delivery.
2010-12-23,4,Love Precious!! Tried most Chinese places when I first moved to Hoboken and had terrible food at most. Precious is terrific. Good vegetables in brown sauce, lo mein and fried rice. Dining in has a standard chinese restaurant atmosphere, delivery is quick.
2010-12-19,4,Precious is definitely the best Chinese in Hoboken. Wish I liked their brown sauce a little better, but everything else is really good- fried rice, lo mein, soups, scallion pancakes- all yummy! Fast delivery service, too!
2010-12-03,4,I was very skeptical reading all the good reviews but I was not let down when i received my food. Easily one of the best chinese restaurants  I'v ever ordered from.
2010-12-01,4,Since I am a frequent customer of this place..I can honestly say that not once out of the 50 times I ordered from there have I been dissatisfied with the food..the sushi is fresh and well prepared.. a bit pricey but well worth it..probably one of the best Chinese food I've had ..oh and the delivery is fast
2010-11-07,4,Ahh... My Precious. Long ago when I first arrived in to Hoboken, I tried many different Chinese places, many of which are no longer around. Back then, Precious stood out from the crowd. It has been able to stand the test of time and remained a steadfast establishment on Washington Street. For those that know Hoboken and its changing dynamics, this says a lot. I have been here for lunch, dinner, taken away both, and have had both delivered. Being such a regular guest, I've had plenty of opportunity to catch them off guard. Fortunately they rarely disappoint. The lunch specials are really a great value for lunch in Hoboken. Can't really go wrong with one of those deals. I will mention that the fried rice you get with the lunch special is not the same as the dinner fried rice. So if you ordered it with dinner one night and expected to get the same with the lunch special, it won't be. And of course vice versa if you ordered it with lunch and expected something different at dinner. I know you can order the dinner style at lunch, I don't know about lunch style at dinner but I bet they would. Dinner for two always seems to run me about $25-$30. It is a little more expensive than other places might be, but I feel the value is there on both the quality and portion sizes. Is it the very best? Likely not. Are there some things I just don't like from there? Yes. Are they better than the average place in Hoboken? In my opinion, absolutely.Visiting, I can't say I've ever had a problem with service. Quick, simple, efficient. Taking away has always been quick. Often I can order as soon as I get off the PATH train and my order if not ready by the time I get there, is usually out in the next minute or two. I'm always amazed at the sheer weight of the contents in the bag.Delivery is something else. Now, I do live very close to Precious so I probably have an advantage over others. When I call to get delivery, I estimate that I have about 15 minutes before it arrives at my door. Consistently. It doesn't seem to matter when I call. I can casually get some place settings together, wash up, and my door is ringing. I can't even prep ingredients that fast if I was going to make dinner for myself. Somehow they manage to both cook and deliver it in that time. I love Precious for the simple fact that its great for when you want to eat NOW! I also love the fact that they keep a record of what you order and many times they have finished my order for me. I like that kind of personalization. I am a fan. I have a lot of positive things to say about this place. I will only note one negative experience that I feel is worth mentioning. On a visit 2 years ago I once saw a cockroach walk across a table next to me in the dining room. Now, even the best of places can have their pest issues from time to time, and I'm sincerely hoping that this was an isolated incident that I won't ever see again - and I haven't since. But, I've always got my eye on you my Precious...
2010-09-09,4,Being that myself and my dinner companion were not familiar with Hoboken's restaurants, we spent a good amount of time looking at the menus of many restaurants, a good amount of which happened to be closed, until we noticed that Precious Chinese Cuisine serves some vegetarian chinese food.It was 4th of July so the restaurant was full, it seems like this was not a regular occurrence for the restaurant because it was in some kind of chaos. We had to wait for some time and eventually were seated inside, since all the outside seating was taken.Their menu offers many options, both from Chinese and Japanese cuisines, all of which are reasonably priced. I ordered the Vegetarian Sesame Chicken while my dinner companion ordered the vegetarian General Tso's chicken. Both dishes were very generous in portion, the vegetarian sesame chicken was a bit larger.While many "fake meat" dishes are soy based (usually chicken) or seitan based (usually beef) in this case both dishes were tofu based so they were somewhat more crunchy than what I am used to, however they both tasted great and it was really all in the sauce.Considering how busy the restaurant was, the service wasn't bad at all, we got our dishes in a reasonable amount of time, and got our water refilled a few times. Even though, the table next to us was extremely loud, we still managed to enjoy the dinner.All in all, I am glad we stumbled upon this restaurant and now I know where to go if I ever find myself in Hoboken again.
2010-08-30,4,Let my first Yelp be a positive one.As a New York City native and having spent my formative years in the densely Asian populated Flushing, Queens, I've had my share of a spectrum of Asian food, be it take-out style or fine restaurant presentation. Precious is, well, quite precious. Judging from the storefront one might assume explicit fine dining, and located on prime Hoboken real estate, this is usually a good idea for a dining establishment. Upon entering it's more casual, more relaxed and just generally clean and tasteful. Most of my personal experience with Precious is of ordering food to go or delivery but my in-dining experiences have been pleasant and welcoming. BYOB is excellent next door to a liquor store.The food makes this place go. You can actually taste Chinese five spice seasoning in the eggrolls and fried chicken wings of all things! Every bit of sushi I've tried has been fresh and tasty.  Freshness and attention to quality is something I've come to expect from this place and have been rarely disappointed. Their vegetarian proteins must be tried. Their vegetarian scallops are more enjoyable than many actual scallops I've encountered.THE best place I've found that serves both Japanese and Chinese food. I've probably had better Japanese food at explicitly Japanese food places, same with Chinese food, but this place scores high in both. I'm not ashamed that they know my face there.
2010-08-26,3,Hoboken is certainly not lacking in Asian fusion restaurants, and I often frequent Rice Shop, which incorporates dishes from Thailand, Malaysia, China, and Japan.  However, I had also heard fabulous things about Precious, which focuses solely on Japanese and Chinese cuisines.  I was recently spending the afternoon with a friend and her boyfriend, and they insisted that we head there for lunch.  The menu offers lunch time specials from both Asian regions.  While my friends loved their fresh sushi roll platters, I opted to go the Chinese route with an order of Steamed Tofu and Mixed Vegetables with garlic sauce on the side.  I started the meal with a Vegetable Roll, rather than the soup, due to the summer heat.  The crisp starter was very tasty, but was heavily fried like a classic egg roll.  My entree was mediocre, because I found the mixed vegetables not overly fresh or crisp.  My brown rice was also fine, but not perfect.I did, however, enjoy the casual, yet sheik, decor and reasonable prices.  I could definitely add this into the second tier of my restaurant rotation.Precious offered us a relaxed meal in a nice environment.  The food was pleasant, but nothing amazing.
2010-07-27,4,Food here is very good and prices are reasonable.  It also has more variety (noodle soups and crispy noodles are really good)  than some of the other chinese restaurants in the area and some of the appetizers are almost as good as in chinatown.  Definitely better than the usual take-out.  Service is great as well, and the location is very easy to get to in town.
2010-07-11,5,This by far the best Chinese food in Hoboken. Great young chow fried rice and shrimp and broccoli in garlic sauce yuyuuuummm!!!
2010-06-09,3,Their vegetarian ma la scallop meal is delicious as is their regular ma la scallop. This place listens if you say extra spicy too. (which i enjoy)
2010-06-05,4,I have never been to Hoboken before and so my coworkers organized a night out here. Initially we were supposed to end up at Charritos for food, but alas they wouldn't take a reservation for such a large party.So Precious is where we ended up and quite frankly it turned out to be a big hit.  Right next door is a convenient liquor store to provide all our alcoholic needs for Precious is yet another BYOB restaurant.We had a nice table outside which made for good people watching while we waited for the rest of our party.  It took us probably a span of an hour and a couple of bottles of wine before our entire party showed up and surprisingly the wait staff were super understanding. (It may have been a different story if they were at capacity).  On top of their friendliness they offered to move our large group inside as the weather started looking questionable.We decided to stick it out and things worked out both weatherwise as well as food.  Most of what we ordered here was American Chinese food. You know all the stuff like  Sweet & Sour chicken, Hunan Chicken, your meat of choice & broccoli etc.  We also got a couple of sushi rolls and one coworker even got Chicken Pad Thai.So given the type of food we got you can already tell this isn't really a typical Chinese or Japanese restaurant but it is perfectly suited for the surrounding demographic.They do what they do well, with everything surprisingly delicious and being very large portions. Unlike other places that jack up their dinner prices for the same dish they serve at lunch, the pricing is far more reasonable being only a couple of bucks more.Staff was always on hand when needed which is great especially when you have a larger group. Overall a very enjoyable experience.
2010-06-01,3,So checked in here today on my new 4square account.(I wish it would link right to yelp somehow).  I have been here 2 times in a week now.  The first time I would of given 4 stars.  However, this second time I had to take a star away.  Overall the place is very good and probably deserves the higher reviews it generally gets.  My meal this second time was not good.  I had sesame beef.  It was real tuff and hard to eat.  It came with no veg on the side.  That is the only bad thing I have experienced with this place.  The first time I had some General Tso's chicken and it was good.  The won ton soup is tasty.  The service has been outstanding both times.  It is def one of the better Chinese food places in The Boken.
2010-05-17,4,The lunch special here is a ridiculous deal. Hot and sour soup is definitely the best I've had in Hoboken and the brown rice is done perfectly!
2010-05-13,4,I've once again had to switch Chinese restaurants. I do eat the lunch special at Precious which is always great.  But delivery is always the crap shoot. I must say thank you Precious. Got some standard dishes all well executed. Affordable. A couple highlights. 1. Holy shit. Cinnamon in the egg rolls. Can I say WOW.  2. I love wonton soup and the wonton has to be done right.     These aren't the wontons I like.......... but the use of Ginger is nice 3. Chinese teabags with the delivery. Perfect touch.4. nice scallion pancakesUnlike most places that do chinese, you can actually taste the ingredients.
2010-04-24,3,We came here because my in laws were hungry, didn't want to walk another 2 blocks, and only eat "chinese" food.  After 3 nights of different variation of chinese food, i decided to have the sashimi platter as a change.  Although the presentation was impressive, i feel the quality of fish was not very fresh.  Illuzion across the street is much better.
2010-03-26,4,We ordered delivery totaling around 30 bucks... pretty filled after and have a lot leftover. I have a tendency to order steamed dumplings (with my sibling asking for half fried and half steamed). it was 6 pcs each, and with 3 pieces for each, we were not full obviously- I think one of us needs to compromise next time..Mummy's review: Sushi was fresh, dumplings were good (I disagree)I thought the food was very good also- scallion pancakes were a little cold when it got to the houseI've eaten in this place about three times before and always have a good meal-their japanese salad with the homemade ginger dressing is great too! (comes with any sushi order which is a good deal)Its a nicely decorated place too if you want to eat at the place- obviously things will taste better because they are fresh out of the kitchen and not driven over! enjoy precious!
2009-12-22,2,The students at Stevens have a few staple restaurants that are just a part of our college lives. If you want pizza, you choose Benny's or Gio's. If you want Mexican, you go to Q-dubs. Hungry for burgers, J-Rock. Craving a sub, you have Vito's, Subway, or Quincy Toasties. And of course, everyone knows if you want Chinese, there is nothing more standard than Aroma. We can sometimes get stuck at these restaurants whether it's financially or for a lack of creativity, and we lose sight to other equal alternatives. This week I was able to find one of these equivalent alternatives in Precious down at the corner of 3rd and Washington (that's next to J-Rock FYI). Precious is a small restaurant offering a nice selection of Chinese and Japanese Cuisine.I've walked by the restaurant many times before, but for some reason I just never gave it a chance, much like many of the other restaurants in Hoboken. From the outside, it looks like a pretty modern and nice place to eat, which usually means that it's going to be expensive; however, that was not the case. I first walked in to an unsightly hospital curtain that did an effective job blocking the cold from the outside. It is about the same size and set up as Aroma, but just a touch on the classier and more modern side. The service was excellent. Even when there were multiple tables, the food came out quickly and my glass was never without water. The lunch specials at Precious are an incredible value with the average price between $6 and $7. Slightly more than the price of Aroma, their food was about the same quality, if not a bit better. For that price, I decided to order an array of foods to test out the quality of their food. My guest and I ordered Chicken with Broccoli, Sweet and Sour Chicken, and the Happy Family, which is a seafood and meat medley. Like I said, the quality of their food might only be slightly better than Aroma for the small price difference. Their Hot and Sour Soup that came with the meal was something to take note of, however, since it was one of the better Hot and Sours that I've had in Hoboken. Because the lunch was so cheap, I tried to order more food from the menu to try to stretch my budget for the week, but I found myself so satisfied that I couldn't do it.Probably to the delight of the Stute's business manager, a lunch that would have been enough for four people was around $25. If I had one complaint, it would be that I wish there was more of a dessert selection so that I could have spent more money on the review this week. Like I've said several times in the article, Precious is definitely comparable to Aroma, however, it's better food and stellar service for a small price increase is worth a try for the college student on a budget, which is pretty much everyone.
2009-12-19,3,i lean toward japfood, but i figure i'd give this a try. first off, the decor of the place is quite nice, and it can be a perfect date spot. ive been the precious about 6 times already and i order out ALL the time. their chicken and broccoili is good as well as thier shrimp and brocoli. general tso's is fine too, i must say thou, that the one reason i come here is for their fried rice...its simply amazing. and i do adore it.
2009-11-20,3,Expensive for Chinese food. And both chicken dishes tasted the same. I can't believe this is the only Chinese restaurant around?
2009-11-17,3,The only reason I give this place less than 4 stars is because the last time I got takeout, I found a cigarette butt inside the sauce of my chicken and broccoli. It was rather nasty, especially considering that I bit into it (obviously before I knew it was in there). Fair warning. I'm not saying boycott the place, just providing the info. I realize it's entirely possible that it got in there via the stock room but somehow I doubt it. Personally, I don't think I'll ever eat there again but who knows? In a couple of months I may change my mind. I swore the same thing about McDonald's after watching Supersize Me but surprise surprise, now I go there from time to time anyway.All that aside, this is a pretty good spot and I think it's unfair to give a place 1 or 2 stars based on one experience, no matter how traumatic it is. The portions are good, service is fast (a little too fast I have to admit, makes me question certain things). The quality of the food is good and the lunch special prices are very reasonable.
2009-11-03,4,Having lived in China for several years, I got sick of Chinese food and came to realize that the Amercian version is not quick the same.  Then I moved to Hoboken and discovered this place.  Precious is by far the best Chinese place in the mile square city.  Prices are right and the servings are good.  The only bad dish is the chicken banana.  Just doesn't work. Everything is worth it!
2009-10-15,4,Hoboken seems to have no lack of Sushi shops and no end of Asian cuisine offerings. However, Precious is able to stand out for not only offering two amazing menus, but for delivering on them too (figuratively and literally - very quick).The chinese menu offers many excellent choices, from pupu platter, to beef chow fun, to peking duck. The chef's specials are a bit expensive, but very good and go beyond the simple run-of-the-mill (though spot on) traditional dishes. Big points for offering choice of brown or white rice too.The sushi is not top-notch among other Hoboken venues, but well above average for the price, always fresh, never off. We usually just get a roll or some japanese salad to add some variety to our meal.Service is always efficient and friendly. The delivery, as mentioned, is fast and always gets our order correct. They also box things up well, no leaking problems, peking duck arrives in three containers to keep everything fresh.Precious is one of our staples and you shouldn't hesitate to try it. The prices are reasonable and the food is great.
2009-08-18,2,I've only eaten here twice before (and both times with Hank C.) but my experience differs greatly. It could have been that I've just been here on bad nights, but I will say that I would not go back to this restaurant. The service is fine, the place is decently clean, and the food is a bit on the expensive side. That being said, I don't think I've liked any dish that I've tried here (nor did the food agree with me). I'm pretty sure I got the double sauteed pork one of those times, and similar to Marc M.'s review - it was not good in either texture or taste.It's been over a year since I've last visited, but I do know that I will likely not try this place again. I am giving it 2 stars instead of 1 star because I did not write my review recently after eating here, so I have few specifics to point to in justifying a lower rating.
2009-07-19,4,Simple, tasty and filling Chinese food that costs a little too much, but will (I guarantee) fill you up. I had the Crab Rangoon and General Tso's chicken, and the lady got Chicken with Broccoli, though was tempted by the scary-sounding Banana Chicken.They don't say so on Seamlessweb, but it seems every entree comes with rice. Don't make my mistake and buy a big old box of rice. You'll be left with it and be too full to eat it.The Tso's -my generic yardstick for all Chinese - tasted great, with firm breadcrumbs and a tangy but not hot sauce. The general quality of everything was lovely, and the additions - such as around 2 million fortune cookies - were a welcome if not slightly overwhelming addition. The Rangoon was delicious too - sweet and savory at its best. Do not get the Wonton Soup, though. It's way too salty.
2009-05-31,3,good food, esp the buddha delight with perfectly baked tofu and the wonton soup is second ONLY to my own (which is my personal favorite :P)pretty decorgood servicefair pricesfast delivery to the area
2009-05-22,1,Sorry Precious. I have changed my mind. I dropped you like a boyfriend with bad breath. A friend saw one of your workers picking his nose while snapping beans. How disgusting. I won't be back.
2009-03-22,4,ahhh Hoboken, how you frustate me. With more restaurants and bars in one square mile, you constant offer some really sub par stuff. Precious,... you are not one of them. Seriously great chinese. Healthy and dirty greasy options, AND some not so bad sushi to boot. I'll forgive the 45 minute delivery wait and the really ridiculous phone manners. Delivering once a week im really familiar with your menu and most everything rocks.
2009-03-10,4,After 2 years and countless attempts to remember "where did I get Chinese from last time?  was it good?", I've settled on Precious as the best game in town.  I think the confusion probably comes from the overstuffing of delivery menus that all look the same.After the last couple of times, I can say with confidence you'll get the best Chinese delivery (I'm not a big Japanes eater, so I can't speak to their quality in that respect) in town at Precious, based on the following:Price for delivery food (vs somewhere like the Rice Shop, which is also excellent, but better priced for dining than delivery)Speed/accuracy of delivery (as a Jewish person, nothing spoils my Sunday night Chinese like a long wait for cold food or a mixed up order)Diversity of the menu
2009-02-28,1,Been there twice. Forget about it being cramped... every restaurant in Hoboken is.1. The first time, I tried the banana chicken. Awful!!!!! Slimy bananas, boiled chicken that was pale and slimy too. 2. Last night I had the double-sauteed pork. Plastic taste and texture on the pork, nasty pieces of tofu thrown in.I am never going back and I suggest you don't either
2009-01-25,5,I absolutely love this place. I'm a stickler for their vegetarian General Tso's chicken. It's so good that my carnivorous friends now order veggie meals from them. Some of my friends enjoy their vegetarian beef steak but I've never tried it and can't vouch for it. Their delivery is very fast I live in Jersey City Heights and get my delivery within 30 minutes. When I order I typically get the veggie General Tso's with brown rice, a veggie egg roll, their house salad which comes with seafood mixed in, and miso soup. The bill comes to $25 which isn't bad at all considering their rather large portion sizes. I can usually eat the food over  a span of two days just to illustrate how big the portion sizes are. I've also eaten in their restaurant and it has a great layout with a sushi bar on the back wall and a big Buddha statue in the front covered with dollar bills. The wait staff is very friendly and the meals come fast so you can get in and out quickly. It's usually not crowded so there's no need to rush and you can sit and chat as they don't play loud music.
2009-01-24,4,BEST Chinese I ever tried in HOBOKEN.To be honest, I'm REALLY skeptical about the Chinese restaurant especially  "Chinese Japanese" restaurant. None of Japanese runs a "Chinese Japanese" restaurant, so I barely trust their taste.HOWEVER!! Precious is my exception.I ordered Crispy Sesame Shrimp and Scallop to take out. WOW! So crispy, tender and tasty! They put some sources, fortune cookie and  my favorite woolong-tea in transparent fancy Chinese bag. WOW, So Cute.Dishes, Egg roll or Soup, and rice plus the fancy bag as above for Only $7! Great Deal!  My BF cares about keeping his buff body, so he doesn't want greasy dishes.Are you same life style?! Don't worry! They have OIL FREE dishes,  "Protein Torio"   It's Perfect for you guys!Further more,  I love their Cleanliness!!I LOVE PRECIOUS! I'm gonna come back soon!
