2017-10-18,5,Absolutely loved this place! Knowledgeable staff, great customer service and very reasonably priced,  especially compared to other cold juice press type places. Really delicious smoothies and healthy snacks. Come to Manhattan, we need one of these spots over here!
2017-10-02,5,Delicious smoothies! I took a yoga class across the street at Pavana Yoga and grabbed a smoothy after. The Inflammatory Smoothly hit the spot! It's a perfect location going to work or coming home. They have grab and go juices and smoothies as well as freshly made. Can't beat it!
2017-09-07,4,I just ordered an acai bowl and a choco loco smoothie. The smoothie is great and I like how it came in a bottle for the 10oz size so it was perfect for me to drink while I work. The acai bowl was okay, mine was a bit on the grainy side but I like how there was a crunch to the bowl. Would wanna try other things out with them!
2017-09-04,2,Their smoothies are good and they have a wide variety, but the guy who took my money when I paid had gloves on and didn't change them when he went to go make my smoothie...he proceeded to touch the ingredients with the gloves that handled my money. I guess I should've said something... ended up tossing the smoothie...handling money/then smoothie ingredients...gross. Don't think I'll go back..not worth the high prices if they're not clean or watching out for their customers best interest.
2017-09-03,1,Ordered their bubble gum smoothie(large size) was bottled which i don't mind but was really watered down, very disappointed, not worth the price
2017-09-01,5,The black bean soup was really good! My friend got the banana boat smoothie with coconut water and she loved it.
2017-08-21,5,This review is for the Fort Lee location which is located on Main Street. At the time of this review, I believe that this location has only been open two weeks. My husband and I stopped in to check out the fresh kombucha as well as the cold press health shots. The owners showed us around the store and gave us lots of yummy samples. We tried the cheesecake which was so delicious, the texture was amazing and it contained no added sugar. We ended up buying some health shots as well as some kale chips. Check out this place if you are looking to expand your taste buds and branch out into healthy eating. My only suggestion to the owner would be to include the nutrition information on the label.
2017-08-14,5,I am extremely pleased by the customer service at this place! In regards to my last order, I received what's called a "grab and go". Simply Juice called me and related this information to me. They also sent over their Pitaya bowl which is INCREDIBLE. More business, especially within the food industry should operate like this. I will definitely endorse and revisit this restaurant.
2017-08-11,4,Simply Juiced just opened in my neighborhood in Fort Lee NJ. I popped in to see what they had to my surprised I saw more than juice, Homemade kale chips, salads, sandwiches etc. All looked really fresh and the staff could not have been nicer offering free samples of kale chips etc. Thank you Rachel! I tried a delicious Fruits and Roots Juice. They do Organic, Raw, Non GMO, Vegan, Dairy, Soy and GF. I will definitely go back and try some food. I thought the prices were reasonable nice addition to all the new places on Main Street.
2017-08-07,5,Normally I only post negative yelp reviews because I don't like my favorite restaurants to get all pricey and packed BUT I do make rare exceptions when they are truly deserved. I wish I could give Simply Juiced 6 stars. I was a vegan for almost 20 years, I have travelled all over the west coast and used to live in San Francisco so I know a thing or two about vegan restaurants. Trust me when I say that Simply Juiced is the best of the best. Every single item I tried was flawless. Creative, delicious, nourishing, prepared with love and simply incredible. It made me wish I had two stomachs. Often vegan food falls into the trap of assuming that just because of the veganism it is automatically healthy. This is not true at all. Eat too much processed fake meat and fake cheese and you will ruin your biome. Simply Juiced does not fall into this trap. Another trap is assuming that food that is healthy is automatically delicious. This is not true at all. Fresh organic ingredients are essential, but they must also be prepared with creativity and flavor or it's just a bunch of ingredients in a pile. Simply Juiced does not fall into this trap either. Simply Juiced is absolutely incredible. I will be ordering from them every week I am in town. They are such a cut above the competition that it's not even fair to place them in the same category. Simply Juiced deserves a Michelin Star, and not even some upcycled local vegan version of a Michelin Star, in talking about the real deal here. Simply Juiced takes big fat healthy well digested probiotic sh*ts all over the competition and then starts its day kicking *ss and taking names. Eat here and tip well.Much respect, more of everything please!Dylan(But don't go get a big ego and price me out of the game now)
2017-07-29,5,Smoothies and juice concoctions are on point! I love that they compost and are conscious of the waste that is produced when working with raw/live food. My go-to's are the açai bowl, natural mystic juice, no harm no cow sandwich, and the coconut macaroons! To the wealth of your health!
2017-07-18,2,This was my first visit here. From what I saw this is a true juice bar. Many different types of (pre bottled) juices in different sizes, although on the expensive side. I tried the coconut cream pie and it was nothing to write home about. It was empty when I walked in and the young lady at the counter was very eager for me to hurry up and buy. This place is alright but it also my last visit.
2017-07-08,5,This place is a neighborhood gem.  I drop in from time to time when I feel like I need to healthy pick me up.  The workers are very friendly and seem to know most of the customers that come in.  The prices are a little steep but certainly worth it for the quality of the product.  Healthy food and snacks are also offered.
2017-06-27,3,This place is just ok.  I've been there a few times over the past 1-2 years-this review reflects those visits.Pro's: it's not too expensive (vs other places I've tried it's basically on par), they offer fresh and ready to go (pre bottled), they have healthy snacks, and give out samples!Con's:  the ingredients they write on the cooler doors are pretty hard to read (ask the person at the counter).  Also, it's really nothing special-just run of the mill.  Worth it only if it's close-I wouldn't go out of your way for this...
2017-06-09,1,No, they will not make fresh juice for you, but point to the bottled stuff on the shelf.
2017-05-30,5,had a bad impression at first but the sunflower sushi was amazing. thank you i would recommend to anyone. Also great customer service they really value there customers.
2017-05-24,4,Was looking for some healthier, grain-free breakfast options in the area and happened upon this little gem. They have a lot of options for smoothies, so far my favorite is the Choco Loco. They have a banana chia pudding that also hit the spot, although ordering them both together will set you back about $20 and is a much heavier breakfast than it looks like. Flavorful, fresh ingredients. Only downside is the price tag.
2017-05-23,5,I got the bubblegum smoothie, it is very tasty and not too sweet. The service was very quick, I will definitely stop again on my way to work! I'm excited to try their other smoothies and juices!
2017-04-05,5,Great selections of sandwiches, juices and raw vegan dishes that were ready for pickup and treated with love!!! I enjoyed the special touches they give to the packaging!
2017-03-15,5,Never ever had anything more delicious in my life. It's a pretty penny of expense but it's the best food and juices in the world. Owner is soooo cool. Cashiers so nice and one is a really cute dude with sociable personality and beaming smile
2017-02-16,5,YES! New to the area and finding a new juice spot was priority. I love all the options for snacks and food here in addition to the juice. Everyone is super friendly and helpful if you have any questions!
2017-01-11,5,Best Juice bar in Hoboken and the Tri State area. Staff friendly and helpful and informative. Always been pleased with the products and even if I wasn't the staff helped to rectify the situation immediately. I HIGHLY recommend this place to anyone who juices, likes healthy food options, or is considering getting into juicing. They have lot of different options for your particular taste. Go NOW!
2017-01-10,5,By far the best juice/smoothie place in Hoboken. Sure it's a bit expensive, but what spot that serves fresh fruit and vegetable drinks isn't? Definitely worth the price for these delicious beverages. The staff is always super friendly. Very clean and cozy.
2017-01-04,5,This is the best juice/smoothie place in Hoboken (and Jersey City) for so many reasons. The employees are AMAZING - very welcoming, friendly and super helpful. The menu is top notch, ingredients are always fresh and the store is very clean. I love that they have an app to checkin and after your 10th check in, you get a free juice...no annoying punch cards to worry about. I love having this option in town - truly the best.
2016-12-11,5,All of their juices are very fresh and they have a big variety. The people who work there are also very friendly and helpful! I highly recommend.
2016-12-05,5,This place is AWESOME! So many raw vegan options. I was in heaven. So hard to find a place like this in Jersey. Everything was perfectly made and it's presentation just grabbed you right away! The vibe was very positive and Ron who attended me shined through! I bought the Choco Love smoothie, Coconut Cream Pie, Super Burrito, Mega Energy Cookies and Chocolate Macaroons! I will be definitely be coming back here many times! Here are some photos of what I bought! :)
2016-11-15,5,Took my time to write a review however am still impressed! Had a chance to try an acai bowl couple weeks ago - and it was the best acai I've had in my life! Will definitely be back for it! Great folks working at this place also.
2016-11-06,5,Simply Juiced is the juice bar to go to. I live on Long Island and travel to Hoboken on average once or twice a week to stock up on my juices. The reason why Simply Juiced is different than the other Juice/Beverage shops is one word: HEALTH. Simply Juiced beverages are freshly squeezed juices, along with being organic and tasty, which the majority of other juice shops cannot offer. This juice bar offers a variety of different drinks - my favorite ones are the detox drinks which help me cleanse my body after a long weekend of nights out socializing. Along with the friendly staff, Simply Juiced has a very positive environment that promotes health. I am waiting for Simply Juiced to open another location in New York so I can go get my daily fix of tasty organic freshly squeezed juice.
2016-11-06,5,Hands down best premium smoothie/juice place in Hoboken. And Jersey City for that matter.Let's start with the smoothies.  The ingredients are premium and include fresh young Thai coconut water (and frozen coconut meat!), raw honey, fresh mint, Brazil nut butter, hemp milk, black mission figs and, of course, kale.  You can order one of the 10 on the menu or create your own.  I recommend the Bubblegum - it's very lightly sweetened with honey only (you can customize the level). It is unbelievably good, strawberry, pineapple, pomegranate, coconut water, plus acai and goji berries.  You can't go wrong and will love anything you order.Next up: juices.  So all the juices are made in house.  One case is 100% organic.  There are about 20 varieties of green juices.   Orange juice.  Simple pure carrot juice, pineapple, even pear!  Chia seed drinks.  Spoiler alert: charcoal lemonade.  Aloe water.  There's ginger and wheatgrass shots.  And my favorite - creama de coco.  This baby is blended coconut meat and water, creating a smooth creamy masterpiece.  It's a vacation to the tropics in a bottle.Another case is dedicated to raw and vegan food.  Find veggie burgers, raw-o-licious (gf raw oats, coconut, dates), chia pudding, burritos, raw tarts, some salads like the Cuban ceviche.  All of it is thoughtfully crafted and very fresh.Pricing - ranges from $5-10.  Offering a cleanse package for $58 with 7 juices.  It's a really good deal!There's steady food traffic here.  There's something for everyone, even kids.  It's easy to understand why - the owner and his staff are super friendly and knowledgeable.  There's some samples on hand and they are happy to help you find exactly what kind of juice you are craving.  Happy smoothie-ing!
2016-09-27,5,Lots of options/combinations available and the employees were very helpful with suggestions/recommendations. They also allow for some sampling if they have some available, not just of the smoothie but also their other snacks they sell! They're also more than happy to adjust any of the ingredients in the smoothie if necessary to accommodate to customer taste.The smoothie was perfectly blended so you don't have chunks of fruits or vegetables. A little on the pricier side at about $8-$11 but definitely worth every dollar for the service and taste of the smoothies. Very content and will definitely be back for more after my morning barre class :P
2016-09-20,5,Very cute and cool place! The guy at the register was extremely helpful and friendly. Helped me pick out just the right green juice I was feeling at the time. They had many combinations of bottled juices to choose from. Perfect to grab on the go! Also the option of having a juice/smoothie made on the spot. I will be back when I'm in Hoboken
2016-09-07,5,I cant say enough about this place - it is absolutely amazing! No matter what time of the day you go or who is working, the employees and staff are so incredibly helpful, welcoming and warm. It is SUCH a good vibe and is a genuinely a pleasant experience from beginning to end. I've tried their juices, smoothies and breakfasts and they are all fresh, healthy and delicious! The best part? They have samples of most of their stuff for you to try before you buy. If you're going to be spending that much $$ on a drink etc it is nice they let you taste it first - a lot of places dont do that. Thank you Simply Juiced for coming to Hoboken! :)
2016-08-25,5,Great simple delicious juice and vegan dishes. I have eaten there several times because it was so good I had to come back. I have had salads , Desserts and juice, and it all has been excellent. The staff and owner have been very courteous, helpful and friendly . If you are a vegan or vegetarian or just want to try something different, you must check this place out !!!!Although I have moved a bit further away from Simply Juiced, it is still worth the travel to enjoy all the goodness . Can't wait to chase all the good treats .
2016-08-23,5,Great organic juice store in Hoboken. Stumbled upon them while doing a quick tour of the town. I was in the mood for a green juice so I checked out simply juiced. When I walked through the door I was greeted by Sung the owner who is extremely nice and knowledgable about his products. He runs a Very nice and clean operation. They have samples of all their juices smoothies and snacks. The chia pudding is very good. I took some goodies to go. Check them out.
2016-08-09,4,this place is mad cute!! cozy shop with fridges chock full 'o fine juices, smoothies and other concoctions. the names+profiles of the drinks are a bit difficult to read on the glass but i like the handwritten-touch! the girl at the register was friendly and let me know that you could basically sample anything and everything you wanted, in and out of the fridge. i helped myself with abandon. a guy who i'm assuming is the manager/shift leader came by to ask me how i was doing and if i was interested in anything, and asked me if i'd ever tried chia pudding before. told him i never had, so he handed me a small container of their chia pudding--good stuff! a lil like rice pudding with fun textureended up getting a small bottle of dirty chai to get me thru a weekend shift. kept well in the fridge and was a great kick of caffeine and chocolate to make my day. relatively decently priced drinks (tho the fresh smoothies seemed a bit absurd for $11+) with friendly customer service? will definitely swing by again during the hot weather when i'm around! :^)
2016-07-26,5,Very friendly staff and you can sample nearly everything! Hands down one of the best healthy food spots in Hoboken!
2016-07-17,4,After my session, my trainer & I were discussing places in Hoboken that offer healthy drinks. We threw a few names around and why they weren't consistent and that's when Simply Juiced came up.. so I had to check it out for myself. The place is super clean, it has a few tables to sit in, and a grab & go option (juices, salads, & snacks). I was greeted by the nice lady behind the counter, who asked if it was my first time. Based on what I told her I was looking for, she recommended the Green Dream($11): Banana, kale, Brazil nut butter, vanilla extract, dates, rice protein, and almond milk!  It sounds like a lot but the mix was perfect. A great post-workout drink ..I just wish it was bigger for the price tag. I was impressed with the varieties available. The staff is so helpful so don't hesitate to ask questions. There were plenty samples that I was offered to try. They also have a reward system based on how many drinks you purchase, all you do is input your cell #. . Looks like I'll be heading to #SimplyJuiced after my workout!
2016-06-30,5,Excellent juice and excellent service! Just tried them for the first time today. I ordered the Inner-Chi green juice, and it is delicious!! I cannot wait to go back again!
2016-06-28,5,This place is my new favorite.  Their juices, smoothies, desserts and snacks are fantastic.  I tried several different items and I liked them all.  I'm so glad to have found a place that has organic AND delicious products.  I will definitely be a new regular.
2016-06-24,5,Amazing chia seed pudding, charcoal lemonade and I asked for a sweet green and that was delicious too!  The gentlemen helping me even had me try a sample before I bought which was nice! Def coming back! I called other Hoboken juice spots before coming into this one - and the employees couldn't even tell me what "green juices they had that have a sweet flavor" - which is what led me here!
2016-06-14,5,I was in Hoboken for work one day, after a night of too little sleep, too much booze, and bad food.  I was parking my car and saw Simply Juiced so I decided that maybe a smoothie would be good for me.  I couldn't have been more right!  I consulted with a very helpful gentlemen(who it turns out was one of the owners), and he recommended the Ginger Zinger.  Before I was even done I felt better.  The place was bright, clean, had an open feel, and the staff all seemed happy. I'm in Hoboken regularly and will definitely be back to see what else they have to offer.
2016-06-13,5,I work just across the street and Simply Juiced has become a fast favorite. It's so easy to pop in and get a quick, healthy and delicious vegan meal on the go. Super friendly, helpful and genuinely excited staff, tasty smoothies/drinks and amazing bites.My go-to's are the dirty chais (great light pick-me-up) and the super burrito. Can't wait to work my way through the menu.
2016-06-02,5,My new favorite place in hoboken. I live in Port Imperial - the closest vegan option is in hoboken. I usually pickup in the city and bring takeout home.I now have a local option. Yay! It's a bit pricey, but all vegan places are. Quality ingredients don't come cheap. You get what you pay for.
2016-05-31,3,Cute little juice/smoothie bar with three tiny tables - definitely a grab-and-go place. Everything is vegan and organic, which I really appreciate. I had the "bubble gum" smoothie which was very tasty. As others have said, it's definitely overpriced. $9-$11 dollars for a small (12 oz) smoothie is a little ridiculous.Really friendly and helpful staff, and they let us have lots of samples which was great. But I'd only recommend it if money is no object for you.
2016-05-03,5,I love how fresh and creative the juices, smoothies, and food is, plus the soups have been fantastic. Great vegan place that is pricey but they all are and I don't feel like I'm getting ripped off here... they really care (and usually you can have a sample of something). So glad I found this place.
2016-04-26,5,Please come to Jersey City!!! Their food is SUPER clean and tastes ridiculously good. This place does it really well. Legit organic, cold pressed, raw, etc. People working it are kind and helpful. Great energy.Soups are delicious and made fresh. Smoothie options are awesome. Their green juices are the best I've had outside of Bali. That's sayin a lot. I love the Gratitude Juice, spicy pickle sandwich and the avocado/kale smoothie. (And jambalaya soup when they have it)They also deliver which is really convenient and they give you samples.  My go to!!Also-- it's hard to get this kind of quality, organic, truly fresh food from a restaurant/store. This quality is equal to what I make at home and the prices make sense to me, knowing how much I spend on ingredients myself. They are high and if you care about the quality, it's worth it!
2016-04-11,2,Ordered the zucchini lasagna and the acai bowl and my total came to about $24. (I ordered from Seamless, so that's including service fees/tip) Delivery took about an hour.Everything was delicious and obviously tasted fresh but like another reviewer said, the portion sizes are ridiculous for the price. I understand that it's organic but I've been to other organic places who don't charge and arm and a leg, and I get a good amount of food. I really wouldn't consider the lasagna entrée an entrée. It's more like a snack, honestly.I don't wanna be too harsh with this review because I have no idea how much it costs to even make healthy and organic foods. But I do kind of agree that there needs to be serious price/quantity adjustments. I feel like a huge sucker spending this much on what I would consider snacks.
2016-04-08,5,"let food be thy medicine" - simply juiced is the embodiment of this philosophy.nothing but pure love for this place - i honestly can't say enough good things. they've continued to grow and expand, constantly adding new and seasonal items, and the passion the owners have for their business absolutely comes through. a few days ago i had an experience similar to those mentioned by a few others - i went in sick as a dog and was recommended an immunity booster shot and a power punch. downed those, repeated the next day - and voila, feeling a LOT better today. i've also been doing a green smoothie in the morning for breakfast - can't remember the name but it's green and has brazil nuts in it. totally hits the spot and keeps me full til lunch. the prices are very competitive and absolutely fair for what the product is (not to mention astronomical hoboken rents and fair wages for employees). the cost of making such products at home using organic and high quality ingredients is not far off - i used to make my own green juices at home, a LOT of produce goes into a single drink - not to mention the hassle! peace, and looking forward to many happy returns!
2016-04-04,2,giving 2 stars only as the food tasted great. If i had to rate the food only, i would give this place 4 stars, however, the quantity for the price they charge is a JOKE. We ordered a sandwich and raw pasta entree, the sandwich would fill a kids belly only half was and the raw pasta was about the size of a condiment... more like pickles given as a condiment along with an entree you order. A message to the business owner, please either adjust your quantities or the prices of your items...
2016-03-25,5,Thank you for helping me survive the winter. :) With a baby getting sick all the time and running on no sleep - this winter was rough! You saved me with your immunity shots and power punch juice. One shot + juice for dinner and another for breakfast the next day and I was feeling fabulous. It's the best cold remedy around.
2016-03-01,5,Tried this on my way home, the smoothie was very good. I'm not sure if it's good that they are open when I head to work. I see more smoothies and kale in my future!
2015-12-31,5,We stopped by today for the first time.  My son had mouth surgery and is on a liquid diet.  The woman behind the counter was very helpful and friendly and let him try a few different kinds.  We got the anti-inflammatory and it was the first thing my son has drank on his own without me nagging him.  We will definitely be back soon and even after he is recovered!great addition to the neighborhood!!
2015-12-17,1,Outrageously overpriced. The pad Thai, which is listed under "entrees", is $10. But it's like a small snack. It literally comes in this tiny, prepackaged container. I'm a 115 pound girl and I would have to spend at least $25 to get full from eating here. Complete waste of my money.
2015-12-15,5,As soon as I walked in I felt an awesome vibe. The girl at the counter was very helpful and knowledgeable about all of the items on the menu. She even provided me with multiple samples before I made my final purchase. They have a great variety of smoothies, juices, and plenty of vegetarian options( sandwiches, wraps, pastas, among others). I ended up choosing the green dream. It was made to order and completely delicious. I'll definitely be sure to come back.
