2015-11-11,5,First things first, EVERYTHING is organic!  Hallelujah!  Then potion master King knows what he's doing with his creative and purposeful mixtures.  He puts a lot of thought into each drink combination and he has a lot of knowledge when it comes to the healing aspects of each vegetable and fruit.  (Reminds me of an acupuncturist with their healing secrets with herbs and essential oils.)I'd be curious what drinks he comes up with during the winter since it's cold weather now and juicing can make a body very cold.   One thing I'd like to see is a really strong greens drink that really knocks me on my butt.  Where the kale, collard greens, and dandelion greens really rock it.Juice Press has something like that.
2015-11-01,5,Everything I have tried here has been amazing and the staff are super knowledgable and helpful. Even my picky 6 year old will drink the smoothies and juices! Banana boat smoothie and the greens and grains salad are my favorite.
2015-10-26,5,I'm so glad a good juice bar finally came to Hoboken!  From raw food to healthy juices and smoothies this place is even better than Juice Press (which I'm also obsessed with), because the owner and employees take the time to get to know their consumers and help them choose foods and juices based on their needs and goals.  Prices are expensive, but on par with every other juice bar / raw food place.
2015-10-25,5,This is a great place to get yummy raw food and healthy smoothies.  The staff is so nice and informative. Highly recommend.
2015-10-15,5,SUPER helpful staff and just genuinely nice people. The food is all reasonably priced and tastes good! Definitely a repeat customer.
2015-10-12,5,I've been craving a green smoothie. Walked in and wanted to try every one of their smoothies - They all looked amazing! The smoothie was so delicious I came back the next day. Highly recommend this place - custom or their own creation you won't go wrong! I will be a frequent patron
2015-10-09,4,As a brand new Hobie (Hoboken resident), I was excited that there were a sprinkling of organic, healthy cafes in the area (and I wish there were more!). Simply juiced is perfect when I am craving an organic, vegan snack. The food is pretty good. Prices are a bit steep, but comparable to what you would find in NYC. The Mexican salad with walnut taco meat is one of my favorites items on the menu. I wasn't a fan of the pad thai because it seemed a bit bland. I haven't tried their juices yet, but they always have samples near the counter (and the coconut yogurt sample was pretty good). The people who work there are really nice too. I hope this places does well and stays open!
2015-09-19,5,I am 9 months pregnant and I was feeling like I needed to be rejuvenated! So I walked downstairs to try simply juiced out. I walked in and the place was so clean and bigger then I thought it would be. They have juices / food in a refrigerator and all the ingredients were written on the doors. A very nice gentlemen walked over to me and asked if it was my first time there and helped me pick out exactly what I needed. He also gave me a paper menu- it makes it a little easier to pick out what you want! He gave me samples of juices and the chia pudding. So good!  I ended up with  gratitude, Nervana, and chia pudding for later.I honestly feel more energized! Can't wait to try more from this place. It is dangerous that it is right next to my apartment.
2015-09-08,5,Couldn't wait for this place to open and it has not disappointed.   Super fresh and delicious, and very healthy.   To me it is the epitome of clean eating I feel so good after every visit.   The staff is amazing, very helpful in explaining every item and always willing to give samples.   Not cheap but comparable to other places offering similar options, but I feel their selection is larger than most and again, very tasty and fresh.   Love that it is right around the corner from me!
2015-09-06,5,FINALLY! We have been waiting for you Simply Juiced here in Hoboken FOREVER!  We are so happy you are here. I've had the juices, desserts, yogurt, salads and it is all fresh and delicious. This is the healthiest place in Hoboken...you will feel good about eating the food and supporting a local business that is in the best interest of your health.  The owners are so inviting and they take time to educate you and support you. This is the real deal - ORGANIC!  No sense wasting money on non -organic juices and smoothies when you can now get the real thing right in Hoboken.  Congratulations to the owners and thanks for making Hoboken the home for your business.
2015-09-04,5,Stopped here for the first time today.  Had the Mother Nature juice.  It was great, really fresh.  Owner was really helpful.  Can't wait to go back and try their food!
2015-08-30,5,Everyone is so nice. Great options!! Delicious juice!!! Everything is fresh! Definitely returning for more!! :)
2015-08-28,5,Great new spot!  So clean and spacious.  Loved my green juice and the prices are so reasonable!  Service was really good too!  Hope this place does well because I definitely will be going back.
2015-08-23,5,Finally, something GOOD/GOOD-FOR-YOU has opened up near me! I had a smoothie today and it was delish! (some kind of chocolate/banana/goji berry one, I can't remember the name) Such a friendly owner as well! I will be going back FREQUENTLY, and once they are on Seamless, ordering FREQUENTLY.  :D
2015-08-19,5,I would go to Simply Juiced over Rejuice a Nation any day. Prices are competitive, but taste, freshness, and cleanliness win at Simply Juiced. Plus, King (the owner) is the man. Marc
2015-08-10,4,Visiting from Portland,  I was searching for a quick refreshing morning meal. I was relieved to find Simply Juiced. After trying a few of of their samples,  I was hooked.  I enjoyed the 'Mother Nature' and cashew butter and Jam sandwich.  Nourishing food for the body and soul. Great way to start my busy day!
2015-08-08,5,Their food is all natural, no heat added, juices are cold pressed. It's healthier than anything you'll ever eat. But what's most important is that it tastes amazing. The La Classique smoothie packs a punch with its berries and Choco Coco smoothie is sweet and subtle, making it the perfect morning drink. Many of their drinks are packed with protein which will help keep you full for longer. I know there are some sweet tooths out there and this place will cater to you too. Their coconut cream pie is my favorite. Very creamy and sweet with coconut. Lastly, the atmosphere is very friendly and the setting is very cute. So if you're ever in the Hoboken area, check this place out!
2015-08-04,5,I am SO happy this place opened. Juice: Their juices are fresh pressed, not pulverized, which keeps a lot of the nutrients intact. The GRATITUDE juice is SO good. One of my fav juice combos and I've had a lot of juices in my lifetime. They have free samples of the most popular juices!Food:The walnut pesto sandwich was super savory and flavorful. I want them to sell the walnut pesto in jars lol!  Collard green rolls are light and filling, love the sauce. Pad Thai was sold out! I heard it was really good from a lot of friends so I'm def coming back to try itDesserts:Goji Chocolate cheesecake is so rich and light and creamy and deliciousCoconut cream pie, I can't believe this is all raw and healthy because it's sinfully good. Chia pudding - they gave me a free sample of this and I almost bought another dessert lol too bad I was stuffed. But will def come back for this when I come for the pad Thai. Service:The staff working there could not be more pleasant and gracious. They kept passing out free samples and really knew their product. Everyone there seemed to really care about putting healthy organic products into the world. I'm so happy a good juice bar finally arrived in Hoboken, and what's awesome is they offer healthy vegan lunch choices too.  They have way better prices than Buddha Press too honestly. Happy I found my new lunch spot. :)
2015-08-03,4,Positives:Staff is friendly and building is a great spaceThey offer samples/taste tests of different juices and smoothiesGood pricesGood FlavorsOpportunity to Grow:More variety for Green JuicesAcai bowls far short -  I like a solid bowl with all toppings visible. Bright, colorful and enough to be a meal replacement ( even if that means hiking up the prices a bit)
2015-08-03,5,The real deal. Best juice spot from Hoboken to jersey city. Delicious and thoughtful. One of the few times a place opens and just can wow you with quality and service. Well done and looking forward to trying more items each visit. The oatmeal is something really special. The Hempire and Choco Coco were awesome.
2015-08-02,5,Yay, I finally got in!They are beyond friendly and helpful and pointed me to some samples as well as a lovely bottle of liquid gold...er emerald...because green. I tried Super Natural and Kale-ldoscope as well as the pad thai. Yum. I will be back, obvis.
2015-07-29,5,I went here on my way to work and was given so many delicious free samples. It was hard to choose because one thing was better than the next. I live around the corner and have been dying for a place like this in Hoboken. I had the Ying Yang Chia pudding and was taken to a cacao/vanilla velvety dreamland. Everyone was well informed, passionate, and friendly AND the product is absolutely FANTASTIC!  I wish them all the best.
2015-07-29,5,I came in here once on my way home from the gym and once before work in the morning. Not only is it completely delicious, healthy and FRESH, but you can tell the people there truly care about what they are doing. I've been given guidance as to what is available and free samples each time. I live close by and plan on being back here often! I wish this new business the best of luck!!! Hoboken needs you!
