2021-05-23,4,Excellent service and wine selection. Raw Bar was also very fresh and the presentation was great. I believe We dined on an off day. (Sunday)There are some issues with some dishes.Crispy Rice Hamachi Crudo had no seasoning or any acidity And the rice part was not crispy at all. It was plated as plain rice. Wish the rice was deep fried or at least browned a little bit. The dish was definitely missing the crispiness.I could not taste or see any clams on `Semolina stuffed clams`. The marmalade is a good idea as a sweet element but the amount they put on the clam was overkilled the entire dish. Sweet and unseasoned stuffing.Had the same problem with the squid ink linguine with agrodolce. The pasta was cooked perfectly but The proportion of the agrodolce was not right for my palette. The sweetness of the sauce was dominant and the acidity was not enough. We feel like we are having sweet pasta. Wish there was some acidity.Seabass was also perfectly cooked and we enjoyed it.,overall friendly service, great interior. Food is not something i was actually expecting.  chef prefers to be on the sweet side and it ruins some of the dishes on the menu. I would definitely come again for friendly hospitality prosecco and for the raw bar.
2021-05-16,2,The venue is really pretty and the mules were good. The staffs were super friendly but the food was .... the portions were small and the flavors were off
2021-05-16,4,The restaurant is gorgeous! They did such a beautiful job. It is hard to get a reservation right now because the location is prime in Hoboken and the environment is perfect for a date night or dinner with friends or family!The fish is beyond fresh! They clearly have an amazing chef and I love the creativity and flavor choices! The crispy rice / yellowtail dish was amazing but I wish they gave more then one rice cracker as there was a great portion of fish and not enough rice. I loved everything I ate and I cannot wait to go back again! Highly recommended!
2021-05-16,4,Really cute seafood restaurant in uptown Hoboken. The decor is totally my style (we almost bought the chandeliers they have for our own home haha). They did great with social distancing compared to most places we've been in the area so kudos for that. And they have these huge windows that they open on both outside facing walls which is great for airflow but also just a great vibe. The food was actually really good. We had some oysters (they only have east coast but that works for me because I realized I don't really like west coast oysters) and even tried the raw bar clams for the first time. Good oysters always leave you wanting more! We also got the shrimp and frites app and the shrimp was cooked well and tasty. Husband and I shared a fish and pasta for the entrees and they were both pretty good. I personally really enjoyed the pappardelle with vodka sauce and fried oysters. The pasta felt homemade and almost felt like it melted into your mouth.  We tried the swordfish at the waiters recommendation and it was lightly fried. Totally my fault for not realizing it was fried but I like fish to be more tender and melt in your mouth so it just wasn't what I was expecting fried fish obviously isn't going to be like that. It was still made well and tasty. They have a good wine selection as well and so many mule options (though that's not what I got). After dinner we asked if the speakeasy attached Backstage had room (which is apparently first come first serve) and the waiter graciously went back to take a peak for us and said there's definitely room. So we closed out and grabbed a post dinner drink. The speak easy is super cute and decorated well (also had a whole wall open to the outside so not that speakeasy like LOL but still really enjoyed it). Overall enjoyed the experience will definitely be back.
2021-05-05,5,Beautiful little corner bar. Had the lobster with gluten free pasta. Lobster tender and plentiful, pasta a little under cooked but still delicious. Caesar salad fresh & delicious. Will definitely come back. Best cosmo ever!!
2021-05-04,4,Small menu but have good options. They don't allow substitutions for sides. I enjoyed appetizers more than the entrees. Spicy shrimp and fries and calamari is great. Loved the oysters
2021-04-30,4,My boyfriend and I wanted to come here for dinner tonight. We started with two of each of the oysters, a couple clams and a chowder soup. Don't get the hoboken clam chowder soup. It was not like new England so we sent it back. It's not good for what it is.We ordered the Stone crab and it was small. It's also a lot of work! Not worth it. Not flavorful. Its served cold..You don't get warm butter or a crab cracker! Don't get the Stone crab. Awful. And overpriced.Best oysters and salmon in town!!! Fresh vegetables. We will return for the clams and oysters from the raw bar and then get the grilled salmon again. Absolutely delicious. Cooked perfect. Perfectly seasoned. Nice crunch on the crust.The grilled octopus was okay, though we wouldn't get it again. It's small and pricey. Cooked perfect. Flavor was okay.We finished with Amaro Montenegro. It's incredible!!! We LOVE it. Perfect aperitif.We also had an amazing server!! Great job Matt!! He made excellent recommendations. Superb service!! Very attentive. We hope to get him again next time we're in! :)
2021-04-29,1,Very disappointed as we waited several weeks to get a reservation. We took an early reservation since that was all that was available just so we could try it. The portions were extremely small, NYC priced and tasteless. The fish was overly cooked and had absolutely no flavor with tiny sides that came with it. Very disappointed as we were looking forward to this restaurant opening. Had to go to dinner elsewhere afterwards as we were still hungry.
2021-04-26,3,We were finally able to get a table here, and the best thing was the oysters. We didn't enjoy our main dishes too much, we will just stick to drinks & oysters if we go again. Atmosphere is great, still a must try for yourself.
2021-04-25,1,We are big fans of Sorrelina and have been for awhile, but we arrived late last night and asked for a table for 3 for drinks.. only two of us had arrived. The hostess escorted us to the "lounge" because she said if we were just drinking that's where we had to sit... annoying, but that's okay! The back had a speak easy feel. We were very excited to try some of the cocktails on the list. We placed an order with a server and when I found out our third guest was coming hungry I asked if we could move to the front of the restaurant, so she could eat a full meal. The waiter said he'd check with the manager on duty.We sat there for 25 minutes when finally the server came back again and said that he was going to grab a manager (I thought you were already doing that?) We still hadn't gotten our drinks when the manager came over and told us we needed a reservation to sit in the front. When I told him it was fine and that we still hadn't gotten our drinks he went over to the computer and told us pretty rudely that they had only been put in 6 minutes ago which may have been true but by this point we had ordered them almost 30 minutes ago. We ended up leaving. To make matters worse, I left my bag on the back of the chair and when I called the next day they insisted they didn't see or have it. Super shady considering I knew exactly where I left it. Just all around a poor customer service experience and we didn't even eat or drink.
2021-04-19,5,Having lived in both the US and Europe we have been fortunate to eat in many fine restaurants.  Sirenetta Seafood & Raw Bar is one of them! Between the extraordinary food, impeccable service and atmosphere it's truly a restaurant you should definitely visit - you will not be disappointed.  We cannot wait to return!
2021-04-13,4,Sitting here now / girlfriend and I ate 24 oysters, lobster biscuits, swordfish Milanese, gnocchi and unfortunately the butterball potatoes. I really enjoyed my Negroni, she enjoyed her tiki mule and then I also enjoyed, if you cannot tell another cocktail called captain jack or something.Honestly I expected this place to suck (pessimism), however y'all rocked my socks and everything has been great with the exception of those damn potato's.I ate them but honestly they're just potato's. Y'all could do better, I was pleasantly surprised but the potatoes fell flat. 5 stars if you fix your potatoes.Potatoes,Lou
2021-04-12,1,I don't write reviews much, but this place merits it. It really is a major hit or miss, and two things ultimately informed my decision to review it. Firstly, this restaurant has a sister restaurant across the street, allowing one to form patterns. Secondly, the restaurant did not respond to my post-meal inquiry about some of their issues, and therefore can be assumed to be confident in their approach to this.If you want the short version, here it is. If you like their sister restaurant, you will probably like this too. If you did not, or if you are in any manner sensitive to salt, you should not eat here, in my opinion. If you are not sure, go and have one dish and some really nice drinks in a pleasant setting, before you risk the possibility of spending $200 for food you cannot eat.PROSThe drinks from the bar were fantastic. Well-made Old Fashioneds, and while the beer menu was quite poorly designed (it is made for exactly one palette type, with no meaningful variety from a beer-lover's perspective), the choices they did have were quite good choices for this genre of beer taste. The wine list was good.The service was great. Brooks and Zac were our servers over the course of the night, and we found them to be very helpful, understanding, and professional. Brooks made sensible recommendations, and worked proactively to resolve a minor issue we encountered. I would also point out that we made reservations, and were seated efficiently as soon as we arrived. CONSIn my opinion, the salt usage has is beyond the pale. Many other reviews have stated this as well, and they are correct. This is not 'regionally salty' food; that would be excusable, since some areas of Italy, for example, make their dishes notably saltier than in other reasons. This nuance is not present; the Smoked Crab Spaghetti was inedible; the cheese biscuits that came with one of our soups were too salty, though not inedible.I do NOT agree with the person who said the stuffed clams were too salty; while it is true that they are (literally) served on a pile of salt, it is up to the diner to choose to add this, and if you sprinkle it on liberally, then of course it will be too salty. I did not think the stuffed clams were good - they were poorly balanced in terms of flavors, very amateur in their composition - but mine were not salty at all.CLOSING THOUGHTSIt is worth noting that this salt issue is - like all questions of flavor - somewhat subjective. I do not eat at this restaurant group's sister place across the street, because it is - in my opinion - also too salty. So, if you have gone there and had a good experience, you may decide that you do not experience this level of sensitivity to the salt, and may as well give this spot a try. You will also notice that, for every review mentioning issues and (specifically) the saltiness, many folks have gone here and not had an issue with it. So, you should take this into account and make a balanced decision on whether or not to go.When in doubt, go and have a few drinks and try one or two appetizers, and then decide whether to come back for a full dinner. You will be supporting a local business, and may decide that the experience is one you will enjoy.We also had a minor issue - a massive fish bone in the chowder - but our waiter proactively took the dish off our bill, so we consider that problem to have been solved to our satisfaction. While the size of the bone (about three inches) certainly indicates a lack of sloppiness in the plating, I believe that an issue like this can happen when you are eating at a place that serves food made in-house from real ingredients, and that this issue could have occurred as easily at another restaurant.
2021-04-08,5,BEST SEAFOOD SPOT IN HOBOKEN the seared tuna, raw oysters, grilled steak are ALL phenomenal Looking forward to trying more on the menu
2021-04-05,2,Food was ok. The lobster pasta dish that the server recommended was super salty but still edible which we mentioned. Raw oysters were fine and the octopus was cooked well. They forgot the stone crab dish which we mentioned at the end of the meal and they comped a dessert in it's place which was ok. They also got me a silver tequila instead of the reposado I ordered but I just didn't bother bringing it up. Wine was decent. The decor is really nice inside. I wouldn't come back though. Too many off things and there were only about 5 or 6 other tables in there. The servers were nice but I guess didn't care enough to get the orders correct.
2021-04-03,3,Service was good, drinks were fine, octopus appetizer was extremely small,  my mahi-mahi was also small...
2021-04-03,3,Ambiance is awesome. The restaurant is beautiful and really nicely designed. I would say that it was pretty loud and tough to have a normal conversation without having to raise your voice for people to hear you a couple of knoches.  Drinks were good and  service was good. What got me was the food. We order the grilled octopus and what came out was a joke.  For $16 I imagined it would be a decent portion.  What they served was tiny and not worth the price. The squid ink pasta was just straight weird.  The pasta was undercooked and sauce was weird. I took 2 bites and could not eat it anymore. I didn't like it at all. My husband got the lobster pasta and that was decent. Desert we chose the peanut butter cook desert. It was ok but nothing special. All in all for what you pay for the food wasn't that good. Don't plan on  going back.
2021-03-27,5,Amazing food, service was great. So happy we have such a great place to go to for raw bar so close to our home. Atmosphere is wonderful. Ate indoors with windows open it was delightful.
2021-03-20,2,I have been wanting to go to this place for months.  Their sister restaurant across the street was really good and more of Italian fare, so when I saw a seafood restaurant open across the street , I was so excited.  We had a dozen oysters for happy hour, these were really good and better than the standard blue point oysters you get during happy hour. For apps we had the stuffed clams and lobster biscuits.  These probably could have been good but were so overloaded with salt, that's all we could taste.  We didn't even finish our clams because they were just too salty.  I did tell our server that everything was extremely salty and to please make sure our entrees weren't over salted.  Another person asked how the food was so far and I said it was "ehh just ok", and he walked away. Our entrees came out.  We had the gnocchi and hanger steak.  The gnocchi was undercooked and the sauce was so salty that any crab or truffle that was in the dish couldn't be tasted. The steak was cooked great, but this had zero seasoning and the salad with onions was so overly salted it wasn't edible. I mentioned how salty everything was again, but it didn't seem to matter. We were just given our $200 check and told "thanks". We left here and went to another restaurant after for dessert and some apps to have something that didn't taste like pure salt. It was disappointing I had to pay so much money to eat an immense amount of salt, but worse when no one seemed to care about the dissatisfaction toward my meal.  If you have high blood pressure or hate being dehydrated, I would not recommend this place.
2021-03-19,2,We have been trying to get here for months and honestly happy it's out of the way At this point. I'm literally ready to suck down water as I'm sitting here writing this review. It was incredibly over salty. We even asked after the apps if the chef could ease up on the salt, unfortunately that wasn't the case. We had the dozen oysters, that was honestly the best thing other than the drinks. The lobster biscuits were okay but so damn salty. Would of been a favorite if they didn't have as much salt. The stuffed clams were flavorful but def over salted as well. The gnocchi with truffle was alright. Sauce was overly salty and the gnocchi was undercooked. Still not a awful dish, would I pay 38 bucks for it, no. The gander steak was cooked to perfection.....with no flavor. You used salt in every other dish with a heavy hand, but this one dish that could of used it, got absolutely nothing. Unfortunate. Their sister restaurant was so much better directly across the street, but after this I don't really know if I'm willing to give my money to this group.
2021-03-16,4,Dined at Sirenetta inside during COVID and felt very safe as the tables were very spaced out. They have a great list of cocktails and wine. The food menu is very seafood focused (obviously!) but they have unique twists on a bunch of seafood dishes where everything sounded so intriguing. My husband and I split the semolina stuffed clams to start and the table split the lobster biscuits. The biscuit were DELICIOUS and there's enough for a large group to try if you cut them in half as they are pretty heavy. The clams were awesome as well. For entrees, we split the lobster rigatoni and king salmon. This was the perfect combo to try to dishes but not get overly stuffed with a pasta dish. The king salmon was super fresh and perfectly cooked. It was a really refreshing dish with orange and escarole on the side. The rigatoni had a ton of lobster in it which was nice they weren't skimping you! Would definitely come back for dinner or just a drink and oysters/raw bar items.
2021-03-12,5,From the outset I was in the Seafood Bar I felt welcome. I then stated with the Career Salad which was delicious...whole Romaine and against very good. Finally went to the Sea Bass. Excellent to the core. Tasty and filling. Highly recommended!!
2021-02-28,5,Best seafood restaurant in Hoboken! Try the lobster biscuits, they are so soft and tasty. They have a great oyster selection, if you're not sure what to order the server can help you out. Staff is very friendly and quick. The cocktails were delicious. For entrees you have many choices even if you're not a seafood lover! I had the smoked crab spaghetti and I was surprised how all the flavors blended in my mouth. If you don't like spicy I would recommend you let them know as it could get a little too much if you're not used to spicy. My boyfriend had the potato gnocchi it was scrumptious, only downside was the small portion. If you're looking for good seafood and crafty cocktails definitely head here, they really know what they are doing!!
2021-02-22,4,Food was amazing and staff was friendly. Only complaint is that they have a truffle burrata appetizer and it only comes with one piece of bread so you can't really share it.
2021-02-22,4,My friend and I had dinner at Sirenetta for the first time this weekend.  When the restaurant first opened, it was really hard to come by a reservation however I looked on Resy the night of and they had several openings for 2 after 7:30 pm.  When booking on Resy, they do require a credit card as there is a $25 cancellation/no show fee. The interior of Sirenetta is gorgeous.  It feels very clean & bright, with the white marble and gold accents.  If it weren't for Covid, it would be really nice to come in and sit at the long bar for drinks & oysters.  They converted the back area into a lounge like area where we were invited to have drinks at after we finished our dinner.  In the main dining area, they had plenty of tables.  The service was very good throughout the entire meal and our waiter was very helpful in answering all of our questions about the menu as first time diners. We decided to split  1/2 dozen oysters, the lobster biscuits and the citrus fried shrimp to start.  The biscuits were delicious with the lobster butter - warm and fresh.  Oysters were good.  The fried shrimp were OK but for $18, you don't get a lot of shrimp - it's mostly just a plate of radicchio.  I would pass on that app.   For our mains, I had the lobster pasta which was a decent sized portion - the dish has a kick to it. I liked it but the pasta was a little too al dente.  My friend tried the sea bass and said it was very good.   For drinks, we each had two espresso martinis which were made perfectly.  They have some interesting cocktails on their drink menu that I would drink the next time.  Overall, it was a pleasant meal and I would dine here again.
2021-02-21,5,I had such a great experience at Sirenetta. Have been meaning to try this place since it opened and figured it would be good for a birthday dinner. It was a perfect place to celebrate!Started with a couple cocktails: the Empress of the Sea and a Moscow Mule (classic and very good, the crystallized ginger was a nice touch). The Empress of the Sea was delicious and reminded me of an Aviation cocktail. It was a fun purple color and not too sweet.Appetizers all looked amazing but we decided on the Fried Oysters and Shrimp & Frites. Would recommend both of these but if I were to go back, I would opt to try something else over reordering the oysters. For entrees, we went with the Lobster Al Amaraciana (not sure if I spelled it correctly) and the Squid Ink Linguine. The Lobster pasta had some kick to it and was spiced nicely! I preferred the squid ink linguine of the two. It had a ridiculous amount of pancetta in it but was very nice with the shrimp, green onions, and black pepper. My fiancé said the squid ink pasta/sauce was a little sweet for him. For desserts, we tried two different espresso options: the Mocha gelato affogado and the Frozen espresso bomb. The mocha gelato was the best gelato I have had in Hoboken. The espresso bomb was my favorite though! I think it was also gelato under chocolate ganache? I didn't catch the server's name but she was very kind and helpful! I felt comfortable eating indoors, and our table was spaced out well from others. The interior of the restaurant is just gorgeous, lots of cool light fixtures. The music wasn't too loud either which I feel like happens too often in fancy restaurants haha. After dinner, we went to the back of the restaurant where there is a little speakeasy called Backstage. Seating is limited because of Covid so try to go earlier in the evening to guarantee a spot. The bartender (Alex?) was very helpful and put on a good show when making the drinks!Overall a fantastic experience! Looking forward to returning, maybe for brunch.
2021-02-14,5,This place was great! Went here for a celebratory drink right after proposing at the waterfront and they made us feel at home and so special. They brought us two glasses of champagne and our waiter was extremely attentive and awesome. I got a Manhattan and it was made to perfection. For the appetizer we got the truffle burratta and I really did not expect for so many truffles to be on it. It was amazing. Thanks so much for everything and we will definitely be back!!!!
2021-02-09,5,Took my wife here for her birthday dinner last night and it was spectacular. Our waiter, Brooks, was extremely knowledgeable and made several good suggestions for appetizers and wine. Very impressed. We'll be back.
2021-02-03,3,My first Sirenetta experience was interesting but good. We came in with big expectations due to the high praise from others. We booked a Friday night reservation almost a week in advance, and we were seated pretty much right away.The place is gorgeous and clean. We sat at a table close to the bar with clear sight light to the raw bar. And arguably most importantly, the staff was great. The hostess, the two managers, our server, and the bartender were incredibly kind, professional, and personable. We ordered two drinks from the Moscow Mule Bar, both of which were delicious. One was made with Jameson and peach liqueur, the other with bourbon. We love mules, so this was a no brainer for us.For starters, we ordered the Grilled Octopus. This was our favorite dish of the night. Absolutely delicious, great char, big flavor. Highly recommend.Our starters were regrettably less than impressive. Our Mahi Mahi was tasty but undercooked, to the point where it could have, and maybe should have, been sent back. The very middle of the fish was noticeably raw, but the rest of the fish was good enough. It was served with a few different forms of eggplant, the thinly fried eggplant being the standout side component.The other starter, as recommended by our server, was the Lobster Rigatoni. The lobster portion was generous, and the lobster itself was awesome. Unfortunately the pasta was a little too al dente. I like my pasta a bit softer, but this bordered on chewy. It was especially disappointing because it was homemade pasta.Overall it was a good, but not great, experience. I would definitely return to Sirenetta again, in fact I look forward to dabbling with the raw bar and other dishes.
