id,Resturant Name,Review
136,10Th And Willow Bar And Grill Hoboken,hard believe never eaten tonight made trip friday night dinner seated right away pleasantly surprised large back dining area best part table n't close together seated comfortably issue spot menu pretty diverse good mix apps salad burger sandwich entree even pizza different flavored butter every night heard everything kit kat buffalo chicken tonight bruschetta goat cheese pizza reasonably priced actually large size tried bruschetta pizza cornbread crusted chicken steak shrimp special pizza good thin crust little overcooked crispy enough cornbread chicken good expecting little bit sweetness bbq sauce added pleasant kick boyfriend got steak shrimp special average steak cooked ordered season drowning sauce n't really needed best food comfortable spot menu big enough cover everyone appetite
181,10Th And Willow Bar And Grill Hoboken,stopped dinner whim cute outdoor patio visiting sister hoboken menu pretty pricey dinner half priced entree 10-16 much reasonable tilapia rice 14 believe great portion fish rice green bean sister fried chicken mom shrimp penne lucky brother pizza food enjoyed pizza really good stealing nothing looked good coming pizza addict bread one best part meal mainly butter cheese jalepeno sooo yummy great way start meal waiting food also gave plenty water waitress attentive n't know expect atmosphere outside really cute inside front bar area two separate section way back cool quiet ton yuppie business professional twenty thirty also saw people little kid older couple
462,Ainsworth Hoboken Hoboken,beautiful tuesday day may decided eat ainsworth hoboken friend birthday waiter favorite top incapable making plain pizza pepperoni pizza plain make sense especially menu service definitely subpar say least food average however one bus boy great acted saving grace meal guac well helped save experience
482,Ainsworth Hoboken Hoboken,great spot water menu extensive tried vegetarian pizza n't bad
687,Ainsworth Hoboken Hoboken,n't like giving bad review disappointed last experience ainsworth hoboken tuesday night 3 table occupied dining room yet food 3 salad pizza appetizer took forever pizza came cold salad luke warm make matter worse dj back hosting trivia night 2 patron listen guy talk microphone nonstop 2 hour literally never stopped talking ruined vibe night really annoying credit waitress really great kitchen remake pizza still awful ended taking bill many many time usually good experience last night terrible wonder going
835,Alessios Cafe Gelato Pizza Hoboken,pizza boxing unique different issue pizza delicious half half spicy pepperoni margarita pepperoni pretty spicy good heat plenty cheesy goodness pizza crust held well leftover delicious would definitely come
838,Alessios Cafe Gelato Pizza Hoboken,got sent two day old pizza via uber eats n't even order pizza disgusting
840,Alessios Cafe Gelato Pizza Hoboken,delicious pizza husband got pala pizza long stretch pizza 30 inch half queen margherita half pepperoni takeout tonight delicious especially fresh basil enough two hungry adult also serve breakfast sandwich coffee gelato italian grocery specialty ca n't wait try coffee breakfast sandwich sometime soon
842,Alessios Cafe Gelato Pizza Hoboken,ever gotten delivery alessio delivery issue everything accurate quick panini fantastic definitely one best italian pizza place hoboken
845,Alessios Cafe Gelato Pizza Hoboken,alessio excellent addition hoboken pizza scene standard pie good real standout pala style pizza large thin sort oblong shape crust pala style little lighter crispier normal pizza crust great far know ca n't get style pizza anywhere else hoboken well worth try bonus order carryout come comically large pizza box aside excellent pizza small selection italian grocery item also nice make great iced mocha well
851,Alessios Cafe Gelato Pizza Hoboken,tried alessio know location lot turnover business year glad see alessio well went nonna pizza since love style pizza little doughier would thought could tell bat pizza heavier look good flavor favorite grandma pie capri sandwich chicken sandwich definitely stuck sandwich area chicken moist flavor worked one critique enough sun dried tomato going put enough notice thing would n't reorder caesar salad basic nothing skip alessio serviceable food good price anything blow away sandwich good pizza trick give place shot
858,Alessios Cafe Gelato Pizza Hoboken,n't understand anyone could possibly give alessio le five star let assure eaten much pizza around new york city hoboken area life time people might say pizza ever eaten one individual last night got pizza delivered one best ever tried hot got unbelievable got spicy diavola two u ate entire thing one sitting choice though good
862,Alessios Cafe Gelato Pizza Hoboken,alessio perfect spot breakfast lunch need breakfast sandwich pastry pizza coffee every single item always delicious suggest spicy texas diavola pizza inside store also sell bunch gourmet italian product outdoor seating available quaint cute also people work always warm welcoming definitely back
872,Alessios Cafe Gelato Pizza Hoboken,happy tried place got diavolo pizza mini chocolate bombolone vanilla hazelnut gelato pizza world thin crust right spice favorite mini chocolate bombolones could probably eat 10 arrived hot filled nutella sooooo good
882,Alessios Cafe Gelato Pizza Hoboken,5 star alessio consistently delicious pizza one best town thin crunchy crust tastey sauce prosciutto de parm panini household favorite today also tried bruschetta absolutely delicious
893,Alessios Cafe Gelato Pizza Hoboken,really fantastic staff incredibly pleasant got 3 scoop gelato fantastic eli sp kind friendly saw eyeing slice pizza offered u try incredibly kind gesture mushroom onion son finicky fell love requirement pie get sauce unique tasty crust crisp crunchy still airy definitely recommend trying live world pizza snobbery become intense remember pizza good time bit different make want ordered meatball parm come super tasty bread gobbled like heading little bit
900,Alessios Cafe Gelato Pizza Hoboken,cafe awesome great addition neighborhood espresso really high quality ca n't wait try gelato flavor really solid slice pizza back
901,Alessios Cafe Gelato Pizza Hoboken,brand new little cafe area variety option breakfast pastry pizza gelato tried slice pizza tasty great add middle hoboken n't want go washington street quick bite
2537,Apulia Hoboken,nice looking place northeast hoboken private outdoor patio space back table outside front inside pizza oven dominates center main dining room small ice cream freezer front promptly seated scanned menu ordered beet salad rustica prosciutto sausage broccoli rabe pizza salad fine nicely presented nothing spectacular good great value given price pizza however disappointing soggy middle probably kept oven another minute flavorful crust greatly resembled large naan could toasted bit longer walked washington later noticed pizza place busier probably try next time
2538,Apulia Hoboken,great vibe excellent food burrata delicious got buffalo mozzarella pizza hazelnut spicy honey pizza great honey n't spicy penne pasta unique texture freshlymade al dante affogato tiramisu great really good espresso flavor
2539,Apulia Hoboken,hand best pizza ever life n't skip calamari make sure try carbonara never want end beautiful patio amazing service ask frank awesome
2541,Apulia Hoboken,spot gem byob believe also serve wine make sure grab favorite bottle wine head enjoy relaxing saturday night vibey outdoor seating mini courtyard back cozy spot linger dinner balmy summer evening good first second third forever date spot beaten path uptown hoboken pasta homemade chew chef kiss waiter told chef make food back hometown apulia southern italy travel frequently authentic get would 1000 get pasta pizza woodfired 1000 degree think mentioned unfortunately pizza little soggy middle reason pizza would flop hold ingredient sure would go back pizza maybe would order simple one next time
2542,Apulia Hoboken,came try pizza rate exclusively liked place italian spot new jersey pizza place center restaurant fast pizza came 10 pizza good much better average usa
2544,Apulia Hoboken,apulia hand best pizza hoboken service great staff always friendly highly recommend
2548,Apulia Hoboken,fine italian restaurant great food good vibe inferno pizza absolutely delicious theatrics presentation unexpectedly delightful pizza literally fire also ordered ravioli panzerotti equally good tiramisu must
2553,Apulia Hoboken,friend mine told u place minute taste pizza transform italy probably authentic pizza ever tried america fresh delicious byob waiting nyt rated pizza good razza according best pizza ny also love local element whole story puglia region italy name taste come
2559,Apulia Hoboken,probably best italian hoboken pizza better many popular place new york gotten delivery sure even better person highly recommend diavla solid caesar
2560,Apulia Hoboken,apulia pizza elevated pizza take date still feeling like try hard simpler pizza eat feeling settling dinner understanding apulia venture former employee ridgewood egidio style similar creatively imagined deliciously executed neapolitan pizza using brick coal oven fine ingredient end result either par better wo n't pizza justice word end simply saying check place
2565,Apulia Hoboken,honestly pizza fantastic hoboken loaded mediocre pizza place one surprisingly great little expensive worth
2567,Apulia Hoboken,friend went restaurant friday sat outside patio inside ambience definitely best part app shared uccelletti prosciutto wrapped around fresh mozz broiled oven phenomenal however server supposed bring u bread never defense think busy possibly server restaurant delicious without though lord know n't need bread meal entree shared margarita pizza tagliatelle bolognese margarita pizza thin crust ok nothing stood pasta delicious homemade overall solid night
2569,Apulia Hoboken,horrible experience ordered 2 appetizer pizza got appetizer normal time 20-30 minute done apps waited pizza hour kept asking waiter said must lost ticket hour 20 minute asked check longer hungry shame came pizza left without pizza dinner wo n't returning anytime soon n't come hungry chance wo n't get eat
2572,Apulia Hoboken,taking bite inferno 12 brick blazed pie felt dressed never happened though dined alone relishing everything enjoying pizza someone agree crust pizza important apulia rave worthy recipe bite chew crust enjoyable sause perfect balance tangy sweet like plus cheese great quality leave anyone read choose topping know inferno dressed reading menu know base pizza great important moon pizza decided enjoy special yesterday fabulous butter sause ravioli dish yes singular one huge scrumptious pasta creation filled longoste ended chocolate nutella gelato satiate sweet tooth left feeling like underdressed staff attentive accommodating making sure comfortable always water filled royal treatment n't see woman staff keep good work gentleman
2574,Apulia Hoboken,ordered first time via grubhub got margherita pizza olive 10 10 1000 new go-to delicious pizza must try wo n't disappointed
2576,Apulia Hoboken,first visit apulia still relatively new hoboken food scene always excited try new pizza spot even though hoboken ton two friend arrived seated relatively promptly make reservation writing time outdoor dining would 100 recommend making rez seated cute cozy back patio table comfortably far apart staff kind negative since wall around high pretty much breeze quite hot even 8pm food thought solid would compare pizza dozzino familiar hoboken pizza spot everything tasty portion worth price best thing one rushed u friend sat hour never feel pressured leave overall another good addition hoboken
2578,Apulia Hoboken,favorite pizza uptown hoboken murgese pizza def one favorite n't disappointed staff always friendly
2579,Apulia Hoboken,awesome pizza great atmosphere vegetariana pizza perfect frank carry good discussion music
2582,Apulia Hoboken,ambiance chic warm inviting wait staff friendly accommodating menu authentic prepared google ingredient italian food really good healthy portion cost 20 got 1 pizza 1 pasta byob like pizza italian restaurant hoboken would recommend place anyone looking authentic italian dish
2585,Apulia Hoboken,early dinner recently friend service great everyone friendly helpful even restaurant filled still got u asked minute patience took order larger company next u meatball octopus appetizer great pizza awesome light flavorful right wood-fired oven friend born raised italy agreed pizza outstanding definitely visit place try dish
2598,Apulia Hoboken,super cute space especially back nice light lot table enjoy beautiful evening pizza food delicious able accommodate everything ordered dietary restriction overall food good huge fan crust server nice took far long pizza come restaurant busy packed n't think wait time justified
2600,Apulia Hoboken,came casual dinner friday night busy big mix people server friendly service felt confused somewhat amateur ordered salad share okay great underdressed bagged mesclun type leaf couple cherry tomato literally red onion sat waited quite long time pizza arrived n't forgotten table anything everyone waiting table next asked food told really busy made raise eyebrow apology kind expect ca n't see lot customer pizza arrive good judging apulia purely pizza would four possibly five crust thin crunchy without tough topping high quality could made bit care distribution topping uneven also think overpriced hoboken nyc goodness sake service decor rudimentary decor pretty non-existent actually felt like eating back room bar tableware ordinary table n't wiped sat condiment even salt pepper table apulia byo also pretty noisy quite happy drop 60 00 two pizza salad service atmosphere good well pizza simply n't case
2601,Apulia Hoboken,ok looking forward coming since opened since know owner chef operator etc edigio ridgewood without doubt best artisanal neapolitan style pizza southern italian food nyc nj challenge anyone serious cultured taste say otherwise ingredient original style apulia coast naples share food root eating culture natural whole best season made care meant enjoyed family friend food worship real deal living well pizza crust distinct yeasty taste food onto made wood fired oven seared crunch outside soft pillow like crumb inside love table bread let alone pizza base topping fantastic seasonal fresh whole vibe inside like happy family feast tried excellent pasta several pizza cherry tomato evoo sea urchin like bari maybe better unusual conventional pizza topping n't need weigh relative 5 star usually say 5 star nj place 3 star manhattan apulia would 5 star manhattan rome bari new jersey
2603,Apulia Hoboken,update finally chance get pizza fresh hot restaurant wow disappoint best pizza new england used live new franco rest staff also seem like awesome people back soon old review starting bad news pizza showed stone cold close original time window great cold pizza box cold touch pizza inside nearly heat oven little disappointing end paying 25 buck per pizza tax tip delivery fee maybe need invest delivery bag pizza delicious think best union city hoboken jersey city area gave three star giving guess favor eat want try
2604,Apulia Hoboken,went wife ordered salad two pizza salad large enough two tasty well dressed etc waited quite long time pizza come however excellent would go far say like roberta quality downside child rich allowed run place 8:30 9:00 friday night price bit steep salad 11 12 pizza 20 60 pizza salad seems expensive nyc price go back pizza good
2605,Apulia Hoboken,pretty good wood burning pizza man attitude would think famous restaurant upscale pizza joint nothing
2611,Apulia Hoboken,typical chunky cheese hoboken pizza place pizza excellent italian food menu item special 5 adult restaurant great food service atmosphere uptown hoboken long overdue gladly welcomed n't disappoint highly recommend
2614,Apulia Hoboken,love place always packed around dinner time weekend come early reservation either like trying different special going apulian burrata best burrata inside creamy exterior little rubbery sucker porchetta try one thinly sliced sauteed onion pretty good also grilled octopus also good flavor pizza however star show chewy crust ingredient work tried different one time called rustica solid pizza around marinara one point literally tomato sauce crust olive oil
2616,Apulia Hoboken,tried apulia first time saturday everything delicious appetizer pizza big fan neapolitan pizza one best see use fresh authentic ingredient definitely best neapolitan pizza hoboken believe tried place reminds much ribalta new york city chef come italy great job definitely come back
2618,Apulia Hoboken,portion complete robbery order pizza another place spent 60 2 people nearly enough food
2619,Apulia Hoboken,great neapolitan style pizza margherita solid prosciutto arugula also fantastic good affocato byob
2623,Apulia Hoboken,yeah really good football watching pizza place saying go good specialty pizza byob btw 3 people 3 pizza good small place waited 25 minute saturday night around 7:30 huge thin crispy crust pizza guy pleased although base crust kinda crispy outer ring little doughy like bialy relate appetizer blow u away skipped inferno pizza n't worry far tasty spicy soppressata p prosciutto different cheese almost classic enjoyable also murgese pizza prosciutto shitake mushroom truffle pecorino cheese special pasta would imagine good good customer service friendly waiter
2624,Apulia Hoboken,great neighborhood spot fresh yummy pizza byob decent service reservation get busy head earlier
2625,Apulia Hoboken,really wonderful pizza hoboken much better place hoboken delivery
2626,Apulia Hoboken,confused rave review restaurant best friend went random wednesday night ordered following eggplant parmesan appetizer barely cheese n't good 1 5 got apulia shrimp n't get good inferno better apulia pizza nothing spectacular super disappointed really looking forward place biggest tip go zero otto uno best pizza hoboken place n't compare unfortunately
2627,Apulia Hoboken,lovely pizza lovely salad seamless deliver show limp cold put pizza warmer delivering cmon
2628,Apulia Hoboken,delivery fast pizza hot large selection pizza pasta selection little subpar
2629,Apulia Hoboken,great new pizza little cozy place corner washington 14th st food definitely authentic southern italian palermo dish exclusively great salad pizza byo
2630,Apulia Hoboken,wife ate tonight first time absolutely loved definitely returning try pie think could best pizza town enjoy neapolitan style service great staff friendly highly recommend
2631,Apulia Hoboken,best pizza hoboken place beautiful service excellent place amazing food pizza ca n't wait go back esp back patio open n't yet gotten take def put add list
2633,Apulia Hoboken,ate friday night coworker first time byob picked 2 bottle chianti go wine taste best pizza pasta red sauce meat server recommended soppressata pizza soo good full flavor prosciutto pizza also nearly good also cavatelli ragu sauce pleased everything italian job well done would recommend others
2634,Apulia Hoboken,ordered delivery got inferno pizza may well one best pizza ever little pricey size quality ca n't complain
2635,Apulia Hoboken,love neapolitan style pizza heard apulia opening give try went apulia weekday night n't wait table restaurant nice inside focal point large oven pizza prepared seated table near oven fun could see pizza making process additionally server friendly helpful attentive ordered eggplant parmesan inferno pizza good eggplant parmesan stacked layer cheese covered sauce made cheesy saucy dish loved could see bit much people looking eggplant parmesan eggplant star inferno pizza great piping hot perfect chewy slightly charred neapolitan crust spicy overwhelming overall really happy ordered ca n't wait come back
2640,Apulia Hoboken,pizza spot hoboken also best service restaurant go lot restaurant pizza apps salad delicious ryan frank brian amazing new go place really place go pizza deliver
2642,Apulia Hoboken,ordered eggplant appetizer special prosciutto ricotta delicious small portion 3 tiny piece expensive small portion size inferno pizza highly rated underwhelming lot pizza place hoboken would prefer one environment nice though byo plus food pricey great returning
2644,Apulia Hoboken,newly opened restaurant excellent neapolitan pizza authentic southern italian small plate puglia regifor appetizer mussel swordfish braciole octopus excellent also several pizza favorite inferno back today lunch inferno pizza best ever explained baresa style different neapolitan crisp light doughy went razza last week also great however apia favorite
2645,Apulia Hoboken,incredible pizza idea make thin pizza soggy must try speck appetizer must try go week avoid crowd byob
2646,Apulia Hoboken,review delivery pizza point ordered margarita pie delicious ca n't wait try others
2647,Apulia Hoboken,like try new place apulia one marguerita pizza husband truffle pecorino really good nice light tomato sauce without strange spice nice layer cheese topping crust similar real italian pizza pizza pan want traditional italian pizza place love
2649,Apulia Hoboken,dining room service quite good nothing super special nothing bad either n't like value pizza good pizza thin crust good quality ingredient pizza 4 slice personal pie 18 3 u ate 1 pizza lunch tip tax 68 wow hoboken ton pizza place sure price point remains viable
2652,Apulia Hoboken,great new pizza place hoboken offer various wood fired pizza pasta salad got fresca inferno pizza great however contrary name inferno pizza spicy server accommodating kind met owner friendly let u finish wine even though closing time fyi byob would definitely come back
2653,Apulia Hoboken,finally got around trying new spot apulia overall place good atmosphere really nice definetly great addition uptown hoboken also byob huge plus crowded 45 minute wait need formal better process host monitor line provide update got seated item menu menu limited outside pizza ordered mussel 2 pizza entree service perspective timing need huge improvement mussel came first deliscious one cherry tomato tho needed 2 pizza came good timing mussel literally one bite pizza entree came awful delivery nice restaurant entree good way priced gnocchi pesto basically tiny ball gnocchi sauce could use thing going charge 22 bite pasta sauce menu could enhanced also lastly bus boy kept trying take plate still eating trying turn table overall food good great service organization need sig improvement menu could enhanced def back especially patio open summer zero otto uno new spot 5th wash origin food also new much much better comparison service top notch
2654,Apulia Hoboken,pizza perfection made right way excellent service italian would ask want espresso eat yes please course margherita spectacular mozzarella definitely aged perfection n't pizza like
2660,Apulia Hoboken,good restaurant pizza crust traditional delicious however surprised delicious pasta mussel
2662,Apulia Hoboken,great addition hoboken frank fabulous tiramisu amazing good pizza salad pasta
2663,Apulia Hoboken,great addition city went business meal client enter warm wood fired pizza oven welcome along friendly owner frank staff started three pizza burratta octopus appetizer excellent adding two home made pasta dish finished great oven roasted italian coffee dessert platter back young dynamic team please support
2667,Apulia Hoboken,uhm seems like prior review artificial took 20min anybody take order another 5min open wine bottle top pizza ordered n't compare napoli brick even urban coalhouse pizza little better 2nd star sympathy fyi please avoid tall red-headed waiter
2671,Apulia Hoboken,tried lot pizza day far delicious authentic italian pizza staff great chef incredible also tried orecchiette made scratch amazing ca n't wait go back try
4373,Basiles Pizza Hoboken,best pizza n't understand one thing read review gon na say thing everytime go dude behind counter got craziest attitude great pizza business mean pizza phenomenal yet keep guy people skill whatsoever talk customer also another young kid got craziest attitude ever mean come man many review need employee many talk go outside get slice got ta deal somebody wake mad wake mad stay home
4377,Basiles Pizza Hoboken,charged average pizza best 3 slice 15 never total 12 50 brought cashier ignored
4379,Basiles Pizza Hoboken,great cheese slice went noon quick go pizza parlor included favorite crust soo crunchy crust
4382,Basiles Pizza Hoboken,time seems service going downhill last year used love service made inconsistency food n't first choice even top ten love real ny pizza area easy place stop corner location pretty quick get depending time day could get really fresh pizza could get slice sitting standard fast food pizza mean sometimes food sitting longer like pinwheel even pizza ok crust done right usually crispy yet soft middle stay together fold otherwise nothing write home hurry even need place grab bite stopping carlo checking local bar decent place stop
4383,Basiles Pizza Hoboken,best spot late night pizza hoboken grab couple slice hang bar
