id,Resturant Name,Review24134,Napolis Pizza Hoboken 2,today ordered large pizza two topic n't get instead delivery guy gave plain huge pizza could n't call child babysitting hungry minute later lady call place telling pizza got expensive one originally ordered expecting pay disgusting pizza received add call ask pizza people hanging around putting telephone terrible experience babysitter accent may undestanble child deserve respect
24135,Napolis Pizza Hoboken 2,napoli make best pizza hoboken easy feat city endless pizza joint always extremely busy testament quality food chipotle chicken favorite slice entire world though seems vary depending make
24137,Napolis Pizza Hoboken 2,best pizza town alison great attentive made sure get order right always smiling n't feel rushed definitely recommend napoli family friend
24139,Napolis Pizza Hoboken 2,incredible oven fired pizza n't get better know people like different kind style pizza crust thinner crust perfect doneness 5 star service marginal day really busy fine line since n't want bothered refill drink getting timely turnaround check could better worry rate 4 instead 5 based service
24145,Napolis Pizza Hoboken 2,pizzeria upper hoboken outdoor seating sell pizza slice whole pie opted pie since cheaper getting slice pizza pretty good price comparable pizzeria hoboken forgot credit card like fool paying thankfully kept safe picked
24149,Napolis Pizza Hoboken 2,always wondered hoopla place always busy figured try tried pizza ny nj area one stacked well top dog spumoni elite category 2nd tier pizza would go going grimaldis hoboken overall great dining experience byob aspect helped back also tried goat cheese salad good
24152,Napolis Pizza Hoboken 2,pizza exceeded expectation everything sizable great group low price service nice loved pizza mediterranean chicken pasta also good 10 10 would come back visit
24154,Napolis Pizza Hoboken 2,love place pizza great salad pizza tremendous love seeing busy get feel like real neighborhood pizza place
24155,Napolis Pizza Hoboken 2,wonderful home style pizza family environment stopped last minute large party 17 people napoli accommodating find u space 15 minute pizza wonderful thin crust bubbly flavorful favorite sicilian thick crust many type cheese fresh crisp veggie definitely recommend note byob accommodating case wine corkage
24156,Napolis Pizza Hoboken 2,amazing brick oven pizza friendly accommodating staff coming pizza hoboken couple year definitely still place go pizza
24157,Napolis Pizza Hoboken 2,could zero would ordered large clam pizza go brought pizza home opened box astounded literally cooked dry bread clam sprinkled top nothing else description pizza say clam black pepper oregano basil olive oil romano cheese baked sound delicious got called see happened told sorry busy forgot forgot add topping solution given cheese delivered arrived 30 minute later le tablespoon something get little shaker container whole supposedly large pizza another thing 6 small slice laughable large pizza needle say eating complete waste 22 dollar
24159,Napolis Pizza Hoboken 2,love place best pizza hoboken always delicious wonderful staff know regular name order packed weekend well worth wait byob
24161,Napolis Pizza Hoboken 2,heard read great review place outside yelp decided give pizza joint try boyfriend man place busting business mostly people ordering picking traffic get monday night wild glad business seems well located washington sure impact local probably visitor love place byod brought bottle wine corkage fee provide glass open busy night went 2 waitress one busser sure norm could definitely use staff given busy really great service granted uber busy give credit hustling also love really good margherita pizza calamari app mediocre almost tasted like cooked unfortunate nice crisp squid chewy sure served marina sauce sweet chili sauce get asian chinese restaurant n't feeling die breaker really pizza obviously pizza restaurant felt pie felt short list dough cooked long almost tasted big cardboard-y n't enough sauce either hoping come back try another kind pizza good review
24165,Napolis Pizza Hoboken 2,great pizza slice deal check yelp promo slice deal 5 two
24166,Napolis Pizza Hoboken 2,visiting west coast ordered delivery grubhub got individual size spinach artichoke white pizza delicious loaded spinach artichoke plus cheese combined white sauce excellent crust ca n't make crust west coast gobbled half hungry also tasted good looking forward half tomorrow lunch get pizza like near suburb northwest la
24167,Napolis Pizza Hoboken 2,place place go pizza love freshness variety pizza choose wife always order thing spinach salad gluten pizza best pizza hoboken
24168,Napolis Pizza Hoboken 2,good around-the-neighborhood pizza pasta joint also byob-place friendly staff
24169,Napolis Pizza Hoboken 2,one best fair priced pizza joint hoboken friendly staff good atmosphere officially go pizza place hoboken cassandra awesome
24173,Napolis Pizza Hoboken 2,far many negative experience napoli give 1 star back summer girlfriend ate outdoor table lunch sat went inside practically empty asked server nicely ok sit outside course said fine right n't come 15 minute even bring menu beginning hour waiting got wrong pizza server seemed really care shrugged time got correct pizza ate hour half manager explanation essentially n't normally operate really took responsibility issue comforting last night frankly last straw placed order seamless small pizza 1 topping 7:00 estimated delivery time 7:45 7:50 fine waiting 8:00 started wonder checked status order said estimated delivery time 8:15 8:25 ok well get friday night 8:30 still pizza sign would called restaurant took nearly 15 try phone line busy someone finally explained restaurant backed thinking taking delivery order know new restaurant know exactly friday night like hoboken fact ca n't anticipate show n't care much ca n't figure make enough pizza either way get act together pizza ended coming 8:50 hour 50 minute small pizza travel 6 block despite call restaurant one even offered refund much delivery fee may wondering pizza time fine best worst certainly worth hour 50 minute wait done napoli
24175,Napolis Pizza Hoboken 2,craving garlic knot one night came across nappoli pepperoni pizza garlic knot pretty good great good delivery pizza option hoboken reasonable price
24178,Napolis Pizza Hoboken 2,napoli one delicious pizza come back several time eat pizza enjoyed everytime gluten free pizza crust made house said still order everytime would helpful could sell gluten free pizza smaller portion ie slice n't taste good warmed next day customer service incredible n't remember waiter waitress last time cassandra great one thing extremely disappointed ordered eggplant parmesan vodka sauce go next day brother ate said eggplant undercooked n't taste like vodka sauce n't think ordering eggplant
24181,Napolis Pizza Hoboken 2,ordered seamless day ago delivery seemed like small vodka pie popular choice ordered buffalo wing well food time called seamless rep shortly placed order let know napoli going charge additional delivery fee top already paid part new policy implemented bit irritated gently let ride hoping food would worth extra cost unfortunately notorious vodka pie extremely disappointing cheese sauce burnt top pizza way rough chewy n't seem like brick oven pizza saving grace meal wing cooked well tasted great native naples also pizza business sad kind experience seems popular menu item look really good perhaps stop one day give another shot
24187,Napolis Pizza Hoboken 2,ordered pizza online 7:00 pm right 9 pm called said need another 20 minute planet restaurant need two hour cook pizza
24188,Napolis Pizza Hoboken 2,n't visited restaurant yet delivery let tell ya brick oven pizza phenomenal happy deliver jersey city height
24191,Napolis Pizza Hoboken 2,came night make pizza salad got arugula salad pretty good little heavy dressing main course got pizza created warning small huge two u could n't finish table next u got two large pie 3 people looked pretty ridiculous haha pizza great next time come back want try one white pizza looked amazing restaurant small seating limited may wait little packed went wait around 20 minute service little slow overall good also note byob
24192,Napolis Pizza Hoboken 2,best pizza hoboken highly recommend whole wheat margarita pizza great selection artisan style pizza delivery service good well look crowded contemplating going brick oven competitor next door n't disappointed place worth wait enjoy
24193,Napolis Pizza Hoboken 2,love waiting 2 hour pizza mention called ask pizza said way yet 40 minute later still starved would understand maybe traffic incident understanding pal hoboken mile mile could crawl faster
24194,Napolis Pizza Hoboken 2,place awsome craving pizza decided check place got vodka pizza meatball slider amazing tried pizza place hoboken favorite far take despite yelp review food delivered le hour definitely order
24198,Napolis Pizza Hoboken 2,never pizza delicious tonight brought back childhood brooklyn n't tasted anything delicious since son moved area recently regular thank livvy amazing service telling u vodka pizza favor try napoli
24199,Napolis Pizza Hoboken 2,definitely best pizza hoboken first time came rush ordered two slice go buffalo chicken slice looked good ordered one grandma slice thicker side buffalo chicken slice stood appearance also taste amazing second time came girlfriend ordered small margharita pizza garlic knot garlic knot best ever margharita pizza conjured san marzano tomato fresh mozz basil romano cheese tomato sauce particular rustic authentic taste definitely freshly made service great time came ordered two slice go received free fountain drink part lunch special napoli new go-to pizza hoboken
24201,Napolis Pizza Hoboken 2,service great waitress nice knowledgable menu recently added bunch new item really punch selection def back byob always pleasant dinner experience wan na try vodka pizza plain next time chicken got dried think meatball slider awesome caprese nice big slab mozz specialty pizza got little heavy still good large size def way go best deal
24207,Napolis Pizza Hoboken 2,first place chose eat moved hoboken gluten free pizza fantastic eating make feel like dietary restriction n't problem still enjoy one favorite food couple block away pasta n't great pizza delish margherita classic clam pie fantastic
24209,Napolis Pizza Hoboken 2,excellent pizza chicago enjoy new york style pizza one best ever travel ny nj area often look forward eating service also top notch
24210,Napolis Pizza Hoboken 2,really liked food lot ordered delivery night late midnight margherita pizza medium sized one two order garlic knot kid pasta whole thing came 30 thought kind crazy n't even full sized pizza like said late hungry delivery took hour also kind crazy guess expected busy area anyway food awesome pizza soooooo good garlic knot best ever soft doughy good would definitely eat food
24211,Napolis Pizza Hoboken 2,wanted love place really reading review gluten free pizza could n't excited try honestly one worst gluten free pizza ever delivery service exceptional especially friday night give friend enjoyed margherita pizza eggplant rollatini would probably never order gf pizza bummed still hunt best gf pizza hoboken
24214,Napolis Pizza Hoboken 2,amazing pizza 5 time great every time margerita pepper olive onion pepperoni fav love garlic order garlic knot die
24216,Napolis Pizza Hoboken 2,pizza always great however tonight service sucked waiter neglectful n't ask food let u get whole meal without refilling drink choking pizza dough n't get mussel half empty n't open table bread taste like 3 day ago next time take go
24217,Napolis Pizza Hoboken 2,love pizza n't tried much else maybe salad anytime want good pizza go napoli pretty consistent pizza always good
24218,Napolis Pizza Hoboken 2,best pizza hoboken without doubt favorite vodka pizza try incredibly usually get extra cheese
24219,Napolis Pizza Hoboken 2,best pizza ever get vodka pizzaand byob
24220,Napolis Pizza Hoboken 2,really nice experience groupon deal well came relatively early friday issue getting table room stroller inside since super hot waiter see little guy say something say right back guy come back minute later napoli onesie little dude anyways probably talk food caprese salad nice fresh mozzarella big tomato slice bruschetta toasty yet soft bread completely smothered chopped tomato salad half sausage ricotta pizza pizza really nicely done chewy crust ricotta add nice creamy smooth element pie half clam pizza one touch oceany might liked clam pizza really ca n't fault oceany strangely enough taking home letting sit day took edge liked better cold food point though would n't get clam pizza back soon
24222,Napolis Pizza Hoboken 2,living hoboken couple year full-blooded italian point view whole lot great pizza place area far favorite basile napoli napoli take number one spot excellent rendition brick oven pie price along generous 20 coupon yelp user make reasonable pizza garlic knot ca n't comment rest menu pizza vote good crust oily perfect mix cheese sauce staff pretty awesome recognize regular treat like family go nap
24226,Napolis Pizza Hoboken 2,pizza place hoboken pretty good though opinion may best bet want basic slice cheese pepperoni
24230,Napolis Pizza Hoboken 2,amazing pizza even warmed hour later kind amazing top crust might look burned unappealing fooled-the flavor point kind pizza get-if want genuine ny nj style slice
24231,Napolis Pizza Hoboken 2,pizza review best slice pie dollar hoboken pizza perfect depth thin thick balance savory level crispiness even maintains crisp delivery live across town dine inside two slice come free fountain drink amazing speciality slice always looking great tell fresh n't sitting refrigerator weekend staff nice authentic
24232,Napolis Pizza Hoboken 2,napoli via delivery night friend would like dine get chance check place pizza always good arrives timely matter nothing over-the-top amazing good quality pizza hoboken short sweet
24233,Napolis Pizza Hoboken 2,hand best white pizza ever get extra basil sausage melted glob mutz fresh melt mouth huge fan tomato pie white pizza world often got delivered actually first pizza moving hoboken hold well delivery byob great outdoor table sit warm
24234,Napolis Pizza Hoboken 2,tried place first trip hoboken delighted pizza delicious get slice whole pie definitely coming back
24236,Napolis Pizza Hoboken 2,stopped friday afternoon pizza ordered large margherita prosciutto n't take long pizza come oven delicious sauce tasty basil fresh cheese perfect great little spot
24237,Napolis Pizza Hoboken 2,came friday night groupon pizza delicious ordered vodka pie white pie amazing also ordered apps bruschetta ok bread n't really crisp kind soggy side baked clam sorry say plain awful huge clam covered melted mozzarella garlic would n't order apps definitely pizza
24238,Napolis Pizza Hoboken 2,ordered 3 pizza received 2 1 correct 1 received 1 2 hour later still missing never order still waiting 3rd pizza
24240,Napolis Pizza Hoboken 2,place clearly happening spot family group though would n't take reservation group 6 thus wait half hour table felt like long time pizza place definitely worth wait pizza delish able lovely book club discussion without feeling like loud one place server brian super attentive friendly say great quote book read snap snap napoli fab
24241,Napolis Pizza Hoboken 2,pizza great undoubtedly service definitely need improvement
24243,Napolis Pizza Hoboken 2,napoli great place eat casual meal visited upstate ny daughter family jersey son hoboken pizza large two fed family 5 adult 2 child love pizza margarita kalamata olive onion choose topping stick traditional margarita fresh basil delicious ended meal italian ice treat great place bring family also good couple enjoy date waitress livie great even cut pizza kid
24244,Napolis Pizza Hoboken 2,first time ordered vodka pie napoli hooked however last three time ordered delivered luke warm dry overcooked think finally time give memory first pie move great pizza option hoboken
24245,Napolis Pizza Hoboken 2,dough sauce cheese topping pizza something love enjoy yet simple make hard nail friend top 3 favorite pizza joint new jersey perfectly thin right amount sauce cheese topping incredibly fresh pepperoni small nice crispy arugula crisp yet delicate jalapeno monster mouth holy moly burn mouth definitely spiciest jalapeno ever ate handle spice regardless topping truly enjoy pizza spot reasonably priced plus offer deal groupon 20 yelp check in small 14 pie one topping cost 15 50 heck bargain right enough two people service good attentive care pleasing customer busy especially weekend point 7 8 delivery personnel delivering pie insane considering many pizzeria hoboken right tell something right next time craving pizza make sure check spot truly worth
24246,Napolis Pizza Hoboken 2,5 star vodka pizza rice ball add pepperoni vodka pizza disappoint wing delicious also ordering recommend picking v delivery delivery take awhile pizza cooled time arrives might need throw oven eating overall love place
24247,Napolis Pizza Hoboken 2,extremely annoyed place love pizza every time go particular pizza gone guy tell popular freaking popular ca n't make always pay personal pie big hit finding screw pasta fair share place god forbid call delivery wo n't get food well hour mention come chance order undercooked main reason decided eat pizza seeing unable anything else right someone explain cesar dressing taste like tuna fish ever ask speak owner always want argue get another dime n't deserve one star ca n't post without star
24249,Napolis Pizza Hoboken 2,boyfriend came napoli craving pizza seated fairly quickly staff friendly attentive food great ciao belle pizza along wing complaint restaurant also honor yelp 20 discount checking 5 star napoli
24250,Napolis Pizza Hoboken 2,great pizza like classic margarita fresh mozz wrap good eggplant rolatini app surprise awesome everyone work especially daytime weekday waitress crazy nice probably best pizza overall hoboken although grimaldi neck neck
24257,Napolis Pizza Hoboken 2,best pizza hoboken hand classic brick oven taste always cooked perfection sure ordering pie tell either classic margherita
24258,Napolis Pizza Hoboken 2,best pizza long shot 9 pizza pie delivered slightly burnt crust barely crust pie crust best part way much sodium n't look appetizing mean definitely never ordering
24259,Napolis Pizza Hoboken 2,disappointment took 2 hour deliver even though told 45-60 min girl eventually answered phone n't really give rip pizza came pizza tasted like box arrived wing barely recognizable weekend hoboken wing fest garlic knot tasted fresh 2 day city great pizza surprised one still standing get 2 star sort smelled like pizza
24264,Napolis Pizza Hoboken 2,first foremost staff fantastic absolutely love attentive food great favorite bbq chicken pizza honey mustard chicken pizza also make gluten free pizza pasta spring summer sell italian ice also fantastic cheer cooky cream favorite n't hesitate dine order napoli far best pizza hoboken
24265,Napolis Pizza Hoboken 2,absolutely great always get garlic knot tried pizza great love bruschetta pizza byob always forget brought home leftover lunch today favor great
24266,Napolis Pizza Hoboken 2,process elimination sorted hoboken pizza joint finally found spot meet simple criterion 1 consistently tasty 2 deliver quickly hour peak time 30 minute peak 3 accurately delivers correct order every time hallelujah thing noticed napoli large pizza absolutely enormous expect leftover find pizza dry fridge therefore never eat leftover pizza hold really well day good cold reheated entree good also delivered portion large enough two meal white pizza awesome love red sauce first time ordered one requested side sauce dip totally unnecessary buffalo chicken killer make buffalo sauce heavenly buffalo alfredo hybrid resembles buffalo chicken pizza ever best way good food delivered accurately time seems easy one found get right
24267,Napolis Pizza Hoboken 2,update 2 deliver pizza building wrong apartment much surprise one neighbor took delivery pizza signed credit card receipt napoli end giving u pizza free gave u credit towards purchase another pizza kudos imo screw ups happen judge business respond make thing better
24268,Napolis Pizza Hoboken 2,great experience especially late pick-up new year eve make solid thin crust pizza recommend ordering white pie artichoke heart extra topping awesome new hoboken up-town go brick oven style
24269,Napolis Pizza Hoboken 2,delicious food always point salad pizza definitely favorite hoboken
24270,Napolis Pizza Hoboken 2,order lot delivery never issue twice took hour get apartment assumed slammed night dining in-it huge place service attentive dined couple time compared ordering delivery probably two dozen time dine experience good reason giving napoli 4 star 5 food quality pizza solid best ever definitely average brick oven pizza pasta dish huge portion quality wise ok however dishes-the cold antipasto got bad cheese stuffed mushroom mussel marinara n't good fairly inconsistent across board salad panini good wrap meh napoli go delivery italian restaurant based pretty fair price reliability dish pizza salad panini mainly however could definitely improve quality dish would recommend others
24271,Napolis Pizza Hoboken 2,amazing pizza wow good pepperoni pizza easy mess taste pepperoni point hurry go try also n't pricey uptight dress code atm store well tv catch game hurry go check em
24276,Napolis Pizza Hoboken 2,looking good pizza place best uptown pizza far n't even think going knockoff next door
24282,Napolis Pizza Hoboken 2,tasty eggplant chicken parmigiana excited try pizza specialty later date ordered clam pizza delivery sorely disappointed came overdone burnt many area beyond rustic char clam dough chewy made jaw ache added tomato sauce pizza much improved without sauce pizza dry nightmare
24283,Napolis Pizza Hoboken 2,boyfriend come three time three visit pizza pasta delicious mention customer service point shout waiter brian make awesome cappuccino
24284,Napolis Pizza Hoboken 2,came gym buddy know gym pizza weight loss one big understatement cheat meal week byob spot like place hoboken beer ordered whole wheat margherita pizza white pie overall pizza ok bet tomato sauce whole wheat pie bland
24287,Napolis Pizza Hoboken 2,best pizza nj everything else awesome bruschetta mussel salad large pie needed table big pepperoni san francisco company rarely seen far east go soon
24288,Napolis Pizza Hoboken 2,fast friendly service super tasty pizza highly recommend vodka pizza garlic knot
24289,Napolis Pizza Hoboken 2,delivery atrocious stopped ordering 6 month ago cause always quote 45-hour reality take hour half get pizza well tried luck know hour half go still pizza worth aggravation
24292,Napolis Pizza Hoboken 2,love love place speak pizza tried anything else pizza amazing tried regular marghaerita pizza totally prefer marghateta thin crust fresh mozzarella topping like always get meat onion say delish slice huge medium good two hoboken parking suck honestly worth driving extra five minute ask livvy best waitress
24293,Napolis Pizza Hoboken,love napoli pizza offer many flavor option choose one never seen pizza spot zucchini primavera clam slice menu variety biggest critique experience crust thick tough rally tried like pizza even tried 3 different slice although could n't get crust taking much energy jaw chew sadly returning
24294,Napolis Pizza Hoboken,review pizza ordered 10 2 21 pickupi ordered 1 white 1 cheese pizzarestaurant quite busy greeting pretty normal place n't expect sad good ordered online pizza ready estimated wait time 5 mintues despite restaurant extremely busythe bad saltsaltsalty someone spill salt making dough frequently eat pizza one clinton today pizza extremely salty initially thought cheese dough taste bud wide open right ok understand busy please better job cutting slice similar size least try burned bottom alwaysa real hit miss pizza joint wish better one term taste
24295,Napolis Pizza Hoboken,online order takeout food ready promised appreciate gluten free option wife ravioli devoured said sauce delicious panini good need napkin large loaded one got personal pizza may try next time looked delicious specialty pizza look forward trying side salad good anywhere delicious dressing crisp lettuce nice addition mix may get larger version complete meal option next time
24297,Napolis Pizza Hoboken,love napoli pizza specialty pizza n't always eat pizza lot topping crave type go napoli crust crispy topping always fresh never order garlic knot incredible
24298,Napolis Pizza Hoboken,pizza joint easily top 3 pizza parlor visit traveling foodie say lot quite thing menu say time favorite buffalo margarita pizza combo seasoning use pizza need side note chicken parm slider winner
24303,Napolis Pizza Hoboken,cute place nice outdoor set indoor cozy ordered two personal pizza go though wow bad boy huge love watch pizza made brick oven back n't realize buy slice glad know option exist told order would take 20 minute took le yay personal ciao bello half olive oil half sauce bbq chicken pizza felt crust pizza tad doughy like favorite ny style thin light cripsy crust however ingredient fresh yummy fav bbq chicken pizza wow really ca n't believe personal pizza lol generous topping stuffed two slice plenty left ca n't wait come back sit outside
24304,Napolis Pizza Hoboken,great pizza quality service 8 0 pizza scale fresh ingredient clean restaurant
